[I 2026-07-30 09:21:18,285] A new study created in RDB with name: oulad_hybrid_vnext_outer0
[I 2026-07-30 09:24:31,156] Trial 0 finished with value: 0.7701596503025591 and parameters: {'loss_policy': 'weighted_bce', 'pos_weight_strategy': 'sqrt_ratio', 'learning_rate': 0.00015958237752949756, 'weight_decay': 5.40771222028812e-08, 'dropout': 0.11452090304204987, 'batch_size': 128, 'survival_weight': 0.15, 'outcome_weight': 0.2}. Best is trial 0 with value: 0.7701596503025591.
[I 2026-07-30 09:27:09,106] Trial 1 finished with value: 0.7715486179916939 and parameters: {'loss_policy': 'standard_bce', 'learning_rate': 0.00023927528765580657, 'weight_decay': 7.500295933641416e-06, 'dropout': 0.13487346516301046, 'batch_size': 256, 'survival_weight': 0.1, 'outcome_weight': 0.15}. Best is trial 1 with value: 0.7715486179916939.
[I 2026-07-30 09:30:35,777] Trial 2 finished with value: 0.7715518208895196 and parameters: {'loss_policy': 'weighted_bce', 'pos_weight_strategy': 'sqrt_ratio', 'learning_rate': 0.0002490643969382441, 'weight_decay': 2.877122371623784e-08, 'dropout': 0.2710582566280392, 'batch_size': 128, 'survival_weight': 0.15, 'outcome_weight': 0.0}. Best is trial 2 with value: 0.7715518208895196.
[I 2026-07-30 09:32:54,856] Trial 3 finished with value: 0.7706587509139156 and parameters: {'loss_policy': 'weighted_bce', 'pos_weight_strategy': 'full_ratio', 'learning_rate': 0.0014594768942966846, 'weight_decay': 6.449322077378624e-06, 'dropout': 0.3304685587557792, 'batch_size': 256, 'survival_weight': 0.15, 'outcome_weight': 0.0}. Best is trial 2 with value: 0.7715518208895196.
[I 2026-07-30 09:35:23,648] Trial 4 finished with value: 0.7683302618489387 and parameters: {'loss_policy': 'weighted_bce', 'pos_weight_strategy': 'full_ratio', 'learning_rate': 0.001010912598210831, 'weight_decay': 8.585370205937349e-08, 'dropout': 0.1013805292809006, 'batch_size': 128, 'survival_weight': 0.1, 'outcome_weight': 0.1}. Best is trial 2 with value: 0.7715518208895196.
[I 2026-07-30 09:37:57,707] Trial 5 finished with value: 0.7705531068744869 and parameters: {'loss_policy': 'weighted_bce', 'pos_weight_strategy': 'full_ratio', 'learning_rate': 0.0006752761235642021, 'weight_decay': 0.00014756591831687835, 'dropout': 0.21805373129048733, 'batch_size': 256, 'survival_weight': 0.15, 'outcome_weight': 0.0}. Best is trial 2 with value: 0.7715518208895196.
[I 2026-07-30 09:41:15,256] Trial 6 finished with value: 0.7710333982619655 and parameters: {'loss_policy': 'standard_bce', 'learning_rate': 0.00038507909734918576, 'weight_decay': 1.0850871665980976e-08, 'dropout': 0.33307258547794677, 'batch_size': 128, 'survival_weight': 0.2, 'outcome_weight': 0.0}. Best is trial 2 with value: 0.7715518208895196.
[I 2026-07-30 09:41:30,398] Trial 7 pruned. median pruner at inner=0, epoch=3
[I 2026-07-30 09:44:37,891] Trial 8 finished with value: 0.7702434690119302 and parameters: {'loss_policy': 'standard_bce', 'learning_rate': 0.00046876496895639536, 'weight_decay': 0.00047639290968453523, 'dropout': 0.24669460782634864, 'batch_size': 128, 'survival_weight': 0.2, 'outcome_weight': 0.1}. Best is trial 2 with value: 0.7715518208895196.
[I 2026-07-30 09:47:06,571] Trial 9 finished with value: 0.7697380681343754 and parameters: {'loss_policy': 'weighted_bce', 'pos_weight_strategy': 'sqrt_ratio', 'learning_rate': 0.0018355991287256864, 'weight_decay': 4.370703945596575e-07, 'dropout': 0.17353847416321416, 'batch_size': 128, 'survival_weight': 0.0, 'outcome_weight': 0.2}. Best is trial 2 with value: 0.7715518208895196.
[I 2026-07-30 09:47:16,460] Trial 10 pruned. median pruner at inner=0, epoch=3
[I 2026-07-30 09:47:26,106] Trial 11 pruned. median pruner at inner=0, epoch=3
[I 2026-07-30 09:47:35,815] Trial 12 pruned. median pruner at inner=0, epoch=3
[I 2026-07-30 09:47:45,620] Trial 13 pruned. median pruner at inner=0, epoch=3
[I 2026-07-30 09:48:00,493] Trial 14 pruned. median pruner at inner=0, epoch=3
[I 2026-07-30 09:48:10,166] Trial 15 pruned. median pruner at inner=0, epoch=3
[I 2026-07-30 09:48:25,400] Trial 16 pruned. median pruner at inner=0, epoch=3
[I 2026-07-30 09:50:50,330] Trial 17 finished with value: 0.7724213973376457 and parameters: {'loss_policy': 'standard_bce', 'learning_rate': 0.0003615581608890234, 'weight_decay': 3.338364265634958e-07, 'dropout': 0.20796444649991924, 'batch_size': 256, 'survival_weight': 0.0, 'outcome_weight': 0.2}. Best is trial 17 with value: 0.7724213973376457.
[I 2026-07-30 09:53:15,391] Trial 18 finished with value: 0.7728136963358219 and parameters: {'loss_policy': 'standard_bce', 'learning_rate': 0.0007317953675938456, 'weight_decay': 2.3764921073536587e-07, 'dropout': 0.2088959640359308, 'batch_size': 256, 'survival_weight': 0.0, 'outcome_weight': 0.2}. Best is trial 18 with value: 0.7728136963358219.
[I 2026-07-30 09:55:41,205] Trial 19 finished with value: 0.7725075055396939 and parameters: {'loss_policy': 'standard_bce', 'learning_rate': 0.0009025365658643437, 'weight_decay': 2.715628533166694e-07, 'dropout': 0.2008159482370649, 'batch_size': 256, 'survival_weight': 0.0, 'outcome_weight': 0.2}. Best is trial 18 with value: 0.7728136963358219.
[I 2026-07-30 09:58:06,701] Trial 20 finished with value: 0.7720648792477685 and parameters: {'loss_policy': 'standard_bce', 'learning_rate': 0.0008935322541134441, 'weight_decay': 1.7872153992979844e-07, 'dropout': 0.18556075430244678, 'batch_size': 256, 'survival_weight': 0.0, 'outcome_weight': 0.2}. Best is trial 18 with value: 0.7728136963358219.
[I 2026-07-30 10:00:32,170] Trial 21 finished with value: 0.7735010419769066 and parameters: {'loss_policy': 'standard_bce', 'learning_rate': 0.0009846381150668893, 'weight_decay': 3.921605024805581e-07, 'dropout': 0.2052982161871636, 'batch_size': 256, 'survival_weight': 0.0, 'outcome_weight': 0.2}. Best is trial 21 with value: 0.7735010419769066.
[I 2026-07-30 10:02:57,240] Trial 22 finished with value: 0.7737412269091039 and parameters: {'loss_policy': 'standard_bce', 'learning_rate': 0.0010721256270319098, 'weight_decay': 7.67233345263127e-07, 'dropout': 0.23021672602736568, 'batch_size': 256, 'survival_weight': 0.0, 'outcome_weight': 0.2}. Best is trial 22 with value: 0.7737412269091039.
[I 2026-07-30 10:05:24,723] Trial 23 finished with value: 0.7741135214243552 and parameters: {'loss_policy': 'standard_bce', 'learning_rate': 0.0011484568466276783, 'weight_decay': 1.3278646414039475e-06, 'dropout': 0.2368400954250437, 'batch_size': 256, 'survival_weight': 0.0, 'outcome_weight': 0.2}. Best is trial 23 with value: 0.7741135214243552.
[I 2026-07-30 10:05:25,021] A new study created in RDB with name: oulad_hybrid_vnext_outer1
[I 2026-07-30 10:09:17,275] Trial 0 finished with value: 0.7733709182622529 and parameters: {'loss_policy': 'weighted_bce', 'pos_weight_strategy': 'full_ratio', 'learning_rate': 0.00026645122691946755, 'weight_decay': 0.00010890838039103247, 'dropout': 0.2665225532745064, 'batch_size': 128, 'survival_weight': 0.15, 'outcome_weight': 0.1}. Best is trial 0 with value: 0.7733709182622529.
[I 2026-07-30 10:11:48,588] Trial 1 finished with value: 0.7754134513949855 and parameters: {'loss_policy': 'standard_bce', 'learning_rate': 0.0012504335577382512, 'weight_decay': 9.75303068867822e-05, 'dropout': 0.34286627285884697, 'batch_size': 256, 'survival_weight': 0.2, 'outcome_weight': 0.2}. Best is trial 1 with value: 0.7754134513949855.
[I 2026-07-30 10:14:22,423] Trial 2 finished with value: 0.7737591760293274 and parameters: {'loss_policy': 'weighted_bce', 'pos_weight_strategy': 'sqrt_ratio', 'learning_rate': 0.0015280460840299544, 'weight_decay': 2.938736473400422e-06, 'dropout': 0.12600473746369073, 'batch_size': 256, 'survival_weight': 0.1, 'outcome_weight': 0.1}. Best is trial 1 with value: 0.7754134513949855.
[I 2026-07-30 10:17:48,765] Trial 3 finished with value: 0.7737875801703078 and parameters: {'loss_policy': 'standard_bce', 'learning_rate': 0.00037934839205744727, 'weight_decay': 4.310616785786249e-06, 'dropout': 0.2028138722716588, 'batch_size': 128, 'survival_weight': 0.1, 'outcome_weight': 0.15}. Best is trial 1 with value: 0.7754134513949855.
[I 2026-07-30 10:20:34,742] Trial 4 finished with value: 0.7715924659251181 and parameters: {'loss_policy': 'standard_bce', 'learning_rate': 0.00015415964588779476, 'weight_decay': 7.910068805152904e-07, 'dropout': 0.17756738171114744, 'batch_size': 256, 'survival_weight': 0.1, 'outcome_weight': 0.1}. Best is trial 1 with value: 0.7754134513949855.
[I 2026-07-30 10:23:26,732] Trial 5 finished with value: 0.7714263614827095 and parameters: {'loss_policy': 'weighted_bce', 'pos_weight_strategy': 'full_ratio', 'learning_rate': 0.00010750882270234363, 'weight_decay': 1.8265431100965896e-06, 'dropout': 0.172855672418402, 'batch_size': 256, 'survival_weight': 0.2, 'outcome_weight': 0.0}. Best is trial 1 with value: 0.7754134513949855.
[I 2026-07-30 10:25:57,040] Trial 6 finished with value: 0.774676540326204 and parameters: {'loss_policy': 'standard_bce', 'learning_rate': 0.001991537895053252, 'weight_decay': 1.1203094059395492e-08, 'dropout': 0.34972445427935794, 'batch_size': 256, 'survival_weight': 0.0, 'outcome_weight': 0.2}. Best is trial 1 with value: 0.7754134513949855.
[I 2026-07-30 10:28:33,982] Trial 7 finished with value: 0.7750582202289746 and parameters: {'loss_policy': 'standard_bce', 'learning_rate': 0.0007802011870114969, 'weight_decay': 0.0003739271518434961, 'dropout': 0.3472890059793282, 'batch_size': 256, 'survival_weight': 0.2, 'outcome_weight': 0.2}. Best is trial 1 with value: 0.7754134513949855.
[I 2026-07-30 10:28:48,986] Trial 8 pruned. median pruner at inner=0, epoch=3
[I 2026-07-30 10:31:19,879] Trial 9 finished with value: 0.7760883075719854 and parameters: {'loss_policy': 'standard_bce', 'learning_rate': 0.000841852031423931, 'weight_decay': 3.091037668335632e-05, 'dropout': 0.10677901106107476, 'batch_size': 256, 'survival_weight': 0.15, 'outcome_weight': 0.0}. Best is trial 9 with value: 0.7760883075719854.
[I 2026-07-30 10:31:35,020] Trial 10 pruned. median pruner at inner=0, epoch=3
[I 2026-07-30 10:34:05,691] Trial 11 finished with value: 0.7761950835967121 and parameters: {'loss_policy': 'standard_bce', 'learning_rate': 0.001093003473301002, 'weight_decay': 3.477266416473616e-05, 'dropout': 0.2809052870797656, 'batch_size': 256, 'survival_weight': 0.15, 'outcome_weight': 0.0}. Best is trial 11 with value: 0.7761950835967121.
[I 2026-07-30 10:36:33,856] Trial 12 finished with value: 0.7769956269954124 and parameters: {'loss_policy': 'standard_bce', 'learning_rate': 0.0009342889927929933, 'weight_decay': 2.33364982516221e-05, 'dropout': 0.24970281620434753, 'batch_size': 256, 'survival_weight': 0.15, 'outcome_weight': 0.0}. Best is trial 12 with value: 0.7769956269954124.
[I 2026-07-30 10:39:04,650] Trial 13 finished with value: 0.776393512635024 and parameters: {'loss_policy': 'standard_bce', 'learning_rate': 0.0011889453324409008, 'weight_decay': 1.7467007776278984e-05, 'dropout': 0.2691076626757319, 'batch_size': 256, 'survival_weight': 0.15, 'outcome_weight': 0.0}. Best is trial 12 with value: 0.7769956269954124.
[I 2026-07-30 10:39:14,479] Trial 14 pruned. median pruner at inner=0, epoch=3
[I 2026-07-30 10:41:45,366] Trial 15 finished with value: 0.7749794394722803 and parameters: {'loss_policy': 'standard_bce', 'learning_rate': 0.001878434511454631, 'weight_decay': 2.0551587657950556e-07, 'dropout': 0.23849220189725764, 'batch_size': 256, 'survival_weight': 0.0, 'outcome_weight': 0.15}. Best is trial 12 with value: 0.7769956269954124.
[I 2026-07-30 10:41:58,410] Trial 16 pruned. median pruner at inner=0, epoch=4
[I 2026-07-30 10:42:08,110] Trial 17 pruned. median pruner at inner=0, epoch=3
[I 2026-07-30 10:42:23,002] Trial 18 pruned. median pruner at inner=0, epoch=3
[I 2026-07-30 10:42:35,806] Trial 19 pruned. median pruner at inner=0, epoch=4
[I 2026-07-30 10:42:48,419] Trial 20 pruned. median pruner at inner=0, epoch=4
[I 2026-07-30 10:45:23,657] Trial 21 finished with value: 0.776841839245102 and parameters: {'loss_policy': 'standard_bce', 'learning_rate': 0.001143065372544974, 'weight_decay': 2.9257929208511013e-05, 'dropout': 0.2750254055342143, 'batch_size': 256, 'survival_weight': 0.15, 'outcome_weight': 0.0}. Best is trial 12 with value: 0.7769956269954124.
[I 2026-07-30 10:45:33,774] Trial 22 pruned. median pruner at inner=0, epoch=3
[I 2026-07-30 10:48:05,952] Trial 23 finished with value: 0.7760476883933127 and parameters: {'loss_policy': 'standard_bce', 'learning_rate': 0.0013739339185376643, 'weight_decay': 5.158220542310749e-06, 'dropout': 0.2928550791398306, 'batch_size': 256, 'survival_weight': 0.15, 'outcome_weight': 0.0}. Best is trial 12 with value: 0.7769956269954124.
[I 2026-07-30 10:48:06,267] A new study created in RDB with name: oulad_hybrid_vnext_outer2
[I 2026-07-30 10:50:58,542] Trial 0 finished with value: 0.7717287780556804 and parameters: {'loss_policy': 'standard_bce', 'learning_rate': 0.000930678331656263, 'weight_decay': 4.94290901166847e-07, 'dropout': 0.189827709452018, 'batch_size': 128, 'survival_weight': 0.2, 'outcome_weight': 0.0}. Best is trial 0 with value: 0.7717287780556804.
[I 2026-07-30 10:54:01,168] Trial 1 finished with value: 0.7737116774340569 and parameters: {'loss_policy': 'standard_bce', 'learning_rate': 0.0014037179086758863, 'weight_decay': 1.0900937338739706e-05, 'dropout': 0.15345620303265214, 'batch_size': 128, 'survival_weight': 0.1, 'outcome_weight': 0.0}. Best is trial 1 with value: 0.7737116774340569.
[I 2026-07-30 10:57:54,275] Trial 2 finished with value: 0.7730173863997986 and parameters: {'loss_policy': 'standard_bce', 'learning_rate': 0.0001836656312251053, 'weight_decay': 1.376958500934898e-06, 'dropout': 0.2986437290570542, 'batch_size': 128, 'survival_weight': 0.2, 'outcome_weight': 0.1}. Best is trial 1 with value: 0.7737116774340569.
[I 2026-07-30 11:00:10,409] Trial 3 finished with value: 0.7718812933861866 and parameters: {'loss_policy': 'standard_bce', 'learning_rate': 0.0016221523733041955, 'weight_decay': 0.00013898047783742103, 'dropout': 0.12374299582411452, 'batch_size': 256, 'survival_weight': 0.15, 'outcome_weight': 0.0}. Best is trial 1 with value: 0.7737116774340569.
[I 2026-07-30 11:03:41,074] Trial 4 finished with value: 0.7678333630664214 and parameters: {'loss_policy': 'weighted_bce', 'pos_weight_strategy': 'full_ratio', 'learning_rate': 0.00013303570113686907, 'weight_decay': 5.619171218758774e-05, 'dropout': 0.167164092619482, 'batch_size': 128, 'survival_weight': 0.1, 'outcome_weight': 0.2}. Best is trial 1 with value: 0.7737116774340569.
[I 2026-07-30 11:06:33,482] Trial 5 finished with value: 0.7685142469273398 and parameters: {'loss_policy': 'weighted_bce', 'pos_weight_strategy': 'full_ratio', 'learning_rate': 0.00013856815215562162, 'weight_decay': 2.0872637901166763e-06, 'dropout': 0.3166877590180437, 'batch_size': 256, 'survival_weight': 0.1, 'outcome_weight': 0.2}. Best is trial 1 with value: 0.7737116774340569.
[I 2026-07-30 11:09:41,176] Trial 6 finished with value: 0.7731911258314277 and parameters: {'loss_policy': 'standard_bce', 'learning_rate': 0.0004464797901424197, 'weight_decay': 5.263132033797694e-08, 'dropout': 0.22724958679266996, 'batch_size': 128, 'survival_weight': 0.0, 'outcome_weight': 0.15}. Best is trial 1 with value: 0.7737116774340569.
[I 2026-07-30 11:12:42,582] Trial 7 finished with value: 0.772631733905118 and parameters: {'loss_policy': 'standard_bce', 'learning_rate': 0.00039635962828350453, 'weight_decay': 2.5828126690572673e-08, 'dropout': 0.10427285756229092, 'batch_size': 128, 'survival_weight': 0.1, 'outcome_weight': 0.0}. Best is trial 1 with value: 0.7737116774340569.
[I 2026-07-30 11:12:52,471] Trial 8 pruned. median pruner at inner=0, epoch=3
[I 2026-07-30 11:13:07,604] Trial 9 pruned. median pruner at inner=0, epoch=3
[I 2026-07-30 11:13:17,204] Trial 10 pruned. median pruner at inner=0, epoch=3
[I 2026-07-30 11:13:32,212] Trial 11 pruned. median pruner at inner=0, epoch=3
[I 2026-07-30 11:16:32,703] Trial 12 finished with value: 0.7714286722947462 and parameters: {'loss_policy': 'standard_bce', 'learning_rate': 0.0009107812835563272, 'weight_decay': 2.1330384068490406e-07, 'dropout': 0.2251724288511031, 'batch_size': 128, 'survival_weight': 0.0, 'outcome_weight': 0.15}. Best is trial 1 with value: 0.7737116774340569.
[I 2026-07-30 11:16:47,858] Trial 13 pruned. median pruner at inner=0, epoch=3
[I 2026-07-30 11:17:02,918] Trial 14 pruned. median pruner at inner=0, epoch=3
[I 2026-07-30 11:20:00,299] Trial 15 finished with value: 0.7752430053751549 and parameters: {'loss_policy': 'standard_bce', 'learning_rate': 0.001427490474468405, 'weight_decay': 1.0731619628337453e-07, 'dropout': 0.14788186212273952, 'batch_size': 128, 'survival_weight': 0.0, 'outcome_weight': 0.15}. Best is trial 15 with value: 0.7752430053751549.
[I 2026-07-30 11:21:03,547] Trial 16 pruned. median pruner at inner=1, epoch=5
[I 2026-07-30 11:23:41,345] Trial 17 finished with value: 0.7748484148813133 and parameters: {'loss_policy': 'standard_bce', 'learning_rate': 0.001293593328467811, 'weight_decay': 2.8890229546667654e-05, 'dropout': 0.18293171731594482, 'batch_size': 128, 'survival_weight': 0.2, 'outcome_weight': 0.2}. Best is trial 15 with value: 0.7752430053751549.
[I 2026-07-30 11:23:51,110] Trial 18 pruned. median pruner at inner=0, epoch=3
[I 2026-07-30 11:24:54,892] Trial 19 pruned. median pruner at inner=1, epoch=2
[I 2026-07-30 11:27:56,357] Trial 20 finished with value: 0.7732763866478151 and parameters: {'loss_policy': 'standard_bce', 'learning_rate': 0.0019167538644820734, 'weight_decay': 3.5262609659301506e-05, 'dropout': 0.12736142808137493, 'batch_size': 128, 'survival_weight': 0.2, 'outcome_weight': 0.2}. Best is trial 15 with value: 0.7752430053751549.
[I 2026-07-30 11:30:43,994] Trial 21 finished with value: 0.7728100026334591 and parameters: {'loss_policy': 'standard_bce', 'learning_rate': 0.0012752309090235537, 'weight_decay': 1.0095621896954013e-05, 'dropout': 0.1531041667272445, 'batch_size': 128, 'survival_weight': 0.0, 'outcome_weight': 0.2}. Best is trial 15 with value: 0.7752430053751549.
[I 2026-07-30 11:33:30,941] Trial 22 finished with value: 0.7741429902604916 and parameters: {'loss_policy': 'standard_bce', 'learning_rate': 0.0011604397440940998, 'weight_decay': 3.0387755459920524e-05, 'dropout': 0.10013895727746358, 'batch_size': 128, 'survival_weight': 0.2, 'outcome_weight': 0.15}. Best is trial 15 with value: 0.7752430053751549.
[I 2026-07-30 11:36:18,820] Trial 23 finished with value: 0.7740361983653019 and parameters: {'loss_policy': 'standard_bce', 'learning_rate': 0.0010510259325541243, 'weight_decay': 3.048554082169976e-05, 'dropout': 0.10223093036072349, 'batch_size': 128, 'survival_weight': 0.2, 'outcome_weight': 0.15}. Best is trial 15 with value: 0.7752430053751549.
