[I 2026-06-12 19:44:10,259] Trial 4 finished with value: 0.44941783466538565 and parameters: {'learning_rate': 0.00026784643998754837, 'weight_decay': 2.5307853963570713e-06, 'batch_size': 64, 'oversample_method': 'smote', 'smote_ratio': 0.4279056645066991, 'cnn_channels': 16, 'lstm_hidden_dim': 32, 'context_hidden_dim': 32, 'fusion_hidden_dim': 128, 'dropout': 0.27632286474453926}. Best is trial 0 with value: 0.8167954911682335.
2026-06-12 19:44:10,259 - preprocessing - INFO - Student engineered features created: ['grade_growth', 'grade_avg', 'absence_study_ratio', 'failure_risk', 'alcohol_risk', 'social_risk']
2026-06-12 19:44:10,259 - preprocessing - INFO - Student engineered features created: ['grade_growth', 'grade_avg', 'absence_study_ratio', 'failure_risk', 'alcohol_risk', 'social_risk']
2026-06-12 19:44:10,320 - preprocessing - INFO - Applying SMOTE on train set with ratio 0.5338968072778392...
2026-06-12 19:44:10,525 - preprocessing - INFO - Feature selection complete. Selected 32 / 38 features.
2026-06-12 19:44:15,242 - train_pipeline - INFO - Early stopping triggered at epoch 33
2026-06-12 19:44:15,245 - preprocessing - INFO - Student engineered features created: ['grade_growth', 'grade_avg', 'absence_study_ratio', 'failure_risk', 'alcohol_risk', 'social_risk']
2026-06-12 19:44:15,245 - preprocessing - INFO - Student engineered features created: ['grade_growth', 'grade_avg', 'absence_study_ratio', 'failure_risk', 'alcohol_risk', 'social_risk']
2026-06-12 19:44:15,287 - preprocessing - INFO - Applying SMOTE on train set with ratio 0.5338968072778392...
2026-06-12 19:44:15,502 - preprocessing - INFO - Feature selection complete. Selected 35 / 38 features.
2026-06-12 19:44:21,281 - train_pipeline - INFO - Early stopping triggered at epoch 40
2026-06-12 19:44:21,288 - preprocessing - INFO - Student engineered features created: ['grade_growth', 'grade_avg', 'absence_study_ratio', 'failure_risk', 'alcohol_risk', 'social_risk']
2026-06-12 19:44:21,288 - preprocessing - INFO - Student engineered features created: ['grade_growth', 'grade_avg', 'absence_study_ratio', 'failure_risk', 'alcohol_risk', 'social_risk']
2026-06-12 19:44:21,329 - preprocessing - INFO - Applying SMOTE on train set with ratio 0.5338968072778392...
2026-06-12 19:44:21,539 - preprocessing - INFO - Feature selection complete. Selected 31 / 38 features.
2026-06-12 19:44:24,021 - train_pipeline - INFO - Early stopping triggered at epoch 17
2026-06-12 19:44:24,022 - preprocessing - INFO - Student engineered features created: ['grade_growth', 'grade_avg', 'absence_study_ratio', 'failure_risk', 'alcohol_risk', 'social_risk']
2026-06-12 19:44:24,022 - preprocessing - INFO - Student engineered features created: ['grade_growth', 'grade_avg', 'absence_study_ratio', 'failure_risk', 'alcohol_risk', 'social_risk']
2026-06-12 19:44:24,071 - preprocessing - INFO - Applying SMOTE on train set with ratio 0.5338968072778392...
2026-06-12 19:44:24,387 - preprocessing - INFO - Feature selection complete. Selected 35 / 38 features.
2026-06-12 19:44:27,178 - train_pipeline - INFO - Early stopping triggered at epoch 19
2026-06-12 19:44:27,193 - preprocessing - INFO - Student engineered features created: ['grade_growth', 'grade_avg', 'absence_study_ratio', 'failure_risk', 'alcohol_risk', 'social_risk']
2026-06-12 19:44:27,193 - preprocessing - INFO - Student engineered features created: ['grade_growth', 'grade_avg', 'absence_study_ratio', 'failure_risk', 'alcohol_risk', 'social_risk']
2026-06-12 19:44:27,233 - preprocessing - INFO - Applying SMOTE on train set with ratio 0.5338968072778392...
2026-06-12 19:44:27,435 - preprocessing - INFO - Feature selection complete. Selected 31 / 38 features.
2026-06-12 19:44:30,343 - train_pipeline - INFO - Early stopping triggered at epoch 20
[I 2026-06-12 19:44:30,345] Trial 5 finished with value: 0.8461679206816806 and parameters: {'learning_rate': 0.003994506372590677, 'weight_decay': 1.1606141613720694e-05, 'batch_size': 32, 'oversample_method': 'smote', 'smote_ratio': 0.5338968072778392, 'cnn_channels': 64, 'lstm_hidden_dim': 32, 'context_hidden_dim': 128, 'fusion_hidden_dim': 64, 'dropout': 0.47692482158247906}. Best is trial 5 with value: 0.8461679206816806.
2026-06-12 19:44:30,351 - preprocessing - INFO - Student engineered features created: ['grade_growth', 'grade_avg', 'absence_study_ratio', 'failure_risk', 'alcohol_risk', 'social_risk']
2026-06-12 19:44:30,353 - preprocessing - INFO - Student engineered features created: ['grade_growth', 'grade_avg', 'absence_study_ratio', 'failure_risk', 'alcohol_risk', 'social_risk']
2026-06-12 19:44:30,404 - preprocessing - INFO - Applying SMOTE on train set with ratio 0.41494190444958456...
2026-06-12 19:44:30,626 - preprocessing - INFO - Feature selection complete. Selected 30 / 38 features.
2026-06-12 19:44:37,200 - preprocessing - INFO - Student engineered features created: ['grade_growth', 'grade_avg', 'absence_study_ratio', 'failure_risk', 'alcohol_risk', 'social_risk']
2026-06-12 19:44:37,200 - preprocessing - INFO - Student engineered features created: ['grade_growth', 'grade_avg', 'absence_study_ratio', 'failure_risk', 'alcohol_risk', 'social_risk']
2026-06-12 19:44:37,251 - preprocessing - INFO - Applying SMOTE on train set with ratio 0.41494190444958456...
2026-06-12 19:44:37,459 - preprocessing - INFO - Feature selection complete. Selected 32 / 38 features.
2026-06-12 19:44:40,991 - train_pipeline - INFO - Early stopping triggered at epoch 28
2026-06-12 19:44:40,991 - preprocessing - INFO - Student engineered features created: ['grade_growth', 'grade_avg', 'absence_study_ratio', 'failure_risk', 'alcohol_risk', 'social_risk']
2026-06-12 19:44:40,998 - preprocessing - INFO - Student engineered features created: ['grade_growth', 'grade_avg', 'absence_study_ratio', 'failure_risk', 'alcohol_risk', 'social_risk']
2026-06-12 19:44:41,039 - preprocessing - INFO - Applying SMOTE on train set with ratio 0.41494190444958456...
2026-06-12 19:44:41,251 - preprocessing - INFO - Feature selection complete. Selected 25 / 38 features.
2026-06-12 19:44:45,707 - train_pipeline - INFO - Early stopping triggered at epoch 36
2026-06-12 19:44:45,707 - preprocessing - INFO - Student engineered features created: ['grade_growth', 'grade_avg', 'absence_study_ratio', 'failure_risk', 'alcohol_risk', 'social_risk']
2026-06-12 19:44:45,707 - preprocessing - INFO - Student engineered features created: ['grade_growth', 'grade_avg', 'absence_study_ratio', 'failure_risk', 'alcohol_risk', 'social_risk']
2026-06-12 19:44:45,764 - preprocessing - INFO - Applying SMOTE on train set with ratio 0.41494190444958456...
2026-06-12 19:44:45,981 - preprocessing - INFO - Feature selection complete. Selected 34 / 38 features.
2026-06-12 19:44:51,334 - train_pipeline - INFO - Early stopping triggered at epoch 42
2026-06-12 19:44:51,350 - preprocessing - INFO - Student engineered features created: ['grade_growth', 'grade_avg', 'absence_study_ratio', 'failure_risk', 'alcohol_risk', 'social_risk']
2026-06-12 19:44:51,350 - preprocessing - INFO - Student engineered features created: ['grade_growth', 'grade_avg', 'absence_study_ratio', 'failure_risk', 'alcohol_risk', 'social_risk']
2026-06-12 19:44:51,398 - preprocessing - INFO - Applying SMOTE on train set with ratio 0.41494190444958456...
2026-06-12 19:44:51,622 - preprocessing - INFO - Feature selection complete. Selected 28 / 38 features.
2026-06-12 19:44:55,412 - train_pipeline - INFO - Early stopping triggered at epoch 30
[I 2026-06-12 19:44:55,412] Trial 6 finished with value: 0.8458073798411544 and parameters: {'learning_rate': 0.0016363473769737383, 'weight_decay': 0.00034456576406549514, 'batch_size': 32, 'oversample_method': 'smote', 'smote_ratio': 0.41494190444958456, 'cnn_channels': 64, 'lstm_hidden_dim': 32, 'context_hidden_dim': 64, 'fusion_hidden_dim': 64, 'dropout': 0.49138126566222906}. Best is trial 5 with value: 0.8461679206816806.
2026-06-12 19:44:55,420 - preprocessing - INFO - Student engineered features created: ['grade_growth', 'grade_avg', 'absence_study_ratio', 'failure_risk', 'alcohol_risk', 'social_risk']
2026-06-12 19:44:55,420 - preprocessing - INFO - Student engineered features created: ['grade_growth', 'grade_avg', 'absence_study_ratio', 'failure_risk', 'alcohol_risk', 'social_risk']
2026-06-12 19:44:55,467 - preprocessing - INFO - Applying ADASYN on train set with ratio 0.8265683453852869...
2026-06-12 19:44:55,692 - preprocessing - INFO - Feature selection complete. Selected 36 / 38 features.
2026-06-12 19:45:08,006 - train_pipeline - INFO - Early stopping triggered at epoch 38
2026-06-12 19:45:08,006 - preprocessing - INFO - Student engineered features created: ['grade_growth', 'grade_avg', 'absence_study_ratio', 'failure_risk', 'alcohol_risk', 'social_risk']
2026-06-12 19:45:08,013 - preprocessing - INFO - Student engineered features created: ['grade_growth', 'grade_avg', 'absence_study_ratio', 'failure_risk', 'alcohol_risk', 'social_risk']
2026-06-12 19:45:08,060 - preprocessing - INFO - Applying ADASYN on train set with ratio 0.8265683453852869...
2026-06-12 19:45:08,272 - preprocessing - INFO - Feature selection complete. Selected 34 / 38 features.
2026-06-12 19:45:24,511 - train_pipeline - INFO - Early stopping triggered at epoch 49
2026-06-12 19:45:24,511 - preprocessing - INFO - Student engineered features created: ['grade_growth', 'grade_avg', 'absence_study_ratio', 'failure_risk', 'alcohol_risk', 'social_risk']
2026-06-12 19:45:24,511 - preprocessing - INFO - Student engineered features created: ['grade_growth', 'grade_avg', 'absence_study_ratio', 'failure_risk', 'alcohol_risk', 'social_risk']
2026-06-12 19:45:24,566 - preprocessing - INFO - Applying ADASYN on train set with ratio 0.8265683453852869...
2026-06-12 19:45:24,794 - preprocessing - INFO - Feature selection complete. Selected 35 / 38 features.
2026-06-12 19:45:41,765 - preprocessing - INFO - Student engineered features created: ['grade_growth', 'grade_avg', 'absence_study_ratio', 'failure_risk', 'alcohol_risk', 'social_risk']
2026-06-12 19:45:41,765 - preprocessing - INFO - Student engineered features created: ['grade_growth', 'grade_avg', 'absence_study_ratio', 'failure_risk', 'alcohol_risk', 'social_risk']
2026-06-12 19:45:41,818 - preprocessing - INFO - Applying ADASYN on train set with ratio 0.8265683453852869...
2026-06-12 19:45:42,068 - preprocessing - INFO - Feature selection complete. Selected 37 / 38 features.
2026-06-12 19:45:59,044 - preprocessing - INFO - Student engineered features created: ['grade_growth', 'grade_avg', 'absence_study_ratio', 'failure_risk', 'alcohol_risk', 'social_risk']
2026-06-12 19:45:59,051 - preprocessing - INFO - Student engineered features created: ['grade_growth', 'grade_avg', 'absence_study_ratio', 'failure_risk', 'alcohol_risk', 'social_risk']
2026-06-12 19:45:59,099 - preprocessing - INFO - Applying ADASYN on train set with ratio 0.8265683453852869...
2026-06-12 19:45:59,325 - preprocessing - INFO - Feature selection complete. Selected 37 / 38 features.
2026-06-12 19:46:17,463 - train_pipeline - INFO - Early stopping triggered at epoch 50
[I 2026-06-12 19:46:17,463] Trial 7 finished with value: 0.7865536235250772 and parameters: {'learning_rate': 0.0002822253410051973, 'weight_decay': 3.3427823633873868e-06, 'batch_size': 16, 'oversample_method': 'adasyn', 'smote_ratio': 0.8265683453852869, 'cnn_channels': 32, 'lstm_hidden_dim': 64, 'context_hidden_dim': 128, 'fusion_hidden_dim': 64, 'dropout': 0.37096058091309914}. Best is trial 5 with value: 0.8461679206816806.
2026-06-12 19:46:17,479 - preprocessing - INFO - Student engineered features created: ['grade_growth', 'grade_avg', 'absence_study_ratio', 'failure_risk', 'alcohol_risk', 'social_risk']
2026-06-12 19:46:17,479 - preprocessing - INFO - Student engineered features created: ['grade_growth', 'grade_avg', 'absence_study_ratio', 'failure_risk', 'alcohol_risk', 'social_risk']
2026-06-12 19:46:17,532 - preprocessing - INFO - Applying SMOTE on train set with ratio 0.6557477798061133...
2026-06-12 19:46:17,750 - preprocessing - INFO - Feature selection complete. Selected 32 / 38 features.
2026-06-12 19:46:26,010 - preprocessing - INFO - Student engineered features created: ['grade_growth', 'grade_avg', 'absence_study_ratio', 'failure_risk', 'alcohol_risk', 'social_risk']
2026-06-12 19:46:26,013 - preprocessing - INFO - Student engineered features created: ['grade_growth', 'grade_avg', 'absence_study_ratio', 'failure_risk', 'alcohol_risk', 'social_risk']
2026-06-12 19:46:26,058 - preprocessing - INFO - Applying SMOTE on train set with ratio 0.6557477798061133...
2026-06-12 19:46:26,268 - preprocessing - INFO - Feature selection complete. Selected 34 / 38 features.
2026-06-12 19:46:33,128 - train_pipeline - INFO - Early stopping triggered at epoch 41
2026-06-12 19:46:33,135 - preprocessing - INFO - Student engineered features created: ['grade_growth', 'grade_avg', 'absence_study_ratio', 'failure_risk', 'alcohol_risk', 'social_risk']
2026-06-12 19:46:33,140 - preprocessing - INFO - Student engineered features created: ['grade_growth', 'grade_avg', 'absence_study_ratio', 'failure_risk', 'alcohol_risk', 'social_risk']
2026-06-12 19:46:33,183 - preprocessing - INFO - Applying SMOTE on train set with ratio 0.6557477798061133...
2026-06-12 19:46:33,405 - preprocessing - INFO - Feature selection complete. Selected 33 / 38 features.
2026-06-12 19:46:41,730 - preprocessing - INFO - Student engineered features created: ['grade_growth', 'grade_avg', 'absence_study_ratio', 'failure_risk', 'alcohol_risk', 'social_risk']
2026-06-12 19:46:41,730 - preprocessing - INFO - Student engineered features created: ['grade_growth', 'grade_avg', 'absence_study_ratio', 'failure_risk', 'alcohol_risk', 'social_risk']
2026-06-12 19:46:41,786 - preprocessing - INFO - Applying SMOTE on train set with ratio 0.6557477798061133...
2026-06-12 19:46:41,995 - preprocessing - INFO - Feature selection complete. Selected 35 / 38 features.
2026-06-12 19:46:47,058 - train_pipeline - INFO - Early stopping triggered at epoch 31
2026-06-12 19:46:47,065 - preprocessing - INFO - Student engineered features created: ['grade_growth', 'grade_avg', 'absence_study_ratio', 'failure_risk', 'alcohol_risk', 'social_risk']
2026-06-12 19:46:47,069 - preprocessing - INFO - Student engineered features created: ['grade_growth', 'grade_avg', 'absence_study_ratio', 'failure_risk', 'alcohol_risk', 'social_risk']
2026-06-12 19:46:47,114 - preprocessing - INFO - Applying SMOTE on train set with ratio 0.6557477798061133...
2026-06-12 19:46:47,315 - preprocessing - INFO - Feature selection complete. Selected 31 / 38 features.
2026-06-12 19:46:52,714 - train_pipeline - INFO - Early stopping triggered at epoch 33
[I 2026-06-12 19:46:52,714] Trial 8 finished with value: 0.8213639604448855 and parameters: {'learning_rate': 0.00207480337305627, 'weight_decay': 0.0001639005102441387, 'batch_size': 32, 'oversample_method': 'smote', 'smote_ratio': 0.6557477798061133, 'cnn_channels': 16, 'lstm_hidden_dim': 64, 'context_hidden_dim': 128, 'fusion_hidden_dim': 64, 'dropout': 0.25503098033203586}. Best is trial 5 with value: 0.8461679206816806.
2026-06-12 19:46:52,719 - preprocessing - INFO - Student engineered features created: ['grade_growth', 'grade_avg', 'absence_study_ratio', 'failure_risk', 'alcohol_risk', 'social_risk']
2026-06-12 19:46:52,725 - preprocessing - INFO - Student engineered features created: ['grade_growth', 'grade_avg', 'absence_study_ratio', 'failure_risk', 'alcohol_risk', 'social_risk']
2026-06-12 19:46:52,771 - preprocessing - INFO - Applying SMOTE on train set with ratio 0.5251316305862751...
2026-06-12 19:46:53,004 - preprocessing - INFO - Feature selection complete. Selected 33 / 38 features.
2026-06-12 19:46:57,036 - preprocessing - INFO - Student engineered features created: ['grade_growth', 'grade_avg', 'absence_study_ratio', 'failure_risk', 'alcohol_risk', 'social_risk']
2026-06-12 19:46:57,036 - preprocessing - INFO - Student engineered features created: ['grade_growth', 'grade_avg', 'absence_study_ratio', 'failure_risk', 'alcohol_risk', 'social_risk']
2026-06-12 19:46:57,083 - preprocessing - INFO - Applying SMOTE on train set with ratio 0.5251316305862751...
2026-06-12 19:46:57,317 - preprocessing - INFO - Feature selection complete. Selected 33 / 38 features.
2026-06-12 19:46:59,677 - train_pipeline - INFO - Early stopping triggered at epoch 29
2026-06-12 19:46:59,693 - preprocessing - INFO - Student engineered features created: ['grade_growth', 'grade_avg', 'absence_study_ratio', 'failure_risk', 'alcohol_risk', 'social_risk']
2026-06-12 19:46:59,698 - preprocessing - INFO - Student engineered features created: ['grade_growth', 'grade_avg', 'absence_study_ratio', 'failure_risk', 'alcohol_risk', 'social_risk']
2026-06-12 19:46:59,747 - preprocessing - INFO - Applying SMOTE on train set with ratio 0.5251316305862751...
2026-06-12 19:46:59,966 - preprocessing - INFO - Feature selection complete. Selected 31 / 38 features.
2026-06-12 19:47:03,653 - train_pipeline - INFO - Early stopping triggered at epoch 45
2026-06-12 19:47:03,653 - preprocessing - INFO - Student engineered features created: ['grade_growth', 'grade_avg', 'absence_study_ratio', 'failure_risk', 'alcohol_risk', 'social_risk']
2026-06-12 19:47:03,659 - preprocessing - INFO - Student engineered features created: ['grade_growth', 'grade_avg', 'absence_study_ratio', 'failure_risk', 'alcohol_risk', 'social_risk']
2026-06-12 19:47:03,708 - preprocessing - INFO - Applying SMOTE on train set with ratio 0.5251316305862751...
2026-06-12 19:47:03,925 - preprocessing - INFO - Feature selection complete. Selected 35 / 38 features.
2026-06-12 19:47:08,030 - preprocessing - INFO - Student engineered features created: ['grade_growth', 'grade_avg', 'absence_study_ratio', 'failure_risk', 'alcohol_risk', 'social_risk']
2026-06-12 19:47:08,037 - preprocessing - INFO - Student engineered features created: ['grade_growth', 'grade_avg', 'absence_study_ratio', 'failure_risk', 'alcohol_risk', 'social_risk']
2026-06-12 19:47:08,084 - preprocessing - INFO - Applying SMOTE on train set with ratio 0.5251316305862751...
2026-06-12 19:47:08,301 - preprocessing - INFO - Feature selection complete. Selected 31 / 38 features.
