[I 2026-06-12 20:31:46,291] Trial 42 finished with value: 0.7891570123959697 and parameters: {'learning_rate': 0.007944527516444979, 'weight_decay': 0.0006163337671612608, 'batch_size': 16, 'oversample_method': 'adasyn', 'smote_ratio': 0.6608610911070035, 'cnn_channels': 16, 'lstm_hidden_dim': 64, 'context_hidden_dim': 128, 'fusion_hidden_dim': 128, 'dropout': 0.31719153372401027}. Best is trial 23 with value: 0.8021730167770063.
2026-06-12 20:31:46,305 - preprocessing - INFO - xAPI engineered features created: ['engagement_score', 'absence_risk', 'parent_support_signal']
2026-06-12 20:31:46,305 - preprocessing - INFO - xAPI engineered features created: ['engagement_score', 'absence_risk', 'parent_support_signal']
2026-06-12 20:31:46,326 - preprocessing - INFO - Applying ADASYN on train set with ratio 0.7249725903291167...
2026-06-12 20:31:46,333 - preprocessing - WARNING - ADASYN failed (likely too few samples). Error: No samples will be generated with the provided ratio settings.. Falling back to no oversampling.
2026-06-12 20:31:46,473 - preprocessing - INFO - Feature selection complete. Selected 15 / 19 features.
2026-06-12 20:31:51,737 - train_pipeline - INFO - Early stopping triggered at epoch 34
2026-06-12 20:31:51,744 - preprocessing - INFO - xAPI engineered features created: ['engagement_score', 'absence_risk', 'parent_support_signal']
2026-06-12 20:31:51,744 - preprocessing - INFO - xAPI engineered features created: ['engagement_score', 'absence_risk', 'parent_support_signal']
2026-06-12 20:31:51,765 - preprocessing - INFO - Applying ADASYN on train set with ratio 0.7249725903291167...
2026-06-12 20:31:51,772 - preprocessing - WARNING - ADASYN failed (likely too few samples). Error: No samples will be generated with the provided ratio settings.. Falling back to no oversampling.
2026-06-12 20:31:51,896 - preprocessing - INFO - Feature selection complete. Selected 16 / 19 features.
2026-06-12 20:31:58,768 - train_pipeline - INFO - Early stopping triggered at epoch 44
2026-06-12 20:31:58,772 - preprocessing - INFO - xAPI engineered features created: ['engagement_score', 'absence_risk', 'parent_support_signal']
2026-06-12 20:31:58,772 - preprocessing - INFO - xAPI engineered features created: ['engagement_score', 'absence_risk', 'parent_support_signal']
2026-06-12 20:31:58,793 - preprocessing - INFO - Applying ADASYN on train set with ratio 0.7249725903291167...
2026-06-12 20:31:58,800 - preprocessing - WARNING - ADASYN failed (likely too few samples). Error: No samples will be generated with the provided ratio settings.. Falling back to no oversampling.
2026-06-12 20:31:58,932 - preprocessing - INFO - Feature selection complete. Selected 18 / 19 features.
2026-06-12 20:32:02,691 - train_pipeline - INFO - Early stopping triggered at epoch 24
2026-06-12 20:32:02,691 - preprocessing - INFO - xAPI engineered features created: ['engagement_score', 'absence_risk', 'parent_support_signal']
2026-06-12 20:32:02,699 - preprocessing - INFO - xAPI engineered features created: ['engagement_score', 'absence_risk', 'parent_support_signal']
2026-06-12 20:32:02,712 - preprocessing - INFO - Applying ADASYN on train set with ratio 0.7249725903291167...
2026-06-12 20:32:02,719 - preprocessing - WARNING - ADASYN failed (likely too few samples). Error: No samples will be generated with the provided ratio settings.. Falling back to no oversampling.
2026-06-12 20:32:02,858 - preprocessing - INFO - Feature selection complete. Selected 16 / 19 features.
2026-06-12 20:32:07,118 - train_pipeline - INFO - Early stopping triggered at epoch 27
2026-06-12 20:32:07,125 - preprocessing - INFO - xAPI engineered features created: ['engagement_score', 'absence_risk', 'parent_support_signal']
2026-06-12 20:32:07,125 - preprocessing - INFO - xAPI engineered features created: ['engagement_score', 'absence_risk', 'parent_support_signal']
2026-06-12 20:32:07,145 - preprocessing - INFO - Applying ADASYN on train set with ratio 0.7249725903291167...
2026-06-12 20:32:07,159 - preprocessing - WARNING - ADASYN failed (likely too few samples). Error: No samples will be generated with the provided ratio settings.. Falling back to no oversampling.
2026-06-12 20:32:07,291 - preprocessing - INFO - Feature selection complete. Selected 18 / 19 features.
2026-06-12 20:32:11,109 - train_pipeline - INFO - Early stopping triggered at epoch 24
[I 2026-06-12 20:32:11,111] Trial 43 finished with value: 0.7928785769221312 and parameters: {'learning_rate': 0.005575354260954005, 'weight_decay': 0.00017077056166743058, 'batch_size': 16, 'oversample_method': 'adasyn', 'smote_ratio': 0.7249725903291167, 'cnn_channels': 16, 'lstm_hidden_dim': 64, 'context_hidden_dim': 128, 'fusion_hidden_dim': 128, 'dropout': 0.24119170637113696}. Best is trial 23 with value: 0.8021730167770063.
2026-06-12 20:32:11,121 - preprocessing - INFO - xAPI engineered features created: ['engagement_score', 'absence_risk', 'parent_support_signal']
2026-06-12 20:32:11,128 - preprocessing - INFO - xAPI engineered features created: ['engagement_score', 'absence_risk', 'parent_support_signal']
2026-06-12 20:32:11,149 - preprocessing - INFO - Applying ADASYN on train set with ratio 0.6951374353246801...
2026-06-12 20:32:11,162 - preprocessing - WARNING - ADASYN failed (likely too few samples). Error: No samples will be generated with the provided ratio settings.. Falling back to no oversampling.
2026-06-12 20:32:11,315 - preprocessing - INFO - Feature selection complete. Selected 15 / 19 features.
2026-06-12 20:32:16,032 - train_pipeline - INFO - Early stopping triggered at epoch 27
2026-06-12 20:32:16,032 - preprocessing - INFO - xAPI engineered features created: ['engagement_score', 'absence_risk', 'parent_support_signal']
2026-06-12 20:32:16,039 - preprocessing - INFO - xAPI engineered features created: ['engagement_score', 'absence_risk', 'parent_support_signal']
2026-06-12 20:32:16,060 - preprocessing - INFO - Applying ADASYN on train set with ratio 0.6951374353246801...
2026-06-12 20:32:16,067 - preprocessing - WARNING - ADASYN failed (likely too few samples). Error: No samples will be generated with the provided ratio settings.. Falling back to no oversampling.
2026-06-12 20:32:16,199 - preprocessing - INFO - Feature selection complete. Selected 16 / 19 features.
2026-06-12 20:32:19,327 - train_pipeline - INFO - Early stopping triggered at epoch 19
2026-06-12 20:32:19,334 - preprocessing - INFO - xAPI engineered features created: ['engagement_score', 'absence_risk', 'parent_support_signal']
2026-06-12 20:32:19,334 - preprocessing - INFO - xAPI engineered features created: ['engagement_score', 'absence_risk', 'parent_support_signal']
2026-06-12 20:32:19,355 - preprocessing - INFO - Applying ADASYN on train set with ratio 0.6951374353246801...
2026-06-12 20:32:19,362 - preprocessing - WARNING - ADASYN failed (likely too few samples). Error: No samples will be generated with the provided ratio settings.. Falling back to no oversampling.
2026-06-12 20:32:19,501 - preprocessing - INFO - Feature selection complete. Selected 18 / 19 features.
2026-06-12 20:32:23,934 - train_pipeline - INFO - Early stopping triggered at epoch 27
2026-06-12 20:32:23,934 - preprocessing - INFO - xAPI engineered features created: ['engagement_score', 'absence_risk', 'parent_support_signal']
2026-06-12 20:32:23,941 - preprocessing - INFO - xAPI engineered features created: ['engagement_score', 'absence_risk', 'parent_support_signal']
2026-06-12 20:32:23,961 - preprocessing - INFO - Applying ADASYN on train set with ratio 0.6951374353246801...
2026-06-12 20:32:23,969 - preprocessing - WARNING - ADASYN failed (likely too few samples). Error: No samples will be generated with the provided ratio settings.. Falling back to no oversampling.
2026-06-12 20:32:24,100 - preprocessing - INFO - Feature selection complete. Selected 16 / 19 features.
2026-06-12 20:32:28,797 - train_pipeline - INFO - Early stopping triggered at epoch 29
2026-06-12 20:32:28,804 - preprocessing - INFO - xAPI engineered features created: ['engagement_score', 'absence_risk', 'parent_support_signal']
2026-06-12 20:32:28,804 - preprocessing - INFO - xAPI engineered features created: ['engagement_score', 'absence_risk', 'parent_support_signal']
2026-06-12 20:32:28,818 - preprocessing - INFO - Applying ADASYN on train set with ratio 0.6951374353246801...
2026-06-12 20:32:28,831 - preprocessing - WARNING - ADASYN failed (likely too few samples). Error: No samples will be generated with the provided ratio settings.. Falling back to no oversampling.
2026-06-12 20:32:28,956 - preprocessing - INFO - Feature selection complete. Selected 18 / 19 features.
2026-06-12 20:32:33,570 - train_pipeline - INFO - Early stopping triggered at epoch 28
[I 2026-06-12 20:32:33,570] Trial 44 finished with value: 0.8049511802403128 and parameters: {'learning_rate': 0.0026465491241133335, 'weight_decay': 1.848208014230452e-05, 'batch_size': 16, 'oversample_method': 'adasyn', 'smote_ratio': 0.6951374353246801, 'cnn_channels': 16, 'lstm_hidden_dim': 64, 'context_hidden_dim': 128, 'fusion_hidden_dim': 128, 'dropout': 0.35513391105985326}. Best is trial 44 with value: 0.8049511802403128.
2026-06-12 20:32:33,584 - preprocessing - INFO - xAPI engineered features created: ['engagement_score', 'absence_risk', 'parent_support_signal']
2026-06-12 20:32:33,591 - preprocessing - INFO - xAPI engineered features created: ['engagement_score', 'absence_risk', 'parent_support_signal']
2026-06-12 20:32:33,612 - preprocessing - INFO - Applying ADASYN on train set with ratio 0.6865612160068101...
2026-06-12 20:32:33,619 - preprocessing - WARNING - ADASYN failed (likely too few samples). Error: No samples will be generated with the provided ratio settings.. Falling back to no oversampling.
2026-06-12 20:32:33,743 - preprocessing - INFO - Feature selection complete. Selected 15 / 19 features.
2026-06-12 20:32:36,227 - train_pipeline - INFO - Early stopping triggered at epoch 29
2026-06-12 20:32:36,234 - preprocessing - INFO - xAPI engineered features created: ['engagement_score', 'absence_risk', 'parent_support_signal']
2026-06-12 20:32:36,234 - preprocessing - INFO - xAPI engineered features created: ['engagement_score', 'absence_risk', 'parent_support_signal']
2026-06-12 20:32:36,255 - preprocessing - INFO - Applying ADASYN on train set with ratio 0.6865612160068101...
2026-06-12 20:32:36,269 - preprocessing - WARNING - ADASYN failed (likely too few samples). Error: No samples will be generated with the provided ratio settings.. Falling back to no oversampling.
2026-06-12 20:32:36,394 - preprocessing - INFO - Feature selection complete. Selected 16 / 19 features.
2026-06-12 20:32:37,843 - train_pipeline - INFO - Early stopping triggered at epoch 17
2026-06-12 20:32:37,850 - preprocessing - INFO - xAPI engineered features created: ['engagement_score', 'absence_risk', 'parent_support_signal']
2026-06-12 20:32:37,850 - preprocessing - INFO - xAPI engineered features created: ['engagement_score', 'absence_risk', 'parent_support_signal']
2026-06-12 20:32:37,871 - preprocessing - INFO - Applying ADASYN on train set with ratio 0.6865612160068101...
2026-06-12 20:32:37,878 - preprocessing - WARNING - ADASYN failed (likely too few samples). Error: No samples will be generated with the provided ratio settings.. Falling back to no oversampling.
2026-06-12 20:32:38,010 - preprocessing - INFO - Feature selection complete. Selected 18 / 19 features.
2026-06-12 20:32:40,591 - train_pipeline - INFO - Early stopping triggered at epoch 30
2026-06-12 20:32:40,598 - preprocessing - INFO - xAPI engineered features created: ['engagement_score', 'absence_risk', 'parent_support_signal']
2026-06-12 20:32:40,598 - preprocessing - INFO - xAPI engineered features created: ['engagement_score', 'absence_risk', 'parent_support_signal']
2026-06-12 20:32:40,618 - preprocessing - INFO - Applying ADASYN on train set with ratio 0.6865612160068101...
2026-06-12 20:32:40,625 - preprocessing - WARNING - ADASYN failed (likely too few samples). Error: No samples will be generated with the provided ratio settings.. Falling back to no oversampling.
2026-06-12 20:32:40,757 - preprocessing - INFO - Feature selection complete. Selected 16 / 19 features.
2026-06-12 20:32:44,998 - preprocessing - INFO - xAPI engineered features created: ['engagement_score', 'absence_risk', 'parent_support_signal']
2026-06-12 20:32:44,998 - preprocessing - INFO - xAPI engineered features created: ['engagement_score', 'absence_risk', 'parent_support_signal']
2026-06-12 20:32:45,019 - preprocessing - INFO - Applying ADASYN on train set with ratio 0.6865612160068101...
2026-06-12 20:32:45,024 - preprocessing - WARNING - ADASYN failed (likely too few samples). Error: No samples will be generated with the provided ratio settings.. Falling back to no oversampling.
2026-06-12 20:32:45,162 - preprocessing - INFO - Feature selection complete. Selected 18 / 19 features.
2026-06-12 20:32:47,508 - train_pipeline - INFO - Early stopping triggered at epoch 27
[I 2026-06-12 20:32:47,514] Trial 45 finished with value: 0.7894834842895044 and parameters: {'learning_rate': 0.002665994342321638, 'weight_decay': 9.39122586648689e-06, 'batch_size': 32, 'oversample_method': 'adasyn', 'smote_ratio': 0.6865612160068101, 'cnn_channels': 32, 'lstm_hidden_dim': 32, 'context_hidden_dim': 128, 'fusion_hidden_dim': 128, 'dropout': 0.35634617356689163}. Best is trial 44 with value: 0.8049511802403128.
2026-06-12 20:32:47,528 - preprocessing - INFO - xAPI engineered features created: ['engagement_score', 'absence_risk', 'parent_support_signal']
2026-06-12 20:32:47,528 - preprocessing - INFO - xAPI engineered features created: ['engagement_score', 'absence_risk', 'parent_support_signal']
2026-06-12 20:32:47,549 - preprocessing - INFO - Applying ADASYN on train set with ratio 0.788951622734656...
2026-06-12 20:32:47,563 - preprocessing - WARNING - ADASYN failed (likely too few samples). Error: No samples will be generated with the provided ratio settings.. Falling back to no oversampling.
2026-06-12 20:32:47,688 - preprocessing - INFO - Feature selection complete. Selected 15 / 19 features.
2026-06-12 20:32:53,383 - train_pipeline - INFO - Early stopping triggered at epoch 37
2026-06-12 20:32:53,390 - preprocessing - INFO - xAPI engineered features created: ['engagement_score', 'absence_risk', 'parent_support_signal']
2026-06-12 20:32:53,390 - preprocessing - INFO - xAPI engineered features created: ['engagement_score', 'absence_risk', 'parent_support_signal']
2026-06-12 20:32:53,411 - preprocessing - INFO - Applying ADASYN on train set with ratio 0.788951622734656...
2026-06-12 20:32:53,425 - preprocessing - WARNING - ADASYN failed (likely too few samples). Error: No samples will be generated with the provided ratio settings.. Falling back to no oversampling.
2026-06-12 20:32:53,550 - preprocessing - INFO - Feature selection complete. Selected 16 / 19 features.
2026-06-12 20:32:58,593 - train_pipeline - INFO - Early stopping triggered at epoch 32
2026-06-12 20:32:58,600 - preprocessing - INFO - xAPI engineered features created: ['engagement_score', 'absence_risk', 'parent_support_signal']
2026-06-12 20:32:58,600 - preprocessing - INFO - xAPI engineered features created: ['engagement_score', 'absence_risk', 'parent_support_signal']
2026-06-12 20:32:58,622 - preprocessing - INFO - Applying ADASYN on train set with ratio 0.788951622734656...
2026-06-12 20:32:58,635 - preprocessing - WARNING - ADASYN failed (likely too few samples). Error: No samples will be generated with the provided ratio settings.. Falling back to no oversampling.
2026-06-12 20:32:58,781 - preprocessing - INFO - Feature selection complete. Selected 18 / 19 features.
2026-06-12 20:33:06,574 - preprocessing - INFO - xAPI engineered features created: ['engagement_score', 'absence_risk', 'parent_support_signal']
2026-06-12 20:33:06,578 - preprocessing - INFO - xAPI engineered features created: ['engagement_score', 'absence_risk', 'parent_support_signal']
2026-06-12 20:33:06,592 - preprocessing - INFO - Applying ADASYN on train set with ratio 0.788951622734656...
2026-06-12 20:33:06,606 - preprocessing - WARNING - ADASYN failed (likely too few samples). Error: No samples will be generated with the provided ratio settings.. Falling back to no oversampling.
2026-06-12 20:33:06,738 - preprocessing - INFO - Feature selection complete. Selected 16 / 19 features.
2026-06-12 20:33:10,457 - train_pipeline - INFO - Early stopping triggered at epoch 25
2026-06-12 20:33:10,460 - preprocessing - INFO - xAPI engineered features created: ['engagement_score', 'absence_risk', 'parent_support_signal']
2026-06-12 20:33:10,463 - preprocessing - INFO - xAPI engineered features created: ['engagement_score', 'absence_risk', 'parent_support_signal']
2026-06-12 20:33:10,478 - preprocessing - INFO - Applying ADASYN on train set with ratio 0.788951622734656...
2026-06-12 20:33:10,498 - preprocessing - WARNING - ADASYN failed (likely too few samples). Error: No samples will be generated with the provided ratio settings.. Falling back to no oversampling.
2026-06-12 20:33:10,623 - preprocessing - INFO - Feature selection complete. Selected 18 / 19 features.
2026-06-12 20:33:14,397 - train_pipeline - INFO - Early stopping triggered at epoch 25
[I 2026-06-12 20:33:14,403] Trial 46 finished with value: 0.761382484382004 and parameters: {'learning_rate': 0.0010256932933416926, 'weight_decay': 5.769232149862916e-06, 'batch_size': 16, 'oversample_method': 'adasyn', 'smote_ratio': 0.788951622734656, 'cnn_channels': 16, 'lstm_hidden_dim': 64, 'context_hidden_dim': 32, 'fusion_hidden_dim': 32, 'dropout': 0.39566669675693}. Best is trial 44 with value: 0.8049511802403128.
2026-06-12 20:33:14,411 - preprocessing - INFO - xAPI engineered features created: ['engagement_score', 'absence_risk', 'parent_support_signal']
2026-06-12 20:33:14,418 - preprocessing - INFO - xAPI engineered features created: ['engagement_score', 'absence_risk', 'parent_support_signal']
2026-06-12 20:33:14,439 - preprocessing - INFO - Applying SMOTE on train set with ratio 0.7586097363751788...
2026-06-12 20:33:14,570 - preprocessing - INFO - Feature selection complete. Selected 17 / 19 features.
2026-06-12 20:33:15,944 - train_pipeline - INFO - Early stopping triggered at epoch 21
2026-06-12 20:33:15,951 - preprocessing - INFO - xAPI engineered features created: ['engagement_score', 'absence_risk', 'parent_support_signal']
2026-06-12 20:33:15,951 - preprocessing - INFO - xAPI engineered features created: ['engagement_score', 'absence_risk', 'parent_support_signal']
2026-06-12 20:33:15,972 - preprocessing - INFO - Applying SMOTE on train set with ratio 0.7586097363751788...
2026-06-12 20:33:16,111 - preprocessing - INFO - Feature selection complete. Selected 16 / 19 features.
2026-06-12 20:33:17,491 - train_pipeline - INFO - Early stopping triggered at epoch 21
2026-06-12 20:33:17,491 - preprocessing - INFO - xAPI engineered features created: ['engagement_score', 'absence_risk', 'parent_support_signal']
2026-06-12 20:33:17,498 - preprocessing - INFO - xAPI engineered features created: ['engagement_score', 'absence_risk', 'parent_support_signal']
2026-06-12 20:33:17,512 - preprocessing - INFO - Applying SMOTE on train set with ratio 0.7586097363751788...
2026-06-12 20:33:17,644 - preprocessing - INFO - Feature selection complete. Selected 18 / 19 features.
2026-06-12 20:33:20,088 - train_pipeline - INFO - Early stopping triggered at epoch 37
2026-06-12 20:33:20,092 - preprocessing - INFO - xAPI engineered features created: ['engagement_score', 'absence_risk', 'parent_support_signal']
2026-06-12 20:33:20,093 - preprocessing - INFO - xAPI engineered features created: ['engagement_score', 'absence_risk', 'parent_support_signal']
2026-06-12 20:33:20,114 - preprocessing - INFO - Applying SMOTE on train set with ratio 0.7586097363751788...
2026-06-12 20:33:20,252 - preprocessing - INFO - Feature selection complete. Selected 17 / 19 features.
2026-06-12 20:33:22,590 - train_pipeline - INFO - Early stopping triggered at epoch 35
2026-06-12 20:33:22,597 - preprocessing - INFO - xAPI engineered features created: ['engagement_score', 'absence_risk', 'parent_support_signal']
2026-06-12 20:33:22,597 - preprocessing - INFO - xAPI engineered features created: ['engagement_score', 'absence_risk', 'parent_support_signal']
2026-06-12 20:33:22,617 - preprocessing - INFO - Applying SMOTE on train set with ratio 0.7586097363751788...
2026-06-12 20:33:22,750 - preprocessing - INFO - Feature selection complete. Selected 18 / 19 features.
2026-06-12 20:33:25,053 - train_pipeline - INFO - Early stopping triggered at epoch 35
