[I 2026-06-12 19:53:37,071] Trial 29 finished with value: 0.815406306122948 and parameters: {'learning_rate': 0.0033646296031220485, 'weight_decay': 6.888562697003756e-05, 'batch_size': 64, 'oversample_method': 'adasyn', 'smote_ratio': 0.8718523247520065, 'cnn_channels': 16, 'lstm_hidden_dim': 64, 'context_hidden_dim': 32, 'fusion_hidden_dim': 128, 'dropout': 0.23716203035131495}. Best is trial 21 with value: 0.8897981256933332.
2026-06-12 19:53:37,083 - preprocessing - INFO - Student engineered features created: ['grade_growth', 'grade_avg', 'absence_study_ratio', 'failure_risk', 'alcohol_risk', 'social_risk']
2026-06-12 19:53:37,084 - preprocessing - INFO - Student engineered features created: ['grade_growth', 'grade_avg', 'absence_study_ratio', 'failure_risk', 'alcohol_risk', 'social_risk']
2026-06-12 19:53:37,132 - preprocessing - INFO - Applying ADASYN on train set with ratio 0.6708785733235433...
2026-06-12 19:53:37,351 - preprocessing - INFO - Feature selection complete. Selected 32 / 38 features.
2026-06-12 19:53:47,413 - train_pipeline - INFO - Early stopping triggered at epoch 35
2026-06-12 19:53:47,418 - preprocessing - INFO - Student engineered features created: ['grade_growth', 'grade_avg', 'absence_study_ratio', 'failure_risk', 'alcohol_risk', 'social_risk']
2026-06-12 19:53:47,422 - preprocessing - INFO - Student engineered features created: ['grade_growth', 'grade_avg', 'absence_study_ratio', 'failure_risk', 'alcohol_risk', 'social_risk']
2026-06-12 19:53:47,465 - preprocessing - INFO - Applying ADASYN on train set with ratio 0.6708785733235433...
2026-06-12 19:53:47,698 - preprocessing - INFO - Feature selection complete. Selected 34 / 38 features.
2026-06-12 19:53:52,332 - train_pipeline - INFO - Early stopping triggered at epoch 16
2026-06-12 19:53:52,339 - preprocessing - INFO - Student engineered features created: ['grade_growth', 'grade_avg', 'absence_study_ratio', 'failure_risk', 'alcohol_risk', 'social_risk']
2026-06-12 19:53:52,342 - preprocessing - INFO - Student engineered features created: ['grade_growth', 'grade_avg', 'absence_study_ratio', 'failure_risk', 'alcohol_risk', 'social_risk']
2026-06-12 19:53:52,381 - preprocessing - INFO - Applying ADASYN on train set with ratio 0.6708785733235433...
2026-06-12 19:53:52,612 - preprocessing - INFO - Feature selection complete. Selected 33 / 38 features.
2026-06-12 19:53:59,451 - train_pipeline - INFO - Early stopping triggered at epoch 24
2026-06-12 19:53:59,451 - preprocessing - INFO - Student engineered features created: ['grade_growth', 'grade_avg', 'absence_study_ratio', 'failure_risk', 'alcohol_risk', 'social_risk']
2026-06-12 19:53:59,451 - preprocessing - INFO - Student engineered features created: ['grade_growth', 'grade_avg', 'absence_study_ratio', 'failure_risk', 'alcohol_risk', 'social_risk']
2026-06-12 19:53:59,499 - preprocessing - INFO - Applying ADASYN on train set with ratio 0.6708785733235433...
2026-06-12 19:53:59,743 - preprocessing - INFO - Feature selection complete. Selected 34 / 38 features.
2026-06-12 19:54:04,563 - train_pipeline - INFO - Early stopping triggered at epoch 17
2026-06-12 19:54:04,563 - preprocessing - INFO - Student engineered features created: ['grade_growth', 'grade_avg', 'absence_study_ratio', 'failure_risk', 'alcohol_risk', 'social_risk']
2026-06-12 19:54:04,563 - preprocessing - INFO - Student engineered features created: ['grade_growth', 'grade_avg', 'absence_study_ratio', 'failure_risk', 'alcohol_risk', 'social_risk']
2026-06-12 19:54:04,612 - preprocessing - INFO - Applying ADASYN on train set with ratio 0.6708785733235433...
2026-06-12 19:54:04,847 - preprocessing - INFO - Feature selection complete. Selected 32 / 38 features.
2026-06-12 19:54:12,444 - train_pipeline - INFO - Early stopping triggered at epoch 27
[I 2026-06-12 19:54:12,444] Trial 30 finished with value: 0.8459060423893833 and parameters: {'learning_rate': 0.0039745634854225454, 'weight_decay': 9.623502762591347e-05, 'batch_size': 16, 'oversample_method': 'adasyn', 'smote_ratio': 0.6708785733235433, 'cnn_channels': 16, 'lstm_hidden_dim': 64, 'context_hidden_dim': 64, 'fusion_hidden_dim': 32, 'dropout': 0.18979547455103182}. Best is trial 21 with value: 0.8897981256933332.
2026-06-12 19:54:12,460 - preprocessing - INFO - Student engineered features created: ['grade_growth', 'grade_avg', 'absence_study_ratio', 'failure_risk', 'alcohol_risk', 'social_risk']
2026-06-12 19:54:12,463 - preprocessing - INFO - Student engineered features created: ['grade_growth', 'grade_avg', 'absence_study_ratio', 'failure_risk', 'alcohol_risk', 'social_risk']
2026-06-12 19:54:12,499 - preprocessing - INFO - Applying ADASYN on train set with ratio 0.6001628255471775...
2026-06-12 19:54:12,719 - preprocessing - INFO - Feature selection complete. Selected 34 / 38 features.
2026-06-12 19:54:14,914 - train_pipeline - INFO - Early stopping triggered at epoch 23
2026-06-12 19:54:14,914 - preprocessing - INFO - Student engineered features created: ['grade_growth', 'grade_avg', 'absence_study_ratio', 'failure_risk', 'alcohol_risk', 'social_risk']
2026-06-12 19:54:14,914 - preprocessing - INFO - Student engineered features created: ['grade_growth', 'grade_avg', 'absence_study_ratio', 'failure_risk', 'alcohol_risk', 'social_risk']
2026-06-12 19:54:14,969 - preprocessing - INFO - Applying ADASYN on train set with ratio 0.6001628255471775...
2026-06-12 19:54:15,185 - preprocessing - INFO - Feature selection complete. Selected 32 / 38 features.
2026-06-12 19:54:17,545 - train_pipeline - INFO - Early stopping triggered at epoch 25
2026-06-12 19:54:17,545 - preprocessing - INFO - Student engineered features created: ['grade_growth', 'grade_avg', 'absence_study_ratio', 'failure_risk', 'alcohol_risk', 'social_risk']
2026-06-12 19:54:17,545 - preprocessing - INFO - Student engineered features created: ['grade_growth', 'grade_avg', 'absence_study_ratio', 'failure_risk', 'alcohol_risk', 'social_risk']
2026-06-12 19:54:17,605 - preprocessing - INFO - Applying ADASYN on train set with ratio 0.6001628255471775...
2026-06-12 19:54:17,832 - preprocessing - INFO - Feature selection complete. Selected 34 / 38 features.
2026-06-12 19:54:19,738 - train_pipeline - INFO - Early stopping triggered at epoch 19
2026-06-12 19:54:19,742 - preprocessing - INFO - Student engineered features created: ['grade_growth', 'grade_avg', 'absence_study_ratio', 'failure_risk', 'alcohol_risk', 'social_risk']
2026-06-12 19:54:19,744 - preprocessing - INFO - Student engineered features created: ['grade_growth', 'grade_avg', 'absence_study_ratio', 'failure_risk', 'alcohol_risk', 'social_risk']
2026-06-12 19:54:19,788 - preprocessing - INFO - Applying ADASYN on train set with ratio 0.6001628255471775...
2026-06-12 19:54:20,021 - preprocessing - INFO - Feature selection complete. Selected 35 / 38 features.
2026-06-12 19:54:22,875 - train_pipeline - INFO - Early stopping triggered at epoch 30
2026-06-12 19:54:22,878 - preprocessing - INFO - Student engineered features created: ['grade_growth', 'grade_avg', 'absence_study_ratio', 'failure_risk', 'alcohol_risk', 'social_risk']
2026-06-12 19:54:22,878 - preprocessing - INFO - Student engineered features created: ['grade_growth', 'grade_avg', 'absence_study_ratio', 'failure_risk', 'alcohol_risk', 'social_risk']
2026-06-12 19:54:22,926 - preprocessing - INFO - Applying ADASYN on train set with ratio 0.6001628255471775...
2026-06-12 19:54:23,145 - preprocessing - INFO - Feature selection complete. Selected 33 / 38 features.
2026-06-12 19:54:26,909 - train_pipeline - INFO - Early stopping triggered at epoch 40
[I 2026-06-12 19:54:26,909] Trial 31 finished with value: 0.8704488145535814 and parameters: {'learning_rate': 0.006621548837898328, 'weight_decay': 0.0002106298093040092, 'batch_size': 64, 'oversample_method': 'adasyn', 'smote_ratio': 0.6001628255471775, 'cnn_channels': 32, 'lstm_hidden_dim': 64, 'context_hidden_dim': 64, 'fusion_hidden_dim': 32, 'dropout': 0.10229168712480775}. Best is trial 21 with value: 0.8897981256933332.
2026-06-12 19:54:26,923 - preprocessing - INFO - Student engineered features created: ['grade_growth', 'grade_avg', 'absence_study_ratio', 'failure_risk', 'alcohol_risk', 'social_risk']
2026-06-12 19:54:26,925 - preprocessing - INFO - Student engineered features created: ['grade_growth', 'grade_avg', 'absence_study_ratio', 'failure_risk', 'alcohol_risk', 'social_risk']
2026-06-12 19:54:26,973 - preprocessing - INFO - Applying ADASYN on train set with ratio 0.4953157291736583...
2026-06-12 19:54:27,183 - preprocessing - INFO - Feature selection complete. Selected 31 / 38 features.
2026-06-12 19:54:28,865 - train_pipeline - INFO - Early stopping triggered at epoch 20
2026-06-12 19:54:28,872 - preprocessing - INFO - Student engineered features created: ['grade_growth', 'grade_avg', 'absence_study_ratio', 'failure_risk', 'alcohol_risk', 'social_risk']
2026-06-12 19:54:28,876 - preprocessing - INFO - Student engineered features created: ['grade_growth', 'grade_avg', 'absence_study_ratio', 'failure_risk', 'alcohol_risk', 'social_risk']
2026-06-12 19:54:28,920 - preprocessing - INFO - Applying ADASYN on train set with ratio 0.4953157291736583...
2026-06-12 19:54:29,145 - preprocessing - INFO - Feature selection complete. Selected 33 / 38 features.
2026-06-12 19:54:30,989 - train_pipeline - INFO - Early stopping triggered at epoch 22
2026-06-12 19:54:30,991 - preprocessing - INFO - Student engineered features created: ['grade_growth', 'grade_avg', 'absence_study_ratio', 'failure_risk', 'alcohol_risk', 'social_risk']
2026-06-12 19:54:30,995 - preprocessing - INFO - Student engineered features created: ['grade_growth', 'grade_avg', 'absence_study_ratio', 'failure_risk', 'alcohol_risk', 'social_risk']
2026-06-12 19:54:31,039 - preprocessing - INFO - Applying ADASYN on train set with ratio 0.4953157291736583...
2026-06-12 19:54:31,268 - preprocessing - INFO - Feature selection complete. Selected 30 / 38 features.
2026-06-12 19:54:33,548 - train_pipeline - INFO - Early stopping triggered at epoch 27
2026-06-12 19:54:33,548 - preprocessing - INFO - Student engineered features created: ['grade_growth', 'grade_avg', 'absence_study_ratio', 'failure_risk', 'alcohol_risk', 'social_risk']
2026-06-12 19:54:33,556 - preprocessing - INFO - Student engineered features created: ['grade_growth', 'grade_avg', 'absence_study_ratio', 'failure_risk', 'alcohol_risk', 'social_risk']
2026-06-12 19:54:33,603 - preprocessing - INFO - Applying ADASYN on train set with ratio 0.4953157291736583...
2026-06-12 19:54:33,831 - preprocessing - INFO - Feature selection complete. Selected 34 / 38 features.
2026-06-12 19:54:37,787 - train_pipeline - INFO - Early stopping triggered at epoch 47
2026-06-12 19:54:37,804 - preprocessing - INFO - Student engineered features created: ['grade_growth', 'grade_avg', 'absence_study_ratio', 'failure_risk', 'alcohol_risk', 'social_risk']
2026-06-12 19:54:37,807 - preprocessing - INFO - Student engineered features created: ['grade_growth', 'grade_avg', 'absence_study_ratio', 'failure_risk', 'alcohol_risk', 'social_risk']
2026-06-12 19:54:37,856 - preprocessing - INFO - Applying ADASYN on train set with ratio 0.4953157291736583...
2026-06-12 19:54:38,071 - preprocessing - INFO - Feature selection complete. Selected 32 / 38 features.
[I 2026-06-12 19:54:42,476] Trial 32 finished with value: 0.8738083679478565 and parameters: {'learning_rate': 0.006461560115315177, 'weight_decay': 0.00043397480665953946, 'batch_size': 64, 'oversample_method': 'adasyn', 'smote_ratio': 0.4953157291736583, 'cnn_channels': 32, 'lstm_hidden_dim': 64, 'context_hidden_dim': 64, 'fusion_hidden_dim': 32, 'dropout': 0.13504654860456317}. Best is trial 21 with value: 0.8897981256933332.
2026-06-12 19:54:42,476 - preprocessing - INFO - Student engineered features created: ['grade_growth', 'grade_avg', 'absence_study_ratio', 'failure_risk', 'alcohol_risk', 'social_risk']
2026-06-12 19:54:42,476 - preprocessing - INFO - Student engineered features created: ['grade_growth', 'grade_avg', 'absence_study_ratio', 'failure_risk', 'alcohol_risk', 'social_risk']
2026-06-12 19:54:42,532 - preprocessing - INFO - Applying ADASYN on train set with ratio 0.45948556567654997...
2026-06-12 19:54:42,764 - preprocessing - INFO - Feature selection complete. Selected 30 / 38 features.
2026-06-12 19:54:44,718 - train_pipeline - INFO - Early stopping triggered at epoch 21
2026-06-12 19:54:44,725 - preprocessing - INFO - Student engineered features created: ['grade_growth', 'grade_avg', 'absence_study_ratio', 'failure_risk', 'alcohol_risk', 'social_risk']
2026-06-12 19:54:44,725 - preprocessing - INFO - Student engineered features created: ['grade_growth', 'grade_avg', 'absence_study_ratio', 'failure_risk', 'alcohol_risk', 'social_risk']
2026-06-12 19:54:44,768 - preprocessing - INFO - Applying ADASYN on train set with ratio 0.45948556567654997...
2026-06-12 19:54:45,017 - preprocessing - INFO - Feature selection complete. Selected 33 / 38 features.
2026-06-12 19:54:46,737 - train_pipeline - INFO - Early stopping triggered at epoch 20
2026-06-12 19:54:46,744 - preprocessing - INFO - Student engineered features created: ['grade_growth', 'grade_avg', 'absence_study_ratio', 'failure_risk', 'alcohol_risk', 'social_risk']
2026-06-12 19:54:46,745 - preprocessing - INFO - Student engineered features created: ['grade_growth', 'grade_avg', 'absence_study_ratio', 'failure_risk', 'alcohol_risk', 'social_risk']
2026-06-12 19:54:46,791 - preprocessing - INFO - Applying ADASYN on train set with ratio 0.45948556567654997...
2026-06-12 19:54:47,015 - preprocessing - INFO - Feature selection complete. Selected 29 / 38 features.
2026-06-12 19:54:48,609 - train_pipeline - INFO - Early stopping triggered at epoch 21
2026-06-12 19:54:48,609 - preprocessing - INFO - Student engineered features created: ['grade_growth', 'grade_avg', 'absence_study_ratio', 'failure_risk', 'alcohol_risk', 'social_risk']
2026-06-12 19:54:48,623 - preprocessing - INFO - Student engineered features created: ['grade_growth', 'grade_avg', 'absence_study_ratio', 'failure_risk', 'alcohol_risk', 'social_risk']
2026-06-12 19:54:48,673 - preprocessing - INFO - Applying ADASYN on train set with ratio 0.45948556567654997...
2026-06-12 19:54:48,891 - preprocessing - INFO - Feature selection complete. Selected 32 / 38 features.
2026-06-12 19:54:50,593 - train_pipeline - INFO - Early stopping triggered at epoch 20
2026-06-12 19:54:50,607 - preprocessing - INFO - Student engineered features created: ['grade_growth', 'grade_avg', 'absence_study_ratio', 'failure_risk', 'alcohol_risk', 'social_risk']
2026-06-12 19:54:50,610 - preprocessing - INFO - Student engineered features created: ['grade_growth', 'grade_avg', 'absence_study_ratio', 'failure_risk', 'alcohol_risk', 'social_risk']
2026-06-12 19:54:50,656 - preprocessing - INFO - Applying ADASYN on train set with ratio 0.45948556567654997...
2026-06-12 19:54:50,898 - preprocessing - INFO - Feature selection complete. Selected 29 / 38 features.
[I 2026-06-12 19:54:54,700] Trial 33 finished with value: 0.8785074107717493 and parameters: {'learning_rate': 0.002846786543431563, 'weight_decay': 0.00047334157042848803, 'batch_size': 64, 'oversample_method': 'adasyn', 'smote_ratio': 0.45948556567654997, 'cnn_channels': 32, 'lstm_hidden_dim': 64, 'context_hidden_dim': 64, 'fusion_hidden_dim': 32, 'dropout': 0.13407044636652105}. Best is trial 21 with value: 0.8897981256933332.
2026-06-12 19:54:54,723 - preprocessing - INFO - Student engineered features created: ['grade_growth', 'grade_avg', 'absence_study_ratio', 'failure_risk', 'alcohol_risk', 'social_risk']
2026-06-12 19:54:54,723 - preprocessing - INFO - Student engineered features created: ['grade_growth', 'grade_avg', 'absence_study_ratio', 'failure_risk', 'alcohol_risk', 'social_risk']
2026-06-12 19:54:54,765 - preprocessing - INFO - Applying ADASYN on train set with ratio 0.4320880447593562...
2026-06-12 19:54:55,000 - preprocessing - INFO - Feature selection complete. Selected 30 / 38 features.
2026-06-12 19:55:01,527 - train_pipeline - INFO - Early stopping triggered at epoch 30
2026-06-12 19:55:01,533 - preprocessing - INFO - Student engineered features created: ['grade_growth', 'grade_avg', 'absence_study_ratio', 'failure_risk', 'alcohol_risk', 'social_risk']
2026-06-12 19:55:01,533 - preprocessing - INFO - Student engineered features created: ['grade_growth', 'grade_avg', 'absence_study_ratio', 'failure_risk', 'alcohol_risk', 'social_risk']
2026-06-12 19:55:01,582 - preprocessing - INFO - Applying ADASYN on train set with ratio 0.4320880447593562...
2026-06-12 19:55:01,820 - preprocessing - INFO - Feature selection complete. Selected 32 / 38 features.
2026-06-12 19:55:05,772 - train_pipeline - INFO - Early stopping triggered at epoch 18
2026-06-12 19:55:05,772 - preprocessing - INFO - Student engineered features created: ['grade_growth', 'grade_avg', 'absence_study_ratio', 'failure_risk', 'alcohol_risk', 'social_risk']
2026-06-12 19:55:05,772 - preprocessing - INFO - Student engineered features created: ['grade_growth', 'grade_avg', 'absence_study_ratio', 'failure_risk', 'alcohol_risk', 'social_risk']
2026-06-12 19:55:05,821 - preprocessing - INFO - Applying ADASYN on train set with ratio 0.4320880447593562...
2026-06-12 19:55:06,045 - preprocessing - INFO - Feature selection complete. Selected 27 / 38 features.
2026-06-12 19:55:12,204 - train_pipeline - INFO - Early stopping triggered at epoch 28
2026-06-12 19:55:12,204 - preprocessing - INFO - Student engineered features created: ['grade_growth', 'grade_avg', 'absence_study_ratio', 'failure_risk', 'alcohol_risk', 'social_risk']
2026-06-12 19:55:12,204 - preprocessing - INFO - Student engineered features created: ['grade_growth', 'grade_avg', 'absence_study_ratio', 'failure_risk', 'alcohol_risk', 'social_risk']
2026-06-12 19:55:12,266 - preprocessing - INFO - Applying ADASYN on train set with ratio 0.4320880447593562...
2026-06-12 19:55:12,489 - preprocessing - INFO - Feature selection complete. Selected 30 / 38 features.
2026-06-12 19:55:16,740 - train_pipeline - INFO - Early stopping triggered at epoch 19
2026-06-12 19:55:16,740 - preprocessing - INFO - Student engineered features created: ['grade_growth', 'grade_avg', 'absence_study_ratio', 'failure_risk', 'alcohol_risk', 'social_risk']
2026-06-12 19:55:16,740 - preprocessing - INFO - Student engineered features created: ['grade_growth', 'grade_avg', 'absence_study_ratio', 'failure_risk', 'alcohol_risk', 'social_risk']
2026-06-12 19:55:16,806 - preprocessing - INFO - Applying ADASYN on train set with ratio 0.4320880447593562...
2026-06-12 19:55:17,026 - preprocessing - INFO - Feature selection complete. Selected 30 / 38 features.
2026-06-12 19:55:21,895 - train_pipeline - INFO - Early stopping triggered at epoch 22
