[I 2026-06-12 20:28:29,308] Trial 32 finished with value: 0.7881096021951366 and parameters: {'learning_rate': 0.006129189842711063, 'weight_decay': 5.894649584330794e-05, 'batch_size': 16, 'oversample_method': 'adasyn', 'smote_ratio': 0.6376947001589927, 'cnn_channels': 16, 'lstm_hidden_dim': 64, 'context_hidden_dim': 128, 'fusion_hidden_dim': 128, 'dropout': 0.19145740576494427}. Best is trial 23 with value: 0.8021730167770063.
2026-06-12 20:28:29,315 - preprocessing - INFO - xAPI engineered features created: ['engagement_score', 'absence_risk', 'parent_support_signal']
2026-06-12 20:28:29,315 - preprocessing - INFO - xAPI engineered features created: ['engagement_score', 'absence_risk', 'parent_support_signal']
2026-06-12 20:28:29,329 - preprocessing - INFO - Applying ADASYN on train set with ratio 0.6870068415885421...
2026-06-12 20:28:29,345 - preprocessing - WARNING - ADASYN failed (likely too few samples). Error: No samples will be generated with the provided ratio settings.. Falling back to no oversampling.
2026-06-12 20:28:29,479 - preprocessing - INFO - Feature selection complete. Selected 15 / 19 features.
2026-06-12 20:28:33,585 - train_pipeline - INFO - Early stopping triggered at epoch 26
2026-06-12 20:28:33,602 - preprocessing - INFO - xAPI engineered features created: ['engagement_score', 'absence_risk', 'parent_support_signal']
2026-06-12 20:28:33,604 - preprocessing - INFO - xAPI engineered features created: ['engagement_score', 'absence_risk', 'parent_support_signal']
2026-06-12 20:28:33,616 - preprocessing - INFO - Applying ADASYN on train set with ratio 0.6870068415885421...
2026-06-12 20:28:33,630 - preprocessing - WARNING - ADASYN failed (likely too few samples). Error: No samples will be generated with the provided ratio settings.. Falling back to no oversampling.
2026-06-12 20:28:33,762 - preprocessing - INFO - Feature selection complete. Selected 16 / 19 features.
2026-06-12 20:28:40,806 - train_pipeline - INFO - Early stopping triggered at epoch 43
2026-06-12 20:28:40,806 - preprocessing - INFO - xAPI engineered features created: ['engagement_score', 'absence_risk', 'parent_support_signal']
2026-06-12 20:28:40,806 - preprocessing - INFO - xAPI engineered features created: ['engagement_score', 'absence_risk', 'parent_support_signal']
2026-06-12 20:28:40,821 - preprocessing - INFO - Applying ADASYN on train set with ratio 0.6870068415885421...
2026-06-12 20:28:40,840 - preprocessing - WARNING - ADASYN failed (likely too few samples). Error: No samples will be generated with the provided ratio settings.. Falling back to no oversampling.
2026-06-12 20:28:40,972 - preprocessing - INFO - Feature selection complete. Selected 18 / 19 features.
2026-06-12 20:28:44,556 - train_pipeline - INFO - Early stopping triggered at epoch 23
2026-06-12 20:28:44,556 - preprocessing - INFO - xAPI engineered features created: ['engagement_score', 'absence_risk', 'parent_support_signal']
2026-06-12 20:28:44,556 - preprocessing - INFO - xAPI engineered features created: ['engagement_score', 'absence_risk', 'parent_support_signal']
2026-06-12 20:28:44,584 - preprocessing - INFO - Applying ADASYN on train set with ratio 0.6870068415885421...
2026-06-12 20:28:44,584 - preprocessing - WARNING - ADASYN failed (likely too few samples). Error: No samples will be generated with the provided ratio settings.. Falling back to no oversampling.
2026-06-12 20:28:44,725 - preprocessing - INFO - Feature selection complete. Selected 16 / 19 features.
2026-06-12 20:28:49,055 - train_pipeline - INFO - Early stopping triggered at epoch 28
2026-06-12 20:28:49,057 - preprocessing - INFO - xAPI engineered features created: ['engagement_score', 'absence_risk', 'parent_support_signal']
2026-06-12 20:28:49,061 - preprocessing - INFO - xAPI engineered features created: ['engagement_score', 'absence_risk', 'parent_support_signal']
2026-06-12 20:28:49,079 - preprocessing - INFO - Applying ADASYN on train set with ratio 0.6870068415885421...
2026-06-12 20:28:49,085 - preprocessing - WARNING - ADASYN failed (likely too few samples). Error: No samples will be generated with the provided ratio settings.. Falling back to no oversampling.
2026-06-12 20:28:49,207 - preprocessing - INFO - Feature selection complete. Selected 18 / 19 features.
2026-06-12 20:28:52,528 - train_pipeline - INFO - Early stopping triggered at epoch 21
[I 2026-06-12 20:28:52,528] Trial 33 finished with value: 0.7845725341318285 and parameters: {'learning_rate': 0.003507176292610791, 'weight_decay': 0.00013981249485134229, 'batch_size': 16, 'oversample_method': 'adasyn', 'smote_ratio': 0.6870068415885421, 'cnn_channels': 16, 'lstm_hidden_dim': 64, 'context_hidden_dim': 128, 'fusion_hidden_dim': 128, 'dropout': 0.23061766226908842}. Best is trial 23 with value: 0.8021730167770063.
2026-06-12 20:28:52,549 - preprocessing - INFO - xAPI engineered features created: ['engagement_score', 'absence_risk', 'parent_support_signal']
2026-06-12 20:28:52,549 - preprocessing - INFO - xAPI engineered features created: ['engagement_score', 'absence_risk', 'parent_support_signal']
2026-06-12 20:28:52,569 - preprocessing - INFO - Applying ADASYN on train set with ratio 0.7146084289953635...
2026-06-12 20:28:52,569 - preprocessing - WARNING - ADASYN failed (likely too few samples). Error: No samples will be generated with the provided ratio settings.. Falling back to no oversampling.
2026-06-12 20:28:52,687 - preprocessing - INFO - Feature selection complete. Selected 15 / 19 features.
2026-06-12 20:28:55,843 - train_pipeline - INFO - Early stopping triggered at epoch 21
2026-06-12 20:28:55,843 - preprocessing - INFO - xAPI engineered features created: ['engagement_score', 'absence_risk', 'parent_support_signal']
2026-06-12 20:28:55,843 - preprocessing - INFO - xAPI engineered features created: ['engagement_score', 'absence_risk', 'parent_support_signal']
2026-06-12 20:28:55,858 - preprocessing - INFO - Applying ADASYN on train set with ratio 0.7146084289953635...
2026-06-12 20:28:55,873 - preprocessing - WARNING - ADASYN failed (likely too few samples). Error: No samples will be generated with the provided ratio settings.. Falling back to no oversampling.
2026-06-12 20:28:56,010 - preprocessing - INFO - Feature selection complete. Selected 16 / 19 features.
2026-06-12 20:29:02,143 - train_pipeline - INFO - Early stopping triggered at epoch 41
2026-06-12 20:29:02,143 - preprocessing - INFO - xAPI engineered features created: ['engagement_score', 'absence_risk', 'parent_support_signal']
2026-06-12 20:29:02,143 - preprocessing - INFO - xAPI engineered features created: ['engagement_score', 'absence_risk', 'parent_support_signal']
2026-06-12 20:29:02,164 - preprocessing - INFO - Applying ADASYN on train set with ratio 0.7146084289953635...
2026-06-12 20:29:02,178 - preprocessing - WARNING - ADASYN failed (likely too few samples). Error: No samples will be generated with the provided ratio settings.. Falling back to no oversampling.
2026-06-12 20:29:02,303 - preprocessing - INFO - Feature selection complete. Selected 18 / 19 features.
2026-06-12 20:29:06,252 - train_pipeline - INFO - Early stopping triggered at epoch 26
2026-06-12 20:29:06,252 - preprocessing - INFO - xAPI engineered features created: ['engagement_score', 'absence_risk', 'parent_support_signal']
2026-06-12 20:29:06,252 - preprocessing - INFO - xAPI engineered features created: ['engagement_score', 'absence_risk', 'parent_support_signal']
2026-06-12 20:29:06,278 - preprocessing - INFO - Applying ADASYN on train set with ratio 0.7146084289953635...
2026-06-12 20:29:06,285 - preprocessing - WARNING - ADASYN failed (likely too few samples). Error: No samples will be generated with the provided ratio settings.. Falling back to no oversampling.
2026-06-12 20:29:06,403 - preprocessing - INFO - Feature selection complete. Selected 16 / 19 features.
2026-06-12 20:29:10,102 - train_pipeline - INFO - Early stopping triggered at epoch 24
2026-06-12 20:29:10,118 - preprocessing - INFO - xAPI engineered features created: ['engagement_score', 'absence_risk', 'parent_support_signal']
2026-06-12 20:29:10,121 - preprocessing - INFO - xAPI engineered features created: ['engagement_score', 'absence_risk', 'parent_support_signal']
2026-06-12 20:29:10,135 - preprocessing - INFO - Applying ADASYN on train set with ratio 0.7146084289953635...
2026-06-12 20:29:10,151 - preprocessing - WARNING - ADASYN failed (likely too few samples). Error: No samples will be generated with the provided ratio settings.. Falling back to no oversampling.
2026-06-12 20:29:10,288 - preprocessing - INFO - Feature selection complete. Selected 18 / 19 features.
2026-06-12 20:29:13,396 - train_pipeline - INFO - Early stopping triggered at epoch 19
[I 2026-06-12 20:29:13,396] Trial 34 finished with value: 0.7746673190545017 and parameters: {'learning_rate': 0.008650902356788984, 'weight_decay': 0.0004139024617962344, 'batch_size': 16, 'oversample_method': 'adasyn', 'smote_ratio': 0.7146084289953635, 'cnn_channels': 64, 'lstm_hidden_dim': 32, 'context_hidden_dim': 128, 'fusion_hidden_dim': 128, 'dropout': 0.3007754242210842}. Best is trial 23 with value: 0.8021730167770063.
2026-06-12 20:29:13,416 - preprocessing - INFO - xAPI engineered features created: ['engagement_score', 'absence_risk', 'parent_support_signal']
2026-06-12 20:29:13,416 - preprocessing - INFO - xAPI engineered features created: ['engagement_score', 'absence_risk', 'parent_support_signal']
2026-06-12 20:29:13,438 - preprocessing - INFO - Applying ADASYN on train set with ratio 0.5615604013512516...
2026-06-12 20:29:13,559 - preprocessing - INFO - Feature selection complete. Selected 15 / 19 features.
2026-06-12 20:29:16,296 - train_pipeline - INFO - Early stopping triggered at epoch 18
2026-06-12 20:29:16,296 - preprocessing - INFO - xAPI engineered features created: ['engagement_score', 'absence_risk', 'parent_support_signal']
2026-06-12 20:29:16,296 - preprocessing - INFO - xAPI engineered features created: ['engagement_score', 'absence_risk', 'parent_support_signal']
2026-06-12 20:29:16,318 - preprocessing - INFO - Applying ADASYN on train set with ratio 0.5615604013512516...
2026-06-12 20:29:16,441 - preprocessing - INFO - Feature selection complete. Selected 16 / 19 features.
2026-06-12 20:29:19,244 - train_pipeline - INFO - Early stopping triggered at epoch 18
2026-06-12 20:29:19,253 - preprocessing - INFO - xAPI engineered features created: ['engagement_score', 'absence_risk', 'parent_support_signal']
2026-06-12 20:29:19,253 - preprocessing - INFO - xAPI engineered features created: ['engagement_score', 'absence_risk', 'parent_support_signal']
2026-06-12 20:29:19,272 - preprocessing - INFO - Applying ADASYN on train set with ratio 0.5615604013512516...
2026-06-12 20:29:19,404 - preprocessing - INFO - Feature selection complete. Selected 18 / 19 features.
2026-06-12 20:29:23,749 - train_pipeline - INFO - Early stopping triggered at epoch 28
2026-06-12 20:29:23,762 - preprocessing - INFO - xAPI engineered features created: ['engagement_score', 'absence_risk', 'parent_support_signal']
2026-06-12 20:29:23,762 - preprocessing - INFO - xAPI engineered features created: ['engagement_score', 'absence_risk', 'parent_support_signal']
2026-06-12 20:29:23,770 - preprocessing - INFO - Applying ADASYN on train set with ratio 0.5615604013512516...
2026-06-12 20:29:23,907 - preprocessing - INFO - Feature selection complete. Selected 16 / 19 features.
2026-06-12 20:29:29,128 - train_pipeline - INFO - Early stopping triggered at epoch 34
2026-06-12 20:29:29,132 - preprocessing - INFO - xAPI engineered features created: ['engagement_score', 'absence_risk', 'parent_support_signal']
2026-06-12 20:29:29,134 - preprocessing - INFO - xAPI engineered features created: ['engagement_score', 'absence_risk', 'parent_support_signal']
2026-06-12 20:29:29,152 - preprocessing - INFO - Applying ADASYN on train set with ratio 0.5615604013512516...
2026-06-12 20:29:29,278 - preprocessing - INFO - Feature selection complete. Selected 18 / 19 features.
2026-06-12 20:29:33,130 - train_pipeline - INFO - Early stopping triggered at epoch 25
[I 2026-06-12 20:29:33,130] Trial 35 finished with value: 0.7949320481203417 and parameters: {'learning_rate': 0.004595253619021408, 'weight_decay': 0.0002758328524759288, 'batch_size': 16, 'oversample_method': 'adasyn', 'smote_ratio': 0.5615604013512516, 'cnn_channels': 16, 'lstm_hidden_dim': 64, 'context_hidden_dim': 64, 'fusion_hidden_dim': 128, 'dropout': 0.2749055870373286}. Best is trial 23 with value: 0.8021730167770063.
2026-06-12 20:29:33,154 - preprocessing - INFO - xAPI engineered features created: ['engagement_score', 'absence_risk', 'parent_support_signal']
2026-06-12 20:29:33,158 - preprocessing - INFO - xAPI engineered features created: ['engagement_score', 'absence_risk', 'parent_support_signal']
2026-06-12 20:29:33,176 - preprocessing - INFO - Applying ADASYN on train set with ratio 0.939667625490649...
2026-06-12 20:29:33,320 - preprocessing - INFO - Feature selection complete. Selected 18 / 19 features.
2026-06-12 20:29:34,509 - train_pipeline - INFO - Early stopping triggered at epoch 21
2026-06-12 20:29:34,513 - preprocessing - INFO - xAPI engineered features created: ['engagement_score', 'absence_risk', 'parent_support_signal']
2026-06-12 20:29:34,516 - preprocessing - INFO - xAPI engineered features created: ['engagement_score', 'absence_risk', 'parent_support_signal']
2026-06-12 20:29:34,534 - preprocessing - INFO - Applying ADASYN on train set with ratio 0.939667625490649...
2026-06-12 20:29:34,675 - preprocessing - INFO - Feature selection complete. Selected 16 / 19 features.
2026-06-12 20:29:36,357 - train_pipeline - INFO - Early stopping triggered at epoch 30
2026-06-12 20:29:36,359 - preprocessing - INFO - xAPI engineered features created: ['engagement_score', 'absence_risk', 'parent_support_signal']
2026-06-12 20:29:36,362 - preprocessing - INFO - xAPI engineered features created: ['engagement_score', 'absence_risk', 'parent_support_signal']
2026-06-12 20:29:36,379 - preprocessing - INFO - Applying ADASYN on train set with ratio 0.939667625490649...
2026-06-12 20:29:36,518 - preprocessing - INFO - Feature selection complete. Selected 18 / 19 features.
2026-06-12 20:29:37,594 - train_pipeline - INFO - Early stopping triggered at epoch 19
2026-06-12 20:29:37,608 - preprocessing - INFO - xAPI engineered features created: ['engagement_score', 'absence_risk', 'parent_support_signal']
2026-06-12 20:29:37,610 - preprocessing - INFO - xAPI engineered features created: ['engagement_score', 'absence_risk', 'parent_support_signal']
2026-06-12 20:29:37,629 - preprocessing - INFO - Applying ADASYN on train set with ratio 0.939667625490649...
2026-06-12 20:29:37,770 - preprocessing - INFO - Feature selection complete. Selected 17 / 19 features.
2026-06-12 20:29:40,535 - train_pipeline - INFO - Early stopping triggered at epoch 42
2026-06-12 20:29:40,551 - preprocessing - INFO - xAPI engineered features created: ['engagement_score', 'absence_risk', 'parent_support_signal']
2026-06-12 20:29:40,551 - preprocessing - INFO - xAPI engineered features created: ['engagement_score', 'absence_risk', 'parent_support_signal']
2026-06-12 20:29:40,567 - preprocessing - INFO - Applying ADASYN on train set with ratio 0.939667625490649...
2026-06-12 20:29:40,715 - preprocessing - INFO - Feature selection complete. Selected 18 / 19 features.
2026-06-12 20:29:42,028 - train_pipeline - INFO - Early stopping triggered at epoch 23
[I 2026-06-12 20:29:42,033] Trial 36 finished with value: 0.7636033045568794 and parameters: {'learning_rate': 0.0016630122384208787, 'weight_decay': 8.095771825739115e-05, 'batch_size': 64, 'oversample_method': 'adasyn', 'smote_ratio': 0.939667625490649, 'cnn_channels': 16, 'lstm_hidden_dim': 32, 'context_hidden_dim': 128, 'fusion_hidden_dim': 128, 'dropout': 0.1755388503341063}. Best is trial 23 with value: 0.8021730167770063.
2026-06-12 20:29:42,040 - preprocessing - INFO - xAPI engineered features created: ['engagement_score', 'absence_risk', 'parent_support_signal']
2026-06-12 20:29:42,040 - preprocessing - INFO - xAPI engineered features created: ['engagement_score', 'absence_risk', 'parent_support_signal']
2026-06-12 20:29:42,061 - preprocessing - INFO - Applying ADASYN on train set with ratio 0.803965648100804...
2026-06-12 20:29:42,079 - preprocessing - WARNING - ADASYN failed (likely too few samples). Error: No samples will be generated with the provided ratio settings.. Falling back to no oversampling.
2026-06-12 20:29:42,214 - preprocessing - INFO - Feature selection complete. Selected 15 / 19 features.
2026-06-12 20:29:45,877 - train_pipeline - INFO - Early stopping triggered at epoch 42
2026-06-12 20:29:45,877 - preprocessing - INFO - xAPI engineered features created: ['engagement_score', 'absence_risk', 'parent_support_signal']
2026-06-12 20:29:45,877 - preprocessing - INFO - xAPI engineered features created: ['engagement_score', 'absence_risk', 'parent_support_signal']
2026-06-12 20:29:45,898 - preprocessing - INFO - Applying ADASYN on train set with ratio 0.803965648100804...
2026-06-12 20:29:45,918 - preprocessing - WARNING - ADASYN failed (likely too few samples). Error: No samples will be generated with the provided ratio settings.. Falling back to no oversampling.
2026-06-12 20:29:46,056 - preprocessing - INFO - Feature selection complete. Selected 16 / 19 features.
2026-06-12 20:29:48,089 - train_pipeline - INFO - Early stopping triggered at epoch 23
2026-06-12 20:29:48,089 - preprocessing - INFO - xAPI engineered features created: ['engagement_score', 'absence_risk', 'parent_support_signal']
2026-06-12 20:29:48,089 - preprocessing - INFO - xAPI engineered features created: ['engagement_score', 'absence_risk', 'parent_support_signal']
2026-06-12 20:29:48,118 - preprocessing - INFO - Applying ADASYN on train set with ratio 0.803965648100804...
2026-06-12 20:29:48,135 - preprocessing - WARNING - ADASYN failed (likely too few samples). Error: No samples will be generated with the provided ratio settings.. Falling back to no oversampling.
2026-06-12 20:29:48,263 - preprocessing - INFO - Feature selection complete. Selected 18 / 19 features.
2026-06-12 20:29:51,281 - train_pipeline - INFO - Early stopping triggered at epoch 34
2026-06-12 20:29:51,281 - preprocessing - INFO - xAPI engineered features created: ['engagement_score', 'absence_risk', 'parent_support_signal']
2026-06-12 20:29:51,281 - preprocessing - INFO - xAPI engineered features created: ['engagement_score', 'absence_risk', 'parent_support_signal']
2026-06-12 20:29:51,297 - preprocessing - INFO - Applying ADASYN on train set with ratio 0.803965648100804...
2026-06-12 20:29:51,316 - preprocessing - WARNING - ADASYN failed (likely too few samples). Error: No samples will be generated with the provided ratio settings.. Falling back to no oversampling.
2026-06-12 20:29:51,451 - preprocessing - INFO - Feature selection complete. Selected 16 / 19 features.
2026-06-12 20:29:55,851 - preprocessing - INFO - xAPI engineered features created: ['engagement_score', 'absence_risk', 'parent_support_signal']
2026-06-12 20:29:55,853 - preprocessing - INFO - xAPI engineered features created: ['engagement_score', 'absence_risk', 'parent_support_signal']
2026-06-12 20:29:55,871 - preprocessing - INFO - Applying ADASYN on train set with ratio 0.803965648100804...
2026-06-12 20:29:55,881 - preprocessing - WARNING - ADASYN failed (likely too few samples). Error: No samples will be generated with the provided ratio settings.. Falling back to no oversampling.
2026-06-12 20:29:56,014 - preprocessing - INFO - Feature selection complete. Selected 18 / 19 features.
2026-06-12 20:29:59,540 - train_pipeline - INFO - Early stopping triggered at epoch 37
