[I 2026-06-12 20:29:59,542] Trial 37 finished with value: 0.7658511442825595 and parameters: {'learning_rate': 0.0019781193129530385, 'weight_decay': 0.00014302848564649696, 'batch_size': 32, 'oversample_method': 'adasyn', 'smote_ratio': 0.803965648100804, 'cnn_channels': 64, 'lstm_hidden_dim': 64, 'context_hidden_dim': 64, 'fusion_hidden_dim': 64, 'dropout': 0.44903848778371364}. Best is trial 23 with value: 0.8021730167770063.
2026-06-12 20:29:59,551 - preprocessing - INFO - xAPI engineered features created: ['engagement_score', 'absence_risk', 'parent_support_signal']
2026-06-12 20:29:59,551 - preprocessing - INFO - xAPI engineered features created: ['engagement_score', 'absence_risk', 'parent_support_signal']
2026-06-12 20:29:59,566 - preprocessing - INFO - Applying ADASYN on train set with ratio 0.6800661839016804...
2026-06-12 20:29:59,581 - preprocessing - WARNING - ADASYN failed (likely too few samples). Error: No samples will be generated with the provided ratio settings.. Falling back to no oversampling.
2026-06-12 20:29:59,710 - preprocessing - INFO - Feature selection complete. Selected 15 / 19 features.
2026-06-12 20:30:03,720 - train_pipeline - INFO - Early stopping triggered at epoch 26
2026-06-12 20:30:03,735 - preprocessing - INFO - xAPI engineered features created: ['engagement_score', 'absence_risk', 'parent_support_signal']
2026-06-12 20:30:03,735 - preprocessing - INFO - xAPI engineered features created: ['engagement_score', 'absence_risk', 'parent_support_signal']
2026-06-12 20:30:03,748 - preprocessing - INFO - Applying ADASYN on train set with ratio 0.6800661839016804...
2026-06-12 20:30:03,764 - preprocessing - WARNING - ADASYN failed (likely too few samples). Error: No samples will be generated with the provided ratio settings.. Falling back to no oversampling.
2026-06-12 20:30:03,894 - preprocessing - INFO - Feature selection complete. Selected 16 / 19 features.
2026-06-12 20:30:08,715 - train_pipeline - INFO - Early stopping triggered at epoch 31
2026-06-12 20:30:08,715 - preprocessing - INFO - xAPI engineered features created: ['engagement_score', 'absence_risk', 'parent_support_signal']
2026-06-12 20:30:08,715 - preprocessing - INFO - xAPI engineered features created: ['engagement_score', 'absence_risk', 'parent_support_signal']
2026-06-12 20:30:08,736 - preprocessing - INFO - Applying ADASYN on train set with ratio 0.6800661839016804...
2026-06-12 20:30:08,752 - preprocessing - WARNING - ADASYN failed (likely too few samples). Error: No samples will be generated with the provided ratio settings.. Falling back to no oversampling.
2026-06-12 20:30:08,875 - preprocessing - INFO - Feature selection complete. Selected 18 / 19 features.
2026-06-12 20:30:13,400 - train_pipeline - INFO - Early stopping triggered at epoch 29
2026-06-12 20:30:13,402 - preprocessing - INFO - xAPI engineered features created: ['engagement_score', 'absence_risk', 'parent_support_signal']
2026-06-12 20:30:13,404 - preprocessing - INFO - xAPI engineered features created: ['engagement_score', 'absence_risk', 'parent_support_signal']
2026-06-12 20:30:13,423 - preprocessing - INFO - Applying ADASYN on train set with ratio 0.6800661839016804...
2026-06-12 20:30:13,428 - preprocessing - WARNING - ADASYN failed (likely too few samples). Error: No samples will be generated with the provided ratio settings.. Falling back to no oversampling.
2026-06-12 20:30:13,566 - preprocessing - INFO - Feature selection complete. Selected 16 / 19 features.
2026-06-12 20:30:17,937 - train_pipeline - INFO - Early stopping triggered at epoch 28
2026-06-12 20:30:17,937 - preprocessing - INFO - xAPI engineered features created: ['engagement_score', 'absence_risk', 'parent_support_signal']
2026-06-12 20:30:17,955 - preprocessing - INFO - xAPI engineered features created: ['engagement_score', 'absence_risk', 'parent_support_signal']
2026-06-12 20:30:17,970 - preprocessing - INFO - Applying ADASYN on train set with ratio 0.6800661839016804...
2026-06-12 20:30:17,977 - preprocessing - WARNING - ADASYN failed (likely too few samples). Error: No samples will be generated with the provided ratio settings.. Falling back to no oversampling.
2026-06-12 20:30:18,104 - preprocessing - INFO - Feature selection complete. Selected 18 / 19 features.
2026-06-12 20:30:26,172 - train_pipeline - INFO - Early stopping triggered at epoch 50
[I 2026-06-12 20:30:26,172] Trial 38 finished with value: 0.7984773943260735 and parameters: {'learning_rate': 0.0033347878436620856, 'weight_decay': 0.0006506783885304179, 'batch_size': 16, 'oversample_method': 'adasyn', 'smote_ratio': 0.6800661839016804, 'cnn_channels': 16, 'lstm_hidden_dim': 64, 'context_hidden_dim': 128, 'fusion_hidden_dim': 128, 'dropout': 0.39476786496586136}. Best is trial 23 with value: 0.8021730167770063.
2026-06-12 20:30:26,188 - preprocessing - INFO - xAPI engineered features created: ['engagement_score', 'absence_risk', 'parent_support_signal']
2026-06-12 20:30:26,191 - preprocessing - INFO - xAPI engineered features created: ['engagement_score', 'absence_risk', 'parent_support_signal']
2026-06-12 20:30:26,210 - preprocessing - INFO - Applying ADASYN on train set with ratio 0.6818639805885657...
2026-06-12 20:30:26,218 - preprocessing - WARNING - ADASYN failed (likely too few samples). Error: No samples will be generated with the provided ratio settings.. Falling back to no oversampling.
2026-06-12 20:30:26,350 - preprocessing - INFO - Feature selection complete. Selected 15 / 19 features.
2026-06-12 20:30:27,793 - train_pipeline - INFO - Early stopping triggered at epoch 30
2026-06-12 20:30:27,793 - preprocessing - INFO - xAPI engineered features created: ['engagement_score', 'absence_risk', 'parent_support_signal']
2026-06-12 20:30:27,802 - preprocessing - INFO - xAPI engineered features created: ['engagement_score', 'absence_risk', 'parent_support_signal']
2026-06-12 20:30:27,820 - preprocessing - INFO - Applying ADASYN on train set with ratio 0.6818639805885657...
2026-06-12 20:30:27,826 - preprocessing - WARNING - ADASYN failed (likely too few samples). Error: No samples will be generated with the provided ratio settings.. Falling back to no oversampling.
2026-06-12 20:30:27,955 - preprocessing - INFO - Feature selection complete. Selected 16 / 19 features.
2026-06-12 20:30:29,063 - train_pipeline - INFO - Early stopping triggered at epoch 23
2026-06-12 20:30:29,063 - preprocessing - INFO - xAPI engineered features created: ['engagement_score', 'absence_risk', 'parent_support_signal']
2026-06-12 20:30:29,063 - preprocessing - INFO - xAPI engineered features created: ['engagement_score', 'absence_risk', 'parent_support_signal']
2026-06-12 20:30:29,076 - preprocessing - INFO - Applying ADASYN on train set with ratio 0.6818639805885657...
2026-06-12 20:30:29,090 - preprocessing - WARNING - ADASYN failed (likely too few samples). Error: No samples will be generated with the provided ratio settings.. Falling back to no oversampling.
2026-06-12 20:30:29,229 - preprocessing - INFO - Feature selection complete. Selected 18 / 19 features.
2026-06-12 20:30:30,542 - train_pipeline - INFO - Early stopping triggered at epoch 27
2026-06-12 20:30:30,547 - preprocessing - INFO - xAPI engineered features created: ['engagement_score', 'absence_risk', 'parent_support_signal']
2026-06-12 20:30:30,547 - preprocessing - INFO - xAPI engineered features created: ['engagement_score', 'absence_risk', 'parent_support_signal']
2026-06-12 20:30:30,561 - preprocessing - INFO - Applying ADASYN on train set with ratio 0.6818639805885657...
2026-06-12 20:30:30,561 - preprocessing - WARNING - ADASYN failed (likely too few samples). Error: No samples will be generated with the provided ratio settings.. Falling back to no oversampling.
2026-06-12 20:30:30,709 - preprocessing - INFO - Feature selection complete. Selected 16 / 19 features.
2026-06-12 20:30:33,031 - train_pipeline - INFO - Early stopping triggered at epoch 48
2026-06-12 20:30:33,031 - preprocessing - INFO - xAPI engineered features created: ['engagement_score', 'absence_risk', 'parent_support_signal']
2026-06-12 20:30:33,038 - preprocessing - INFO - xAPI engineered features created: ['engagement_score', 'absence_risk', 'parent_support_signal']
2026-06-12 20:30:33,052 - preprocessing - INFO - Applying ADASYN on train set with ratio 0.6818639805885657...
2026-06-12 20:30:33,059 - preprocessing - WARNING - ADASYN failed (likely too few samples). Error: No samples will be generated with the provided ratio settings.. Falling back to no oversampling.
2026-06-12 20:30:33,177 - preprocessing - INFO - Feature selection complete. Selected 18 / 19 features.
2026-06-12 20:30:35,385 - train_pipeline - INFO - Early stopping triggered at epoch 46
[I 2026-06-12 20:30:35,385] Trial 39 finished with value: 0.7864760161392498 and parameters: {'learning_rate': 0.0033208558990771206, 'weight_decay': 0.0005636889656917444, 'batch_size': 64, 'oversample_method': 'adasyn', 'smote_ratio': 0.6818639805885657, 'cnn_channels': 32, 'lstm_hidden_dim': 32, 'context_hidden_dim': 128, 'fusion_hidden_dim': 64, 'dropout': 0.40015604906880115}. Best is trial 23 with value: 0.8021730167770063.
2026-06-12 20:30:35,397 - preprocessing - INFO - xAPI engineered features created: ['engagement_score', 'absence_risk', 'parent_support_signal']
2026-06-12 20:30:35,397 - preprocessing - INFO - xAPI engineered features created: ['engagement_score', 'absence_risk', 'parent_support_signal']
2026-06-12 20:30:35,420 - preprocessing - INFO - Applying ADASYN on train set with ratio 0.7561443871497251...
2026-06-12 20:30:35,430 - preprocessing - WARNING - ADASYN failed (likely too few samples). Error: No samples will be generated with the provided ratio settings.. Falling back to no oversampling.
2026-06-12 20:30:35,563 - preprocessing - INFO - Feature selection complete. Selected 15 / 19 features.
2026-06-12 20:30:38,199 - train_pipeline - INFO - Early stopping triggered at epoch 17
2026-06-12 20:30:38,199 - preprocessing - INFO - xAPI engineered features created: ['engagement_score', 'absence_risk', 'parent_support_signal']
2026-06-12 20:30:38,199 - preprocessing - INFO - xAPI engineered features created: ['engagement_score', 'absence_risk', 'parent_support_signal']
2026-06-12 20:30:38,228 - preprocessing - INFO - Applying ADASYN on train set with ratio 0.7561443871497251...
2026-06-12 20:30:38,243 - preprocessing - WARNING - ADASYN failed (likely too few samples). Error: No samples will be generated with the provided ratio settings.. Falling back to no oversampling.
2026-06-12 20:30:38,366 - preprocessing - INFO - Feature selection complete. Selected 16 / 19 features.
2026-06-12 20:30:41,502 - train_pipeline - INFO - Early stopping triggered at epoch 20
2026-06-12 20:30:41,504 - preprocessing - INFO - xAPI engineered features created: ['engagement_score', 'absence_risk', 'parent_support_signal']
2026-06-12 20:30:41,505 - preprocessing - INFO - xAPI engineered features created: ['engagement_score', 'absence_risk', 'parent_support_signal']
2026-06-12 20:30:41,524 - preprocessing - INFO - Applying ADASYN on train set with ratio 0.7561443871497251...
2026-06-12 20:30:41,540 - preprocessing - WARNING - ADASYN failed (likely too few samples). Error: No samples will be generated with the provided ratio settings.. Falling back to no oversampling.
2026-06-12 20:30:41,661 - preprocessing - INFO - Feature selection complete. Selected 18 / 19 features.
2026-06-12 20:30:46,632 - train_pipeline - INFO - Early stopping triggered at epoch 31
2026-06-12 20:30:46,635 - preprocessing - INFO - xAPI engineered features created: ['engagement_score', 'absence_risk', 'parent_support_signal']
2026-06-12 20:30:46,635 - preprocessing - INFO - xAPI engineered features created: ['engagement_score', 'absence_risk', 'parent_support_signal']
2026-06-12 20:30:46,658 - preprocessing - INFO - Applying ADASYN on train set with ratio 0.7561443871497251...
2026-06-12 20:30:46,673 - preprocessing - WARNING - ADASYN failed (likely too few samples). Error: No samples will be generated with the provided ratio settings.. Falling back to no oversampling.
2026-06-12 20:30:46,795 - preprocessing - INFO - Feature selection complete. Selected 16 / 19 features.
2026-06-12 20:30:54,538 - train_pipeline - INFO - Early stopping triggered at epoch 49
2026-06-12 20:30:54,557 - preprocessing - INFO - xAPI engineered features created: ['engagement_score', 'absence_risk', 'parent_support_signal']
2026-06-12 20:30:54,558 - preprocessing - INFO - xAPI engineered features created: ['engagement_score', 'absence_risk', 'parent_support_signal']
2026-06-12 20:30:54,572 - preprocessing - INFO - Applying ADASYN on train set with ratio 0.7561443871497251...
2026-06-12 20:30:54,586 - preprocessing - WARNING - ADASYN failed (likely too few samples). Error: No samples will be generated with the provided ratio settings.. Falling back to no oversampling.
2026-06-12 20:30:54,729 - preprocessing - INFO - Feature selection complete. Selected 18 / 19 features.
2026-06-12 20:31:00,692 - train_pipeline - INFO - Early stopping triggered at epoch 37
[I 2026-06-12 20:31:00,692] Trial 40 finished with value: 0.7861961689196983 and parameters: {'learning_rate': 0.0016239855120270706, 'weight_decay': 0.0005745415960651678, 'batch_size': 16, 'oversample_method': 'adasyn', 'smote_ratio': 0.7561443871497251, 'cnn_channels': 64, 'lstm_hidden_dim': 64, 'context_hidden_dim': 128, 'fusion_hidden_dim': 32, 'dropout': 0.3760212441914105}. Best is trial 23 with value: 0.8021730167770063.
2026-06-12 20:31:00,704 - preprocessing - INFO - xAPI engineered features created: ['engagement_score', 'absence_risk', 'parent_support_signal']
2026-06-12 20:31:00,704 - preprocessing - INFO - xAPI engineered features created: ['engagement_score', 'absence_risk', 'parent_support_signal']
2026-06-12 20:31:00,725 - preprocessing - INFO - Applying ADASYN on train set with ratio 0.6204303607106698...
2026-06-12 20:31:00,725 - preprocessing - WARNING - ADASYN failed (likely too few samples). Error: No samples will be generated with the provided ratio settings.. Falling back to no oversampling.
2026-06-12 20:31:00,862 - preprocessing - INFO - Feature selection complete. Selected 15 / 19 features.
2026-06-12 20:31:03,854 - train_pipeline - INFO - Early stopping triggered at epoch 19
2026-06-12 20:31:03,854 - preprocessing - INFO - xAPI engineered features created: ['engagement_score', 'absence_risk', 'parent_support_signal']
2026-06-12 20:31:03,854 - preprocessing - INFO - xAPI engineered features created: ['engagement_score', 'absence_risk', 'parent_support_signal']
2026-06-12 20:31:03,884 - preprocessing - INFO - Applying ADASYN on train set with ratio 0.6204303607106698...
2026-06-12 20:31:03,889 - preprocessing - WARNING - ADASYN failed (likely too few samples). Error: No samples will be generated with the provided ratio settings.. Falling back to no oversampling.
2026-06-12 20:31:04,021 - preprocessing - INFO - Feature selection complete. Selected 16 / 19 features.
2026-06-12 20:31:10,224 - train_pipeline - INFO - Early stopping triggered at epoch 40
2026-06-12 20:31:10,224 - preprocessing - INFO - xAPI engineered features created: ['engagement_score', 'absence_risk', 'parent_support_signal']
2026-06-12 20:31:10,230 - preprocessing - INFO - xAPI engineered features created: ['engagement_score', 'absence_risk', 'parent_support_signal']
2026-06-12 20:31:10,244 - preprocessing - INFO - Applying ADASYN on train set with ratio 0.6204303607106698...
2026-06-12 20:31:10,253 - preprocessing - WARNING - ADASYN failed (likely too few samples). Error: No samples will be generated with the provided ratio settings.. Falling back to no oversampling.
2026-06-12 20:31:10,378 - preprocessing - INFO - Feature selection complete. Selected 18 / 19 features.
2026-06-12 20:31:14,107 - train_pipeline - INFO - Early stopping triggered at epoch 24
2026-06-12 20:31:14,123 - preprocessing - INFO - xAPI engineered features created: ['engagement_score', 'absence_risk', 'parent_support_signal']
2026-06-12 20:31:14,123 - preprocessing - INFO - xAPI engineered features created: ['engagement_score', 'absence_risk', 'parent_support_signal']
2026-06-12 20:31:14,135 - preprocessing - INFO - Applying ADASYN on train set with ratio 0.6204303607106698...
2026-06-12 20:31:14,151 - preprocessing - WARNING - ADASYN failed (likely too few samples). Error: No samples will be generated with the provided ratio settings.. Falling back to no oversampling.
2026-06-12 20:31:14,288 - preprocessing - INFO - Feature selection complete. Selected 16 / 19 features.
2026-06-12 20:31:17,709 - train_pipeline - INFO - Early stopping triggered at epoch 22
2026-06-12 20:31:17,709 - preprocessing - INFO - xAPI engineered features created: ['engagement_score', 'absence_risk', 'parent_support_signal']
2026-06-12 20:31:17,709 - preprocessing - INFO - xAPI engineered features created: ['engagement_score', 'absence_risk', 'parent_support_signal']
2026-06-12 20:31:17,736 - preprocessing - INFO - Applying ADASYN on train set with ratio 0.6204303607106698...
2026-06-12 20:31:17,736 - preprocessing - WARNING - ADASYN failed (likely too few samples). Error: No samples will be generated with the provided ratio settings.. Falling back to no oversampling.
2026-06-12 20:31:17,868 - preprocessing - INFO - Feature selection complete. Selected 18 / 19 features.
2026-06-12 20:31:23,988 - train_pipeline - INFO - Early stopping triggered at epoch 39
[I 2026-06-12 20:31:23,988] Trial 41 finished with value: 0.7777726059872767 and parameters: {'learning_rate': 0.004436281750947672, 'weight_decay': 0.0003072450953929343, 'batch_size': 16, 'oversample_method': 'adasyn', 'smote_ratio': 0.6204303607106698, 'cnn_channels': 16, 'lstm_hidden_dim': 64, 'context_hidden_dim': 128, 'fusion_hidden_dim': 128, 'dropout': 0.4222975289289036}. Best is trial 23 with value: 0.8021730167770063.
2026-06-12 20:31:24,002 - preprocessing - INFO - xAPI engineered features created: ['engagement_score', 'absence_risk', 'parent_support_signal']
2026-06-12 20:31:24,002 - preprocessing - INFO - xAPI engineered features created: ['engagement_score', 'absence_risk', 'parent_support_signal']
2026-06-12 20:31:24,022 - preprocessing - INFO - Applying ADASYN on train set with ratio 0.6608610911070035...
2026-06-12 20:31:24,032 - preprocessing - WARNING - ADASYN failed (likely too few samples). Error: No samples will be generated with the provided ratio settings.. Falling back to no oversampling.
2026-06-12 20:31:24,160 - preprocessing - INFO - Feature selection complete. Selected 15 / 19 features.
2026-06-12 20:31:31,888 - preprocessing - INFO - xAPI engineered features created: ['engagement_score', 'absence_risk', 'parent_support_signal']
2026-06-12 20:31:31,888 - preprocessing - INFO - xAPI engineered features created: ['engagement_score', 'absence_risk', 'parent_support_signal']
2026-06-12 20:31:31,911 - preprocessing - INFO - Applying ADASYN on train set with ratio 0.6608610911070035...
2026-06-12 20:31:31,911 - preprocessing - WARNING - ADASYN failed (likely too few samples). Error: No samples will be generated with the provided ratio settings.. Falling back to no oversampling.
2026-06-12 20:31:32,048 - preprocessing - INFO - Feature selection complete. Selected 16 / 19 features.
2026-06-12 20:31:34,796 - train_pipeline - INFO - Early stopping triggered at epoch 16
2026-06-12 20:31:34,796 - preprocessing - INFO - xAPI engineered features created: ['engagement_score', 'absence_risk', 'parent_support_signal']
2026-06-12 20:31:34,803 - preprocessing - INFO - xAPI engineered features created: ['engagement_score', 'absence_risk', 'parent_support_signal']
2026-06-12 20:31:34,824 - preprocessing - INFO - Applying ADASYN on train set with ratio 0.6608610911070035...
2026-06-12 20:31:34,831 - preprocessing - WARNING - ADASYN failed (likely too few samples). Error: No samples will be generated with the provided ratio settings.. Falling back to no oversampling.
2026-06-12 20:31:34,962 - preprocessing - INFO - Feature selection complete. Selected 18 / 19 features.
2026-06-12 20:31:38,265 - train_pipeline - INFO - Early stopping triggered at epoch 21
2026-06-12 20:31:38,265 - preprocessing - INFO - xAPI engineered features created: ['engagement_score', 'absence_risk', 'parent_support_signal']
2026-06-12 20:31:38,271 - preprocessing - INFO - xAPI engineered features created: ['engagement_score', 'absence_risk', 'parent_support_signal']
2026-06-12 20:31:38,285 - preprocessing - INFO - Applying ADASYN on train set with ratio 0.6608610911070035...
2026-06-12 20:31:38,292 - preprocessing - WARNING - ADASYN failed (likely too few samples). Error: No samples will be generated with the provided ratio settings.. Falling back to no oversampling.
2026-06-12 20:31:38,425 - preprocessing - INFO - Feature selection complete. Selected 16 / 19 features.
2026-06-12 20:31:43,315 - train_pipeline - INFO - Early stopping triggered at epoch 31
2026-06-12 20:31:43,322 - preprocessing - INFO - xAPI engineered features created: ['engagement_score', 'absence_risk', 'parent_support_signal']
2026-06-12 20:31:43,322 - preprocessing - INFO - xAPI engineered features created: ['engagement_score', 'absence_risk', 'parent_support_signal']
2026-06-12 20:31:43,343 - preprocessing - INFO - Applying ADASYN on train set with ratio 0.6608610911070035...
2026-06-12 20:31:43,350 - preprocessing - WARNING - ADASYN failed (likely too few samples). Error: No samples will be generated with the provided ratio settings.. Falling back to no oversampling.
2026-06-12 20:31:43,488 - preprocessing - INFO - Feature selection complete. Selected 18 / 19 features.
2026-06-12 20:31:46,291 - train_pipeline - INFO - Early stopping triggered at epoch 18
