[I 2026-06-12 19:55:21,895] Trial 34 finished with value: 0.8427479820314033 and parameters: {'learning_rate': 0.0026630174633182294, 'weight_decay': 0.0009614509132087757, 'batch_size': 16, 'oversample_method': 'adasyn', 'smote_ratio': 0.4320880447593562, 'cnn_channels': 32, 'lstm_hidden_dim': 32, 'context_hidden_dim': 64, 'fusion_hidden_dim': 32, 'dropout': 0.14126167589868072}. Best is trial 21 with value: 0.8897981256933332.
2026-06-12 19:55:21,902 - preprocessing - INFO - Student engineered features created: ['grade_growth', 'grade_avg', 'absence_study_ratio', 'failure_risk', 'alcohol_risk', 'social_risk']
2026-06-12 19:55:21,902 - preprocessing - INFO - Student engineered features created: ['grade_growth', 'grade_avg', 'absence_study_ratio', 'failure_risk', 'alcohol_risk', 'social_risk']
2026-06-12 19:55:21,960 - preprocessing - INFO - Applying ADASYN on train set with ratio 0.4507571925869381...
2026-06-12 19:55:22,189 - preprocessing - INFO - Feature selection complete. Selected 30 / 38 features.
2026-06-12 19:55:25,655 - train_pipeline - INFO - Early stopping triggered at epoch 40
2026-06-12 19:55:25,655 - preprocessing - INFO - Student engineered features created: ['grade_growth', 'grade_avg', 'absence_study_ratio', 'failure_risk', 'alcohol_risk', 'social_risk']
2026-06-12 19:55:25,655 - preprocessing - INFO - Student engineered features created: ['grade_growth', 'grade_avg', 'absence_study_ratio', 'failure_risk', 'alcohol_risk', 'social_risk']
2026-06-12 19:55:25,706 - preprocessing - INFO - Applying ADASYN on train set with ratio 0.4507571925869381...
2026-06-12 19:55:25,935 - preprocessing - INFO - Feature selection complete. Selected 33 / 38 features.
2026-06-12 19:55:29,235 - train_pipeline - INFO - Early stopping triggered at epoch 38
2026-06-12 19:55:29,235 - preprocessing - INFO - Student engineered features created: ['grade_growth', 'grade_avg', 'absence_study_ratio', 'failure_risk', 'alcohol_risk', 'social_risk']
2026-06-12 19:55:29,235 - preprocessing - INFO - Student engineered features created: ['grade_growth', 'grade_avg', 'absence_study_ratio', 'failure_risk', 'alcohol_risk', 'social_risk']
2026-06-12 19:55:29,290 - preprocessing - INFO - Applying ADASYN on train set with ratio 0.4507571925869381...
2026-06-12 19:55:29,510 - preprocessing - INFO - Feature selection complete. Selected 29 / 38 features.
2026-06-12 19:55:31,126 - train_pipeline - INFO - Early stopping triggered at epoch 21
2026-06-12 19:55:31,133 - preprocessing - INFO - Student engineered features created: ['grade_growth', 'grade_avg', 'absence_study_ratio', 'failure_risk', 'alcohol_risk', 'social_risk']
2026-06-12 19:55:31,136 - preprocessing - INFO - Student engineered features created: ['grade_growth', 'grade_avg', 'absence_study_ratio', 'failure_risk', 'alcohol_risk', 'social_risk']
2026-06-12 19:55:31,184 - preprocessing - INFO - Applying ADASYN on train set with ratio 0.4507571925869381...
2026-06-12 19:55:31,418 - preprocessing - INFO - Feature selection complete. Selected 32 / 38 features.
2026-06-12 19:55:33,830 - train_pipeline - INFO - Early stopping triggered at epoch 28
2026-06-12 19:55:33,845 - preprocessing - INFO - Student engineered features created: ['grade_growth', 'grade_avg', 'absence_study_ratio', 'failure_risk', 'alcohol_risk', 'social_risk']
2026-06-12 19:55:33,845 - preprocessing - INFO - Student engineered features created: ['grade_growth', 'grade_avg', 'absence_study_ratio', 'failure_risk', 'alcohol_risk', 'social_risk']
2026-06-12 19:55:33,890 - preprocessing - INFO - Applying ADASYN on train set with ratio 0.4507571925869381...
2026-06-12 19:55:34,121 - preprocessing - INFO - Feature selection complete. Selected 29 / 38 features.
2026-06-12 19:55:35,735 - train_pipeline - INFO - Early stopping triggered at epoch 21
[I 2026-06-12 19:55:35,744] Trial 35 finished with value: 0.8472529262945019 and parameters: {'learning_rate': 0.0017183756131627086, 'weight_decay': 0.000613724703568803, 'batch_size': 64, 'oversample_method': 'adasyn', 'smote_ratio': 0.4507571925869381, 'cnn_channels': 32, 'lstm_hidden_dim': 64, 'context_hidden_dim': 128, 'fusion_hidden_dim': 32, 'dropout': 0.16690246880299925}. Best is trial 21 with value: 0.8897981256933332.
2026-06-12 19:55:35,756 - preprocessing - INFO - Student engineered features created: ['grade_growth', 'grade_avg', 'absence_study_ratio', 'failure_risk', 'alcohol_risk', 'social_risk']
2026-06-12 19:55:35,760 - preprocessing - INFO - Student engineered features created: ['grade_growth', 'grade_avg', 'absence_study_ratio', 'failure_risk', 'alcohol_risk', 'social_risk']
2026-06-12 19:55:35,805 - preprocessing - INFO - Applying ADASYN on train set with ratio 0.9905908890100978...
2026-06-12 19:55:36,028 - preprocessing - INFO - Feature selection complete. Selected 37 / 38 features.
2026-06-12 19:55:39,482 - train_pipeline - INFO - Early stopping triggered at epoch 29
2026-06-12 19:55:39,491 - preprocessing - INFO - Student engineered features created: ['grade_growth', 'grade_avg', 'absence_study_ratio', 'failure_risk', 'alcohol_risk', 'social_risk']
2026-06-12 19:55:39,494 - preprocessing - INFO - Student engineered features created: ['grade_growth', 'grade_avg', 'absence_study_ratio', 'failure_risk', 'alcohol_risk', 'social_risk']
2026-06-12 19:55:39,530 - preprocessing - INFO - Applying ADASYN on train set with ratio 0.9905908890100978...
2026-06-12 19:55:39,759 - preprocessing - INFO - Feature selection complete. Selected 37 / 38 features.
2026-06-12 19:55:43,367 - train_pipeline - INFO - Early stopping triggered at epoch 30
2026-06-12 19:55:43,372 - preprocessing - INFO - Student engineered features created: ['grade_growth', 'grade_avg', 'absence_study_ratio', 'failure_risk', 'alcohol_risk', 'social_risk']
2026-06-12 19:55:43,373 - preprocessing - INFO - Student engineered features created: ['grade_growth', 'grade_avg', 'absence_study_ratio', 'failure_risk', 'alcohol_risk', 'social_risk']
2026-06-12 19:55:43,422 - preprocessing - INFO - Applying ADASYN on train set with ratio 0.9905908890100978...
2026-06-12 19:55:43,639 - preprocessing - INFO - Feature selection complete. Selected 36 / 38 features.
2026-06-12 19:55:47,862 - train_pipeline - INFO - Early stopping triggered at epoch 35
2026-06-12 19:55:47,869 - preprocessing - INFO - Student engineered features created: ['grade_growth', 'grade_avg', 'absence_study_ratio', 'failure_risk', 'alcohol_risk', 'social_risk']
2026-06-12 19:55:47,873 - preprocessing - INFO - Student engineered features created: ['grade_growth', 'grade_avg', 'absence_study_ratio', 'failure_risk', 'alcohol_risk', 'social_risk']
2026-06-12 19:55:47,910 - preprocessing - INFO - Applying ADASYN on train set with ratio 0.9905908890100978...
2026-06-12 19:55:48,142 - preprocessing - INFO - Feature selection complete. Selected 36 / 38 features.
2026-06-12 19:55:54,231 - preprocessing - INFO - Student engineered features created: ['grade_growth', 'grade_avg', 'absence_study_ratio', 'failure_risk', 'alcohol_risk', 'social_risk']
2026-06-12 19:55:54,236 - preprocessing - INFO - Student engineered features created: ['grade_growth', 'grade_avg', 'absence_study_ratio', 'failure_risk', 'alcohol_risk', 'social_risk']
2026-06-12 19:55:54,272 - preprocessing - INFO - Applying ADASYN on train set with ratio 0.9905908890100978...
2026-06-12 19:55:54,501 - preprocessing - INFO - Feature selection complete. Selected 35 / 38 features.
2026-06-12 19:55:58,254 - train_pipeline - INFO - Early stopping triggered at epoch 31
[I 2026-06-12 19:55:58,254] Trial 36 finished with value: 0.8389001496724159 and parameters: {'learning_rate': 0.003513218016433494, 'weight_decay': 1.8627173354512118e-05, 'batch_size': 64, 'oversample_method': 'adasyn', 'smote_ratio': 0.9905908890100978, 'cnn_channels': 32, 'lstm_hidden_dim': 32, 'context_hidden_dim': 64, 'fusion_hidden_dim': 128, 'dropout': 0.2730521328855092}. Best is trial 21 with value: 0.8897981256933332.
2026-06-12 19:55:58,261 - preprocessing - INFO - Student engineered features created: ['grade_growth', 'grade_avg', 'absence_study_ratio', 'failure_risk', 'alcohol_risk', 'social_risk']
2026-06-12 19:55:58,274 - preprocessing - INFO - Student engineered features created: ['grade_growth', 'grade_avg', 'absence_study_ratio', 'failure_risk', 'alcohol_risk', 'social_risk']
2026-06-12 19:55:58,310 - preprocessing - INFO - Applying SMOTE on train set with ratio 0.6903770248762586...
2026-06-12 19:55:58,534 - preprocessing - INFO - Feature selection complete. Selected 33 / 38 features.
2026-06-12 19:56:04,859 - train_pipeline - INFO - Early stopping triggered at epoch 21
2026-06-12 19:56:04,873 - preprocessing - INFO - Student engineered features created: ['grade_growth', 'grade_avg', 'absence_study_ratio', 'failure_risk', 'alcohol_risk', 'social_risk']
2026-06-12 19:56:04,877 - preprocessing - INFO - Student engineered features created: ['grade_growth', 'grade_avg', 'absence_study_ratio', 'failure_risk', 'alcohol_risk', 'social_risk']
2026-06-12 19:56:04,921 - preprocessing - INFO - Applying SMOTE on train set with ratio 0.6903770248762586...
2026-06-12 19:56:05,146 - preprocessing - INFO - Feature selection complete. Selected 34 / 38 features.
2026-06-12 19:56:11,750 - train_pipeline - INFO - Early stopping triggered at epoch 22
2026-06-12 19:56:11,756 - preprocessing - INFO - Student engineered features created: ['grade_growth', 'grade_avg', 'absence_study_ratio', 'failure_risk', 'alcohol_risk', 'social_risk']
2026-06-12 19:56:11,756 - preprocessing - INFO - Student engineered features created: ['grade_growth', 'grade_avg', 'absence_study_ratio', 'failure_risk', 'alcohol_risk', 'social_risk']
2026-06-12 19:56:11,810 - preprocessing - INFO - Applying SMOTE on train set with ratio 0.6903770248762586...
2026-06-12 19:56:12,026 - preprocessing - INFO - Feature selection complete. Selected 34 / 38 features.
2026-06-12 19:56:25,657 - train_pipeline - INFO - Early stopping triggered at epoch 45
2026-06-12 19:56:25,664 - preprocessing - INFO - Student engineered features created: ['grade_growth', 'grade_avg', 'absence_study_ratio', 'failure_risk', 'alcohol_risk', 'social_risk']
2026-06-12 19:56:25,670 - preprocessing - INFO - Student engineered features created: ['grade_growth', 'grade_avg', 'absence_study_ratio', 'failure_risk', 'alcohol_risk', 'social_risk']
2026-06-12 19:56:25,706 - preprocessing - INFO - Applying SMOTE on train set with ratio 0.6903770248762586...
2026-06-12 19:56:25,930 - preprocessing - INFO - Feature selection complete. Selected 35 / 38 features.
2026-06-12 19:56:30,812 - train_pipeline - INFO - Early stopping triggered at epoch 16
2026-06-12 19:56:30,827 - preprocessing - INFO - Student engineered features created: ['grade_growth', 'grade_avg', 'absence_study_ratio', 'failure_risk', 'alcohol_risk', 'social_risk']
2026-06-12 19:56:30,827 - preprocessing - INFO - Student engineered features created: ['grade_growth', 'grade_avg', 'absence_study_ratio', 'failure_risk', 'alcohol_risk', 'social_risk']
2026-06-12 19:56:30,874 - preprocessing - INFO - Applying SMOTE on train set with ratio 0.6903770248762586...
2026-06-12 19:56:31,084 - preprocessing - INFO - Feature selection complete. Selected 33 / 38 features.
2026-06-12 19:56:37,562 - train_pipeline - INFO - Early stopping triggered at epoch 21
[I 2026-06-12 19:56:37,562] Trial 37 finished with value: 0.8305932327021541 and parameters: {'learning_rate': 0.004832897207856187, 'weight_decay': 7.838260459489683e-05, 'batch_size': 16, 'oversample_method': 'smote', 'smote_ratio': 0.6903770248762586, 'cnn_channels': 64, 'lstm_hidden_dim': 64, 'context_hidden_dim': 32, 'fusion_hidden_dim': 32, 'dropout': 0.19350885119419783}. Best is trial 21 with value: 0.8897981256933332.
2026-06-12 19:56:37,576 - preprocessing - INFO - Student engineered features created: ['grade_growth', 'grade_avg', 'absence_study_ratio', 'failure_risk', 'alcohol_risk', 'social_risk']
2026-06-12 19:56:37,576 - preprocessing - INFO - Student engineered features created: ['grade_growth', 'grade_avg', 'absence_study_ratio', 'failure_risk', 'alcohol_risk', 'social_risk']
2026-06-12 19:56:37,624 - preprocessing - INFO - Applying ADASYN on train set with ratio 0.5073854175698868...
2026-06-12 19:56:37,846 - preprocessing - INFO - Feature selection complete. Selected 31 / 38 features.
2026-06-12 19:56:42,269 - train_pipeline - INFO - Early stopping triggered at epoch 49
2026-06-12 19:56:42,286 - preprocessing - INFO - Student engineered features created: ['grade_growth', 'grade_avg', 'absence_study_ratio', 'failure_risk', 'alcohol_risk', 'social_risk']
2026-06-12 19:56:42,286 - preprocessing - INFO - Student engineered features created: ['grade_growth', 'grade_avg', 'absence_study_ratio', 'failure_risk', 'alcohol_risk', 'social_risk']
2026-06-12 19:56:42,330 - preprocessing - INFO - Applying ADASYN on train set with ratio 0.5073854175698868...
2026-06-12 19:56:42,557 - preprocessing - INFO - Feature selection complete. Selected 33 / 38 features.
2026-06-12 19:56:45,751 - train_pipeline - INFO - Early stopping triggered at epoch 38
2026-06-12 19:56:45,756 - preprocessing - INFO - Student engineered features created: ['grade_growth', 'grade_avg', 'absence_study_ratio', 'failure_risk', 'alcohol_risk', 'social_risk']
2026-06-12 19:56:45,756 - preprocessing - INFO - Student engineered features created: ['grade_growth', 'grade_avg', 'absence_study_ratio', 'failure_risk', 'alcohol_risk', 'social_risk']
2026-06-12 19:56:45,806 - preprocessing - INFO - Applying ADASYN on train set with ratio 0.5073854175698868...
2026-06-12 19:56:46,033 - preprocessing - INFO - Feature selection complete. Selected 30 / 38 features.
2026-06-12 19:56:47,621 - train_pipeline - INFO - Early stopping triggered at epoch 19
2026-06-12 19:56:47,621 - preprocessing - INFO - Student engineered features created: ['grade_growth', 'grade_avg', 'absence_study_ratio', 'failure_risk', 'alcohol_risk', 'social_risk']
2026-06-12 19:56:47,621 - preprocessing - INFO - Student engineered features created: ['grade_growth', 'grade_avg', 'absence_study_ratio', 'failure_risk', 'alcohol_risk', 'social_risk']
2026-06-12 19:56:47,681 - preprocessing - INFO - Applying ADASYN on train set with ratio 0.5073854175698868...
2026-06-12 19:56:47,912 - preprocessing - INFO - Feature selection complete. Selected 34 / 38 features.
2026-06-12 19:56:50,135 - train_pipeline - INFO - Early stopping triggered at epoch 27
2026-06-12 19:56:50,138 - preprocessing - INFO - Student engineered features created: ['grade_growth', 'grade_avg', 'absence_study_ratio', 'failure_risk', 'alcohol_risk', 'social_risk']
2026-06-12 19:56:50,142 - preprocessing - INFO - Student engineered features created: ['grade_growth', 'grade_avg', 'absence_study_ratio', 'failure_risk', 'alcohol_risk', 'social_risk']
2026-06-12 19:56:50,189 - preprocessing - INFO - Applying ADASYN on train set with ratio 0.5073854175698868...
2026-06-12 19:56:50,405 - preprocessing - INFO - Feature selection complete. Selected 32 / 38 features.
2026-06-12 19:56:53,071 - train_pipeline - INFO - Early stopping triggered at epoch 32
[I 2026-06-12 19:56:53,071] Trial 38 finished with value: 0.8598763472290519 and parameters: {'learning_rate': 0.0019897805942214798, 'weight_decay': 4.242445619529594e-05, 'batch_size': 64, 'oversample_method': 'adasyn', 'smote_ratio': 0.5073854175698868, 'cnn_channels': 32, 'lstm_hidden_dim': 32, 'context_hidden_dim': 128, 'fusion_hidden_dim': 64, 'dropout': 0.22758043302612843}. Best is trial 21 with value: 0.8897981256933332.
2026-06-12 19:56:53,089 - preprocessing - INFO - Student engineered features created: ['grade_growth', 'grade_avg', 'absence_study_ratio', 'failure_risk', 'alcohol_risk', 'social_risk']
2026-06-12 19:56:53,093 - preprocessing - INFO - Student engineered features created: ['grade_growth', 'grade_avg', 'absence_study_ratio', 'failure_risk', 'alcohol_risk', 'social_risk']
2026-06-12 19:56:53,137 - preprocessing - INFO - Applying SMOTE on train set with ratio 0.4446025270130007...
2026-06-12 19:56:53,345 - preprocessing - INFO - Feature selection complete. Selected 31 / 38 features.
2026-06-12 19:57:00,053 - preprocessing - INFO - Student engineered features created: ['grade_growth', 'grade_avg', 'absence_study_ratio', 'failure_risk', 'alcohol_risk', 'social_risk']
2026-06-12 19:57:00,058 - preprocessing - INFO - Student engineered features created: ['grade_growth', 'grade_avg', 'absence_study_ratio', 'failure_risk', 'alcohol_risk', 'social_risk']
2026-06-12 19:57:00,104 - preprocessing - INFO - Applying SMOTE on train set with ratio 0.4446025270130007...
2026-06-12 19:57:00,331 - preprocessing - INFO - Feature selection complete. Selected 33 / 38 features.
2026-06-12 19:57:05,374 - train_pipeline - INFO - Early stopping triggered at epoch 36
2026-06-12 19:57:05,388 - preprocessing - INFO - Student engineered features created: ['grade_growth', 'grade_avg', 'absence_study_ratio', 'failure_risk', 'alcohol_risk', 'social_risk']
2026-06-12 19:57:05,390 - preprocessing - INFO - Student engineered features created: ['grade_growth', 'grade_avg', 'absence_study_ratio', 'failure_risk', 'alcohol_risk', 'social_risk']
2026-06-12 19:57:05,430 - preprocessing - INFO - Applying SMOTE on train set with ratio 0.4446025270130007...
2026-06-12 19:57:05,645 - preprocessing - INFO - Feature selection complete. Selected 29 / 38 features.
2026-06-12 19:57:11,466 - train_pipeline - INFO - Early stopping triggered at epoch 44
2026-06-12 19:57:11,474 - preprocessing - INFO - Student engineered features created: ['grade_growth', 'grade_avg', 'absence_study_ratio', 'failure_risk', 'alcohol_risk', 'social_risk']
2026-06-12 19:57:11,477 - preprocessing - INFO - Student engineered features created: ['grade_growth', 'grade_avg', 'absence_study_ratio', 'failure_risk', 'alcohol_risk', 'social_risk']
2026-06-12 19:57:11,521 - preprocessing - INFO - Applying SMOTE on train set with ratio 0.4446025270130007...
2026-06-12 19:57:11,727 - preprocessing - INFO - Feature selection complete. Selected 34 / 38 features.
2026-06-12 19:57:17,382 - train_pipeline - INFO - Early stopping triggered at epoch 43
2026-06-12 19:57:17,387 - preprocessing - INFO - Student engineered features created: ['grade_growth', 'grade_avg', 'absence_study_ratio', 'failure_risk', 'alcohol_risk', 'social_risk']
2026-06-12 19:57:17,390 - preprocessing - INFO - Student engineered features created: ['grade_growth', 'grade_avg', 'absence_study_ratio', 'failure_risk', 'alcohol_risk', 'social_risk']
2026-06-12 19:57:17,435 - preprocessing - INFO - Applying SMOTE on train set with ratio 0.4446025270130007...
2026-06-12 19:57:17,633 - preprocessing - INFO - Feature selection complete. Selected 29 / 38 features.
2026-06-12 19:57:23,802 - train_pipeline - INFO - Early stopping triggered at epoch 47
