[I 2026-06-12 20:23:48,543] Trial 17 finished with value: 0.7664361729722218 and parameters: {'learning_rate': 0.00272385736999759, 'weight_decay': 0.0001961332777211336, 'batch_size': 64, 'oversample_method': 'smote', 'smote_ratio': 0.8508309649921654, 'cnn_channels': 64, 'lstm_hidden_dim': 64, 'context_hidden_dim': 128, 'fusion_hidden_dim': 32, 'dropout': 0.4350220208894419}. Best is trial 1 with value: 0.7981084913133594.
2026-06-12 20:23:48,554 - preprocessing - INFO - xAPI engineered features created: ['engagement_score', 'absence_risk', 'parent_support_signal']
2026-06-12 20:23:48,556 - preprocessing - INFO - xAPI engineered features created: ['engagement_score', 'absence_risk', 'parent_support_signal']
2026-06-12 20:23:48,569 - preprocessing - INFO - Applying ADASYN on train set with ratio 0.7173061754013893...
2026-06-12 20:23:48,585 - preprocessing - WARNING - ADASYN failed (likely too few samples). Error: No samples will be generated with the provided ratio settings.. Falling back to no oversampling.
2026-06-12 20:23:48,731 - preprocessing - INFO - Feature selection complete. Selected 15 / 19 features.
2026-06-12 20:23:52,739 - train_pipeline - INFO - Early stopping triggered at epoch 26
2026-06-12 20:23:52,745 - preprocessing - INFO - xAPI engineered features created: ['engagement_score', 'absence_risk', 'parent_support_signal']
2026-06-12 20:23:52,747 - preprocessing - INFO - xAPI engineered features created: ['engagement_score', 'absence_risk', 'parent_support_signal']
2026-06-12 20:23:52,767 - preprocessing - INFO - Applying ADASYN on train set with ratio 0.7173061754013893...
2026-06-12 20:23:52,774 - preprocessing - WARNING - ADASYN failed (likely too few samples). Error: No samples will be generated with the provided ratio settings.. Falling back to no oversampling.
2026-06-12 20:23:52,898 - preprocessing - INFO - Feature selection complete. Selected 16 / 19 features.
2026-06-12 20:23:57,590 - train_pipeline - INFO - Early stopping triggered at epoch 29
2026-06-12 20:23:57,604 - preprocessing - INFO - xAPI engineered features created: ['engagement_score', 'absence_risk', 'parent_support_signal']
2026-06-12 20:23:57,606 - preprocessing - INFO - xAPI engineered features created: ['engagement_score', 'absence_risk', 'parent_support_signal']
2026-06-12 20:23:57,623 - preprocessing - INFO - Applying ADASYN on train set with ratio 0.7173061754013893...
2026-06-12 20:23:57,630 - preprocessing - WARNING - ADASYN failed (likely too few samples). Error: No samples will be generated with the provided ratio settings.. Falling back to no oversampling.
2026-06-12 20:23:57,772 - preprocessing - INFO - Feature selection complete. Selected 18 / 19 features.
2026-06-12 20:24:01,439 - train_pipeline - INFO - Early stopping triggered at epoch 24
2026-06-12 20:24:01,443 - preprocessing - INFO - xAPI engineered features created: ['engagement_score', 'absence_risk', 'parent_support_signal']
2026-06-12 20:24:01,445 - preprocessing - INFO - xAPI engineered features created: ['engagement_score', 'absence_risk', 'parent_support_signal']
2026-06-12 20:24:01,459 - preprocessing - INFO - Applying ADASYN on train set with ratio 0.7173061754013893...
2026-06-12 20:24:01,466 - preprocessing - WARNING - ADASYN failed (likely too few samples). Error: No samples will be generated with the provided ratio settings.. Falling back to no oversampling.
2026-06-12 20:24:01,608 - preprocessing - INFO - Feature selection complete. Selected 16 / 19 features.
2026-06-12 20:24:04,803 - train_pipeline - INFO - Early stopping triggered at epoch 21
2026-06-12 20:24:04,803 - preprocessing - INFO - xAPI engineered features created: ['engagement_score', 'absence_risk', 'parent_support_signal']
2026-06-12 20:24:04,803 - preprocessing - INFO - xAPI engineered features created: ['engagement_score', 'absence_risk', 'parent_support_signal']
2026-06-12 20:24:04,831 - preprocessing - INFO - Applying ADASYN on train set with ratio 0.7173061754013893...
2026-06-12 20:24:04,831 - preprocessing - WARNING - ADASYN failed (likely too few samples). Error: No samples will be generated with the provided ratio settings.. Falling back to no oversampling.
2026-06-12 20:24:04,974 - preprocessing - INFO - Feature selection complete. Selected 18 / 19 features.
2026-06-12 20:24:08,695 - train_pipeline - INFO - Early stopping triggered at epoch 24
[I 2026-06-12 20:24:08,695] Trial 18 finished with value: 0.7970313222143262 and parameters: {'learning_rate': 0.0067194313349366085, 'weight_decay': 1.6561030243017407e-05, 'batch_size': 16, 'oversample_method': 'adasyn', 'smote_ratio': 0.7173061754013893, 'cnn_channels': 16, 'lstm_hidden_dim': 64, 'context_hidden_dim': 128, 'fusion_hidden_dim': 64, 'dropout': 0.22283497036468547}. Best is trial 1 with value: 0.7981084913133594.
2026-06-12 20:24:08,716 - preprocessing - INFO - xAPI engineered features created: ['engagement_score', 'absence_risk', 'parent_support_signal']
2026-06-12 20:24:08,716 - preprocessing - INFO - xAPI engineered features created: ['engagement_score', 'absence_risk', 'parent_support_signal']
2026-06-12 20:24:08,731 - preprocessing - INFO - Applying ADASYN on train set with ratio 0.731878606291802...
2026-06-12 20:24:08,737 - preprocessing - WARNING - ADASYN failed (likely too few samples). Error: No samples will be generated with the provided ratio settings.. Falling back to no oversampling.
2026-06-12 20:24:08,861 - preprocessing - INFO - Feature selection complete. Selected 15 / 19 features.
2026-06-12 20:24:12,022 - train_pipeline - INFO - Early stopping triggered at epoch 38
2026-06-12 20:24:12,026 - preprocessing - INFO - xAPI engineered features created: ['engagement_score', 'absence_risk', 'parent_support_signal']
2026-06-12 20:24:12,026 - preprocessing - INFO - xAPI engineered features created: ['engagement_score', 'absence_risk', 'parent_support_signal']
2026-06-12 20:24:12,047 - preprocessing - INFO - Applying ADASYN on train set with ratio 0.731878606291802...
2026-06-12 20:24:12,055 - preprocessing - WARNING - ADASYN failed (likely too few samples). Error: No samples will be generated with the provided ratio settings.. Falling back to no oversampling.
2026-06-12 20:24:12,177 - preprocessing - INFO - Feature selection complete. Selected 16 / 19 features.
2026-06-12 20:24:13,785 - train_pipeline - INFO - Early stopping triggered at epoch 19
2026-06-12 20:24:13,785 - preprocessing - INFO - xAPI engineered features created: ['engagement_score', 'absence_risk', 'parent_support_signal']
2026-06-12 20:24:13,785 - preprocessing - INFO - xAPI engineered features created: ['engagement_score', 'absence_risk', 'parent_support_signal']
2026-06-12 20:24:13,801 - preprocessing - INFO - Applying ADASYN on train set with ratio 0.731878606291802...
2026-06-12 20:24:13,817 - preprocessing - WARNING - ADASYN failed (likely too few samples). Error: No samples will be generated with the provided ratio settings.. Falling back to no oversampling.
2026-06-12 20:24:13,947 - preprocessing - INFO - Feature selection complete. Selected 18 / 19 features.
2026-06-12 20:24:15,600 - train_pipeline - INFO - Early stopping triggered at epoch 20
2026-06-12 20:24:15,616 - preprocessing - INFO - xAPI engineered features created: ['engagement_score', 'absence_risk', 'parent_support_signal']
2026-06-12 20:24:15,618 - preprocessing - INFO - xAPI engineered features created: ['engagement_score', 'absence_risk', 'parent_support_signal']
2026-06-12 20:24:15,634 - preprocessing - INFO - Applying ADASYN on train set with ratio 0.731878606291802...
2026-06-12 20:24:15,655 - preprocessing - WARNING - ADASYN failed (likely too few samples). Error: No samples will be generated with the provided ratio settings.. Falling back to no oversampling.
2026-06-12 20:24:15,778 - preprocessing - INFO - Feature selection complete. Selected 16 / 19 features.
2026-06-12 20:24:18,598 - train_pipeline - INFO - Early stopping triggered at epoch 32
2026-06-12 20:24:18,602 - preprocessing - INFO - xAPI engineered features created: ['engagement_score', 'absence_risk', 'parent_support_signal']
2026-06-12 20:24:18,604 - preprocessing - INFO - xAPI engineered features created: ['engagement_score', 'absence_risk', 'parent_support_signal']
2026-06-12 20:24:18,624 - preprocessing - INFO - Applying ADASYN on train set with ratio 0.731878606291802...
2026-06-12 20:24:18,638 - preprocessing - WARNING - ADASYN failed (likely too few samples). Error: No samples will be generated with the provided ratio settings.. Falling back to no oversampling.
2026-06-12 20:24:18,775 - preprocessing - INFO - Feature selection complete. Selected 18 / 19 features.
2026-06-12 20:24:22,165 - train_pipeline - INFO - Early stopping triggered at epoch 37
[I 2026-06-12 20:24:22,167] Trial 19 finished with value: 0.7828899554607411 and parameters: {'learning_rate': 0.007174786036262511, 'weight_decay': 1.3208767627755522e-05, 'batch_size': 32, 'oversample_method': 'adasyn', 'smote_ratio': 0.731878606291802, 'cnn_channels': 16, 'lstm_hidden_dim': 64, 'context_hidden_dim': 32, 'fusion_hidden_dim': 64, 'dropout': 0.2221479002448571}. Best is trial 1 with value: 0.7981084913133594.
2026-06-12 20:24:22,173 - preprocessing - INFO - xAPI engineered features created: ['engagement_score', 'absence_risk', 'parent_support_signal']
2026-06-12 20:24:22,181 - preprocessing - INFO - xAPI engineered features created: ['engagement_score', 'absence_risk', 'parent_support_signal']
2026-06-12 20:24:22,202 - preprocessing - INFO - Applying ADASYN on train set with ratio 0.879732256259673...
2026-06-12 20:24:22,341 - preprocessing - INFO - Feature selection complete. Selected 16 / 19 features.
2026-06-12 20:24:24,203 - train_pipeline - INFO - Early stopping triggered at epoch 29
2026-06-12 20:24:24,207 - preprocessing - INFO - xAPI engineered features created: ['engagement_score', 'absence_risk', 'parent_support_signal']
2026-06-12 20:24:24,207 - preprocessing - INFO - xAPI engineered features created: ['engagement_score', 'absence_risk', 'parent_support_signal']
2026-06-12 20:24:24,223 - preprocessing - INFO - Applying ADASYN on train set with ratio 0.879732256259673...
2026-06-12 20:24:24,383 - preprocessing - INFO - Feature selection complete. Selected 16 / 19 features.
2026-06-12 20:24:27,269 - train_pipeline - INFO - Early stopping triggered at epoch 45
2026-06-12 20:24:27,273 - preprocessing - INFO - xAPI engineered features created: ['engagement_score', 'absence_risk', 'parent_support_signal']
2026-06-12 20:24:27,275 - preprocessing - INFO - xAPI engineered features created: ['engagement_score', 'absence_risk', 'parent_support_signal']
2026-06-12 20:24:27,294 - preprocessing - INFO - Applying ADASYN on train set with ratio 0.879732256259673...
2026-06-12 20:24:27,454 - preprocessing - INFO - Feature selection complete. Selected 17 / 19 features.
2026-06-12 20:24:29,801 - train_pipeline - INFO - Early stopping triggered at epoch 36
2026-06-12 20:24:29,801 - preprocessing - INFO - xAPI engineered features created: ['engagement_score', 'absence_risk', 'parent_support_signal']
2026-06-12 20:24:29,814 - preprocessing - INFO - xAPI engineered features created: ['engagement_score', 'absence_risk', 'parent_support_signal']
2026-06-12 20:24:29,826 - preprocessing - INFO - Applying ADASYN on train set with ratio 0.879732256259673...
2026-06-12 20:24:29,994 - preprocessing - INFO - Feature selection complete. Selected 16 / 19 features.
2026-06-12 20:24:31,575 - train_pipeline - INFO - Early stopping triggered at epoch 26
2026-06-12 20:24:31,575 - preprocessing - INFO - xAPI engineered features created: ['engagement_score', 'absence_risk', 'parent_support_signal']
2026-06-12 20:24:31,575 - preprocessing - INFO - xAPI engineered features created: ['engagement_score', 'absence_risk', 'parent_support_signal']
2026-06-12 20:24:31,589 - preprocessing - INFO - Applying ADASYN on train set with ratio 0.879732256259673...
2026-06-12 20:24:31,743 - preprocessing - INFO - Feature selection complete. Selected 18 / 19 features.
2026-06-12 20:24:32,928 - train_pipeline - INFO - Early stopping triggered at epoch 20
[I 2026-06-12 20:24:32,928] Trial 20 finished with value: 0.7420149066501073 and parameters: {'learning_rate': 0.0006347825801928925, 'weight_decay': 6.294344635788011e-05, 'batch_size': 64, 'oversample_method': 'adasyn', 'smote_ratio': 0.879732256259673, 'cnn_channels': 16, 'lstm_hidden_dim': 64, 'context_hidden_dim': 128, 'fusion_hidden_dim': 64, 'dropout': 0.21421390613204072}. Best is trial 1 with value: 0.7981084913133594.
2026-06-12 20:24:32,941 - preprocessing - INFO - xAPI engineered features created: ['engagement_score', 'absence_risk', 'parent_support_signal']
2026-06-12 20:24:32,941 - preprocessing - INFO - xAPI engineered features created: ['engagement_score', 'absence_risk', 'parent_support_signal']
2026-06-12 20:24:32,964 - preprocessing - INFO - Applying ADASYN on train set with ratio 0.5459461076794953...
2026-06-12 20:24:33,094 - preprocessing - INFO - Feature selection complete. Selected 15 / 19 features.
2026-06-12 20:24:35,543 - train_pipeline - INFO - Early stopping triggered at epoch 16
2026-06-12 20:24:35,543 - preprocessing - INFO - xAPI engineered features created: ['engagement_score', 'absence_risk', 'parent_support_signal']
2026-06-12 20:24:35,543 - preprocessing - INFO - xAPI engineered features created: ['engagement_score', 'absence_risk', 'parent_support_signal']
2026-06-12 20:24:35,568 - preprocessing - INFO - Applying ADASYN on train set with ratio 0.5459461076794953...
2026-06-12 20:24:35,688 - preprocessing - INFO - Feature selection complete. Selected 16 / 19 features.
2026-06-12 20:24:38,525 - train_pipeline - INFO - Early stopping triggered at epoch 18
2026-06-12 20:24:38,526 - preprocessing - INFO - xAPI engineered features created: ['engagement_score', 'absence_risk', 'parent_support_signal']
2026-06-12 20:24:38,530 - preprocessing - INFO - xAPI engineered features created: ['engagement_score', 'absence_risk', 'parent_support_signal']
2026-06-12 20:24:38,547 - preprocessing - INFO - Applying ADASYN on train set with ratio 0.5459461076794953...
2026-06-12 20:24:38,675 - preprocessing - INFO - Feature selection complete. Selected 18 / 19 features.
2026-06-12 20:24:43,162 - train_pipeline - INFO - Early stopping triggered at epoch 29
2026-06-12 20:24:43,162 - preprocessing - INFO - xAPI engineered features created: ['engagement_score', 'absence_risk', 'parent_support_signal']
2026-06-12 20:24:43,178 - preprocessing - INFO - xAPI engineered features created: ['engagement_score', 'absence_risk', 'parent_support_signal']
2026-06-12 20:24:43,195 - preprocessing - INFO - Applying ADASYN on train set with ratio 0.5459461076794953...
2026-06-12 20:24:43,315 - preprocessing - INFO - Feature selection complete. Selected 16 / 19 features.
2026-06-12 20:24:47,657 - train_pipeline - INFO - Early stopping triggered at epoch 28
2026-06-12 20:24:47,672 - preprocessing - INFO - xAPI engineered features created: ['engagement_score', 'absence_risk', 'parent_support_signal']
2026-06-12 20:24:47,672 - preprocessing - INFO - xAPI engineered features created: ['engagement_score', 'absence_risk', 'parent_support_signal']
2026-06-12 20:24:47,688 - preprocessing - INFO - Applying ADASYN on train set with ratio 0.5459461076794953...
2026-06-12 20:24:47,812 - preprocessing - INFO - Feature selection complete. Selected 18 / 19 features.
2026-06-12 20:24:54,392 - train_pipeline - INFO - Early stopping triggered at epoch 42
[I 2026-06-12 20:24:54,392] Trial 21 finished with value: 0.7929959672126909 and parameters: {'learning_rate': 0.005581102255241472, 'weight_decay': 1.5369154045519624e-05, 'batch_size': 16, 'oversample_method': 'adasyn', 'smote_ratio': 0.5459461076794953, 'cnn_channels': 16, 'lstm_hidden_dim': 64, 'context_hidden_dim': 128, 'fusion_hidden_dim': 64, 'dropout': 0.3151965632469761}. Best is trial 1 with value: 0.7981084913133594.
2026-06-12 20:24:54,392 - preprocessing - INFO - xAPI engineered features created: ['engagement_score', 'absence_risk', 'parent_support_signal']
2026-06-12 20:24:54,408 - preprocessing - INFO - xAPI engineered features created: ['engagement_score', 'absence_risk', 'parent_support_signal']
2026-06-12 20:24:54,427 - preprocessing - INFO - Applying ADASYN on train set with ratio 0.5181171450838976...
2026-06-12 20:24:54,552 - preprocessing - INFO - Feature selection complete. Selected 15 / 19 features.
2026-06-12 20:24:57,604 - train_pipeline - INFO - Early stopping triggered at epoch 20
2026-06-12 20:24:57,618 - preprocessing - INFO - xAPI engineered features created: ['engagement_score', 'absence_risk', 'parent_support_signal']
2026-06-12 20:24:57,618 - preprocessing - INFO - xAPI engineered features created: ['engagement_score', 'absence_risk', 'parent_support_signal']
2026-06-12 20:24:57,639 - preprocessing - INFO - Applying ADASYN on train set with ratio 0.5181171450838976...
2026-06-12 20:24:57,767 - preprocessing - INFO - Feature selection complete. Selected 16 / 19 features.
2026-06-12 20:25:01,965 - train_pipeline - INFO - Early stopping triggered at epoch 26
2026-06-12 20:25:01,969 - preprocessing - INFO - xAPI engineered features created: ['engagement_score', 'absence_risk', 'parent_support_signal']
2026-06-12 20:25:01,971 - preprocessing - INFO - xAPI engineered features created: ['engagement_score', 'absence_risk', 'parent_support_signal']
2026-06-12 20:25:01,989 - preprocessing - INFO - Applying ADASYN on train set with ratio 0.5181171450838976...
2026-06-12 20:25:02,119 - preprocessing - INFO - Feature selection complete. Selected 18 / 19 features.
2026-06-12 20:25:06,174 - train_pipeline - INFO - Early stopping triggered at epoch 26
2026-06-12 20:25:06,174 - preprocessing - INFO - xAPI engineered features created: ['engagement_score', 'absence_risk', 'parent_support_signal']
2026-06-12 20:25:06,174 - preprocessing - INFO - xAPI engineered features created: ['engagement_score', 'absence_risk', 'parent_support_signal']
2026-06-12 20:25:06,205 - preprocessing - INFO - Applying ADASYN on train set with ratio 0.5181171450838976...
2026-06-12 20:25:06,331 - preprocessing - INFO - Feature selection complete. Selected 16 / 19 features.
2026-06-12 20:25:10,792 - train_pipeline - INFO - Early stopping triggered at epoch 29
2026-06-12 20:25:10,792 - preprocessing - INFO - xAPI engineered features created: ['engagement_score', 'absence_risk', 'parent_support_signal']
2026-06-12 20:25:10,792 - preprocessing - INFO - xAPI engineered features created: ['engagement_score', 'absence_risk', 'parent_support_signal']
2026-06-12 20:25:10,813 - preprocessing - INFO - Applying ADASYN on train set with ratio 0.5181171450838976...
2026-06-12 20:25:10,953 - preprocessing - INFO - Feature selection complete. Selected 18 / 19 features.
2026-06-12 20:25:14,990 - train_pipeline - INFO - Early stopping triggered at epoch 26
