[I 2026-06-12 19:50:45,520] Trial 19 finished with value: 0.8683003074072978 and parameters: {'learning_rate': 0.006125793929382311, 'weight_decay': 0.00012674356726113278, 'batch_size': 64, 'oversample_method': 'adasyn', 'smote_ratio': 0.7901989792347792, 'cnn_channels': 32, 'lstm_hidden_dim': 64, 'context_hidden_dim': 32, 'fusion_hidden_dim': 32, 'dropout': 0.12682530056904234}. Best is trial 14 with value: 0.8830480130408699.
2026-06-12 19:50:45,527 - preprocessing - INFO - Student engineered features created: ['grade_growth', 'grade_avg', 'absence_study_ratio', 'failure_risk', 'alcohol_risk', 'social_risk']
2026-06-12 19:50:45,539 - preprocessing - INFO - Student engineered features created: ['grade_growth', 'grade_avg', 'absence_study_ratio', 'failure_risk', 'alcohol_risk', 'social_risk']
2026-06-12 19:50:45,582 - preprocessing - INFO - Applying ADASYN on train set with ratio 0.9166283614946407...
2026-06-12 19:50:45,805 - preprocessing - INFO - Feature selection complete. Selected 36 / 38 features.
2026-06-12 19:50:51,632 - preprocessing - INFO - Student engineered features created: ['grade_growth', 'grade_avg', 'absence_study_ratio', 'failure_risk', 'alcohol_risk', 'social_risk']
2026-06-12 19:50:51,648 - preprocessing - INFO - Student engineered features created: ['grade_growth', 'grade_avg', 'absence_study_ratio', 'failure_risk', 'alcohol_risk', 'social_risk']
2026-06-12 19:50:51,694 - preprocessing - INFO - Applying ADASYN on train set with ratio 0.9166283614946407...
2026-06-12 19:50:51,923 - preprocessing - INFO - Feature selection complete. Selected 35 / 38 features.
2026-06-12 19:50:57,699 - preprocessing - INFO - Student engineered features created: ['grade_growth', 'grade_avg', 'absence_study_ratio', 'failure_risk', 'alcohol_risk', 'social_risk']
2026-06-12 19:50:57,715 - preprocessing - INFO - Student engineered features created: ['grade_growth', 'grade_avg', 'absence_study_ratio', 'failure_risk', 'alcohol_risk', 'social_risk']
2026-06-12 19:50:57,758 - preprocessing - INFO - Applying ADASYN on train set with ratio 0.9166283614946407...
2026-06-12 19:50:57,982 - preprocessing - INFO - Feature selection complete. Selected 36 / 38 features.
2026-06-12 19:51:02,947 - train_pipeline - INFO - Early stopping triggered at epoch 42
2026-06-12 19:51:02,961 - preprocessing - INFO - Student engineered features created: ['grade_growth', 'grade_avg', 'absence_study_ratio', 'failure_risk', 'alcohol_risk', 'social_risk']
2026-06-12 19:51:02,966 - preprocessing - INFO - Student engineered features created: ['grade_growth', 'grade_avg', 'absence_study_ratio', 'failure_risk', 'alcohol_risk', 'social_risk']
2026-06-12 19:51:03,010 - preprocessing - INFO - Applying ADASYN on train set with ratio 0.9166283614946407...
2026-06-12 19:51:03,232 - preprocessing - INFO - Feature selection complete. Selected 37 / 38 features.
2026-06-12 19:51:09,114 - preprocessing - INFO - Student engineered features created: ['grade_growth', 'grade_avg', 'absence_study_ratio', 'failure_risk', 'alcohol_risk', 'social_risk']
2026-06-12 19:51:09,114 - preprocessing - INFO - Student engineered features created: ['grade_growth', 'grade_avg', 'absence_study_ratio', 'failure_risk', 'alcohol_risk', 'social_risk']
2026-06-12 19:51:09,156 - preprocessing - INFO - Applying ADASYN on train set with ratio 0.9166283614946407...
2026-06-12 19:51:09,371 - preprocessing - INFO - Feature selection complete. Selected 34 / 38 features.
2026-06-12 19:51:14,508 - train_pipeline - INFO - Early stopping triggered at epoch 44
[I 2026-06-12 19:51:14,512] Trial 20 finished with value: 0.8033905839201825 and parameters: {'learning_rate': 0.0005615064625140983, 'weight_decay': 2.6949879074612896e-05, 'batch_size': 64, 'oversample_method': 'adasyn', 'smote_ratio': 0.9166283614946407, 'cnn_channels': 64, 'lstm_hidden_dim': 64, 'context_hidden_dim': 32, 'fusion_hidden_dim': 32, 'dropout': 0.20574236297518245}. Best is trial 14 with value: 0.8830480130408699.
2026-06-12 19:51:14,523 - preprocessing - INFO - Student engineered features created: ['grade_growth', 'grade_avg', 'absence_study_ratio', 'failure_risk', 'alcohol_risk', 'social_risk']
2026-06-12 19:51:14,526 - preprocessing - INFO - Student engineered features created: ['grade_growth', 'grade_avg', 'absence_study_ratio', 'failure_risk', 'alcohol_risk', 'social_risk']
2026-06-12 19:51:14,574 - preprocessing - INFO - Applying ADASYN on train set with ratio 0.46782851025555244...
2026-06-12 19:51:14,803 - preprocessing - INFO - Feature selection complete. Selected 30 / 38 features.
2026-06-12 19:51:16,450 - train_pipeline - INFO - Early stopping triggered at epoch 19
2026-06-12 19:51:16,455 - preprocessing - INFO - Student engineered features created: ['grade_growth', 'grade_avg', 'absence_study_ratio', 'failure_risk', 'alcohol_risk', 'social_risk']
2026-06-12 19:51:16,457 - preprocessing - INFO - Student engineered features created: ['grade_growth', 'grade_avg', 'absence_study_ratio', 'failure_risk', 'alcohol_risk', 'social_risk']
2026-06-12 19:51:16,503 - preprocessing - INFO - Applying ADASYN on train set with ratio 0.46782851025555244...
2026-06-12 19:51:16,732 - preprocessing - INFO - Feature selection complete. Selected 33 / 38 features.
2026-06-12 19:51:18,546 - train_pipeline - INFO - Early stopping triggered at epoch 21
2026-06-12 19:51:18,549 - preprocessing - INFO - Student engineered features created: ['grade_growth', 'grade_avg', 'absence_study_ratio', 'failure_risk', 'alcohol_risk', 'social_risk']
2026-06-12 19:51:18,554 - preprocessing - INFO - Student engineered features created: ['grade_growth', 'grade_avg', 'absence_study_ratio', 'failure_risk', 'alcohol_risk', 'social_risk']
2026-06-12 19:51:18,600 - preprocessing - INFO - Applying ADASYN on train set with ratio 0.46782851025555244...
2026-06-12 19:51:18,814 - preprocessing - INFO - Feature selection complete. Selected 29 / 38 features.
2026-06-12 19:51:20,339 - train_pipeline - INFO - Early stopping triggered at epoch 20
2026-06-12 19:51:20,346 - preprocessing - INFO - Student engineered features created: ['grade_growth', 'grade_avg', 'absence_study_ratio', 'failure_risk', 'alcohol_risk', 'social_risk']
2026-06-12 19:51:20,349 - preprocessing - INFO - Student engineered features created: ['grade_growth', 'grade_avg', 'absence_study_ratio', 'failure_risk', 'alcohol_risk', 'social_risk']
2026-06-12 19:51:20,395 - preprocessing - INFO - Applying ADASYN on train set with ratio 0.46782851025555244...
2026-06-12 19:51:20,631 - preprocessing - INFO - Feature selection complete. Selected 32 / 38 features.
2026-06-12 19:51:22,559 - train_pipeline - INFO - Early stopping triggered at epoch 22
2026-06-12 19:51:22,567 - preprocessing - INFO - Student engineered features created: ['grade_growth', 'grade_avg', 'absence_study_ratio', 'failure_risk', 'alcohol_risk', 'social_risk']
2026-06-12 19:51:22,570 - preprocessing - INFO - Student engineered features created: ['grade_growth', 'grade_avg', 'absence_study_ratio', 'failure_risk', 'alcohol_risk', 'social_risk']
2026-06-12 19:51:22,617 - preprocessing - INFO - Applying ADASYN on train set with ratio 0.46782851025555244...
2026-06-12 19:51:22,840 - preprocessing - INFO - Feature selection complete. Selected 29 / 38 features.
2026-06-12 19:51:25,767 - train_pipeline - INFO - Early stopping triggered at epoch 38
[I 2026-06-12 19:51:25,767] Trial 21 finished with value: 0.8897981256933332 and parameters: {'learning_rate': 0.0049509130573654235, 'weight_decay': 5.1938026547695015e-05, 'batch_size': 64, 'oversample_method': 'adasyn', 'smote_ratio': 0.46782851025555244, 'cnn_channels': 64, 'lstm_hidden_dim': 64, 'context_hidden_dim': 32, 'fusion_hidden_dim': 32, 'dropout': 0.18467328187693013}. Best is trial 21 with value: 0.8897981256933332.
2026-06-12 19:51:25,782 - preprocessing - INFO - Student engineered features created: ['grade_growth', 'grade_avg', 'absence_study_ratio', 'failure_risk', 'alcohol_risk', 'social_risk']
2026-06-12 19:51:25,782 - preprocessing - INFO - Student engineered features created: ['grade_growth', 'grade_avg', 'absence_study_ratio', 'failure_risk', 'alcohol_risk', 'social_risk']
2026-06-12 19:51:25,827 - preprocessing - INFO - Applying ADASYN on train set with ratio 0.6515115577755366...
2026-06-12 19:51:26,060 - preprocessing - INFO - Feature selection complete. Selected 32 / 38 features.
2026-06-12 19:51:30,881 - preprocessing - INFO - Student engineered features created: ['grade_growth', 'grade_avg', 'absence_study_ratio', 'failure_risk', 'alcohol_risk', 'social_risk']
2026-06-12 19:51:30,884 - preprocessing - INFO - Student engineered features created: ['grade_growth', 'grade_avg', 'absence_study_ratio', 'failure_risk', 'alcohol_risk', 'social_risk']
2026-06-12 19:51:30,928 - preprocessing - INFO - Applying ADASYN on train set with ratio 0.6515115577755366...
2026-06-12 19:51:31,161 - preprocessing - INFO - Feature selection complete. Selected 34 / 38 features.
2026-06-12 19:51:33,964 - train_pipeline - INFO - Early stopping triggered at epoch 28
2026-06-12 19:51:33,974 - preprocessing - INFO - Student engineered features created: ['grade_growth', 'grade_avg', 'absence_study_ratio', 'failure_risk', 'alcohol_risk', 'social_risk']
2026-06-12 19:51:33,977 - preprocessing - INFO - Student engineered features created: ['grade_growth', 'grade_avg', 'absence_study_ratio', 'failure_risk', 'alcohol_risk', 'social_risk']
2026-06-12 19:51:34,029 - preprocessing - INFO - Applying ADASYN on train set with ratio 0.6515115577755366...
2026-06-12 19:51:34,251 - preprocessing - INFO - Feature selection complete. Selected 33 / 38 features.
2026-06-12 19:51:38,841 - train_pipeline - INFO - Early stopping triggered at epoch 46
2026-06-12 19:51:38,841 - preprocessing - INFO - Student engineered features created: ['grade_growth', 'grade_avg', 'absence_study_ratio', 'failure_risk', 'alcohol_risk', 'social_risk']
2026-06-12 19:51:38,841 - preprocessing - INFO - Student engineered features created: ['grade_growth', 'grade_avg', 'absence_study_ratio', 'failure_risk', 'alcohol_risk', 'social_risk']
2026-06-12 19:51:38,890 - preprocessing - INFO - Applying ADASYN on train set with ratio 0.6515115577755366...
2026-06-12 19:51:39,107 - preprocessing - INFO - Feature selection complete. Selected 34 / 38 features.
2026-06-12 19:51:43,942 - preprocessing - INFO - Student engineered features created: ['grade_growth', 'grade_avg', 'absence_study_ratio', 'failure_risk', 'alcohol_risk', 'social_risk']
2026-06-12 19:51:43,942 - preprocessing - INFO - Student engineered features created: ['grade_growth', 'grade_avg', 'absence_study_ratio', 'failure_risk', 'alcohol_risk', 'social_risk']
2026-06-12 19:51:43,997 - preprocessing - INFO - Applying ADASYN on train set with ratio 0.6515115577755366...
2026-06-12 19:51:44,227 - preprocessing - INFO - Feature selection complete. Selected 32 / 38 features.
2026-06-12 19:51:47,096 - train_pipeline - INFO - Early stopping triggered at epoch 30
[I 2026-06-12 19:51:47,096] Trial 22 finished with value: 0.8543551739792541 and parameters: {'learning_rate': 0.0032772562418304997, 'weight_decay': 0.00025211374175150477, 'batch_size': 64, 'oversample_method': 'adasyn', 'smote_ratio': 0.6515115577755366, 'cnn_channels': 64, 'lstm_hidden_dim': 64, 'context_hidden_dim': 32, 'fusion_hidden_dim': 32, 'dropout': 0.10295805138607174}. Best is trial 21 with value: 0.8897981256933332.
2026-06-12 19:51:47,111 - preprocessing - INFO - Student engineered features created: ['grade_growth', 'grade_avg', 'absence_study_ratio', 'failure_risk', 'alcohol_risk', 'social_risk']
2026-06-12 19:51:47,124 - preprocessing - INFO - Student engineered features created: ['grade_growth', 'grade_avg', 'absence_study_ratio', 'failure_risk', 'alcohol_risk', 'social_risk']
2026-06-12 19:51:47,166 - preprocessing - INFO - Applying ADASYN on train set with ratio 0.6169964103764249...
2026-06-12 19:51:47,389 - preprocessing - INFO - Feature selection complete. Selected 34 / 38 features.
2026-06-12 19:51:51,627 - train_pipeline - INFO - Early stopping triggered at epoch 44
2026-06-12 19:51:51,634 - preprocessing - INFO - Student engineered features created: ['grade_growth', 'grade_avg', 'absence_study_ratio', 'failure_risk', 'alcohol_risk', 'social_risk']
2026-06-12 19:51:51,634 - preprocessing - INFO - Student engineered features created: ['grade_growth', 'grade_avg', 'absence_study_ratio', 'failure_risk', 'alcohol_risk', 'social_risk']
2026-06-12 19:51:51,683 - preprocessing - INFO - Applying ADASYN on train set with ratio 0.6169964103764249...
2026-06-12 19:51:51,900 - preprocessing - INFO - Feature selection complete. Selected 34 / 38 features.
2026-06-12 19:51:54,818 - train_pipeline - INFO - Early stopping triggered at epoch 30
2026-06-12 19:51:54,828 - preprocessing - INFO - Student engineered features created: ['grade_growth', 'grade_avg', 'absence_study_ratio', 'failure_risk', 'alcohol_risk', 'social_risk']
2026-06-12 19:51:54,831 - preprocessing - INFO - Student engineered features created: ['grade_growth', 'grade_avg', 'absence_study_ratio', 'failure_risk', 'alcohol_risk', 'social_risk']
2026-06-12 19:51:54,878 - preprocessing - INFO - Applying ADASYN on train set with ratio 0.6169964103764249...
2026-06-12 19:51:55,095 - preprocessing - INFO - Feature selection complete. Selected 34 / 38 features.
2026-06-12 19:51:59,938 - preprocessing - INFO - Student engineered features created: ['grade_growth', 'grade_avg', 'absence_study_ratio', 'failure_risk', 'alcohol_risk', 'social_risk']
2026-06-12 19:51:59,952 - preprocessing - INFO - Student engineered features created: ['grade_growth', 'grade_avg', 'absence_study_ratio', 'failure_risk', 'alcohol_risk', 'social_risk']
2026-06-12 19:52:00,001 - preprocessing - INFO - Applying ADASYN on train set with ratio 0.6169964103764249...
2026-06-12 19:52:00,237 - preprocessing - INFO - Feature selection complete. Selected 35 / 38 features.
2026-06-12 19:52:04,879 - train_pipeline - INFO - Early stopping triggered at epoch 47
2026-06-12 19:52:04,887 - preprocessing - INFO - Student engineered features created: ['grade_growth', 'grade_avg', 'absence_study_ratio', 'failure_risk', 'alcohol_risk', 'social_risk']
2026-06-12 19:52:04,891 - preprocessing - INFO - Student engineered features created: ['grade_growth', 'grade_avg', 'absence_study_ratio', 'failure_risk', 'alcohol_risk', 'social_risk']
2026-06-12 19:52:04,927 - preprocessing - INFO - Applying ADASYN on train set with ratio 0.6169964103764249...
2026-06-12 19:52:05,164 - preprocessing - INFO - Feature selection complete. Selected 32 / 38 features.
2026-06-12 19:52:07,965 - train_pipeline - INFO - Early stopping triggered at epoch 29
[I 2026-06-12 19:52:07,965] Trial 23 finished with value: 0.8443578794412746 and parameters: {'learning_rate': 0.0014913326282836147, 'weight_decay': 9.61154117408517e-05, 'batch_size': 64, 'oversample_method': 'adasyn', 'smote_ratio': 0.6169964103764249, 'cnn_channels': 64, 'lstm_hidden_dim': 64, 'context_hidden_dim': 32, 'fusion_hidden_dim': 32, 'dropout': 0.20561208513497503}. Best is trial 21 with value: 0.8897981256933332.
2026-06-12 19:52:07,979 - preprocessing - INFO - Student engineered features created: ['grade_growth', 'grade_avg', 'absence_study_ratio', 'failure_risk', 'alcohol_risk', 'social_risk']
2026-06-12 19:52:07,979 - preprocessing - INFO - Student engineered features created: ['grade_growth', 'grade_avg', 'absence_study_ratio', 'failure_risk', 'alcohol_risk', 'social_risk']
2026-06-12 19:52:08,021 - preprocessing - INFO - Applying ADASYN on train set with ratio 0.47868205169497763...
2026-06-12 19:52:08,246 - preprocessing - INFO - Feature selection complete. Selected 32 / 38 features.
2026-06-12 19:52:10,147 - train_pipeline - INFO - Early stopping triggered at epoch 22
2026-06-12 19:52:10,147 - preprocessing - INFO - Student engineered features created: ['grade_growth', 'grade_avg', 'absence_study_ratio', 'failure_risk', 'alcohol_risk', 'social_risk']
2026-06-12 19:52:10,164 - preprocessing - INFO - Student engineered features created: ['grade_growth', 'grade_avg', 'absence_study_ratio', 'failure_risk', 'alcohol_risk', 'social_risk']
2026-06-12 19:52:10,206 - preprocessing - INFO - Applying ADASYN on train set with ratio 0.47868205169497763...
2026-06-12 19:52:10,435 - preprocessing - INFO - Feature selection complete. Selected 33 / 38 features.
2026-06-12 19:52:12,245 - train_pipeline - INFO - Early stopping triggered at epoch 21
2026-06-12 19:52:12,252 - preprocessing - INFO - Student engineered features created: ['grade_growth', 'grade_avg', 'absence_study_ratio', 'failure_risk', 'alcohol_risk', 'social_risk']
2026-06-12 19:52:12,258 - preprocessing - INFO - Student engineered features created: ['grade_growth', 'grade_avg', 'absence_study_ratio', 'failure_risk', 'alcohol_risk', 'social_risk']
2026-06-12 19:52:12,308 - preprocessing - INFO - Applying ADASYN on train set with ratio 0.47868205169497763...
2026-06-12 19:52:12,537 - preprocessing - INFO - Feature selection complete. Selected 27 / 38 features.
2026-06-12 19:52:14,035 - train_pipeline - INFO - Early stopping triggered at epoch 17
2026-06-12 19:52:14,042 - preprocessing - INFO - Student engineered features created: ['grade_growth', 'grade_avg', 'absence_study_ratio', 'failure_risk', 'alcohol_risk', 'social_risk']
2026-06-12 19:52:14,049 - preprocessing - INFO - Student engineered features created: ['grade_growth', 'grade_avg', 'absence_study_ratio', 'failure_risk', 'alcohol_risk', 'social_risk']
2026-06-12 19:52:14,091 - preprocessing - INFO - Applying ADASYN on train set with ratio 0.47868205169497763...
2026-06-12 19:52:14,315 - preprocessing - INFO - Feature selection complete. Selected 35 / 38 features.
2026-06-12 19:52:16,075 - train_pipeline - INFO - Early stopping triggered at epoch 19
2026-06-12 19:52:16,089 - preprocessing - INFO - Student engineered features created: ['grade_growth', 'grade_avg', 'absence_study_ratio', 'failure_risk', 'alcohol_risk', 'social_risk']
2026-06-12 19:52:16,093 - preprocessing - INFO - Student engineered features created: ['grade_growth', 'grade_avg', 'absence_study_ratio', 'failure_risk', 'alcohol_risk', 'social_risk']
2026-06-12 19:52:16,137 - preprocessing - INFO - Applying ADASYN on train set with ratio 0.47868205169497763...
2026-06-12 19:52:16,471 - preprocessing - INFO - Feature selection complete. Selected 29 / 38 features.
2026-06-12 19:52:20,321 - train_pipeline - INFO - Early stopping triggered at epoch 43
