2026-06-12 19:39:46,738 - run_pipeline - INFO - Starting approved thesis pipeline for student-por.
2026-06-12 19:39:46,769 - run_pipeline - INFO - Starting Optuna optimization with 50 trials.
[I 2026-06-12 19:39:46,769] A new study created in memory with name: no-name-913d6075-d82e-4187-9cd2-f3e2ed33e4c9
2026-06-12 19:39:46,773 - preprocessing - INFO - Student engineered features created: ['grade_growth', 'grade_avg', 'absence_study_ratio', 'failure_risk', 'alcohol_risk', 'social_risk']
2026-06-12 19:39:46,780 - preprocessing - INFO - Student engineered features created: ['grade_growth', 'grade_avg', 'absence_study_ratio', 'failure_risk', 'alcohol_risk', 'social_risk']
2026-06-12 19:39:46,822 - preprocessing - INFO - Applying SMOTE on train set with ratio 0.8468038954008399...
2026-06-12 19:39:48,500 - preprocessing - INFO - Feature selection complete. Selected 37 / 38 features.
2026-06-12 19:39:57,109 - train_pipeline - INFO - Early stopping triggered at epoch 21
2026-06-12 19:39:57,116 - preprocessing - INFO - Student engineered features created: ['grade_growth', 'grade_avg', 'absence_study_ratio', 'failure_risk', 'alcohol_risk', 'social_risk']
2026-06-12 19:39:57,116 - preprocessing - INFO - Student engineered features created: ['grade_growth', 'grade_avg', 'absence_study_ratio', 'failure_risk', 'alcohol_risk', 'social_risk']
2026-06-12 19:39:57,171 - preprocessing - INFO - Applying SMOTE on train set with ratio 0.8468038954008399...
2026-06-12 19:39:57,394 - preprocessing - INFO - Feature selection complete. Selected 37 / 38 features.
2026-06-12 19:40:06,683 - train_pipeline - INFO - Early stopping triggered at epoch 29
2026-06-12 19:40:06,683 - preprocessing - INFO - Student engineered features created: ['grade_growth', 'grade_avg', 'absence_study_ratio', 'failure_risk', 'alcohol_risk', 'social_risk']
2026-06-12 19:40:06,690 - preprocessing - INFO - Student engineered features created: ['grade_growth', 'grade_avg', 'absence_study_ratio', 'failure_risk', 'alcohol_risk', 'social_risk']
2026-06-12 19:40:06,733 - preprocessing - INFO - Applying SMOTE on train set with ratio 0.8468038954008399...
2026-06-12 19:40:06,940 - preprocessing - INFO - Feature selection complete. Selected 35 / 38 features.
2026-06-12 19:40:20,690 - train_pipeline - INFO - Early stopping triggered at epoch 43
2026-06-12 19:40:20,697 - preprocessing - INFO - Student engineered features created: ['grade_growth', 'grade_avg', 'absence_study_ratio', 'failure_risk', 'alcohol_risk', 'social_risk']
2026-06-12 19:40:20,697 - preprocessing - INFO - Student engineered features created: ['grade_growth', 'grade_avg', 'absence_study_ratio', 'failure_risk', 'alcohol_risk', 'social_risk']
2026-06-12 19:40:20,744 - preprocessing - INFO - Applying SMOTE on train set with ratio 0.8468038954008399...
2026-06-12 19:40:20,960 - preprocessing - INFO - Feature selection complete. Selected 35 / 38 features.
2026-06-12 19:40:32,844 - train_pipeline - INFO - Early stopping triggered at epoch 38
2026-06-12 19:40:32,844 - preprocessing - INFO - Student engineered features created: ['grade_growth', 'grade_avg', 'absence_study_ratio', 'failure_risk', 'alcohol_risk', 'social_risk']
2026-06-12 19:40:32,851 - preprocessing - INFO - Student engineered features created: ['grade_growth', 'grade_avg', 'absence_study_ratio', 'failure_risk', 'alcohol_risk', 'social_risk']
2026-06-12 19:40:32,893 - preprocessing - INFO - Applying SMOTE on train set with ratio 0.8468038954008399...
2026-06-12 19:40:33,144 - preprocessing - INFO - Feature selection complete. Selected 35 / 38 features.
2026-06-12 19:40:41,412 - train_pipeline - INFO - Early stopping triggered at epoch 25
[I 2026-06-12 19:40:41,418] Trial 0 finished with value: 0.8167954911682335 and parameters: {'learning_rate': 0.0030889429487166507, 'weight_decay': 7.30715475958035e-05, 'batch_size': 16, 'oversample_method': 'smote', 'smote_ratio': 0.8468038954008399, 'cnn_channels': 16, 'lstm_hidden_dim': 32, 'context_hidden_dim': 64, 'fusion_hidden_dim': 128, 'dropout': 0.2678464319125041}. Best is trial 0 with value: 0.8167954911682335.
2026-06-12 19:40:41,419 - preprocessing - INFO - Student engineered features created: ['grade_growth', 'grade_avg', 'absence_study_ratio', 'failure_risk', 'alcohol_risk', 'social_risk']
2026-06-12 19:40:41,426 - preprocessing - INFO - Student engineered features created: ['grade_growth', 'grade_avg', 'absence_study_ratio', 'failure_risk', 'alcohol_risk', 'social_risk']
2026-06-12 19:40:41,468 - preprocessing - INFO - Applying ADASYN on train set with ratio 0.7110085725469903...
2026-06-12 19:40:41,704 - preprocessing - INFO - Feature selection complete. Selected 34 / 38 features.
2026-06-12 19:40:56,661 - preprocessing - INFO - Student engineered features created: ['grade_growth', 'grade_avg', 'absence_study_ratio', 'failure_risk', 'alcohol_risk', 'social_risk']
2026-06-12 19:40:56,661 - preprocessing - INFO - Student engineered features created: ['grade_growth', 'grade_avg', 'absence_study_ratio', 'failure_risk', 'alcohol_risk', 'social_risk']
2026-06-12 19:40:56,716 - preprocessing - INFO - Applying ADASYN on train set with ratio 0.7110085725469903...
2026-06-12 19:40:56,959 - preprocessing - INFO - Feature selection complete. Selected 34 / 38 features.
2026-06-12 19:41:11,361 - preprocessing - INFO - Student engineered features created: ['grade_growth', 'grade_avg', 'absence_study_ratio', 'failure_risk', 'alcohol_risk', 'social_risk']
2026-06-12 19:41:11,368 - preprocessing - INFO - Student engineered features created: ['grade_growth', 'grade_avg', 'absence_study_ratio', 'failure_risk', 'alcohol_risk', 'social_risk']
2026-06-12 19:41:11,410 - preprocessing - INFO - Applying ADASYN on train set with ratio 0.7110085725469903...
2026-06-12 19:41:11,639 - preprocessing - INFO - Feature selection complete. Selected 36 / 38 features.
2026-06-12 19:41:26,353 - preprocessing - INFO - Student engineered features created: ['grade_growth', 'grade_avg', 'absence_study_ratio', 'failure_risk', 'alcohol_risk', 'social_risk']
2026-06-12 19:41:26,360 - preprocessing - INFO - Student engineered features created: ['grade_growth', 'grade_avg', 'absence_study_ratio', 'failure_risk', 'alcohol_risk', 'social_risk']
2026-06-12 19:41:26,407 - preprocessing - INFO - Applying ADASYN on train set with ratio 0.7110085725469903...
2026-06-12 19:41:26,638 - preprocessing - INFO - Feature selection complete. Selected 36 / 38 features.
2026-06-12 19:41:42,280 - preprocessing - INFO - Student engineered features created: ['grade_growth', 'grade_avg', 'absence_study_ratio', 'failure_risk', 'alcohol_risk', 'social_risk']
2026-06-12 19:41:42,280 - preprocessing - INFO - Student engineered features created: ['grade_growth', 'grade_avg', 'absence_study_ratio', 'failure_risk', 'alcohol_risk', 'social_risk']
2026-06-12 19:41:42,336 - preprocessing - INFO - Applying ADASYN on train set with ratio 0.7110085725469903...
2026-06-12 19:41:42,547 - preprocessing - INFO - Feature selection complete. Selected 34 / 38 features.
[I 2026-06-12 19:41:57,334] Trial 1 finished with value: 0.7586606087446821 and parameters: {'learning_rate': 0.0001739812799140201, 'weight_decay': 0.00046836725395887934, 'batch_size': 16, 'oversample_method': 'adasyn', 'smote_ratio': 0.7110085725469903, 'cnn_channels': 32, 'lstm_hidden_dim': 32, 'context_hidden_dim': 128, 'fusion_hidden_dim': 64, 'dropout': 0.4351407418297565}. Best is trial 0 with value: 0.8167954911682335.
2026-06-12 19:41:57,334 - preprocessing - INFO - Student engineered features created: ['grade_growth', 'grade_avg', 'absence_study_ratio', 'failure_risk', 'alcohol_risk', 'social_risk']
2026-06-12 19:41:57,334 - preprocessing - INFO - Student engineered features created: ['grade_growth', 'grade_avg', 'absence_study_ratio', 'failure_risk', 'alcohol_risk', 'social_risk']
2026-06-12 19:41:57,384 - preprocessing - INFO - Applying SMOTE on train set with ratio 0.954077335053953...
2026-06-12 19:41:57,594 - preprocessing - INFO - Feature selection complete. Selected 38 / 38 features.
2026-06-12 19:42:16,233 - preprocessing - INFO - Student engineered features created: ['grade_growth', 'grade_avg', 'absence_study_ratio', 'failure_risk', 'alcohol_risk', 'social_risk']
2026-06-12 19:42:16,235 - preprocessing - INFO - Student engineered features created: ['grade_growth', 'grade_avg', 'absence_study_ratio', 'failure_risk', 'alcohol_risk', 'social_risk']
2026-06-12 19:42:16,282 - preprocessing - INFO - Applying SMOTE on train set with ratio 0.954077335053953...
2026-06-12 19:42:16,498 - preprocessing - INFO - Feature selection complete. Selected 37 / 38 features.
2026-06-12 19:42:26,833 - train_pipeline - INFO - Early stopping triggered at epoch 28
2026-06-12 19:42:26,833 - preprocessing - INFO - Student engineered features created: ['grade_growth', 'grade_avg', 'absence_study_ratio', 'failure_risk', 'alcohol_risk', 'social_risk']
2026-06-12 19:42:26,833 - preprocessing - INFO - Student engineered features created: ['grade_growth', 'grade_avg', 'absence_study_ratio', 'failure_risk', 'alcohol_risk', 'social_risk']
2026-06-12 19:42:26,882 - preprocessing - INFO - Applying SMOTE on train set with ratio 0.954077335053953...
2026-06-12 19:42:27,094 - preprocessing - INFO - Feature selection complete. Selected 34 / 38 features.
2026-06-12 19:42:41,513 - train_pipeline - INFO - Early stopping triggered at epoch 39
2026-06-12 19:42:41,523 - preprocessing - INFO - Student engineered features created: ['grade_growth', 'grade_avg', 'absence_study_ratio', 'failure_risk', 'alcohol_risk', 'social_risk']
2026-06-12 19:42:41,526 - preprocessing - INFO - Student engineered features created: ['grade_growth', 'grade_avg', 'absence_study_ratio', 'failure_risk', 'alcohol_risk', 'social_risk']
2026-06-12 19:42:41,569 - preprocessing - INFO - Applying SMOTE on train set with ratio 0.954077335053953...
2026-06-12 19:42:41,791 - preprocessing - INFO - Feature selection complete. Selected 35 / 38 features.
2026-06-12 19:42:49,873 - train_pipeline - INFO - Early stopping triggered at epoch 22
2026-06-12 19:42:49,888 - preprocessing - INFO - Student engineered features created: ['grade_growth', 'grade_avg', 'absence_study_ratio', 'failure_risk', 'alcohol_risk', 'social_risk']
2026-06-12 19:42:49,888 - preprocessing - INFO - Student engineered features created: ['grade_growth', 'grade_avg', 'absence_study_ratio', 'failure_risk', 'alcohol_risk', 'social_risk']
2026-06-12 19:42:49,937 - preprocessing - INFO - Applying SMOTE on train set with ratio 0.954077335053953...
2026-06-12 19:42:50,164 - preprocessing - INFO - Feature selection complete. Selected 35 / 38 features.
2026-06-12 19:43:02,367 - train_pipeline - INFO - Early stopping triggered at epoch 33
[I 2026-06-12 19:43:02,367] Trial 2 finished with value: 0.7907623080312156 and parameters: {'learning_rate': 0.0011586846999604235, 'weight_decay': 1.3485350928021338e-06, 'batch_size': 16, 'oversample_method': 'smote', 'smote_ratio': 0.954077335053953, 'cnn_channels': 32, 'lstm_hidden_dim': 64, 'context_hidden_dim': 32, 'fusion_hidden_dim': 64, 'dropout': 0.26658144382270166}. Best is trial 0 with value: 0.8167954911682335.
2026-06-12 19:43:02,374 - preprocessing - INFO - Student engineered features created: ['grade_growth', 'grade_avg', 'absence_study_ratio', 'failure_risk', 'alcohol_risk', 'social_risk']
2026-06-12 19:43:02,374 - preprocessing - INFO - Student engineered features created: ['grade_growth', 'grade_avg', 'absence_study_ratio', 'failure_risk', 'alcohol_risk', 'social_risk']
2026-06-12 19:43:02,425 - preprocessing - INFO - Applying SMOTE on train set with ratio 0.647046915664896...
2026-06-12 19:43:02,631 - preprocessing - INFO - Feature selection complete. Selected 31 / 38 features.
2026-06-12 19:43:13,377 - train_pipeline - INFO - Early stopping triggered at epoch 38
2026-06-12 19:43:13,377 - preprocessing - INFO - Student engineered features created: ['grade_growth', 'grade_avg', 'absence_study_ratio', 'failure_risk', 'alcohol_risk', 'social_risk']
2026-06-12 19:43:13,377 - preprocessing - INFO - Student engineered features created: ['grade_growth', 'grade_avg', 'absence_study_ratio', 'failure_risk', 'alcohol_risk', 'social_risk']
2026-06-12 19:43:13,434 - preprocessing - INFO - Applying SMOTE on train set with ratio 0.647046915664896...
2026-06-12 19:43:13,657 - preprocessing - INFO - Feature selection complete. Selected 34 / 38 features.
2026-06-12 19:43:22,923 - train_pipeline - INFO - Early stopping triggered at epoch 32
2026-06-12 19:43:22,923 - preprocessing - INFO - Student engineered features created: ['grade_growth', 'grade_avg', 'absence_study_ratio', 'failure_risk', 'alcohol_risk', 'social_risk']
2026-06-12 19:43:22,930 - preprocessing - INFO - Student engineered features created: ['grade_growth', 'grade_avg', 'absence_study_ratio', 'failure_risk', 'alcohol_risk', 'social_risk']
2026-06-12 19:43:22,971 - preprocessing - INFO - Applying SMOTE on train set with ratio 0.647046915664896...
2026-06-12 19:43:23,207 - preprocessing - INFO - Feature selection complete. Selected 32 / 38 features.
2026-06-12 19:43:36,141 - train_pipeline - INFO - Early stopping triggered at epoch 45
2026-06-12 19:43:36,153 - preprocessing - INFO - Student engineered features created: ['grade_growth', 'grade_avg', 'absence_study_ratio', 'failure_risk', 'alcohol_risk', 'social_risk']
2026-06-12 19:43:36,155 - preprocessing - INFO - Student engineered features created: ['grade_growth', 'grade_avg', 'absence_study_ratio', 'failure_risk', 'alcohol_risk', 'social_risk']
2026-06-12 19:43:36,189 - preprocessing - INFO - Applying SMOTE on train set with ratio 0.647046915664896...
2026-06-12 19:43:36,394 - preprocessing - INFO - Feature selection complete. Selected 35 / 38 features.
2026-06-12 19:43:49,306 - train_pipeline - INFO - Early stopping triggered at epoch 46
2026-06-12 19:43:49,306 - preprocessing - INFO - Student engineered features created: ['grade_growth', 'grade_avg', 'absence_study_ratio', 'failure_risk', 'alcohol_risk', 'social_risk']
2026-06-12 19:43:49,306 - preprocessing - INFO - Student engineered features created: ['grade_growth', 'grade_avg', 'absence_study_ratio', 'failure_risk', 'alcohol_risk', 'social_risk']
2026-06-12 19:43:49,371 - preprocessing - INFO - Applying SMOTE on train set with ratio 0.647046915664896...
2026-06-12 19:43:49,571 - preprocessing - INFO - Feature selection complete. Selected 31 / 38 features.
2026-06-12 19:44:01,884 - train_pipeline - INFO - Early stopping triggered at epoch 43
[I 2026-06-12 19:44:01,888] Trial 3 finished with value: 0.8085665454182627 and parameters: {'learning_rate': 0.00048795812526680147, 'weight_decay': 0.0007784302360599614, 'batch_size': 16, 'oversample_method': 'smote', 'smote_ratio': 0.647046915664896, 'cnn_channels': 64, 'lstm_hidden_dim': 32, 'context_hidden_dim': 128, 'fusion_hidden_dim': 64, 'dropout': 0.4747109494098761}. Best is trial 0 with value: 0.8167954911682335.
2026-06-12 19:44:01,890 - preprocessing - INFO - Student engineered features created: ['grade_growth', 'grade_avg', 'absence_study_ratio', 'failure_risk', 'alcohol_risk', 'social_risk']
2026-06-12 19:44:01,897 - preprocessing - INFO - Student engineered features created: ['grade_growth', 'grade_avg', 'absence_study_ratio', 'failure_risk', 'alcohol_risk', 'social_risk']
2026-06-12 19:44:01,946 - preprocessing - INFO - Applying SMOTE on train set with ratio 0.4279056645066991...
2026-06-12 19:44:02,163 - preprocessing - INFO - Feature selection complete. Selected 30 / 38 features.
2026-06-12 19:44:03,585 - train_pipeline - INFO - Early stopping triggered at epoch 20
2026-06-12 19:44:03,599 - preprocessing - INFO - Student engineered features created: ['grade_growth', 'grade_avg', 'absence_study_ratio', 'failure_risk', 'alcohol_risk', 'social_risk']
2026-06-12 19:44:03,601 - preprocessing - INFO - Student engineered features created: ['grade_growth', 'grade_avg', 'absence_study_ratio', 'failure_risk', 'alcohol_risk', 'social_risk']
2026-06-12 19:44:03,654 - preprocessing - INFO - Applying SMOTE on train set with ratio 0.4279056645066991...
2026-06-12 19:44:03,870 - preprocessing - INFO - Feature selection complete. Selected 31 / 38 features.
2026-06-12 19:44:05,228 - train_pipeline - INFO - Early stopping triggered at epoch 19
2026-06-12 19:44:05,228 - preprocessing - INFO - Student engineered features created: ['grade_growth', 'grade_avg', 'absence_study_ratio', 'failure_risk', 'alcohol_risk', 'social_risk']
2026-06-12 19:44:05,228 - preprocessing - INFO - Student engineered features created: ['grade_growth', 'grade_avg', 'absence_study_ratio', 'failure_risk', 'alcohol_risk', 'social_risk']
2026-06-12 19:44:05,285 - preprocessing - INFO - Applying SMOTE on train set with ratio 0.4279056645066991...
2026-06-12 19:44:05,497 - preprocessing - INFO - Feature selection complete. Selected 24 / 38 features.
2026-06-12 19:44:06,987 - train_pipeline - INFO - Early stopping triggered at epoch 21
2026-06-12 19:44:06,991 - preprocessing - INFO - Student engineered features created: ['grade_growth', 'grade_avg', 'absence_study_ratio', 'failure_risk', 'alcohol_risk', 'social_risk']
2026-06-12 19:44:06,994 - preprocessing - INFO - Student engineered features created: ['grade_growth', 'grade_avg', 'absence_study_ratio', 'failure_risk', 'alcohol_risk', 'social_risk']
2026-06-12 19:44:07,047 - preprocessing - INFO - Applying SMOTE on train set with ratio 0.4279056645066991...
2026-06-12 19:44:07,247 - preprocessing - INFO - Feature selection complete. Selected 35 / 38 features.
2026-06-12 19:44:08,541 - train_pipeline - INFO - Early stopping triggered at epoch 18
2026-06-12 19:44:08,541 - preprocessing - INFO - Student engineered features created: ['grade_growth', 'grade_avg', 'absence_study_ratio', 'failure_risk', 'alcohol_risk', 'social_risk']
2026-06-12 19:44:08,541 - preprocessing - INFO - Student engineered features created: ['grade_growth', 'grade_avg', 'absence_study_ratio', 'failure_risk', 'alcohol_risk', 'social_risk']
2026-06-12 19:44:08,592 - preprocessing - INFO - Applying SMOTE on train set with ratio 0.4279056645066991...
2026-06-12 19:44:08,800 - preprocessing - INFO - Feature selection complete. Selected 30 / 38 features.
2026-06-12 19:44:10,259 - train_pipeline - INFO - Early stopping triggered at epoch 20
