[I 2026-06-12 20:20:14,139] Trial 5 finished with value: 0.7167519086011919 and parameters: {'learning_rate': 0.00010513265762291246, 'weight_decay': 9.610729502217583e-05, 'batch_size': 16, 'oversample_method': 'smote', 'smote_ratio': 0.6749734390936835, 'cnn_channels': 16, 'lstm_hidden_dim': 32, 'context_hidden_dim': 64, 'fusion_hidden_dim': 32, 'dropout': 0.10948843038321875}. Best is trial 1 with value: 0.7981084913133594.
2026-06-12 20:20:14,153 - preprocessing - INFO - xAPI engineered features created: ['engagement_score', 'absence_risk', 'parent_support_signal']
2026-06-12 20:20:14,153 - preprocessing - INFO - xAPI engineered features created: ['engagement_score', 'absence_risk', 'parent_support_signal']
2026-06-12 20:20:14,160 - preprocessing - INFO - Applying ADASYN on train set with ratio 0.7839357649929573...
2026-06-12 20:20:14,190 - preprocessing - WARNING - ADASYN failed (likely too few samples). Error: No samples will be generated with the provided ratio settings.. Falling back to no oversampling.
2026-06-12 20:20:14,326 - preprocessing - INFO - Feature selection complete. Selected 15 / 19 features.
2026-06-12 20:20:15,762 - train_pipeline - INFO - Early stopping triggered at epoch 27
2026-06-12 20:20:15,762 - preprocessing - INFO - xAPI engineered features created: ['engagement_score', 'absence_risk', 'parent_support_signal']
2026-06-12 20:20:15,771 - preprocessing - INFO - xAPI engineered features created: ['engagement_score', 'absence_risk', 'parent_support_signal']
2026-06-12 20:20:15,783 - preprocessing - INFO - Applying ADASYN on train set with ratio 0.7839357649929573...
2026-06-12 20:20:15,796 - preprocessing - WARNING - ADASYN failed (likely too few samples). Error: No samples will be generated with the provided ratio settings.. Falling back to no oversampling.
2026-06-12 20:20:15,922 - preprocessing - INFO - Feature selection complete. Selected 16 / 19 features.
2026-06-12 20:20:17,143 - train_pipeline - INFO - Early stopping triggered at epoch 23
2026-06-12 20:20:17,155 - preprocessing - INFO - xAPI engineered features created: ['engagement_score', 'absence_risk', 'parent_support_signal']
2026-06-12 20:20:17,159 - preprocessing - INFO - xAPI engineered features created: ['engagement_score', 'absence_risk', 'parent_support_signal']
2026-06-12 20:20:17,170 - preprocessing - INFO - Applying ADASYN on train set with ratio 0.7839357649929573...
2026-06-12 20:20:17,190 - preprocessing - WARNING - ADASYN failed (likely too few samples). Error: No samples will be generated with the provided ratio settings.. Falling back to no oversampling.
2026-06-12 20:20:17,316 - preprocessing - INFO - Feature selection complete. Selected 18 / 19 features.
2026-06-12 20:20:19,529 - train_pipeline - INFO - Early stopping triggered at epoch 41
2026-06-12 20:20:19,529 - preprocessing - INFO - xAPI engineered features created: ['engagement_score', 'absence_risk', 'parent_support_signal']
2026-06-12 20:20:19,544 - preprocessing - INFO - xAPI engineered features created: ['engagement_score', 'absence_risk', 'parent_support_signal']
2026-06-12 20:20:19,550 - preprocessing - INFO - Applying ADASYN on train set with ratio 0.7839357649929573...
2026-06-12 20:20:19,564 - preprocessing - WARNING - ADASYN failed (likely too few samples). Error: No samples will be generated with the provided ratio settings.. Falling back to no oversampling.
2026-06-12 20:20:19,698 - preprocessing - INFO - Feature selection complete. Selected 16 / 19 features.
2026-06-12 20:20:21,106 - train_pipeline - INFO - Early stopping triggered at epoch 26
2026-06-12 20:20:21,118 - preprocessing - INFO - xAPI engineered features created: ['engagement_score', 'absence_risk', 'parent_support_signal']
2026-06-12 20:20:21,118 - preprocessing - INFO - xAPI engineered features created: ['engagement_score', 'absence_risk', 'parent_support_signal']
2026-06-12 20:20:21,139 - preprocessing - INFO - Applying ADASYN on train set with ratio 0.7839357649929573...
2026-06-12 20:20:21,153 - preprocessing - WARNING - ADASYN failed (likely too few samples). Error: No samples will be generated with the provided ratio settings.. Falling back to no oversampling.
2026-06-12 20:20:21,287 - preprocessing - INFO - Feature selection complete. Selected 18 / 19 features.
2026-06-12 20:20:23,720 - train_pipeline - INFO - Early stopping triggered at epoch 46
[I 2026-06-12 20:20:23,720] Trial 6 finished with value: 0.7690025105378431 and parameters: {'learning_rate': 0.0012209728791387309, 'weight_decay': 5.885183074885359e-06, 'batch_size': 64, 'oversample_method': 'adasyn', 'smote_ratio': 0.7839357649929573, 'cnn_channels': 64, 'lstm_hidden_dim': 64, 'context_hidden_dim': 128, 'fusion_hidden_dim': 128, 'dropout': 0.4047148960776602}. Best is trial 1 with value: 0.7981084913133594.
2026-06-12 20:20:23,720 - preprocessing - INFO - xAPI engineered features created: ['engagement_score', 'absence_risk', 'parent_support_signal']
2026-06-12 20:20:23,720 - preprocessing - INFO - xAPI engineered features created: ['engagement_score', 'absence_risk', 'parent_support_signal']
2026-06-12 20:20:23,733 - preprocessing - INFO - Applying ADASYN on train set with ratio 0.578332899408556...
2026-06-12 20:20:23,872 - preprocessing - INFO - Feature selection complete. Selected 15 / 19 features.
2026-06-12 20:20:25,815 - train_pipeline - INFO - Early stopping triggered at epoch 24
2026-06-12 20:20:25,830 - preprocessing - INFO - xAPI engineered features created: ['engagement_score', 'absence_risk', 'parent_support_signal']
2026-06-12 20:20:25,830 - preprocessing - INFO - xAPI engineered features created: ['engagement_score', 'absence_risk', 'parent_support_signal']
2026-06-12 20:20:25,850 - preprocessing - INFO - Applying ADASYN on train set with ratio 0.578332899408556...
2026-06-12 20:20:25,974 - preprocessing - INFO - Feature selection complete. Selected 16 / 19 features.
2026-06-12 20:20:27,516 - train_pipeline - INFO - Early stopping triggered at epoch 19
2026-06-12 20:20:27,520 - preprocessing - INFO - xAPI engineered features created: ['engagement_score', 'absence_risk', 'parent_support_signal']
2026-06-12 20:20:27,520 - preprocessing - INFO - xAPI engineered features created: ['engagement_score', 'absence_risk', 'parent_support_signal']
2026-06-12 20:20:27,542 - preprocessing - INFO - Applying ADASYN on train set with ratio 0.578332899408556...
2026-06-12 20:20:27,670 - preprocessing - INFO - Feature selection complete. Selected 18 / 19 features.
2026-06-12 20:20:30,347 - train_pipeline - INFO - Early stopping triggered at epoch 33
2026-06-12 20:20:30,347 - preprocessing - INFO - xAPI engineered features created: ['engagement_score', 'absence_risk', 'parent_support_signal']
2026-06-12 20:20:30,352 - preprocessing - INFO - xAPI engineered features created: ['engagement_score', 'absence_risk', 'parent_support_signal']
2026-06-12 20:20:30,366 - preprocessing - INFO - Applying ADASYN on train set with ratio 0.578332899408556...
2026-06-12 20:20:30,490 - preprocessing - INFO - Feature selection complete. Selected 16 / 19 features.
2026-06-12 20:20:34,285 - train_pipeline - INFO - Early stopping triggered at epoch 47
2026-06-12 20:20:34,288 - preprocessing - INFO - xAPI engineered features created: ['engagement_score', 'absence_risk', 'parent_support_signal']
2026-06-12 20:20:34,288 - preprocessing - INFO - xAPI engineered features created: ['engagement_score', 'absence_risk', 'parent_support_signal']
2026-06-12 20:20:34,299 - preprocessing - INFO - Applying ADASYN on train set with ratio 0.578332899408556...
2026-06-12 20:20:34,435 - preprocessing - INFO - Feature selection complete. Selected 18 / 19 features.
2026-06-12 20:20:38,415 - train_pipeline - INFO - Early stopping triggered at epoch 49
[I 2026-06-12 20:20:38,415] Trial 7 finished with value: 0.7876560031416342 and parameters: {'learning_rate': 0.0012078577479654492, 'weight_decay': 2.462130970497609e-06, 'batch_size': 32, 'oversample_method': 'adasyn', 'smote_ratio': 0.578332899408556, 'cnn_channels': 32, 'lstm_hidden_dim': 32, 'context_hidden_dim': 128, 'fusion_hidden_dim': 64, 'dropout': 0.13569770416969137}. Best is trial 1 with value: 0.7981084913133594.
2026-06-12 20:20:38,415 - preprocessing - INFO - xAPI engineered features created: ['engagement_score', 'absence_risk', 'parent_support_signal']
2026-06-12 20:20:38,415 - preprocessing - INFO - xAPI engineered features created: ['engagement_score', 'absence_risk', 'parent_support_signal']
2026-06-12 20:20:38,431 - preprocessing - INFO - Applying SMOTE on train set with ratio 0.4279928146142135...
2026-06-12 20:20:38,580 - preprocessing - INFO - Feature selection complete. Selected 15 / 19 features.
2026-06-12 20:20:42,302 - train_pipeline - INFO - Early stopping triggered at epoch 26
2026-06-12 20:20:42,305 - preprocessing - INFO - xAPI engineered features created: ['engagement_score', 'absence_risk', 'parent_support_signal']
2026-06-12 20:20:42,305 - preprocessing - INFO - xAPI engineered features created: ['engagement_score', 'absence_risk', 'parent_support_signal']
2026-06-12 20:20:42,319 - preprocessing - INFO - Applying SMOTE on train set with ratio 0.4279928146142135...
2026-06-12 20:20:42,451 - preprocessing - INFO - Feature selection complete. Selected 16 / 19 features.
2026-06-12 20:20:45,229 - train_pipeline - INFO - Early stopping triggered at epoch 19
2026-06-12 20:20:45,232 - preprocessing - INFO - xAPI engineered features created: ['engagement_score', 'absence_risk', 'parent_support_signal']
2026-06-12 20:20:45,236 - preprocessing - INFO - xAPI engineered features created: ['engagement_score', 'absence_risk', 'parent_support_signal']
2026-06-12 20:20:45,253 - preprocessing - INFO - Applying SMOTE on train set with ratio 0.4279928146142135...
2026-06-12 20:20:45,385 - preprocessing - INFO - Feature selection complete. Selected 18 / 19 features.
2026-06-12 20:20:48,905 - train_pipeline - INFO - Early stopping triggered at epoch 24
2026-06-12 20:20:48,907 - preprocessing - INFO - xAPI engineered features created: ['engagement_score', 'absence_risk', 'parent_support_signal']
2026-06-12 20:20:48,909 - preprocessing - INFO - xAPI engineered features created: ['engagement_score', 'absence_risk', 'parent_support_signal']
2026-06-12 20:20:48,930 - preprocessing - INFO - Applying SMOTE on train set with ratio 0.4279928146142135...
2026-06-12 20:20:49,055 - preprocessing - INFO - Feature selection complete. Selected 16 / 19 features.
2026-06-12 20:20:53,159 - train_pipeline - INFO - Early stopping triggered at epoch 27
2026-06-12 20:20:53,163 - preprocessing - INFO - xAPI engineered features created: ['engagement_score', 'absence_risk', 'parent_support_signal']
2026-06-12 20:20:53,163 - preprocessing - INFO - xAPI engineered features created: ['engagement_score', 'absence_risk', 'parent_support_signal']
2026-06-12 20:20:53,188 - preprocessing - INFO - Applying SMOTE on train set with ratio 0.4279928146142135...
2026-06-12 20:20:53,324 - preprocessing - INFO - Feature selection complete. Selected 18 / 19 features.
2026-06-12 20:20:57,664 - train_pipeline - INFO - Early stopping triggered at epoch 29
[I 2026-06-12 20:20:57,666] Trial 8 finished with value: 0.7879916892649732 and parameters: {'learning_rate': 0.0017133755079393935, 'weight_decay': 8.29192863987729e-06, 'batch_size': 16, 'oversample_method': 'smote', 'smote_ratio': 0.4279928146142135, 'cnn_channels': 32, 'lstm_hidden_dim': 32, 'context_hidden_dim': 128, 'fusion_hidden_dim': 32, 'dropout': 0.11350225644978576}. Best is trial 1 with value: 0.7981084913133594.
2026-06-12 20:20:57,667 - preprocessing - INFO - xAPI engineered features created: ['engagement_score', 'absence_risk', 'parent_support_signal']
2026-06-12 20:20:57,667 - preprocessing - INFO - xAPI engineered features created: ['engagement_score', 'absence_risk', 'parent_support_signal']
2026-06-12 20:20:57,692 - preprocessing - INFO - Applying ADASYN on train set with ratio 0.49761967294515297...
2026-06-12 20:20:57,824 - preprocessing - INFO - Feature selection complete. Selected 15 / 19 features.
2026-06-12 20:21:00,187 - train_pipeline - INFO - Early stopping triggered at epoch 30
2026-06-12 20:21:00,187 - preprocessing - INFO - xAPI engineered features created: ['engagement_score', 'absence_risk', 'parent_support_signal']
2026-06-12 20:21:00,187 - preprocessing - INFO - xAPI engineered features created: ['engagement_score', 'absence_risk', 'parent_support_signal']
2026-06-12 20:21:00,211 - preprocessing - INFO - Applying ADASYN on train set with ratio 0.49761967294515297...
2026-06-12 20:21:00,349 - preprocessing - INFO - Feature selection complete. Selected 16 / 19 features.
2026-06-12 20:21:02,271 - train_pipeline - INFO - Early stopping triggered at epoch 24
2026-06-12 20:21:02,282 - preprocessing - INFO - xAPI engineered features created: ['engagement_score', 'absence_risk', 'parent_support_signal']
2026-06-12 20:21:02,285 - preprocessing - INFO - xAPI engineered features created: ['engagement_score', 'absence_risk', 'parent_support_signal']
2026-06-12 20:21:02,301 - preprocessing - INFO - Applying ADASYN on train set with ratio 0.49761967294515297...
2026-06-12 20:21:02,430 - preprocessing - INFO - Feature selection complete. Selected 18 / 19 features.
2026-06-12 20:21:06,195 - train_pipeline - INFO - Early stopping triggered at epoch 47
2026-06-12 20:21:06,198 - preprocessing - INFO - xAPI engineered features created: ['engagement_score', 'absence_risk', 'parent_support_signal']
2026-06-12 20:21:06,198 - preprocessing - INFO - xAPI engineered features created: ['engagement_score', 'absence_risk', 'parent_support_signal']
2026-06-12 20:21:06,220 - preprocessing - INFO - Applying ADASYN on train set with ratio 0.49761967294515297...
2026-06-12 20:21:06,343 - preprocessing - INFO - Feature selection complete. Selected 16 / 19 features.
2026-06-12 20:21:08,444 - train_pipeline - INFO - Early stopping triggered at epoch 26
2026-06-12 20:21:08,448 - preprocessing - INFO - xAPI engineered features created: ['engagement_score', 'absence_risk', 'parent_support_signal']
2026-06-12 20:21:08,450 - preprocessing - INFO - xAPI engineered features created: ['engagement_score', 'absence_risk', 'parent_support_signal']
2026-06-12 20:21:08,466 - preprocessing - INFO - Applying ADASYN on train set with ratio 0.49761967294515297...
2026-06-12 20:21:08,590 - preprocessing - INFO - Feature selection complete. Selected 18 / 19 features.
[I 2026-06-12 20:21:12,629] Trial 9 finished with value: 0.7608033914271188 and parameters: {'learning_rate': 0.0012689275287475028, 'weight_decay': 7.656492417896463e-06, 'batch_size': 32, 'oversample_method': 'adasyn', 'smote_ratio': 0.49761967294515297, 'cnn_channels': 32, 'lstm_hidden_dim': 32, 'context_hidden_dim': 32, 'fusion_hidden_dim': 32, 'dropout': 0.15951702856979066}. Best is trial 1 with value: 0.7981084913133594.
2026-06-12 20:21:12,646 - preprocessing - INFO - xAPI engineered features created: ['engagement_score', 'absence_risk', 'parent_support_signal']
2026-06-12 20:21:12,646 - preprocessing - INFO - xAPI engineered features created: ['engagement_score', 'absence_risk', 'parent_support_signal']
2026-06-12 20:21:12,671 - preprocessing - INFO - Applying SMOTE on train set with ratio 0.7640407637535274...
2026-06-12 20:21:12,809 - preprocessing - INFO - Feature selection complete. Selected 16 / 19 features.
2026-06-12 20:21:14,159 - train_pipeline - INFO - Early stopping triggered at epoch 23
2026-06-12 20:21:14,175 - preprocessing - INFO - xAPI engineered features created: ['engagement_score', 'absence_risk', 'parent_support_signal']
2026-06-12 20:21:14,175 - preprocessing - INFO - xAPI engineered features created: ['engagement_score', 'absence_risk', 'parent_support_signal']
2026-06-12 20:21:14,197 - preprocessing - INFO - Applying SMOTE on train set with ratio 0.7640407637535274...
2026-06-12 20:21:14,344 - preprocessing - INFO - Feature selection complete. Selected 16 / 19 features.
2026-06-12 20:21:17,353 - preprocessing - INFO - xAPI engineered features created: ['engagement_score', 'absence_risk', 'parent_support_signal']
2026-06-12 20:21:17,360 - preprocessing - INFO - xAPI engineered features created: ['engagement_score', 'absence_risk', 'parent_support_signal']
2026-06-12 20:21:17,381 - preprocessing - INFO - Applying SMOTE on train set with ratio 0.7640407637535274...
2026-06-12 20:21:17,523 - preprocessing - INFO - Feature selection complete. Selected 18 / 19 features.
2026-06-12 20:21:19,329 - train_pipeline - INFO - Early stopping triggered at epoch 28
2026-06-12 20:21:19,332 - preprocessing - INFO - xAPI engineered features created: ['engagement_score', 'absence_risk', 'parent_support_signal']
2026-06-12 20:21:19,334 - preprocessing - INFO - xAPI engineered features created: ['engagement_score', 'absence_risk', 'parent_support_signal']
2026-06-12 20:21:19,377 - preprocessing - INFO - Applying SMOTE on train set with ratio 0.7640407637535274...
2026-06-12 20:21:19,546 - preprocessing - INFO - Feature selection complete. Selected 16 / 19 features.
2026-06-12 20:21:20,642 - train_pipeline - INFO - Early stopping triggered at epoch 17
2026-06-12 20:21:20,644 - preprocessing - INFO - xAPI engineered features created: ['engagement_score', 'absence_risk', 'parent_support_signal']
2026-06-12 20:21:20,644 - preprocessing - INFO - xAPI engineered features created: ['engagement_score', 'absence_risk', 'parent_support_signal']
2026-06-12 20:21:20,665 - preprocessing - INFO - Applying SMOTE on train set with ratio 0.7640407637535274...
2026-06-12 20:21:20,801 - preprocessing - INFO - Feature selection complete. Selected 18 / 19 features.
2026-06-12 20:21:22,619 - train_pipeline - INFO - Early stopping triggered at epoch 30
[I 2026-06-12 20:21:22,619] Trial 10 finished with value: 0.7864254948483769 and parameters: {'learning_rate': 0.00953874016134545, 'weight_decay': 0.0007726489400783648, 'batch_size': 64, 'oversample_method': 'smote', 'smote_ratio': 0.7640407637535274, 'cnn_channels': 16, 'lstm_hidden_dim': 64, 'context_hidden_dim': 32, 'fusion_hidden_dim': 64, 'dropout': 0.26697662179748627}. Best is trial 1 with value: 0.7981084913133594.
2026-06-12 20:21:22,634 - preprocessing - INFO - xAPI engineered features created: ['engagement_score', 'absence_risk', 'parent_support_signal']
2026-06-12 20:21:22,646 - preprocessing - INFO - xAPI engineered features created: ['engagement_score', 'absence_risk', 'parent_support_signal']
2026-06-12 20:21:22,662 - preprocessing - INFO - Applying SMOTE on train set with ratio 0.6617996492646776...
2026-06-12 20:21:22,802 - preprocessing - INFO - Feature selection complete. Selected 15 / 19 features.
2026-06-12 20:21:30,093 - train_pipeline - INFO - Early stopping triggered at epoch 42
2026-06-12 20:21:30,098 - preprocessing - INFO - xAPI engineered features created: ['engagement_score', 'absence_risk', 'parent_support_signal']
2026-06-12 20:21:30,098 - preprocessing - INFO - xAPI engineered features created: ['engagement_score', 'absence_risk', 'parent_support_signal']
2026-06-12 20:21:30,133 - preprocessing - INFO - Applying SMOTE on train set with ratio 0.6617996492646776...
2026-06-12 20:21:30,285 - preprocessing - INFO - Feature selection complete. Selected 16 / 19 features.
2026-06-12 20:21:38,464 - preprocessing - INFO - xAPI engineered features created: ['engagement_score', 'absence_risk', 'parent_support_signal']
2026-06-12 20:21:38,471 - preprocessing - INFO - xAPI engineered features created: ['engagement_score', 'absence_risk', 'parent_support_signal']
2026-06-12 20:21:38,492 - preprocessing - INFO - Applying SMOTE on train set with ratio 0.6617996492646776...
2026-06-12 20:21:38,624 - preprocessing - INFO - Feature selection complete. Selected 18 / 19 features.
2026-06-12 20:21:44,486 - train_pipeline - INFO - Early stopping triggered at epoch 37
2026-06-12 20:21:44,493 - preprocessing - INFO - xAPI engineered features created: ['engagement_score', 'absence_risk', 'parent_support_signal']
2026-06-12 20:21:44,493 - preprocessing - INFO - xAPI engineered features created: ['engagement_score', 'absence_risk', 'parent_support_signal']
2026-06-12 20:21:44,514 - preprocessing - INFO - Applying SMOTE on train set with ratio 0.6617996492646776...
2026-06-12 20:21:44,646 - preprocessing - INFO - Feature selection complete. Selected 16 / 19 features.
2026-06-12 20:21:48,149 - train_pipeline - INFO - Early stopping triggered at epoch 22
2026-06-12 20:21:48,149 - preprocessing - INFO - xAPI engineered features created: ['engagement_score', 'absence_risk', 'parent_support_signal']
2026-06-12 20:21:48,155 - preprocessing - INFO - xAPI engineered features created: ['engagement_score', 'absence_risk', 'parent_support_signal']
2026-06-12 20:21:48,170 - preprocessing - INFO - Applying SMOTE on train set with ratio 0.6617996492646776...
2026-06-12 20:21:48,296 - preprocessing - INFO - Feature selection complete. Selected 18 / 19 features.
2026-06-12 20:21:52,631 - train_pipeline - INFO - Early stopping triggered at epoch 27
