[I 2026-06-12 19:49:15,610] Trial 14 finished with value: 0.8830480130408699 and parameters: {'learning_rate': 0.005223194537320701, 'weight_decay': 3.814395336626469e-05, 'batch_size': 32, 'oversample_method': 'adasyn', 'smote_ratio': 0.48462568971553793, 'cnn_channels': 64, 'lstm_hidden_dim': 64, 'context_hidden_dim': 128, 'fusion_hidden_dim': 32, 'dropout': 0.18687957984716916}. Best is trial 14 with value: 0.8830480130408699.
2026-06-12 19:49:15,622 - preprocessing - INFO - Student engineered features created: ['grade_growth', 'grade_avg', 'absence_study_ratio', 'failure_risk', 'alcohol_risk', 'social_risk']
2026-06-12 19:49:15,626 - preprocessing - INFO - Student engineered features created: ['grade_growth', 'grade_avg', 'absence_study_ratio', 'failure_risk', 'alcohol_risk', 'social_risk']
2026-06-12 19:49:15,673 - preprocessing - INFO - Applying ADASYN on train set with ratio 0.47798549957078507...
2026-06-12 19:49:15,885 - preprocessing - INFO - Feature selection complete. Selected 32 / 38 features.
2026-06-12 19:49:18,836 - train_pipeline - INFO - Early stopping triggered at epoch 21
2026-06-12 19:49:18,843 - preprocessing - INFO - Student engineered features created: ['grade_growth', 'grade_avg', 'absence_study_ratio', 'failure_risk', 'alcohol_risk', 'social_risk']
2026-06-12 19:49:18,848 - preprocessing - INFO - Student engineered features created: ['grade_growth', 'grade_avg', 'absence_study_ratio', 'failure_risk', 'alcohol_risk', 'social_risk']
2026-06-12 19:49:18,892 - preprocessing - INFO - Applying ADASYN on train set with ratio 0.47798549957078507...
2026-06-12 19:49:19,116 - preprocessing - INFO - Feature selection complete. Selected 33 / 38 features.
2026-06-12 19:49:22,062 - train_pipeline - INFO - Early stopping triggered at epoch 21
2026-06-12 19:49:22,066 - preprocessing - INFO - Student engineered features created: ['grade_growth', 'grade_avg', 'absence_study_ratio', 'failure_risk', 'alcohol_risk', 'social_risk']
2026-06-12 19:49:22,070 - preprocessing - INFO - Student engineered features created: ['grade_growth', 'grade_avg', 'absence_study_ratio', 'failure_risk', 'alcohol_risk', 'social_risk']
2026-06-12 19:49:22,113 - preprocessing - INFO - Applying ADASYN on train set with ratio 0.47798549957078507...
2026-06-12 19:49:22,351 - preprocessing - INFO - Feature selection complete. Selected 27 / 38 features.
2026-06-12 19:49:27,508 - train_pipeline - INFO - Early stopping triggered at epoch 37
2026-06-12 19:49:27,508 - preprocessing - INFO - Student engineered features created: ['grade_growth', 'grade_avg', 'absence_study_ratio', 'failure_risk', 'alcohol_risk', 'social_risk']
2026-06-12 19:49:27,508 - preprocessing - INFO - Student engineered features created: ['grade_growth', 'grade_avg', 'absence_study_ratio', 'failure_risk', 'alcohol_risk', 'social_risk']
2026-06-12 19:49:27,556 - preprocessing - INFO - Applying ADASYN on train set with ratio 0.47798549957078507...
2026-06-12 19:49:27,782 - preprocessing - INFO - Feature selection complete. Selected 35 / 38 features.
2026-06-12 19:49:30,633 - train_pipeline - INFO - Early stopping triggered at epoch 20
2026-06-12 19:49:30,646 - preprocessing - INFO - Student engineered features created: ['grade_growth', 'grade_avg', 'absence_study_ratio', 'failure_risk', 'alcohol_risk', 'social_risk']
2026-06-12 19:49:30,646 - preprocessing - INFO - Student engineered features created: ['grade_growth', 'grade_avg', 'absence_study_ratio', 'failure_risk', 'alcohol_risk', 'social_risk']
2026-06-12 19:49:30,699 - preprocessing - INFO - Applying ADASYN on train set with ratio 0.47798549957078507...
2026-06-12 19:49:30,933 - preprocessing - INFO - Feature selection complete. Selected 29 / 38 features.
2026-06-12 19:49:34,154 - train_pipeline - INFO - Early stopping triggered at epoch 23
[I 2026-06-12 19:49:34,170] Trial 15 finished with value: 0.8684005145566989 and parameters: {'learning_rate': 0.005050828986327275, 'weight_decay': 5.0121003321437184e-05, 'batch_size': 32, 'oversample_method': 'adasyn', 'smote_ratio': 0.47798549957078507, 'cnn_channels': 64, 'lstm_hidden_dim': 64, 'context_hidden_dim': 32, 'fusion_hidden_dim': 32, 'dropout': 0.17300884350687296}. Best is trial 14 with value: 0.8830480130408699.
2026-06-12 19:49:34,170 - preprocessing - INFO - Student engineered features created: ['grade_growth', 'grade_avg', 'absence_study_ratio', 'failure_risk', 'alcohol_risk', 'social_risk']
2026-06-12 19:49:34,170 - preprocessing - INFO - Student engineered features created: ['grade_growth', 'grade_avg', 'absence_study_ratio', 'failure_risk', 'alcohol_risk', 'social_risk']
2026-06-12 19:49:34,223 - preprocessing - INFO - Applying ADASYN on train set with ratio 0.46407194745090175...
2026-06-12 19:49:34,450 - preprocessing - INFO - Feature selection complete. Selected 30 / 38 features.
2026-06-12 19:49:38,478 - train_pipeline - INFO - Early stopping triggered at epoch 29
2026-06-12 19:49:38,478 - preprocessing - INFO - Student engineered features created: ['grade_growth', 'grade_avg', 'absence_study_ratio', 'failure_risk', 'alcohol_risk', 'social_risk']
2026-06-12 19:49:38,483 - preprocessing - INFO - Student engineered features created: ['grade_growth', 'grade_avg', 'absence_study_ratio', 'failure_risk', 'alcohol_risk', 'social_risk']
2026-06-12 19:49:38,532 - preprocessing - INFO - Applying ADASYN on train set with ratio 0.46407194745090175...
2026-06-12 19:49:38,755 - preprocessing - INFO - Feature selection complete. Selected 33 / 38 features.
2026-06-12 19:49:41,681 - train_pipeline - INFO - Early stopping triggered at epoch 21
2026-06-12 19:49:41,690 - preprocessing - INFO - Student engineered features created: ['grade_growth', 'grade_avg', 'absence_study_ratio', 'failure_risk', 'alcohol_risk', 'social_risk']
2026-06-12 19:49:41,693 - preprocessing - INFO - Student engineered features created: ['grade_growth', 'grade_avg', 'absence_study_ratio', 'failure_risk', 'alcohol_risk', 'social_risk']
2026-06-12 19:49:41,737 - preprocessing - INFO - Applying ADASYN on train set with ratio 0.46407194745090175...
2026-06-12 19:49:41,961 - preprocessing - INFO - Feature selection complete. Selected 29 / 38 features.
2026-06-12 19:49:44,839 - train_pipeline - INFO - Early stopping triggered at epoch 22
2026-06-12 19:49:44,843 - preprocessing - INFO - Student engineered features created: ['grade_growth', 'grade_avg', 'absence_study_ratio', 'failure_risk', 'alcohol_risk', 'social_risk']
2026-06-12 19:49:44,845 - preprocessing - INFO - Student engineered features created: ['grade_growth', 'grade_avg', 'absence_study_ratio', 'failure_risk', 'alcohol_risk', 'social_risk']
2026-06-12 19:49:44,891 - preprocessing - INFO - Applying ADASYN on train set with ratio 0.46407194745090175...
2026-06-12 19:49:45,111 - preprocessing - INFO - Feature selection complete. Selected 32 / 38 features.
2026-06-12 19:49:50,308 - train_pipeline - INFO - Early stopping triggered at epoch 37
2026-06-12 19:49:50,310 - preprocessing - INFO - Student engineered features created: ['grade_growth', 'grade_avg', 'absence_study_ratio', 'failure_risk', 'alcohol_risk', 'social_risk']
2026-06-12 19:49:50,314 - preprocessing - INFO - Student engineered features created: ['grade_growth', 'grade_avg', 'absence_study_ratio', 'failure_risk', 'alcohol_risk', 'social_risk']
2026-06-12 19:49:50,359 - preprocessing - INFO - Applying ADASYN on train set with ratio 0.46407194745090175...
2026-06-12 19:49:50,590 - preprocessing - INFO - Feature selection complete. Selected 29 / 38 features.
2026-06-12 19:49:56,770 - train_pipeline - INFO - Early stopping triggered at epoch 45
[I 2026-06-12 19:49:56,784] Trial 16 finished with value: 0.8669496774685532 and parameters: {'learning_rate': 0.0045033015544202705, 'weight_decay': 5.621346350112e-05, 'batch_size': 32, 'oversample_method': 'adasyn', 'smote_ratio': 0.46407194745090175, 'cnn_channels': 64, 'lstm_hidden_dim': 64, 'context_hidden_dim': 32, 'fusion_hidden_dim': 32, 'dropout': 0.15992311789190797}. Best is trial 14 with value: 0.8830480130408699.
2026-06-12 19:49:56,784 - preprocessing - INFO - Student engineered features created: ['grade_growth', 'grade_avg', 'absence_study_ratio', 'failure_risk', 'alcohol_risk', 'social_risk']
2026-06-12 19:49:56,784 - preprocessing - INFO - Student engineered features created: ['grade_growth', 'grade_avg', 'absence_study_ratio', 'failure_risk', 'alcohol_risk', 'social_risk']
2026-06-12 19:49:56,848 - preprocessing - INFO - Applying ADASYN on train set with ratio 0.729951705242029...
2026-06-12 19:49:57,091 - preprocessing - INFO - Feature selection complete. Selected 36 / 38 features.
2026-06-12 19:49:59,362 - train_pipeline - INFO - Early stopping triggered at epoch 19
2026-06-12 19:49:59,369 - preprocessing - INFO - Student engineered features created: ['grade_growth', 'grade_avg', 'absence_study_ratio', 'failure_risk', 'alcohol_risk', 'social_risk']
2026-06-12 19:49:59,372 - preprocessing - INFO - Student engineered features created: ['grade_growth', 'grade_avg', 'absence_study_ratio', 'failure_risk', 'alcohol_risk', 'social_risk']
2026-06-12 19:49:59,423 - preprocessing - INFO - Applying ADASYN on train set with ratio 0.729951705242029...
2026-06-12 19:49:59,649 - preprocessing - INFO - Feature selection complete. Selected 34 / 38 features.
2026-06-12 19:50:01,899 - train_pipeline - INFO - Early stopping triggered at epoch 21
2026-06-12 19:50:01,907 - preprocessing - INFO - Student engineered features created: ['grade_growth', 'grade_avg', 'absence_study_ratio', 'failure_risk', 'alcohol_risk', 'social_risk']
2026-06-12 19:50:01,910 - preprocessing - INFO - Student engineered features created: ['grade_growth', 'grade_avg', 'absence_study_ratio', 'failure_risk', 'alcohol_risk', 'social_risk']
2026-06-12 19:50:01,955 - preprocessing - INFO - Applying ADASYN on train set with ratio 0.729951705242029...
2026-06-12 19:50:02,189 - preprocessing - INFO - Feature selection complete. Selected 35 / 38 features.
2026-06-12 19:50:07,426 - train_pipeline - INFO - Early stopping triggered at epoch 49
2026-06-12 19:50:07,426 - preprocessing - INFO - Student engineered features created: ['grade_growth', 'grade_avg', 'absence_study_ratio', 'failure_risk', 'alcohol_risk', 'social_risk']
2026-06-12 19:50:07,440 - preprocessing - INFO - Student engineered features created: ['grade_growth', 'grade_avg', 'absence_study_ratio', 'failure_risk', 'alcohol_risk', 'social_risk']
2026-06-12 19:50:07,483 - preprocessing - INFO - Applying ADASYN on train set with ratio 0.729951705242029...
2026-06-12 19:50:07,701 - preprocessing - INFO - Feature selection complete. Selected 36 / 38 features.
2026-06-12 19:50:09,625 - train_pipeline - INFO - Early stopping triggered at epoch 18
2026-06-12 19:50:09,630 - preprocessing - INFO - Student engineered features created: ['grade_growth', 'grade_avg', 'absence_study_ratio', 'failure_risk', 'alcohol_risk', 'social_risk']
2026-06-12 19:50:09,632 - preprocessing - INFO - Student engineered features created: ['grade_growth', 'grade_avg', 'absence_study_ratio', 'failure_risk', 'alcohol_risk', 'social_risk']
2026-06-12 19:50:09,681 - preprocessing - INFO - Applying ADASYN on train set with ratio 0.729951705242029...
2026-06-12 19:50:09,903 - preprocessing - INFO - Feature selection complete. Selected 34 / 38 features.
2026-06-12 19:50:13,721 - train_pipeline - INFO - Early stopping triggered at epoch 36
[I 2026-06-12 19:50:13,721] Trial 17 finished with value: 0.875268228746989 and parameters: {'learning_rate': 0.00496911504495217, 'weight_decay': 9.467090722736628e-05, 'batch_size': 64, 'oversample_method': 'adasyn', 'smote_ratio': 0.729951705242029, 'cnn_channels': 64, 'lstm_hidden_dim': 64, 'context_hidden_dim': 32, 'fusion_hidden_dim': 32, 'dropout': 0.1995770157352477}. Best is trial 14 with value: 0.8830480130408699.
2026-06-12 19:50:13,726 - preprocessing - INFO - Student engineered features created: ['grade_growth', 'grade_avg', 'absence_study_ratio', 'failure_risk', 'alcohol_risk', 'social_risk']
2026-06-12 19:50:13,736 - preprocessing - INFO - Student engineered features created: ['grade_growth', 'grade_avg', 'absence_study_ratio', 'failure_risk', 'alcohol_risk', 'social_risk']
2026-06-12 19:50:13,776 - preprocessing - INFO - Applying ADASYN on train set with ratio 0.7459843047429492...
2026-06-12 19:50:14,011 - preprocessing - INFO - Feature selection complete. Selected 36 / 38 features.
2026-06-12 19:50:19,359 - preprocessing - INFO - Student engineered features created: ['grade_growth', 'grade_avg', 'absence_study_ratio', 'failure_risk', 'alcohol_risk', 'social_risk']
2026-06-12 19:50:19,359 - preprocessing - INFO - Student engineered features created: ['grade_growth', 'grade_avg', 'absence_study_ratio', 'failure_risk', 'alcohol_risk', 'social_risk']
2026-06-12 19:50:19,407 - preprocessing - INFO - Applying ADASYN on train set with ratio 0.7459843047429492...
2026-06-12 19:50:19,617 - preprocessing - INFO - Feature selection complete. Selected 34 / 38 features.
2026-06-12 19:50:21,863 - train_pipeline - INFO - Early stopping triggered at epoch 21
2026-06-12 19:50:21,863 - preprocessing - INFO - Student engineered features created: ['grade_growth', 'grade_avg', 'absence_study_ratio', 'failure_risk', 'alcohol_risk', 'social_risk']
2026-06-12 19:50:21,863 - preprocessing - INFO - Student engineered features created: ['grade_growth', 'grade_avg', 'absence_study_ratio', 'failure_risk', 'alcohol_risk', 'social_risk']
2026-06-12 19:50:21,912 - preprocessing - INFO - Applying ADASYN on train set with ratio 0.7459843047429492...
2026-06-12 19:50:22,134 - preprocessing - INFO - Feature selection complete. Selected 35 / 38 features.
2026-06-12 19:50:25,970 - train_pipeline - INFO - Early stopping triggered at epoch 36
2026-06-12 19:50:25,978 - preprocessing - INFO - Student engineered features created: ['grade_growth', 'grade_avg', 'absence_study_ratio', 'failure_risk', 'alcohol_risk', 'social_risk']
2026-06-12 19:50:25,979 - preprocessing - INFO - Student engineered features created: ['grade_growth', 'grade_avg', 'absence_study_ratio', 'failure_risk', 'alcohol_risk', 'social_risk']
2026-06-12 19:50:26,028 - preprocessing - INFO - Applying ADASYN on train set with ratio 0.7459843047429492...
2026-06-12 19:50:26,257 - preprocessing - INFO - Feature selection complete. Selected 36 / 38 features.
2026-06-12 19:50:28,162 - train_pipeline - INFO - Early stopping triggered at epoch 18
2026-06-12 19:50:28,178 - preprocessing - INFO - Student engineered features created: ['grade_growth', 'grade_avg', 'absence_study_ratio', 'failure_risk', 'alcohol_risk', 'social_risk']
2026-06-12 19:50:28,178 - preprocessing - INFO - Student engineered features created: ['grade_growth', 'grade_avg', 'absence_study_ratio', 'failure_risk', 'alcohol_risk', 'social_risk']
2026-06-12 19:50:28,225 - preprocessing - INFO - Applying ADASYN on train set with ratio 0.7459843047429492...
2026-06-12 19:50:28,437 - preprocessing - INFO - Feature selection complete. Selected 34 / 38 features.
2026-06-12 19:50:31,152 - train_pipeline - INFO - Early stopping triggered at epoch 25
[I 2026-06-12 19:50:31,152] Trial 18 finished with value: 0.8478683623261677 and parameters: {'learning_rate': 0.00248171150647068, 'weight_decay': 0.00014142202375432337, 'batch_size': 64, 'oversample_method': 'adasyn', 'smote_ratio': 0.7459843047429492, 'cnn_channels': 64, 'lstm_hidden_dim': 64, 'context_hidden_dim': 32, 'fusion_hidden_dim': 32, 'dropout': 0.21491796631114035}. Best is trial 14 with value: 0.8830480130408699.
2026-06-12 19:50:31,167 - preprocessing - INFO - Student engineered features created: ['grade_growth', 'grade_avg', 'absence_study_ratio', 'failure_risk', 'alcohol_risk', 'social_risk']
2026-06-12 19:50:31,168 - preprocessing - INFO - Student engineered features created: ['grade_growth', 'grade_avg', 'absence_study_ratio', 'failure_risk', 'alcohol_risk', 'social_risk']
2026-06-12 19:50:31,217 - preprocessing - INFO - Applying ADASYN on train set with ratio 0.7901989792347792...
2026-06-12 19:50:31,437 - preprocessing - INFO - Feature selection complete. Selected 36 / 38 features.
2026-06-12 19:50:33,941 - train_pipeline - INFO - Early stopping triggered at epoch 24
2026-06-12 19:50:33,951 - preprocessing - INFO - Student engineered features created: ['grade_growth', 'grade_avg', 'absence_study_ratio', 'failure_risk', 'alcohol_risk', 'social_risk']
2026-06-12 19:50:33,954 - preprocessing - INFO - Student engineered features created: ['grade_growth', 'grade_avg', 'absence_study_ratio', 'failure_risk', 'alcohol_risk', 'social_risk']
2026-06-12 19:50:33,997 - preprocessing - INFO - Applying ADASYN on train set with ratio 0.7901989792347792...
2026-06-12 19:50:34,216 - preprocessing - INFO - Feature selection complete. Selected 34 / 38 features.
2026-06-12 19:50:36,369 - train_pipeline - INFO - Early stopping triggered at epoch 19
2026-06-12 19:50:36,377 - preprocessing - INFO - Student engineered features created: ['grade_growth', 'grade_avg', 'absence_study_ratio', 'failure_risk', 'alcohol_risk', 'social_risk']
2026-06-12 19:50:36,381 - preprocessing - INFO - Student engineered features created: ['grade_growth', 'grade_avg', 'absence_study_ratio', 'failure_risk', 'alcohol_risk', 'social_risk']
2026-06-12 19:50:36,425 - preprocessing - INFO - Applying ADASYN on train set with ratio 0.7901989792347792...
2026-06-12 19:50:36,675 - preprocessing - INFO - Feature selection complete. Selected 35 / 38 features.
2026-06-12 19:50:38,593 - train_pipeline - INFO - Early stopping triggered at epoch 18
2026-06-12 19:50:38,603 - preprocessing - INFO - Student engineered features created: ['grade_growth', 'grade_avg', 'absence_study_ratio', 'failure_risk', 'alcohol_risk', 'social_risk']
2026-06-12 19:50:38,607 - preprocessing - INFO - Student engineered features created: ['grade_growth', 'grade_avg', 'absence_study_ratio', 'failure_risk', 'alcohol_risk', 'social_risk']
2026-06-12 19:50:38,652 - preprocessing - INFO - Applying ADASYN on train set with ratio 0.7901989792347792...
2026-06-12 19:50:38,881 - preprocessing - INFO - Feature selection complete. Selected 36 / 38 features.
2026-06-12 19:50:41,989 - train_pipeline - INFO - Early stopping triggered at epoch 30
2026-06-12 19:50:41,990 - preprocessing - INFO - Student engineered features created: ['grade_growth', 'grade_avg', 'absence_study_ratio', 'failure_risk', 'alcohol_risk', 'social_risk']
2026-06-12 19:50:41,995 - preprocessing - INFO - Student engineered features created: ['grade_growth', 'grade_avg', 'absence_study_ratio', 'failure_risk', 'alcohol_risk', 'social_risk']
2026-06-12 19:50:42,041 - preprocessing - INFO - Applying ADASYN on train set with ratio 0.7901989792347792...
2026-06-12 19:50:42,269 - preprocessing - INFO - Feature selection complete. Selected 34 / 38 features.
2026-06-12 19:50:45,520 - train_pipeline - INFO - Early stopping triggered at epoch 32
