[I 2026-06-12 20:33:25,053] Trial 47 finished with value: 0.7775403144095611 and parameters: {'learning_rate': 0.003003142503888462, 'weight_decay': 2.9813771130127998e-06, 'batch_size': 64, 'oversample_method': 'smote', 'smote_ratio': 0.7586097363751788, 'cnn_channels': 64, 'lstm_hidden_dim': 64, 'context_hidden_dim': 128, 'fusion_hidden_dim': 128, 'dropout': 0.4576786473024205}. Best is trial 44 with value: 0.8049511802403128.
2026-06-12 20:33:25,067 - preprocessing - INFO - xAPI engineered features created: ['engagement_score', 'absence_risk', 'parent_support_signal']
2026-06-12 20:33:25,073 - preprocessing - INFO - xAPI engineered features created: ['engagement_score', 'absence_risk', 'parent_support_signal']
2026-06-12 20:33:25,091 - preprocessing - INFO - Applying ADASYN on train set with ratio 0.6107290498382455...
2026-06-12 20:33:25,095 - preprocessing - WARNING - ADASYN failed (likely too few samples). Error: No samples will be generated with the provided ratio settings.. Falling back to no oversampling.
2026-06-12 20:33:25,233 - preprocessing - INFO - Feature selection complete. Selected 15 / 19 features.
2026-06-12 20:33:29,632 - train_pipeline - INFO - Early stopping triggered at epoch 29
2026-06-12 20:33:29,639 - preprocessing - INFO - xAPI engineered features created: ['engagement_score', 'absence_risk', 'parent_support_signal']
2026-06-12 20:33:29,639 - preprocessing - INFO - xAPI engineered features created: ['engagement_score', 'absence_risk', 'parent_support_signal']
2026-06-12 20:33:29,659 - preprocessing - INFO - Applying ADASYN on train set with ratio 0.6107290498382455...
2026-06-12 20:33:29,666 - preprocessing - WARNING - ADASYN failed (likely too few samples). Error: No samples will be generated with the provided ratio settings.. Falling back to no oversampling.
2026-06-12 20:33:29,794 - preprocessing - INFO - Feature selection complete. Selected 16 / 19 features.
2026-06-12 20:33:32,844 - train_pipeline - INFO - Early stopping triggered at epoch 20
2026-06-12 20:33:32,851 - preprocessing - INFO - xAPI engineered features created: ['engagement_score', 'absence_risk', 'parent_support_signal']
2026-06-12 20:33:32,851 - preprocessing - INFO - xAPI engineered features created: ['engagement_score', 'absence_risk', 'parent_support_signal']
2026-06-12 20:33:32,872 - preprocessing - INFO - Applying ADASYN on train set with ratio 0.6107290498382455...
2026-06-12 20:33:32,879 - preprocessing - WARNING - ADASYN failed (likely too few samples). Error: No samples will be generated with the provided ratio settings.. Falling back to no oversampling.
2026-06-12 20:33:33,004 - preprocessing - INFO - Feature selection complete. Selected 18 / 19 features.
2026-06-12 20:33:38,158 - train_pipeline - INFO - Early stopping triggered at epoch 33
2026-06-12 20:33:38,158 - preprocessing - INFO - xAPI engineered features created: ['engagement_score', 'absence_risk', 'parent_support_signal']
2026-06-12 20:33:38,158 - preprocessing - INFO - xAPI engineered features created: ['engagement_score', 'absence_risk', 'parent_support_signal']
2026-06-12 20:33:38,179 - preprocessing - INFO - Applying ADASYN on train set with ratio 0.6107290498382455...
2026-06-12 20:33:38,186 - preprocessing - WARNING - ADASYN failed (likely too few samples). Error: No samples will be generated with the provided ratio settings.. Falling back to no oversampling.
2026-06-12 20:33:38,324 - preprocessing - INFO - Feature selection complete. Selected 16 / 19 features.
2026-06-12 20:33:41,104 - train_pipeline - INFO - Early stopping triggered at epoch 18
2026-06-12 20:33:41,106 - preprocessing - INFO - xAPI engineered features created: ['engagement_score', 'absence_risk', 'parent_support_signal']
2026-06-12 20:33:41,106 - preprocessing - INFO - xAPI engineered features created: ['engagement_score', 'absence_risk', 'parent_support_signal']
2026-06-12 20:33:41,127 - preprocessing - INFO - Applying ADASYN on train set with ratio 0.6107290498382455...
2026-06-12 20:33:41,134 - preprocessing - WARNING - ADASYN failed (likely too few samples). Error: No samples will be generated with the provided ratio settings.. Falling back to no oversampling.
2026-06-12 20:33:41,260 - preprocessing - INFO - Feature selection complete. Selected 18 / 19 features.
2026-06-12 20:33:46,899 - train_pipeline - INFO - Early stopping triggered at epoch 36
[I 2026-06-12 20:33:46,899] Trial 48 finished with value: 0.7728529194479814 and parameters: {'learning_rate': 0.0014616037459885237, 'weight_decay': 1.7009004143232072e-05, 'batch_size': 16, 'oversample_method': 'adasyn', 'smote_ratio': 0.6107290498382455, 'cnn_channels': 32, 'lstm_hidden_dim': 64, 'context_hidden_dim': 128, 'fusion_hidden_dim': 32, 'dropout': 0.3760412912821946}. Best is trial 44 with value: 0.8049511802403128.
2026-06-12 20:33:46,914 - preprocessing - INFO - xAPI engineered features created: ['engagement_score', 'absence_risk', 'parent_support_signal']
2026-06-12 20:33:46,921 - preprocessing - INFO - xAPI engineered features created: ['engagement_score', 'absence_risk', 'parent_support_signal']
2026-06-12 20:33:46,941 - preprocessing - INFO - Applying ADASYN on train set with ratio 0.4698939475344483...
2026-06-12 20:33:47,073 - preprocessing - INFO - Feature selection complete. Selected 15 / 19 features.
2026-06-12 20:33:52,449 - train_pipeline - INFO - Early stopping triggered at epoch 39
2026-06-12 20:33:52,456 - preprocessing - INFO - xAPI engineered features created: ['engagement_score', 'absence_risk', 'parent_support_signal']
2026-06-12 20:33:52,456 - preprocessing - INFO - xAPI engineered features created: ['engagement_score', 'absence_risk', 'parent_support_signal']
2026-06-12 20:33:52,476 - preprocessing - INFO - Applying ADASYN on train set with ratio 0.4698939475344483...
2026-06-12 20:33:52,608 - preprocessing - INFO - Feature selection complete. Selected 16 / 19 features.
2026-06-12 20:33:56,395 - train_pipeline - INFO - Early stopping triggered at epoch 26
2026-06-12 20:33:56,399 - preprocessing - INFO - xAPI engineered features created: ['engagement_score', 'absence_risk', 'parent_support_signal']
2026-06-12 20:33:56,401 - preprocessing - INFO - xAPI engineered features created: ['engagement_score', 'absence_risk', 'parent_support_signal']
2026-06-12 20:33:56,417 - preprocessing - INFO - Applying ADASYN on train set with ratio 0.4698939475344483...
2026-06-12 20:33:56,549 - preprocessing - INFO - Feature selection complete. Selected 18 / 19 features.
2026-06-12 20:34:03,431 - train_pipeline - INFO - Early stopping triggered at epoch 47
2026-06-12 20:34:03,438 - preprocessing - INFO - xAPI engineered features created: ['engagement_score', 'absence_risk', 'parent_support_signal']
2026-06-12 20:34:03,438 - preprocessing - INFO - xAPI engineered features created: ['engagement_score', 'absence_risk', 'parent_support_signal']
2026-06-12 20:34:03,459 - preprocessing - INFO - Applying ADASYN on train set with ratio 0.4698939475344483...
2026-06-12 20:34:03,584 - preprocessing - INFO - Feature selection complete. Selected 16 / 19 features.
2026-06-12 20:34:05,999 - train_pipeline - INFO - Early stopping triggered at epoch 17
2026-06-12 20:34:06,006 - preprocessing - INFO - xAPI engineered features created: ['engagement_score', 'absence_risk', 'parent_support_signal']
2026-06-12 20:34:06,006 - preprocessing - INFO - xAPI engineered features created: ['engagement_score', 'absence_risk', 'parent_support_signal']
2026-06-12 20:34:06,027 - preprocessing - INFO - Applying ADASYN on train set with ratio 0.4698939475344483...
2026-06-12 20:34:06,164 - preprocessing - INFO - Feature selection complete. Selected 18 / 19 features.
2026-06-12 20:34:10,576 - train_pipeline - INFO - Early stopping triggered at epoch 31
[I 2026-06-12 20:34:10,577] Trial 49 finished with value: 0.7870201385204626 and parameters: {'learning_rate': 0.004207923802283506, 'weight_decay': 4.009493146939565e-05, 'batch_size': 16, 'oversample_method': 'adasyn', 'smote_ratio': 0.4698939475344483, 'cnn_channels': 16, 'lstm_hidden_dim': 32, 'context_hidden_dim': 64, 'fusion_hidden_dim': 64, 'dropout': 0.42517589442939435}. Best is trial 44 with value: 0.8049511802403128.
2026-06-12 20:34:10,577 - run_pipeline - INFO - Best CV F1-Macro: 0.8050
2026-06-12 20:34:10,577 - run_pipeline - INFO - Best parameters: {'learning_rate': 0.0026465491241133335, 'weight_decay': 1.848208014230452e-05, 'batch_size': 16, 'oversample_method': 'adasyn', 'smote_ratio': 0.6951374353246801, 'cnn_channels': 16, 'lstm_hidden_dim': 64, 'context_hidden_dim': 128, 'fusion_hidden_dim': 128, 'dropout': 0.35513391105985326}
2026-06-12 20:34:10,582 - preprocessing - INFO - xAPI engineered features created: ['engagement_score', 'absence_risk', 'parent_support_signal']
2026-06-12 20:34:10,584 - preprocessing - INFO - xAPI engineered features created: ['engagement_score', 'absence_risk', 'parent_support_signal']
2026-06-12 20:34:10,598 - preprocessing - INFO - Applying ADASYN on train set with ratio 0.6951374353246801...
2026-06-12 20:34:10,611 - preprocessing - WARNING - ADASYN failed (likely too few samples). Error: No samples will be generated with the provided ratio settings.. Falling back to no oversampling.
2026-06-12 20:34:10,767 - preprocessing - INFO - Feature selection complete. Selected 17 / 19 features.
2026-06-12 20:34:10,778 - run_pipeline - INFO - Training ensemble seed 42.
2026-06-12 20:34:14,184 - train_pipeline - INFO - Early stopping triggered at epoch 21
2026-06-12 20:34:14,212 - run_pipeline - INFO - Training ensemble seed 123.
2026-06-12 20:34:19,353 - train_pipeline - INFO - Early stopping triggered at epoch 31
2026-06-12 20:34:19,381 - run_pipeline - INFO - Training ensemble seed 155.
2026-06-12 20:34:22,239 - train_pipeline - INFO - Early stopping triggered at epoch 17
2026-06-12 20:34:22,259 - run_pipeline - INFO - Training ensemble seed 156.
2026-06-12 20:34:25,825 - train_pipeline - INFO - Early stopping triggered at epoch 22
2026-06-12 20:34:25,854 - run_pipeline - INFO - Training ensemble seed 2025.
2026-06-12 20:34:29,696 - train_pipeline - INFO - Early stopping triggered at epoch 23
2026-06-12 20:34:29,724 - run_pipeline - INFO - Locked-test F1-Macro: 0.7773
2026-06-12 20:34:29,759 - run_pipeline - INFO - Saved metrics, predictions, learning paths and report for xapi.
2026-06-12 20:34:29,759 - explainability - INFO - Calculating permutation importance...
2026-06-12 20:34:30,016 - evaluation - INFO - Persisted PostgreSQL evaluation run 9 for xapi.
2026-06-12 20:34:30,016 - run_pipeline - INFO - PostgreSQL run id: 9
