[I 2026-06-12 19:47:12,375] Trial 9 finished with value: 0.8312744825457272 and parameters: {'learning_rate': 0.001063611364305923, 'weight_decay': 2.5727844492886434e-05, 'batch_size': 64, 'oversample_method': 'smote', 'smote_ratio': 0.5251316305862751, 'cnn_channels': 16, 'lstm_hidden_dim': 32, 'context_hidden_dim': 64, 'fusion_hidden_dim': 128, 'dropout': 0.14483710392769875}. Best is trial 5 with value: 0.8461679206816806.
2026-06-12 19:47:12,400 - preprocessing - INFO - Student engineered features created: ['grade_growth', 'grade_avg', 'absence_study_ratio', 'failure_risk', 'alcohol_risk', 'social_risk']
2026-06-12 19:47:12,401 - preprocessing - INFO - Student engineered features created: ['grade_growth', 'grade_avg', 'absence_study_ratio', 'failure_risk', 'alcohol_risk', 'social_risk']
2026-06-12 19:47:12,442 - preprocessing - INFO - Applying ADASYN on train set with ratio 0.5508025941877255...
2026-06-12 19:47:12,671 - preprocessing - INFO - Feature selection complete. Selected 31 / 38 features.
2026-06-12 19:47:18,318 - train_pipeline - INFO - Early stopping triggered at epoch 37
2026-06-12 19:47:18,323 - preprocessing - INFO - Student engineered features created: ['grade_growth', 'grade_avg', 'absence_study_ratio', 'failure_risk', 'alcohol_risk', 'social_risk']
2026-06-12 19:47:18,326 - preprocessing - INFO - Student engineered features created: ['grade_growth', 'grade_avg', 'absence_study_ratio', 'failure_risk', 'alcohol_risk', 'social_risk']
2026-06-12 19:47:18,367 - preprocessing - INFO - Applying ADASYN on train set with ratio 0.5508025941877255...
2026-06-12 19:47:18,582 - preprocessing - INFO - Feature selection complete. Selected 33 / 38 features.
2026-06-12 19:47:21,302 - train_pipeline - INFO - Early stopping triggered at epoch 18
2026-06-12 19:47:21,320 - preprocessing - INFO - Student engineered features created: ['grade_growth', 'grade_avg', 'absence_study_ratio', 'failure_risk', 'alcohol_risk', 'social_risk']
2026-06-12 19:47:21,322 - preprocessing - INFO - Student engineered features created: ['grade_growth', 'grade_avg', 'absence_study_ratio', 'failure_risk', 'alcohol_risk', 'social_risk']
2026-06-12 19:47:21,371 - preprocessing - INFO - Applying ADASYN on train set with ratio 0.5508025941877255...
2026-06-12 19:47:21,599 - preprocessing - INFO - Feature selection complete. Selected 31 / 38 features.
2026-06-12 19:47:24,527 - train_pipeline - INFO - Early stopping triggered at epoch 19
2026-06-12 19:47:24,539 - preprocessing - INFO - Student engineered features created: ['grade_growth', 'grade_avg', 'absence_study_ratio', 'failure_risk', 'alcohol_risk', 'social_risk']
2026-06-12 19:47:24,543 - preprocessing - INFO - Student engineered features created: ['grade_growth', 'grade_avg', 'absence_study_ratio', 'failure_risk', 'alcohol_risk', 'social_risk']
2026-06-12 19:47:24,576 - preprocessing - INFO - Applying ADASYN on train set with ratio 0.5508025941877255...
2026-06-12 19:47:24,814 - preprocessing - INFO - Feature selection complete. Selected 35 / 38 features.
2026-06-12 19:47:29,231 - train_pipeline - INFO - Early stopping triggered at epoch 29
2026-06-12 19:47:29,231 - preprocessing - INFO - Student engineered features created: ['grade_growth', 'grade_avg', 'absence_study_ratio', 'failure_risk', 'alcohol_risk', 'social_risk']
2026-06-12 19:47:29,238 - preprocessing - INFO - Student engineered features created: ['grade_growth', 'grade_avg', 'absence_study_ratio', 'failure_risk', 'alcohol_risk', 'social_risk']
2026-06-12 19:47:29,286 - preprocessing - INFO - Applying ADASYN on train set with ratio 0.5508025941877255...
2026-06-12 19:47:29,516 - preprocessing - INFO - Feature selection complete. Selected 31 / 38 features.
2026-06-12 19:47:33,387 - train_pipeline - INFO - Early stopping triggered at epoch 25
[I 2026-06-12 19:47:33,387] Trial 10 finished with value: 0.8651336593975858 and parameters: {'learning_rate': 0.00937811405389606, 'weight_decay': 1.1401976343746573e-05, 'batch_size': 32, 'oversample_method': 'adasyn', 'smote_ratio': 0.5508025941877255, 'cnn_channels': 64, 'lstm_hidden_dim': 64, 'context_hidden_dim': 128, 'fusion_hidden_dim': 32, 'dropout': 0.3712067340226881}. Best is trial 10 with value: 0.8651336593975858.
2026-06-12 19:47:33,402 - preprocessing - INFO - Student engineered features created: ['grade_growth', 'grade_avg', 'absence_study_ratio', 'failure_risk', 'alcohol_risk', 'social_risk']
2026-06-12 19:47:33,405 - preprocessing - INFO - Student engineered features created: ['grade_growth', 'grade_avg', 'absence_study_ratio', 'failure_risk', 'alcohol_risk', 'social_risk']
2026-06-12 19:47:33,449 - preprocessing - INFO - Applying ADASYN on train set with ratio 0.5417416885272041...
2026-06-12 19:47:33,680 - preprocessing - INFO - Feature selection complete. Selected 31 / 38 features.
2026-06-12 19:47:39,138 - train_pipeline - INFO - Early stopping triggered at epoch 33
2026-06-12 19:47:39,146 - preprocessing - INFO - Student engineered features created: ['grade_growth', 'grade_avg', 'absence_study_ratio', 'failure_risk', 'alcohol_risk', 'social_risk']
2026-06-12 19:47:39,147 - preprocessing - INFO - Student engineered features created: ['grade_growth', 'grade_avg', 'absence_study_ratio', 'failure_risk', 'alcohol_risk', 'social_risk']
2026-06-12 19:47:39,193 - preprocessing - INFO - Applying ADASYN on train set with ratio 0.5417416885272041...
2026-06-12 19:47:39,434 - preprocessing - INFO - Feature selection complete. Selected 33 / 38 features.
2026-06-12 19:47:42,041 - train_pipeline - INFO - Early stopping triggered at epoch 17
2026-06-12 19:47:42,044 - preprocessing - INFO - Student engineered features created: ['grade_growth', 'grade_avg', 'absence_study_ratio', 'failure_risk', 'alcohol_risk', 'social_risk']
2026-06-12 19:47:42,047 - preprocessing - INFO - Student engineered features created: ['grade_growth', 'grade_avg', 'absence_study_ratio', 'failure_risk', 'alcohol_risk', 'social_risk']
2026-06-12 19:47:42,090 - preprocessing - INFO - Applying ADASYN on train set with ratio 0.5417416885272041...
2026-06-12 19:47:42,316 - preprocessing - INFO - Feature selection complete. Selected 31 / 38 features.
2026-06-12 19:47:44,994 - train_pipeline - INFO - Early stopping triggered at epoch 18
2026-06-12 19:47:45,000 - preprocessing - INFO - Student engineered features created: ['grade_growth', 'grade_avg', 'absence_study_ratio', 'failure_risk', 'alcohol_risk', 'social_risk']
2026-06-12 19:47:45,005 - preprocessing - INFO - Student engineered features created: ['grade_growth', 'grade_avg', 'absence_study_ratio', 'failure_risk', 'alcohol_risk', 'social_risk']
2026-06-12 19:47:45,048 - preprocessing - INFO - Applying ADASYN on train set with ratio 0.5417416885272041...
2026-06-12 19:47:45,257 - preprocessing - INFO - Feature selection complete. Selected 35 / 38 features.
2026-06-12 19:47:51,903 - train_pipeline - INFO - Early stopping triggered at epoch 43
2026-06-12 19:47:51,909 - preprocessing - INFO - Student engineered features created: ['grade_growth', 'grade_avg', 'absence_study_ratio', 'failure_risk', 'alcohol_risk', 'social_risk']
2026-06-12 19:47:51,913 - preprocessing - INFO - Student engineered features created: ['grade_growth', 'grade_avg', 'absence_study_ratio', 'failure_risk', 'alcohol_risk', 'social_risk']
2026-06-12 19:47:51,951 - preprocessing - INFO - Applying ADASYN on train set with ratio 0.5417416885272041...
2026-06-12 19:47:52,187 - preprocessing - INFO - Feature selection complete. Selected 31 / 38 features.
2026-06-12 19:47:55,866 - train_pipeline - INFO - Early stopping triggered at epoch 24
[I 2026-06-12 19:47:55,870] Trial 11 finished with value: 0.8678955456470249 and parameters: {'learning_rate': 0.009490258011320907, 'weight_decay': 1.2909297177746246e-05, 'batch_size': 32, 'oversample_method': 'adasyn', 'smote_ratio': 0.5417416885272041, 'cnn_channels': 64, 'lstm_hidden_dim': 64, 'context_hidden_dim': 128, 'fusion_hidden_dim': 32, 'dropout': 0.37573310420069517}. Best is trial 11 with value: 0.8678955456470249.
2026-06-12 19:47:55,878 - preprocessing - INFO - Student engineered features created: ['grade_growth', 'grade_avg', 'absence_study_ratio', 'failure_risk', 'alcohol_risk', 'social_risk']
2026-06-12 19:47:55,885 - preprocessing - INFO - Student engineered features created: ['grade_growth', 'grade_avg', 'absence_study_ratio', 'failure_risk', 'alcohol_risk', 'social_risk']
2026-06-12 19:47:55,932 - preprocessing - INFO - Applying ADASYN on train set with ratio 0.5530406332238317...
2026-06-12 19:47:56,152 - preprocessing - INFO - Feature selection complete. Selected 31 / 38 features.
2026-06-12 19:48:03,627 - preprocessing - INFO - Student engineered features created: ['grade_growth', 'grade_avg', 'absence_study_ratio', 'failure_risk', 'alcohol_risk', 'social_risk']
2026-06-12 19:48:03,645 - preprocessing - INFO - Student engineered features created: ['grade_growth', 'grade_avg', 'absence_study_ratio', 'failure_risk', 'alcohol_risk', 'social_risk']
2026-06-12 19:48:03,682 - preprocessing - INFO - Applying ADASYN on train set with ratio 0.5530406332238317...
2026-06-12 19:48:03,912 - preprocessing - INFO - Feature selection complete. Selected 33 / 38 features.
2026-06-12 19:48:07,889 - train_pipeline - INFO - Early stopping triggered at epoch 26
2026-06-12 19:48:07,893 - preprocessing - INFO - Student engineered features created: ['grade_growth', 'grade_avg', 'absence_study_ratio', 'failure_risk', 'alcohol_risk', 'social_risk']
2026-06-12 19:48:07,895 - preprocessing - INFO - Student engineered features created: ['grade_growth', 'grade_avg', 'absence_study_ratio', 'failure_risk', 'alcohol_risk', 'social_risk']
2026-06-12 19:48:07,935 - preprocessing - INFO - Applying ADASYN on train set with ratio 0.5530406332238317...
2026-06-12 19:48:08,170 - preprocessing - INFO - Feature selection complete. Selected 31 / 38 features.
2026-06-12 19:48:11,565 - train_pipeline - INFO - Early stopping triggered at epoch 22
2026-06-12 19:48:11,565 - preprocessing - INFO - Student engineered features created: ['grade_growth', 'grade_avg', 'absence_study_ratio', 'failure_risk', 'alcohol_risk', 'social_risk']
2026-06-12 19:48:11,565 - preprocessing - INFO - Student engineered features created: ['grade_growth', 'grade_avg', 'absence_study_ratio', 'failure_risk', 'alcohol_risk', 'social_risk']
2026-06-12 19:48:11,612 - preprocessing - INFO - Applying ADASYN on train set with ratio 0.5530406332238317...
2026-06-12 19:48:11,824 - preprocessing - INFO - Feature selection complete. Selected 35 / 38 features.
2026-06-12 19:48:15,686 - train_pipeline - INFO - Early stopping triggered at epoch 25
2026-06-12 19:48:15,702 - preprocessing - INFO - Student engineered features created: ['grade_growth', 'grade_avg', 'absence_study_ratio', 'failure_risk', 'alcohol_risk', 'social_risk']
2026-06-12 19:48:15,702 - preprocessing - INFO - Student engineered features created: ['grade_growth', 'grade_avg', 'absence_study_ratio', 'failure_risk', 'alcohol_risk', 'social_risk']
2026-06-12 19:48:15,756 - preprocessing - INFO - Applying ADASYN on train set with ratio 0.5530406332238317...
2026-06-12 19:48:15,972 - preprocessing - INFO - Feature selection complete. Selected 31 / 38 features.
[I 2026-06-12 19:48:23,475] Trial 12 finished with value: 0.8530071507298433 and parameters: {'learning_rate': 0.00914871966931705, 'weight_decay': 1.2007915067527621e-05, 'batch_size': 32, 'oversample_method': 'adasyn', 'smote_ratio': 0.5530406332238317, 'cnn_channels': 64, 'lstm_hidden_dim': 64, 'context_hidden_dim': 128, 'fusion_hidden_dim': 32, 'dropout': 0.3615582020332912}. Best is trial 11 with value: 0.8678955456470249.
2026-06-12 19:48:23,482 - preprocessing - INFO - Student engineered features created: ['grade_growth', 'grade_avg', 'absence_study_ratio', 'failure_risk', 'alcohol_risk', 'social_risk']
2026-06-12 19:48:23,482 - preprocessing - INFO - Student engineered features created: ['grade_growth', 'grade_avg', 'absence_study_ratio', 'failure_risk', 'alcohol_risk', 'social_risk']
2026-06-12 19:48:23,535 - preprocessing - INFO - Applying ADASYN on train set with ratio 0.5884381212986586...
2026-06-12 19:48:23,753 - preprocessing - INFO - Feature selection complete. Selected 31 / 38 features.
2026-06-12 19:48:31,162 - train_pipeline - INFO - Early stopping triggered at epoch 47
2026-06-12 19:48:31,174 - preprocessing - INFO - Student engineered features created: ['grade_growth', 'grade_avg', 'absence_study_ratio', 'failure_risk', 'alcohol_risk', 'social_risk']
2026-06-12 19:48:31,177 - preprocessing - INFO - Student engineered features created: ['grade_growth', 'grade_avg', 'absence_study_ratio', 'failure_risk', 'alcohol_risk', 'social_risk']
2026-06-12 19:48:31,212 - preprocessing - INFO - Applying ADASYN on train set with ratio 0.5884381212986586...
2026-06-12 19:48:31,440 - preprocessing - INFO - Feature selection complete. Selected 32 / 38 features.
2026-06-12 19:48:39,507 - preprocessing - INFO - Student engineered features created: ['grade_growth', 'grade_avg', 'absence_study_ratio', 'failure_risk', 'alcohol_risk', 'social_risk']
2026-06-12 19:48:39,508 - preprocessing - INFO - Student engineered features created: ['grade_growth', 'grade_avg', 'absence_study_ratio', 'failure_risk', 'alcohol_risk', 'social_risk']
2026-06-12 19:48:39,549 - preprocessing - INFO - Applying ADASYN on train set with ratio 0.5884381212986586...
2026-06-12 19:48:39,767 - preprocessing - INFO - Feature selection complete. Selected 34 / 38 features.
2026-06-12 19:48:43,139 - train_pipeline - INFO - Early stopping triggered at epoch 21
2026-06-12 19:48:43,151 - preprocessing - INFO - Student engineered features created: ['grade_growth', 'grade_avg', 'absence_study_ratio', 'failure_risk', 'alcohol_risk', 'social_risk']
2026-06-12 19:48:43,157 - preprocessing - INFO - Student engineered features created: ['grade_growth', 'grade_avg', 'absence_study_ratio', 'failure_risk', 'alcohol_risk', 'social_risk']
2026-06-12 19:48:43,205 - preprocessing - INFO - Applying ADASYN on train set with ratio 0.5884381212986586...
2026-06-12 19:48:43,419 - preprocessing - INFO - Feature selection complete. Selected 35 / 38 features.
2026-06-12 19:48:47,978 - train_pipeline - INFO - Early stopping triggered at epoch 26
2026-06-12 19:48:47,986 - preprocessing - INFO - Student engineered features created: ['grade_growth', 'grade_avg', 'absence_study_ratio', 'failure_risk', 'alcohol_risk', 'social_risk']
2026-06-12 19:48:47,990 - preprocessing - INFO - Student engineered features created: ['grade_growth', 'grade_avg', 'absence_study_ratio', 'failure_risk', 'alcohol_risk', 'social_risk']
2026-06-12 19:48:48,027 - preprocessing - INFO - Applying ADASYN on train set with ratio 0.5884381212986586...
2026-06-12 19:48:48,270 - preprocessing - INFO - Feature selection complete. Selected 33 / 38 features.
2026-06-12 19:48:55,179 - train_pipeline - INFO - Early stopping triggered at epoch 42
[I 2026-06-12 19:48:55,181] Trial 13 finished with value: 0.8455577371797117 and parameters: {'learning_rate': 0.00864409286569478, 'weight_decay': 1.1936866791082689e-05, 'batch_size': 32, 'oversample_method': 'adasyn', 'smote_ratio': 0.5884381212986586, 'cnn_channels': 64, 'lstm_hidden_dim': 64, 'context_hidden_dim': 128, 'fusion_hidden_dim': 32, 'dropout': 0.3622908838682156}. Best is trial 11 with value: 0.8678955456470249.
2026-06-12 19:48:55,193 - preprocessing - INFO - Student engineered features created: ['grade_growth', 'grade_avg', 'absence_study_ratio', 'failure_risk', 'alcohol_risk', 'social_risk']
2026-06-12 19:48:55,193 - preprocessing - INFO - Student engineered features created: ['grade_growth', 'grade_avg', 'absence_study_ratio', 'failure_risk', 'alcohol_risk', 'social_risk']
2026-06-12 19:48:55,241 - preprocessing - INFO - Applying ADASYN on train set with ratio 0.48462568971553793...
2026-06-12 19:48:55,461 - preprocessing - INFO - Feature selection complete. Selected 32 / 38 features.
2026-06-12 19:49:00,459 - train_pipeline - INFO - Early stopping triggered at epoch 35
2026-06-12 19:49:00,477 - preprocessing - INFO - Student engineered features created: ['grade_growth', 'grade_avg', 'absence_study_ratio', 'failure_risk', 'alcohol_risk', 'social_risk']
2026-06-12 19:49:00,480 - preprocessing - INFO - Student engineered features created: ['grade_growth', 'grade_avg', 'absence_study_ratio', 'failure_risk', 'alcohol_risk', 'social_risk']
2026-06-12 19:49:00,525 - preprocessing - INFO - Applying ADASYN on train set with ratio 0.48462568971553793...
2026-06-12 19:49:00,740 - preprocessing - INFO - Feature selection complete. Selected 33 / 38 features.
2026-06-12 19:49:03,491 - train_pipeline - INFO - Early stopping triggered at epoch 19
2026-06-12 19:49:03,495 - preprocessing - INFO - Student engineered features created: ['grade_growth', 'grade_avg', 'absence_study_ratio', 'failure_risk', 'alcohol_risk', 'social_risk']
2026-06-12 19:49:03,497 - preprocessing - INFO - Student engineered features created: ['grade_growth', 'grade_avg', 'absence_study_ratio', 'failure_risk', 'alcohol_risk', 'social_risk']
2026-06-12 19:49:03,539 - preprocessing - INFO - Applying ADASYN on train set with ratio 0.48462568971553793...
2026-06-12 19:49:03,764 - preprocessing - INFO - Feature selection complete. Selected 27 / 38 features.
2026-06-12 19:49:06,189 - train_pipeline - INFO - Early stopping triggered at epoch 17
2026-06-12 19:49:06,203 - preprocessing - INFO - Student engineered features created: ['grade_growth', 'grade_avg', 'absence_study_ratio', 'failure_risk', 'alcohol_risk', 'social_risk']
2026-06-12 19:49:06,207 - preprocessing - INFO - Student engineered features created: ['grade_growth', 'grade_avg', 'absence_study_ratio', 'failure_risk', 'alcohol_risk', 'social_risk']
2026-06-12 19:49:06,251 - preprocessing - INFO - Applying ADASYN on train set with ratio 0.48462568971553793...
2026-06-12 19:49:06,464 - preprocessing - INFO - Feature selection complete. Selected 35 / 38 features.
2026-06-12 19:49:11,531 - train_pipeline - INFO - Early stopping triggered at epoch 35
2026-06-12 19:49:11,531 - preprocessing - INFO - Student engineered features created: ['grade_growth', 'grade_avg', 'absence_study_ratio', 'failure_risk', 'alcohol_risk', 'social_risk']
2026-06-12 19:49:11,531 - preprocessing - INFO - Student engineered features created: ['grade_growth', 'grade_avg', 'absence_study_ratio', 'failure_risk', 'alcohol_risk', 'social_risk']
2026-06-12 19:49:11,586 - preprocessing - INFO - Applying ADASYN on train set with ratio 0.48462568971553793...
2026-06-12 19:49:11,800 - preprocessing - INFO - Feature selection complete. Selected 29 / 38 features.
2026-06-12 19:49:15,610 - train_pipeline - INFO - Early stopping triggered at epoch 27
