[I 2026-06-12 19:58:56,554] Trial 44 finished with value: 0.8819922864153069 and parameters: {'learning_rate': 0.007430137715330928, 'weight_decay': 1.1830028316521304e-06, 'batch_size': 64, 'oversample_method': 'smote', 'smote_ratio': 0.519926682379124, 'cnn_channels': 32, 'lstm_hidden_dim': 64, 'context_hidden_dim': 64, 'fusion_hidden_dim': 32, 'dropout': 0.14964553000031822}. Best is trial 21 with value: 0.8897981256933332.
2026-06-12 19:58:56,576 - preprocessing - INFO - Student engineered features created: ['grade_growth', 'grade_avg', 'absence_study_ratio', 'failure_risk', 'alcohol_risk', 'social_risk']
2026-06-12 19:58:56,581 - preprocessing - INFO - Student engineered features created: ['grade_growth', 'grade_avg', 'absence_study_ratio', 'failure_risk', 'alcohol_risk', 'social_risk']
2026-06-12 19:58:56,626 - preprocessing - INFO - Applying SMOTE on train set with ratio 0.5651972060048907...
2026-06-12 19:58:56,838 - preprocessing - INFO - Feature selection complete. Selected 30 / 38 features.
2026-06-12 19:59:03,986 - preprocessing - INFO - Student engineered features created: ['grade_growth', 'grade_avg', 'absence_study_ratio', 'failure_risk', 'alcohol_risk', 'social_risk']
2026-06-12 19:59:03,988 - preprocessing - INFO - Student engineered features created: ['grade_growth', 'grade_avg', 'absence_study_ratio', 'failure_risk', 'alcohol_risk', 'social_risk']
2026-06-12 19:59:04,047 - preprocessing - INFO - Applying SMOTE on train set with ratio 0.5651972060048907...
2026-06-12 19:59:04,275 - preprocessing - INFO - Feature selection complete. Selected 34 / 38 features.
2026-06-12 19:59:11,020 - train_pipeline - INFO - Early stopping triggered at epoch 47
2026-06-12 19:59:11,027 - preprocessing - INFO - Student engineered features created: ['grade_growth', 'grade_avg', 'absence_study_ratio', 'failure_risk', 'alcohol_risk', 'social_risk']
2026-06-12 19:59:11,033 - preprocessing - INFO - Student engineered features created: ['grade_growth', 'grade_avg', 'absence_study_ratio', 'failure_risk', 'alcohol_risk', 'social_risk']
2026-06-12 19:59:11,081 - preprocessing - INFO - Applying SMOTE on train set with ratio 0.5651972060048907...
2026-06-12 19:59:11,279 - preprocessing - INFO - Feature selection complete. Selected 31 / 38 features.
2026-06-12 19:59:18,312 - train_pipeline - INFO - Early stopping triggered at epoch 50
2026-06-12 19:59:18,317 - preprocessing - INFO - Student engineered features created: ['grade_growth', 'grade_avg', 'absence_study_ratio', 'failure_risk', 'alcohol_risk', 'social_risk']
2026-06-12 19:59:18,320 - preprocessing - INFO - Student engineered features created: ['grade_growth', 'grade_avg', 'absence_study_ratio', 'failure_risk', 'alcohol_risk', 'social_risk']
2026-06-12 19:59:18,369 - preprocessing - INFO - Applying SMOTE on train set with ratio 0.5651972060048907...
2026-06-12 19:59:18,583 - preprocessing - INFO - Feature selection complete. Selected 35 / 38 features.
2026-06-12 19:59:23,362 - train_pipeline - INFO - Early stopping triggered at epoch 33
2026-06-12 19:59:23,362 - preprocessing - INFO - Student engineered features created: ['grade_growth', 'grade_avg', 'absence_study_ratio', 'failure_risk', 'alcohol_risk', 'social_risk']
2026-06-12 19:59:23,368 - preprocessing - INFO - Student engineered features created: ['grade_growth', 'grade_avg', 'absence_study_ratio', 'failure_risk', 'alcohol_risk', 'social_risk']
2026-06-12 19:59:23,416 - preprocessing - INFO - Applying SMOTE on train set with ratio 0.5651972060048907...
2026-06-12 19:59:23,728 - preprocessing - INFO - Feature selection complete. Selected 31 / 38 features.
[I 2026-06-12 19:59:31,276] Trial 45 finished with value: 0.8421886253193243 and parameters: {'learning_rate': 0.000369286453145914, 'weight_decay': 1.809994132222259e-06, 'batch_size': 32, 'oversample_method': 'smote', 'smote_ratio': 0.5651972060048907, 'cnn_channels': 32, 'lstm_hidden_dim': 32, 'context_hidden_dim': 64, 'fusion_hidden_dim': 128, 'dropout': 0.14773983563636212}. Best is trial 21 with value: 0.8897981256933332.
2026-06-12 19:59:31,276 - preprocessing - INFO - Student engineered features created: ['grade_growth', 'grade_avg', 'absence_study_ratio', 'failure_risk', 'alcohol_risk', 'social_risk']
2026-06-12 19:59:31,292 - preprocessing - INFO - Student engineered features created: ['grade_growth', 'grade_avg', 'absence_study_ratio', 'failure_risk', 'alcohol_risk', 'social_risk']
2026-06-12 19:59:31,339 - preprocessing - INFO - Applying SMOTE on train set with ratio 0.520142111401417...
2026-06-12 19:59:31,548 - preprocessing - INFO - Feature selection complete. Selected 31 / 38 features.
2026-06-12 19:59:33,330 - train_pipeline - INFO - Early stopping triggered at epoch 20
2026-06-12 19:59:33,344 - preprocessing - INFO - Student engineered features created: ['grade_growth', 'grade_avg', 'absence_study_ratio', 'failure_risk', 'alcohol_risk', 'social_risk']
2026-06-12 19:59:33,344 - preprocessing - INFO - Student engineered features created: ['grade_growth', 'grade_avg', 'absence_study_ratio', 'failure_risk', 'alcohol_risk', 'social_risk']
2026-06-12 19:59:33,392 - preprocessing - INFO - Applying SMOTE on train set with ratio 0.520142111401417...
2026-06-12 19:59:33,600 - preprocessing - INFO - Feature selection complete. Selected 33 / 38 features.
2026-06-12 19:59:35,538 - train_pipeline - INFO - Early stopping triggered at epoch 22
2026-06-12 19:59:35,543 - preprocessing - INFO - Student engineered features created: ['grade_growth', 'grade_avg', 'absence_study_ratio', 'failure_risk', 'alcohol_risk', 'social_risk']
2026-06-12 19:59:35,547 - preprocessing - INFO - Student engineered features created: ['grade_growth', 'grade_avg', 'absence_study_ratio', 'failure_risk', 'alcohol_risk', 'social_risk']
2026-06-12 19:59:35,585 - preprocessing - INFO - Applying SMOTE on train set with ratio 0.520142111401417...
2026-06-12 19:59:35,804 - preprocessing - INFO - Feature selection complete. Selected 32 / 38 features.
2026-06-12 19:59:37,479 - train_pipeline - INFO - Early stopping triggered at epoch 19
2026-06-12 19:59:37,483 - preprocessing - INFO - Student engineered features created: ['grade_growth', 'grade_avg', 'absence_study_ratio', 'failure_risk', 'alcohol_risk', 'social_risk']
2026-06-12 19:59:37,485 - preprocessing - INFO - Student engineered features created: ['grade_growth', 'grade_avg', 'absence_study_ratio', 'failure_risk', 'alcohol_risk', 'social_risk']
2026-06-12 19:59:37,527 - preprocessing - INFO - Applying SMOTE on train set with ratio 0.520142111401417...
2026-06-12 19:59:37,750 - preprocessing - INFO - Feature selection complete. Selected 35 / 38 features.
2026-06-12 19:59:39,697 - train_pipeline - INFO - Early stopping triggered at epoch 21
2026-06-12 19:59:39,699 - preprocessing - INFO - Student engineered features created: ['grade_growth', 'grade_avg', 'absence_study_ratio', 'failure_risk', 'alcohol_risk', 'social_risk']
2026-06-12 19:59:39,699 - preprocessing - INFO - Student engineered features created: ['grade_growth', 'grade_avg', 'absence_study_ratio', 'failure_risk', 'alcohol_risk', 'social_risk']
2026-06-12 19:59:39,761 - preprocessing - INFO - Applying SMOTE on train set with ratio 0.520142111401417...
2026-06-12 19:59:39,984 - preprocessing - INFO - Feature selection complete. Selected 31 / 38 features.
2026-06-12 19:59:43,284 - train_pipeline - INFO - Early stopping triggered at epoch 34
[I 2026-06-12 19:59:43,284] Trial 46 finished with value: 0.863773580901001 and parameters: {'learning_rate': 0.002844685644491804, 'weight_decay': 5.0148751643681546e-06, 'batch_size': 64, 'oversample_method': 'smote', 'smote_ratio': 0.520142111401417, 'cnn_channels': 64, 'lstm_hidden_dim': 64, 'context_hidden_dim': 128, 'fusion_hidden_dim': 32, 'dropout': 0.17582861961060373}. Best is trial 21 with value: 0.8897981256933332.
2026-06-12 19:59:43,300 - preprocessing - INFO - Student engineered features created: ['grade_growth', 'grade_avg', 'absence_study_ratio', 'failure_risk', 'alcohol_risk', 'social_risk']
2026-06-12 19:59:43,300 - preprocessing - INFO - Student engineered features created: ['grade_growth', 'grade_avg', 'absence_study_ratio', 'failure_risk', 'alcohol_risk', 'social_risk']
2026-06-12 19:59:43,355 - preprocessing - INFO - Applying SMOTE on train set with ratio 0.533382227572174...
2026-06-12 19:59:43,570 - preprocessing - INFO - Feature selection complete. Selected 32 / 38 features.
2026-06-12 19:59:50,023 - train_pipeline - INFO - Early stopping triggered at epoch 43
2026-06-12 19:59:50,023 - preprocessing - INFO - Student engineered features created: ['grade_growth', 'grade_avg', 'absence_study_ratio', 'failure_risk', 'alcohol_risk', 'social_risk']
2026-06-12 19:59:50,023 - preprocessing - INFO - Student engineered features created: ['grade_growth', 'grade_avg', 'absence_study_ratio', 'failure_risk', 'alcohol_risk', 'social_risk']
2026-06-12 19:59:50,074 - preprocessing - INFO - Applying SMOTE on train set with ratio 0.533382227572174...
2026-06-12 19:59:50,294 - preprocessing - INFO - Feature selection complete. Selected 35 / 38 features.
2026-06-12 19:59:53,032 - train_pipeline - INFO - Early stopping triggered at epoch 18
2026-06-12 19:59:53,032 - preprocessing - INFO - Student engineered features created: ['grade_growth', 'grade_avg', 'absence_study_ratio', 'failure_risk', 'alcohol_risk', 'social_risk']
2026-06-12 19:59:53,032 - preprocessing - INFO - Student engineered features created: ['grade_growth', 'grade_avg', 'absence_study_ratio', 'failure_risk', 'alcohol_risk', 'social_risk']
2026-06-12 19:59:53,096 - preprocessing - INFO - Applying SMOTE on train set with ratio 0.533382227572174...
2026-06-12 19:59:53,317 - preprocessing - INFO - Feature selection complete. Selected 31 / 38 features.
2026-06-12 19:59:56,531 - train_pipeline - INFO - Early stopping triggered at epoch 21
2026-06-12 19:59:56,531 - preprocessing - INFO - Student engineered features created: ['grade_growth', 'grade_avg', 'absence_study_ratio', 'failure_risk', 'alcohol_risk', 'social_risk']
2026-06-12 19:59:56,543 - preprocessing - INFO - Student engineered features created: ['grade_growth', 'grade_avg', 'absence_study_ratio', 'failure_risk', 'alcohol_risk', 'social_risk']
2026-06-12 19:59:56,577 - preprocessing - INFO - Applying SMOTE on train set with ratio 0.533382227572174...
2026-06-12 19:59:56,799 - preprocessing - INFO - Feature selection complete. Selected 35 / 38 features.
2026-06-12 20:00:04,008 - train_pipeline - INFO - Early stopping triggered at epoch 47
2026-06-12 20:00:04,008 - preprocessing - INFO - Student engineered features created: ['grade_growth', 'grade_avg', 'absence_study_ratio', 'failure_risk', 'alcohol_risk', 'social_risk']
2026-06-12 20:00:04,014 - preprocessing - INFO - Student engineered features created: ['grade_growth', 'grade_avg', 'absence_study_ratio', 'failure_risk', 'alcohol_risk', 'social_risk']
2026-06-12 20:00:04,056 - preprocessing - INFO - Applying SMOTE on train set with ratio 0.533382227572174...
2026-06-12 20:00:04,271 - preprocessing - INFO - Feature selection complete. Selected 31 / 38 features.
2026-06-12 20:00:10,753 - train_pipeline - INFO - Early stopping triggered at epoch 43
[I 2026-06-12 20:00:10,758] Trial 47 finished with value: 0.8685677252566839 and parameters: {'learning_rate': 0.008039788859542086, 'weight_decay': 1.6603553276025848e-05, 'batch_size': 32, 'oversample_method': 'smote', 'smote_ratio': 0.533382227572174, 'cnn_channels': 64, 'lstm_hidden_dim': 64, 'context_hidden_dim': 64, 'fusion_hidden_dim': 64, 'dropout': 0.1897739638034992}. Best is trial 21 with value: 0.8897981256933332.
2026-06-12 20:00:10,767 - preprocessing - INFO - Student engineered features created: ['grade_growth', 'grade_avg', 'absence_study_ratio', 'failure_risk', 'alcohol_risk', 'social_risk']
2026-06-12 20:00:10,767 - preprocessing - INFO - Student engineered features created: ['grade_growth', 'grade_avg', 'absence_study_ratio', 'failure_risk', 'alcohol_risk', 'social_risk']
2026-06-12 20:00:10,816 - preprocessing - INFO - Applying SMOTE on train set with ratio 0.46747302005338737...
2026-06-12 20:00:11,022 - preprocessing - INFO - Feature selection complete. Selected 31 / 38 features.
2026-06-12 20:00:15,221 - preprocessing - INFO - Student engineered features created: ['grade_growth', 'grade_avg', 'absence_study_ratio', 'failure_risk', 'alcohol_risk', 'social_risk']
2026-06-12 20:00:15,221 - preprocessing - INFO - Student engineered features created: ['grade_growth', 'grade_avg', 'absence_study_ratio', 'failure_risk', 'alcohol_risk', 'social_risk']
2026-06-12 20:00:15,267 - preprocessing - INFO - Applying SMOTE on train set with ratio 0.46747302005338737...
2026-06-12 20:00:15,482 - preprocessing - INFO - Feature selection complete. Selected 34 / 38 features.
2026-06-12 20:00:17,952 - train_pipeline - INFO - Early stopping triggered at epoch 29
2026-06-12 20:00:17,952 - preprocessing - INFO - Student engineered features created: ['grade_growth', 'grade_avg', 'absence_study_ratio', 'failure_risk', 'alcohol_risk', 'social_risk']
2026-06-12 20:00:17,959 - preprocessing - INFO - Student engineered features created: ['grade_growth', 'grade_avg', 'absence_study_ratio', 'failure_risk', 'alcohol_risk', 'social_risk']
2026-06-12 20:00:18,008 - preprocessing - INFO - Applying SMOTE on train set with ratio 0.46747302005338737...
2026-06-12 20:00:18,223 - preprocessing - INFO - Feature selection complete. Selected 29 / 38 features.
2026-06-12 20:00:20,342 - train_pipeline - INFO - Early stopping triggered at epoch 25
2026-06-12 20:00:20,345 - preprocessing - INFO - Student engineered features created: ['grade_growth', 'grade_avg', 'absence_study_ratio', 'failure_risk', 'alcohol_risk', 'social_risk']
2026-06-12 20:00:20,345 - preprocessing - INFO - Student engineered features created: ['grade_growth', 'grade_avg', 'absence_study_ratio', 'failure_risk', 'alcohol_risk', 'social_risk']
2026-06-12 20:00:20,389 - preprocessing - INFO - Applying SMOTE on train set with ratio 0.46747302005338737...
2026-06-12 20:00:20,611 - preprocessing - INFO - Feature selection complete. Selected 34 / 38 features.
2026-06-12 20:00:23,967 - train_pipeline - INFO - Early stopping triggered at epoch 39
2026-06-12 20:00:23,973 - preprocessing - INFO - Student engineered features created: ['grade_growth', 'grade_avg', 'absence_study_ratio', 'failure_risk', 'alcohol_risk', 'social_risk']
2026-06-12 20:00:23,973 - preprocessing - INFO - Student engineered features created: ['grade_growth', 'grade_avg', 'absence_study_ratio', 'failure_risk', 'alcohol_risk', 'social_risk']
2026-06-12 20:00:24,023 - preprocessing - INFO - Applying SMOTE on train set with ratio 0.46747302005338737...
2026-06-12 20:00:24,243 - preprocessing - INFO - Feature selection complete. Selected 30 / 38 features.
2026-06-12 20:00:27,199 - train_pipeline - INFO - Early stopping triggered at epoch 35
[I 2026-06-12 20:00:27,199] Trial 48 finished with value: 0.8527921746708271 and parameters: {'learning_rate': 0.009977003211428727, 'weight_decay': 8.190919414044169e-06, 'batch_size': 64, 'oversample_method': 'smote', 'smote_ratio': 0.46747302005338737, 'cnn_channels': 16, 'lstm_hidden_dim': 64, 'context_hidden_dim': 128, 'fusion_hidden_dim': 32, 'dropout': 0.44776428985041766}. Best is trial 21 with value: 0.8897981256933332.
2026-06-12 20:00:27,220 - preprocessing - INFO - Student engineered features created: ['grade_growth', 'grade_avg', 'absence_study_ratio', 'failure_risk', 'alcohol_risk', 'social_risk']
2026-06-12 20:00:27,227 - preprocessing - INFO - Student engineered features created: ['grade_growth', 'grade_avg', 'absence_study_ratio', 'failure_risk', 'alcohol_risk', 'social_risk']
2026-06-12 20:00:27,269 - preprocessing - INFO - Applying SMOTE on train set with ratio 0.6255336702048147...
2026-06-12 20:00:27,493 - preprocessing - INFO - Feature selection complete. Selected 31 / 38 features.
2026-06-12 20:00:31,487 - train_pipeline - INFO - Early stopping triggered at epoch 28
2026-06-12 20:00:31,496 - preprocessing - INFO - Student engineered features created: ['grade_growth', 'grade_avg', 'absence_study_ratio', 'failure_risk', 'alcohol_risk', 'social_risk']
2026-06-12 20:00:31,500 - preprocessing - INFO - Student engineered features created: ['grade_growth', 'grade_avg', 'absence_study_ratio', 'failure_risk', 'alcohol_risk', 'social_risk']
2026-06-12 20:00:31,548 - preprocessing - INFO - Applying SMOTE on train set with ratio 0.6255336702048147...
2026-06-12 20:00:31,767 - preprocessing - INFO - Feature selection complete. Selected 34 / 38 features.
2026-06-12 20:00:35,323 - train_pipeline - INFO - Early stopping triggered at epoch 24
2026-06-12 20:00:35,330 - preprocessing - INFO - Student engineered features created: ['grade_growth', 'grade_avg', 'absence_study_ratio', 'failure_risk', 'alcohol_risk', 'social_risk']
2026-06-12 20:00:35,330 - preprocessing - INFO - Student engineered features created: ['grade_growth', 'grade_avg', 'absence_study_ratio', 'failure_risk', 'alcohol_risk', 'social_risk']
2026-06-12 20:00:35,386 - preprocessing - INFO - Applying SMOTE on train set with ratio 0.6255336702048147...
2026-06-12 20:00:35,594 - preprocessing - INFO - Feature selection complete. Selected 31 / 38 features.
2026-06-12 20:00:38,688 - train_pipeline - INFO - Early stopping triggered at epoch 21
2026-06-12 20:00:38,696 - preprocessing - INFO - Student engineered features created: ['grade_growth', 'grade_avg', 'absence_study_ratio', 'failure_risk', 'alcohol_risk', 'social_risk']
2026-06-12 20:00:38,699 - preprocessing - INFO - Student engineered features created: ['grade_growth', 'grade_avg', 'absence_study_ratio', 'failure_risk', 'alcohol_risk', 'social_risk']
2026-06-12 20:00:38,745 - preprocessing - INFO - Applying SMOTE on train set with ratio 0.6255336702048147...
2026-06-12 20:00:38,945 - preprocessing - INFO - Feature selection complete. Selected 35 / 38 features.
2026-06-12 20:00:41,629 - train_pipeline - INFO - Early stopping triggered at epoch 18
2026-06-12 20:00:41,636 - preprocessing - INFO - Student engineered features created: ['grade_growth', 'grade_avg', 'absence_study_ratio', 'failure_risk', 'alcohol_risk', 'social_risk']
2026-06-12 20:00:41,636 - preprocessing - INFO - Student engineered features created: ['grade_growth', 'grade_avg', 'absence_study_ratio', 'failure_risk', 'alcohol_risk', 'social_risk']
2026-06-12 20:00:41,687 - preprocessing - INFO - Applying SMOTE on train set with ratio 0.6255336702048147...
2026-06-12 20:00:41,904 - preprocessing - INFO - Feature selection complete. Selected 31 / 38 features.
2026-06-12 20:00:45,931 - train_pipeline - INFO - Early stopping triggered at epoch 28
[I 2026-06-12 20:00:45,937] Trial 49 finished with value: 0.8600152838557487 and parameters: {'learning_rate': 0.0050994427465070585, 'weight_decay': 3.479518317121823e-05, 'batch_size': 32, 'oversample_method': 'smote', 'smote_ratio': 0.6255336702048147, 'cnn_channels': 32, 'lstm_hidden_dim': 32, 'context_hidden_dim': 32, 'fusion_hidden_dim': 32, 'dropout': 0.1204115883419481}. Best is trial 21 with value: 0.8897981256933332.
2026-06-12 20:00:45,937 - run_pipeline - INFO - Best CV F1-Macro: 0.8898
2026-06-12 20:00:45,937 - run_pipeline - INFO - Best parameters: {'learning_rate': 0.0049509130573654235, 'weight_decay': 5.1938026547695015e-05, 'batch_size': 64, 'oversample_method': 'adasyn', 'smote_ratio': 0.46782851025555244, 'cnn_channels': 64, 'lstm_hidden_dim': 64, 'context_hidden_dim': 32, 'fusion_hidden_dim': 32, 'dropout': 0.18467328187693013}
2026-06-12 20:00:45,937 - preprocessing - INFO - Student engineered features created: ['grade_growth', 'grade_avg', 'absence_study_ratio', 'failure_risk', 'alcohol_risk', 'social_risk']
2026-06-12 20:00:45,944 - preprocessing - INFO - Student engineered features created: ['grade_growth', 'grade_avg', 'absence_study_ratio', 'failure_risk', 'alcohol_risk', 'social_risk']
2026-06-12 20:00:45,994 - preprocessing - INFO - Applying ADASYN on train set with ratio 0.46782851025555244...
2026-06-12 20:00:46,250 - preprocessing - INFO - Feature selection complete. Selected 32 / 38 features.
2026-06-12 20:00:46,283 - run_pipeline - INFO - Training ensemble seed 42.
2026-06-12 20:00:49,788 - train_pipeline - INFO - Early stopping triggered at epoch 41
2026-06-12 20:00:49,820 - run_pipeline - INFO - Training ensemble seed 123.
2026-06-12 20:00:53,313 - train_pipeline - INFO - Early stopping triggered at epoch 39
2026-06-12 20:00:53,335 - run_pipeline - INFO - Training ensemble seed 155.
2026-06-12 20:01:00,485 - run_pipeline - INFO - Training ensemble seed 156.
2026-06-12 20:01:04,474 - train_pipeline - INFO - Early stopping triggered at epoch 45
2026-06-12 20:01:04,481 - run_pipeline - INFO - Training ensemble seed 2025.
2026-06-12 20:01:06,320 - train_pipeline - INFO - Early stopping triggered at epoch 21
2026-06-12 20:01:06,341 - run_pipeline - INFO - Locked-test F1-Macro: 0.8394
2026-06-12 20:01:06,383 - run_pipeline - INFO - Saved metrics, predictions, learning paths and report for student-por.
2026-06-12 20:01:06,383 - explainability - INFO - Calculating permutation importance...
2026-06-12 20:01:06,877 - evaluation - INFO - Persisted PostgreSQL evaluation run 7 for student-por.
2026-06-12 20:01:06,877 - run_pipeline - INFO - PostgreSQL run id: 7
