2026-06-12 20:18:46,847 - run_pipeline - INFO - Starting approved thesis pipeline for xapi.
2026-06-12 20:18:46,852 - run_pipeline - INFO - Starting Optuna optimization with 50 trials.
[I 2026-06-12 20:18:46,854] A new study created in memory with name: no-name-f9a4edc4-498f-43ac-90c7-599dcd25593a
2026-06-12 20:18:46,860 - preprocessing - INFO - xAPI engineered features created: ['engagement_score', 'absence_risk', 'parent_support_signal']
2026-06-12 20:18:46,863 - preprocessing - INFO - xAPI engineered features created: ['engagement_score', 'absence_risk', 'parent_support_signal']
2026-06-12 20:18:46,879 - preprocessing - INFO - Applying ADASYN on train set with ratio 0.9795219046245539...
2026-06-12 20:18:48,519 - preprocessing - INFO - Feature selection complete. Selected 18 / 19 features.
2026-06-12 20:18:53,413 - train_pipeline - INFO - Early stopping triggered at epoch 45
2026-06-12 20:18:53,413 - preprocessing - INFO - xAPI engineered features created: ['engagement_score', 'absence_risk', 'parent_support_signal']
2026-06-12 20:18:53,421 - preprocessing - INFO - xAPI engineered features created: ['engagement_score', 'absence_risk', 'parent_support_signal']
2026-06-12 20:18:53,428 - preprocessing - INFO - Applying ADASYN on train set with ratio 0.9795219046245539...
2026-06-12 20:18:53,588 - preprocessing - INFO - Feature selection complete. Selected 17 / 19 features.
2026-06-12 20:18:56,141 - train_pipeline - INFO - Early stopping triggered at epoch 35
2026-06-12 20:18:56,155 - preprocessing - INFO - xAPI engineered features created: ['engagement_score', 'absence_risk', 'parent_support_signal']
2026-06-12 20:18:56,155 - preprocessing - INFO - xAPI engineered features created: ['engagement_score', 'absence_risk', 'parent_support_signal']
2026-06-12 20:18:56,175 - preprocessing - INFO - Applying ADASYN on train set with ratio 0.9795219046245539...
2026-06-12 20:18:56,328 - preprocessing - INFO - Feature selection complete. Selected 18 / 19 features.
2026-06-12 20:18:59,865 - preprocessing - INFO - xAPI engineered features created: ['engagement_score', 'absence_risk', 'parent_support_signal']
2026-06-12 20:18:59,865 - preprocessing - INFO - xAPI engineered features created: ['engagement_score', 'absence_risk', 'parent_support_signal']
2026-06-12 20:18:59,889 - preprocessing - INFO - Applying ADASYN on train set with ratio 0.9795219046245539...
2026-06-12 20:19:00,047 - preprocessing - INFO - Feature selection complete. Selected 18 / 19 features.
2026-06-12 20:19:01,567 - train_pipeline - INFO - Early stopping triggered at epoch 22
2026-06-12 20:19:01,582 - preprocessing - INFO - xAPI engineered features created: ['engagement_score', 'absence_risk', 'parent_support_signal']
2026-06-12 20:19:01,582 - preprocessing - INFO - xAPI engineered features created: ['engagement_score', 'absence_risk', 'parent_support_signal']
2026-06-12 20:19:01,597 - preprocessing - INFO - Applying ADASYN on train set with ratio 0.9795219046245539...
2026-06-12 20:19:01,750 - preprocessing - INFO - Feature selection complete. Selected 18 / 19 features.
2026-06-12 20:19:04,875 - train_pipeline - INFO - Early stopping triggered at epoch 46
[I 2026-06-12 20:19:04,875] Trial 0 finished with value: 0.7374528908193347 and parameters: {'learning_rate': 0.0012788643698738377, 'weight_decay': 1.417628839510878e-06, 'batch_size': 64, 'oversample_method': 'adasyn', 'smote_ratio': 0.9795219046245539, 'cnn_channels': 64, 'lstm_hidden_dim': 32, 'context_hidden_dim': 64, 'fusion_hidden_dim': 64, 'dropout': 0.34247118895963047}. Best is trial 0 with value: 0.7374528908193347.
2026-06-12 20:19:04,889 - preprocessing - INFO - xAPI engineered features created: ['engagement_score', 'absence_risk', 'parent_support_signal']
2026-06-12 20:19:04,889 - preprocessing - INFO - xAPI engineered features created: ['engagement_score', 'absence_risk', 'parent_support_signal']
2026-06-12 20:19:04,910 - preprocessing - INFO - Applying ADASYN on train set with ratio 0.686996761665843...
2026-06-12 20:19:04,917 - preprocessing - WARNING - ADASYN failed (likely too few samples). Error: No samples will be generated with the provided ratio settings.. Falling back to no oversampling.
2026-06-12 20:19:05,052 - preprocessing - INFO - Feature selection complete. Selected 15 / 19 features.
2026-06-12 20:19:07,185 - train_pipeline - INFO - Early stopping triggered at epoch 40
2026-06-12 20:19:07,194 - preprocessing - INFO - xAPI engineered features created: ['engagement_score', 'absence_risk', 'parent_support_signal']
2026-06-12 20:19:07,196 - preprocessing - INFO - xAPI engineered features created: ['engagement_score', 'absence_risk', 'parent_support_signal']
2026-06-12 20:19:07,213 - preprocessing - INFO - Applying ADASYN on train set with ratio 0.686996761665843...
2026-06-12 20:19:07,219 - preprocessing - WARNING - ADASYN failed (likely too few samples). Error: No samples will be generated with the provided ratio settings.. Falling back to no oversampling.
2026-06-12 20:19:07,353 - preprocessing - INFO - Feature selection complete. Selected 16 / 19 features.
2026-06-12 20:19:08,351 - train_pipeline - INFO - Early stopping triggered at epoch 20
2026-06-12 20:19:08,351 - preprocessing - INFO - xAPI engineered features created: ['engagement_score', 'absence_risk', 'parent_support_signal']
2026-06-12 20:19:08,351 - preprocessing - INFO - xAPI engineered features created: ['engagement_score', 'absence_risk', 'parent_support_signal']
2026-06-12 20:19:08,382 - preprocessing - INFO - Applying ADASYN on train set with ratio 0.686996761665843...
2026-06-12 20:19:08,385 - preprocessing - WARNING - ADASYN failed (likely too few samples). Error: No samples will be generated with the provided ratio settings.. Falling back to no oversampling.
2026-06-12 20:19:08,510 - preprocessing - INFO - Feature selection complete. Selected 18 / 19 features.
2026-06-12 20:19:09,865 - train_pipeline - INFO - Early stopping triggered at epoch 25
2026-06-12 20:19:09,870 - preprocessing - INFO - xAPI engineered features created: ['engagement_score', 'absence_risk', 'parent_support_signal']
2026-06-12 20:19:09,875 - preprocessing - INFO - xAPI engineered features created: ['engagement_score', 'absence_risk', 'parent_support_signal']
2026-06-12 20:19:09,886 - preprocessing - INFO - Applying ADASYN on train set with ratio 0.686996761665843...
2026-06-12 20:19:09,901 - preprocessing - WARNING - ADASYN failed (likely too few samples). Error: No samples will be generated with the provided ratio settings.. Falling back to no oversampling.
2026-06-12 20:19:10,037 - preprocessing - INFO - Feature selection complete. Selected 16 / 19 features.
2026-06-12 20:19:11,241 - train_pipeline - INFO - Early stopping triggered at epoch 23
2026-06-12 20:19:11,245 - preprocessing - INFO - xAPI engineered features created: ['engagement_score', 'absence_risk', 'parent_support_signal']
2026-06-12 20:19:11,245 - preprocessing - INFO - xAPI engineered features created: ['engagement_score', 'absence_risk', 'parent_support_signal']
2026-06-12 20:19:11,267 - preprocessing - INFO - Applying ADASYN on train set with ratio 0.686996761665843...
2026-06-12 20:19:11,271 - preprocessing - WARNING - ADASYN failed (likely too few samples). Error: No samples will be generated with the provided ratio settings.. Falling back to no oversampling.
2026-06-12 20:19:11,391 - preprocessing - INFO - Feature selection complete. Selected 18 / 19 features.
2026-06-12 20:19:12,971 - train_pipeline - INFO - Early stopping triggered at epoch 29
[I 2026-06-12 20:19:12,971] Trial 1 finished with value: 0.7981084913133594 and parameters: {'learning_rate': 0.006042273180084808, 'weight_decay': 0.00027103702765834595, 'batch_size': 64, 'oversample_method': 'adasyn', 'smote_ratio': 0.686996761665843, 'cnn_channels': 64, 'lstm_hidden_dim': 64, 'context_hidden_dim': 128, 'fusion_hidden_dim': 32, 'dropout': 0.3834630453225448}. Best is trial 1 with value: 0.7981084913133594.
2026-06-12 20:19:12,971 - preprocessing - INFO - xAPI engineered features created: ['engagement_score', 'absence_risk', 'parent_support_signal']
2026-06-12 20:19:12,980 - preprocessing - INFO - xAPI engineered features created: ['engagement_score', 'absence_risk', 'parent_support_signal']
2026-06-12 20:19:12,999 - preprocessing - INFO - Applying ADASYN on train set with ratio 0.5129005478409193...
2026-06-12 20:19:13,131 - preprocessing - INFO - Feature selection complete. Selected 15 / 19 features.
2026-06-12 20:19:15,732 - train_pipeline - INFO - Early stopping triggered at epoch 32
2026-06-12 20:19:15,732 - preprocessing - INFO - xAPI engineered features created: ['engagement_score', 'absence_risk', 'parent_support_signal']
2026-06-12 20:19:15,732 - preprocessing - INFO - xAPI engineered features created: ['engagement_score', 'absence_risk', 'parent_support_signal']
2026-06-12 20:19:15,746 - preprocessing - INFO - Applying ADASYN on train set with ratio 0.5129005478409193...
2026-06-12 20:19:15,885 - preprocessing - INFO - Feature selection complete. Selected 16 / 19 features.
2026-06-12 20:19:17,453 - train_pipeline - INFO - Early stopping triggered at epoch 19
2026-06-12 20:19:17,453 - preprocessing - INFO - xAPI engineered features created: ['engagement_score', 'absence_risk', 'parent_support_signal']
2026-06-12 20:19:17,469 - preprocessing - INFO - xAPI engineered features created: ['engagement_score', 'absence_risk', 'parent_support_signal']
2026-06-12 20:19:17,484 - preprocessing - INFO - Applying ADASYN on train set with ratio 0.5129005478409193...
2026-06-12 20:19:17,605 - preprocessing - INFO - Feature selection complete. Selected 18 / 19 features.
2026-06-12 20:19:19,749 - train_pipeline - INFO - Early stopping triggered at epoch 26
2026-06-12 20:19:19,749 - preprocessing - INFO - xAPI engineered features created: ['engagement_score', 'absence_risk', 'parent_support_signal']
2026-06-12 20:19:19,749 - preprocessing - INFO - xAPI engineered features created: ['engagement_score', 'absence_risk', 'parent_support_signal']
2026-06-12 20:19:19,777 - preprocessing - INFO - Applying ADASYN on train set with ratio 0.5129005478409193...
2026-06-12 20:19:19,909 - preprocessing - INFO - Feature selection complete. Selected 16 / 19 features.
2026-06-12 20:19:21,362 - train_pipeline - INFO - Early stopping triggered at epoch 18
2026-06-12 20:19:21,362 - preprocessing - INFO - xAPI engineered features created: ['engagement_score', 'absence_risk', 'parent_support_signal']
2026-06-12 20:19:21,362 - preprocessing - INFO - xAPI engineered features created: ['engagement_score', 'absence_risk', 'parent_support_signal']
2026-06-12 20:19:21,378 - preprocessing - INFO - Applying ADASYN on train set with ratio 0.5129005478409193...
2026-06-12 20:19:21,511 - preprocessing - INFO - Feature selection complete. Selected 18 / 19 features.
2026-06-12 20:19:23,691 - train_pipeline - INFO - Early stopping triggered at epoch 27
[I 2026-06-12 20:19:23,691] Trial 2 finished with value: 0.7641109484777158 and parameters: {'learning_rate': 0.003822907081147229, 'weight_decay': 3.326774986140699e-06, 'batch_size': 32, 'oversample_method': 'adasyn', 'smote_ratio': 0.5129005478409193, 'cnn_channels': 64, 'lstm_hidden_dim': 32, 'context_hidden_dim': 64, 'fusion_hidden_dim': 32, 'dropout': 0.4344993211210689}. Best is trial 1 with value: 0.7981084913133594.
2026-06-12 20:19:23,703 - preprocessing - INFO - xAPI engineered features created: ['engagement_score', 'absence_risk', 'parent_support_signal']
2026-06-12 20:19:23,703 - preprocessing - INFO - xAPI engineered features created: ['engagement_score', 'absence_risk', 'parent_support_signal']
2026-06-12 20:19:23,724 - preprocessing - INFO - Applying SMOTE on train set with ratio 0.9133805613388216...
2026-06-12 20:19:23,856 - preprocessing - INFO - Feature selection complete. Selected 18 / 19 features.
2026-06-12 20:19:25,063 - train_pipeline - INFO - Early stopping triggered at epoch 21
2026-06-12 20:19:25,063 - preprocessing - INFO - xAPI engineered features created: ['engagement_score', 'absence_risk', 'parent_support_signal']
2026-06-12 20:19:25,079 - preprocessing - INFO - xAPI engineered features created: ['engagement_score', 'absence_risk', 'parent_support_signal']
2026-06-12 20:19:25,092 - preprocessing - INFO - Applying SMOTE on train set with ratio 0.9133805613388216...
2026-06-12 20:19:25,230 - preprocessing - INFO - Feature selection complete. Selected 17 / 19 features.
2026-06-12 20:19:26,825 - train_pipeline - INFO - Early stopping triggered at epoch 28
2026-06-12 20:19:26,841 - preprocessing - INFO - xAPI engineered features created: ['engagement_score', 'absence_risk', 'parent_support_signal']
2026-06-12 20:19:26,841 - preprocessing - INFO - xAPI engineered features created: ['engagement_score', 'absence_risk', 'parent_support_signal']
2026-06-12 20:19:26,860 - preprocessing - INFO - Applying SMOTE on train set with ratio 0.9133805613388216...
2026-06-12 20:19:26,992 - preprocessing - INFO - Feature selection complete. Selected 18 / 19 features.
2026-06-12 20:19:29,673 - train_pipeline - INFO - Early stopping triggered at epoch 47
2026-06-12 20:19:29,673 - preprocessing - INFO - xAPI engineered features created: ['engagement_score', 'absence_risk', 'parent_support_signal']
2026-06-12 20:19:29,673 - preprocessing - INFO - xAPI engineered features created: ['engagement_score', 'absence_risk', 'parent_support_signal']
2026-06-12 20:19:29,699 - preprocessing - INFO - Applying SMOTE on train set with ratio 0.9133805613388216...
2026-06-12 20:19:29,838 - preprocessing - INFO - Feature selection complete. Selected 17 / 19 features.
2026-06-12 20:19:30,971 - train_pipeline - INFO - Early stopping triggered at epoch 20
2026-06-12 20:19:30,974 - preprocessing - INFO - xAPI engineered features created: ['engagement_score', 'absence_risk', 'parent_support_signal']
2026-06-12 20:19:30,974 - preprocessing - INFO - xAPI engineered features created: ['engagement_score', 'absence_risk', 'parent_support_signal']
2026-06-12 20:19:30,995 - preprocessing - INFO - Applying SMOTE on train set with ratio 0.9133805613388216...
2026-06-12 20:19:31,127 - preprocessing - INFO - Feature selection complete. Selected 19 / 19 features.
2026-06-12 20:19:33,686 - train_pipeline - INFO - Early stopping triggered at epoch 39
[I 2026-06-12 20:19:33,700] Trial 3 finished with value: 0.7660625256353444 and parameters: {'learning_rate': 0.0025494717378485355, 'weight_decay': 0.00044801766143662204, 'batch_size': 64, 'oversample_method': 'smote', 'smote_ratio': 0.9133805613388216, 'cnn_channels': 32, 'lstm_hidden_dim': 32, 'context_hidden_dim': 64, 'fusion_hidden_dim': 128, 'dropout': 0.434857935039061}. Best is trial 1 with value: 0.7981084913133594.
2026-06-12 20:19:33,704 - preprocessing - INFO - xAPI engineered features created: ['engagement_score', 'absence_risk', 'parent_support_signal']
2026-06-12 20:19:33,707 - preprocessing - INFO - xAPI engineered features created: ['engagement_score', 'absence_risk', 'parent_support_signal']
2026-06-12 20:19:33,714 - preprocessing - INFO - Applying ADASYN on train set with ratio 0.4362274088110538...
2026-06-12 20:19:33,853 - preprocessing - INFO - Feature selection complete. Selected 15 / 19 features.
2026-06-12 20:19:35,247 - train_pipeline - INFO - Early stopping triggered at epoch 28
2026-06-12 20:19:35,254 - preprocessing - INFO - xAPI engineered features created: ['engagement_score', 'absence_risk', 'parent_support_signal']
2026-06-12 20:19:35,254 - preprocessing - INFO - xAPI engineered features created: ['engagement_score', 'absence_risk', 'parent_support_signal']
2026-06-12 20:19:35,270 - preprocessing - INFO - Applying ADASYN on train set with ratio 0.4362274088110538...
2026-06-12 20:19:35,393 - preprocessing - INFO - Feature selection complete. Selected 16 / 19 features.
2026-06-12 20:19:36,506 - train_pipeline - INFO - Early stopping triggered at epoch 22
2026-06-12 20:19:36,506 - preprocessing - INFO - xAPI engineered features created: ['engagement_score', 'absence_risk', 'parent_support_signal']
2026-06-12 20:19:36,506 - preprocessing - INFO - xAPI engineered features created: ['engagement_score', 'absence_risk', 'parent_support_signal']
2026-06-12 20:19:36,524 - preprocessing - INFO - Applying ADASYN on train set with ratio 0.4362274088110538...
2026-06-12 20:19:36,663 - preprocessing - INFO - Feature selection complete. Selected 18 / 19 features.
2026-06-12 20:19:38,473 - train_pipeline - INFO - Early stopping triggered at epoch 36
2026-06-12 20:19:38,473 - preprocessing - INFO - xAPI engineered features created: ['engagement_score', 'absence_risk', 'parent_support_signal']
2026-06-12 20:19:38,473 - preprocessing - INFO - xAPI engineered features created: ['engagement_score', 'absence_risk', 'parent_support_signal']
2026-06-12 20:19:38,497 - preprocessing - INFO - Applying ADASYN on train set with ratio 0.4362274088110538...
2026-06-12 20:19:38,619 - preprocessing - INFO - Feature selection complete. Selected 16 / 19 features.
2026-06-12 20:19:39,798 - train_pipeline - INFO - Early stopping triggered at epoch 23
2026-06-12 20:19:39,801 - preprocessing - INFO - xAPI engineered features created: ['engagement_score', 'absence_risk', 'parent_support_signal']
2026-06-12 20:19:39,804 - preprocessing - INFO - xAPI engineered features created: ['engagement_score', 'absence_risk', 'parent_support_signal']
2026-06-12 20:19:39,821 - preprocessing - INFO - Applying ADASYN on train set with ratio 0.4362274088110538...
2026-06-12 20:19:39,944 - preprocessing - INFO - Feature selection complete. Selected 18 / 19 features.
2026-06-12 20:19:41,588 - train_pipeline - INFO - Early stopping triggered at epoch 33
[I 2026-06-12 20:19:41,588] Trial 4 finished with value: 0.7818480969799718 and parameters: {'learning_rate': 0.0013156886972013426, 'weight_decay': 4.764640731970759e-06, 'batch_size': 64, 'oversample_method': 'adasyn', 'smote_ratio': 0.4362274088110538, 'cnn_channels': 32, 'lstm_hidden_dim': 64, 'context_hidden_dim': 128, 'fusion_hidden_dim': 32, 'dropout': 0.1606622849323289}. Best is trial 1 with value: 0.7981084913133594.
2026-06-12 20:19:41,604 - preprocessing - INFO - xAPI engineered features created: ['engagement_score', 'absence_risk', 'parent_support_signal']
2026-06-12 20:19:41,606 - preprocessing - INFO - xAPI engineered features created: ['engagement_score', 'absence_risk', 'parent_support_signal']
2026-06-12 20:19:41,623 - preprocessing - INFO - Applying SMOTE on train set with ratio 0.6749734390936835...
2026-06-12 20:19:41,757 - preprocessing - INFO - Feature selection complete. Selected 15 / 19 features.
2026-06-12 20:19:48,854 - preprocessing - INFO - xAPI engineered features created: ['engagement_score', 'absence_risk', 'parent_support_signal']
2026-06-12 20:19:48,854 - preprocessing - INFO - xAPI engineered features created: ['engagement_score', 'absence_risk', 'parent_support_signal']
2026-06-12 20:19:48,872 - preprocessing - INFO - Applying SMOTE on train set with ratio 0.6749734390936835...
2026-06-12 20:19:49,013 - preprocessing - INFO - Feature selection complete. Selected 16 / 19 features.
2026-06-12 20:19:56,048 - preprocessing - INFO - xAPI engineered features created: ['engagement_score', 'absence_risk', 'parent_support_signal']
2026-06-12 20:19:56,053 - preprocessing - INFO - xAPI engineered features created: ['engagement_score', 'absence_risk', 'parent_support_signal']
2026-06-12 20:19:56,067 - preprocessing - INFO - Applying SMOTE on train set with ratio 0.6749734390936835...
2026-06-12 20:19:56,198 - preprocessing - INFO - Feature selection complete. Selected 18 / 19 features.
2026-06-12 20:19:59,741 - train_pipeline - INFO - Early stopping triggered at epoch 25
2026-06-12 20:19:59,743 - preprocessing - INFO - xAPI engineered features created: ['engagement_score', 'absence_risk', 'parent_support_signal']
2026-06-12 20:19:59,745 - preprocessing - INFO - xAPI engineered features created: ['engagement_score', 'absence_risk', 'parent_support_signal']
2026-06-12 20:19:59,764 - preprocessing - INFO - Applying SMOTE on train set with ratio 0.6749734390936835...
2026-06-12 20:19:59,889 - preprocessing - INFO - Feature selection complete. Selected 17 / 19 features.
2026-06-12 20:20:06,972 - preprocessing - INFO - xAPI engineered features created: ['engagement_score', 'absence_risk', 'parent_support_signal']
2026-06-12 20:20:06,972 - preprocessing - INFO - xAPI engineered features created: ['engagement_score', 'absence_risk', 'parent_support_signal']
2026-06-12 20:20:06,994 - preprocessing - INFO - Applying SMOTE on train set with ratio 0.6749734390936835...
2026-06-12 20:20:07,136 - preprocessing - INFO - Feature selection complete. Selected 18 / 19 features.
