[I 2026-06-12 20:21:52,631] Trial 11 finished with value: 0.7722680130049258 and parameters: {'learning_rate': 0.0003631629256396564, 'weight_decay': 3.812048714037631e-05, 'batch_size': 16, 'oversample_method': 'smote', 'smote_ratio': 0.6617996492646776, 'cnn_channels': 64, 'lstm_hidden_dim': 64, 'context_hidden_dim': 128, 'fusion_hidden_dim': 32, 'dropout': 0.26488799428438287}. Best is trial 1 with value: 0.7981084913133594.
2026-06-12 20:21:52,645 - preprocessing - INFO - xAPI engineered features created: ['engagement_score', 'absence_risk', 'parent_support_signal']
2026-06-12 20:21:52,645 - preprocessing - INFO - xAPI engineered features created: ['engagement_score', 'absence_risk', 'parent_support_signal']
2026-06-12 20:21:52,666 - preprocessing - INFO - Applying SMOTE on train set with ratio 0.41230255639349883...
2026-06-12 20:21:52,804 - preprocessing - INFO - Feature selection complete. Selected 15 / 19 features.
2026-06-12 20:21:57,050 - train_pipeline - INFO - Early stopping triggered at epoch 28
2026-06-12 20:21:57,057 - preprocessing - INFO - xAPI engineered features created: ['engagement_score', 'absence_risk', 'parent_support_signal']
2026-06-12 20:21:57,060 - preprocessing - INFO - xAPI engineered features created: ['engagement_score', 'absence_risk', 'parent_support_signal']
2026-06-12 20:21:57,078 - preprocessing - INFO - Applying SMOTE on train set with ratio 0.41230255639349883...
2026-06-12 20:21:57,209 - preprocessing - INFO - Feature selection complete. Selected 16 / 19 features.
2026-06-12 20:22:01,199 - train_pipeline - INFO - Early stopping triggered at epoch 25
2026-06-12 20:22:01,199 - preprocessing - INFO - xAPI engineered features created: ['engagement_score', 'absence_risk', 'parent_support_signal']
2026-06-12 20:22:01,205 - preprocessing - INFO - xAPI engineered features created: ['engagement_score', 'absence_risk', 'parent_support_signal']
2026-06-12 20:22:01,226 - preprocessing - INFO - Applying SMOTE on train set with ratio 0.41230255639349883...
2026-06-12 20:22:01,351 - preprocessing - INFO - Feature selection complete. Selected 18 / 19 features.
2026-06-12 20:22:06,221 - train_pipeline - INFO - Early stopping triggered at epoch 31
2026-06-12 20:22:06,228 - preprocessing - INFO - xAPI engineered features created: ['engagement_score', 'absence_risk', 'parent_support_signal']
2026-06-12 20:22:06,228 - preprocessing - INFO - xAPI engineered features created: ['engagement_score', 'absence_risk', 'parent_support_signal']
2026-06-12 20:22:06,242 - preprocessing - INFO - Applying SMOTE on train set with ratio 0.41230255639349883...
2026-06-12 20:22:06,381 - preprocessing - INFO - Feature selection complete. Selected 16 / 19 features.
2026-06-12 20:22:10,377 - train_pipeline - INFO - Early stopping triggered at epoch 26
2026-06-12 20:22:10,377 - preprocessing - INFO - xAPI engineered features created: ['engagement_score', 'absence_risk', 'parent_support_signal']
2026-06-12 20:22:10,383 - preprocessing - INFO - xAPI engineered features created: ['engagement_score', 'absence_risk', 'parent_support_signal']
2026-06-12 20:22:10,397 - preprocessing - INFO - Applying SMOTE on train set with ratio 0.41230255639349883...
2026-06-12 20:22:10,529 - preprocessing - INFO - Feature selection complete. Selected 18 / 19 features.
2026-06-12 20:22:15,913 - train_pipeline - INFO - Early stopping triggered at epoch 35
[I 2026-06-12 20:22:15,920] Trial 12 finished with value: 0.7852326240586796 and parameters: {'learning_rate': 0.009764222789178692, 'weight_decay': 0.00018656208501119267, 'batch_size': 16, 'oversample_method': 'smote', 'smote_ratio': 0.41230255639349883, 'cnn_channels': 32, 'lstm_hidden_dim': 64, 'context_hidden_dim': 128, 'fusion_hidden_dim': 32, 'dropout': 0.3384868703513424}. Best is trial 1 with value: 0.7981084913133594.
2026-06-12 20:22:15,927 - preprocessing - INFO - xAPI engineered features created: ['engagement_score', 'absence_risk', 'parent_support_signal']
2026-06-12 20:22:15,934 - preprocessing - INFO - xAPI engineered features created: ['engagement_score', 'absence_risk', 'parent_support_signal']
2026-06-12 20:22:15,949 - preprocessing - INFO - Applying SMOTE on train set with ratio 0.5916039665586539...
2026-06-12 20:22:16,080 - preprocessing - INFO - Feature selection complete. Selected 15 / 19 features.
2026-06-12 20:22:21,692 - train_pipeline - INFO - Early stopping triggered at epoch 36
2026-06-12 20:22:21,692 - preprocessing - INFO - xAPI engineered features created: ['engagement_score', 'absence_risk', 'parent_support_signal']
2026-06-12 20:22:21,699 - preprocessing - INFO - xAPI engineered features created: ['engagement_score', 'absence_risk', 'parent_support_signal']
2026-06-12 20:22:21,713 - preprocessing - INFO - Applying SMOTE on train set with ratio 0.5916039665586539...
2026-06-12 20:22:21,844 - preprocessing - INFO - Feature selection complete. Selected 16 / 19 features.
2026-06-12 20:22:25,341 - train_pipeline - INFO - Early stopping triggered at epoch 22
2026-06-12 20:22:25,348 - preprocessing - INFO - xAPI engineered features created: ['engagement_score', 'absence_risk', 'parent_support_signal']
2026-06-12 20:22:25,348 - preprocessing - INFO - xAPI engineered features created: ['engagement_score', 'absence_risk', 'parent_support_signal']
2026-06-12 20:22:25,369 - preprocessing - INFO - Applying SMOTE on train set with ratio 0.5916039665586539...
2026-06-12 20:22:25,500 - preprocessing - INFO - Feature selection complete. Selected 18 / 19 features.
2026-06-12 20:22:29,302 - train_pipeline - INFO - Early stopping triggered at epoch 24
2026-06-12 20:22:29,302 - preprocessing - INFO - xAPI engineered features created: ['engagement_score', 'absence_risk', 'parent_support_signal']
2026-06-12 20:22:29,302 - preprocessing - INFO - xAPI engineered features created: ['engagement_score', 'absence_risk', 'parent_support_signal']
2026-06-12 20:22:29,323 - preprocessing - INFO - Applying SMOTE on train set with ratio 0.5916039665586539...
2026-06-12 20:22:29,448 - preprocessing - INFO - Feature selection complete. Selected 16 / 19 features.
2026-06-12 20:22:35,456 - train_pipeline - INFO - Early stopping triggered at epoch 38
2026-06-12 20:22:35,462 - preprocessing - INFO - xAPI engineered features created: ['engagement_score', 'absence_risk', 'parent_support_signal']
2026-06-12 20:22:35,463 - preprocessing - INFO - xAPI engineered features created: ['engagement_score', 'absence_risk', 'parent_support_signal']
2026-06-12 20:22:35,476 - preprocessing - INFO - Applying SMOTE on train set with ratio 0.5916039665586539...
2026-06-12 20:22:35,601 - preprocessing - INFO - Feature selection complete. Selected 18 / 19 features.
2026-06-12 20:22:38,904 - train_pipeline - INFO - Early stopping triggered at epoch 21
[I 2026-06-12 20:22:38,904] Trial 13 finished with value: 0.788061741717623 and parameters: {'learning_rate': 0.0038894069613457194, 'weight_decay': 2.16874453230635e-05, 'batch_size': 16, 'oversample_method': 'smote', 'smote_ratio': 0.5916039665586539, 'cnn_channels': 64, 'lstm_hidden_dim': 64, 'context_hidden_dim': 128, 'fusion_hidden_dim': 32, 'dropout': 0.49860300313528555}. Best is trial 1 with value: 0.7981084913133594.
2026-06-12 20:22:38,917 - preprocessing - INFO - xAPI engineered features created: ['engagement_score', 'absence_risk', 'parent_support_signal']
2026-06-12 20:22:38,917 - preprocessing - INFO - xAPI engineered features created: ['engagement_score', 'absence_risk', 'parent_support_signal']
2026-06-12 20:22:38,938 - preprocessing - INFO - Applying ADASYN on train set with ratio 0.6014151359217738...
2026-06-12 20:22:39,056 - preprocessing - INFO - Feature selection complete. Selected 15 / 19 features.
2026-06-12 20:22:44,044 - train_pipeline - INFO - Early stopping triggered at epoch 32
2026-06-12 20:22:44,047 - preprocessing - INFO - xAPI engineered features created: ['engagement_score', 'absence_risk', 'parent_support_signal']
2026-06-12 20:22:44,047 - preprocessing - INFO - xAPI engineered features created: ['engagement_score', 'absence_risk', 'parent_support_signal']
2026-06-12 20:22:44,065 - preprocessing - INFO - Applying ADASYN on train set with ratio 0.6014151359217738...
2026-06-12 20:22:44,197 - preprocessing - INFO - Feature selection complete. Selected 16 / 19 features.
2026-06-12 20:22:47,027 - train_pipeline - INFO - Early stopping triggered at epoch 18
2026-06-12 20:22:47,027 - preprocessing - INFO - xAPI engineered features created: ['engagement_score', 'absence_risk', 'parent_support_signal']
2026-06-12 20:22:47,034 - preprocessing - INFO - xAPI engineered features created: ['engagement_score', 'absence_risk', 'parent_support_signal']
2026-06-12 20:22:47,048 - preprocessing - INFO - Applying ADASYN on train set with ratio 0.6014151359217738...
2026-06-12 20:22:47,180 - preprocessing - INFO - Feature selection complete. Selected 18 / 19 features.
2026-06-12 20:22:52,251 - train_pipeline - INFO - Early stopping triggered at epoch 32
2026-06-12 20:22:52,258 - preprocessing - INFO - xAPI engineered features created: ['engagement_score', 'absence_risk', 'parent_support_signal']
2026-06-12 20:22:52,258 - preprocessing - INFO - xAPI engineered features created: ['engagement_score', 'absence_risk', 'parent_support_signal']
2026-06-12 20:22:52,281 - preprocessing - INFO - Applying ADASYN on train set with ratio 0.6014151359217738...
2026-06-12 20:22:52,287 - preprocessing - WARNING - ADASYN failed (likely too few samples). Error: No samples will be generated with the provided ratio settings.. Falling back to no oversampling.
2026-06-12 20:22:52,418 - preprocessing - INFO - Feature selection complete. Selected 16 / 19 features.
2026-06-12 20:22:55,248 - train_pipeline - INFO - Early stopping triggered at epoch 18
2026-06-12 20:22:55,248 - preprocessing - INFO - xAPI engineered features created: ['engagement_score', 'absence_risk', 'parent_support_signal']
2026-06-12 20:22:55,255 - preprocessing - INFO - xAPI engineered features created: ['engagement_score', 'absence_risk', 'parent_support_signal']
2026-06-12 20:22:55,269 - preprocessing - INFO - Applying ADASYN on train set with ratio 0.6014151359217738...
2026-06-12 20:22:55,401 - preprocessing - INFO - Feature selection complete. Selected 18 / 19 features.
2026-06-12 20:23:00,042 - train_pipeline - INFO - Early stopping triggered at epoch 30
[I 2026-06-12 20:23:00,042] Trial 14 finished with value: 0.7873805407718029 and parameters: {'learning_rate': 0.0045858234941999875, 'weight_decay': 2.7095132092863673e-05, 'batch_size': 16, 'oversample_method': 'adasyn', 'smote_ratio': 0.6014151359217738, 'cnn_channels': 64, 'lstm_hidden_dim': 64, 'context_hidden_dim': 128, 'fusion_hidden_dim': 32, 'dropout': 0.49749610754394735}. Best is trial 1 with value: 0.7981084913133594.
2026-06-12 20:23:00,056 - preprocessing - INFO - xAPI engineered features created: ['engagement_score', 'absence_risk', 'parent_support_signal']
2026-06-12 20:23:00,062 - preprocessing - INFO - xAPI engineered features created: ['engagement_score', 'absence_risk', 'parent_support_signal']
2026-06-12 20:23:00,077 - preprocessing - INFO - Applying SMOTE on train set with ratio 0.777891893640741...
2026-06-12 20:23:00,215 - preprocessing - INFO - Feature selection complete. Selected 16 / 19 features.
2026-06-12 20:23:02,644 - train_pipeline - INFO - Early stopping triggered at epoch 38
2026-06-12 20:23:02,651 - preprocessing - INFO - xAPI engineered features created: ['engagement_score', 'absence_risk', 'parent_support_signal']
2026-06-12 20:23:02,651 - preprocessing - INFO - xAPI engineered features created: ['engagement_score', 'absence_risk', 'parent_support_signal']
2026-06-12 20:23:02,673 - preprocessing - INFO - Applying SMOTE on train set with ratio 0.777891893640741...
2026-06-12 20:23:02,810 - preprocessing - INFO - Feature selection complete. Selected 17 / 19 features.
2026-06-12 20:23:05,217 - train_pipeline - INFO - Early stopping triggered at epoch 37
2026-06-12 20:23:05,217 - preprocessing - INFO - xAPI engineered features created: ['engagement_score', 'absence_risk', 'parent_support_signal']
2026-06-12 20:23:05,224 - preprocessing - INFO - xAPI engineered features created: ['engagement_score', 'absence_risk', 'parent_support_signal']
2026-06-12 20:23:05,238 - preprocessing - INFO - Applying SMOTE on train set with ratio 0.777891893640741...
2026-06-12 20:23:05,384 - preprocessing - INFO - Feature selection complete. Selected 18 / 19 features.
2026-06-12 20:23:08,708 - preprocessing - INFO - xAPI engineered features created: ['engagement_score', 'absence_risk', 'parent_support_signal']
2026-06-12 20:23:08,715 - preprocessing - INFO - xAPI engineered features created: ['engagement_score', 'absence_risk', 'parent_support_signal']
2026-06-12 20:23:08,736 - preprocessing - INFO - Applying SMOTE on train set with ratio 0.777891893640741...
2026-06-12 20:23:08,874 - preprocessing - INFO - Feature selection complete. Selected 17 / 19 features.
2026-06-12 20:23:10,770 - train_pipeline - INFO - Early stopping triggered at epoch 26
2026-06-12 20:23:10,770 - preprocessing - INFO - xAPI engineered features created: ['engagement_score', 'absence_risk', 'parent_support_signal']
2026-06-12 20:23:10,770 - preprocessing - INFO - xAPI engineered features created: ['engagement_score', 'absence_risk', 'parent_support_signal']
2026-06-12 20:23:10,786 - preprocessing - INFO - Applying SMOTE on train set with ratio 0.777891893640741...
2026-06-12 20:23:10,940 - preprocessing - INFO - Feature selection complete. Selected 18 / 19 features.
2026-06-12 20:23:13,272 - train_pipeline - INFO - Early stopping triggered at epoch 36
[I 2026-06-12 20:23:13,279] Trial 15 finished with value: 0.7413847819535844 and parameters: {'learning_rate': 0.0005593923189241128, 'weight_decay': 2.6524099969195647e-05, 'batch_size': 64, 'oversample_method': 'smote', 'smote_ratio': 0.777891893640741, 'cnn_channels': 64, 'lstm_hidden_dim': 64, 'context_hidden_dim': 128, 'fusion_hidden_dim': 128, 'dropout': 0.48881471259381404}. Best is trial 1 with value: 0.7981084913133594.
2026-06-12 20:23:13,290 - preprocessing - INFO - xAPI engineered features created: ['engagement_score', 'absence_risk', 'parent_support_signal']
2026-06-12 20:23:13,294 - preprocessing - INFO - xAPI engineered features created: ['engagement_score', 'absence_risk', 'parent_support_signal']
2026-06-12 20:23:13,311 - preprocessing - INFO - Applying ADASYN on train set with ratio 0.6219249277065108...
2026-06-12 20:23:13,319 - preprocessing - WARNING - ADASYN failed (likely too few samples). Error: No samples will be generated with the provided ratio settings.. Falling back to no oversampling.
2026-06-12 20:23:13,452 - preprocessing - INFO - Feature selection complete. Selected 15 / 19 features.
2026-06-12 20:23:18,553 - train_pipeline - INFO - Early stopping triggered at epoch 33
2026-06-12 20:23:18,557 - preprocessing - INFO - xAPI engineered features created: ['engagement_score', 'absence_risk', 'parent_support_signal']
2026-06-12 20:23:18,559 - preprocessing - INFO - xAPI engineered features created: ['engagement_score', 'absence_risk', 'parent_support_signal']
2026-06-12 20:23:18,580 - preprocessing - INFO - Applying ADASYN on train set with ratio 0.6219249277065108...
2026-06-12 20:23:18,585 - preprocessing - WARNING - ADASYN failed (likely too few samples). Error: No samples will be generated with the provided ratio settings.. Falling back to no oversampling.
2026-06-12 20:23:18,717 - preprocessing - INFO - Feature selection complete. Selected 16 / 19 features.
2026-06-12 20:23:21,818 - train_pipeline - INFO - Early stopping triggered at epoch 20
2026-06-12 20:23:21,818 - preprocessing - INFO - xAPI engineered features created: ['engagement_score', 'absence_risk', 'parent_support_signal']
2026-06-12 20:23:21,825 - preprocessing - INFO - xAPI engineered features created: ['engagement_score', 'absence_risk', 'parent_support_signal']
2026-06-12 20:23:21,832 - preprocessing - INFO - Applying ADASYN on train set with ratio 0.6219249277065108...
2026-06-12 20:23:21,848 - preprocessing - WARNING - ADASYN failed (likely too few samples). Error: No samples will be generated with the provided ratio settings.. Falling back to no oversampling.
2026-06-12 20:23:21,981 - preprocessing - INFO - Feature selection complete. Selected 18 / 19 features.
2026-06-12 20:23:27,950 - train_pipeline - INFO - Early stopping triggered at epoch 38
2026-06-12 20:23:27,954 - preprocessing - INFO - xAPI engineered features created: ['engagement_score', 'absence_risk', 'parent_support_signal']
2026-06-12 20:23:27,956 - preprocessing - INFO - xAPI engineered features created: ['engagement_score', 'absence_risk', 'parent_support_signal']
2026-06-12 20:23:27,976 - preprocessing - INFO - Applying ADASYN on train set with ratio 0.6219249277065108...
2026-06-12 20:23:27,981 - preprocessing - WARNING - ADASYN failed (likely too few samples). Error: No samples will be generated with the provided ratio settings.. Falling back to no oversampling.
2026-06-12 20:23:28,113 - preprocessing - INFO - Feature selection complete. Selected 16 / 19 features.
2026-06-12 20:23:32,887 - train_pipeline - INFO - Early stopping triggered at epoch 31
2026-06-12 20:23:32,887 - preprocessing - INFO - xAPI engineered features created: ['engagement_score', 'absence_risk', 'parent_support_signal']
2026-06-12 20:23:32,887 - preprocessing - INFO - xAPI engineered features created: ['engagement_score', 'absence_risk', 'parent_support_signal']
2026-06-12 20:23:32,918 - preprocessing - INFO - Applying ADASYN on train set with ratio 0.6219249277065108...
2026-06-12 20:23:32,918 - preprocessing - WARNING - ADASYN failed (likely too few samples). Error: No samples will be generated with the provided ratio settings.. Falling back to no oversampling.
2026-06-12 20:23:33,050 - preprocessing - INFO - Feature selection complete. Selected 18 / 19 features.
2026-06-12 20:23:37,866 - train_pipeline - INFO - Early stopping triggered at epoch 31
[I 2026-06-12 20:23:37,882] Trial 16 finished with value: 0.7762661389492125 and parameters: {'learning_rate': 0.005068855935116602, 'weight_decay': 9.46227692320775e-05, 'batch_size': 16, 'oversample_method': 'adasyn', 'smote_ratio': 0.6219249277065108, 'cnn_channels': 64, 'lstm_hidden_dim': 64, 'context_hidden_dim': 32, 'fusion_hidden_dim': 32, 'dropout': 0.36541121467766857}. Best is trial 1 with value: 0.7981084913133594.
2026-06-12 20:23:37,882 - preprocessing - INFO - xAPI engineered features created: ['engagement_score', 'absence_risk', 'parent_support_signal']
2026-06-12 20:23:37,882 - preprocessing - INFO - xAPI engineered features created: ['engagement_score', 'absence_risk', 'parent_support_signal']
2026-06-12 20:23:37,913 - preprocessing - INFO - Applying SMOTE on train set with ratio 0.8508309649921654...
2026-06-12 20:23:38,054 - preprocessing - INFO - Feature selection complete. Selected 16 / 19 features.
2026-06-12 20:23:39,275 - train_pipeline - INFO - Early stopping triggered at epoch 19
2026-06-12 20:23:39,280 - preprocessing - INFO - xAPI engineered features created: ['engagement_score', 'absence_risk', 'parent_support_signal']
2026-06-12 20:23:39,280 - preprocessing - INFO - xAPI engineered features created: ['engagement_score', 'absence_risk', 'parent_support_signal']
2026-06-12 20:23:39,301 - preprocessing - INFO - Applying SMOTE on train set with ratio 0.8508309649921654...
2026-06-12 20:23:39,445 - preprocessing - INFO - Feature selection complete. Selected 17 / 19 features.
2026-06-12 20:23:40,966 - train_pipeline - INFO - Early stopping triggered at epoch 24
2026-06-12 20:23:40,966 - preprocessing - INFO - xAPI engineered features created: ['engagement_score', 'absence_risk', 'parent_support_signal']
2026-06-12 20:23:40,982 - preprocessing - INFO - xAPI engineered features created: ['engagement_score', 'absence_risk', 'parent_support_signal']
2026-06-12 20:23:41,000 - preprocessing - INFO - Applying SMOTE on train set with ratio 0.8508309649921654...
2026-06-12 20:23:41,132 - preprocessing - INFO - Feature selection complete. Selected 18 / 19 features.
2026-06-12 20:23:43,828 - train_pipeline - INFO - Early stopping triggered at epoch 42
2026-06-12 20:23:43,836 - preprocessing - INFO - xAPI engineered features created: ['engagement_score', 'absence_risk', 'parent_support_signal']
2026-06-12 20:23:43,836 - preprocessing - INFO - xAPI engineered features created: ['engagement_score', 'absence_risk', 'parent_support_signal']
2026-06-12 20:23:43,859 - preprocessing - INFO - Applying SMOTE on train set with ratio 0.8508309649921654...
2026-06-12 20:23:43,998 - preprocessing - INFO - Feature selection complete. Selected 17 / 19 features.
2026-06-12 20:23:46,169 - train_pipeline - INFO - Early stopping triggered at epoch 33
2026-06-12 20:23:46,178 - preprocessing - INFO - xAPI engineered features created: ['engagement_score', 'absence_risk', 'parent_support_signal']
2026-06-12 20:23:46,178 - preprocessing - INFO - xAPI engineered features created: ['engagement_score', 'absence_risk', 'parent_support_signal']
2026-06-12 20:23:46,204 - preprocessing - INFO - Applying SMOTE on train set with ratio 0.8508309649921654...
2026-06-12 20:23:46,370 - preprocessing - INFO - Feature selection complete. Selected 19 / 19 features.
2026-06-12 20:23:48,541 - train_pipeline - INFO - Early stopping triggered at epoch 32
