[I 2026-06-12 19:52:20,321] Trial 24 finished with value: 0.8686314137774829 and parameters: {'learning_rate': 0.005860971199557584, 'weight_decay': 3.614068141374988e-05, 'batch_size': 64, 'oversample_method': 'adasyn', 'smote_ratio': 0.47868205169497763, 'cnn_channels': 64, 'lstm_hidden_dim': 64, 'context_hidden_dim': 32, 'fusion_hidden_dim': 32, 'dropout': 0.2324245365064163}. Best is trial 21 with value: 0.8897981256933332.
2026-06-12 19:52:20,342 - preprocessing - INFO - Student engineered features created: ['grade_growth', 'grade_avg', 'absence_study_ratio', 'failure_risk', 'alcohol_risk', 'social_risk']
2026-06-12 19:52:20,346 - preprocessing - INFO - Student engineered features created: ['grade_growth', 'grade_avg', 'absence_study_ratio', 'failure_risk', 'alcohol_risk', 'social_risk']
2026-06-12 19:52:20,392 - preprocessing - INFO - Applying ADASYN on train set with ratio 0.7233796902588431...
2026-06-12 19:52:20,613 - preprocessing - INFO - Feature selection complete. Selected 36 / 38 features.
2026-06-12 19:52:22,605 - train_pipeline - INFO - Early stopping triggered at epoch 19
2026-06-12 19:52:22,610 - preprocessing - INFO - Student engineered features created: ['grade_growth', 'grade_avg', 'absence_study_ratio', 'failure_risk', 'alcohol_risk', 'social_risk']
2026-06-12 19:52:22,612 - preprocessing - INFO - Student engineered features created: ['grade_growth', 'grade_avg', 'absence_study_ratio', 'failure_risk', 'alcohol_risk', 'social_risk']
2026-06-12 19:52:22,658 - preprocessing - INFO - Applying ADASYN on train set with ratio 0.7233796902588431...
2026-06-12 19:52:22,876 - preprocessing - INFO - Feature selection complete. Selected 34 / 38 features.
2026-06-12 19:52:24,795 - train_pipeline - INFO - Early stopping triggered at epoch 18
2026-06-12 19:52:24,795 - preprocessing - INFO - Student engineered features created: ['grade_growth', 'grade_avg', 'absence_study_ratio', 'failure_risk', 'alcohol_risk', 'social_risk']
2026-06-12 19:52:24,795 - preprocessing - INFO - Student engineered features created: ['grade_growth', 'grade_avg', 'absence_study_ratio', 'failure_risk', 'alcohol_risk', 'social_risk']
2026-06-12 19:52:24,846 - preprocessing - INFO - Applying ADASYN on train set with ratio 0.7233796902588431...
2026-06-12 19:52:25,073 - preprocessing - INFO - Feature selection complete. Selected 35 / 38 features.
2026-06-12 19:52:30,449 - preprocessing - INFO - Student engineered features created: ['grade_growth', 'grade_avg', 'absence_study_ratio', 'failure_risk', 'alcohol_risk', 'social_risk']
2026-06-12 19:52:30,458 - preprocessing - INFO - Student engineered features created: ['grade_growth', 'grade_avg', 'absence_study_ratio', 'failure_risk', 'alcohol_risk', 'social_risk']
2026-06-12 19:52:30,505 - preprocessing - INFO - Applying ADASYN on train set with ratio 0.7233796902588431...
2026-06-12 19:52:30,736 - preprocessing - INFO - Feature selection complete. Selected 36 / 38 features.
2026-06-12 19:52:32,989 - train_pipeline - INFO - Early stopping triggered at epoch 21
2026-06-12 19:52:32,996 - preprocessing - INFO - Student engineered features created: ['grade_growth', 'grade_avg', 'absence_study_ratio', 'failure_risk', 'alcohol_risk', 'social_risk']
2026-06-12 19:52:32,996 - preprocessing - INFO - Student engineered features created: ['grade_growth', 'grade_avg', 'absence_study_ratio', 'failure_risk', 'alcohol_risk', 'social_risk']
2026-06-12 19:52:33,055 - preprocessing - INFO - Applying ADASYN on train set with ratio 0.7233796902588431...
2026-06-12 19:52:33,273 - preprocessing - INFO - Feature selection complete. Selected 34 / 38 features.
2026-06-12 19:52:36,374 - train_pipeline - INFO - Early stopping triggered at epoch 29
[I 2026-06-12 19:52:36,374] Trial 25 finished with value: 0.8337221091077707 and parameters: {'learning_rate': 0.0024343362706749773, 'weight_decay': 5.741635225741905e-06, 'batch_size': 64, 'oversample_method': 'adasyn', 'smote_ratio': 0.7233796902588431, 'cnn_channels': 64, 'lstm_hidden_dim': 64, 'context_hidden_dim': 64, 'fusion_hidden_dim': 32, 'dropout': 0.32031844829772416}. Best is trial 21 with value: 0.8897981256933332.
2026-06-12 19:52:36,388 - preprocessing - INFO - Student engineered features created: ['grade_growth', 'grade_avg', 'absence_study_ratio', 'failure_risk', 'alcohol_risk', 'social_risk']
2026-06-12 19:52:36,392 - preprocessing - INFO - Student engineered features created: ['grade_growth', 'grade_avg', 'absence_study_ratio', 'failure_risk', 'alcohol_risk', 'social_risk']
2026-06-12 19:52:36,436 - preprocessing - INFO - Applying ADASYN on train set with ratio 0.7563664837594952...
2026-06-12 19:52:36,649 - preprocessing - INFO - Feature selection complete. Selected 36 / 38 features.
2026-06-12 19:52:38,603 - train_pipeline - INFO - Early stopping triggered at epoch 18
2026-06-12 19:52:38,619 - preprocessing - INFO - Student engineered features created: ['grade_growth', 'grade_avg', 'absence_study_ratio', 'failure_risk', 'alcohol_risk', 'social_risk']
2026-06-12 19:52:38,624 - preprocessing - INFO - Student engineered features created: ['grade_growth', 'grade_avg', 'absence_study_ratio', 'failure_risk', 'alcohol_risk', 'social_risk']
2026-06-12 19:52:38,671 - preprocessing - INFO - Applying ADASYN on train set with ratio 0.7563664837594952...
2026-06-12 19:52:38,894 - preprocessing - INFO - Feature selection complete. Selected 34 / 38 features.
2026-06-12 19:52:40,698 - train_pipeline - INFO - Early stopping triggered at epoch 17
2026-06-12 19:52:40,706 - preprocessing - INFO - Student engineered features created: ['grade_growth', 'grade_avg', 'absence_study_ratio', 'failure_risk', 'alcohol_risk', 'social_risk']
2026-06-12 19:52:40,709 - preprocessing - INFO - Student engineered features created: ['grade_growth', 'grade_avg', 'absence_study_ratio', 'failure_risk', 'alcohol_risk', 'social_risk']
2026-06-12 19:52:40,751 - preprocessing - INFO - Applying ADASYN on train set with ratio 0.7563664837594952...
2026-06-12 19:52:40,969 - preprocessing - INFO - Feature selection complete. Selected 35 / 38 features.
2026-06-12 19:52:42,930 - train_pipeline - INFO - Early stopping triggered at epoch 18
2026-06-12 19:52:42,930 - preprocessing - INFO - Student engineered features created: ['grade_growth', 'grade_avg', 'absence_study_ratio', 'failure_risk', 'alcohol_risk', 'social_risk']
2026-06-12 19:52:42,937 - preprocessing - INFO - Student engineered features created: ['grade_growth', 'grade_avg', 'absence_study_ratio', 'failure_risk', 'alcohol_risk', 'social_risk']
2026-06-12 19:52:42,978 - preprocessing - INFO - Applying ADASYN on train set with ratio 0.7563664837594952...
2026-06-12 19:52:43,209 - preprocessing - INFO - Feature selection complete. Selected 36 / 38 features.
2026-06-12 19:52:45,119 - train_pipeline - INFO - Early stopping triggered at epoch 18
2026-06-12 19:52:45,119 - preprocessing - INFO - Student engineered features created: ['grade_growth', 'grade_avg', 'absence_study_ratio', 'failure_risk', 'alcohol_risk', 'social_risk']
2026-06-12 19:52:45,119 - preprocessing - INFO - Student engineered features created: ['grade_growth', 'grade_avg', 'absence_study_ratio', 'failure_risk', 'alcohol_risk', 'social_risk']
2026-06-12 19:52:45,177 - preprocessing - INFO - Applying ADASYN on train set with ratio 0.7563664837594952...
2026-06-12 19:52:45,394 - preprocessing - INFO - Feature selection complete. Selected 34 / 38 features.
2026-06-12 19:52:47,446 - train_pipeline - INFO - Early stopping triggered at epoch 19
[I 2026-06-12 19:52:47,446] Trial 26 finished with value: 0.39871468954856853 and parameters: {'learning_rate': 0.00010377271384999361, 'weight_decay': 2.301352091825541e-05, 'batch_size': 64, 'oversample_method': 'adasyn', 'smote_ratio': 0.7563664837594952, 'cnn_channels': 64, 'lstm_hidden_dim': 64, 'context_hidden_dim': 32, 'fusion_hidden_dim': 128, 'dropout': 0.17791130163345634}. Best is trial 21 with value: 0.8897981256933332.
2026-06-12 19:52:47,453 - preprocessing - INFO - Student engineered features created: ['grade_growth', 'grade_avg', 'absence_study_ratio', 'failure_risk', 'alcohol_risk', 'social_risk']
2026-06-12 19:52:47,463 - preprocessing - INFO - Student engineered features created: ['grade_growth', 'grade_avg', 'absence_study_ratio', 'failure_risk', 'alcohol_risk', 'social_risk']
2026-06-12 19:52:47,494 - preprocessing - INFO - Applying ADASYN on train set with ratio 0.4011331833763365...
2026-06-12 19:52:47,522 - preprocessing - WARNING - ADASYN failed (likely too few samples). Error: No samples will be generated with the provided ratio settings.. Falling back to no oversampling.
2026-06-12 19:52:47,736 - preprocessing - INFO - Feature selection complete. Selected 28 / 38 features.
2026-06-12 19:52:51,062 - preprocessing - INFO - Student engineered features created: ['grade_growth', 'grade_avg', 'absence_study_ratio', 'failure_risk', 'alcohol_risk', 'social_risk']
2026-06-12 19:52:51,071 - preprocessing - INFO - Student engineered features created: ['grade_growth', 'grade_avg', 'absence_study_ratio', 'failure_risk', 'alcohol_risk', 'social_risk']
2026-06-12 19:52:51,118 - preprocessing - INFO - Applying ADASYN on train set with ratio 0.4011331833763365...
2026-06-12 19:52:51,139 - preprocessing - WARNING - ADASYN failed (likely too few samples). Error: No samples will be generated with the provided ratio settings.. Falling back to no oversampling.
2026-06-12 19:52:51,354 - preprocessing - INFO - Feature selection complete. Selected 28 / 38 features.
2026-06-12 19:52:54,647 - train_pipeline - INFO - Early stopping triggered at epoch 49
2026-06-12 19:52:54,647 - preprocessing - INFO - Student engineered features created: ['grade_growth', 'grade_avg', 'absence_study_ratio', 'failure_risk', 'alcohol_risk', 'social_risk']
2026-06-12 19:52:54,647 - preprocessing - INFO - Student engineered features created: ['grade_growth', 'grade_avg', 'absence_study_ratio', 'failure_risk', 'alcohol_risk', 'social_risk']
2026-06-12 19:52:54,696 - preprocessing - INFO - Applying ADASYN on train set with ratio 0.4011331833763365...
2026-06-12 19:52:54,723 - preprocessing - WARNING - ADASYN failed (likely too few samples). Error: No samples will be generated with the provided ratio settings.. Falling back to no oversampling.
2026-06-12 19:52:54,933 - preprocessing - INFO - Feature selection complete. Selected 25 / 38 features.
2026-06-12 19:52:58,492 - preprocessing - INFO - Student engineered features created: ['grade_growth', 'grade_avg', 'absence_study_ratio', 'failure_risk', 'alcohol_risk', 'social_risk']
2026-06-12 19:52:58,497 - preprocessing - INFO - Student engineered features created: ['grade_growth', 'grade_avg', 'absence_study_ratio', 'failure_risk', 'alcohol_risk', 'social_risk']
2026-06-12 19:52:58,549 - preprocessing - INFO - Applying ADASYN on train set with ratio 0.4011331833763365...
2026-06-12 19:52:58,561 - preprocessing - WARNING - ADASYN failed (likely too few samples). Error: No samples will be generated with the provided ratio settings.. Falling back to no oversampling.
2026-06-12 19:52:58,771 - preprocessing - INFO - Feature selection complete. Selected 25 / 38 features.
2026-06-12 19:53:00,069 - train_pipeline - INFO - Early stopping triggered at epoch 19
2026-06-12 19:53:00,069 - preprocessing - INFO - Student engineered features created: ['grade_growth', 'grade_avg', 'absence_study_ratio', 'failure_risk', 'alcohol_risk', 'social_risk']
2026-06-12 19:53:00,085 - preprocessing - INFO - Student engineered features created: ['grade_growth', 'grade_avg', 'absence_study_ratio', 'failure_risk', 'alcohol_risk', 'social_risk']
2026-06-12 19:53:00,137 - preprocessing - INFO - Applying ADASYN on train set with ratio 0.4011331833763365...
2026-06-12 19:53:00,154 - preprocessing - WARNING - ADASYN failed (likely too few samples). Error: No samples will be generated with the provided ratio settings.. Falling back to no oversampling.
2026-06-12 19:53:00,365 - preprocessing - INFO - Feature selection complete. Selected 27 / 38 features.
[I 2026-06-12 19:53:03,763] Trial 27 finished with value: 0.8503452478250002 and parameters: {'learning_rate': 0.0006858625006908223, 'weight_decay': 4.598054448830604e-05, 'batch_size': 64, 'oversample_method': 'adasyn', 'smote_ratio': 0.4011331833763365, 'cnn_channels': 64, 'lstm_hidden_dim': 64, 'context_hidden_dim': 32, 'fusion_hidden_dim': 32, 'dropout': 0.3092818008471404}. Best is trial 21 with value: 0.8897981256933332.
2026-06-12 19:53:03,769 - preprocessing - INFO - Student engineered features created: ['grade_growth', 'grade_avg', 'absence_study_ratio', 'failure_risk', 'alcohol_risk', 'social_risk']
2026-06-12 19:53:03,778 - preprocessing - INFO - Student engineered features created: ['grade_growth', 'grade_avg', 'absence_study_ratio', 'failure_risk', 'alcohol_risk', 'social_risk']
2026-06-12 19:53:03,813 - preprocessing - INFO - Applying ADASYN on train set with ratio 0.5984575753337193...
2026-06-12 19:53:04,043 - preprocessing - INFO - Feature selection complete. Selected 34 / 38 features.
2026-06-12 19:53:06,233 - train_pipeline - INFO - Early stopping triggered at epoch 23
2026-06-12 19:53:06,233 - preprocessing - INFO - Student engineered features created: ['grade_growth', 'grade_avg', 'absence_study_ratio', 'failure_risk', 'alcohol_risk', 'social_risk']
2026-06-12 19:53:06,233 - preprocessing - INFO - Student engineered features created: ['grade_growth', 'grade_avg', 'absence_study_ratio', 'failure_risk', 'alcohol_risk', 'social_risk']
2026-06-12 19:53:06,276 - preprocessing - INFO - Applying ADASYN on train set with ratio 0.5984575753337193...
2026-06-12 19:53:06,499 - preprocessing - INFO - Feature selection complete. Selected 32 / 38 features.
2026-06-12 19:53:08,380 - train_pipeline - INFO - Early stopping triggered at epoch 20
2026-06-12 19:53:08,380 - preprocessing - INFO - Student engineered features created: ['grade_growth', 'grade_avg', 'absence_study_ratio', 'failure_risk', 'alcohol_risk', 'social_risk']
2026-06-12 19:53:08,396 - preprocessing - INFO - Student engineered features created: ['grade_growth', 'grade_avg', 'absence_study_ratio', 'failure_risk', 'alcohol_risk', 'social_risk']
2026-06-12 19:53:08,434 - preprocessing - INFO - Applying ADASYN on train set with ratio 0.5984575753337193...
2026-06-12 19:53:08,648 - preprocessing - INFO - Feature selection complete. Selected 34 / 38 features.
2026-06-12 19:53:10,354 - train_pipeline - INFO - Early stopping triggered at epoch 18
2026-06-12 19:53:10,354 - preprocessing - INFO - Student engineered features created: ['grade_growth', 'grade_avg', 'absence_study_ratio', 'failure_risk', 'alcohol_risk', 'social_risk']
2026-06-12 19:53:10,354 - preprocessing - INFO - Student engineered features created: ['grade_growth', 'grade_avg', 'absence_study_ratio', 'failure_risk', 'alcohol_risk', 'social_risk']
2026-06-12 19:53:10,404 - preprocessing - INFO - Applying ADASYN on train set with ratio 0.5984575753337193...
2026-06-12 19:53:10,618 - preprocessing - INFO - Feature selection complete. Selected 35 / 38 features.
2026-06-12 19:53:12,406 - train_pipeline - INFO - Early stopping triggered at epoch 19
2026-06-12 19:53:12,418 - preprocessing - INFO - Student engineered features created: ['grade_growth', 'grade_avg', 'absence_study_ratio', 'failure_risk', 'alcohol_risk', 'social_risk']
2026-06-12 19:53:12,422 - preprocessing - INFO - Student engineered features created: ['grade_growth', 'grade_avg', 'absence_study_ratio', 'failure_risk', 'alcohol_risk', 'social_risk']
2026-06-12 19:53:12,451 - preprocessing - INFO - Applying ADASYN on train set with ratio 0.5984575753337193...
2026-06-12 19:53:12,693 - preprocessing - INFO - Feature selection complete. Selected 33 / 38 features.
[I 2026-06-12 19:53:17,328] Trial 28 finished with value: 0.869739860210004 and parameters: {'learning_rate': 0.006700054316205576, 'weight_decay': 0.00022060518585059042, 'batch_size': 64, 'oversample_method': 'adasyn', 'smote_ratio': 0.5984575753337193, 'cnn_channels': 32, 'lstm_hidden_dim': 64, 'context_hidden_dim': 64, 'fusion_hidden_dim': 32, 'dropout': 0.10416508859788473}. Best is trial 21 with value: 0.8897981256933332.
2026-06-12 19:53:17,352 - preprocessing - INFO - Student engineered features created: ['grade_growth', 'grade_avg', 'absence_study_ratio', 'failure_risk', 'alcohol_risk', 'social_risk']
2026-06-12 19:53:17,353 - preprocessing - INFO - Student engineered features created: ['grade_growth', 'grade_avg', 'absence_study_ratio', 'failure_risk', 'alcohol_risk', 'social_risk']
2026-06-12 19:53:17,388 - preprocessing - INFO - Applying ADASYN on train set with ratio 0.8718523247520065...
2026-06-12 19:53:17,610 - preprocessing - INFO - Feature selection complete. Selected 36 / 38 features.
2026-06-12 19:53:19,769 - train_pipeline - INFO - Early stopping triggered at epoch 19
2026-06-12 19:53:19,770 - preprocessing - INFO - Student engineered features created: ['grade_growth', 'grade_avg', 'absence_study_ratio', 'failure_risk', 'alcohol_risk', 'social_risk']
2026-06-12 19:53:19,775 - preprocessing - INFO - Student engineered features created: ['grade_growth', 'grade_avg', 'absence_study_ratio', 'failure_risk', 'alcohol_risk', 'social_risk']
2026-06-12 19:53:19,816 - preprocessing - INFO - Applying ADASYN on train set with ratio 0.8718523247520065...
2026-06-12 19:53:20,045 - preprocessing - INFO - Feature selection complete. Selected 35 / 38 features.
2026-06-12 19:53:22,239 - train_pipeline - INFO - Early stopping triggered at epoch 20
2026-06-12 19:53:22,247 - preprocessing - INFO - Student engineered features created: ['grade_growth', 'grade_avg', 'absence_study_ratio', 'failure_risk', 'alcohol_risk', 'social_risk']
2026-06-12 19:53:22,250 - preprocessing - INFO - Student engineered features created: ['grade_growth', 'grade_avg', 'absence_study_ratio', 'failure_risk', 'alcohol_risk', 'social_risk']
2026-06-12 19:53:22,295 - preprocessing - INFO - Applying ADASYN on train set with ratio 0.8718523247520065...
2026-06-12 19:53:22,513 - preprocessing - INFO - Feature selection complete. Selected 36 / 38 features.
2026-06-12 19:53:28,180 - preprocessing - INFO - Student engineered features created: ['grade_growth', 'grade_avg', 'absence_study_ratio', 'failure_risk', 'alcohol_risk', 'social_risk']
2026-06-12 19:53:28,183 - preprocessing - INFO - Student engineered features created: ['grade_growth', 'grade_avg', 'absence_study_ratio', 'failure_risk', 'alcohol_risk', 'social_risk']
2026-06-12 19:53:28,231 - preprocessing - INFO - Applying ADASYN on train set with ratio 0.8718523247520065...
2026-06-12 19:53:28,453 - preprocessing - INFO - Feature selection complete. Selected 37 / 38 features.
2026-06-12 19:53:31,427 - train_pipeline - INFO - Early stopping triggered at epoch 26
2026-06-12 19:53:31,441 - preprocessing - INFO - Student engineered features created: ['grade_growth', 'grade_avg', 'absence_study_ratio', 'failure_risk', 'alcohol_risk', 'social_risk']
2026-06-12 19:53:31,443 - preprocessing - INFO - Student engineered features created: ['grade_growth', 'grade_avg', 'absence_study_ratio', 'failure_risk', 'alcohol_risk', 'social_risk']
2026-06-12 19:53:31,494 - preprocessing - INFO - Applying ADASYN on train set with ratio 0.8718523247520065...
2026-06-12 19:53:31,703 - preprocessing - INFO - Feature selection complete. Selected 37 / 38 features.
2026-06-12 19:53:37,053 - train_pipeline - INFO - Early stopping triggered at epoch 47
