[I 2026-06-12 20:25:14,997] Trial 22 finished with value: 0.7852953286426773 and parameters: {'learning_rate': 0.006608497309196193, 'weight_decay': 1.3638035562176653e-05, 'batch_size': 16, 'oversample_method': 'adasyn', 'smote_ratio': 0.5181171450838976, 'cnn_channels': 16, 'lstm_hidden_dim': 64, 'context_hidden_dim': 128, 'fusion_hidden_dim': 64, 'dropout': 0.3009427529534572}. Best is trial 1 with value: 0.7981084913133594.
2026-06-12 20:25:15,004 - preprocessing - INFO - xAPI engineered features created: ['engagement_score', 'absence_risk', 'parent_support_signal']
2026-06-12 20:25:15,010 - preprocessing - INFO - xAPI engineered features created: ['engagement_score', 'absence_risk', 'parent_support_signal']
2026-06-12 20:25:15,025 - preprocessing - INFO - Applying ADASYN on train set with ratio 0.704102903283306...
2026-06-12 20:25:15,031 - preprocessing - WARNING - ADASYN failed (likely too few samples). Error: No samples will be generated with the provided ratio settings.. Falling back to no oversampling.
2026-06-12 20:25:15,156 - preprocessing - INFO - Feature selection complete. Selected 15 / 19 features.
2026-06-12 20:25:19,520 - train_pipeline - INFO - Early stopping triggered at epoch 29
2026-06-12 20:25:19,520 - preprocessing - INFO - xAPI engineered features created: ['engagement_score', 'absence_risk', 'parent_support_signal']
2026-06-12 20:25:19,520 - preprocessing - INFO - xAPI engineered features created: ['engagement_score', 'absence_risk', 'parent_support_signal']
2026-06-12 20:25:19,548 - preprocessing - INFO - Applying ADASYN on train set with ratio 0.704102903283306...
2026-06-12 20:25:19,554 - preprocessing - WARNING - ADASYN failed (likely too few samples). Error: No samples will be generated with the provided ratio settings.. Falling back to no oversampling.
2026-06-12 20:25:19,679 - preprocessing - INFO - Feature selection complete. Selected 16 / 19 features.
2026-06-12 20:25:22,253 - train_pipeline - INFO - Early stopping triggered at epoch 17
2026-06-12 20:25:22,253 - preprocessing - INFO - xAPI engineered features created: ['engagement_score', 'absence_risk', 'parent_support_signal']
2026-06-12 20:25:22,253 - preprocessing - INFO - xAPI engineered features created: ['engagement_score', 'absence_risk', 'parent_support_signal']
2026-06-12 20:25:22,269 - preprocessing - INFO - Applying ADASYN on train set with ratio 0.704102903283306...
2026-06-12 20:25:22,284 - preprocessing - WARNING - ADASYN failed (likely too few samples). Error: No samples will be generated with the provided ratio settings.. Falling back to no oversampling.
2026-06-12 20:25:22,416 - preprocessing - INFO - Feature selection complete. Selected 18 / 19 features.
2026-06-12 20:25:26,565 - train_pipeline - INFO - Early stopping triggered at epoch 27
2026-06-12 20:25:26,565 - preprocessing - INFO - xAPI engineered features created: ['engagement_score', 'absence_risk', 'parent_support_signal']
2026-06-12 20:25:26,565 - preprocessing - INFO - xAPI engineered features created: ['engagement_score', 'absence_risk', 'parent_support_signal']
2026-06-12 20:25:26,582 - preprocessing - INFO - Applying ADASYN on train set with ratio 0.704102903283306...
2026-06-12 20:25:26,598 - preprocessing - WARNING - ADASYN failed (likely too few samples). Error: No samples will be generated with the provided ratio settings.. Falling back to no oversampling.
2026-06-12 20:25:26,734 - preprocessing - INFO - Feature selection complete. Selected 16 / 19 features.
2026-06-12 20:25:30,828 - train_pipeline - INFO - Early stopping triggered at epoch 27
2026-06-12 20:25:30,841 - preprocessing - INFO - xAPI engineered features created: ['engagement_score', 'absence_risk', 'parent_support_signal']
2026-06-12 20:25:30,841 - preprocessing - INFO - xAPI engineered features created: ['engagement_score', 'absence_risk', 'parent_support_signal']
2026-06-12 20:25:30,862 - preprocessing - INFO - Applying ADASYN on train set with ratio 0.704102903283306...
2026-06-12 20:25:30,862 - preprocessing - WARNING - ADASYN failed (likely too few samples). Error: No samples will be generated with the provided ratio settings.. Falling back to no oversampling.
2026-06-12 20:25:31,009 - preprocessing - INFO - Feature selection complete. Selected 18 / 19 features.
2026-06-12 20:25:35,831 - train_pipeline - INFO - Early stopping triggered at epoch 31
[I 2026-06-12 20:25:35,833] Trial 23 finished with value: 0.8021730167770063 and parameters: {'learning_rate': 0.0023738542652220035, 'weight_decay': 5.352577681813433e-05, 'batch_size': 16, 'oversample_method': 'adasyn', 'smote_ratio': 0.704102903283306, 'cnn_channels': 16, 'lstm_hidden_dim': 64, 'context_hidden_dim': 128, 'fusion_hidden_dim': 64, 'dropout': 0.2978884746226379}. Best is trial 23 with value: 0.8021730167770063.
2026-06-12 20:25:35,843 - preprocessing - INFO - xAPI engineered features created: ['engagement_score', 'absence_risk', 'parent_support_signal']
2026-06-12 20:25:35,848 - preprocessing - INFO - xAPI engineered features created: ['engagement_score', 'absence_risk', 'parent_support_signal']
2026-06-12 20:25:35,859 - preprocessing - INFO - Applying ADASYN on train set with ratio 0.7008342020469517...
2026-06-12 20:25:35,871 - preprocessing - WARNING - ADASYN failed (likely too few samples). Error: No samples will be generated with the provided ratio settings.. Falling back to no oversampling.
2026-06-12 20:25:36,004 - preprocessing - INFO - Feature selection complete. Selected 15 / 19 features.
2026-06-12 20:25:39,324 - train_pipeline - INFO - Early stopping triggered at epoch 22
2026-06-12 20:25:39,326 - preprocessing - INFO - xAPI engineered features created: ['engagement_score', 'absence_risk', 'parent_support_signal']
2026-06-12 20:25:39,326 - preprocessing - INFO - xAPI engineered features created: ['engagement_score', 'absence_risk', 'parent_support_signal']
2026-06-12 20:25:39,340 - preprocessing - INFO - Applying ADASYN on train set with ratio 0.7008342020469517...
2026-06-12 20:25:39,340 - preprocessing - WARNING - ADASYN failed (likely too few samples). Error: No samples will be generated with the provided ratio settings.. Falling back to no oversampling.
2026-06-12 20:25:39,467 - preprocessing - INFO - Feature selection complete. Selected 16 / 19 features.
2026-06-12 20:25:43,315 - train_pipeline - INFO - Early stopping triggered at epoch 25
2026-06-12 20:25:43,315 - preprocessing - INFO - xAPI engineered features created: ['engagement_score', 'absence_risk', 'parent_support_signal']
2026-06-12 20:25:43,315 - preprocessing - INFO - xAPI engineered features created: ['engagement_score', 'absence_risk', 'parent_support_signal']
2026-06-12 20:25:43,336 - preprocessing - INFO - Applying ADASYN on train set with ratio 0.7008342020469517...
2026-06-12 20:25:43,352 - preprocessing - WARNING - ADASYN failed (likely too few samples). Error: No samples will be generated with the provided ratio settings.. Falling back to no oversampling.
2026-06-12 20:25:43,482 - preprocessing - INFO - Feature selection complete. Selected 18 / 19 features.
2026-06-12 20:25:47,637 - train_pipeline - INFO - Early stopping triggered at epoch 27
2026-06-12 20:25:47,637 - preprocessing - INFO - xAPI engineered features created: ['engagement_score', 'absence_risk', 'parent_support_signal']
2026-06-12 20:25:47,637 - preprocessing - INFO - xAPI engineered features created: ['engagement_score', 'absence_risk', 'parent_support_signal']
2026-06-12 20:25:47,659 - preprocessing - INFO - Applying ADASYN on train set with ratio 0.7008342020469517...
2026-06-12 20:25:47,665 - preprocessing - WARNING - ADASYN failed (likely too few samples). Error: No samples will be generated with the provided ratio settings.. Falling back to no oversampling.
2026-06-12 20:25:47,804 - preprocessing - INFO - Feature selection complete. Selected 16 / 19 features.
2026-06-12 20:25:52,757 - train_pipeline - INFO - Early stopping triggered at epoch 32
2026-06-12 20:25:52,757 - preprocessing - INFO - xAPI engineered features created: ['engagement_score', 'absence_risk', 'parent_support_signal']
2026-06-12 20:25:52,766 - preprocessing - INFO - xAPI engineered features created: ['engagement_score', 'absence_risk', 'parent_support_signal']
2026-06-12 20:25:52,771 - preprocessing - INFO - Applying ADASYN on train set with ratio 0.7008342020469517...
2026-06-12 20:25:52,785 - preprocessing - WARNING - ADASYN failed (likely too few samples). Error: No samples will be generated with the provided ratio settings.. Falling back to no oversampling.
2026-06-12 20:25:52,917 - preprocessing - INFO - Feature selection complete. Selected 18 / 19 features.
2026-06-12 20:25:57,232 - train_pipeline - INFO - Early stopping triggered at epoch 28
[I 2026-06-12 20:25:57,232] Trial 24 finished with value: 0.7842874539453863 and parameters: {'learning_rate': 0.002291290035883063, 'weight_decay': 0.00025572098021841845, 'batch_size': 16, 'oversample_method': 'adasyn', 'smote_ratio': 0.7008342020469517, 'cnn_channels': 16, 'lstm_hidden_dim': 64, 'context_hidden_dim': 128, 'fusion_hidden_dim': 64, 'dropout': 0.25496499858197924}. Best is trial 23 with value: 0.8021730167770063.
2026-06-12 20:25:57,247 - preprocessing - INFO - xAPI engineered features created: ['engagement_score', 'absence_risk', 'parent_support_signal']
2026-06-12 20:25:57,252 - preprocessing - INFO - xAPI engineered features created: ['engagement_score', 'absence_risk', 'parent_support_signal']
2026-06-12 20:25:57,268 - preprocessing - INFO - Applying ADASYN on train set with ratio 0.8249862168762562...
2026-06-12 20:25:57,281 - preprocessing - WARNING - ADASYN failed (likely too few samples). Error: No samples will be generated with the provided ratio settings.. Falling back to no oversampling.
2026-06-12 20:25:57,405 - preprocessing - INFO - Feature selection complete. Selected 15 / 19 features.
2026-06-12 20:26:01,561 - train_pipeline - INFO - Early stopping triggered at epoch 27
2026-06-12 20:26:01,561 - preprocessing - INFO - xAPI engineered features created: ['engagement_score', 'absence_risk', 'parent_support_signal']
2026-06-12 20:26:01,561 - preprocessing - INFO - xAPI engineered features created: ['engagement_score', 'absence_risk', 'parent_support_signal']
2026-06-12 20:26:01,577 - preprocessing - INFO - Applying ADASYN on train set with ratio 0.8249862168762562...
2026-06-12 20:26:01,588 - preprocessing - WARNING - ADASYN failed (likely too few samples). Error: No samples will be generated with the provided ratio settings.. Falling back to no oversampling.
2026-06-12 20:26:01,772 - preprocessing - INFO - Feature selection complete. Selected 16 / 19 features.
2026-06-12 20:26:05,134 - train_pipeline - INFO - Early stopping triggered at epoch 21
2026-06-12 20:26:05,134 - preprocessing - INFO - xAPI engineered features created: ['engagement_score', 'absence_risk', 'parent_support_signal']
2026-06-12 20:26:05,134 - preprocessing - INFO - xAPI engineered features created: ['engagement_score', 'absence_risk', 'parent_support_signal']
2026-06-12 20:26:05,153 - preprocessing - INFO - Applying ADASYN on train set with ratio 0.8249862168762562...
2026-06-12 20:26:05,168 - preprocessing - WARNING - ADASYN failed (likely too few samples). Error: No samples will be generated with the provided ratio settings.. Falling back to no oversampling.
2026-06-12 20:26:05,309 - preprocessing - INFO - Feature selection complete. Selected 18 / 19 features.
2026-06-12 20:26:07,968 - train_pipeline - INFO - Early stopping triggered at epoch 17
2026-06-12 20:26:07,978 - preprocessing - INFO - xAPI engineered features created: ['engagement_score', 'absence_risk', 'parent_support_signal']
2026-06-12 20:26:07,978 - preprocessing - INFO - xAPI engineered features created: ['engagement_score', 'absence_risk', 'parent_support_signal']
2026-06-12 20:26:08,000 - preprocessing - INFO - Applying ADASYN on train set with ratio 0.8249862168762562...
2026-06-12 20:26:08,019 - preprocessing - WARNING - ADASYN failed (likely too few samples). Error: No samples will be generated with the provided ratio settings.. Falling back to no oversampling.
2026-06-12 20:26:08,151 - preprocessing - INFO - Feature selection complete. Selected 16 / 19 features.
2026-06-12 20:26:11,065 - train_pipeline - INFO - Early stopping triggered at epoch 19
2026-06-12 20:26:11,065 - preprocessing - INFO - xAPI engineered features created: ['engagement_score', 'absence_risk', 'parent_support_signal']
2026-06-12 20:26:11,065 - preprocessing - INFO - xAPI engineered features created: ['engagement_score', 'absence_risk', 'parent_support_signal']
2026-06-12 20:26:11,093 - preprocessing - INFO - Applying ADASYN on train set with ratio 0.8249862168762562...
2026-06-12 20:26:11,093 - preprocessing - WARNING - ADASYN failed (likely too few samples). Error: No samples will be generated with the provided ratio settings.. Falling back to no oversampling.
2026-06-12 20:26:11,238 - preprocessing - INFO - Feature selection complete. Selected 18 / 19 features.
2026-06-12 20:26:15,720 - train_pipeline - INFO - Early stopping triggered at epoch 29
[I 2026-06-12 20:26:15,720] Trial 25 finished with value: 0.7902680623128598 and parameters: {'learning_rate': 0.003657023269974711, 'weight_decay': 4.159951205533715e-05, 'batch_size': 16, 'oversample_method': 'adasyn', 'smote_ratio': 0.8249862168762562, 'cnn_channels': 16, 'lstm_hidden_dim': 64, 'context_hidden_dim': 128, 'fusion_hidden_dim': 64, 'dropout': 0.19788703481076964}. Best is trial 23 with value: 0.8021730167770063.
2026-06-12 20:26:15,746 - preprocessing - INFO - xAPI engineered features created: ['engagement_score', 'absence_risk', 'parent_support_signal']
2026-06-12 20:26:15,748 - preprocessing - INFO - xAPI engineered features created: ['engagement_score', 'absence_risk', 'parent_support_signal']
2026-06-12 20:26:15,764 - preprocessing - INFO - Applying ADASYN on train set with ratio 0.7164718075489455...
2026-06-12 20:26:15,772 - preprocessing - WARNING - ADASYN failed (likely too few samples). Error: No samples will be generated with the provided ratio settings.. Falling back to no oversampling.
2026-06-12 20:26:15,893 - preprocessing - INFO - Feature selection complete. Selected 15 / 19 features.
2026-06-12 20:26:23,448 - preprocessing - INFO - xAPI engineered features created: ['engagement_score', 'absence_risk', 'parent_support_signal']
2026-06-12 20:26:23,448 - preprocessing - INFO - xAPI engineered features created: ['engagement_score', 'absence_risk', 'parent_support_signal']
2026-06-12 20:26:23,471 - preprocessing - INFO - Applying ADASYN on train set with ratio 0.7164718075489455...
2026-06-12 20:26:23,486 - preprocessing - WARNING - ADASYN failed (likely too few samples). Error: No samples will be generated with the provided ratio settings.. Falling back to no oversampling.
2026-06-12 20:26:23,615 - preprocessing - INFO - Feature selection complete. Selected 16 / 19 features.
2026-06-12 20:26:27,271 - train_pipeline - INFO - Early stopping triggered at epoch 24
2026-06-12 20:26:27,275 - preprocessing - INFO - xAPI engineered features created: ['engagement_score', 'absence_risk', 'parent_support_signal']
2026-06-12 20:26:27,278 - preprocessing - INFO - xAPI engineered features created: ['engagement_score', 'absence_risk', 'parent_support_signal']
2026-06-12 20:26:27,293 - preprocessing - INFO - Applying ADASYN on train set with ratio 0.7164718075489455...
2026-06-12 20:26:27,299 - preprocessing - WARNING - ADASYN failed (likely too few samples). Error: No samples will be generated with the provided ratio settings.. Falling back to no oversampling.
2026-06-12 20:26:27,417 - preprocessing - INFO - Feature selection complete. Selected 18 / 19 features.
2026-06-12 20:26:31,616 - train_pipeline - INFO - Early stopping triggered at epoch 27
2026-06-12 20:26:31,616 - preprocessing - INFO - xAPI engineered features created: ['engagement_score', 'absence_risk', 'parent_support_signal']
2026-06-12 20:26:31,632 - preprocessing - INFO - xAPI engineered features created: ['engagement_score', 'absence_risk', 'parent_support_signal']
2026-06-12 20:26:31,652 - preprocessing - INFO - Applying ADASYN on train set with ratio 0.7164718075489455...
2026-06-12 20:26:31,657 - preprocessing - WARNING - ADASYN failed (likely too few samples). Error: No samples will be generated with the provided ratio settings.. Falling back to no oversampling.
2026-06-12 20:26:31,781 - preprocessing - INFO - Feature selection complete. Selected 16 / 19 features.
2026-06-12 20:26:37,095 - train_pipeline - INFO - Early stopping triggered at epoch 34
2026-06-12 20:26:37,111 - preprocessing - INFO - xAPI engineered features created: ['engagement_score', 'absence_risk', 'parent_support_signal']
2026-06-12 20:26:37,111 - preprocessing - INFO - xAPI engineered features created: ['engagement_score', 'absence_risk', 'parent_support_signal']
2026-06-12 20:26:37,127 - preprocessing - INFO - Applying ADASYN on train set with ratio 0.7164718075489455...
2026-06-12 20:26:37,127 - preprocessing - WARNING - ADASYN failed (likely too few samples). Error: No samples will be generated with the provided ratio settings.. Falling back to no oversampling.
2026-06-12 20:26:37,268 - preprocessing - INFO - Feature selection complete. Selected 18 / 19 features.
2026-06-12 20:26:41,292 - train_pipeline - INFO - Early stopping triggered at epoch 26
[I 2026-06-12 20:26:41,292] Trial 26 finished with value: 0.7769115100993969 and parameters: {'learning_rate': 0.0021867150521131117, 'weight_decay': 0.0009208200810448671, 'batch_size': 16, 'oversample_method': 'adasyn', 'smote_ratio': 0.7164718075489455, 'cnn_channels': 16, 'lstm_hidden_dim': 64, 'context_hidden_dim': 128, 'fusion_hidden_dim': 64, 'dropout': 0.3853333242127681}. Best is trial 23 with value: 0.8021730167770063.
2026-06-12 20:26:41,292 - preprocessing - INFO - xAPI engineered features created: ['engagement_score', 'absence_risk', 'parent_support_signal']
2026-06-12 20:26:41,307 - preprocessing - INFO - xAPI engineered features created: ['engagement_score', 'absence_risk', 'parent_support_signal']
2026-06-12 20:26:41,326 - preprocessing - INFO - Applying ADASYN on train set with ratio 0.6483251471068744...
2026-06-12 20:26:41,335 - preprocessing - WARNING - ADASYN failed (likely too few samples). Error: No samples will be generated with the provided ratio settings.. Falling back to no oversampling.
2026-06-12 20:26:41,497 - preprocessing - INFO - Feature selection complete. Selected 15 / 19 features.
2026-06-12 20:26:45,220 - train_pipeline - INFO - Early stopping triggered at epoch 24
2026-06-12 20:26:45,232 - preprocessing - INFO - xAPI engineered features created: ['engagement_score', 'absence_risk', 'parent_support_signal']
2026-06-12 20:26:45,232 - preprocessing - INFO - xAPI engineered features created: ['engagement_score', 'absence_risk', 'parent_support_signal']
2026-06-12 20:26:45,255 - preprocessing - INFO - Applying ADASYN on train set with ratio 0.6483251471068744...
2026-06-12 20:26:45,267 - preprocessing - WARNING - ADASYN failed (likely too few samples). Error: No samples will be generated with the provided ratio settings.. Falling back to no oversampling.
2026-06-12 20:26:45,400 - preprocessing - INFO - Feature selection complete. Selected 16 / 19 features.
2026-06-12 20:26:50,784 - train_pipeline - INFO - Early stopping triggered at epoch 34
2026-06-12 20:26:50,790 - preprocessing - INFO - xAPI engineered features created: ['engagement_score', 'absence_risk', 'parent_support_signal']
2026-06-12 20:26:50,792 - preprocessing - INFO - xAPI engineered features created: ['engagement_score', 'absence_risk', 'parent_support_signal']
2026-06-12 20:26:50,811 - preprocessing - INFO - Applying ADASYN on train set with ratio 0.6483251471068744...
2026-06-12 20:26:50,822 - preprocessing - WARNING - ADASYN failed (likely too few samples). Error: No samples will be generated with the provided ratio settings.. Falling back to no oversampling.
2026-06-12 20:26:50,992 - preprocessing - INFO - Feature selection complete. Selected 18 / 19 features.
2026-06-12 20:26:56,214 - train_pipeline - INFO - Early stopping triggered at epoch 31
2026-06-12 20:26:56,223 - preprocessing - INFO - xAPI engineered features created: ['engagement_score', 'absence_risk', 'parent_support_signal']
2026-06-12 20:26:56,223 - preprocessing - INFO - xAPI engineered features created: ['engagement_score', 'absence_risk', 'parent_support_signal']
2026-06-12 20:26:56,246 - preprocessing - INFO - Applying ADASYN on train set with ratio 0.6483251471068744...
2026-06-12 20:26:56,256 - preprocessing - WARNING - ADASYN failed (likely too few samples). Error: No samples will be generated with the provided ratio settings.. Falling back to no oversampling.
2026-06-12 20:26:56,426 - preprocessing - INFO - Feature selection complete. Selected 16 / 19 features.
2026-06-12 20:27:00,807 - train_pipeline - INFO - Early stopping triggered at epoch 26
2026-06-12 20:27:00,809 - preprocessing - INFO - xAPI engineered features created: ['engagement_score', 'absence_risk', 'parent_support_signal']
2026-06-12 20:27:00,809 - preprocessing - INFO - xAPI engineered features created: ['engagement_score', 'absence_risk', 'parent_support_signal']
2026-06-12 20:27:00,834 - preprocessing - INFO - Applying ADASYN on train set with ratio 0.6483251471068744...
2026-06-12 20:27:00,834 - preprocessing - WARNING - ADASYN failed (likely too few samples). Error: No samples will be generated with the provided ratio settings.. Falling back to no oversampling.
2026-06-12 20:27:00,973 - preprocessing - INFO - Feature selection complete. Selected 18 / 19 features.
2026-06-12 20:27:04,976 - train_pipeline - INFO - Early stopping triggered at epoch 25
