[I 2026-06-12 19:57:23,802] Trial 39 finished with value: 0.8387597714082247 and parameters: {'learning_rate': 0.0007900425054917658, 'weight_decay': 0.0004221447978568845, 'batch_size': 32, 'oversample_method': 'smote', 'smote_ratio': 0.4446025270130007, 'cnn_channels': 64, 'lstm_hidden_dim': 64, 'context_hidden_dim': 32, 'fusion_hidden_dim': 32, 'dropout': 0.25408747433013146}. Best is trial 21 with value: 0.8897981256933332.
2026-06-12 19:57:23,814 - preprocessing - INFO - Student engineered features created: ['grade_growth', 'grade_avg', 'absence_study_ratio', 'failure_risk', 'alcohol_risk', 'social_risk']
2026-06-12 19:57:23,814 - preprocessing - INFO - Student engineered features created: ['grade_growth', 'grade_avg', 'absence_study_ratio', 'failure_risk', 'alcohol_risk', 'social_risk']
2026-06-12 19:57:23,870 - preprocessing - INFO - Applying ADASYN on train set with ratio 0.580687823058503...
2026-06-12 19:57:24,093 - preprocessing - INFO - Feature selection complete. Selected 31 / 38 features.
2026-06-12 19:57:33,570 - train_pipeline - INFO - Early stopping triggered at epoch 35
2026-06-12 19:57:33,572 - preprocessing - INFO - Student engineered features created: ['grade_growth', 'grade_avg', 'absence_study_ratio', 'failure_risk', 'alcohol_risk', 'social_risk']
2026-06-12 19:57:33,572 - preprocessing - INFO - Student engineered features created: ['grade_growth', 'grade_avg', 'absence_study_ratio', 'failure_risk', 'alcohol_risk', 'social_risk']
2026-06-12 19:57:33,619 - preprocessing - INFO - Applying ADASYN on train set with ratio 0.580687823058503...
2026-06-12 19:57:33,849 - preprocessing - INFO - Feature selection complete. Selected 33 / 38 features.
2026-06-12 19:57:43,769 - train_pipeline - INFO - Early stopping triggered at epoch 37
2026-06-12 19:57:43,769 - preprocessing - INFO - Student engineered features created: ['grade_growth', 'grade_avg', 'absence_study_ratio', 'failure_risk', 'alcohol_risk', 'social_risk']
2026-06-12 19:57:43,769 - preprocessing - INFO - Student engineered features created: ['grade_growth', 'grade_avg', 'absence_study_ratio', 'failure_risk', 'alcohol_risk', 'social_risk']
2026-06-12 19:57:43,824 - preprocessing - INFO - Applying ADASYN on train set with ratio 0.580687823058503...
2026-06-12 19:57:44,057 - preprocessing - INFO - Feature selection complete. Selected 33 / 38 features.
2026-06-12 19:57:51,024 - train_pipeline - INFO - Early stopping triggered at epoch 26
2026-06-12 19:57:51,030 - preprocessing - INFO - Student engineered features created: ['grade_growth', 'grade_avg', 'absence_study_ratio', 'failure_risk', 'alcohol_risk', 'social_risk']
2026-06-12 19:57:51,030 - preprocessing - INFO - Student engineered features created: ['grade_growth', 'grade_avg', 'absence_study_ratio', 'failure_risk', 'alcohol_risk', 'social_risk']
2026-06-12 19:57:51,079 - preprocessing - INFO - Applying ADASYN on train set with ratio 0.580687823058503...
2026-06-12 19:57:51,294 - preprocessing - INFO - Feature selection complete. Selected 35 / 38 features.
2026-06-12 19:57:56,412 - train_pipeline - INFO - Early stopping triggered at epoch 19
2026-06-12 19:57:56,412 - preprocessing - INFO - Student engineered features created: ['grade_growth', 'grade_avg', 'absence_study_ratio', 'failure_risk', 'alcohol_risk', 'social_risk']
2026-06-12 19:57:56,419 - preprocessing - INFO - Student engineered features created: ['grade_growth', 'grade_avg', 'absence_study_ratio', 'failure_risk', 'alcohol_risk', 'social_risk']
2026-06-12 19:57:56,468 - preprocessing - INFO - Applying ADASYN on train set with ratio 0.580687823058503...
2026-06-12 19:57:56,686 - preprocessing - INFO - Feature selection complete. Selected 33 / 38 features.
2026-06-12 19:58:04,477 - train_pipeline - INFO - Early stopping triggered at epoch 29
[I 2026-06-12 19:58:04,480] Trial 40 finished with value: 0.8180463982055339 and parameters: {'learning_rate': 0.0012062300196094514, 'weight_decay': 0.0003204195384092942, 'batch_size': 16, 'oversample_method': 'adasyn', 'smote_ratio': 0.580687823058503, 'cnn_channels': 16, 'lstm_hidden_dim': 64, 'context_hidden_dim': 128, 'fusion_hidden_dim': 64, 'dropout': 0.29318507975728314}. Best is trial 21 with value: 0.8897981256933332.
2026-06-12 19:58:04,492 - preprocessing - INFO - Student engineered features created: ['grade_growth', 'grade_avg', 'absence_study_ratio', 'failure_risk', 'alcohol_risk', 'social_risk']
2026-06-12 19:58:04,494 - preprocessing - INFO - Student engineered features created: ['grade_growth', 'grade_avg', 'absence_study_ratio', 'failure_risk', 'alcohol_risk', 'social_risk']
2026-06-12 19:58:04,539 - preprocessing - INFO - Applying ADASYN on train set with ratio 0.5036391267961835...
2026-06-12 19:58:04,750 - preprocessing - INFO - Feature selection complete. Selected 31 / 38 features.
2026-06-12 19:58:07,170 - train_pipeline - INFO - Early stopping triggered at epoch 29
2026-06-12 19:58:07,173 - preprocessing - INFO - Student engineered features created: ['grade_growth', 'grade_avg', 'absence_study_ratio', 'failure_risk', 'alcohol_risk', 'social_risk']
2026-06-12 19:58:07,176 - preprocessing - INFO - Student engineered features created: ['grade_growth', 'grade_avg', 'absence_study_ratio', 'failure_risk', 'alcohol_risk', 'social_risk']
2026-06-12 19:58:07,219 - preprocessing - INFO - Applying ADASYN on train set with ratio 0.5036391267961835...
2026-06-12 19:58:07,444 - preprocessing - INFO - Feature selection complete. Selected 33 / 38 features.
2026-06-12 19:58:09,771 - train_pipeline - INFO - Early stopping triggered at epoch 27
2026-06-12 19:58:09,782 - preprocessing - INFO - Student engineered features created: ['grade_growth', 'grade_avg', 'absence_study_ratio', 'failure_risk', 'alcohol_risk', 'social_risk']
2026-06-12 19:58:09,782 - preprocessing - INFO - Student engineered features created: ['grade_growth', 'grade_avg', 'absence_study_ratio', 'failure_risk', 'alcohol_risk', 'social_risk']
2026-06-12 19:58:09,825 - preprocessing - INFO - Applying ADASYN on train set with ratio 0.5036391267961835...
2026-06-12 19:58:10,048 - preprocessing - INFO - Feature selection complete. Selected 30 / 38 features.
2026-06-12 19:58:11,641 - train_pipeline - INFO - Early stopping triggered at epoch 18
2026-06-12 19:58:11,648 - preprocessing - INFO - Student engineered features created: ['grade_growth', 'grade_avg', 'absence_study_ratio', 'failure_risk', 'alcohol_risk', 'social_risk']
2026-06-12 19:58:11,648 - preprocessing - INFO - Student engineered features created: ['grade_growth', 'grade_avg', 'absence_study_ratio', 'failure_risk', 'alcohol_risk', 'social_risk']
2026-06-12 19:58:11,697 - preprocessing - INFO - Applying ADASYN on train set with ratio 0.5036391267961835...
2026-06-12 19:58:11,929 - preprocessing - INFO - Feature selection complete. Selected 34 / 38 features.
2026-06-12 19:58:13,801 - train_pipeline - INFO - Early stopping triggered at epoch 22
2026-06-12 19:58:13,801 - preprocessing - INFO - Student engineered features created: ['grade_growth', 'grade_avg', 'absence_study_ratio', 'failure_risk', 'alcohol_risk', 'social_risk']
2026-06-12 19:58:13,816 - preprocessing - INFO - Student engineered features created: ['grade_growth', 'grade_avg', 'absence_study_ratio', 'failure_risk', 'alcohol_risk', 'social_risk']
2026-06-12 19:58:13,868 - preprocessing - INFO - Applying ADASYN on train set with ratio 0.5036391267961835...
2026-06-12 19:58:14,087 - preprocessing - INFO - Feature selection complete. Selected 32 / 38 features.
2026-06-12 19:58:16,048 - train_pipeline - INFO - Early stopping triggered at epoch 23
[I 2026-06-12 19:58:16,050] Trial 41 finished with value: 0.8596403497257104 and parameters: {'learning_rate': 0.007581005827154085, 'weight_decay': 0.0005520954642907937, 'batch_size': 64, 'oversample_method': 'adasyn', 'smote_ratio': 0.5036391267961835, 'cnn_channels': 32, 'lstm_hidden_dim': 64, 'context_hidden_dim': 64, 'fusion_hidden_dim': 32, 'dropout': 0.13110505595856647}. Best is trial 21 with value: 0.8897981256933332.
2026-06-12 19:58:16,064 - preprocessing - INFO - Student engineered features created: ['grade_growth', 'grade_avg', 'absence_study_ratio', 'failure_risk', 'alcohol_risk', 'social_risk']
2026-06-12 19:58:16,066 - preprocessing - INFO - Student engineered features created: ['grade_growth', 'grade_avg', 'absence_study_ratio', 'failure_risk', 'alcohol_risk', 'social_risk']
2026-06-12 19:58:16,111 - preprocessing - INFO - Applying ADASYN on train set with ratio 0.4939740124572039...
2026-06-12 19:58:16,327 - preprocessing - INFO - Feature selection complete. Selected 31 / 38 features.
2026-06-12 19:58:18,683 - train_pipeline - INFO - Early stopping triggered at epoch 28
2026-06-12 19:58:18,692 - preprocessing - INFO - Student engineered features created: ['grade_growth', 'grade_avg', 'absence_study_ratio', 'failure_risk', 'alcohol_risk', 'social_risk']
2026-06-12 19:58:18,696 - preprocessing - INFO - Student engineered features created: ['grade_growth', 'grade_avg', 'absence_study_ratio', 'failure_risk', 'alcohol_risk', 'social_risk']
2026-06-12 19:58:18,746 - preprocessing - INFO - Applying ADASYN on train set with ratio 0.4939740124572039...
2026-06-12 19:58:18,962 - preprocessing - INFO - Feature selection complete. Selected 32 / 38 features.
2026-06-12 19:58:20,767 - train_pipeline - INFO - Early stopping triggered at epoch 21
2026-06-12 19:58:20,769 - preprocessing - INFO - Student engineered features created: ['grade_growth', 'grade_avg', 'absence_study_ratio', 'failure_risk', 'alcohol_risk', 'social_risk']
2026-06-12 19:58:20,771 - preprocessing - INFO - Student engineered features created: ['grade_growth', 'grade_avg', 'absence_study_ratio', 'failure_risk', 'alcohol_risk', 'social_risk']
2026-06-12 19:58:20,819 - preprocessing - INFO - Applying ADASYN on train set with ratio 0.4939740124572039...
2026-06-12 19:58:21,053 - preprocessing - INFO - Feature selection complete. Selected 30 / 38 features.
2026-06-12 19:58:22,655 - train_pipeline - INFO - Early stopping triggered at epoch 19
2026-06-12 19:58:22,669 - preprocessing - INFO - Student engineered features created: ['grade_growth', 'grade_avg', 'absence_study_ratio', 'failure_risk', 'alcohol_risk', 'social_risk']
2026-06-12 19:58:22,673 - preprocessing - INFO - Student engineered features created: ['grade_growth', 'grade_avg', 'absence_study_ratio', 'failure_risk', 'alcohol_risk', 'social_risk']
2026-06-12 19:58:22,721 - preprocessing - INFO - Applying ADASYN on train set with ratio 0.4939740124572039...
2026-06-12 19:58:22,938 - preprocessing - INFO - Feature selection complete. Selected 34 / 38 features.
2026-06-12 19:58:24,547 - train_pipeline - INFO - Early stopping triggered at epoch 19
2026-06-12 19:58:24,550 - preprocessing - INFO - Student engineered features created: ['grade_growth', 'grade_avg', 'absence_study_ratio', 'failure_risk', 'alcohol_risk', 'social_risk']
2026-06-12 19:58:24,554 - preprocessing - INFO - Student engineered features created: ['grade_growth', 'grade_avg', 'absence_study_ratio', 'failure_risk', 'alcohol_risk', 'social_risk']
2026-06-12 19:58:24,603 - preprocessing - INFO - Applying ADASYN on train set with ratio 0.4939740124572039...
2026-06-12 19:58:24,830 - preprocessing - INFO - Feature selection complete. Selected 32 / 38 features.
2026-06-12 19:58:27,535 - train_pipeline - INFO - Early stopping triggered at epoch 32
[I 2026-06-12 19:58:27,535] Trial 42 finished with value: 0.8550195828018856 and parameters: {'learning_rate': 0.005067089232022303, 'weight_decay': 0.0007873154676424355, 'batch_size': 64, 'oversample_method': 'adasyn', 'smote_ratio': 0.4939740124572039, 'cnn_channels': 32, 'lstm_hidden_dim': 64, 'context_hidden_dim': 64, 'fusion_hidden_dim': 32, 'dropout': 0.15790686423140998}. Best is trial 21 with value: 0.8897981256933332.
2026-06-12 19:58:27,553 - preprocessing - INFO - Student engineered features created: ['grade_growth', 'grade_avg', 'absence_study_ratio', 'failure_risk', 'alcohol_risk', 'social_risk']
2026-06-12 19:58:27,556 - preprocessing - INFO - Student engineered features created: ['grade_growth', 'grade_avg', 'absence_study_ratio', 'failure_risk', 'alcohol_risk', 'social_risk']
2026-06-12 19:58:27,603 - preprocessing - INFO - Applying ADASYN on train set with ratio 0.41875545855104307...
2026-06-12 19:58:27,618 - preprocessing - WARNING - ADASYN failed (likely too few samples). Error: No samples will be generated with the provided ratio settings.. Falling back to no oversampling.
2026-06-12 19:58:27,829 - preprocessing - INFO - Feature selection complete. Selected 28 / 38 features.
2026-06-12 19:58:30,428 - train_pipeline - INFO - Early stopping triggered at epoch 40
2026-06-12 19:58:30,435 - preprocessing - INFO - Student engineered features created: ['grade_growth', 'grade_avg', 'absence_study_ratio', 'failure_risk', 'alcohol_risk', 'social_risk']
2026-06-12 19:58:30,439 - preprocessing - INFO - Student engineered features created: ['grade_growth', 'grade_avg', 'absence_study_ratio', 'failure_risk', 'alcohol_risk', 'social_risk']
2026-06-12 19:58:30,476 - preprocessing - INFO - Applying ADASYN on train set with ratio 0.41875545855104307...
2026-06-12 19:58:30,496 - preprocessing - WARNING - ADASYN failed (likely too few samples). Error: No samples will be generated with the provided ratio settings.. Falling back to no oversampling.
2026-06-12 19:58:30,707 - preprocessing - INFO - Feature selection complete. Selected 28 / 38 features.
2026-06-12 19:58:32,918 - train_pipeline - INFO - Early stopping triggered at epoch 34
2026-06-12 19:58:32,925 - preprocessing - INFO - Student engineered features created: ['grade_growth', 'grade_avg', 'absence_study_ratio', 'failure_risk', 'alcohol_risk', 'social_risk']
2026-06-12 19:58:32,925 - preprocessing - INFO - Student engineered features created: ['grade_growth', 'grade_avg', 'absence_study_ratio', 'failure_risk', 'alcohol_risk', 'social_risk']
2026-06-12 19:58:32,974 - preprocessing - INFO - Applying ADASYN on train set with ratio 0.41875545855104307...
2026-06-12 19:58:32,995 - preprocessing - WARNING - ADASYN failed (likely too few samples). Error: No samples will be generated with the provided ratio settings.. Falling back to no oversampling.
2026-06-12 19:58:33,190 - preprocessing - INFO - Feature selection complete. Selected 25 / 38 features.
2026-06-12 19:58:34,716 - train_pipeline - INFO - Early stopping triggered at epoch 23
2026-06-12 19:58:34,717 - preprocessing - INFO - Student engineered features created: ['grade_growth', 'grade_avg', 'absence_study_ratio', 'failure_risk', 'alcohol_risk', 'social_risk']
2026-06-12 19:58:34,722 - preprocessing - INFO - Student engineered features created: ['grade_growth', 'grade_avg', 'absence_study_ratio', 'failure_risk', 'alcohol_risk', 'social_risk']
2026-06-12 19:58:34,766 - preprocessing - INFO - Applying ADASYN on train set with ratio 0.41875545855104307...
2026-06-12 19:58:34,778 - preprocessing - WARNING - ADASYN failed (likely too few samples). Error: No samples will be generated with the provided ratio settings.. Falling back to no oversampling.
2026-06-12 19:58:34,965 - preprocessing - INFO - Feature selection complete. Selected 25 / 38 features.
2026-06-12 19:58:36,960 - train_pipeline - INFO - Early stopping triggered at epoch 31
2026-06-12 19:58:36,964 - preprocessing - INFO - Student engineered features created: ['grade_growth', 'grade_avg', 'absence_study_ratio', 'failure_risk', 'alcohol_risk', 'social_risk']
2026-06-12 19:58:36,966 - preprocessing - INFO - Student engineered features created: ['grade_growth', 'grade_avg', 'absence_study_ratio', 'failure_risk', 'alcohol_risk', 'social_risk']
2026-06-12 19:58:37,019 - preprocessing - INFO - Applying ADASYN on train set with ratio 0.41875545855104307...
2026-06-12 19:58:37,229 - preprocessing - INFO - Feature selection complete. Selected 30 / 38 features.
[I 2026-06-12 19:58:40,968] Trial 43 finished with value: 0.8729117198641673 and parameters: {'learning_rate': 0.00402505032840128, 'weight_decay': 0.00046552061892428143, 'batch_size': 64, 'oversample_method': 'adasyn', 'smote_ratio': 0.41875545855104307, 'cnn_channels': 32, 'lstm_hidden_dim': 64, 'context_hidden_dim': 64, 'fusion_hidden_dim': 32, 'dropout': 0.12440663201383978}. Best is trial 21 with value: 0.8897981256933332.
2026-06-12 19:58:40,987 - preprocessing - INFO - Student engineered features created: ['grade_growth', 'grade_avg', 'absence_study_ratio', 'failure_risk', 'alcohol_risk', 'social_risk']
2026-06-12 19:58:40,992 - preprocessing - INFO - Student engineered features created: ['grade_growth', 'grade_avg', 'absence_study_ratio', 'failure_risk', 'alcohol_risk', 'social_risk']
2026-06-12 19:58:41,035 - preprocessing - INFO - Applying SMOTE on train set with ratio 0.519926682379124...
2026-06-12 19:58:41,247 - preprocessing - INFO - Feature selection complete. Selected 31 / 38 features.
2026-06-12 19:58:43,422 - train_pipeline - INFO - Early stopping triggered at epoch 26
2026-06-12 19:58:43,422 - preprocessing - INFO - Student engineered features created: ['grade_growth', 'grade_avg', 'absence_study_ratio', 'failure_risk', 'alcohol_risk', 'social_risk']
2026-06-12 19:58:43,431 - preprocessing - INFO - Student engineered features created: ['grade_growth', 'grade_avg', 'absence_study_ratio', 'failure_risk', 'alcohol_risk', 'social_risk']
2026-06-12 19:58:43,472 - preprocessing - INFO - Applying SMOTE on train set with ratio 0.519926682379124...
2026-06-12 19:58:43,695 - preprocessing - INFO - Feature selection complete. Selected 33 / 38 features.
2026-06-12 19:58:45,311 - train_pipeline - INFO - Early stopping triggered at epoch 19
2026-06-12 19:58:45,326 - preprocessing - INFO - Student engineered features created: ['grade_growth', 'grade_avg', 'absence_study_ratio', 'failure_risk', 'alcohol_risk', 'social_risk']
2026-06-12 19:58:45,327 - preprocessing - INFO - Student engineered features created: ['grade_growth', 'grade_avg', 'absence_study_ratio', 'failure_risk', 'alcohol_risk', 'social_risk']
2026-06-12 19:58:45,366 - preprocessing - INFO - Applying SMOTE on train set with ratio 0.519926682379124...
2026-06-12 19:58:45,582 - preprocessing - INFO - Feature selection complete. Selected 32 / 38 features.
2026-06-12 19:58:47,585 - train_pipeline - INFO - Early stopping triggered at epoch 23
2026-06-12 19:58:47,587 - preprocessing - INFO - Student engineered features created: ['grade_growth', 'grade_avg', 'absence_study_ratio', 'failure_risk', 'alcohol_risk', 'social_risk']
2026-06-12 19:58:47,591 - preprocessing - INFO - Student engineered features created: ['grade_growth', 'grade_avg', 'absence_study_ratio', 'failure_risk', 'alcohol_risk', 'social_risk']
2026-06-12 19:58:47,643 - preprocessing - INFO - Applying SMOTE on train set with ratio 0.519926682379124...
2026-06-12 19:58:47,848 - preprocessing - INFO - Feature selection complete. Selected 35 / 38 features.
2026-06-12 19:58:52,047 - train_pipeline - INFO - Early stopping triggered at epoch 49
2026-06-12 19:58:52,047 - preprocessing - INFO - Student engineered features created: ['grade_growth', 'grade_avg', 'absence_study_ratio', 'failure_risk', 'alcohol_risk', 'social_risk']
2026-06-12 19:58:52,047 - preprocessing - INFO - Student engineered features created: ['grade_growth', 'grade_avg', 'absence_study_ratio', 'failure_risk', 'alcohol_risk', 'social_risk']
2026-06-12 19:58:52,111 - preprocessing - INFO - Applying SMOTE on train set with ratio 0.519926682379124...
2026-06-12 19:58:52,322 - preprocessing - INFO - Feature selection complete. Selected 31 / 38 features.
