[I 2026-06-12 20:27:04,976] Trial 27 finished with value: 0.795072073898232 and parameters: {'learning_rate': 0.0074105835270485134, 'weight_decay': 0.00010895993987722368, 'batch_size': 16, 'oversample_method': 'adasyn', 'smote_ratio': 0.6483251471068744, 'cnn_channels': 16, 'lstm_hidden_dim': 64, 'context_hidden_dim': 128, 'fusion_hidden_dim': 128, 'dropout': 0.24097246979684586}. Best is trial 23 with value: 0.8021730167770063.
2026-06-12 20:27:04,992 - preprocessing - INFO - xAPI engineered features created: ['engagement_score', 'absence_risk', 'parent_support_signal']
2026-06-12 20:27:04,993 - preprocessing - INFO - xAPI engineered features created: ['engagement_score', 'absence_risk', 'parent_support_signal']
2026-06-12 20:27:05,012 - preprocessing - INFO - Applying ADASYN on train set with ratio 0.8209275619447...
2026-06-12 20:27:05,025 - preprocessing - WARNING - ADASYN failed (likely too few samples). Error: No samples will be generated with the provided ratio settings.. Falling back to no oversampling.
2026-06-12 20:27:05,161 - preprocessing - INFO - Feature selection complete. Selected 15 / 19 features.
2026-06-12 20:27:06,678 - train_pipeline - INFO - Early stopping triggered at epoch 18
2026-06-12 20:27:06,692 - preprocessing - INFO - xAPI engineered features created: ['engagement_score', 'absence_risk', 'parent_support_signal']
2026-06-12 20:27:06,694 - preprocessing - INFO - xAPI engineered features created: ['engagement_score', 'absence_risk', 'parent_support_signal']
2026-06-12 20:27:06,717 - preprocessing - INFO - Applying ADASYN on train set with ratio 0.8209275619447...
2026-06-12 20:27:06,724 - preprocessing - WARNING - ADASYN failed (likely too few samples). Error: No samples will be generated with the provided ratio settings.. Falling back to no oversampling.
2026-06-12 20:27:06,856 - preprocessing - INFO - Feature selection complete. Selected 16 / 19 features.
2026-06-12 20:27:08,627 - train_pipeline - INFO - Early stopping triggered at epoch 21
2026-06-12 20:27:08,639 - preprocessing - INFO - xAPI engineered features created: ['engagement_score', 'absence_risk', 'parent_support_signal']
2026-06-12 20:27:08,639 - preprocessing - INFO - xAPI engineered features created: ['engagement_score', 'absence_risk', 'parent_support_signal']
2026-06-12 20:27:08,660 - preprocessing - INFO - Applying ADASYN on train set with ratio 0.8209275619447...
2026-06-12 20:27:08,676 - preprocessing - WARNING - ADASYN failed (likely too few samples). Error: No samples will be generated with the provided ratio settings.. Falling back to no oversampling.
2026-06-12 20:27:08,815 - preprocessing - INFO - Feature selection complete. Selected 18 / 19 features.
2026-06-12 20:27:10,720 - train_pipeline - INFO - Early stopping triggered at epoch 22
2026-06-12 20:27:10,720 - preprocessing - INFO - xAPI engineered features created: ['engagement_score', 'absence_risk', 'parent_support_signal']
2026-06-12 20:27:10,727 - preprocessing - INFO - xAPI engineered features created: ['engagement_score', 'absence_risk', 'parent_support_signal']
2026-06-12 20:27:10,741 - preprocessing - INFO - Applying ADASYN on train set with ratio 0.8209275619447...
2026-06-12 20:27:10,748 - preprocessing - WARNING - ADASYN failed (likely too few samples). Error: No samples will be generated with the provided ratio settings.. Falling back to no oversampling.
2026-06-12 20:27:10,887 - preprocessing - INFO - Feature selection complete. Selected 16 / 19 features.
2026-06-12 20:27:13,808 - train_pipeline - INFO - Early stopping triggered at epoch 35
2026-06-12 20:27:13,808 - preprocessing - INFO - xAPI engineered features created: ['engagement_score', 'absence_risk', 'parent_support_signal']
2026-06-12 20:27:13,808 - preprocessing - INFO - xAPI engineered features created: ['engagement_score', 'absence_risk', 'parent_support_signal']
2026-06-12 20:27:13,835 - preprocessing - INFO - Applying ADASYN on train set with ratio 0.8209275619447...
2026-06-12 20:27:13,849 - preprocessing - WARNING - ADASYN failed (likely too few samples). Error: No samples will be generated with the provided ratio settings.. Falling back to no oversampling.
2026-06-12 20:27:13,982 - preprocessing - INFO - Feature selection complete. Selected 18 / 19 features.
2026-06-12 20:27:16,543 - train_pipeline - INFO - Early stopping triggered at epoch 30
[I 2026-06-12 20:27:16,543] Trial 28 finished with value: 0.7665070045263394 and parameters: {'learning_rate': 0.002976908854931572, 'weight_decay': 0.0003853456198558572, 'batch_size': 32, 'oversample_method': 'adasyn', 'smote_ratio': 0.8209275619447, 'cnn_channels': 16, 'lstm_hidden_dim': 64, 'context_hidden_dim': 32, 'fusion_hidden_dim': 64, 'dropout': 0.28372978885452904}. Best is trial 23 with value: 0.8021730167770063.
2026-06-12 20:27:16,555 - preprocessing - INFO - xAPI engineered features created: ['engagement_score', 'absence_risk', 'parent_support_signal']
2026-06-12 20:27:16,567 - preprocessing - INFO - xAPI engineered features created: ['engagement_score', 'absence_risk', 'parent_support_signal']
2026-06-12 20:27:16,585 - preprocessing - INFO - Applying ADASYN on train set with ratio 0.9924298816251353...
2026-06-12 20:27:16,735 - preprocessing - INFO - Feature selection complete. Selected 18 / 19 features.
2026-06-12 20:27:20,296 - preprocessing - INFO - xAPI engineered features created: ['engagement_score', 'absence_risk', 'parent_support_signal']
2026-06-12 20:27:20,296 - preprocessing - INFO - xAPI engineered features created: ['engagement_score', 'absence_risk', 'parent_support_signal']
2026-06-12 20:27:20,317 - preprocessing - INFO - Applying ADASYN on train set with ratio 0.9924298816251353...
2026-06-12 20:27:20,460 - preprocessing - INFO - Feature selection complete. Selected 17 / 19 features.
2026-06-12 20:27:22,750 - train_pipeline - INFO - Early stopping triggered at epoch 33
2026-06-12 20:27:22,750 - preprocessing - INFO - xAPI engineered features created: ['engagement_score', 'absence_risk', 'parent_support_signal']
2026-06-12 20:27:22,750 - preprocessing - INFO - xAPI engineered features created: ['engagement_score', 'absence_risk', 'parent_support_signal']
2026-06-12 20:27:22,778 - preprocessing - INFO - Applying ADASYN on train set with ratio 0.9924298816251353...
2026-06-12 20:27:22,916 - preprocessing - INFO - Feature selection complete. Selected 18 / 19 features.
2026-06-12 20:27:24,562 - train_pipeline - INFO - Early stopping triggered at epoch 23
2026-06-12 20:27:24,567 - preprocessing - INFO - xAPI engineered features created: ['engagement_score', 'absence_risk', 'parent_support_signal']
2026-06-12 20:27:24,567 - preprocessing - INFO - xAPI engineered features created: ['engagement_score', 'absence_risk', 'parent_support_signal']
2026-06-12 20:27:24,588 - preprocessing - INFO - Applying ADASYN on train set with ratio 0.9924298816251353...
2026-06-12 20:27:24,741 - preprocessing - INFO - Feature selection complete. Selected 18 / 19 features.
2026-06-12 20:27:26,357 - train_pipeline - INFO - Early stopping triggered at epoch 23
2026-06-12 20:27:26,357 - preprocessing - INFO - xAPI engineered features created: ['engagement_score', 'absence_risk', 'parent_support_signal']
2026-06-12 20:27:26,371 - preprocessing - INFO - xAPI engineered features created: ['engagement_score', 'absence_risk', 'parent_support_signal']
2026-06-12 20:27:26,390 - preprocessing - INFO - Applying ADASYN on train set with ratio 0.9924298816251353...
2026-06-12 20:27:26,546 - preprocessing - INFO - Feature selection complete. Selected 18 / 19 features.
[I 2026-06-12 20:27:30,107] Trial 29 finished with value: 0.49941848197875205 and parameters: {'learning_rate': 0.0001636867575236071, 'weight_decay': 1.4384673477044325e-06, 'batch_size': 64, 'oversample_method': 'adasyn', 'smote_ratio': 0.9924298816251353, 'cnn_channels': 16, 'lstm_hidden_dim': 64, 'context_hidden_dim': 64, 'fusion_hidden_dim': 64, 'dropout': 0.3466590110008502}. Best is trial 23 with value: 0.8021730167770063.
2026-06-12 20:27:30,111 - preprocessing - INFO - xAPI engineered features created: ['engagement_score', 'absence_risk', 'parent_support_signal']
2026-06-12 20:27:30,111 - preprocessing - INFO - xAPI engineered features created: ['engagement_score', 'absence_risk', 'parent_support_signal']
2026-06-12 20:27:30,137 - preprocessing - INFO - Applying ADASYN on train set with ratio 0.7466212716061413...
2026-06-12 20:27:30,152 - preprocessing - WARNING - ADASYN failed (likely too few samples). Error: No samples will be generated with the provided ratio settings.. Falling back to no oversampling.
2026-06-12 20:27:30,291 - preprocessing - INFO - Feature selection complete. Selected 15 / 19 features.
2026-06-12 20:27:31,842 - train_pipeline - INFO - Early stopping triggered at epoch 31
2026-06-12 20:27:31,842 - preprocessing - INFO - xAPI engineered features created: ['engagement_score', 'absence_risk', 'parent_support_signal']
2026-06-12 20:27:31,842 - preprocessing - INFO - xAPI engineered features created: ['engagement_score', 'absence_risk', 'parent_support_signal']
2026-06-12 20:27:31,858 - preprocessing - INFO - Applying ADASYN on train set with ratio 0.7466212716061413...
2026-06-12 20:27:31,880 - preprocessing - WARNING - ADASYN failed (likely too few samples). Error: No samples will be generated with the provided ratio settings.. Falling back to no oversampling.
2026-06-12 20:27:32,012 - preprocessing - INFO - Feature selection complete. Selected 16 / 19 features.
2026-06-12 20:27:33,059 - train_pipeline - INFO - Early stopping triggered at epoch 20
2026-06-12 20:27:33,070 - preprocessing - INFO - xAPI engineered features created: ['engagement_score', 'absence_risk', 'parent_support_signal']
2026-06-12 20:27:33,074 - preprocessing - INFO - xAPI engineered features created: ['engagement_score', 'absence_risk', 'parent_support_signal']
2026-06-12 20:27:33,096 - preprocessing - INFO - Applying ADASYN on train set with ratio 0.7466212716061413...
2026-06-12 20:27:33,108 - preprocessing - WARNING - ADASYN failed (likely too few samples). Error: No samples will be generated with the provided ratio settings.. Falling back to no oversampling.
2026-06-12 20:27:33,268 - preprocessing - INFO - Feature selection complete. Selected 18 / 19 features.
2026-06-12 20:27:34,273 - train_pipeline - INFO - Early stopping triggered at epoch 20
2026-06-12 20:27:34,280 - preprocessing - INFO - xAPI engineered features created: ['engagement_score', 'absence_risk', 'parent_support_signal']
2026-06-12 20:27:34,280 - preprocessing - INFO - xAPI engineered features created: ['engagement_score', 'absence_risk', 'parent_support_signal']
2026-06-12 20:27:34,301 - preprocessing - INFO - Applying ADASYN on train set with ratio 0.7466212716061413...
2026-06-12 20:27:34,317 - preprocessing - WARNING - ADASYN failed (likely too few samples). Error: No samples will be generated with the provided ratio settings.. Falling back to no oversampling.
2026-06-12 20:27:34,442 - preprocessing - INFO - Feature selection complete. Selected 16 / 19 features.
2026-06-12 20:27:36,958 - preprocessing - INFO - xAPI engineered features created: ['engagement_score', 'absence_risk', 'parent_support_signal']
2026-06-12 20:27:36,958 - preprocessing - INFO - xAPI engineered features created: ['engagement_score', 'absence_risk', 'parent_support_signal']
2026-06-12 20:27:36,979 - preprocessing - INFO - Applying ADASYN on train set with ratio 0.7466212716061413...
2026-06-12 20:27:36,995 - preprocessing - WARNING - ADASYN failed (likely too few samples). Error: No samples will be generated with the provided ratio settings.. Falling back to no oversampling.
2026-06-12 20:27:37,131 - preprocessing - INFO - Feature selection complete. Selected 18 / 19 features.
2026-06-12 20:27:38,082 - train_pipeline - INFO - Early stopping triggered at epoch 19
[I 2026-06-12 20:27:38,082] Trial 30 finished with value: 0.7370269722911378 and parameters: {'learning_rate': 0.0007918976847097945, 'weight_decay': 6.082121470084032e-05, 'batch_size': 64, 'oversample_method': 'adasyn', 'smote_ratio': 0.7466212716061413, 'cnn_channels': 16, 'lstm_hidden_dim': 64, 'context_hidden_dim': 64, 'fusion_hidden_dim': 64, 'dropout': 0.33149763103417973}. Best is trial 23 with value: 0.8021730167770063.
2026-06-12 20:27:38,095 - preprocessing - INFO - xAPI engineered features created: ['engagement_score', 'absence_risk', 'parent_support_signal']
2026-06-12 20:27:38,095 - preprocessing - INFO - xAPI engineered features created: ['engagement_score', 'absence_risk', 'parent_support_signal']
2026-06-12 20:27:38,116 - preprocessing - INFO - Applying ADASYN on train set with ratio 0.6515762848617336...
2026-06-12 20:27:38,125 - preprocessing - WARNING - ADASYN failed (likely too few samples). Error: No samples will be generated with the provided ratio settings.. Falling back to no oversampling.
2026-06-12 20:27:38,255 - preprocessing - INFO - Feature selection complete. Selected 15 / 19 features.
2026-06-12 20:27:41,509 - train_pipeline - INFO - Early stopping triggered at epoch 21
2026-06-12 20:27:41,525 - preprocessing - INFO - xAPI engineered features created: ['engagement_score', 'absence_risk', 'parent_support_signal']
2026-06-12 20:27:41,525 - preprocessing - INFO - xAPI engineered features created: ['engagement_score', 'absence_risk', 'parent_support_signal']
2026-06-12 20:27:41,543 - preprocessing - INFO - Applying ADASYN on train set with ratio 0.6515762848617336...
2026-06-12 20:27:41,549 - preprocessing - WARNING - ADASYN failed (likely too few samples). Error: No samples will be generated with the provided ratio settings.. Falling back to no oversampling.
2026-06-12 20:27:41,689 - preprocessing - INFO - Feature selection complete. Selected 16 / 19 features.
2026-06-12 20:27:46,393 - train_pipeline - INFO - Early stopping triggered at epoch 30
2026-06-12 20:27:46,393 - preprocessing - INFO - xAPI engineered features created: ['engagement_score', 'absence_risk', 'parent_support_signal']
2026-06-12 20:27:46,393 - preprocessing - INFO - xAPI engineered features created: ['engagement_score', 'absence_risk', 'parent_support_signal']
2026-06-12 20:27:46,414 - preprocessing - INFO - Applying ADASYN on train set with ratio 0.6515762848617336...
2026-06-12 20:27:46,421 - preprocessing - WARNING - ADASYN failed (likely too few samples). Error: No samples will be generated with the provided ratio settings.. Falling back to no oversampling.
2026-06-12 20:27:46,553 - preprocessing - INFO - Feature selection complete. Selected 18 / 19 features.
2026-06-12 20:27:49,591 - train_pipeline - INFO - Early stopping triggered at epoch 19
2026-06-12 20:27:49,591 - preprocessing - INFO - xAPI engineered features created: ['engagement_score', 'absence_risk', 'parent_support_signal']
2026-06-12 20:27:49,605 - preprocessing - INFO - xAPI engineered features created: ['engagement_score', 'absence_risk', 'parent_support_signal']
2026-06-12 20:27:49,619 - preprocessing - INFO - Applying ADASYN on train set with ratio 0.6515762848617336...
2026-06-12 20:27:49,626 - preprocessing - WARNING - ADASYN failed (likely too few samples). Error: No samples will be generated with the provided ratio settings.. Falling back to no oversampling.
2026-06-12 20:27:49,761 - preprocessing - INFO - Feature selection complete. Selected 16 / 19 features.
2026-06-12 20:27:56,175 - train_pipeline - INFO - Early stopping triggered at epoch 41
2026-06-12 20:27:56,189 - preprocessing - INFO - xAPI engineered features created: ['engagement_score', 'absence_risk', 'parent_support_signal']
2026-06-12 20:27:56,189 - preprocessing - INFO - xAPI engineered features created: ['engagement_score', 'absence_risk', 'parent_support_signal']
2026-06-12 20:27:56,204 - preprocessing - INFO - Applying ADASYN on train set with ratio 0.6515762848617336...
2026-06-12 20:27:56,219 - preprocessing - WARNING - ADASYN failed (likely too few samples). Error: No samples will be generated with the provided ratio settings.. Falling back to no oversampling.
2026-06-12 20:27:56,357 - preprocessing - INFO - Feature selection complete. Selected 18 / 19 features.
2026-06-12 20:28:03,119 - train_pipeline - INFO - Early stopping triggered at epoch 42
[I 2026-06-12 20:28:03,119] Trial 31 finished with value: 0.790133246051339 and parameters: {'learning_rate': 0.007383315223839317, 'weight_decay': 0.00012146000322027091, 'batch_size': 16, 'oversample_method': 'adasyn', 'smote_ratio': 0.6515762848617336, 'cnn_channels': 16, 'lstm_hidden_dim': 64, 'context_hidden_dim': 128, 'fusion_hidden_dim': 128, 'dropout': 0.24537179111350096}. Best is trial 23 with value: 0.8021730167770063.
2026-06-12 20:28:03,133 - preprocessing - INFO - xAPI engineered features created: ['engagement_score', 'absence_risk', 'parent_support_signal']
2026-06-12 20:28:03,133 - preprocessing - INFO - xAPI engineered features created: ['engagement_score', 'absence_risk', 'parent_support_signal']
2026-06-12 20:28:03,154 - preprocessing - INFO - Applying ADASYN on train set with ratio 0.6376947001589927...
2026-06-12 20:28:03,161 - preprocessing - WARNING - ADASYN failed (likely too few samples). Error: No samples will be generated with the provided ratio settings.. Falling back to no oversampling.
2026-06-12 20:28:03,292 - preprocessing - INFO - Feature selection complete. Selected 15 / 19 features.
2026-06-12 20:28:08,593 - train_pipeline - INFO - Early stopping triggered at epoch 34
2026-06-12 20:28:08,600 - preprocessing - INFO - xAPI engineered features created: ['engagement_score', 'absence_risk', 'parent_support_signal']
2026-06-12 20:28:08,600 - preprocessing - INFO - xAPI engineered features created: ['engagement_score', 'absence_risk', 'parent_support_signal']
2026-06-12 20:28:08,620 - preprocessing - INFO - Applying ADASYN on train set with ratio 0.6376947001589927...
2026-06-12 20:28:08,627 - preprocessing - WARNING - ADASYN failed (likely too few samples). Error: No samples will be generated with the provided ratio settings.. Falling back to no oversampling.
2026-06-12 20:28:08,768 - preprocessing - INFO - Feature selection complete. Selected 16 / 19 features.
2026-06-12 20:28:15,655 - train_pipeline - INFO - Early stopping triggered at epoch 44
2026-06-12 20:28:15,655 - preprocessing - INFO - xAPI engineered features created: ['engagement_score', 'absence_risk', 'parent_support_signal']
2026-06-12 20:28:15,662 - preprocessing - INFO - xAPI engineered features created: ['engagement_score', 'absence_risk', 'parent_support_signal']
2026-06-12 20:28:15,679 - preprocessing - INFO - Applying ADASYN on train set with ratio 0.6376947001589927...
2026-06-12 20:28:15,684 - preprocessing - WARNING - ADASYN failed (likely too few samples). Error: No samples will be generated with the provided ratio settings.. Falling back to no oversampling.
2026-06-12 20:28:15,815 - preprocessing - INFO - Feature selection complete. Selected 18 / 19 features.
2026-06-12 20:28:19,311 - train_pipeline - INFO - Early stopping triggered at epoch 22
2026-06-12 20:28:19,311 - preprocessing - INFO - xAPI engineered features created: ['engagement_score', 'absence_risk', 'parent_support_signal']
2026-06-12 20:28:19,311 - preprocessing - INFO - xAPI engineered features created: ['engagement_score', 'absence_risk', 'parent_support_signal']
2026-06-12 20:28:19,332 - preprocessing - INFO - Applying ADASYN on train set with ratio 0.6376947001589927...
2026-06-12 20:28:19,346 - preprocessing - WARNING - ADASYN failed (likely too few samples). Error: No samples will be generated with the provided ratio settings.. Falling back to no oversampling.
2026-06-12 20:28:19,484 - preprocessing - INFO - Feature selection complete. Selected 16 / 19 features.
2026-06-12 20:28:23,911 - train_pipeline - INFO - Early stopping triggered at epoch 28
2026-06-12 20:28:23,911 - preprocessing - INFO - xAPI engineered features created: ['engagement_score', 'absence_risk', 'parent_support_signal']
2026-06-12 20:28:23,911 - preprocessing - INFO - xAPI engineered features created: ['engagement_score', 'absence_risk', 'parent_support_signal']
2026-06-12 20:28:23,940 - preprocessing - INFO - Applying ADASYN on train set with ratio 0.6376947001589927...
2026-06-12 20:28:23,950 - preprocessing - WARNING - ADASYN failed (likely too few samples). Error: No samples will be generated with the provided ratio settings.. Falling back to no oversampling.
2026-06-12 20:28:24,084 - preprocessing - INFO - Feature selection complete. Selected 18 / 19 features.
2026-06-12 20:28:29,308 - train_pipeline - INFO - Early stopping triggered at epoch 33
