[I 2026-06-13 00:52:23,392] Trial 53 finished with value: 0.8006114964869614 and parameters: {'learning_rate': 0.001869339235477852, 'weight_decay': 0.006012900096675788, 'batch_size': 32, 'oversample_method': 'adasyn', 'smote_ratio': 0.7650579380592368, 'resampling_k_neighbors': 2, 'cnn_channels': 16, 'cnn_kernel_size': 3, 'lstm_hidden_dim': 64, 'context_hidden_dim': 256, 'fusion_hidden_dim': 128, 'sequence_dropout': 0.272286885530696, 'context_dropout': 0.18091879396024085, 'fusion_dropout': 0.13218281110671}. Best is trial 17 with value: 0.8075693134180814.
2026-06-13 00:52:23,507 - preprocessing - INFO - xAPI engineered features created: ['engagement_score', 'absence_risk', 'parent_support_signal']
2026-06-13 00:52:23,509 - preprocessing - INFO - xAPI engineered features created: ['engagement_score', 'absence_risk', 'parent_support_signal']
2026-06-13 00:52:23,526 - preprocessing - INFO - Applying ADASYN on train set with ratio 0.4548169346546087...
2026-06-13 00:52:23,643 - preprocessing - INFO - Feature selection complete. Selected 15 / 19 features.
2026-06-13 00:52:27,414 - train_pipeline - INFO - Early stopping triggered at epoch 49
2026-06-13 00:52:27,437 - preprocessing - INFO - xAPI engineered features created: ['engagement_score', 'absence_risk', 'parent_support_signal']
2026-06-13 00:52:27,439 - preprocessing - INFO - xAPI engineered features created: ['engagement_score', 'absence_risk', 'parent_support_signal']
2026-06-13 00:52:27,462 - preprocessing - INFO - Applying ADASYN on train set with ratio 0.4548169346546087...
2026-06-13 00:52:27,627 - preprocessing - INFO - Feature selection complete. Selected 16 / 19 features.
2026-06-13 00:52:31,112 - train_pipeline - INFO - Early stopping triggered at epoch 45
2026-06-13 00:52:31,138 - preprocessing - INFO - xAPI engineered features created: ['engagement_score', 'absence_risk', 'parent_support_signal']
2026-06-13 00:52:31,143 - preprocessing - INFO - xAPI engineered features created: ['engagement_score', 'absence_risk', 'parent_support_signal']
2026-06-13 00:52:31,175 - preprocessing - INFO - Applying ADASYN on train set with ratio 0.4548169346546087...
2026-06-13 00:52:31,344 - preprocessing - INFO - Feature selection complete. Selected 18 / 19 features.
2026-06-13 00:52:34,917 - train_pipeline - INFO - Early stopping triggered at epoch 45
2026-06-13 00:52:34,943 - preprocessing - INFO - xAPI engineered features created: ['engagement_score', 'absence_risk', 'parent_support_signal']
2026-06-13 00:52:34,947 - preprocessing - INFO - xAPI engineered features created: ['engagement_score', 'absence_risk', 'parent_support_signal']
2026-06-13 00:52:34,980 - preprocessing - INFO - Applying ADASYN on train set with ratio 0.4548169346546087...
2026-06-13 00:52:35,157 - preprocessing - INFO - Feature selection complete. Selected 16 / 19 features.
2026-06-13 00:52:41,337 - train_pipeline - INFO - Early stopping triggered at epoch 76
2026-06-13 00:52:41,354 - preprocessing - INFO - xAPI engineered features created: ['engagement_score', 'absence_risk', 'parent_support_signal']
2026-06-13 00:52:41,357 - preprocessing - INFO - xAPI engineered features created: ['engagement_score', 'absence_risk', 'parent_support_signal']
2026-06-13 00:52:41,374 - preprocessing - INFO - Applying ADASYN on train set with ratio 0.4548169346546087...
2026-06-13 00:52:41,494 - preprocessing - INFO - Feature selection complete. Selected 18 / 19 features.
2026-06-13 00:52:45,799 - train_pipeline - INFO - Early stopping triggered at epoch 54
[I 2026-06-13 00:52:45,831] Trial 54 finished with value: 0.7948801644180741 and parameters: {'learning_rate': 0.006872784476603048, 'weight_decay': 0.006919508136690924, 'batch_size': 32, 'oversample_method': 'adasyn', 'smote_ratio': 0.4548169346546087, 'resampling_k_neighbors': 5, 'cnn_channels': 16, 'cnn_kernel_size': 3, 'lstm_hidden_dim': 32, 'context_hidden_dim': 128, 'fusion_hidden_dim': 32, 'sequence_dropout': 0.11557362138459908, 'context_dropout': 0.28412926117922316, 'fusion_dropout': 0.1961062032417341}. Best is trial 17 with value: 0.8075693134180814.
2026-06-13 00:52:45,956 - preprocessing - INFO - xAPI engineered features created: ['engagement_score', 'absence_risk', 'parent_support_signal']
2026-06-13 00:52:45,958 - preprocessing - INFO - xAPI engineered features created: ['engagement_score', 'absence_risk', 'parent_support_signal']
2026-06-13 00:52:45,978 - preprocessing - INFO - Applying SMOTE on train set with ratio 0.613914852032189...
2026-06-13 00:52:46,108 - preprocessing - INFO - Feature selection complete. Selected 15 / 19 features.
2026-06-13 00:52:48,083 - train_pipeline - INFO - Early stopping triggered at epoch 34
2026-06-13 00:52:48,101 - preprocessing - INFO - xAPI engineered features created: ['engagement_score', 'absence_risk', 'parent_support_signal']
2026-06-13 00:52:48,103 - preprocessing - INFO - xAPI engineered features created: ['engagement_score', 'absence_risk', 'parent_support_signal']
2026-06-13 00:52:48,121 - preprocessing - INFO - Applying SMOTE on train set with ratio 0.613914852032189...
2026-06-13 00:52:48,242 - preprocessing - INFO - Feature selection complete. Selected 16 / 19 features.
2026-06-13 00:52:50,057 - train_pipeline - INFO - Early stopping triggered at epoch 32
2026-06-13 00:52:50,074 - preprocessing - INFO - xAPI engineered features created: ['engagement_score', 'absence_risk', 'parent_support_signal']
2026-06-13 00:52:50,076 - preprocessing - INFO - xAPI engineered features created: ['engagement_score', 'absence_risk', 'parent_support_signal']
2026-06-13 00:52:50,095 - preprocessing - INFO - Applying SMOTE on train set with ratio 0.613914852032189...
2026-06-13 00:52:50,221 - preprocessing - INFO - Feature selection complete. Selected 18 / 19 features.
2026-06-13 00:52:52,184 - train_pipeline - INFO - Early stopping triggered at epoch 34
2026-06-13 00:52:52,202 - preprocessing - INFO - xAPI engineered features created: ['engagement_score', 'absence_risk', 'parent_support_signal']
2026-06-13 00:52:52,204 - preprocessing - INFO - xAPI engineered features created: ['engagement_score', 'absence_risk', 'parent_support_signal']
2026-06-13 00:52:52,222 - preprocessing - INFO - Applying SMOTE on train set with ratio 0.613914852032189...
2026-06-13 00:52:52,342 - preprocessing - INFO - Feature selection complete. Selected 16 / 19 features.
2026-06-13 00:52:54,623 - train_pipeline - INFO - Early stopping triggered at epoch 40
2026-06-13 00:52:54,640 - preprocessing - INFO - xAPI engineered features created: ['engagement_score', 'absence_risk', 'parent_support_signal']
2026-06-13 00:52:54,642 - preprocessing - INFO - xAPI engineered features created: ['engagement_score', 'absence_risk', 'parent_support_signal']
2026-06-13 00:52:54,660 - preprocessing - INFO - Applying SMOTE on train set with ratio 0.613914852032189...
2026-06-13 00:52:54,813 - preprocessing - INFO - Feature selection complete. Selected 17 / 19 features.
2026-06-13 00:52:58,813 - train_pipeline - INFO - Early stopping triggered at epoch 63
[I 2026-06-13 00:52:58,860] Trial 55 finished with value: 0.8121442327638384 and parameters: {'learning_rate': 0.005895084262565673, 'weight_decay': 0.0008186193200934173, 'batch_size': 64, 'oversample_method': 'smote', 'smote_ratio': 0.613914852032189, 'resampling_k_neighbors': 2, 'cnn_channels': 16, 'cnn_kernel_size': 3, 'lstm_hidden_dim': 128, 'context_hidden_dim': 256, 'fusion_hidden_dim': 256, 'sequence_dropout': 0.14613966394794353, 'context_dropout': 0.12477030958565044, 'fusion_dropout': 0.23148947180170343}. Best is trial 55 with value: 0.8121442327638384.
2026-06-13 00:52:59,013 - preprocessing - INFO - xAPI engineered features created: ['engagement_score', 'absence_risk', 'parent_support_signal']
2026-06-13 00:52:59,015 - preprocessing - INFO - xAPI engineered features created: ['engagement_score', 'absence_risk', 'parent_support_signal']
2026-06-13 00:52:59,043 - preprocessing - INFO - Applying SMOTE on train set with ratio 0.5223206132415762...
2026-06-13 00:52:59,201 - preprocessing - INFO - Feature selection complete. Selected 15 / 19 features.
2026-06-13 00:53:02,099 - train_pipeline - INFO - Early stopping triggered at epoch 47
2026-06-13 00:53:02,117 - preprocessing - INFO - xAPI engineered features created: ['engagement_score', 'absence_risk', 'parent_support_signal']
2026-06-13 00:53:02,119 - preprocessing - INFO - xAPI engineered features created: ['engagement_score', 'absence_risk', 'parent_support_signal']
2026-06-13 00:53:02,136 - preprocessing - INFO - Applying SMOTE on train set with ratio 0.5223206132415762...
2026-06-13 00:53:02,252 - preprocessing - INFO - Feature selection complete. Selected 16 / 19 features.
2026-06-13 00:53:05,381 - train_pipeline - INFO - Early stopping triggered at epoch 51
2026-06-13 00:53:05,404 - preprocessing - INFO - xAPI engineered features created: ['engagement_score', 'absence_risk', 'parent_support_signal']
2026-06-13 00:53:05,407 - preprocessing - INFO - xAPI engineered features created: ['engagement_score', 'absence_risk', 'parent_support_signal']
2026-06-13 00:53:05,435 - preprocessing - INFO - Applying SMOTE on train set with ratio 0.5223206132415762...
2026-06-13 00:53:05,608 - preprocessing - INFO - Feature selection complete. Selected 18 / 19 features.
2026-06-13 00:53:07,443 - train_pipeline - INFO - Early stopping triggered at epoch 30
2026-06-13 00:53:07,463 - preprocessing - INFO - xAPI engineered features created: ['engagement_score', 'absence_risk', 'parent_support_signal']
2026-06-13 00:53:07,465 - preprocessing - INFO - xAPI engineered features created: ['engagement_score', 'absence_risk', 'parent_support_signal']
2026-06-13 00:53:07,482 - preprocessing - INFO - Applying SMOTE on train set with ratio 0.5223206132415762...
2026-06-13 00:53:07,599 - preprocessing - INFO - Feature selection complete. Selected 16 / 19 features.
2026-06-13 00:53:11,534 - train_pipeline - INFO - Early stopping triggered at epoch 64
2026-06-13 00:53:11,560 - preprocessing - INFO - xAPI engineered features created: ['engagement_score', 'absence_risk', 'parent_support_signal']
2026-06-13 00:53:11,563 - preprocessing - INFO - xAPI engineered features created: ['engagement_score', 'absence_risk', 'parent_support_signal']
2026-06-13 00:53:11,590 - preprocessing - INFO - Applying SMOTE on train set with ratio 0.5223206132415762...
2026-06-13 00:53:11,750 - preprocessing - INFO - Feature selection complete. Selected 18 / 19 features.
2026-06-13 00:53:14,307 - train_pipeline - INFO - Early stopping triggered at epoch 43
[I 2026-06-13 00:53:14,337] Trial 56 finished with value: 0.7902408560326035 and parameters: {'learning_rate': 0.0008397166967173372, 'weight_decay': 7.379143580179394e-05, 'batch_size': 64, 'oversample_method': 'smote', 'smote_ratio': 0.5223206132415762, 'resampling_k_neighbors': 4, 'cnn_channels': 16, 'cnn_kernel_size': 3, 'lstm_hidden_dim': 128, 'context_hidden_dim': 256, 'fusion_hidden_dim': 256, 'sequence_dropout': 0.20584297216845904, 'context_dropout': 0.16781360125400943, 'fusion_dropout': 0.28624621635363545}. Best is trial 55 with value: 0.8121442327638384.
2026-06-13 00:53:14,448 - preprocessing - INFO - xAPI engineered features created: ['engagement_score', 'absence_risk', 'parent_support_signal']
2026-06-13 00:53:14,450 - preprocessing - INFO - xAPI engineered features created: ['engagement_score', 'absence_risk', 'parent_support_signal']
2026-06-13 00:53:14,468 - preprocessing - INFO - Applying ADASYN on train set with ratio 0.41360122226805673...
2026-06-13 00:53:14,586 - preprocessing - INFO - Feature selection complete. Selected 15 / 19 features.
2026-06-13 00:53:30,096 - train_pipeline - INFO - Early stopping triggered at epoch 55
2026-06-13 00:53:30,113 - preprocessing - INFO - xAPI engineered features created: ['engagement_score', 'absence_risk', 'parent_support_signal']
2026-06-13 00:53:30,115 - preprocessing - INFO - xAPI engineered features created: ['engagement_score', 'absence_risk', 'parent_support_signal']
2026-06-13 00:53:30,133 - preprocessing - INFO - Applying ADASYN on train set with ratio 0.41360122226805673...
2026-06-13 00:53:30,252 - preprocessing - INFO - Feature selection complete. Selected 16 / 19 features.
2026-06-13 00:53:46,622 - train_pipeline - INFO - Early stopping triggered at epoch 58
2026-06-13 00:53:46,639 - preprocessing - INFO - xAPI engineered features created: ['engagement_score', 'absence_risk', 'parent_support_signal']
2026-06-13 00:53:46,642 - preprocessing - INFO - xAPI engineered features created: ['engagement_score', 'absence_risk', 'parent_support_signal']
2026-06-13 00:53:46,661 - preprocessing - INFO - Applying ADASYN on train set with ratio 0.41360122226805673...
2026-06-13 00:53:46,780 - preprocessing - INFO - Feature selection complete. Selected 18 / 19 features.
2026-06-13 00:53:56,527 - train_pipeline - INFO - Early stopping triggered at epoch 33
2026-06-13 00:53:56,545 - preprocessing - INFO - xAPI engineered features created: ['engagement_score', 'absence_risk', 'parent_support_signal']
2026-06-13 00:53:56,547 - preprocessing - INFO - xAPI engineered features created: ['engagement_score', 'absence_risk', 'parent_support_signal']
2026-06-13 00:53:56,565 - preprocessing - INFO - Applying ADASYN on train set with ratio 0.41360122226805673...
2026-06-13 00:53:56,684 - preprocessing - INFO - Feature selection complete. Selected 16 / 19 features.
2026-06-13 00:54:07,971 - train_pipeline - INFO - Early stopping triggered at epoch 39
2026-06-13 00:54:07,989 - preprocessing - INFO - xAPI engineered features created: ['engagement_score', 'absence_risk', 'parent_support_signal']
2026-06-13 00:54:07,991 - preprocessing - INFO - xAPI engineered features created: ['engagement_score', 'absence_risk', 'parent_support_signal']
2026-06-13 00:54:08,014 - preprocessing - INFO - Applying ADASYN on train set with ratio 0.41360122226805673...
2026-06-13 00:54:08,132 - preprocessing - INFO - Feature selection complete. Selected 18 / 19 features.
2026-06-13 00:54:20,571 - train_pipeline - INFO - Early stopping triggered at epoch 43
[I 2026-06-13 00:54:20,599] Trial 57 finished with value: 0.7974623438755664 and parameters: {'learning_rate': 0.013059444488225302, 'weight_decay': 0.0010136294403295543, 'batch_size': 8, 'oversample_method': 'adasyn', 'smote_ratio': 0.41360122226805673, 'resampling_k_neighbors': 2, 'cnn_channels': 16, 'cnn_kernel_size': 3, 'lstm_hidden_dim': 96, 'context_hidden_dim': 128, 'fusion_hidden_dim': 32, 'sequence_dropout': 0.2115318469301445, 'context_dropout': 0.272951791800085, 'fusion_dropout': 0.4336449562784099}. Best is trial 55 with value: 0.8121442327638384.
2026-06-13 00:54:20,717 - preprocessing - INFO - xAPI engineered features created: ['engagement_score', 'absence_risk', 'parent_support_signal']
2026-06-13 00:54:20,719 - preprocessing - INFO - xAPI engineered features created: ['engagement_score', 'absence_risk', 'parent_support_signal']
2026-06-13 00:54:20,736 - preprocessing - INFO - Applying SMOTE on train set with ratio 0.4491320344349049...
2026-06-13 00:54:20,856 - preprocessing - INFO - Feature selection complete. Selected 15 / 19 features.
2026-06-13 00:54:26,399 - train_pipeline - INFO - Early stopping triggered at epoch 67
2026-06-13 00:54:26,417 - preprocessing - INFO - xAPI engineered features created: ['engagement_score', 'absence_risk', 'parent_support_signal']
2026-06-13 00:54:26,419 - preprocessing - INFO - xAPI engineered features created: ['engagement_score', 'absence_risk', 'parent_support_signal']
2026-06-13 00:54:26,436 - preprocessing - INFO - Applying SMOTE on train set with ratio 0.4491320344349049...
2026-06-13 00:54:26,566 - preprocessing - INFO - Feature selection complete. Selected 16 / 19 features.
2026-06-13 00:54:29,542 - train_pipeline - INFO - Early stopping triggered at epoch 37
2026-06-13 00:54:29,560 - preprocessing - INFO - xAPI engineered features created: ['engagement_score', 'absence_risk', 'parent_support_signal']
2026-06-13 00:54:29,562 - preprocessing - INFO - xAPI engineered features created: ['engagement_score', 'absence_risk', 'parent_support_signal']
2026-06-13 00:54:29,579 - preprocessing - INFO - Applying SMOTE on train set with ratio 0.4491320344349049...
2026-06-13 00:54:29,698 - preprocessing - INFO - Feature selection complete. Selected 18 / 19 features.
2026-06-13 00:54:33,265 - train_pipeline - INFO - Early stopping triggered at epoch 41
2026-06-13 00:54:33,284 - preprocessing - INFO - xAPI engineered features created: ['engagement_score', 'absence_risk', 'parent_support_signal']
2026-06-13 00:54:33,286 - preprocessing - INFO - xAPI engineered features created: ['engagement_score', 'absence_risk', 'parent_support_signal']
2026-06-13 00:54:33,303 - preprocessing - INFO - Applying SMOTE on train set with ratio 0.4491320344349049...
2026-06-13 00:54:33,419 - preprocessing - INFO - Feature selection complete. Selected 16 / 19 features.
2026-06-13 00:54:36,515 - train_pipeline - INFO - Early stopping triggered at epoch 35
2026-06-13 00:54:36,533 - preprocessing - INFO - xAPI engineered features created: ['engagement_score', 'absence_risk', 'parent_support_signal']
2026-06-13 00:54:36,535 - preprocessing - INFO - xAPI engineered features created: ['engagement_score', 'absence_risk', 'parent_support_signal']
2026-06-13 00:54:36,551 - preprocessing - INFO - Applying SMOTE on train set with ratio 0.4491320344349049...
2026-06-13 00:54:36,667 - preprocessing - INFO - Feature selection complete. Selected 18 / 19 features.
2026-06-13 00:54:39,602 - train_pipeline - INFO - Early stopping triggered at epoch 38
[I 2026-06-13 00:54:39,629] Trial 58 finished with value: 0.7886416148537704 and parameters: {'learning_rate': 0.012672363818944023, 'weight_decay': 0.00020348477655597052, 'batch_size': 32, 'oversample_method': 'smote', 'smote_ratio': 0.4491320344349049, 'resampling_k_neighbors': 4, 'cnn_channels': 16, 'cnn_kernel_size': 3, 'lstm_hidden_dim': 64, 'context_hidden_dim': 128, 'fusion_hidden_dim': 64, 'sequence_dropout': 0.19447717898527525, 'context_dropout': 0.11996284318229342, 'fusion_dropout': 0.2754531779443751}. Best is trial 55 with value: 0.8121442327638384.
2026-06-13 00:54:39,746 - preprocessing - INFO - xAPI engineered features created: ['engagement_score', 'absence_risk', 'parent_support_signal']
2026-06-13 00:54:39,749 - preprocessing - INFO - xAPI engineered features created: ['engagement_score', 'absence_risk', 'parent_support_signal']
2026-06-13 00:54:39,784 - preprocessing - INFO - Applying SMOTE on train set with ratio 0.8083484821803812...
2026-06-13 00:54:39,954 - preprocessing - INFO - Feature selection complete. Selected 18 / 19 features.
2026-06-13 00:54:42,862 - train_pipeline - INFO - Early stopping triggered at epoch 40
2026-06-13 00:54:42,880 - preprocessing - INFO - xAPI engineered features created: ['engagement_score', 'absence_risk', 'parent_support_signal']
2026-06-13 00:54:42,882 - preprocessing - INFO - xAPI engineered features created: ['engagement_score', 'absence_risk', 'parent_support_signal']
2026-06-13 00:54:42,899 - preprocessing - INFO - Applying SMOTE on train set with ratio 0.8083484821803812...
2026-06-13 00:54:43,030 - preprocessing - INFO - Feature selection complete. Selected 16 / 19 features.
2026-06-13 00:54:45,341 - train_pipeline - INFO - Early stopping triggered at epoch 36
2026-06-13 00:54:45,359 - preprocessing - INFO - xAPI engineered features created: ['engagement_score', 'absence_risk', 'parent_support_signal']
2026-06-13 00:54:45,361 - preprocessing - INFO - xAPI engineered features created: ['engagement_score', 'absence_risk', 'parent_support_signal']
2026-06-13 00:54:45,379 - preprocessing - INFO - Applying SMOTE on train set with ratio 0.8083484821803812...
2026-06-13 00:54:45,502 - preprocessing - INFO - Feature selection complete. Selected 18 / 19 features.
2026-06-13 00:54:48,235 - train_pipeline - INFO - Early stopping triggered at epoch 36
