[I 2026-06-12 17:52:01,294] Trial 17 finished with value: 0.7834634088965537 and parameters: {'learning_rate': 0.005297929393278662, 'weight_decay': 0.0004971323102214717, 'dropout': 0.3126505971580185, 'batch_size': 16, 'lambda_ordinal': 0.28930803580803466, 'oversample_method': 'smote', 'smote_ratio': 0.40188853005209846, 'context_architecture': 'deepfm', 'sequence_architecture': 'dsc_bilstm_attention', 'fm_embedding_dim': 8, 'dcn_cross_layers': 2, 'context_hidden_dim': 128, 'sequence_hidden_dim': 64, 'fusion_hidden_dim': 64}. Best is trial 0 with value: 0.8012617082366521.
2026-06-12 17:52:01,310 - preprocessing - INFO - xAPI engineered features created: ['engagement_score', 'absence_risk', 'parent_support_signal']
2026-06-12 17:52:01,310 - preprocessing - INFO - xAPI engineered features created: ['engagement_score', 'absence_risk', 'parent_support_signal']
2026-06-12 17:52:01,329 - preprocessing - INFO - Applying ADASYN on train set with ratio 0.7904669520312422...
2026-06-12 17:52:01,341 - preprocessing - WARNING - ADASYN failed (likely too few samples). Error: No samples will be generated with the provided ratio settings.. Falling back to no oversampling.
2026-06-12 17:52:01,466 - preprocessing - INFO - Feature selection complete. Selected 15 / 19 features.
[I 2026-06-12 17:52:04,689] Early stopping triggered at epoch 44
2026-06-12 17:52:04,689 - preprocessing - INFO - xAPI engineered features created: ['engagement_score', 'absence_risk', 'parent_support_signal']
2026-06-12 17:52:04,689 - preprocessing - INFO - xAPI engineered features created: ['engagement_score', 'absence_risk', 'parent_support_signal']
2026-06-12 17:52:04,716 - preprocessing - INFO - Applying ADASYN on train set with ratio 0.7904669520312422...
2026-06-12 17:52:04,733 - preprocessing - WARNING - ADASYN failed (likely too few samples). Error: No samples will be generated with the provided ratio settings.. Falling back to no oversampling.
2026-06-12 17:52:04,861 - preprocessing - INFO - Feature selection complete. Selected 16 / 19 features.
[I 2026-06-12 17:52:07,584] Early stopping triggered at epoch 36
2026-06-12 17:52:07,589 - preprocessing - INFO - xAPI engineered features created: ['engagement_score', 'absence_risk', 'parent_support_signal']
2026-06-12 17:52:07,591 - preprocessing - INFO - xAPI engineered features created: ['engagement_score', 'absence_risk', 'parent_support_signal']
2026-06-12 17:52:07,609 - preprocessing - INFO - Applying ADASYN on train set with ratio 0.7904669520312422...
2026-06-12 17:52:07,622 - preprocessing - WARNING - ADASYN failed (likely too few samples). Error: No samples will be generated with the provided ratio settings.. Falling back to no oversampling.
2026-06-12 17:52:07,754 - preprocessing - INFO - Feature selection complete. Selected 18 / 19 features.
[I 2026-06-12 17:52:11,583] Early stopping triggered at epoch 49
2026-06-12 17:52:11,587 - preprocessing - INFO - xAPI engineered features created: ['engagement_score', 'absence_risk', 'parent_support_signal']
2026-06-12 17:52:11,589 - preprocessing - INFO - xAPI engineered features created: ['engagement_score', 'absence_risk', 'parent_support_signal']
2026-06-12 17:52:11,605 - preprocessing - INFO - Applying ADASYN on train set with ratio 0.7904669520312422...
2026-06-12 17:52:11,626 - preprocessing - WARNING - ADASYN failed (likely too few samples). Error: No samples will be generated with the provided ratio settings.. Falling back to no oversampling.
2026-06-12 17:52:11,758 - preprocessing - INFO - Feature selection complete. Selected 16 / 19 features.
[I 2026-06-12 17:52:14,789] Early stopping triggered at epoch 40
2026-06-12 17:52:14,789 - preprocessing - INFO - xAPI engineered features created: ['engagement_score', 'absence_risk', 'parent_support_signal']
2026-06-12 17:52:14,805 - preprocessing - INFO - xAPI engineered features created: ['engagement_score', 'absence_risk', 'parent_support_signal']
2026-06-12 17:52:14,820 - preprocessing - INFO - Applying ADASYN on train set with ratio 0.7904669520312422...
2026-06-12 17:52:14,838 - preprocessing - WARNING - ADASYN failed (likely too few samples). Error: No samples will be generated with the provided ratio settings.. Falling back to no oversampling.
2026-06-12 17:52:14,962 - preprocessing - INFO - Feature selection complete. Selected 18 / 19 features.
[I 2026-06-12 17:52:18,157] Early stopping triggered at epoch 41
[I 2026-06-12 17:52:18,157] Trial 18 finished with value: 0.7820121812133759 and parameters: {'learning_rate': 0.0017354092883150507, 'weight_decay': 8.014553755593393e-05, 'dropout': 0.26211661658464214, 'batch_size': 64, 'lambda_ordinal': 0.42628225032251266, 'oversample_method': 'adasyn', 'smote_ratio': 0.7904669520312422, 'context_architecture': 'deepfm', 'sequence_architecture': 'dsc_bilstm_attention', 'fm_embedding_dim': 32, 'dcn_cross_layers': 3, 'context_hidden_dim': 32, 'sequence_hidden_dim': 64, 'fusion_hidden_dim': 64}. Best is trial 0 with value: 0.8012617082366521.
2026-06-12 17:52:18,181 - preprocessing - INFO - xAPI engineered features created: ['engagement_score', 'absence_risk', 'parent_support_signal']
2026-06-12 17:52:18,181 - preprocessing - INFO - xAPI engineered features created: ['engagement_score', 'absence_risk', 'parent_support_signal']
2026-06-12 17:52:18,310 - preprocessing - INFO - Feature selection complete. Selected 15 / 19 features.
[I 2026-06-12 17:52:22,928] Early stopping triggered at epoch 35
2026-06-12 17:52:22,928 - preprocessing - INFO - xAPI engineered features created: ['engagement_score', 'absence_risk', 'parent_support_signal']
2026-06-12 17:52:22,928 - preprocessing - INFO - xAPI engineered features created: ['engagement_score', 'absence_risk', 'parent_support_signal']
2026-06-12 17:52:23,088 - preprocessing - INFO - Feature selection complete. Selected 16 / 19 features.
[I 2026-06-12 17:52:26,617] Early stopping triggered at epoch 26
2026-06-12 17:52:26,617 - preprocessing - INFO - xAPI engineered features created: ['engagement_score', 'absence_risk', 'parent_support_signal']
2026-06-12 17:52:26,617 - preprocessing - INFO - xAPI engineered features created: ['engagement_score', 'absence_risk', 'parent_support_signal']
2026-06-12 17:52:26,770 - preprocessing - INFO - Feature selection complete. Selected 18 / 19 features.
[I 2026-06-12 17:52:30,617] Early stopping triggered at epoch 26
2026-06-12 17:52:30,624 - preprocessing - INFO - xAPI engineered features created: ['engagement_score', 'absence_risk', 'parent_support_signal']
2026-06-12 17:52:30,627 - preprocessing - INFO - xAPI engineered features created: ['engagement_score', 'absence_risk', 'parent_support_signal']
2026-06-12 17:52:30,794 - preprocessing - INFO - Feature selection complete. Selected 16 / 19 features.
[I 2026-06-12 17:52:35,497] Early stopping triggered at epoch 34
2026-06-12 17:52:35,497 - preprocessing - INFO - xAPI engineered features created: ['engagement_score', 'absence_risk', 'parent_support_signal']
2026-06-12 17:52:35,511 - preprocessing - INFO - xAPI engineered features created: ['engagement_score', 'absence_risk', 'parent_support_signal']
2026-06-12 17:52:35,656 - preprocessing - INFO - Feature selection complete. Selected 18 / 19 features.
[I 2026-06-12 17:52:39,238] Early stopping triggered at epoch 26
[I 2026-06-12 17:52:39,238] Trial 19 finished with value: 0.7954507853175702 and parameters: {'learning_rate': 0.002154573607128265, 'weight_decay': 4.0952121897530735e-05, 'dropout': 0.1409980604593017, 'batch_size': 32, 'lambda_ordinal': 0.18704673648273068, 'oversample_method': 'none', 'focal_gamma': 1.042114233687574, 'context_architecture': 'deepfm', 'sequence_architecture': 'dsc_bilstm_attention', 'fm_embedding_dim': 16, 'dcn_cross_layers': 1, 'context_hidden_dim': 64, 'sequence_hidden_dim': 64, 'fusion_hidden_dim': 64}. Best is trial 0 with value: 0.8012617082366521.
2026-06-12 17:52:39,266 - preprocessing - INFO - xAPI engineered features created: ['engagement_score', 'absence_risk', 'parent_support_signal']
2026-06-12 17:52:39,266 - preprocessing - INFO - xAPI engineered features created: ['engagement_score', 'absence_risk', 'parent_support_signal']
2026-06-12 17:52:39,396 - preprocessing - INFO - Feature selection complete. Selected 15 / 19 features.
[I 2026-06-12 17:52:44,648] Early stopping triggered at epoch 47
2026-06-12 17:52:44,648 - preprocessing - INFO - xAPI engineered features created: ['engagement_score', 'absence_risk', 'parent_support_signal']
2026-06-12 17:52:44,662 - preprocessing - INFO - xAPI engineered features created: ['engagement_score', 'absence_risk', 'parent_support_signal']
2026-06-12 17:52:44,792 - preprocessing - INFO - Feature selection complete. Selected 16 / 19 features.
[I 2026-06-12 17:52:47,818] Early stopping triggered at epoch 27
2026-06-12 17:52:47,825 - preprocessing - INFO - xAPI engineered features created: ['engagement_score', 'absence_risk', 'parent_support_signal']
2026-06-12 17:52:47,825 - preprocessing - INFO - xAPI engineered features created: ['engagement_score', 'absence_risk', 'parent_support_signal']
2026-06-12 17:52:47,950 - preprocessing - INFO - Feature selection complete. Selected 18 / 19 features.
[I 2026-06-12 17:52:52,239] Early stopping triggered at epoch 37
2026-06-12 17:52:52,253 - preprocessing - INFO - xAPI engineered features created: ['engagement_score', 'absence_risk', 'parent_support_signal']
2026-06-12 17:52:52,255 - preprocessing - INFO - xAPI engineered features created: ['engagement_score', 'absence_risk', 'parent_support_signal']
2026-06-12 17:52:52,397 - preprocessing - INFO - Feature selection complete. Selected 16 / 19 features.
2026-06-12 17:52:58,032 - preprocessing - INFO - xAPI engineered features created: ['engagement_score', 'absence_risk', 'parent_support_signal']
2026-06-12 17:52:58,038 - preprocessing - INFO - xAPI engineered features created: ['engagement_score', 'absence_risk', 'parent_support_signal']
2026-06-12 17:52:58,180 - preprocessing - INFO - Feature selection complete. Selected 18 / 19 features.
[I 2026-06-12 17:53:01,610] Early stopping triggered at epoch 30
[I 2026-06-12 17:53:01,610] Trial 20 finished with value: 0.798982130736599 and parameters: {'learning_rate': 0.00045836685374515826, 'weight_decay': 2.944174608607154e-05, 'dropout': 0.16533633568885814, 'batch_size': 32, 'lambda_ordinal': 0.16032467503054623, 'oversample_method': 'none', 'focal_gamma': 1.0703463378572826, 'context_architecture': 'mlp_baseline', 'sequence_architecture': 'dsc_bilstm_attention', 'fm_embedding_dim': 16, 'dcn_cross_layers': 1, 'context_hidden_dim': 64, 'sequence_hidden_dim': 64, 'fusion_hidden_dim': 64}. Best is trial 0 with value: 0.8012617082366521.
2026-06-12 17:53:01,626 - preprocessing - INFO - xAPI engineered features created: ['engagement_score', 'absence_risk', 'parent_support_signal']
2026-06-12 17:53:01,626 - preprocessing - INFO - xAPI engineered features created: ['engagement_score', 'absence_risk', 'parent_support_signal']
2026-06-12 17:53:01,773 - preprocessing - INFO - Feature selection complete. Selected 15 / 19 features.
[I 2026-06-12 17:53:06,991] Early stopping triggered at epoch 46
2026-06-12 17:53:07,002 - preprocessing - INFO - xAPI engineered features created: ['engagement_score', 'absence_risk', 'parent_support_signal']
2026-06-12 17:53:07,008 - preprocessing - INFO - xAPI engineered features created: ['engagement_score', 'absence_risk', 'parent_support_signal']
2026-06-12 17:53:07,146 - preprocessing - INFO - Feature selection complete. Selected 16 / 19 features.
2026-06-12 17:53:12,828 - preprocessing - INFO - xAPI engineered features created: ['engagement_score', 'absence_risk', 'parent_support_signal']
2026-06-12 17:53:12,828 - preprocessing - INFO - xAPI engineered features created: ['engagement_score', 'absence_risk', 'parent_support_signal']
2026-06-12 17:53:12,979 - preprocessing - INFO - Feature selection complete. Selected 18 / 19 features.
[I 2026-06-12 17:53:15,812] Early stopping triggered at epoch 25
2026-06-12 17:53:15,815 - preprocessing - INFO - xAPI engineered features created: ['engagement_score', 'absence_risk', 'parent_support_signal']
2026-06-12 17:53:15,817 - preprocessing - INFO - xAPI engineered features created: ['engagement_score', 'absence_risk', 'parent_support_signal']
2026-06-12 17:53:15,957 - preprocessing - INFO - Feature selection complete. Selected 16 / 19 features.
[I 2026-06-12 17:53:19,205] Early stopping triggered at epoch 29
2026-06-12 17:53:19,212 - preprocessing - INFO - xAPI engineered features created: ['engagement_score', 'absence_risk', 'parent_support_signal']
2026-06-12 17:53:19,214 - preprocessing - INFO - xAPI engineered features created: ['engagement_score', 'absence_risk', 'parent_support_signal']
2026-06-12 17:53:19,359 - preprocessing - INFO - Feature selection complete. Selected 18 / 19 features.
[I 2026-06-12 17:53:21,888] Early stopping triggered at epoch 22
[I 2026-06-12 17:53:21,888] Trial 21 finished with value: 0.7594036844768961 and parameters: {'learning_rate': 0.00031950532932781424, 'weight_decay': 3.1611924447771954e-05, 'dropout': 0.16498995823004142, 'batch_size': 32, 'lambda_ordinal': 0.1747384782974182, 'oversample_method': 'none', 'focal_gamma': 1.0037392964781013, 'context_architecture': 'mlp_baseline', 'sequence_architecture': 'dsc_bilstm_attention', 'fm_embedding_dim': 16, 'dcn_cross_layers': 1, 'context_hidden_dim': 64, 'sequence_hidden_dim': 64, 'fusion_hidden_dim': 64}. Best is trial 0 with value: 0.8012617082366521.
2026-06-12 17:53:21,909 - preprocessing - INFO - xAPI engineered features created: ['engagement_score', 'absence_risk', 'parent_support_signal']
2026-06-12 17:53:21,909 - preprocessing - INFO - xAPI engineered features created: ['engagement_score', 'absence_risk', 'parent_support_signal']
2026-06-12 17:53:22,058 - preprocessing - INFO - Feature selection complete. Selected 15 / 19 features.
[I 2026-06-12 17:53:24,825] Early stopping triggered at epoch 25
2026-06-12 17:53:24,836 - preprocessing - INFO - xAPI engineered features created: ['engagement_score', 'absence_risk', 'parent_support_signal']
2026-06-12 17:53:24,836 - preprocessing - INFO - xAPI engineered features created: ['engagement_score', 'absence_risk', 'parent_support_signal']
2026-06-12 17:53:24,968 - preprocessing - INFO - Feature selection complete. Selected 16 / 19 features.
[I 2026-06-12 17:53:28,177] Early stopping triggered at epoch 28
2026-06-12 17:53:28,177 - preprocessing - INFO - xAPI engineered features created: ['engagement_score', 'absence_risk', 'parent_support_signal']
2026-06-12 17:53:28,177 - preprocessing - INFO - xAPI engineered features created: ['engagement_score', 'absence_risk', 'parent_support_signal']
2026-06-12 17:53:28,314 - preprocessing - INFO - Feature selection complete. Selected 18 / 19 features.
[I 2026-06-12 17:53:32,114] Early stopping triggered at epoch 33
2026-06-12 17:53:32,118 - preprocessing - INFO - xAPI engineered features created: ['engagement_score', 'absence_risk', 'parent_support_signal']
2026-06-12 17:53:32,121 - preprocessing - INFO - xAPI engineered features created: ['engagement_score', 'absence_risk', 'parent_support_signal']
2026-06-12 17:53:32,266 - preprocessing - INFO - Feature selection complete. Selected 16 / 19 features.
[I 2026-06-12 17:53:36,960] Early stopping triggered at epoch 41
2026-06-12 17:53:36,960 - preprocessing - INFO - xAPI engineered features created: ['engagement_score', 'absence_risk', 'parent_support_signal']
2026-06-12 17:53:36,960 - preprocessing - INFO - xAPI engineered features created: ['engagement_score', 'absence_risk', 'parent_support_signal']
2026-06-12 17:53:37,118 - preprocessing - INFO - Feature selection complete. Selected 18 / 19 features.
[I 2026-06-12 17:53:43,193] Trial 22 finished with value: 0.7677422649550103 and parameters: {'learning_rate': 0.00040330919566988765, 'weight_decay': 2.7709492132610016e-05, 'dropout': 0.1497808144646311, 'batch_size': 32, 'lambda_ordinal': 0.1768006513389424, 'oversample_method': 'none', 'focal_gamma': 1.5240136017524795, 'context_architecture': 'mlp_baseline', 'sequence_architecture': 'dsc_bilstm_attention', 'fm_embedding_dim': 16, 'dcn_cross_layers': 1, 'context_hidden_dim': 64, 'sequence_hidden_dim': 64, 'fusion_hidden_dim': 64}. Best is trial 0 with value: 0.8012617082366521.
2026-06-12 17:53:43,214 - preprocessing - INFO - xAPI engineered features created: ['engagement_score', 'absence_risk', 'parent_support_signal']
2026-06-12 17:53:43,214 - preprocessing - INFO - xAPI engineered features created: ['engagement_score', 'absence_risk', 'parent_support_signal']
2026-06-12 17:53:43,353 - preprocessing - INFO - Feature selection complete. Selected 15 / 19 features.
[I 2026-06-12 17:53:45,912] Early stopping triggered at epoch 23
2026-06-12 17:53:45,917 - preprocessing - INFO - xAPI engineered features created: ['engagement_score', 'absence_risk', 'parent_support_signal']
2026-06-12 17:53:45,919 - preprocessing - INFO - xAPI engineered features created: ['engagement_score', 'absence_risk', 'parent_support_signal']
2026-06-12 17:53:46,062 - preprocessing - INFO - Feature selection complete. Selected 16 / 19 features.
[I 2026-06-12 17:53:48,993] Early stopping triggered at epoch 26
2026-06-12 17:53:48,993 - preprocessing - INFO - xAPI engineered features created: ['engagement_score', 'absence_risk', 'parent_support_signal']
2026-06-12 17:53:48,993 - preprocessing - INFO - xAPI engineered features created: ['engagement_score', 'absence_risk', 'parent_support_signal']
2026-06-12 17:53:49,139 - preprocessing - INFO - Feature selection complete. Selected 18 / 19 features.
[I 2026-06-12 17:53:52,152] Early stopping triggered at epoch 26
2026-06-12 17:53:52,152 - preprocessing - INFO - xAPI engineered features created: ['engagement_score', 'absence_risk', 'parent_support_signal']
2026-06-12 17:53:52,152 - preprocessing - INFO - xAPI engineered features created: ['engagement_score', 'absence_risk', 'parent_support_signal']
2026-06-12 17:53:52,305 - preprocessing - INFO - Feature selection complete. Selected 16 / 19 features.
[I 2026-06-12 17:53:55,500] Early stopping triggered at epoch 28
2026-06-12 17:53:55,500 - preprocessing - INFO - xAPI engineered features created: ['engagement_score', 'absence_risk', 'parent_support_signal']
2026-06-12 17:53:55,516 - preprocessing - INFO - xAPI engineered features created: ['engagement_score', 'absence_risk', 'parent_support_signal']
2026-06-12 17:53:55,653 - preprocessing - INFO - Feature selection complete. Selected 18 / 19 features.
[I 2026-06-12 17:53:58,553] Early stopping triggered at epoch 25
[I 2026-06-12 17:53:58,555] Trial 23 finished with value: 0.7746885560974139 and parameters: {'learning_rate': 0.0018072486915580535, 'weight_decay': 2.356406484833339e-05, 'dropout': 0.33618007722265375, 'batch_size': 32, 'lambda_ordinal': 0.16164281785748752, 'oversample_method': 'none', 'focal_gamma': 1.6720696682430605, 'context_architecture': 'mlp_baseline', 'sequence_architecture': 'dsc_bilstm_attention', 'fm_embedding_dim': 16, 'dcn_cross_layers': 1, 'context_hidden_dim': 64, 'sequence_hidden_dim': 64, 'fusion_hidden_dim': 64}. Best is trial 0 with value: 0.8012617082366521.
2026-06-12 17:53:58,566 - preprocessing - INFO - xAPI engineered features created: ['engagement_score', 'absence_risk', 'parent_support_signal']
2026-06-12 17:53:58,566 - preprocessing - INFO - xAPI engineered features created: ['engagement_score', 'absence_risk', 'parent_support_signal']
2026-06-12 17:53:58,704 - preprocessing - INFO - Feature selection complete. Selected 15 / 19 features.
[I 2026-06-12 17:54:03,208] Early stopping triggered at epoch 40
2026-06-12 17:54:03,224 - preprocessing - INFO - xAPI engineered features created: ['engagement_score', 'absence_risk', 'parent_support_signal']
2026-06-12 17:54:03,224 - preprocessing - INFO - xAPI engineered features created: ['engagement_score', 'absence_risk', 'parent_support_signal']
2026-06-12 17:54:03,360 - preprocessing - INFO - Feature selection complete. Selected 16 / 19 features.
[I 2026-06-12 17:54:08,577] Early stopping triggered at epoch 46
2026-06-12 17:54:08,577 - preprocessing - INFO - xAPI engineered features created: ['engagement_score', 'absence_risk', 'parent_support_signal']
2026-06-12 17:54:08,577 - preprocessing - INFO - xAPI engineered features created: ['engagement_score', 'absence_risk', 'parent_support_signal']
2026-06-12 17:54:08,709 - preprocessing - INFO - Feature selection complete. Selected 18 / 19 features.
[I 2026-06-12 17:54:14,096] Early stopping triggered at epoch 46
2026-06-12 17:54:14,096 - preprocessing - INFO - xAPI engineered features created: ['engagement_score', 'absence_risk', 'parent_support_signal']
2026-06-12 17:54:14,096 - preprocessing - INFO - xAPI engineered features created: ['engagement_score', 'absence_risk', 'parent_support_signal']
2026-06-12 17:54:14,247 - preprocessing - INFO - Feature selection complete. Selected 16 / 19 features.
[I 2026-06-12 17:54:18,908] Early stopping triggered at epoch 41
2026-06-12 17:54:18,908 - preprocessing - INFO - xAPI engineered features created: ['engagement_score', 'absence_risk', 'parent_support_signal']
2026-06-12 17:54:18,908 - preprocessing - INFO - xAPI engineered features created: ['engagement_score', 'absence_risk', 'parent_support_signal']
2026-06-12 17:54:19,047 - preprocessing - INFO - Feature selection complete. Selected 18 / 19 features.
