[I 2026-06-13 00:44:32,493] Trial 35 finished with value: 0.7941845178730982 and parameters: {'learning_rate': 0.017269788111842224, 'weight_decay': 0.000104799594207408, 'batch_size': 8, 'oversample_method': 'smote', 'smote_ratio': 0.3362121876932023, 'resampling_k_neighbors': 2, 'cnn_channels': 16, 'cnn_kernel_size': 3, 'lstm_hidden_dim': 128, 'context_hidden_dim': 128, 'fusion_hidden_dim': 256, 'sequence_dropout': 0.21911387703909369, 'context_dropout': 0.23118472204006527, 'fusion_dropout': 0.20629549707372588}. Best is trial 17 with value: 0.8075693134180814.
2026-06-13 00:44:32,606 - preprocessing - INFO - xAPI engineered features created: ['engagement_score', 'absence_risk', 'parent_support_signal']
2026-06-13 00:44:32,608 - preprocessing - INFO - xAPI engineered features created: ['engagement_score', 'absence_risk', 'parent_support_signal']
2026-06-13 00:44:32,625 - preprocessing - INFO - Applying SMOTE on train set with ratio 0.3994556868245135...
2026-06-13 00:44:32,743 - preprocessing - INFO - Feature selection complete. Selected 15 / 19 features.
2026-06-13 00:44:37,416 - train_pipeline - INFO - Early stopping triggered at epoch 46
2026-06-13 00:44:37,434 - preprocessing - INFO - xAPI engineered features created: ['engagement_score', 'absence_risk', 'parent_support_signal']
2026-06-13 00:44:37,436 - preprocessing - INFO - xAPI engineered features created: ['engagement_score', 'absence_risk', 'parent_support_signal']
2026-06-13 00:44:37,454 - preprocessing - INFO - Applying SMOTE on train set with ratio 0.3994556868245135...
2026-06-13 00:44:37,573 - preprocessing - INFO - Feature selection complete. Selected 16 / 19 features.
2026-06-13 00:44:40,562 - train_pipeline - INFO - Early stopping triggered at epoch 32
2026-06-13 00:44:40,582 - preprocessing - INFO - xAPI engineered features created: ['engagement_score', 'absence_risk', 'parent_support_signal']
2026-06-13 00:44:40,584 - preprocessing - INFO - xAPI engineered features created: ['engagement_score', 'absence_risk', 'parent_support_signal']
2026-06-13 00:44:40,603 - preprocessing - INFO - Applying SMOTE on train set with ratio 0.3994556868245135...
2026-06-13 00:44:40,722 - preprocessing - INFO - Feature selection complete. Selected 18 / 19 features.
2026-06-13 00:44:45,411 - train_pipeline - INFO - Early stopping triggered at epoch 43
2026-06-13 00:44:45,439 - preprocessing - INFO - xAPI engineered features created: ['engagement_score', 'absence_risk', 'parent_support_signal']
2026-06-13 00:44:45,442 - preprocessing - INFO - xAPI engineered features created: ['engagement_score', 'absence_risk', 'parent_support_signal']
2026-06-13 00:44:45,472 - preprocessing - INFO - Applying SMOTE on train set with ratio 0.3994556868245135...
2026-06-13 00:44:45,634 - preprocessing - INFO - Feature selection complete. Selected 16 / 19 features.
2026-06-13 00:44:48,701 - train_pipeline - INFO - Early stopping triggered at epoch 32
2026-06-13 00:44:48,719 - preprocessing - INFO - xAPI engineered features created: ['engagement_score', 'absence_risk', 'parent_support_signal']
2026-06-13 00:44:48,721 - preprocessing - INFO - xAPI engineered features created: ['engagement_score', 'absence_risk', 'parent_support_signal']
2026-06-13 00:44:48,740 - preprocessing - INFO - Applying SMOTE on train set with ratio 0.3994556868245135...
2026-06-13 00:44:48,920 - preprocessing - INFO - Feature selection complete. Selected 18 / 19 features.
2026-06-13 00:44:52,535 - train_pipeline - INFO - Early stopping triggered at epoch 35
[I 2026-06-13 00:44:52,565] Trial 36 finished with value: 0.791974443377466 and parameters: {'learning_rate': 0.012279017280457034, 'weight_decay': 3.795100218555114e-07, 'batch_size': 32, 'oversample_method': 'smote', 'smote_ratio': 0.3994556868245135, 'resampling_k_neighbors': 3, 'cnn_channels': 16, 'cnn_kernel_size': 3, 'lstm_hidden_dim': 128, 'context_hidden_dim': 256, 'fusion_hidden_dim': 128, 'sequence_dropout': 0.18701133626064403, 'context_dropout': 0.34128048187772714, 'fusion_dropout': 0.22172508455714512}. Best is trial 17 with value: 0.8075693134180814.
2026-06-13 00:44:52,682 - preprocessing - INFO - xAPI engineered features created: ['engagement_score', 'absence_risk', 'parent_support_signal']
2026-06-13 00:44:52,684 - preprocessing - INFO - xAPI engineered features created: ['engagement_score', 'absence_risk', 'parent_support_signal']
2026-06-13 00:44:52,702 - preprocessing - INFO - Applying ADASYN on train set with ratio 0.992571906115551...
2026-06-13 00:44:52,869 - preprocessing - INFO - Feature selection complete. Selected 18 / 19 features.
2026-06-13 00:45:04,160 - train_pipeline - INFO - Early stopping triggered at epoch 54
2026-06-13 00:45:04,177 - preprocessing - INFO - xAPI engineered features created: ['engagement_score', 'absence_risk', 'parent_support_signal']
2026-06-13 00:45:04,180 - preprocessing - INFO - xAPI engineered features created: ['engagement_score', 'absence_risk', 'parent_support_signal']
2026-06-13 00:45:04,197 - preprocessing - INFO - Applying ADASYN on train set with ratio 0.992571906115551...
2026-06-13 00:45:04,332 - preprocessing - INFO - Feature selection complete. Selected 17 / 19 features.
2026-06-13 00:45:15,466 - train_pipeline - INFO - Early stopping triggered at epoch 53
2026-06-13 00:45:15,486 - preprocessing - INFO - xAPI engineered features created: ['engagement_score', 'absence_risk', 'parent_support_signal']
2026-06-13 00:45:15,488 - preprocessing - INFO - xAPI engineered features created: ['engagement_score', 'absence_risk', 'parent_support_signal']
2026-06-13 00:45:15,504 - preprocessing - INFO - Applying ADASYN on train set with ratio 0.992571906115551...
2026-06-13 00:45:15,636 - preprocessing - INFO - Feature selection complete. Selected 18 / 19 features.
2026-06-13 00:45:24,968 - train_pipeline - INFO - Early stopping triggered at epoch 42
2026-06-13 00:45:24,986 - preprocessing - INFO - xAPI engineered features created: ['engagement_score', 'absence_risk', 'parent_support_signal']
2026-06-13 00:45:24,988 - preprocessing - INFO - xAPI engineered features created: ['engagement_score', 'absence_risk', 'parent_support_signal']
2026-06-13 00:45:25,006 - preprocessing - INFO - Applying ADASYN on train set with ratio 0.992571906115551...
2026-06-13 00:45:25,142 - preprocessing - INFO - Feature selection complete. Selected 18 / 19 features.
2026-06-13 00:45:33,900 - train_pipeline - INFO - Early stopping triggered at epoch 39
2026-06-13 00:45:33,919 - preprocessing - INFO - xAPI engineered features created: ['engagement_score', 'absence_risk', 'parent_support_signal']
2026-06-13 00:45:33,921 - preprocessing - INFO - xAPI engineered features created: ['engagement_score', 'absence_risk', 'parent_support_signal']
2026-06-13 00:45:33,938 - preprocessing - INFO - Applying ADASYN on train set with ratio 0.992571906115551...
2026-06-13 00:45:34,073 - preprocessing - INFO - Feature selection complete. Selected 18 / 19 features.
2026-06-13 00:45:45,424 - train_pipeline - INFO - Early stopping triggered at epoch 52
[I 2026-06-13 00:45:45,454] Trial 37 finished with value: 0.7698461724049291 and parameters: {'learning_rate': 0.028487390128269945, 'weight_decay': 1.2958241727995163e-05, 'batch_size': 16, 'oversample_method': 'adasyn', 'smote_ratio': 0.992571906115551, 'resampling_k_neighbors': 5, 'cnn_channels': 32, 'cnn_kernel_size': 4, 'lstm_hidden_dim': 64, 'context_hidden_dim': 256, 'fusion_hidden_dim': 256, 'sequence_dropout': 0.122963758798296, 'context_dropout': 0.4631201735087611, 'fusion_dropout': 0.21588534237404594}. Best is trial 17 with value: 0.8075693134180814.
2026-06-13 00:45:45,569 - preprocessing - INFO - xAPI engineered features created: ['engagement_score', 'absence_risk', 'parent_support_signal']
2026-06-13 00:45:45,571 - preprocessing - INFO - xAPI engineered features created: ['engagement_score', 'absence_risk', 'parent_support_signal']
2026-06-13 00:45:45,588 - preprocessing - INFO - Applying SMOTE on train set with ratio 0.4927706033816848...
2026-06-13 00:45:45,704 - preprocessing - INFO - Feature selection complete. Selected 15 / 19 features.
2026-06-13 00:45:52,520 - train_pipeline - INFO - Early stopping triggered at epoch 44
2026-06-13 00:45:52,539 - preprocessing - INFO - xAPI engineered features created: ['engagement_score', 'absence_risk', 'parent_support_signal']
2026-06-13 00:45:52,542 - preprocessing - INFO - xAPI engineered features created: ['engagement_score', 'absence_risk', 'parent_support_signal']
2026-06-13 00:45:52,559 - preprocessing - INFO - Applying SMOTE on train set with ratio 0.4927706033816848...
2026-06-13 00:45:52,684 - preprocessing - INFO - Feature selection complete. Selected 16 / 19 features.
2026-06-13 00:46:04,357 - train_pipeline - INFO - Early stopping triggered at epoch 74
2026-06-13 00:46:04,375 - preprocessing - INFO - xAPI engineered features created: ['engagement_score', 'absence_risk', 'parent_support_signal']
2026-06-13 00:46:04,377 - preprocessing - INFO - xAPI engineered features created: ['engagement_score', 'absence_risk', 'parent_support_signal']
2026-06-13 00:46:04,395 - preprocessing - INFO - Applying SMOTE on train set with ratio 0.4927706033816848...
2026-06-13 00:46:04,514 - preprocessing - INFO - Feature selection complete. Selected 18 / 19 features.
2026-06-13 00:46:10,316 - train_pipeline - INFO - Early stopping triggered at epoch 36
2026-06-13 00:46:10,334 - preprocessing - INFO - xAPI engineered features created: ['engagement_score', 'absence_risk', 'parent_support_signal']
2026-06-13 00:46:10,337 - preprocessing - INFO - xAPI engineered features created: ['engagement_score', 'absence_risk', 'parent_support_signal']
2026-06-13 00:46:10,355 - preprocessing - INFO - Applying SMOTE on train set with ratio 0.4927706033816848...
2026-06-13 00:46:10,476 - preprocessing - INFO - Feature selection complete. Selected 16 / 19 features.
2026-06-13 00:46:16,891 - train_pipeline - INFO - Early stopping triggered at epoch 41
2026-06-13 00:46:16,908 - preprocessing - INFO - xAPI engineered features created: ['engagement_score', 'absence_risk', 'parent_support_signal']
2026-06-13 00:46:16,910 - preprocessing - INFO - xAPI engineered features created: ['engagement_score', 'absence_risk', 'parent_support_signal']
2026-06-13 00:46:16,927 - preprocessing - INFO - Applying SMOTE on train set with ratio 0.4927706033816848...
2026-06-13 00:46:17,047 - preprocessing - INFO - Feature selection complete. Selected 18 / 19 features.
2026-06-13 00:46:24,424 - train_pipeline - INFO - Early stopping triggered at epoch 45
[I 2026-06-13 00:46:24,458] Trial 38 finished with value: 0.8017815582330554 and parameters: {'learning_rate': 0.0028448146161153738, 'weight_decay': 0.00026362154807798996, 'batch_size': 16, 'oversample_method': 'smote', 'smote_ratio': 0.4927706033816848, 'resampling_k_neighbors': 3, 'cnn_channels': 16, 'cnn_kernel_size': 3, 'lstm_hidden_dim': 96, 'context_hidden_dim': 128, 'fusion_hidden_dim': 64, 'sequence_dropout': 0.1589361539849699, 'context_dropout': 0.3746827356413871, 'fusion_dropout': 0.38789461342560305}. Best is trial 17 with value: 0.8075693134180814.
2026-06-13 00:46:24,599 - preprocessing - INFO - xAPI engineered features created: ['engagement_score', 'absence_risk', 'parent_support_signal']
2026-06-13 00:46:24,601 - preprocessing - INFO - xAPI engineered features created: ['engagement_score', 'absence_risk', 'parent_support_signal']
2026-06-13 00:46:24,631 - preprocessing - INFO - Applying SMOTE on train set with ratio 0.5216076582958041...
2026-06-13 00:46:24,761 - preprocessing - INFO - Feature selection complete. Selected 15 / 19 features.
2026-06-13 00:46:29,458 - train_pipeline - INFO - Early stopping triggered at epoch 29
2026-06-13 00:46:29,475 - preprocessing - INFO - xAPI engineered features created: ['engagement_score', 'absence_risk', 'parent_support_signal']
2026-06-13 00:46:29,477 - preprocessing - INFO - xAPI engineered features created: ['engagement_score', 'absence_risk', 'parent_support_signal']
2026-06-13 00:46:29,496 - preprocessing - INFO - Applying SMOTE on train set with ratio 0.5216076582958041...
2026-06-13 00:46:29,617 - preprocessing - INFO - Feature selection complete. Selected 16 / 19 features.
2026-06-13 00:46:34,322 - train_pipeline - INFO - Early stopping triggered at epoch 29
2026-06-13 00:46:34,340 - preprocessing - INFO - xAPI engineered features created: ['engagement_score', 'absence_risk', 'parent_support_signal']
2026-06-13 00:46:34,342 - preprocessing - INFO - xAPI engineered features created: ['engagement_score', 'absence_risk', 'parent_support_signal']
2026-06-13 00:46:34,359 - preprocessing - INFO - Applying SMOTE on train set with ratio 0.5216076582958041...
2026-06-13 00:46:34,479 - preprocessing - INFO - Feature selection complete. Selected 18 / 19 features.
2026-06-13 00:46:41,345 - train_pipeline - INFO - Early stopping triggered at epoch 43
2026-06-13 00:46:41,362 - preprocessing - INFO - xAPI engineered features created: ['engagement_score', 'absence_risk', 'parent_support_signal']
2026-06-13 00:46:41,364 - preprocessing - INFO - xAPI engineered features created: ['engagement_score', 'absence_risk', 'parent_support_signal']
2026-06-13 00:46:41,382 - preprocessing - INFO - Applying SMOTE on train set with ratio 0.5216076582958041...
2026-06-13 00:46:41,503 - preprocessing - INFO - Feature selection complete. Selected 16 / 19 features.
2026-06-13 00:46:47,448 - train_pipeline - INFO - Early stopping triggered at epoch 35
2026-06-13 00:46:47,467 - preprocessing - INFO - xAPI engineered features created: ['engagement_score', 'absence_risk', 'parent_support_signal']
2026-06-13 00:46:47,469 - preprocessing - INFO - xAPI engineered features created: ['engagement_score', 'absence_risk', 'parent_support_signal']
2026-06-13 00:46:47,487 - preprocessing - INFO - Applying SMOTE on train set with ratio 0.5216076582958041...
2026-06-13 00:46:47,605 - preprocessing - INFO - Feature selection complete. Selected 18 / 19 features.
2026-06-13 00:46:53,045 - train_pipeline - INFO - Early stopping triggered at epoch 34
[I 2026-06-13 00:46:53,073] Trial 39 finished with value: 0.7880881102807674 and parameters: {'learning_rate': 0.002586889082511538, 'weight_decay': 5.828256431540801e-05, 'batch_size': 16, 'oversample_method': 'smote', 'smote_ratio': 0.5216076582958041, 'resampling_k_neighbors': 2, 'cnn_channels': 16, 'cnn_kernel_size': 3, 'lstm_hidden_dim': 96, 'context_hidden_dim': 128, 'fusion_hidden_dim': 64, 'sequence_dropout': 0.1337568329215508, 'context_dropout': 0.31495010399832346, 'fusion_dropout': 0.3710698790207194}. Best is trial 17 with value: 0.8075693134180814.
2026-06-13 00:46:53,187 - preprocessing - INFO - xAPI engineered features created: ['engagement_score', 'absence_risk', 'parent_support_signal']
2026-06-13 00:46:53,189 - preprocessing - INFO - xAPI engineered features created: ['engagement_score', 'absence_risk', 'parent_support_signal']
2026-06-13 00:46:53,206 - preprocessing - INFO - Applying ADASYN on train set with ratio 0.8429343814855088...
2026-06-13 00:46:53,220 - preprocessing - WARNING - ADASYN failed (likely too few samples). Error: No samples will be generated with the provided ratio settings.. Falling back to no oversampling.
2026-06-13 00:46:53,332 - preprocessing - INFO - Feature selection complete. Selected 15 / 19 features.
2026-06-13 00:46:55,407 - train_pipeline - INFO - Early stopping triggered at epoch 34
2026-06-13 00:46:55,425 - preprocessing - INFO - xAPI engineered features created: ['engagement_score', 'absence_risk', 'parent_support_signal']
2026-06-13 00:46:55,428 - preprocessing - INFO - xAPI engineered features created: ['engagement_score', 'absence_risk', 'parent_support_signal']
2026-06-13 00:46:55,446 - preprocessing - INFO - Applying ADASYN on train set with ratio 0.8429343814855088...
2026-06-13 00:46:55,461 - preprocessing - WARNING - ADASYN failed (likely too few samples). Error: No samples will be generated with the provided ratio settings.. Falling back to no oversampling.
2026-06-13 00:46:55,576 - preprocessing - INFO - Feature selection complete. Selected 16 / 19 features.
2026-06-13 00:47:01,271 - preprocessing - INFO - xAPI engineered features created: ['engagement_score', 'absence_risk', 'parent_support_signal']
2026-06-13 00:47:01,273 - preprocessing - INFO - xAPI engineered features created: ['engagement_score', 'absence_risk', 'parent_support_signal']
2026-06-13 00:47:01,290 - preprocessing - INFO - Applying ADASYN on train set with ratio 0.8429343814855088...
2026-06-13 00:47:01,304 - preprocessing - WARNING - ADASYN failed (likely too few samples). Error: No samples will be generated with the provided ratio settings.. Falling back to no oversampling.
2026-06-13 00:47:01,428 - preprocessing - INFO - Feature selection complete. Selected 18 / 19 features.
2026-06-13 00:47:04,635 - train_pipeline - INFO - Early stopping triggered at epoch 52
2026-06-13 00:47:04,652 - preprocessing - INFO - xAPI engineered features created: ['engagement_score', 'absence_risk', 'parent_support_signal']
2026-06-13 00:47:04,654 - preprocessing - INFO - xAPI engineered features created: ['engagement_score', 'absence_risk', 'parent_support_signal']
2026-06-13 00:47:04,672 - preprocessing - INFO - Applying ADASYN on train set with ratio 0.8429343814855088...
2026-06-13 00:47:04,686 - preprocessing - WARNING - ADASYN failed (likely too few samples). Error: No samples will be generated with the provided ratio settings.. Falling back to no oversampling.
2026-06-13 00:47:04,837 - preprocessing - INFO - Feature selection complete. Selected 16 / 19 features.
2026-06-13 00:47:08,230 - train_pipeline - INFO - Early stopping triggered at epoch 50
2026-06-13 00:47:08,249 - preprocessing - INFO - xAPI engineered features created: ['engagement_score', 'absence_risk', 'parent_support_signal']
2026-06-13 00:47:08,251 - preprocessing - INFO - xAPI engineered features created: ['engagement_score', 'absence_risk', 'parent_support_signal']
2026-06-13 00:47:08,268 - preprocessing - INFO - Applying ADASYN on train set with ratio 0.8429343814855088...
2026-06-13 00:47:08,282 - preprocessing - WARNING - ADASYN failed (likely too few samples). Error: No samples will be generated with the provided ratio settings.. Falling back to no oversampling.
2026-06-13 00:47:08,399 - preprocessing - INFO - Feature selection complete. Selected 18 / 19 features.
2026-06-13 00:47:12,152 - train_pipeline - INFO - Early stopping triggered at epoch 55
