2026-06-12 17:41:18,247 - run_pipeline - INFO - === Starting E2E Pipeline for xapi (3class) ===
2026-06-12 17:41:18,247 - run_pipeline - INFO - Starting Optuna optimization with 30 trials...
[I 2026-06-12 17:41:18,351] A new study created in memory with name: no-name-db1c0f32-9567-49bd-9a0a-d37e932c0722
2026-06-12 17:41:18,351 - preprocessing - INFO - xAPI engineered features created: ['engagement_score', 'absence_risk', 'parent_support_signal']
2026-06-12 17:41:18,351 - preprocessing - INFO - xAPI engineered features created: ['engagement_score', 'absence_risk', 'parent_support_signal']
2026-06-12 17:41:18,367 - preprocessing - INFO - Applying SMOTE on train set with ratio 0.4190721074726053...
2026-06-12 17:41:18,497 - preprocessing - INFO - Feature selection complete. Selected 15 / 19 features.
2026-06-12 17:41:33,308 - preprocessing - INFO - xAPI engineered features created: ['engagement_score', 'absence_risk', 'parent_support_signal']
2026-06-12 17:41:33,316 - preprocessing - INFO - xAPI engineered features created: ['engagement_score', 'absence_risk', 'parent_support_signal']
2026-06-12 17:41:33,322 - preprocessing - INFO - Applying SMOTE on train set with ratio 0.4190721074726053...
2026-06-12 17:41:33,468 - preprocessing - INFO - Feature selection complete. Selected 16 / 19 features.
[I 2026-06-12 17:41:42,064] Early stopping triggered at epoch 34
2026-06-12 17:41:42,071 - preprocessing - INFO - xAPI engineered features created: ['engagement_score', 'absence_risk', 'parent_support_signal']
2026-06-12 17:41:42,071 - preprocessing - INFO - xAPI engineered features created: ['engagement_score', 'absence_risk', 'parent_support_signal']
2026-06-12 17:41:42,091 - preprocessing - INFO - Applying SMOTE on train set with ratio 0.4190721074726053...
2026-06-12 17:41:42,209 - preprocessing - INFO - Feature selection complete. Selected 18 / 19 features.
[I 2026-06-12 17:41:52,762] Early stopping triggered at epoch 38
2026-06-12 17:41:52,763 - preprocessing - INFO - xAPI engineered features created: ['engagement_score', 'absence_risk', 'parent_support_signal']
2026-06-12 17:41:52,763 - preprocessing - INFO - xAPI engineered features created: ['engagement_score', 'absence_risk', 'parent_support_signal']
2026-06-12 17:41:52,782 - preprocessing - INFO - Applying SMOTE on train set with ratio 0.4190721074726053...
2026-06-12 17:41:52,907 - preprocessing - INFO - Feature selection complete. Selected 16 / 19 features.
[I 2026-06-12 17:41:59,268] Early stopping triggered at epoch 24
2026-06-12 17:41:59,275 - preprocessing - INFO - xAPI engineered features created: ['engagement_score', 'absence_risk', 'parent_support_signal']
2026-06-12 17:41:59,275 - preprocessing - INFO - xAPI engineered features created: ['engagement_score', 'absence_risk', 'parent_support_signal']
2026-06-12 17:41:59,296 - preprocessing - INFO - Applying SMOTE on train set with ratio 0.4190721074726053...
2026-06-12 17:41:59,430 - preprocessing - INFO - Feature selection complete. Selected 18 / 19 features.
[I 2026-06-12 17:42:09,364] Early stopping triggered at epoch 36
[I 2026-06-12 17:42:09,366] Trial 0 finished with value: 0.8012617082366521 and parameters: {'learning_rate': 0.002958594248396769, 'weight_decay': 0.0009336558238410763, 'dropout': 0.3093558354184839, 'batch_size': 16, 'lambda_ordinal': 0.34920713801634873, 'oversample_method': 'smote', 'smote_ratio': 0.4190721074726053, 'context_architecture': 'deepfm', 'sequence_architecture': 'dsc_bilstm_attention', 'fm_embedding_dim': 32, 'dcn_cross_layers': 2, 'context_hidden_dim': 128, 'sequence_hidden_dim': 64, 'fusion_hidden_dim': 64}. Best is trial 0 with value: 0.8012617082366521.
2026-06-12 17:42:09,370 - preprocessing - INFO - xAPI engineered features created: ['engagement_score', 'absence_risk', 'parent_support_signal']
2026-06-12 17:42:09,370 - preprocessing - INFO - xAPI engineered features created: ['engagement_score', 'absence_risk', 'parent_support_signal']
2026-06-12 17:42:09,516 - preprocessing - INFO - Feature selection complete. Selected 15 / 19 features.
[I 2026-06-12 17:42:15,377] Early stopping triggered at epoch 40
2026-06-12 17:42:15,387 - preprocessing - INFO - xAPI engineered features created: ['engagement_score', 'absence_risk', 'parent_support_signal']
2026-06-12 17:42:15,389 - preprocessing - INFO - xAPI engineered features created: ['engagement_score', 'absence_risk', 'parent_support_signal']
2026-06-12 17:42:15,524 - preprocessing - INFO - Feature selection complete. Selected 16 / 19 features.
[I 2026-06-12 17:42:19,875] Early stopping triggered at epoch 28
2026-06-12 17:42:19,875 - preprocessing - INFO - xAPI engineered features created: ['engagement_score', 'absence_risk', 'parent_support_signal']
2026-06-12 17:42:19,875 - preprocessing - INFO - xAPI engineered features created: ['engagement_score', 'absence_risk', 'parent_support_signal']
2026-06-12 17:42:20,032 - preprocessing - INFO - Feature selection complete. Selected 18 / 19 features.
[I 2026-06-12 17:42:25,070] Early stopping triggered at epoch 32
2026-06-12 17:42:25,077 - preprocessing - INFO - xAPI engineered features created: ['engagement_score', 'absence_risk', 'parent_support_signal']
2026-06-12 17:42:25,077 - preprocessing - INFO - xAPI engineered features created: ['engagement_score', 'absence_risk', 'parent_support_signal']
2026-06-12 17:42:25,221 - preprocessing - INFO - Feature selection complete. Selected 16 / 19 features.
[I 2026-06-12 17:42:29,460] Early stopping triggered at epoch 29
2026-06-12 17:42:29,460 - preprocessing - INFO - xAPI engineered features created: ['engagement_score', 'absence_risk', 'parent_support_signal']
2026-06-12 17:42:29,460 - preprocessing - INFO - xAPI engineered features created: ['engagement_score', 'absence_risk', 'parent_support_signal']
2026-06-12 17:42:29,620 - preprocessing - INFO - Feature selection complete. Selected 18 / 19 features.
[I 2026-06-12 17:42:36,435] Early stopping triggered at epoch 45
[I 2026-06-12 17:42:36,435] Trial 1 finished with value: 0.7790410253529754 and parameters: {'learning_rate': 0.0007549172633527554, 'weight_decay': 0.0006871762126104753, 'dropout': 0.32050786935065123, 'batch_size': 32, 'lambda_ordinal': 0.37725275400261354, 'oversample_method': 'none', 'focal_gamma': 1.196291559358227, 'context_architecture': 'dcnv2', 'sequence_architecture': 'dsc_bilstm_attention', 'fm_embedding_dim': 32, 'dcn_cross_layers': 2, 'context_hidden_dim': 128, 'sequence_hidden_dim': 64, 'fusion_hidden_dim': 64}. Best is trial 0 with value: 0.8012617082366521.
2026-06-12 17:42:36,435 - preprocessing - INFO - xAPI engineered features created: ['engagement_score', 'absence_risk', 'parent_support_signal']
2026-06-12 17:42:36,447 - preprocessing - INFO - xAPI engineered features created: ['engagement_score', 'absence_risk', 'parent_support_signal']
2026-06-12 17:42:36,460 - preprocessing - INFO - Applying SMOTE on train set with ratio 0.7267349655124912...
2026-06-12 17:42:38,085 - preprocessing - INFO - Feature selection complete. Selected 16 / 19 features.
[I 2026-06-12 17:42:46,581] Early stopping triggered at epoch 35
2026-06-12 17:42:46,581 - preprocessing - INFO - xAPI engineered features created: ['engagement_score', 'absence_risk', 'parent_support_signal']
2026-06-12 17:42:46,581 - preprocessing - INFO - xAPI engineered features created: ['engagement_score', 'absence_risk', 'parent_support_signal']
2026-06-12 17:42:46,613 - preprocessing - INFO - Applying SMOTE on train set with ratio 0.7267349655124912...
2026-06-12 17:42:46,743 - preprocessing - INFO - Feature selection complete. Selected 16 / 19 features.
2026-06-12 17:42:59,243 - preprocessing - INFO - xAPI engineered features created: ['engagement_score', 'absence_risk', 'parent_support_signal']
2026-06-12 17:42:59,243 - preprocessing - INFO - xAPI engineered features created: ['engagement_score', 'absence_risk', 'parent_support_signal']
2026-06-12 17:42:59,264 - preprocessing - INFO - Applying SMOTE on train set with ratio 0.7267349655124912...
2026-06-12 17:42:59,390 - preprocessing - INFO - Feature selection complete. Selected 18 / 19 features.
[I 2026-06-12 17:43:05,827] Early stopping triggered at epoch 25
2026-06-12 17:43:05,827 - preprocessing - INFO - xAPI engineered features created: ['engagement_score', 'absence_risk', 'parent_support_signal']
2026-06-12 17:43:05,842 - preprocessing - INFO - xAPI engineered features created: ['engagement_score', 'absence_risk', 'parent_support_signal']
2026-06-12 17:43:05,854 - preprocessing - INFO - Applying SMOTE on train set with ratio 0.7267349655124912...
2026-06-12 17:43:05,986 - preprocessing - INFO - Feature selection complete. Selected 17 / 19 features.
[I 2026-06-12 17:43:18,212] Early stopping triggered at epoch 49
2026-06-12 17:43:18,212 - preprocessing - INFO - xAPI engineered features created: ['engagement_score', 'absence_risk', 'parent_support_signal']
2026-06-12 17:43:18,212 - preprocessing - INFO - xAPI engineered features created: ['engagement_score', 'absence_risk', 'parent_support_signal']
2026-06-12 17:43:18,245 - preprocessing - INFO - Applying SMOTE on train set with ratio 0.7267349655124912...
2026-06-12 17:43:18,388 - preprocessing - INFO - Feature selection complete. Selected 18 / 19 features.
[I 2026-06-12 17:43:29,104] Early stopping triggered at epoch 41
[I 2026-06-12 17:43:29,107] Trial 2 finished with value: 0.7716004914542899 and parameters: {'learning_rate': 0.0012485776426996843, 'weight_decay': 0.00020504949890608944, 'dropout': 0.21945965661824296, 'batch_size': 16, 'lambda_ordinal': 0.1250040249866427, 'oversample_method': 'smote', 'smote_ratio': 0.7267349655124912, 'context_architecture': 'deepfm', 'sequence_architecture': 'dsc_bilstm_attention', 'fm_embedding_dim': 8, 'dcn_cross_layers': 1, 'context_hidden_dim': 32, 'sequence_hidden_dim': 32, 'fusion_hidden_dim': 64}. Best is trial 0 with value: 0.8012617082366521.
2026-06-12 17:43:29,113 - preprocessing - INFO - xAPI engineered features created: ['engagement_score', 'absence_risk', 'parent_support_signal']
2026-06-12 17:43:29,115 - preprocessing - INFO - xAPI engineered features created: ['engagement_score', 'absence_risk', 'parent_support_signal']
2026-06-12 17:43:29,138 - preprocessing - INFO - Applying SMOTE on train set with ratio 0.5472080658772963...
2026-06-12 17:43:29,294 - preprocessing - INFO - Feature selection complete. Selected 15 / 19 features.
[I 2026-06-12 17:43:31,927] Early stopping triggered at epoch 42
2026-06-12 17:43:31,943 - preprocessing - INFO - xAPI engineered features created: ['engagement_score', 'absence_risk', 'parent_support_signal']
2026-06-12 17:43:31,943 - preprocessing - INFO - xAPI engineered features created: ['engagement_score', 'absence_risk', 'parent_support_signal']
2026-06-12 17:43:31,959 - preprocessing - INFO - Applying SMOTE on train set with ratio 0.5472080658772963...
2026-06-12 17:43:32,092 - preprocessing - INFO - Feature selection complete. Selected 16 / 19 features.
[I 2026-06-12 17:43:34,999] Early stopping triggered at epoch 47
2026-06-12 17:43:34,999 - preprocessing - INFO - xAPI engineered features created: ['engagement_score', 'absence_risk', 'parent_support_signal']
2026-06-12 17:43:34,999 - preprocessing - INFO - xAPI engineered features created: ['engagement_score', 'absence_risk', 'parent_support_signal']
2026-06-12 17:43:35,014 - preprocessing - INFO - Applying SMOTE on train set with ratio 0.5472080658772963...
2026-06-12 17:43:35,158 - preprocessing - INFO - Feature selection complete. Selected 18 / 19 features.
[I 2026-06-12 17:43:37,395] Early stopping triggered at epoch 36
2026-06-12 17:43:37,395 - preprocessing - INFO - xAPI engineered features created: ['engagement_score', 'absence_risk', 'parent_support_signal']
2026-06-12 17:43:37,407 - preprocessing - INFO - xAPI engineered features created: ['engagement_score', 'absence_risk', 'parent_support_signal']
2026-06-12 17:43:37,413 - preprocessing - INFO - Applying SMOTE on train set with ratio 0.5472080658772963...
2026-06-12 17:43:37,559 - preprocessing - INFO - Feature selection complete. Selected 16 / 19 features.
2026-06-12 17:43:40,715 - preprocessing - INFO - xAPI engineered features created: ['engagement_score', 'absence_risk', 'parent_support_signal']
2026-06-12 17:43:40,715 - preprocessing - INFO - xAPI engineered features created: ['engagement_score', 'absence_risk', 'parent_support_signal']
2026-06-12 17:43:40,736 - preprocessing - INFO - Applying SMOTE on train set with ratio 0.5472080658772963...
2026-06-12 17:43:40,868 - preprocessing - INFO - Feature selection complete. Selected 18 / 19 features.
[I 2026-06-12 17:43:42,880] Early stopping triggered at epoch 32
[I 2026-06-12 17:43:42,880] Trial 3 finished with value: 0.7511646284950722 and parameters: {'learning_rate': 0.00011487173650858298, 'weight_decay': 0.00018709258776771322, 'dropout': 0.17403340737199308, 'batch_size': 64, 'lambda_ordinal': 0.4917181113893311, 'oversample_method': 'smote', 'smote_ratio': 0.5472080658772963, 'context_architecture': 'mlp_baseline', 'sequence_architecture': 'dsc_bilstm_attention', 'fm_embedding_dim': 32, 'dcn_cross_layers': 2, 'context_hidden_dim': 128, 'sequence_hidden_dim': 32, 'fusion_hidden_dim': 128}. Best is trial 0 with value: 0.8012617082366521.
2026-06-12 17:43:42,895 - preprocessing - INFO - xAPI engineered features created: ['engagement_score', 'absence_risk', 'parent_support_signal']
2026-06-12 17:43:42,895 - preprocessing - INFO - xAPI engineered features created: ['engagement_score', 'absence_risk', 'parent_support_signal']
2026-06-12 17:43:42,914 - preprocessing - INFO - Applying SMOTE on train set with ratio 0.627323309862269...
2026-06-12 17:43:43,055 - preprocessing - INFO - Feature selection complete. Selected 15 / 19 features.
[I 2026-06-12 17:43:44,836] Early stopping triggered at epoch 31
2026-06-12 17:43:44,843 - preprocessing - INFO - xAPI engineered features created: ['engagement_score', 'absence_risk', 'parent_support_signal']
2026-06-12 17:43:44,843 - preprocessing - INFO - xAPI engineered features created: ['engagement_score', 'absence_risk', 'parent_support_signal']
2026-06-12 17:43:44,864 - preprocessing - INFO - Applying SMOTE on train set with ratio 0.627323309862269...
2026-06-12 17:43:45,000 - preprocessing - INFO - Feature selection complete. Selected 16 / 19 features.
[I 2026-06-12 17:43:46,903] Early stopping triggered at epoch 32
2026-06-12 17:43:46,903 - preprocessing - INFO - xAPI engineered features created: ['engagement_score', 'absence_risk', 'parent_support_signal']
2026-06-12 17:43:46,918 - preprocessing - INFO - xAPI engineered features created: ['engagement_score', 'absence_risk', 'parent_support_signal']
2026-06-12 17:43:46,938 - preprocessing - INFO - Applying SMOTE on train set with ratio 0.627323309862269...
2026-06-12 17:43:47,085 - preprocessing - INFO - Feature selection complete. Selected 18 / 19 features.
[I 2026-06-12 17:43:49,314] Early stopping triggered at epoch 37
2026-06-12 17:43:49,318 - preprocessing - INFO - xAPI engineered features created: ['engagement_score', 'absence_risk', 'parent_support_signal']
2026-06-12 17:43:49,319 - preprocessing - INFO - xAPI engineered features created: ['engagement_score', 'absence_risk', 'parent_support_signal']
2026-06-12 17:43:49,324 - preprocessing - INFO - Applying SMOTE on train set with ratio 0.627323309862269...
2026-06-12 17:43:49,456 - preprocessing - INFO - Feature selection complete. Selected 16 / 19 features.
[I 2026-06-12 17:43:51,762] Early stopping triggered at epoch 40
2026-06-12 17:43:51,766 - preprocessing - INFO - xAPI engineered features created: ['engagement_score', 'absence_risk', 'parent_support_signal']
2026-06-12 17:43:51,766 - preprocessing - INFO - xAPI engineered features created: ['engagement_score', 'absence_risk', 'parent_support_signal']
2026-06-12 17:43:51,787 - preprocessing - INFO - Applying SMOTE on train set with ratio 0.627323309862269...
2026-06-12 17:43:51,922 - preprocessing - INFO - Feature selection complete. Selected 18 / 19 features.
[I 2026-06-12 17:43:54,985] Trial 4 finished with value: 0.762738551220835 and parameters: {'learning_rate': 0.0012355123141526503, 'weight_decay': 0.00013565904234688115, 'dropout': 0.3724680521124287, 'batch_size': 64, 'lambda_ordinal': 0.3319772291547794, 'oversample_method': 'smote', 'smote_ratio': 0.627323309862269, 'context_architecture': 'mlp_baseline', 'sequence_architecture': 'dsc_bilstm_attention', 'fm_embedding_dim': 32, 'dcn_cross_layers': 2, 'context_hidden_dim': 32, 'sequence_hidden_dim': 32, 'fusion_hidden_dim': 128}. Best is trial 0 with value: 0.8012617082366521.
2026-06-12 17:43:54,985 - preprocessing - INFO - xAPI engineered features created: ['engagement_score', 'absence_risk', 'parent_support_signal']
2026-06-12 17:43:55,001 - preprocessing - INFO - xAPI engineered features created: ['engagement_score', 'absence_risk', 'parent_support_signal']
2026-06-12 17:43:55,013 - preprocessing - INFO - Applying ADASYN on train set with ratio 0.6191364637342265...
2026-06-12 17:43:55,027 - preprocessing - WARNING - ADASYN failed (likely too few samples). Error: No samples will be generated with the provided ratio settings.. Falling back to no oversampling.
2026-06-12 17:43:55,159 - preprocessing - INFO - Feature selection complete. Selected 15 / 19 features.
[I 2026-06-12 17:44:03,435] Early stopping triggered at epoch 33
2026-06-12 17:44:03,442 - preprocessing - INFO - xAPI engineered features created: ['engagement_score', 'absence_risk', 'parent_support_signal']
2026-06-12 17:44:03,442 - preprocessing - INFO - xAPI engineered features created: ['engagement_score', 'absence_risk', 'parent_support_signal']
2026-06-12 17:44:03,456 - preprocessing - INFO - Applying ADASYN on train set with ratio 0.6191364637342265...
2026-06-12 17:44:03,472 - preprocessing - WARNING - ADASYN failed (likely too few samples). Error: No samples will be generated with the provided ratio settings.. Falling back to no oversampling.
2026-06-12 17:44:03,602 - preprocessing - INFO - Feature selection complete. Selected 16 / 19 features.
[I 2026-06-12 17:44:14,202] Early stopping triggered at epoch 42
2026-06-12 17:44:14,206 - preprocessing - INFO - xAPI engineered features created: ['engagement_score', 'absence_risk', 'parent_support_signal']
2026-06-12 17:44:14,210 - preprocessing - INFO - xAPI engineered features created: ['engagement_score', 'absence_risk', 'parent_support_signal']
2026-06-12 17:44:14,216 - preprocessing - INFO - Applying ADASYN on train set with ratio 0.6191364637342265...
2026-06-12 17:44:14,232 - preprocessing - WARNING - ADASYN failed (likely too few samples). Error: No samples will be generated with the provided ratio settings.. Falling back to no oversampling.
2026-06-12 17:44:14,355 - preprocessing - INFO - Feature selection complete. Selected 18 / 19 features.
[I 2026-06-12 17:44:24,082] Early stopping triggered at epoch 37
2026-06-12 17:44:24,082 - preprocessing - INFO - xAPI engineered features created: ['engagement_score', 'absence_risk', 'parent_support_signal']
2026-06-12 17:44:24,082 - preprocessing - INFO - xAPI engineered features created: ['engagement_score', 'absence_risk', 'parent_support_signal']
2026-06-12 17:44:24,109 - preprocessing - INFO - Applying ADASYN on train set with ratio 0.6191364637342265...
2026-06-12 17:44:24,116 - preprocessing - WARNING - ADASYN failed (likely too few samples). Error: No samples will be generated with the provided ratio settings.. Falling back to no oversampling.
2026-06-12 17:44:24,254 - preprocessing - INFO - Feature selection complete. Selected 16 / 19 features.
[I 2026-06-12 17:44:34,966] Early stopping triggered at epoch 42
2026-06-12 17:44:34,973 - preprocessing - INFO - xAPI engineered features created: ['engagement_score', 'absence_risk', 'parent_support_signal']
2026-06-12 17:44:34,973 - preprocessing - INFO - xAPI engineered features created: ['engagement_score', 'absence_risk', 'parent_support_signal']
2026-06-12 17:44:35,005 - preprocessing - INFO - Applying ADASYN on train set with ratio 0.6191364637342265...
2026-06-12 17:44:35,015 - preprocessing - WARNING - ADASYN failed (likely too few samples). Error: No samples will be generated with the provided ratio settings.. Falling back to no oversampling.
2026-06-12 17:44:35,153 - preprocessing - INFO - Feature selection complete. Selected 18 / 19 features.
[I 2026-06-12 17:44:44,979] Early stopping triggered at epoch 36
