[I 2026-06-13 00:39:47,328] Trial 29 finished with value: 0.778452713215721 and parameters: {'learning_rate': 0.01455388066032334, 'weight_decay': 0.000277900065515667, 'batch_size': 8, 'oversample_method': 'adasyn', 'smote_ratio': 0.6251553531988592, 'resampling_k_neighbors': 7, 'cnn_channels': 128, 'cnn_kernel_size': 3, 'lstm_hidden_dim': 64, 'context_hidden_dim': 32, 'fusion_hidden_dim': 128, 'sequence_dropout': 0.367516881447867, 'context_dropout': 0.3467697821894901, 'fusion_dropout': 0.4490933174293068}. Best is trial 17 with value: 0.8075693134180814.
2026-06-13 00:39:47,441 - preprocessing - INFO - xAPI engineered features created: ['engagement_score', 'absence_risk', 'parent_support_signal']
2026-06-13 00:39:47,443 - preprocessing - INFO - xAPI engineered features created: ['engagement_score', 'absence_risk', 'parent_support_signal']
2026-06-13 00:39:47,460 - preprocessing - INFO - Applying SMOTE on train set with ratio 0.5461853093200721...
2026-06-13 00:39:47,575 - preprocessing - INFO - Feature selection complete. Selected 15 / 19 features.
2026-06-13 00:39:49,684 - train_pipeline - INFO - Early stopping triggered at epoch 36
2026-06-13 00:39:49,702 - preprocessing - INFO - xAPI engineered features created: ['engagement_score', 'absence_risk', 'parent_support_signal']
2026-06-13 00:39:49,704 - preprocessing - INFO - xAPI engineered features created: ['engagement_score', 'absence_risk', 'parent_support_signal']
2026-06-13 00:39:49,721 - preprocessing - INFO - Applying SMOTE on train set with ratio 0.5461853093200721...
2026-06-13 00:39:49,840 - preprocessing - INFO - Feature selection complete. Selected 16 / 19 features.
2026-06-13 00:39:51,936 - train_pipeline - INFO - Early stopping triggered at epoch 36
2026-06-13 00:39:51,954 - preprocessing - INFO - xAPI engineered features created: ['engagement_score', 'absence_risk', 'parent_support_signal']
2026-06-13 00:39:51,956 - preprocessing - INFO - xAPI engineered features created: ['engagement_score', 'absence_risk', 'parent_support_signal']
2026-06-13 00:39:51,975 - preprocessing - INFO - Applying SMOTE on train set with ratio 0.5461853093200721...
2026-06-13 00:39:52,090 - preprocessing - INFO - Feature selection complete. Selected 18 / 19 features.
2026-06-13 00:39:54,031 - train_pipeline - INFO - Early stopping triggered at epoch 33
2026-06-13 00:39:54,049 - preprocessing - INFO - xAPI engineered features created: ['engagement_score', 'absence_risk', 'parent_support_signal']
2026-06-13 00:39:54,052 - preprocessing - INFO - xAPI engineered features created: ['engagement_score', 'absence_risk', 'parent_support_signal']
2026-06-13 00:39:54,070 - preprocessing - INFO - Applying SMOTE on train set with ratio 0.5461853093200721...
2026-06-13 00:39:54,190 - preprocessing - INFO - Feature selection complete. Selected 16 / 19 features.
2026-06-13 00:39:56,586 - train_pipeline - INFO - Early stopping triggered at epoch 41
2026-06-13 00:39:56,603 - preprocessing - INFO - xAPI engineered features created: ['engagement_score', 'absence_risk', 'parent_support_signal']
2026-06-13 00:39:56,606 - preprocessing - INFO - xAPI engineered features created: ['engagement_score', 'absence_risk', 'parent_support_signal']
2026-06-13 00:39:56,624 - preprocessing - INFO - Applying SMOTE on train set with ratio 0.5461853093200721...
2026-06-13 00:39:56,740 - preprocessing - INFO - Feature selection complete. Selected 18 / 19 features.
2026-06-13 00:40:00,731 - train_pipeline - INFO - Early stopping triggered at epoch 61
[I 2026-06-13 00:40:00,768] Trial 30 finished with value: 0.7990886721309003 and parameters: {'learning_rate': 0.004883864739978694, 'weight_decay': 0.0004748146677209802, 'batch_size': 64, 'oversample_method': 'smote', 'smote_ratio': 0.5461853093200721, 'resampling_k_neighbors': 5, 'cnn_channels': 64, 'cnn_kernel_size': 3, 'lstm_hidden_dim': 128, 'context_hidden_dim': 128, 'fusion_hidden_dim': 256, 'sequence_dropout': 0.3152808564220428, 'context_dropout': 0.28598615145216794, 'fusion_dropout': 0.4156550971845625}. Best is trial 17 with value: 0.8075693134180814.
2026-06-13 00:40:00,920 - preprocessing - INFO - xAPI engineered features created: ['engagement_score', 'absence_risk', 'parent_support_signal']
2026-06-13 00:40:00,925 - preprocessing - INFO - xAPI engineered features created: ['engagement_score', 'absence_risk', 'parent_support_signal']
2026-06-13 00:40:00,953 - preprocessing - INFO - Applying SMOTE on train set with ratio 0.4620524121847081...
2026-06-13 00:40:01,107 - preprocessing - INFO - Feature selection complete. Selected 15 / 19 features.
2026-06-13 00:40:08,492 - train_pipeline - INFO - Early stopping triggered at epoch 73
2026-06-13 00:40:08,509 - preprocessing - INFO - xAPI engineered features created: ['engagement_score', 'absence_risk', 'parent_support_signal']
2026-06-13 00:40:08,511 - preprocessing - INFO - xAPI engineered features created: ['engagement_score', 'absence_risk', 'parent_support_signal']
2026-06-13 00:40:08,529 - preprocessing - INFO - Applying SMOTE on train set with ratio 0.4620524121847081...
2026-06-13 00:40:08,649 - preprocessing - INFO - Feature selection complete. Selected 16 / 19 features.
2026-06-13 00:40:15,856 - train_pipeline - INFO - Early stopping triggered at epoch 73
2026-06-13 00:40:15,881 - preprocessing - INFO - xAPI engineered features created: ['engagement_score', 'absence_risk', 'parent_support_signal']
2026-06-13 00:40:15,883 - preprocessing - INFO - xAPI engineered features created: ['engagement_score', 'absence_risk', 'parent_support_signal']
2026-06-13 00:40:15,909 - preprocessing - INFO - Applying SMOTE on train set with ratio 0.4620524121847081...
2026-06-13 00:40:16,088 - preprocessing - INFO - Feature selection complete. Selected 18 / 19 features.
2026-06-13 00:40:18,902 - train_pipeline - INFO - Early stopping triggered at epoch 27
2026-06-13 00:40:18,921 - preprocessing - INFO - xAPI engineered features created: ['engagement_score', 'absence_risk', 'parent_support_signal']
2026-06-13 00:40:18,923 - preprocessing - INFO - xAPI engineered features created: ['engagement_score', 'absence_risk', 'parent_support_signal']
2026-06-13 00:40:18,940 - preprocessing - INFO - Applying SMOTE on train set with ratio 0.4620524121847081...
2026-06-13 00:40:19,060 - preprocessing - INFO - Feature selection complete. Selected 16 / 19 features.
2026-06-13 00:40:22,460 - train_pipeline - INFO - Early stopping triggered at epoch 34
2026-06-13 00:40:22,486 - preprocessing - INFO - xAPI engineered features created: ['engagement_score', 'absence_risk', 'parent_support_signal']
2026-06-13 00:40:22,489 - preprocessing - INFO - xAPI engineered features created: ['engagement_score', 'absence_risk', 'parent_support_signal']
2026-06-13 00:40:22,512 - preprocessing - INFO - Applying SMOTE on train set with ratio 0.4620524121847081...
2026-06-13 00:40:22,685 - preprocessing - INFO - Feature selection complete. Selected 18 / 19 features.
2026-06-13 00:40:27,180 - train_pipeline - INFO - Early stopping triggered at epoch 42
[I 2026-06-13 00:40:27,208] Trial 31 finished with value: 0.7990875998683512 and parameters: {'learning_rate': 0.0037224497477125135, 'weight_decay': 0.003632729639728755, 'batch_size': 32, 'oversample_method': 'smote', 'smote_ratio': 0.4620524121847081, 'resampling_k_neighbors': 3, 'cnn_channels': 16, 'cnn_kernel_size': 2, 'lstm_hidden_dim': 128, 'context_hidden_dim': 128, 'fusion_hidden_dim': 128, 'sequence_dropout': 0.19766274645382953, 'context_dropout': 0.3538484912582317, 'fusion_dropout': 0.30796218760397065}. Best is trial 17 with value: 0.8075693134180814.
2026-06-13 00:40:27,323 - preprocessing - INFO - xAPI engineered features created: ['engagement_score', 'absence_risk', 'parent_support_signal']
2026-06-13 00:40:27,327 - preprocessing - INFO - xAPI engineered features created: ['engagement_score', 'absence_risk', 'parent_support_signal']
2026-06-13 00:40:27,344 - preprocessing - INFO - Applying SMOTE on train set with ratio 0.4850986058841199...
2026-06-13 00:40:27,461 - preprocessing - INFO - Feature selection complete. Selected 15 / 19 features.
2026-06-13 00:40:39,765 - train_pipeline - INFO - Early stopping triggered at epoch 38
2026-06-13 00:40:39,782 - preprocessing - INFO - xAPI engineered features created: ['engagement_score', 'absence_risk', 'parent_support_signal']
2026-06-13 00:40:39,786 - preprocessing - INFO - xAPI engineered features created: ['engagement_score', 'absence_risk', 'parent_support_signal']
2026-06-13 00:40:39,803 - preprocessing - INFO - Applying SMOTE on train set with ratio 0.4850986058841199...
2026-06-13 00:40:39,919 - preprocessing - INFO - Feature selection complete. Selected 16 / 19 features.
2026-06-13 00:40:49,210 - train_pipeline - INFO - Early stopping triggered at epoch 28
2026-06-13 00:40:49,228 - preprocessing - INFO - xAPI engineered features created: ['engagement_score', 'absence_risk', 'parent_support_signal']
2026-06-13 00:40:49,231 - preprocessing - INFO - xAPI engineered features created: ['engagement_score', 'absence_risk', 'parent_support_signal']
2026-06-13 00:40:49,248 - preprocessing - INFO - Applying SMOTE on train set with ratio 0.4850986058841199...
2026-06-13 00:40:49,368 - preprocessing - INFO - Feature selection complete. Selected 18 / 19 features.
2026-06-13 00:41:01,801 - train_pipeline - INFO - Early stopping triggered at epoch 38
2026-06-13 00:41:01,820 - preprocessing - INFO - xAPI engineered features created: ['engagement_score', 'absence_risk', 'parent_support_signal']
2026-06-13 00:41:01,822 - preprocessing - INFO - xAPI engineered features created: ['engagement_score', 'absence_risk', 'parent_support_signal']
2026-06-13 00:41:01,840 - preprocessing - INFO - Applying SMOTE on train set with ratio 0.4850986058841199...
2026-06-13 00:41:01,958 - preprocessing - INFO - Feature selection complete. Selected 16 / 19 features.
2026-06-13 00:41:14,617 - train_pipeline - INFO - Early stopping triggered at epoch 39
2026-06-13 00:41:14,640 - preprocessing - INFO - xAPI engineered features created: ['engagement_score', 'absence_risk', 'parent_support_signal']
2026-06-13 00:41:14,642 - preprocessing - INFO - xAPI engineered features created: ['engagement_score', 'absence_risk', 'parent_support_signal']
2026-06-13 00:41:14,660 - preprocessing - INFO - Applying SMOTE on train set with ratio 0.4850986058841199...
2026-06-13 00:41:14,777 - preprocessing - INFO - Feature selection complete. Selected 18 / 19 features.
2026-06-13 00:41:40,859 - train_pipeline - INFO - Early stopping triggered at epoch 69
[I 2026-06-13 00:41:40,888] Trial 32 finished with value: 0.79567028417007 and parameters: {'learning_rate': 0.0018983849004937149, 'weight_decay': 0.00022658582377605357, 'batch_size': 8, 'oversample_method': 'smote', 'smote_ratio': 0.4850986058841199, 'resampling_k_neighbors': 3, 'cnn_channels': 64, 'cnn_kernel_size': 3, 'lstm_hidden_dim': 128, 'context_hidden_dim': 128, 'fusion_hidden_dim': 128, 'sequence_dropout': 0.16784162649707812, 'context_dropout': 0.2809976724191859, 'fusion_dropout': 0.27719936159895464}. Best is trial 17 with value: 0.8075693134180814.
2026-06-13 00:41:41,011 - preprocessing - INFO - xAPI engineered features created: ['engagement_score', 'absence_risk', 'parent_support_signal']
2026-06-13 00:41:41,014 - preprocessing - INFO - xAPI engineered features created: ['engagement_score', 'absence_risk', 'parent_support_signal']
2026-06-13 00:41:41,031 - preprocessing - INFO - Applying ADASYN on train set with ratio 0.8109010562887264...
2026-06-13 00:41:41,047 - preprocessing - WARNING - ADASYN failed (likely too few samples). Error: No samples will be generated with the provided ratio settings.. Falling back to no oversampling.
2026-06-13 00:41:41,164 - preprocessing - INFO - Feature selection complete. Selected 15 / 19 features.
2026-06-13 00:41:47,628 - train_pipeline - INFO - Early stopping triggered at epoch 32
2026-06-13 00:41:47,647 - preprocessing - INFO - xAPI engineered features created: ['engagement_score', 'absence_risk', 'parent_support_signal']
2026-06-13 00:41:47,650 - preprocessing - INFO - xAPI engineered features created: ['engagement_score', 'absence_risk', 'parent_support_signal']
2026-06-13 00:41:47,678 - preprocessing - INFO - Applying ADASYN on train set with ratio 0.8109010562887264...
2026-06-13 00:41:47,707 - preprocessing - WARNING - ADASYN failed (likely too few samples). Error: No samples will be generated with the provided ratio settings.. Falling back to no oversampling.
2026-06-13 00:41:47,923 - preprocessing - INFO - Feature selection complete. Selected 16 / 19 features.
2026-06-13 00:41:55,349 - train_pipeline - INFO - Early stopping triggered at epoch 32
2026-06-13 00:41:55,368 - preprocessing - INFO - xAPI engineered features created: ['engagement_score', 'absence_risk', 'parent_support_signal']
2026-06-13 00:41:55,371 - preprocessing - INFO - xAPI engineered features created: ['engagement_score', 'absence_risk', 'parent_support_signal']
2026-06-13 00:41:55,392 - preprocessing - INFO - Applying ADASYN on train set with ratio 0.8109010562887264...
2026-06-13 00:41:55,410 - preprocessing - WARNING - ADASYN failed (likely too few samples). Error: No samples will be generated with the provided ratio settings.. Falling back to no oversampling.
2026-06-13 00:41:55,566 - preprocessing - INFO - Feature selection complete. Selected 18 / 19 features.
2026-06-13 00:42:01,397 - train_pipeline - INFO - Early stopping triggered at epoch 28
[I 2026-06-13 00:42:01,422] Trial 33 pruned. 
2026-06-13 00:42:01,543 - preprocessing - INFO - xAPI engineered features created: ['engagement_score', 'absence_risk', 'parent_support_signal']
2026-06-13 00:42:01,547 - preprocessing - INFO - xAPI engineered features created: ['engagement_score', 'absence_risk', 'parent_support_signal']
2026-06-13 00:42:01,565 - preprocessing - INFO - Applying SMOTE on train set with ratio 0.30466878765059147...
2026-06-13 00:42:01,691 - preprocessing - INFO - Feature selection complete. Selected 15 / 19 features.
2026-06-13 00:42:21,647 - train_pipeline - INFO - Early stopping triggered at epoch 52
2026-06-13 00:42:21,674 - preprocessing - INFO - xAPI engineered features created: ['engagement_score', 'absence_risk', 'parent_support_signal']
2026-06-13 00:42:21,681 - preprocessing - INFO - xAPI engineered features created: ['engagement_score', 'absence_risk', 'parent_support_signal']
2026-06-13 00:42:21,712 - preprocessing - INFO - Applying SMOTE on train set with ratio 0.30466878765059147...
2026-06-13 00:42:21,976 - preprocessing - INFO - Feature selection complete. Selected 16 / 19 features.
2026-06-13 00:42:39,500 - train_pipeline - INFO - Early stopping triggered at epoch 41
2026-06-13 00:42:39,519 - preprocessing - INFO - xAPI engineered features created: ['engagement_score', 'absence_risk', 'parent_support_signal']
2026-06-13 00:42:39,521 - preprocessing - INFO - xAPI engineered features created: ['engagement_score', 'absence_risk', 'parent_support_signal']
2026-06-13 00:42:39,540 - preprocessing - INFO - Applying SMOTE on train set with ratio 0.30466878765059147...
2026-06-13 00:42:39,665 - preprocessing - INFO - Feature selection complete. Selected 18 / 19 features.
2026-06-13 00:42:52,948 - train_pipeline - INFO - Early stopping triggered at epoch 43
2026-06-13 00:42:52,967 - preprocessing - INFO - xAPI engineered features created: ['engagement_score', 'absence_risk', 'parent_support_signal']
2026-06-13 00:42:52,969 - preprocessing - INFO - xAPI engineered features created: ['engagement_score', 'absence_risk', 'parent_support_signal']
2026-06-13 00:42:52,987 - preprocessing - INFO - Applying SMOTE on train set with ratio 0.30466878765059147...
2026-06-13 00:42:53,107 - preprocessing - INFO - Feature selection complete. Selected 16 / 19 features.
2026-06-13 00:43:03,646 - train_pipeline - INFO - Early stopping triggered at epoch 33
2026-06-13 00:43:03,667 - preprocessing - INFO - xAPI engineered features created: ['engagement_score', 'absence_risk', 'parent_support_signal']
2026-06-13 00:43:03,670 - preprocessing - INFO - xAPI engineered features created: ['engagement_score', 'absence_risk', 'parent_support_signal']
2026-06-13 00:43:03,687 - preprocessing - INFO - Applying SMOTE on train set with ratio 0.30466878765059147...
2026-06-13 00:43:03,812 - preprocessing - INFO - Feature selection complete. Selected 18 / 19 features.
2026-06-13 00:43:19,585 - train_pipeline - INFO - Early stopping triggered at epoch 50
[I 2026-06-13 00:43:19,616] Trial 34 finished with value: 0.7873406807074259 and parameters: {'learning_rate': 0.02553997356308358, 'weight_decay': 0.003796322389570038, 'batch_size': 8, 'oversample_method': 'smote', 'smote_ratio': 0.30466878765059147, 'resampling_k_neighbors': 3, 'cnn_channels': 16, 'cnn_kernel_size': 3, 'lstm_hidden_dim': 128, 'context_hidden_dim': 32, 'fusion_hidden_dim': 128, 'sequence_dropout': 0.17294557949914685, 'context_dropout': 0.4115132782932669, 'fusion_dropout': 0.323433147927105}. Best is trial 17 with value: 0.8075693134180814.
2026-06-13 00:43:19,733 - preprocessing - INFO - xAPI engineered features created: ['engagement_score', 'absence_risk', 'parent_support_signal']
2026-06-13 00:43:19,735 - preprocessing - INFO - xAPI engineered features created: ['engagement_score', 'absence_risk', 'parent_support_signal']
2026-06-13 00:43:19,752 - preprocessing - INFO - Applying SMOTE on train set with ratio 0.3362121876932023...
2026-06-13 00:43:19,868 - preprocessing - INFO - Feature selection complete. Selected 15 / 19 features.
2026-06-13 00:43:28,816 - train_pipeline - INFO - Early stopping triggered at epoch 27
2026-06-13 00:43:28,834 - preprocessing - INFO - xAPI engineered features created: ['engagement_score', 'absence_risk', 'parent_support_signal']
2026-06-13 00:43:28,836 - preprocessing - INFO - xAPI engineered features created: ['engagement_score', 'absence_risk', 'parent_support_signal']
2026-06-13 00:43:28,853 - preprocessing - INFO - Applying SMOTE on train set with ratio 0.3362121876932023...
2026-06-13 00:43:28,970 - preprocessing - INFO - Feature selection complete. Selected 16 / 19 features.
2026-06-13 00:43:45,699 - train_pipeline - INFO - Early stopping triggered at epoch 53
2026-06-13 00:43:45,716 - preprocessing - INFO - xAPI engineered features created: ['engagement_score', 'absence_risk', 'parent_support_signal']
2026-06-13 00:43:45,719 - preprocessing - INFO - xAPI engineered features created: ['engagement_score', 'absence_risk', 'parent_support_signal']
2026-06-13 00:43:45,737 - preprocessing - INFO - Applying SMOTE on train set with ratio 0.3362121876932023...
2026-06-13 00:43:45,860 - preprocessing - INFO - Feature selection complete. Selected 18 / 19 features.
2026-06-13 00:44:03,143 - train_pipeline - INFO - Early stopping triggered at epoch 54
2026-06-13 00:44:03,161 - preprocessing - INFO - xAPI engineered features created: ['engagement_score', 'absence_risk', 'parent_support_signal']
2026-06-13 00:44:03,163 - preprocessing - INFO - xAPI engineered features created: ['engagement_score', 'absence_risk', 'parent_support_signal']
2026-06-13 00:44:03,182 - preprocessing - INFO - Applying SMOTE on train set with ratio 0.3362121876932023...
2026-06-13 00:44:03,301 - preprocessing - INFO - Feature selection complete. Selected 16 / 19 features.
2026-06-13 00:44:21,234 - train_pipeline - INFO - Early stopping triggered at epoch 57
2026-06-13 00:44:21,251 - preprocessing - INFO - xAPI engineered features created: ['engagement_score', 'absence_risk', 'parent_support_signal']
2026-06-13 00:44:21,253 - preprocessing - INFO - xAPI engineered features created: ['engagement_score', 'absence_risk', 'parent_support_signal']
2026-06-13 00:44:21,271 - preprocessing - INFO - Applying SMOTE on train set with ratio 0.3362121876932023...
2026-06-13 00:44:21,386 - preprocessing - INFO - Feature selection complete. Selected 18 / 19 features.
2026-06-13 00:44:32,464 - train_pipeline - INFO - Early stopping triggered at epoch 34
