[I 2026-06-12 17:54:24,783] Trial 24 finished with value: 0.7561359765774496 and parameters: {'learning_rate': 0.00019806120069468963, 'weight_decay': 4.941620368078972e-05, 'dropout': 0.23587148461027346, 'batch_size': 32, 'lambda_ordinal': 0.06670383000989888, 'oversample_method': 'none', 'focal_gamma': 1.0132052890494225, 'context_architecture': 'mlp_baseline', 'sequence_architecture': 'dsc_bilstm_attention', 'fm_embedding_dim': 16, 'dcn_cross_layers': 1, 'context_hidden_dim': 64, 'sequence_hidden_dim': 64, 'fusion_hidden_dim': 64}. Best is trial 0 with value: 0.8012617082366521.
2026-06-12 17:54:24,790 - preprocessing - INFO - xAPI engineered features created: ['engagement_score', 'absence_risk', 'parent_support_signal']
2026-06-12 17:54:24,801 - preprocessing - INFO - xAPI engineered features created: ['engagement_score', 'absence_risk', 'parent_support_signal']
2026-06-12 17:54:24,943 - preprocessing - INFO - Feature selection complete. Selected 15 / 19 features.
[I 2026-06-12 17:54:30,341] Early stopping triggered at epoch 41
2026-06-12 17:54:30,341 - preprocessing - INFO - xAPI engineered features created: ['engagement_score', 'absence_risk', 'parent_support_signal']
2026-06-12 17:54:30,347 - preprocessing - INFO - xAPI engineered features created: ['engagement_score', 'absence_risk', 'parent_support_signal']
2026-06-12 17:54:30,502 - preprocessing - INFO - Feature selection complete. Selected 16 / 19 features.
[I 2026-06-12 17:54:33,628] Early stopping triggered at epoch 23
2026-06-12 17:54:33,628 - preprocessing - INFO - xAPI engineered features created: ['engagement_score', 'absence_risk', 'parent_support_signal']
2026-06-12 17:54:33,628 - preprocessing - INFO - xAPI engineered features created: ['engagement_score', 'absence_risk', 'parent_support_signal']
2026-06-12 17:54:33,779 - preprocessing - INFO - Feature selection complete. Selected 18 / 19 features.
[I 2026-06-12 17:54:37,823] Early stopping triggered at epoch 29
2026-06-12 17:54:37,823 - preprocessing - INFO - xAPI engineered features created: ['engagement_score', 'absence_risk', 'parent_support_signal']
2026-06-12 17:54:37,839 - preprocessing - INFO - xAPI engineered features created: ['engagement_score', 'absence_risk', 'parent_support_signal']
2026-06-12 17:54:37,978 - preprocessing - INFO - Feature selection complete. Selected 16 / 19 features.
[I 2026-06-12 17:54:41,558] Early stopping triggered at epoch 27
2026-06-12 17:54:41,558 - preprocessing - INFO - xAPI engineered features created: ['engagement_score', 'absence_risk', 'parent_support_signal']
2026-06-12 17:54:41,558 - preprocessing - INFO - xAPI engineered features created: ['engagement_score', 'absence_risk', 'parent_support_signal']
2026-06-12 17:54:41,698 - preprocessing - INFO - Feature selection complete. Selected 18 / 19 features.
[I 2026-06-12 17:54:46,440] Early stopping triggered at epoch 34
[I 2026-06-12 17:54:46,444] Trial 25 finished with value: 0.7896610160112999 and parameters: {'learning_rate': 0.004635614391602496, 'weight_decay': 0.00010447347025825474, 'dropout': 0.27410282920978857, 'batch_size': 32, 'lambda_ordinal': 0.21318393863334076, 'oversample_method': 'none', 'focal_gamma': 1.5703817754601688, 'context_architecture': 'deepfm', 'sequence_architecture': 'dsc_bilstm_attention', 'fm_embedding_dim': 16, 'dcn_cross_layers': 1, 'context_hidden_dim': 64, 'sequence_hidden_dim': 64, 'fusion_hidden_dim': 64}. Best is trial 0 with value: 0.8012617082366521.
2026-06-12 17:54:46,456 - preprocessing - INFO - xAPI engineered features created: ['engagement_score', 'absence_risk', 'parent_support_signal']
2026-06-12 17:54:46,456 - preprocessing - INFO - xAPI engineered features created: ['engagement_score', 'absence_risk', 'parent_support_signal']
2026-06-12 17:54:46,588 - preprocessing - INFO - Feature selection complete. Selected 15 / 19 features.
[I 2026-06-12 17:54:49,254] Early stopping triggered at epoch 24
2026-06-12 17:54:49,254 - preprocessing - INFO - xAPI engineered features created: ['engagement_score', 'absence_risk', 'parent_support_signal']
2026-06-12 17:54:49,254 - preprocessing - INFO - xAPI engineered features created: ['engagement_score', 'absence_risk', 'parent_support_signal']
2026-06-12 17:54:49,404 - preprocessing - INFO - Feature selection complete. Selected 16 / 19 features.
[I 2026-06-12 17:54:52,104] Early stopping triggered at epoch 24
2026-06-12 17:54:52,110 - preprocessing - INFO - xAPI engineered features created: ['engagement_score', 'absence_risk', 'parent_support_signal']
2026-06-12 17:54:52,110 - preprocessing - INFO - xAPI engineered features created: ['engagement_score', 'absence_risk', 'parent_support_signal']
2026-06-12 17:54:52,242 - preprocessing - INFO - Feature selection complete. Selected 18 / 19 features.
[I 2026-06-12 17:54:55,782] Early stopping triggered at epoch 29
2026-06-12 17:54:55,782 - preprocessing - INFO - xAPI engineered features created: ['engagement_score', 'absence_risk', 'parent_support_signal']
2026-06-12 17:54:55,782 - preprocessing - INFO - xAPI engineered features created: ['engagement_score', 'absence_risk', 'parent_support_signal']
2026-06-12 17:54:55,932 - preprocessing - INFO - Feature selection complete. Selected 16 / 19 features.
[I 2026-06-12 17:54:58,687] Early stopping triggered at epoch 22
2026-06-12 17:54:58,694 - preprocessing - INFO - xAPI engineered features created: ['engagement_score', 'absence_risk', 'parent_support_signal']
2026-06-12 17:54:58,694 - preprocessing - INFO - xAPI engineered features created: ['engagement_score', 'absence_risk', 'parent_support_signal']
2026-06-12 17:54:58,834 - preprocessing - INFO - Feature selection complete. Selected 18 / 19 features.
[I 2026-06-12 17:55:02,213] Early stopping triggered at epoch 27
[I 2026-06-12 17:55:02,213] Trial 26 finished with value: 0.775686008218645 and parameters: {'learning_rate': 0.000652035475704492, 'weight_decay': 1.0043016097229522e-05, 'dropout': 0.13609953392292548, 'batch_size': 32, 'lambda_ordinal': 0.12820899719663406, 'oversample_method': 'none', 'focal_gamma': 2.1337233339377524, 'context_architecture': 'mlp_baseline', 'sequence_architecture': 'dsc_bilstm_attention', 'fm_embedding_dim': 16, 'dcn_cross_layers': 1, 'context_hidden_dim': 64, 'sequence_hidden_dim': 64, 'fusion_hidden_dim': 128}. Best is trial 0 with value: 0.8012617082366521.
2026-06-12 17:55:02,225 - preprocessing - INFO - xAPI engineered features created: ['engagement_score', 'absence_risk', 'parent_support_signal']
2026-06-12 17:55:02,225 - preprocessing - INFO - xAPI engineered features created: ['engagement_score', 'absence_risk', 'parent_support_signal']
2026-06-12 17:55:02,372 - preprocessing - INFO - Feature selection complete. Selected 15 / 19 features.
2026-06-12 17:55:08,996 - preprocessing - INFO - xAPI engineered features created: ['engagement_score', 'absence_risk', 'parent_support_signal']
2026-06-12 17:55:08,996 - preprocessing - INFO - xAPI engineered features created: ['engagement_score', 'absence_risk', 'parent_support_signal']
2026-06-12 17:55:09,134 - preprocessing - INFO - Feature selection complete. Selected 16 / 19 features.
[I 2026-06-12 17:55:14,477] Early stopping triggered at epoch 39
2026-06-12 17:55:14,483 - preprocessing - INFO - xAPI engineered features created: ['engagement_score', 'absence_risk', 'parent_support_signal']
2026-06-12 17:55:14,483 - preprocessing - INFO - xAPI engineered features created: ['engagement_score', 'absence_risk', 'parent_support_signal']
2026-06-12 17:55:14,625 - preprocessing - INFO - Feature selection complete. Selected 18 / 19 features.
[I 2026-06-12 17:55:18,611] Early stopping triggered at epoch 29
2026-06-12 17:55:18,611 - preprocessing - INFO - xAPI engineered features created: ['engagement_score', 'absence_risk', 'parent_support_signal']
2026-06-12 17:55:18,628 - preprocessing - INFO - xAPI engineered features created: ['engagement_score', 'absence_risk', 'parent_support_signal']
2026-06-12 17:55:18,771 - preprocessing - INFO - Feature selection complete. Selected 16 / 19 features.
[I 2026-06-12 17:55:23,842] Early stopping triggered at epoch 37
2026-06-12 17:55:23,842 - preprocessing - INFO - xAPI engineered features created: ['engagement_score', 'absence_risk', 'parent_support_signal']
2026-06-12 17:55:23,848 - preprocessing - INFO - xAPI engineered features created: ['engagement_score', 'absence_risk', 'parent_support_signal']
2026-06-12 17:55:24,002 - preprocessing - INFO - Feature selection complete. Selected 18 / 19 features.
[I 2026-06-12 17:55:28,816] Early stopping triggered at epoch 34
[I 2026-06-12 17:55:28,816] Trial 27 finished with value: 0.7799819980474757 and parameters: {'learning_rate': 0.0015659878971793681, 'weight_decay': 4.2637215671304456e-05, 'dropout': 0.3491289339837413, 'batch_size': 32, 'lambda_ordinal': 0.28820279972672846, 'oversample_method': 'none', 'focal_gamma': 1.3918519667665286, 'context_architecture': 'deepfm', 'sequence_architecture': 'dsc_bilstm_attention', 'fm_embedding_dim': 16, 'dcn_cross_layers': 1, 'context_hidden_dim': 64, 'sequence_hidden_dim': 64, 'fusion_hidden_dim': 64}. Best is trial 0 with value: 0.8012617082366521.
2026-06-12 17:55:28,848 - preprocessing - INFO - xAPI engineered features created: ['engagement_score', 'absence_risk', 'parent_support_signal']
2026-06-12 17:55:28,851 - preprocessing - INFO - xAPI engineered features created: ['engagement_score', 'absence_risk', 'parent_support_signal']
2026-06-12 17:55:28,992 - preprocessing - INFO - Feature selection complete. Selected 15 / 19 features.
[I 2026-06-12 17:55:33,013] Early stopping triggered at epoch 30
2026-06-12 17:55:33,020 - preprocessing - INFO - xAPI engineered features created: ['engagement_score', 'absence_risk', 'parent_support_signal']
2026-06-12 17:55:33,020 - preprocessing - INFO - xAPI engineered features created: ['engagement_score', 'absence_risk', 'parent_support_signal']
2026-06-12 17:55:33,152 - preprocessing - INFO - Feature selection complete. Selected 16 / 19 features.
[I 2026-06-12 17:55:36,525] Early stopping triggered at epoch 25
2026-06-12 17:55:36,531 - preprocessing - INFO - xAPI engineered features created: ['engagement_score', 'absence_risk', 'parent_support_signal']
2026-06-12 17:55:36,531 - preprocessing - INFO - xAPI engineered features created: ['engagement_score', 'absence_risk', 'parent_support_signal']
2026-06-12 17:55:36,678 - preprocessing - INFO - Feature selection complete. Selected 18 / 19 features.
[I 2026-06-12 17:55:41,172] Early stopping triggered at epoch 32
2026-06-12 17:55:41,179 - preprocessing - INFO - xAPI engineered features created: ['engagement_score', 'absence_risk', 'parent_support_signal']
2026-06-12 17:55:41,202 - preprocessing - INFO - xAPI engineered features created: ['engagement_score', 'absence_risk', 'parent_support_signal']
2026-06-12 17:55:41,352 - preprocessing - INFO - Feature selection complete. Selected 16 / 19 features.
[I 2026-06-12 17:55:44,910] Early stopping triggered at epoch 26
2026-06-12 17:55:44,914 - preprocessing - INFO - xAPI engineered features created: ['engagement_score', 'absence_risk', 'parent_support_signal']
2026-06-12 17:55:44,914 - preprocessing - INFO - xAPI engineered features created: ['engagement_score', 'absence_risk', 'parent_support_signal']
2026-06-12 17:55:45,065 - preprocessing - INFO - Feature selection complete. Selected 18 / 19 features.
[I 2026-06-12 17:55:48,625] Early stopping triggered at epoch 25
[I 2026-06-12 17:55:48,637] Trial 28 finished with value: 0.7634223134596976 and parameters: {'learning_rate': 0.00529939818220399, 'weight_decay': 2.1834139008546862e-05, 'dropout': 0.43240360260345584, 'batch_size': 32, 'lambda_ordinal': 0.01654520420718325, 'oversample_method': 'none', 'focal_gamma': 1.8388438745239455, 'context_architecture': 'deepfm', 'sequence_architecture': 'dsc_bilstm_attention', 'fm_embedding_dim': 16, 'dcn_cross_layers': 1, 'context_hidden_dim': 64, 'sequence_hidden_dim': 64, 'fusion_hidden_dim': 64}. Best is trial 0 with value: 0.8012617082366521.
2026-06-12 17:55:48,652 - preprocessing - INFO - xAPI engineered features created: ['engagement_score', 'absence_risk', 'parent_support_signal']
2026-06-12 17:55:48,652 - preprocessing - INFO - xAPI engineered features created: ['engagement_score', 'absence_risk', 'parent_support_signal']
2026-06-12 17:55:48,789 - preprocessing - INFO - Feature selection complete. Selected 15 / 19 features.
[I 2026-06-12 17:55:51,652] Early stopping triggered at epoch 25
2026-06-12 17:55:51,656 - preprocessing - INFO - xAPI engineered features created: ['engagement_score', 'absence_risk', 'parent_support_signal']
2026-06-12 17:55:51,660 - preprocessing - INFO - xAPI engineered features created: ['engagement_score', 'absence_risk', 'parent_support_signal']
2026-06-12 17:55:51,802 - preprocessing - INFO - Feature selection complete. Selected 16 / 19 features.
[I 2026-06-12 17:55:54,369] Early stopping triggered at epoch 22
2026-06-12 17:55:54,375 - preprocessing - INFO - xAPI engineered features created: ['engagement_score', 'absence_risk', 'parent_support_signal']
2026-06-12 17:55:54,375 - preprocessing - INFO - xAPI engineered features created: ['engagement_score', 'absence_risk', 'parent_support_signal']
2026-06-12 17:55:54,524 - preprocessing - INFO - Feature selection complete. Selected 18 / 19 features.
[I 2026-06-12 17:55:57,107] Early stopping triggered at epoch 22
2026-06-12 17:55:57,121 - preprocessing - INFO - xAPI engineered features created: ['engagement_score', 'absence_risk', 'parent_support_signal']
2026-06-12 17:55:57,121 - preprocessing - INFO - xAPI engineered features created: ['engagement_score', 'absence_risk', 'parent_support_signal']
2026-06-12 17:55:57,266 - preprocessing - INFO - Feature selection complete. Selected 16 / 19 features.
[I 2026-06-12 17:56:01,998] Early stopping triggered at epoch 40
2026-06-12 17:56:01,998 - preprocessing - INFO - xAPI engineered features created: ['engagement_score', 'absence_risk', 'parent_support_signal']
2026-06-12 17:56:02,012 - preprocessing - INFO - xAPI engineered features created: ['engagement_score', 'absence_risk', 'parent_support_signal']
2026-06-12 17:56:02,151 - preprocessing - INFO - Feature selection complete. Selected 18 / 19 features.
[I 2026-06-12 17:56:06,091] Early stopping triggered at epoch 32
[I 2026-06-12 17:56:06,098] Trial 29 finished with value: 0.7689374367117321 and parameters: {'learning_rate': 0.000861408651077777, 'weight_decay': 3.545953152017615e-05, 'dropout': 0.3067847382483982, 'batch_size': 32, 'lambda_ordinal': 0.3665677067743534, 'oversample_method': 'none', 'focal_gamma': 2.5468065625225407, 'context_architecture': 'mlp_baseline', 'sequence_architecture': 'dsc_bilstm_attention', 'fm_embedding_dim': 32, 'dcn_cross_layers': 2, 'context_hidden_dim': 64, 'sequence_hidden_dim': 64, 'fusion_hidden_dim': 64}. Best is trial 0 with value: 0.8012617082366521.
2026-06-12 17:56:06,098 - run_pipeline - INFO - Best Optuna Trial:
2026-06-12 17:56:06,098 - run_pipeline - INFO -   F1-Macro (CV): 0.8013
2026-06-12 17:56:06,098 - run_pipeline - INFO -   Params: {'learning_rate': 0.002958594248396769, 'weight_decay': 0.0009336558238410763, 'dropout': 0.3093558354184839, 'batch_size': 16, 'lambda_ordinal': 0.34920713801634873, 'oversample_method': 'smote', 'smote_ratio': 0.4190721074726053, 'context_architecture': 'deepfm', 'sequence_architecture': 'dsc_bilstm_attention', 'fm_embedding_dim': 32, 'dcn_cross_layers': 2, 'context_hidden_dim': 128, 'sequence_hidden_dim': 64, 'fusion_hidden_dim': 64}
2026-06-12 17:56:06,098 - run_pipeline - INFO - Starting Final Evaluation on Locked Test with Fixed Seeds...
2026-06-12 17:56:06,114 - preprocessing - INFO - Applying SMOTE on train set with ratio 1.0...
2026-06-12 17:56:06,223 - preprocessing - INFO - xAPI engineered features created: ['engagement_score', 'absence_risk', 'parent_support_signal']
2026-06-12 17:56:06,223 - preprocessing - INFO - xAPI engineered features created: ['engagement_score', 'absence_risk', 'parent_support_signal']
2026-06-12 17:56:06,265 - preprocessing - INFO - Feature selection complete. Selected 15 / 16 features.
2026-06-12 17:56:06,280 - run_pipeline - INFO - Training Seed 42...
Traceback (most recent call last):
  File "C:\Huflit\kltn\scripts\run_pipeline.py", line 196, in <module>
    main()
  File "C:\Huflit\kltn\scripts\run_pipeline.py", line 136, in main
    model, _, _ = train_model(model, train_loader, train_loader, criterion, optimizer, tconfig, device)
  File "C:\Huflit\kltn\src\train_pipeline.py", line 101, in train_model
    train_loss = train_epoch(model, train_loader, criterion, optimizer, device)
  File "C:\Huflit\kltn\src\train_pipeline.py", line 57, in train_epoch
    logits, expected_val = model(seq_x, num_x, cat_x)
  File "C:\Users\THPhu\AppData\Local\Programs\Python\Python310\lib\site-packages\torch\nn\modules\module.py", line 1778, in _wrapped_call_impl
    return self._call_impl(*args, **kwargs)
  File "C:\Users\THPhu\AppData\Local\Programs\Python\Python310\lib\site-packages\torch\nn\modules\module.py", line 1789, in _call_impl
    return forward_call(*args, **kwargs)
  File "C:\Huflit\kltn\src\models.py", line 532, in forward
    logits, expected_val = self.core_model(seq_x, num_x, cat_x)
  File "C:\Users\THPhu\AppData\Local\Programs\Python\Python310\lib\site-packages\torch\nn\modules\module.py", line 1778, in _wrapped_call_impl
    return self._call_impl(*args, **kwargs)
  File "C:\Users\THPhu\AppData\Local\Programs\Python\Python310\lib\site-packages\torch\nn\modules\module.py", line 1789, in _call_impl
    return forward_call(*args, **kwargs)
  File "C:\Huflit\kltn\src\models.py", line 463, in forward
    context_vector = self.context_branch(num_x, cat_x)
  File "C:\Users\THPhu\AppData\Local\Programs\Python\Python310\lib\site-packages\torch\nn\modules\module.py", line 1778, in _wrapped_call_impl
    return self._call_impl(*args, **kwargs)
  File "C:\Users\THPhu\AppData\Local\Programs\Python\Python310\lib\site-packages\torch\nn\modules\module.py", line 1789, in _call_impl
    return forward_call(*args, **kwargs)
  File "C:\Huflit\kltn\src\models.py", line 161, in forward
    linear_out += self.linear_num(num_x)
  File "C:\Users\THPhu\AppData\Local\Programs\Python\Python310\lib\site-packages\torch\nn\modules\module.py", line 1778, in _wrapped_call_impl
    return self._call_impl(*args, **kwargs)
  File "C:\Users\THPhu\AppData\Local\Programs\Python\Python310\lib\site-packages\torch\nn\modules\module.py", line 1789, in _call_impl
    return forward_call(*args, **kwargs)
  File "C:\Users\THPhu\AppData\Local\Programs\Python\Python310\lib\site-packages\torch\nn\modules\linear.py", line 134, in forward
    return F.linear(input, self.weight, self.bias)
RuntimeError: mat1 and mat2 shapes cannot be multiplied (16x1 and 4x1)
