[I 2026-06-13 00:59:30,902] Trial 72 finished with value: 0.7935503055555149 and parameters: {'learning_rate': 0.005640946286536148, 'weight_decay': 0.000952834671412016, 'batch_size': 16, 'oversample_method': 'adasyn', 'smote_ratio': 0.30800103641136906, 'resampling_k_neighbors': 4, 'cnn_channels': 32, 'cnn_kernel_size': 3, 'lstm_hidden_dim': 128, 'context_hidden_dim': 256, 'fusion_hidden_dim': 256, 'sequence_dropout': 0.3521634630501516, 'context_dropout': 0.13826338495631635, 'fusion_dropout': 0.17053536076700573}. Best is trial 55 with value: 0.8121442327638384.
2026-06-13 00:59:31,019 - preprocessing - INFO - xAPI engineered features created: ['engagement_score', 'absence_risk', 'parent_support_signal']
2026-06-13 00:59:31,021 - preprocessing - INFO - xAPI engineered features created: ['engagement_score', 'absence_risk', 'parent_support_signal']
2026-06-13 00:59:31,038 - preprocessing - INFO - Applying SMOTE on train set with ratio 0.7685921365894709...
2026-06-13 00:59:31,167 - preprocessing - INFO - Feature selection complete. Selected 16 / 19 features.
2026-06-13 00:59:36,861 - train_pipeline - INFO - Early stopping triggered at epoch 48
2026-06-13 00:59:36,879 - preprocessing - INFO - xAPI engineered features created: ['engagement_score', 'absence_risk', 'parent_support_signal']
2026-06-13 00:59:36,882 - preprocessing - INFO - xAPI engineered features created: ['engagement_score', 'absence_risk', 'parent_support_signal']
2026-06-13 00:59:36,900 - preprocessing - INFO - Applying SMOTE on train set with ratio 0.7685921365894709...
2026-06-13 00:59:37,052 - preprocessing - INFO - Feature selection complete. Selected 17 / 19 features.
2026-06-13 00:59:40,674 - train_pipeline - INFO - Early stopping triggered at epoch 30
2026-06-13 00:59:40,699 - preprocessing - INFO - xAPI engineered features created: ['engagement_score', 'absence_risk', 'parent_support_signal']
2026-06-13 00:59:40,702 - preprocessing - INFO - xAPI engineered features created: ['engagement_score', 'absence_risk', 'parent_support_signal']
2026-06-13 00:59:40,731 - preprocessing - INFO - Applying SMOTE on train set with ratio 0.7685921365894709...
2026-06-13 00:59:40,882 - preprocessing - INFO - Feature selection complete. Selected 18 / 19 features.
2026-06-13 00:59:46,056 - train_pipeline - INFO - Early stopping triggered at epoch 43
[I 2026-06-13 00:59:46,081] Trial 73 pruned. 
2026-06-13 00:59:46,201 - preprocessing - INFO - xAPI engineered features created: ['engagement_score', 'absence_risk', 'parent_support_signal']
2026-06-13 00:59:46,203 - preprocessing - INFO - xAPI engineered features created: ['engagement_score', 'absence_risk', 'parent_support_signal']
2026-06-13 00:59:46,220 - preprocessing - INFO - Applying SMOTE on train set with ratio 0.37032134839778297...
2026-06-13 00:59:46,338 - preprocessing - INFO - Feature selection complete. Selected 15 / 19 features.
2026-06-13 00:59:52,317 - train_pipeline - INFO - Early stopping triggered at epoch 64
2026-06-13 00:59:52,333 - preprocessing - INFO - xAPI engineered features created: ['engagement_score', 'absence_risk', 'parent_support_signal']
2026-06-13 00:59:52,335 - preprocessing - INFO - xAPI engineered features created: ['engagement_score', 'absence_risk', 'parent_support_signal']
2026-06-13 00:59:52,353 - preprocessing - INFO - Applying SMOTE on train set with ratio 0.37032134839778297...
2026-06-13 00:59:52,471 - preprocessing - INFO - Feature selection complete. Selected 16 / 19 features.
2026-06-13 00:59:56,303 - train_pipeline - INFO - Early stopping triggered at epoch 39
2026-06-13 00:59:56,321 - preprocessing - INFO - xAPI engineered features created: ['engagement_score', 'absence_risk', 'parent_support_signal']
2026-06-13 00:59:56,324 - preprocessing - INFO - xAPI engineered features created: ['engagement_score', 'absence_risk', 'parent_support_signal']
2026-06-13 00:59:56,341 - preprocessing - INFO - Applying SMOTE on train set with ratio 0.37032134839778297...
2026-06-13 00:59:56,463 - preprocessing - INFO - Feature selection complete. Selected 18 / 19 features.
2026-06-13 00:59:59,954 - train_pipeline - INFO - Early stopping triggered at epoch 35
2026-06-13 00:59:59,971 - preprocessing - INFO - xAPI engineered features created: ['engagement_score', 'absence_risk', 'parent_support_signal']
2026-06-13 00:59:59,973 - preprocessing - INFO - xAPI engineered features created: ['engagement_score', 'absence_risk', 'parent_support_signal']
2026-06-13 00:59:59,990 - preprocessing - INFO - Applying SMOTE on train set with ratio 0.37032134839778297...
2026-06-13 01:00:00,112 - preprocessing - INFO - Feature selection complete. Selected 16 / 19 features.
2026-06-13 01:00:05,460 - train_pipeline - INFO - Early stopping triggered at epoch 56
2026-06-13 01:00:05,479 - preprocessing - INFO - xAPI engineered features created: ['engagement_score', 'absence_risk', 'parent_support_signal']
2026-06-13 01:00:05,481 - preprocessing - INFO - xAPI engineered features created: ['engagement_score', 'absence_risk', 'parent_support_signal']
2026-06-13 01:00:05,499 - preprocessing - INFO - Applying SMOTE on train set with ratio 0.37032134839778297...
2026-06-13 01:00:05,618 - preprocessing - INFO - Feature selection complete. Selected 18 / 19 features.
2026-06-13 01:00:11,074 - train_pipeline - INFO - Early stopping triggered at epoch 57
[I 2026-06-13 01:00:11,102] Trial 74 finished with value: 0.7949730426446112 and parameters: {'learning_rate': 0.0027077216315822073, 'weight_decay': 0.0016208203460919414, 'batch_size': 32, 'oversample_method': 'smote', 'smote_ratio': 0.37032134839778297, 'resampling_k_neighbors': 5, 'cnn_channels': 32, 'cnn_kernel_size': 4, 'lstm_hidden_dim': 96, 'context_hidden_dim': 128, 'fusion_hidden_dim': 128, 'sequence_dropout': 0.32212283792202917, 'context_dropout': 0.15020033211174913, 'fusion_dropout': 0.24616691639179972}. Best is trial 55 with value: 0.8121442327638384.
2026-06-13 01:00:11,220 - preprocessing - INFO - xAPI engineered features created: ['engagement_score', 'absence_risk', 'parent_support_signal']
2026-06-13 01:00:11,222 - preprocessing - INFO - xAPI engineered features created: ['engagement_score', 'absence_risk', 'parent_support_signal']
2026-06-13 01:00:11,240 - preprocessing - INFO - Applying ADASYN on train set with ratio 0.6357507791139924...
2026-06-13 01:00:11,247 - preprocessing - WARNING - ADASYN failed (likely too few samples). Error: No samples will be generated with the provided ratio settings.. Falling back to no oversampling.
2026-06-13 01:00:11,361 - preprocessing - INFO - Feature selection complete. Selected 15 / 19 features.
2026-06-13 01:00:16,101 - train_pipeline - INFO - Early stopping triggered at epoch 44
2026-06-13 01:00:16,120 - preprocessing - INFO - xAPI engineered features created: ['engagement_score', 'absence_risk', 'parent_support_signal']
2026-06-13 01:00:16,123 - preprocessing - INFO - xAPI engineered features created: ['engagement_score', 'absence_risk', 'parent_support_signal']
2026-06-13 01:00:16,140 - preprocessing - INFO - Applying ADASYN on train set with ratio 0.6357507791139924...
2026-06-13 01:00:16,147 - preprocessing - WARNING - ADASYN failed (likely too few samples). Error: No samples will be generated with the provided ratio settings.. Falling back to no oversampling.
2026-06-13 01:00:16,269 - preprocessing - INFO - Feature selection complete. Selected 16 / 19 features.
2026-06-13 01:00:20,197 - train_pipeline - INFO - Early stopping triggered at epoch 36
2026-06-13 01:00:20,215 - preprocessing - INFO - xAPI engineered features created: ['engagement_score', 'absence_risk', 'parent_support_signal']
2026-06-13 01:00:20,217 - preprocessing - INFO - xAPI engineered features created: ['engagement_score', 'absence_risk', 'parent_support_signal']
2026-06-13 01:00:20,234 - preprocessing - INFO - Applying ADASYN on train set with ratio 0.6357507791139924...
2026-06-13 01:00:20,242 - preprocessing - WARNING - ADASYN failed (likely too few samples). Error: No samples will be generated with the provided ratio settings.. Falling back to no oversampling.
2026-06-13 01:00:20,359 - preprocessing - INFO - Feature selection complete. Selected 18 / 19 features.
2026-06-13 01:00:24,215 - train_pipeline - INFO - Early stopping triggered at epoch 37
2026-06-13 01:00:24,241 - preprocessing - INFO - xAPI engineered features created: ['engagement_score', 'absence_risk', 'parent_support_signal']
2026-06-13 01:00:24,245 - preprocessing - INFO - xAPI engineered features created: ['engagement_score', 'absence_risk', 'parent_support_signal']
2026-06-13 01:00:24,277 - preprocessing - INFO - Applying ADASYN on train set with ratio 0.6357507791139924...
2026-06-13 01:00:24,288 - preprocessing - WARNING - ADASYN failed (likely too few samples). Error: No samples will be generated with the provided ratio settings.. Falling back to no oversampling.
2026-06-13 01:00:24,454 - preprocessing - INFO - Feature selection complete. Selected 16 / 19 features.
2026-06-13 01:00:29,028 - train_pipeline - INFO - Early stopping triggered at epoch 41
2026-06-13 01:00:29,048 - preprocessing - INFO - xAPI engineered features created: ['engagement_score', 'absence_risk', 'parent_support_signal']
2026-06-13 01:00:29,051 - preprocessing - INFO - xAPI engineered features created: ['engagement_score', 'absence_risk', 'parent_support_signal']
2026-06-13 01:00:29,073 - preprocessing - INFO - Applying ADASYN on train set with ratio 0.6357507791139924...
2026-06-13 01:00:29,082 - preprocessing - WARNING - ADASYN failed (likely too few samples). Error: No samples will be generated with the provided ratio settings.. Falling back to no oversampling.
2026-06-13 01:00:29,210 - preprocessing - INFO - Feature selection complete. Selected 18 / 19 features.
2026-06-13 01:00:32,928 - train_pipeline - INFO - Early stopping triggered at epoch 34
[I 2026-06-13 01:00:32,967] Trial 75 finished with value: 0.7958001447077157 and parameters: {'learning_rate': 0.02937644003802255, 'weight_decay': 4.9456453756432245e-05, 'batch_size': 32, 'oversample_method': 'adasyn', 'smote_ratio': 0.6357507791139924, 'resampling_k_neighbors': 3, 'cnn_channels': 32, 'cnn_kernel_size': 3, 'lstm_hidden_dim': 128, 'context_hidden_dim': 256, 'fusion_hidden_dim': 256, 'sequence_dropout': 0.4621752986969157, 'context_dropout': 0.3474267524691214, 'fusion_dropout': 0.13981471598017153}. Best is trial 55 with value: 0.8121442327638384.
2026-06-13 01:00:33,098 - preprocessing - INFO - xAPI engineered features created: ['engagement_score', 'absence_risk', 'parent_support_signal']
2026-06-13 01:00:33,101 - preprocessing - INFO - xAPI engineered features created: ['engagement_score', 'absence_risk', 'parent_support_signal']
2026-06-13 01:00:33,120 - preprocessing - INFO - Applying SMOTE on train set with ratio 0.5817470809023951...
2026-06-13 01:00:33,236 - preprocessing - INFO - Feature selection complete. Selected 15 / 19 features.
2026-06-13 01:00:35,652 - train_pipeline - INFO - Early stopping triggered at epoch 44
2026-06-13 01:00:35,669 - preprocessing - INFO - xAPI engineered features created: ['engagement_score', 'absence_risk', 'parent_support_signal']
2026-06-13 01:00:35,672 - preprocessing - INFO - xAPI engineered features created: ['engagement_score', 'absence_risk', 'parent_support_signal']
2026-06-13 01:00:35,689 - preprocessing - INFO - Applying SMOTE on train set with ratio 0.5817470809023951...
2026-06-13 01:00:35,805 - preprocessing - INFO - Feature selection complete. Selected 16 / 19 features.
2026-06-13 01:00:37,478 - train_pipeline - INFO - Early stopping triggered at epoch 31
2026-06-13 01:00:37,498 - preprocessing - INFO - xAPI engineered features created: ['engagement_score', 'absence_risk', 'parent_support_signal']
2026-06-13 01:00:37,500 - preprocessing - INFO - xAPI engineered features created: ['engagement_score', 'absence_risk', 'parent_support_signal']
2026-06-13 01:00:37,517 - preprocessing - INFO - Applying SMOTE on train set with ratio 0.5817470809023951...
2026-06-13 01:00:37,632 - preprocessing - INFO - Feature selection complete. Selected 18 / 19 features.
2026-06-13 01:00:40,033 - train_pipeline - INFO - Early stopping triggered at epoch 44
[I 2026-06-13 01:00:40,056] Trial 76 pruned. 
2026-06-13 01:00:40,179 - preprocessing - INFO - xAPI engineered features created: ['engagement_score', 'absence_risk', 'parent_support_signal']
2026-06-13 01:00:40,181 - preprocessing - INFO - xAPI engineered features created: ['engagement_score', 'absence_risk', 'parent_support_signal']
2026-06-13 01:00:40,198 - preprocessing - INFO - Applying ADASYN on train set with ratio 0.5420198629215648...
2026-06-13 01:00:40,315 - preprocessing - INFO - Feature selection complete. Selected 15 / 19 features.
2026-06-13 01:00:45,245 - train_pipeline - INFO - Early stopping triggered at epoch 30
2026-06-13 01:00:45,262 - preprocessing - INFO - xAPI engineered features created: ['engagement_score', 'absence_risk', 'parent_support_signal']
2026-06-13 01:00:45,265 - preprocessing - INFO - xAPI engineered features created: ['engagement_score', 'absence_risk', 'parent_support_signal']
2026-06-13 01:00:45,282 - preprocessing - INFO - Applying ADASYN on train set with ratio 0.5420198629215648...
2026-06-13 01:00:45,398 - preprocessing - INFO - Feature selection complete. Selected 16 / 19 features.
2026-06-13 01:00:57,094 - train_pipeline - INFO - Early stopping triggered at epoch 72
2026-06-13 01:00:57,112 - preprocessing - INFO - xAPI engineered features created: ['engagement_score', 'absence_risk', 'parent_support_signal']
2026-06-13 01:00:57,114 - preprocessing - INFO - xAPI engineered features created: ['engagement_score', 'absence_risk', 'parent_support_signal']
2026-06-13 01:00:57,130 - preprocessing - INFO - Applying ADASYN on train set with ratio 0.5420198629215648...
2026-06-13 01:00:57,246 - preprocessing - INFO - Feature selection complete. Selected 18 / 19 features.
2026-06-13 01:01:06,210 - train_pipeline - INFO - Early stopping triggered at epoch 53
2026-06-13 01:01:06,229 - preprocessing - INFO - xAPI engineered features created: ['engagement_score', 'absence_risk', 'parent_support_signal']
2026-06-13 01:01:06,231 - preprocessing - INFO - xAPI engineered features created: ['engagement_score', 'absence_risk', 'parent_support_signal']
2026-06-13 01:01:06,248 - preprocessing - INFO - Applying ADASYN on train set with ratio 0.5420198629215648...
2026-06-13 01:01:06,373 - preprocessing - INFO - Feature selection complete. Selected 16 / 19 features.
2026-06-13 01:01:15,327 - train_pipeline - INFO - Early stopping triggered at epoch 53
2026-06-13 01:01:15,347 - preprocessing - INFO - xAPI engineered features created: ['engagement_score', 'absence_risk', 'parent_support_signal']
2026-06-13 01:01:15,350 - preprocessing - INFO - xAPI engineered features created: ['engagement_score', 'absence_risk', 'parent_support_signal']
2026-06-13 01:01:15,368 - preprocessing - INFO - Applying ADASYN on train set with ratio 0.5420198629215648...
2026-06-13 01:01:15,484 - preprocessing - INFO - Feature selection complete. Selected 18 / 19 features.
2026-06-13 01:01:24,853 - train_pipeline - INFO - Early stopping triggered at epoch 56
[I 2026-06-13 01:01:24,881] Trial 77 finished with value: 0.7992588603714823 and parameters: {'learning_rate': 0.006712873890603498, 'weight_decay': 0.0036403308279244506, 'batch_size': 16, 'oversample_method': 'adasyn', 'smote_ratio': 0.5420198629215648, 'resampling_k_neighbors': 3, 'cnn_channels': 32, 'cnn_kernel_size': 3, 'lstm_hidden_dim': 96, 'context_hidden_dim': 32, 'fusion_hidden_dim': 256, 'sequence_dropout': 0.2918516600355464, 'context_dropout': 0.31516412701206575, 'fusion_dropout': 0.20339586452712596}. Best is trial 55 with value: 0.8121442327638384.
2026-06-13 01:01:24,999 - preprocessing - INFO - xAPI engineered features created: ['engagement_score', 'absence_risk', 'parent_support_signal']
2026-06-13 01:01:25,002 - preprocessing - INFO - xAPI engineered features created: ['engagement_score', 'absence_risk', 'parent_support_signal']
2026-06-13 01:01:25,018 - preprocessing - INFO - Applying SMOTE on train set with ratio 0.5686141474348197...
2026-06-13 01:01:25,141 - preprocessing - INFO - Feature selection complete. Selected 15 / 19 features.
2026-06-13 01:01:27,149 - train_pipeline - INFO - Early stopping triggered at epoch 44
2026-06-13 01:01:27,168 - preprocessing - INFO - xAPI engineered features created: ['engagement_score', 'absence_risk', 'parent_support_signal']
2026-06-13 01:01:27,170 - preprocessing - INFO - xAPI engineered features created: ['engagement_score', 'absence_risk', 'parent_support_signal']
2026-06-13 01:01:27,187 - preprocessing - INFO - Applying SMOTE on train set with ratio 0.5686141474348197...
2026-06-13 01:01:27,302 - preprocessing - INFO - Feature selection complete. Selected 16 / 19 features.
2026-06-13 01:01:30,060 - train_pipeline - INFO - Early stopping triggered at epoch 58
2026-06-13 01:01:30,089 - preprocessing - INFO - xAPI engineered features created: ['engagement_score', 'absence_risk', 'parent_support_signal']
2026-06-13 01:01:30,092 - preprocessing - INFO - xAPI engineered features created: ['engagement_score', 'absence_risk', 'parent_support_signal']
2026-06-13 01:01:30,122 - preprocessing - INFO - Applying SMOTE on train set with ratio 0.5686141474348197...
2026-06-13 01:01:30,304 - preprocessing - INFO - Feature selection complete. Selected 18 / 19 features.
2026-06-13 01:01:32,510 - train_pipeline - INFO - Early stopping triggered at epoch 44
2026-06-13 01:01:32,528 - preprocessing - INFO - xAPI engineered features created: ['engagement_score', 'absence_risk', 'parent_support_signal']
2026-06-13 01:01:32,531 - preprocessing - INFO - xAPI engineered features created: ['engagement_score', 'absence_risk', 'parent_support_signal']
2026-06-13 01:01:32,552 - preprocessing - INFO - Applying SMOTE on train set with ratio 0.5686141474348197...
2026-06-13 01:01:32,672 - preprocessing - INFO - Feature selection complete. Selected 16 / 19 features.
2026-06-13 01:01:35,293 - train_pipeline - INFO - Early stopping triggered at epoch 57
2026-06-13 01:01:35,310 - preprocessing - INFO - xAPI engineered features created: ['engagement_score', 'absence_risk', 'parent_support_signal']
2026-06-13 01:01:35,312 - preprocessing - INFO - xAPI engineered features created: ['engagement_score', 'absence_risk', 'parent_support_signal']
2026-06-13 01:01:35,329 - preprocessing - INFO - Applying SMOTE on train set with ratio 0.5686141474348197...
2026-06-13 01:01:35,444 - preprocessing - INFO - Feature selection complete. Selected 18 / 19 features.
2026-06-13 01:01:38,181 - train_pipeline - INFO - Early stopping triggered at epoch 51
[I 2026-06-13 01:01:38,211] Trial 78 finished with value: 0.8049970876184268 and parameters: {'learning_rate': 0.005754352256862908, 'weight_decay': 0.0038630393922072805, 'batch_size': 64, 'oversample_method': 'smote', 'smote_ratio': 0.5686141474348197, 'resampling_k_neighbors': 2, 'cnn_channels': 16, 'cnn_kernel_size': 4, 'lstm_hidden_dim': 32, 'context_hidden_dim': 256, 'fusion_hidden_dim': 128, 'sequence_dropout': 0.14385047495143183, 'context_dropout': 0.20146588211698063, 'fusion_dropout': 0.2517420655597817}. Best is trial 55 with value: 0.8121442327638384.
2026-06-13 01:01:38,326 - preprocessing - INFO - xAPI engineered features created: ['engagement_score', 'absence_risk', 'parent_support_signal']
2026-06-13 01:01:38,329 - preprocessing - INFO - xAPI engineered features created: ['engagement_score', 'absence_risk', 'parent_support_signal']
2026-06-13 01:01:38,345 - preprocessing - INFO - Applying SMOTE on train set with ratio 0.7520243920779761...
2026-06-13 01:01:38,474 - preprocessing - INFO - Feature selection complete. Selected 16 / 19 features.
2026-06-13 01:01:40,177 - train_pipeline - INFO - Early stopping triggered at epoch 30
2026-06-13 01:01:40,195 - preprocessing - INFO - xAPI engineered features created: ['engagement_score', 'absence_risk', 'parent_support_signal']
2026-06-13 01:01:40,198 - preprocessing - INFO - xAPI engineered features created: ['engagement_score', 'absence_risk', 'parent_support_signal']
2026-06-13 01:01:40,214 - preprocessing - INFO - Applying SMOTE on train set with ratio 0.7520243920779761...
2026-06-13 01:01:40,342 - preprocessing - INFO - Feature selection complete. Selected 16 / 19 features.
2026-06-13 01:01:44,144 - train_pipeline - INFO - Early stopping triggered at epoch 62
2026-06-13 01:01:44,161 - preprocessing - INFO - xAPI engineered features created: ['engagement_score', 'absence_risk', 'parent_support_signal']
2026-06-13 01:01:44,163 - preprocessing - INFO - xAPI engineered features created: ['engagement_score', 'absence_risk', 'parent_support_signal']
2026-06-13 01:01:44,180 - preprocessing - INFO - Applying SMOTE on train set with ratio 0.7520243920779761...
2026-06-13 01:01:44,312 - preprocessing - INFO - Feature selection complete. Selected 18 / 19 features.
2026-06-13 01:01:46,162 - train_pipeline - INFO - Early stopping triggered at epoch 33
2026-06-13 01:01:46,179 - preprocessing - INFO - xAPI engineered features created: ['engagement_score', 'absence_risk', 'parent_support_signal']
2026-06-13 01:01:46,182 - preprocessing - INFO - xAPI engineered features created: ['engagement_score', 'absence_risk', 'parent_support_signal']
2026-06-13 01:01:46,199 - preprocessing - INFO - Applying SMOTE on train set with ratio 0.7520243920779761...
2026-06-13 01:01:46,324 - preprocessing - INFO - Feature selection complete. Selected 16 / 19 features.
2026-06-13 01:01:49,253 - train_pipeline - INFO - Early stopping triggered at epoch 50
