[I 2026-06-13 00:47:12,180] Trial 40 finished with value: 0.8003700991317431 and parameters: {'learning_rate': 0.02058609704986736, 'weight_decay': 0.0019564711144799897, 'batch_size': 64, 'oversample_method': 'adasyn', 'smote_ratio': 0.8429343814855088, 'resampling_k_neighbors': 6, 'cnn_channels': 64, 'cnn_kernel_size': 4, 'lstm_hidden_dim': 128, 'context_hidden_dim': 256, 'fusion_hidden_dim': 64, 'sequence_dropout': 0.14958078456877322, 'context_dropout': 0.42131840406662, 'fusion_dropout': 0.13646218455895165}. Best is trial 17 with value: 0.8075693134180814.
2026-06-13 00:47:12,295 - preprocessing - INFO - xAPI engineered features created: ['engagement_score', 'absence_risk', 'parent_support_signal']
2026-06-13 00:47:12,298 - preprocessing - INFO - xAPI engineered features created: ['engagement_score', 'absence_risk', 'parent_support_signal']
2026-06-13 00:47:12,315 - preprocessing - INFO - Applying SMOTE on train set with ratio 0.47807019049047905...
2026-06-13 00:47:12,431 - preprocessing - INFO - Feature selection complete. Selected 15 / 19 features.
2026-06-13 00:47:14,301 - train_pipeline - INFO - Early stopping triggered at epoch 27
2026-06-13 00:47:14,320 - preprocessing - INFO - xAPI engineered features created: ['engagement_score', 'absence_risk', 'parent_support_signal']
2026-06-13 00:47:14,323 - preprocessing - INFO - xAPI engineered features created: ['engagement_score', 'absence_risk', 'parent_support_signal']
2026-06-13 00:47:14,340 - preprocessing - INFO - Applying SMOTE on train set with ratio 0.47807019049047905...
2026-06-13 00:47:14,458 - preprocessing - INFO - Feature selection complete. Selected 16 / 19 features.
2026-06-13 00:47:16,530 - train_pipeline - INFO - Early stopping triggered at epoch 38
2026-06-13 00:47:16,547 - preprocessing - INFO - xAPI engineered features created: ['engagement_score', 'absence_risk', 'parent_support_signal']
2026-06-13 00:47:16,549 - preprocessing - INFO - xAPI engineered features created: ['engagement_score', 'absence_risk', 'parent_support_signal']
2026-06-13 00:47:16,566 - preprocessing - INFO - Applying SMOTE on train set with ratio 0.47807019049047905...
2026-06-13 00:47:16,682 - preprocessing - INFO - Feature selection complete. Selected 18 / 19 features.
2026-06-13 00:47:18,944 - train_pipeline - INFO - Early stopping triggered at epoch 41
2026-06-13 00:47:18,962 - preprocessing - INFO - xAPI engineered features created: ['engagement_score', 'absence_risk', 'parent_support_signal']
2026-06-13 00:47:18,964 - preprocessing - INFO - xAPI engineered features created: ['engagement_score', 'absence_risk', 'parent_support_signal']
2026-06-13 00:47:18,981 - preprocessing - INFO - Applying SMOTE on train set with ratio 0.47807019049047905...
2026-06-13 00:47:19,097 - preprocessing - INFO - Feature selection complete. Selected 16 / 19 features.
2026-06-13 00:47:22,268 - train_pipeline - INFO - Early stopping triggered at epoch 54
2026-06-13 00:47:22,292 - preprocessing - INFO - xAPI engineered features created: ['engagement_score', 'absence_risk', 'parent_support_signal']
2026-06-13 00:47:22,297 - preprocessing - INFO - xAPI engineered features created: ['engagement_score', 'absence_risk', 'parent_support_signal']
2026-06-13 00:47:22,323 - preprocessing - INFO - Applying SMOTE on train set with ratio 0.47807019049047905...
2026-06-13 00:47:22,488 - preprocessing - INFO - Feature selection complete. Selected 18 / 19 features.
2026-06-13 00:47:26,930 - train_pipeline - INFO - Early stopping triggered at epoch 71
[I 2026-06-13 00:47:26,963] Trial 41 finished with value: 0.7972132488699782 and parameters: {'learning_rate': 0.005440526255784736, 'weight_decay': 9.786126625281414e-05, 'batch_size': 64, 'oversample_method': 'smote', 'smote_ratio': 0.47807019049047905, 'resampling_k_neighbors': 3, 'cnn_channels': 16, 'cnn_kernel_size': 4, 'lstm_hidden_dim': 128, 'context_hidden_dim': 128, 'fusion_hidden_dim': 64, 'sequence_dropout': 0.13973913372365754, 'context_dropout': 0.42721166825398027, 'fusion_dropout': 0.4513263383821457}. Best is trial 17 with value: 0.8075693134180814.
2026-06-13 00:47:27,090 - preprocessing - INFO - xAPI engineered features created: ['engagement_score', 'absence_risk', 'parent_support_signal']
2026-06-13 00:47:27,092 - preprocessing - INFO - xAPI engineered features created: ['engagement_score', 'absence_risk', 'parent_support_signal']
2026-06-13 00:47:27,111 - preprocessing - INFO - Applying SMOTE on train set with ratio 0.4738879878266116...
2026-06-13 00:47:27,228 - preprocessing - INFO - Feature selection complete. Selected 15 / 19 features.
2026-06-13 00:47:31,764 - train_pipeline - INFO - Early stopping triggered at epoch 45
2026-06-13 00:47:31,782 - preprocessing - INFO - xAPI engineered features created: ['engagement_score', 'absence_risk', 'parent_support_signal']
2026-06-13 00:47:31,785 - preprocessing - INFO - xAPI engineered features created: ['engagement_score', 'absence_risk', 'parent_support_signal']
2026-06-13 00:47:31,802 - preprocessing - INFO - Applying SMOTE on train set with ratio 0.4738879878266116...
2026-06-13 00:47:31,920 - preprocessing - INFO - Feature selection complete. Selected 16 / 19 features.
2026-06-13 00:47:34,645 - train_pipeline - INFO - Early stopping triggered at epoch 30
2026-06-13 00:47:34,663 - preprocessing - INFO - xAPI engineered features created: ['engagement_score', 'absence_risk', 'parent_support_signal']
2026-06-13 00:47:34,666 - preprocessing - INFO - xAPI engineered features created: ['engagement_score', 'absence_risk', 'parent_support_signal']
2026-06-13 00:47:34,683 - preprocessing - INFO - Applying SMOTE on train set with ratio 0.4738879878266116...
2026-06-13 00:47:34,840 - preprocessing - INFO - Feature selection complete. Selected 18 / 19 features.
2026-06-13 00:47:40,732 - train_pipeline - INFO - Early stopping triggered at epoch 56
2026-06-13 00:47:40,752 - preprocessing - INFO - xAPI engineered features created: ['engagement_score', 'absence_risk', 'parent_support_signal']
2026-06-13 00:47:40,754 - preprocessing - INFO - xAPI engineered features created: ['engagement_score', 'absence_risk', 'parent_support_signal']
2026-06-13 00:47:40,772 - preprocessing - INFO - Applying SMOTE on train set with ratio 0.4738879878266116...
2026-06-13 00:47:40,898 - preprocessing - INFO - Feature selection complete. Selected 16 / 19 features.
2026-06-13 00:47:48,584 - train_pipeline - INFO - Early stopping triggered at epoch 78
2026-06-13 00:47:48,607 - preprocessing - INFO - xAPI engineered features created: ['engagement_score', 'absence_risk', 'parent_support_signal']
2026-06-13 00:47:48,611 - preprocessing - INFO - xAPI engineered features created: ['engagement_score', 'absence_risk', 'parent_support_signal']
2026-06-13 00:47:48,640 - preprocessing - INFO - Applying SMOTE on train set with ratio 0.4738879878266116...
2026-06-13 00:47:48,795 - preprocessing - INFO - Feature selection complete. Selected 18 / 19 features.
2026-06-13 00:47:53,670 - train_pipeline - INFO - Early stopping triggered at epoch 49
[I 2026-06-13 00:47:53,705] Trial 42 finished with value: 0.8019298655845134 and parameters: {'learning_rate': 0.005468789844360557, 'weight_decay': 0.0044126228876132725, 'batch_size': 32, 'oversample_method': 'smote', 'smote_ratio': 0.4738879878266116, 'resampling_k_neighbors': 3, 'cnn_channels': 16, 'cnn_kernel_size': 3, 'lstm_hidden_dim': 128, 'context_hidden_dim': 128, 'fusion_hidden_dim': 128, 'sequence_dropout': 0.12318973140549752, 'context_dropout': 0.20106216995990178, 'fusion_dropout': 0.2622906329305395}. Best is trial 17 with value: 0.8075693134180814.
2026-06-13 00:47:53,823 - preprocessing - INFO - xAPI engineered features created: ['engagement_score', 'absence_risk', 'parent_support_signal']
2026-06-13 00:47:53,824 - preprocessing - INFO - xAPI engineered features created: ['engagement_score', 'absence_risk', 'parent_support_signal']
2026-06-13 00:47:53,841 - preprocessing - INFO - Applying ADASYN on train set with ratio 0.7916076781304947...
2026-06-13 00:47:53,855 - preprocessing - WARNING - ADASYN failed (likely too few samples). Error: No samples will be generated with the provided ratio settings.. Falling back to no oversampling.
2026-06-13 00:47:53,968 - preprocessing - INFO - Feature selection complete. Selected 15 / 19 features.
2026-06-13 00:47:55,656 - train_pipeline - INFO - Early stopping triggered at epoch 31
2026-06-13 00:47:55,673 - preprocessing - INFO - xAPI engineered features created: ['engagement_score', 'absence_risk', 'parent_support_signal']
2026-06-13 00:47:55,675 - preprocessing - INFO - xAPI engineered features created: ['engagement_score', 'absence_risk', 'parent_support_signal']
2026-06-13 00:47:55,693 - preprocessing - INFO - Applying ADASYN on train set with ratio 0.7916076781304947...
2026-06-13 00:47:55,707 - preprocessing - WARNING - ADASYN failed (likely too few samples). Error: No samples will be generated with the provided ratio settings.. Falling back to no oversampling.
2026-06-13 00:47:55,825 - preprocessing - INFO - Feature selection complete. Selected 16 / 19 features.
2026-06-13 00:47:57,778 - train_pipeline - INFO - Early stopping triggered at epoch 36
2026-06-13 00:47:57,795 - preprocessing - INFO - xAPI engineered features created: ['engagement_score', 'absence_risk', 'parent_support_signal']
2026-06-13 00:47:57,797 - preprocessing - INFO - xAPI engineered features created: ['engagement_score', 'absence_risk', 'parent_support_signal']
2026-06-13 00:47:57,815 - preprocessing - INFO - Applying ADASYN on train set with ratio 0.7916076781304947...
2026-06-13 00:47:57,828 - preprocessing - WARNING - ADASYN failed (likely too few samples). Error: No samples will be generated with the provided ratio settings.. Falling back to no oversampling.
2026-06-13 00:47:57,941 - preprocessing - INFO - Feature selection complete. Selected 18 / 19 features.
2026-06-13 00:47:59,636 - train_pipeline - INFO - Early stopping triggered at epoch 31
2026-06-13 00:47:59,655 - preprocessing - INFO - xAPI engineered features created: ['engagement_score', 'absence_risk', 'parent_support_signal']
2026-06-13 00:47:59,657 - preprocessing - INFO - xAPI engineered features created: ['engagement_score', 'absence_risk', 'parent_support_signal']
2026-06-13 00:47:59,675 - preprocessing - INFO - Applying ADASYN on train set with ratio 0.7916076781304947...
2026-06-13 00:47:59,688 - preprocessing - WARNING - ADASYN failed (likely too few samples). Error: No samples will be generated with the provided ratio settings.. Falling back to no oversampling.
2026-06-13 00:47:59,810 - preprocessing - INFO - Feature selection complete. Selected 16 / 19 features.
2026-06-13 00:48:01,724 - train_pipeline - INFO - Early stopping triggered at epoch 35
2026-06-13 00:48:01,742 - preprocessing - INFO - xAPI engineered features created: ['engagement_score', 'absence_risk', 'parent_support_signal']
2026-06-13 00:48:01,744 - preprocessing - INFO - xAPI engineered features created: ['engagement_score', 'absence_risk', 'parent_support_signal']
2026-06-13 00:48:01,761 - preprocessing - INFO - Applying ADASYN on train set with ratio 0.7916076781304947...
2026-06-13 00:48:01,774 - preprocessing - WARNING - ADASYN failed (likely too few samples). Error: No samples will be generated with the provided ratio settings.. Falling back to no oversampling.
2026-06-13 00:48:01,899 - preprocessing - INFO - Feature selection complete. Selected 18 / 19 features.
2026-06-13 00:48:05,267 - train_pipeline - INFO - Early stopping triggered at epoch 58
[I 2026-06-13 00:48:05,310] Trial 43 finished with value: 0.7852202889107677 and parameters: {'learning_rate': 0.023621024165398206, 'weight_decay': 2.2539196421513487e-06, 'batch_size': 64, 'oversample_method': 'adasyn', 'smote_ratio': 0.7916076781304947, 'resampling_k_neighbors': 5, 'cnn_channels': 128, 'cnn_kernel_size': 4, 'lstm_hidden_dim': 64, 'context_hidden_dim': 256, 'fusion_hidden_dim': 32, 'sequence_dropout': 0.1110285838935885, 'context_dropout': 0.4060237691340397, 'fusion_dropout': 0.2204845255444462}. Best is trial 17 with value: 0.8075693134180814.
2026-06-13 00:48:05,455 - preprocessing - INFO - xAPI engineered features created: ['engagement_score', 'absence_risk', 'parent_support_signal']
2026-06-13 00:48:05,457 - preprocessing - INFO - xAPI engineered features created: ['engagement_score', 'absence_risk', 'parent_support_signal']
2026-06-13 00:48:05,483 - preprocessing - INFO - Applying ADASYN on train set with ratio 0.4543282940551356...
2026-06-13 00:48:05,627 - preprocessing - INFO - Feature selection complete. Selected 15 / 19 features.
2026-06-13 00:48:12,950 - train_pipeline - INFO - Early stopping triggered at epoch 68
2026-06-13 00:48:12,969 - preprocessing - INFO - xAPI engineered features created: ['engagement_score', 'absence_risk', 'parent_support_signal']
2026-06-13 00:48:12,971 - preprocessing - INFO - xAPI engineered features created: ['engagement_score', 'absence_risk', 'parent_support_signal']
2026-06-13 00:48:12,989 - preprocessing - INFO - Applying ADASYN on train set with ratio 0.4543282940551356...
2026-06-13 00:48:13,105 - preprocessing - INFO - Feature selection complete. Selected 16 / 19 features.
2026-06-13 00:48:19,117 - train_pipeline - INFO - Early stopping triggered at epoch 56
2026-06-13 00:48:19,137 - preprocessing - INFO - xAPI engineered features created: ['engagement_score', 'absence_risk', 'parent_support_signal']
2026-06-13 00:48:19,139 - preprocessing - INFO - xAPI engineered features created: ['engagement_score', 'absence_risk', 'parent_support_signal']
2026-06-13 00:48:19,156 - preprocessing - INFO - Applying ADASYN on train set with ratio 0.4543282940551356...
2026-06-13 00:48:19,273 - preprocessing - INFO - Feature selection complete. Selected 18 / 19 features.
2026-06-13 00:48:23,571 - train_pipeline - INFO - Early stopping triggered at epoch 38
[I 2026-06-13 00:48:23,596] Trial 44 pruned. 
2026-06-13 00:48:23,711 - preprocessing - INFO - xAPI engineered features created: ['engagement_score', 'absence_risk', 'parent_support_signal']
2026-06-13 00:48:23,713 - preprocessing - INFO - xAPI engineered features created: ['engagement_score', 'absence_risk', 'parent_support_signal']
2026-06-13 00:48:23,731 - preprocessing - INFO - Applying ADASYN on train set with ratio 0.872430224358474...
2026-06-13 00:48:23,869 - preprocessing - INFO - Feature selection complete. Selected 17 / 19 features.
2026-06-13 00:48:25,990 - train_pipeline - INFO - Early stopping triggered at epoch 35
2026-06-13 00:48:26,008 - preprocessing - INFO - xAPI engineered features created: ['engagement_score', 'absence_risk', 'parent_support_signal']
2026-06-13 00:48:26,010 - preprocessing - INFO - xAPI engineered features created: ['engagement_score', 'absence_risk', 'parent_support_signal']
2026-06-13 00:48:26,027 - preprocessing - INFO - Applying ADASYN on train set with ratio 0.872430224358474...
2026-06-13 00:48:26,160 - preprocessing - INFO - Feature selection complete. Selected 16 / 19 features.
2026-06-13 00:48:28,042 - train_pipeline - INFO - Early stopping triggered at epoch 31
2026-06-13 00:48:28,061 - preprocessing - INFO - xAPI engineered features created: ['engagement_score', 'absence_risk', 'parent_support_signal']
2026-06-13 00:48:28,064 - preprocessing - INFO - xAPI engineered features created: ['engagement_score', 'absence_risk', 'parent_support_signal']
2026-06-13 00:48:28,081 - preprocessing - INFO - Applying ADASYN on train set with ratio 0.872430224358474...
2026-06-13 00:48:28,214 - preprocessing - INFO - Feature selection complete. Selected 18 / 19 features.
2026-06-13 00:48:30,516 - train_pipeline - INFO - Early stopping triggered at epoch 38
2026-06-13 00:48:30,534 - preprocessing - INFO - xAPI engineered features created: ['engagement_score', 'absence_risk', 'parent_support_signal']
2026-06-13 00:48:30,536 - preprocessing - INFO - xAPI engineered features created: ['engagement_score', 'absence_risk', 'parent_support_signal']
2026-06-13 00:48:30,555 - preprocessing - INFO - Applying ADASYN on train set with ratio 0.872430224358474...
2026-06-13 00:48:30,570 - preprocessing - WARNING - ADASYN failed (likely too few samples). Error: No samples will be generated with the provided ratio settings.. Falling back to no oversampling.
2026-06-13 00:48:30,684 - preprocessing - INFO - Feature selection complete. Selected 16 / 19 features.
2026-06-13 00:48:32,991 - train_pipeline - INFO - Early stopping triggered at epoch 38
2026-06-13 00:48:33,008 - preprocessing - INFO - xAPI engineered features created: ['engagement_score', 'absence_risk', 'parent_support_signal']
2026-06-13 00:48:33,012 - preprocessing - INFO - xAPI engineered features created: ['engagement_score', 'absence_risk', 'parent_support_signal']
2026-06-13 00:48:33,032 - preprocessing - INFO - Applying ADASYN on train set with ratio 0.872430224358474...
2026-06-13 00:48:33,167 - preprocessing - INFO - Feature selection complete. Selected 18 / 19 features.
2026-06-13 00:48:36,109 - train_pipeline - INFO - Early stopping triggered at epoch 46
[I 2026-06-13 00:48:36,148] Trial 45 finished with value: 0.782762748941155 and parameters: {'learning_rate': 0.026201635445789406, 'weight_decay': 9.836527646847631e-05, 'batch_size': 64, 'oversample_method': 'adasyn', 'smote_ratio': 0.872430224358474, 'resampling_k_neighbors': 7, 'cnn_channels': 32, 'cnn_kernel_size': 4, 'lstm_hidden_dim': 64, 'context_hidden_dim': 256, 'fusion_hidden_dim': 128, 'sequence_dropout': 0.2562333224426188, 'context_dropout': 0.3836900072004662, 'fusion_dropout': 0.24615195374503046}. Best is trial 17 with value: 0.8075693134180814.
2026-06-13 00:48:36,303 - preprocessing - INFO - xAPI engineered features created: ['engagement_score', 'absence_risk', 'parent_support_signal']
2026-06-13 00:48:36,306 - preprocessing - INFO - xAPI engineered features created: ['engagement_score', 'absence_risk', 'parent_support_signal']
2026-06-13 00:48:36,331 - preprocessing - INFO - Applying ADASYN on train set with ratio 0.6161313870320494...
2026-06-13 00:48:36,340 - preprocessing - WARNING - ADASYN failed (likely too few samples). Error: No samples will be generated with the provided ratio settings.. Falling back to no oversampling.
2026-06-13 00:48:36,481 - preprocessing - INFO - Feature selection complete. Selected 15 / 19 features.
2026-06-13 00:48:41,340 - train_pipeline - INFO - Early stopping triggered at epoch 45
2026-06-13 00:48:41,358 - preprocessing - INFO - xAPI engineered features created: ['engagement_score', 'absence_risk', 'parent_support_signal']
2026-06-13 00:48:41,361 - preprocessing - INFO - xAPI engineered features created: ['engagement_score', 'absence_risk', 'parent_support_signal']
2026-06-13 00:48:41,379 - preprocessing - INFO - Applying ADASYN on train set with ratio 0.6161313870320494...
2026-06-13 00:48:41,385 - preprocessing - WARNING - ADASYN failed (likely too few samples). Error: No samples will be generated with the provided ratio settings.. Falling back to no oversampling.
2026-06-13 00:48:41,504 - preprocessing - INFO - Feature selection complete. Selected 16 / 19 features.
2026-06-13 00:48:50,018 - preprocessing - INFO - xAPI engineered features created: ['engagement_score', 'absence_risk', 'parent_support_signal']
2026-06-13 00:48:50,022 - preprocessing - INFO - xAPI engineered features created: ['engagement_score', 'absence_risk', 'parent_support_signal']
2026-06-13 00:48:50,045 - preprocessing - INFO - Applying ADASYN on train set with ratio 0.6161313870320494...
2026-06-13 00:48:50,054 - preprocessing - WARNING - ADASYN failed (likely too few samples). Error: No samples will be generated with the provided ratio settings.. Falling back to no oversampling.
2026-06-13 00:48:50,177 - preprocessing - INFO - Feature selection complete. Selected 18 / 19 features.
2026-06-13 00:48:55,153 - train_pipeline - INFO - Early stopping triggered at epoch 47
2026-06-13 00:48:55,170 - preprocessing - INFO - xAPI engineered features created: ['engagement_score', 'absence_risk', 'parent_support_signal']
2026-06-13 00:48:55,173 - preprocessing - INFO - xAPI engineered features created: ['engagement_score', 'absence_risk', 'parent_support_signal']
2026-06-13 00:48:55,191 - preprocessing - INFO - Applying ADASYN on train set with ratio 0.6161313870320494...
2026-06-13 00:48:55,198 - preprocessing - WARNING - ADASYN failed (likely too few samples). Error: No samples will be generated with the provided ratio settings.. Falling back to no oversampling.
2026-06-13 00:48:55,313 - preprocessing - INFO - Feature selection complete. Selected 16 / 19 features.
2026-06-13 00:49:01,142 - train_pipeline - INFO - Early stopping triggered at epoch 56
2026-06-13 00:49:01,160 - preprocessing - INFO - xAPI engineered features created: ['engagement_score', 'absence_risk', 'parent_support_signal']
2026-06-13 00:49:01,162 - preprocessing - INFO - xAPI engineered features created: ['engagement_score', 'absence_risk', 'parent_support_signal']
2026-06-13 00:49:01,179 - preprocessing - INFO - Applying ADASYN on train set with ratio 0.6161313870320494...
2026-06-13 00:49:01,186 - preprocessing - WARNING - ADASYN failed (likely too few samples). Error: No samples will be generated with the provided ratio settings.. Falling back to no oversampling.
2026-06-13 00:49:01,302 - preprocessing - INFO - Feature selection complete. Selected 18 / 19 features.
2026-06-13 00:49:08,578 - train_pipeline - INFO - Early stopping triggered at epoch 68
