[I 2026-06-13 00:26:41,727] Trial 5 finished with value: 0.7723044069007149 and parameters: {'learning_rate': 0.0006343360631052426, 'weight_decay': 6.220638781359827e-05, 'batch_size': 64, 'oversample_method': 'smote', 'smote_ratio': 0.3285425990883347, 'resampling_k_neighbors': 7, 'cnn_channels': 16, 'cnn_kernel_size': 4, 'lstm_hidden_dim': 64, 'context_hidden_dim': 64, 'fusion_hidden_dim': 64, 'sequence_dropout': 0.22092614545022585, 'context_dropout': 0.1372411071223597, 'fusion_dropout': 0.5486078789766634}. Best is trial 0 with value: 0.7792042287679527.
2026-06-13 00:26:41,861 - preprocessing - INFO - xAPI engineered features created: ['engagement_score', 'absence_risk', 'parent_support_signal']
2026-06-13 00:26:41,863 - preprocessing - INFO - xAPI engineered features created: ['engagement_score', 'absence_risk', 'parent_support_signal']
2026-06-13 00:26:41,883 - preprocessing - INFO - Applying SMOTE on train set with ratio 0.7494221523080014...
2026-06-13 00:26:42,025 - preprocessing - INFO - Feature selection complete. Selected 18 / 19 features.
2026-06-13 00:26:44,839 - train_pipeline - INFO - Early stopping triggered at epoch 37
2026-06-13 00:26:44,870 - preprocessing - INFO - xAPI engineered features created: ['engagement_score', 'absence_risk', 'parent_support_signal']
2026-06-13 00:26:44,870 - preprocessing - INFO - xAPI engineered features created: ['engagement_score', 'absence_risk', 'parent_support_signal']
2026-06-13 00:26:44,891 - preprocessing - INFO - Applying SMOTE on train set with ratio 0.7494221523080014...
2026-06-13 00:26:45,046 - preprocessing - INFO - Feature selection complete. Selected 16 / 19 features.
2026-06-13 00:26:49,622 - train_pipeline - INFO - Early stopping triggered at epoch 38
2026-06-13 00:26:49,642 - preprocessing - INFO - xAPI engineered features created: ['engagement_score', 'absence_risk', 'parent_support_signal']
2026-06-13 00:26:49,644 - preprocessing - INFO - xAPI engineered features created: ['engagement_score', 'absence_risk', 'parent_support_signal']
2026-06-13 00:26:49,664 - preprocessing - INFO - Applying SMOTE on train set with ratio 0.7494221523080014...
2026-06-13 00:26:49,832 - preprocessing - INFO - Feature selection complete. Selected 18 / 19 features.
2026-06-13 00:26:52,523 - train_pipeline - INFO - Early stopping triggered at epoch 34
2026-06-13 00:26:52,545 - preprocessing - INFO - xAPI engineered features created: ['engagement_score', 'absence_risk', 'parent_support_signal']
2026-06-13 00:26:52,548 - preprocessing - INFO - xAPI engineered features created: ['engagement_score', 'absence_risk', 'parent_support_signal']
2026-06-13 00:26:52,569 - preprocessing - INFO - Applying SMOTE on train set with ratio 0.7494221523080014...
2026-06-13 00:26:52,724 - preprocessing - INFO - Feature selection complete. Selected 16 / 19 features.
2026-06-13 00:26:55,822 - train_pipeline - INFO - Early stopping triggered at epoch 43
2026-06-13 00:26:55,842 - preprocessing - INFO - xAPI engineered features created: ['engagement_score', 'absence_risk', 'parent_support_signal']
2026-06-13 00:26:55,845 - preprocessing - INFO - xAPI engineered features created: ['engagement_score', 'absence_risk', 'parent_support_signal']
2026-06-13 00:26:55,865 - preprocessing - INFO - Applying SMOTE on train set with ratio 0.7494221523080014...
2026-06-13 00:26:56,006 - preprocessing - INFO - Feature selection complete. Selected 18 / 19 features.
2026-06-13 00:27:00,813 - train_pipeline - INFO - Early stopping triggered at epoch 74
[I 2026-06-13 00:27:00,847] Trial 6 finished with value: 0.7839824446939196 and parameters: {'learning_rate': 0.025131833615807113, 'weight_decay': 6.289393154519743e-05, 'batch_size': 64, 'oversample_method': 'smote', 'smote_ratio': 0.7494221523080014, 'resampling_k_neighbors': 2, 'cnn_channels': 32, 'cnn_kernel_size': 3, 'lstm_hidden_dim': 96, 'context_hidden_dim': 64, 'fusion_hidden_dim': 128, 'sequence_dropout': 0.3841543016677358, 'context_dropout': 0.137469907131237, 'fusion_dropout': 0.2838579015297168}. Best is trial 6 with value: 0.7839824446939196.
2026-06-13 00:27:00,964 - preprocessing - INFO - xAPI engineered features created: ['engagement_score', 'absence_risk', 'parent_support_signal']
2026-06-13 00:27:00,966 - preprocessing - INFO - xAPI engineered features created: ['engagement_score', 'absence_risk', 'parent_support_signal']
2026-06-13 00:27:00,983 - preprocessing - INFO - Applying SMOTE on train set with ratio 0.7038327192384514...
2026-06-13 00:27:01,098 - preprocessing - INFO - Feature selection complete. Selected 18 / 19 features.
2026-06-13 00:27:18,132 - train_pipeline - INFO - Early stopping triggered at epoch 48
2026-06-13 00:27:18,154 - preprocessing - INFO - xAPI engineered features created: ['engagement_score', 'absence_risk', 'parent_support_signal']
2026-06-13 00:27:18,156 - preprocessing - INFO - xAPI engineered features created: ['engagement_score', 'absence_risk', 'parent_support_signal']
2026-06-13 00:27:18,179 - preprocessing - INFO - Applying SMOTE on train set with ratio 0.7038327192384514...
2026-06-13 00:27:18,330 - preprocessing - INFO - Feature selection complete. Selected 16 / 19 features.
2026-06-13 00:27:30,848 - train_pipeline - INFO - Early stopping triggered at epoch 31
2026-06-13 00:27:30,876 - preprocessing - INFO - xAPI engineered features created: ['engagement_score', 'absence_risk', 'parent_support_signal']
2026-06-13 00:27:30,878 - preprocessing - INFO - xAPI engineered features created: ['engagement_score', 'absence_risk', 'parent_support_signal']
2026-06-13 00:27:30,909 - preprocessing - INFO - Applying SMOTE on train set with ratio 0.7038327192384514...
2026-06-13 00:27:31,098 - preprocessing - INFO - Feature selection complete. Selected 18 / 19 features.
2026-06-13 00:27:52,604 - train_pipeline - INFO - Early stopping triggered at epoch 65
2026-06-13 00:27:52,621 - preprocessing - INFO - xAPI engineered features created: ['engagement_score', 'absence_risk', 'parent_support_signal']
2026-06-13 00:27:52,621 - preprocessing - INFO - xAPI engineered features created: ['engagement_score', 'absence_risk', 'parent_support_signal']
2026-06-13 00:27:52,641 - preprocessing - INFO - Applying SMOTE on train set with ratio 0.7038327192384514...
2026-06-13 00:27:52,772 - preprocessing - INFO - Feature selection complete. Selected 16 / 19 features.
2026-06-13 00:28:09,143 - train_pipeline - INFO - Early stopping triggered at epoch 53
2026-06-13 00:28:09,164 - preprocessing - INFO - xAPI engineered features created: ['engagement_score', 'absence_risk', 'parent_support_signal']
2026-06-13 00:28:09,164 - preprocessing - INFO - xAPI engineered features created: ['engagement_score', 'absence_risk', 'parent_support_signal']
2026-06-13 00:28:09,185 - preprocessing - INFO - Applying SMOTE on train set with ratio 0.7038327192384514...
2026-06-13 00:28:09,318 - preprocessing - INFO - Feature selection complete. Selected 18 / 19 features.
2026-06-13 00:28:29,991 - train_pipeline - INFO - Early stopping triggered at epoch 68
[I 2026-06-13 00:28:30,021] Trial 7 finished with value: 0.775195108714347 and parameters: {'learning_rate': 0.0003123036840659046, 'weight_decay': 2.9103006766169193e-07, 'batch_size': 8, 'oversample_method': 'smote', 'smote_ratio': 0.7038327192384514, 'resampling_k_neighbors': 6, 'cnn_channels': 32, 'cnn_kernel_size': 4, 'lstm_hidden_dim': 32, 'context_hidden_dim': 128, 'fusion_hidden_dim': 32, 'sequence_dropout': 0.25846100257813887, 'context_dropout': 0.16779709867443698, 'fusion_dropout': 0.3784006312291751}. Best is trial 6 with value: 0.7839824446939196.
2026-06-13 00:28:30,140 - preprocessing - INFO - xAPI engineered features created: ['engagement_score', 'absence_risk', 'parent_support_signal']
2026-06-13 00:28:30,143 - preprocessing - INFO - xAPI engineered features created: ['engagement_score', 'absence_risk', 'parent_support_signal']
2026-06-13 00:28:30,162 - preprocessing - INFO - Applying ADASYN on train set with ratio 0.9141611503495688...
2026-06-13 00:28:30,301 - preprocessing - INFO - Feature selection complete. Selected 18 / 19 features.
2026-06-13 00:28:33,251 - train_pipeline - INFO - Early stopping triggered at epoch 42
2026-06-13 00:28:33,281 - preprocessing - INFO - xAPI engineered features created: ['engagement_score', 'absence_risk', 'parent_support_signal']
2026-06-13 00:28:33,286 - preprocessing - INFO - xAPI engineered features created: ['engagement_score', 'absence_risk', 'parent_support_signal']
2026-06-13 00:28:33,320 - preprocessing - INFO - Applying ADASYN on train set with ratio 0.9141611503495688...
2026-06-13 00:28:33,527 - preprocessing - INFO - Feature selection complete. Selected 16 / 19 features.
2026-06-13 00:28:36,940 - train_pipeline - INFO - Early stopping triggered at epoch 50
2026-06-13 00:28:36,965 - preprocessing - INFO - xAPI engineered features created: ['engagement_score', 'absence_risk', 'parent_support_signal']
2026-06-13 00:28:36,970 - preprocessing - INFO - xAPI engineered features created: ['engagement_score', 'absence_risk', 'parent_support_signal']
2026-06-13 00:28:37,002 - preprocessing - INFO - Applying ADASYN on train set with ratio 0.9141611503495688...
2026-06-13 00:28:37,215 - preprocessing - INFO - Feature selection complete. Selected 18 / 19 features.
2026-06-13 00:28:40,507 - train_pipeline - INFO - Early stopping triggered at epoch 48
2026-06-13 00:28:40,526 - preprocessing - INFO - xAPI engineered features created: ['engagement_score', 'absence_risk', 'parent_support_signal']
2026-06-13 00:28:40,529 - preprocessing - INFO - xAPI engineered features created: ['engagement_score', 'absence_risk', 'parent_support_signal']
2026-06-13 00:28:40,550 - preprocessing - INFO - Applying ADASYN on train set with ratio 0.9141611503495688...
2026-06-13 00:28:40,696 - preprocessing - INFO - Feature selection complete. Selected 17 / 19 features.
2026-06-13 00:28:46,216 - train_pipeline - INFO - Early stopping triggered at epoch 75
2026-06-13 00:28:46,235 - preprocessing - INFO - xAPI engineered features created: ['engagement_score', 'absence_risk', 'parent_support_signal']
2026-06-13 00:28:46,238 - preprocessing - INFO - xAPI engineered features created: ['engagement_score', 'absence_risk', 'parent_support_signal']
2026-06-13 00:28:46,257 - preprocessing - INFO - Applying ADASYN on train set with ratio 0.9141611503495688...
2026-06-13 00:28:46,405 - preprocessing - INFO - Feature selection complete. Selected 18 / 19 features.
2026-06-13 00:28:48,739 - train_pipeline - INFO - Early stopping triggered at epoch 36
[I 2026-06-13 00:28:48,772] Trial 8 finished with value: 0.7879746996276845 and parameters: {'learning_rate': 0.03216876046065344, 'weight_decay': 0.00015003023172658556, 'batch_size': 64, 'oversample_method': 'adasyn', 'smote_ratio': 0.9141611503495688, 'resampling_k_neighbors': 8, 'cnn_channels': 32, 'cnn_kernel_size': 4, 'lstm_hidden_dim': 32, 'context_hidden_dim': 256, 'fusion_hidden_dim': 256, 'sequence_dropout': 0.11797113689837105, 'context_dropout': 0.2862392072529841, 'fusion_dropout': 0.3713223173537883}. Best is trial 8 with value: 0.7879746996276845.
2026-06-13 00:28:48,893 - preprocessing - INFO - xAPI engineered features created: ['engagement_score', 'absence_risk', 'parent_support_signal']
2026-06-13 00:28:48,896 - preprocessing - INFO - xAPI engineered features created: ['engagement_score', 'absence_risk', 'parent_support_signal']
2026-06-13 00:28:48,915 - preprocessing - INFO - Applying ADASYN on train set with ratio 0.8389954871690275...
2026-06-13 00:28:48,932 - preprocessing - WARNING - ADASYN failed (likely too few samples). Error: No samples will be generated with the provided ratio settings.. Falling back to no oversampling.
2026-06-13 00:28:49,052 - preprocessing - INFO - Feature selection complete. Selected 15 / 19 features.
2026-06-13 00:28:56,361 - preprocessing - INFO - xAPI engineered features created: ['engagement_score', 'absence_risk', 'parent_support_signal']
2026-06-13 00:28:56,365 - preprocessing - INFO - xAPI engineered features created: ['engagement_score', 'absence_risk', 'parent_support_signal']
2026-06-13 00:28:56,397 - preprocessing - INFO - Applying ADASYN on train set with ratio 0.8389954871690275...
2026-06-13 00:28:56,605 - preprocessing - INFO - Feature selection complete. Selected 17 / 19 features.
2026-06-13 00:29:04,274 - preprocessing - INFO - xAPI engineered features created: ['engagement_score', 'absence_risk', 'parent_support_signal']
2026-06-13 00:29:04,276 - preprocessing - INFO - xAPI engineered features created: ['engagement_score', 'absence_risk', 'parent_support_signal']
2026-06-13 00:29:04,296 - preprocessing - INFO - Applying ADASYN on train set with ratio 0.8389954871690275...
2026-06-13 00:29:04,311 - preprocessing - WARNING - ADASYN failed (likely too few samples). Error: No samples will be generated with the provided ratio settings.. Falling back to no oversampling.
2026-06-13 00:29:04,439 - preprocessing - INFO - Feature selection complete. Selected 18 / 19 features.
2026-06-13 00:29:11,464 - preprocessing - INFO - xAPI engineered features created: ['engagement_score', 'absence_risk', 'parent_support_signal']
2026-06-13 00:29:11,467 - preprocessing - INFO - xAPI engineered features created: ['engagement_score', 'absence_risk', 'parent_support_signal']
2026-06-13 00:29:11,485 - preprocessing - INFO - Applying ADASYN on train set with ratio 0.8389954871690275...
2026-06-13 00:29:11,500 - preprocessing - WARNING - ADASYN failed (likely too few samples). Error: No samples will be generated with the provided ratio settings.. Falling back to no oversampling.
2026-06-13 00:29:11,626 - preprocessing - INFO - Feature selection complete. Selected 16 / 19 features.
2026-06-13 00:29:16,168 - train_pipeline - INFO - Early stopping triggered at epoch 50
2026-06-13 00:29:16,193 - preprocessing - INFO - xAPI engineered features created: ['engagement_score', 'absence_risk', 'parent_support_signal']
2026-06-13 00:29:16,198 - preprocessing - INFO - xAPI engineered features created: ['engagement_score', 'absence_risk', 'parent_support_signal']
2026-06-13 00:29:16,232 - preprocessing - INFO - Applying ADASYN on train set with ratio 0.8389954871690275...
2026-06-13 00:29:16,440 - preprocessing - INFO - Feature selection complete. Selected 18 / 19 features.
2026-06-13 00:29:22,448 - train_pipeline - INFO - Early stopping triggered at epoch 56
[I 2026-06-13 00:29:22,478] Trial 9 finished with value: 0.7604561721688011 and parameters: {'learning_rate': 0.0003619043145590698, 'weight_decay': 3.507515213502105e-05, 'batch_size': 32, 'oversample_method': 'adasyn', 'smote_ratio': 0.8389954871690275, 'resampling_k_neighbors': 3, 'cnn_channels': 16, 'cnn_kernel_size': 4, 'lstm_hidden_dim': 32, 'context_hidden_dim': 64, 'fusion_hidden_dim': 32, 'sequence_dropout': 0.1866471600354229, 'context_dropout': 0.1625748170684344, 'fusion_dropout': 0.22512144908229767}. Best is trial 8 with value: 0.7879746996276845.
2026-06-13 00:29:22,601 - preprocessing - INFO - xAPI engineered features created: ['engagement_score', 'absence_risk', 'parent_support_signal']
2026-06-13 00:29:22,604 - preprocessing - INFO - xAPI engineered features created: ['engagement_score', 'absence_risk', 'parent_support_signal']
2026-06-13 00:29:22,623 - preprocessing - INFO - Applying ADASYN on train set with ratio 0.7729197138900492...
2026-06-13 00:29:22,640 - preprocessing - WARNING - ADASYN failed (likely too few samples). Error: No samples will be generated with the provided ratio settings.. Falling back to no oversampling.
2026-06-13 00:29:22,761 - preprocessing - INFO - Feature selection complete. Selected 15 / 19 features.
2026-06-13 00:29:37,653 - train_pipeline - INFO - Early stopping triggered at epoch 44
2026-06-13 00:29:37,672 - preprocessing - INFO - xAPI engineered features created: ['engagement_score', 'absence_risk', 'parent_support_signal']
2026-06-13 00:29:37,675 - preprocessing - INFO - xAPI engineered features created: ['engagement_score', 'absence_risk', 'parent_support_signal']
2026-06-13 00:29:37,694 - preprocessing - INFO - Applying ADASYN on train set with ratio 0.7729197138900492...
2026-06-13 00:29:37,710 - preprocessing - WARNING - ADASYN failed (likely too few samples). Error: No samples will be generated with the provided ratio settings.. Falling back to no oversampling.
2026-06-13 00:29:37,839 - preprocessing - INFO - Feature selection complete. Selected 16 / 19 features.
2026-06-13 00:29:51,371 - train_pipeline - INFO - Early stopping triggered at epoch 42
2026-06-13 00:29:51,390 - preprocessing - INFO - xAPI engineered features created: ['engagement_score', 'absence_risk', 'parent_support_signal']
2026-06-13 00:29:51,393 - preprocessing - INFO - xAPI engineered features created: ['engagement_score', 'absence_risk', 'parent_support_signal']
2026-06-13 00:29:51,412 - preprocessing - INFO - Applying ADASYN on train set with ratio 0.7729197138900492...
2026-06-13 00:29:51,428 - preprocessing - WARNING - ADASYN failed (likely too few samples). Error: No samples will be generated with the provided ratio settings.. Falling back to no oversampling.
2026-06-13 00:29:51,557 - preprocessing - INFO - Feature selection complete. Selected 18 / 19 features.
2026-06-13 00:30:03,932 - train_pipeline - INFO - Early stopping triggered at epoch 38
2026-06-13 00:30:03,954 - preprocessing - INFO - xAPI engineered features created: ['engagement_score', 'absence_risk', 'parent_support_signal']
2026-06-13 00:30:03,956 - preprocessing - INFO - xAPI engineered features created: ['engagement_score', 'absence_risk', 'parent_support_signal']
2026-06-13 00:30:03,976 - preprocessing - INFO - Applying ADASYN on train set with ratio 0.7729197138900492...
2026-06-13 00:30:03,994 - preprocessing - WARNING - ADASYN failed (likely too few samples). Error: No samples will be generated with the provided ratio settings.. Falling back to no oversampling.
2026-06-13 00:30:04,126 - preprocessing - INFO - Feature selection complete. Selected 16 / 19 features.
2026-06-13 00:30:19,802 - train_pipeline - INFO - Early stopping triggered at epoch 48
2026-06-13 00:30:19,823 - preprocessing - INFO - xAPI engineered features created: ['engagement_score', 'absence_risk', 'parent_support_signal']
2026-06-13 00:30:19,826 - preprocessing - INFO - xAPI engineered features created: ['engagement_score', 'absence_risk', 'parent_support_signal']
2026-06-13 00:30:19,844 - preprocessing - INFO - Applying ADASYN on train set with ratio 0.7729197138900492...
2026-06-13 00:30:19,860 - preprocessing - WARNING - ADASYN failed (likely too few samples). Error: No samples will be generated with the provided ratio settings.. Falling back to no oversampling.
2026-06-13 00:30:19,995 - preprocessing - INFO - Feature selection complete. Selected 18 / 19 features.
2026-06-13 00:30:32,873 - train_pipeline - INFO - Early stopping triggered at epoch 40
