[I 2026-06-13 01:13:55,510] Trial 104 finished with value: 0.7990711005778153 and parameters: {'learning_rate': 0.020270811819883102, 'weight_decay': 0.0028464421657255173, 'batch_size': 64, 'oversample_method': 'smote', 'smote_ratio': 0.7928551702730767, 'resampling_k_neighbors': 2, 'cnn_channels': 16, 'cnn_kernel_size': 2, 'lstm_hidden_dim': 128, 'context_hidden_dim': 256, 'fusion_hidden_dim': 128, 'sequence_dropout': 0.2980623658053284, 'context_dropout': 0.1481935291724037, 'fusion_dropout': 0.13992933833960797}. Best is trial 55 with value: 0.8121442327638384.
2026-06-13 01:13:55,631 - preprocessing - INFO - xAPI engineered features created: ['engagement_score', 'absence_risk', 'parent_support_signal']
2026-06-13 01:13:55,633 - preprocessing - INFO - xAPI engineered features created: ['engagement_score', 'absence_risk', 'parent_support_signal']
2026-06-13 01:13:55,650 - preprocessing - INFO - Applying ADASYN on train set with ratio 0.5513120110491198...
2026-06-13 01:13:55,788 - preprocessing - INFO - Feature selection complete. Selected 15 / 19 features.
2026-06-13 01:14:05,679 - train_pipeline - INFO - Early stopping triggered at epoch 56
2026-06-13 01:14:05,697 - preprocessing - INFO - xAPI engineered features created: ['engagement_score', 'absence_risk', 'parent_support_signal']
2026-06-13 01:14:05,699 - preprocessing - INFO - xAPI engineered features created: ['engagement_score', 'absence_risk', 'parent_support_signal']
2026-06-13 01:14:05,716 - preprocessing - INFO - Applying ADASYN on train set with ratio 0.5513120110491198...
2026-06-13 01:14:05,833 - preprocessing - INFO - Feature selection complete. Selected 16 / 19 features.
2026-06-13 01:14:15,288 - train_pipeline - INFO - Early stopping triggered at epoch 53
2026-06-13 01:14:15,307 - preprocessing - INFO - xAPI engineered features created: ['engagement_score', 'absence_risk', 'parent_support_signal']
2026-06-13 01:14:15,309 - preprocessing - INFO - xAPI engineered features created: ['engagement_score', 'absence_risk', 'parent_support_signal']
2026-06-13 01:14:15,326 - preprocessing - INFO - Applying ADASYN on train set with ratio 0.5513120110491198...
2026-06-13 01:14:15,446 - preprocessing - INFO - Feature selection complete. Selected 18 / 19 features.
2026-06-13 01:14:25,990 - train_pipeline - INFO - Early stopping triggered at epoch 59
[I 2026-06-13 01:14:26,016] Trial 105 pruned. 
2026-06-13 01:14:26,133 - preprocessing - INFO - xAPI engineered features created: ['engagement_score', 'absence_risk', 'parent_support_signal']
2026-06-13 01:14:26,135 - preprocessing - INFO - xAPI engineered features created: ['engagement_score', 'absence_risk', 'parent_support_signal']
2026-06-13 01:14:26,153 - preprocessing - INFO - Applying SMOTE on train set with ratio 0.7783805150772286...
2026-06-13 01:14:26,280 - preprocessing - INFO - Feature selection complete. Selected 18 / 19 features.
2026-06-13 01:14:31,737 - train_pipeline - INFO - Early stopping triggered at epoch 35
2026-06-13 01:14:31,755 - preprocessing - INFO - xAPI engineered features created: ['engagement_score', 'absence_risk', 'parent_support_signal']
2026-06-13 01:14:31,758 - preprocessing - INFO - xAPI engineered features created: ['engagement_score', 'absence_risk', 'parent_support_signal']
2026-06-13 01:14:31,775 - preprocessing - INFO - Applying SMOTE on train set with ratio 0.7783805150772286...
2026-06-13 01:14:31,907 - preprocessing - INFO - Feature selection complete. Selected 16 / 19 features.
2026-06-13 01:14:42,508 - train_pipeline - INFO - Early stopping triggered at epoch 68
2026-06-13 01:14:42,525 - preprocessing - INFO - xAPI engineered features created: ['engagement_score', 'absence_risk', 'parent_support_signal']
2026-06-13 01:14:42,528 - preprocessing - INFO - xAPI engineered features created: ['engagement_score', 'absence_risk', 'parent_support_signal']
2026-06-13 01:14:42,546 - preprocessing - INFO - Applying SMOTE on train set with ratio 0.7783805150772286...
2026-06-13 01:14:42,677 - preprocessing - INFO - Feature selection complete. Selected 18 / 19 features.
2026-06-13 01:14:47,881 - train_pipeline - INFO - Early stopping triggered at epoch 33
2026-06-13 01:14:47,898 - preprocessing - INFO - xAPI engineered features created: ['engagement_score', 'absence_risk', 'parent_support_signal']
2026-06-13 01:14:47,900 - preprocessing - INFO - xAPI engineered features created: ['engagement_score', 'absence_risk', 'parent_support_signal']
2026-06-13 01:14:47,920 - preprocessing - INFO - Applying SMOTE on train set with ratio 0.7783805150772286...
2026-06-13 01:14:48,045 - preprocessing - INFO - Feature selection complete. Selected 16 / 19 features.
2026-06-13 01:14:55,686 - train_pipeline - INFO - Early stopping triggered at epoch 48
2026-06-13 01:14:55,709 - preprocessing - INFO - xAPI engineered features created: ['engagement_score', 'absence_risk', 'parent_support_signal']
2026-06-13 01:14:55,712 - preprocessing - INFO - xAPI engineered features created: ['engagement_score', 'absence_risk', 'parent_support_signal']
2026-06-13 01:14:55,733 - preprocessing - INFO - Applying SMOTE on train set with ratio 0.7783805150772286...
2026-06-13 01:14:55,889 - preprocessing - INFO - Feature selection complete. Selected 18 / 19 features.
2026-06-13 01:15:01,240 - train_pipeline - INFO - Early stopping triggered at epoch 34
[I 2026-06-13 01:15:01,271] Trial 106 finished with value: 0.8030967297807214 and parameters: {'learning_rate': 0.0037812849124976, 'weight_decay': 0.002024589324031295, 'batch_size': 16, 'oversample_method': 'smote', 'smote_ratio': 0.7783805150772286, 'resampling_k_neighbors': 2, 'cnn_channels': 16, 'cnn_kernel_size': 2, 'lstm_hidden_dim': 32, 'context_hidden_dim': 64, 'fusion_hidden_dim': 128, 'sequence_dropout': 0.26774949614959476, 'context_dropout': 0.1726860166802746, 'fusion_dropout': 0.13135583943891602}. Best is trial 55 with value: 0.8121442327638384.
2026-06-13 01:15:01,386 - preprocessing - INFO - xAPI engineered features created: ['engagement_score', 'absence_risk', 'parent_support_signal']
2026-06-13 01:15:01,389 - preprocessing - INFO - xAPI engineered features created: ['engagement_score', 'absence_risk', 'parent_support_signal']
2026-06-13 01:15:01,407 - preprocessing - INFO - Applying SMOTE on train set with ratio 0.8206523674383727...
2026-06-13 01:15:01,531 - preprocessing - INFO - Feature selection complete. Selected 18 / 19 features.
2026-06-13 01:15:11,711 - train_pipeline - INFO - Early stopping triggered at epoch 57
2026-06-13 01:15:11,729 - preprocessing - INFO - xAPI engineered features created: ['engagement_score', 'absence_risk', 'parent_support_signal']
2026-06-13 01:15:11,731 - preprocessing - INFO - xAPI engineered features created: ['engagement_score', 'absence_risk', 'parent_support_signal']
2026-06-13 01:15:11,747 - preprocessing - INFO - Applying SMOTE on train set with ratio 0.8206523674383727...
2026-06-13 01:15:11,872 - preprocessing - INFO - Feature selection complete. Selected 16 / 19 features.
2026-06-13 01:15:17,153 - train_pipeline - INFO - Early stopping triggered at epoch 30
2026-06-13 01:15:17,171 - preprocessing - INFO - xAPI engineered features created: ['engagement_score', 'absence_risk', 'parent_support_signal']
2026-06-13 01:15:17,173 - preprocessing - INFO - xAPI engineered features created: ['engagement_score', 'absence_risk', 'parent_support_signal']
2026-06-13 01:15:17,191 - preprocessing - INFO - Applying SMOTE on train set with ratio 0.8206523674383727...
2026-06-13 01:15:17,318 - preprocessing - INFO - Feature selection complete. Selected 18 / 19 features.
2026-06-13 01:15:26,227 - train_pipeline - INFO - Early stopping triggered at epoch 49
2026-06-13 01:15:26,245 - preprocessing - INFO - xAPI engineered features created: ['engagement_score', 'absence_risk', 'parent_support_signal']
2026-06-13 01:15:26,248 - preprocessing - INFO - xAPI engineered features created: ['engagement_score', 'absence_risk', 'parent_support_signal']
2026-06-13 01:15:26,265 - preprocessing - INFO - Applying SMOTE on train set with ratio 0.8206523674383727...
2026-06-13 01:15:26,398 - preprocessing - INFO - Feature selection complete. Selected 16 / 19 features.
2026-06-13 01:15:32,553 - train_pipeline - INFO - Early stopping triggered at epoch 35
2026-06-13 01:15:32,571 - preprocessing - INFO - xAPI engineered features created: ['engagement_score', 'absence_risk', 'parent_support_signal']
2026-06-13 01:15:32,573 - preprocessing - INFO - xAPI engineered features created: ['engagement_score', 'absence_risk', 'parent_support_signal']
2026-06-13 01:15:32,590 - preprocessing - INFO - Applying SMOTE on train set with ratio 0.8206523674383727...
2026-06-13 01:15:32,716 - preprocessing - INFO - Feature selection complete. Selected 18 / 19 features.
2026-06-13 01:15:41,784 - train_pipeline - INFO - Early stopping triggered at epoch 50
[I 2026-06-13 01:15:41,812] Trial 107 finished with value: 0.7812683061067476 and parameters: {'learning_rate': 0.0014214425208332012, 'weight_decay': 0.002969565096922791, 'batch_size': 16, 'oversample_method': 'smote', 'smote_ratio': 0.8206523674383727, 'resampling_k_neighbors': 2, 'cnn_channels': 128, 'cnn_kernel_size': 2, 'lstm_hidden_dim': 32, 'context_hidden_dim': 64, 'fusion_hidden_dim': 128, 'sequence_dropout': 0.30063156879201963, 'context_dropout': 0.1519976270651009, 'fusion_dropout': 0.2175456052154631}. Best is trial 55 with value: 0.8121442327638384.
2026-06-13 01:15:41,933 - preprocessing - INFO - xAPI engineered features created: ['engagement_score', 'absence_risk', 'parent_support_signal']
2026-06-13 01:15:41,936 - preprocessing - INFO - xAPI engineered features created: ['engagement_score', 'absence_risk', 'parent_support_signal']
2026-06-13 01:15:41,954 - preprocessing - INFO - Applying SMOTE on train set with ratio 0.730774288033414...
2026-06-13 01:15:42,078 - preprocessing - INFO - Feature selection complete. Selected 16 / 19 features.
2026-06-13 01:15:46,077 - train_pipeline - INFO - Early stopping triggered at epoch 26
2026-06-13 01:15:46,093 - preprocessing - INFO - xAPI engineered features created: ['engagement_score', 'absence_risk', 'parent_support_signal']
2026-06-13 01:15:46,095 - preprocessing - INFO - xAPI engineered features created: ['engagement_score', 'absence_risk', 'parent_support_signal']
2026-06-13 01:15:46,112 - preprocessing - INFO - Applying SMOTE on train set with ratio 0.730774288033414...
2026-06-13 01:15:46,237 - preprocessing - INFO - Feature selection complete. Selected 16 / 19 features.
2026-06-13 01:15:54,098 - train_pipeline - INFO - Early stopping triggered at epoch 51
2026-06-13 01:15:54,116 - preprocessing - INFO - xAPI engineered features created: ['engagement_score', 'absence_risk', 'parent_support_signal']
2026-06-13 01:15:54,118 - preprocessing - INFO - xAPI engineered features created: ['engagement_score', 'absence_risk', 'parent_support_signal']
2026-06-13 01:15:54,135 - preprocessing - INFO - Applying SMOTE on train set with ratio 0.730774288033414...
2026-06-13 01:15:54,260 - preprocessing - INFO - Feature selection complete. Selected 18 / 19 features.
2026-06-13 01:15:59,165 - train_pipeline - INFO - Early stopping triggered at epoch 32
[I 2026-06-13 01:15:59,190] Trial 108 pruned. 
2026-06-13 01:15:59,305 - preprocessing - INFO - xAPI engineered features created: ['engagement_score', 'absence_risk', 'parent_support_signal']
2026-06-13 01:15:59,308 - preprocessing - INFO - xAPI engineered features created: ['engagement_score', 'absence_risk', 'parent_support_signal']
2026-06-13 01:15:59,326 - preprocessing - INFO - Applying SMOTE on train set with ratio 0.941442551381827...
2026-06-13 01:15:59,453 - preprocessing - INFO - Feature selection complete. Selected 19 / 19 features.
2026-06-13 01:16:06,493 - train_pipeline - INFO - Early stopping triggered at epoch 40
2026-06-13 01:16:06,511 - preprocessing - INFO - xAPI engineered features created: ['engagement_score', 'absence_risk', 'parent_support_signal']
2026-06-13 01:16:06,513 - preprocessing - INFO - xAPI engineered features created: ['engagement_score', 'absence_risk', 'parent_support_signal']
2026-06-13 01:16:06,531 - preprocessing - INFO - Applying SMOTE on train set with ratio 0.941442551381827...
2026-06-13 01:16:06,663 - preprocessing - INFO - Feature selection complete. Selected 17 / 19 features.
2026-06-13 01:16:17,286 - train_pipeline - INFO - Early stopping triggered at epoch 60
2026-06-13 01:16:17,305 - preprocessing - INFO - xAPI engineered features created: ['engagement_score', 'absence_risk', 'parent_support_signal']
2026-06-13 01:16:17,307 - preprocessing - INFO - xAPI engineered features created: ['engagement_score', 'absence_risk', 'parent_support_signal']
2026-06-13 01:16:17,324 - preprocessing - INFO - Applying SMOTE on train set with ratio 0.941442551381827...
2026-06-13 01:16:17,450 - preprocessing - INFO - Feature selection complete. Selected 18 / 19 features.
2026-06-13 01:16:30,858 - train_pipeline - INFO - Early stopping triggered at epoch 76
[I 2026-06-13 01:16:30,883] Trial 109 pruned. 
2026-06-13 01:16:30,999 - preprocessing - INFO - xAPI engineered features created: ['engagement_score', 'absence_risk', 'parent_support_signal']
2026-06-13 01:16:31,001 - preprocessing - INFO - xAPI engineered features created: ['engagement_score', 'absence_risk', 'parent_support_signal']
2026-06-13 01:16:31,018 - preprocessing - INFO - Applying SMOTE on train set with ratio 0.5874789045928518...
2026-06-13 01:16:31,138 - preprocessing - INFO - Feature selection complete. Selected 15 / 19 features.
2026-06-13 01:16:34,173 - train_pipeline - INFO - Early stopping triggered at epoch 33
2026-06-13 01:16:34,199 - preprocessing - INFO - xAPI engineered features created: ['engagement_score', 'absence_risk', 'parent_support_signal']
2026-06-13 01:16:34,204 - preprocessing - INFO - xAPI engineered features created: ['engagement_score', 'absence_risk', 'parent_support_signal']
2026-06-13 01:16:34,230 - preprocessing - INFO - Applying SMOTE on train set with ratio 0.5874789045928518...
2026-06-13 01:16:34,410 - preprocessing - INFO - Feature selection complete. Selected 16 / 19 features.
2026-06-13 01:16:37,016 - train_pipeline - INFO - Early stopping triggered at epoch 28
2026-06-13 01:16:37,033 - preprocessing - INFO - xAPI engineered features created: ['engagement_score', 'absence_risk', 'parent_support_signal']
2026-06-13 01:16:37,037 - preprocessing - INFO - xAPI engineered features created: ['engagement_score', 'absence_risk', 'parent_support_signal']
2026-06-13 01:16:37,054 - preprocessing - INFO - Applying SMOTE on train set with ratio 0.5874789045928518...
2026-06-13 01:16:37,171 - preprocessing - INFO - Feature selection complete. Selected 18 / 19 features.
2026-06-13 01:16:40,187 - train_pipeline - INFO - Early stopping triggered at epoch 32
2026-06-13 01:16:40,213 - preprocessing - INFO - xAPI engineered features created: ['engagement_score', 'absence_risk', 'parent_support_signal']
2026-06-13 01:16:40,218 - preprocessing - INFO - xAPI engineered features created: ['engagement_score', 'absence_risk', 'parent_support_signal']
2026-06-13 01:16:40,254 - preprocessing - INFO - Applying SMOTE on train set with ratio 0.5874789045928518...
2026-06-13 01:16:40,426 - preprocessing - INFO - Feature selection complete. Selected 16 / 19 features.
2026-06-13 01:16:43,742 - train_pipeline - INFO - Early stopping triggered at epoch 36
2026-06-13 01:16:43,770 - preprocessing - INFO - xAPI engineered features created: ['engagement_score', 'absence_risk', 'parent_support_signal']
2026-06-13 01:16:43,774 - preprocessing - INFO - xAPI engineered features created: ['engagement_score', 'absence_risk', 'parent_support_signal']
2026-06-13 01:16:43,805 - preprocessing - INFO - Applying SMOTE on train set with ratio 0.5874789045928518...
2026-06-13 01:16:43,979 - preprocessing - INFO - Feature selection complete. Selected 18 / 19 features.
2026-06-13 01:16:49,808 - train_pipeline - INFO - Early stopping triggered at epoch 59
[I 2026-06-13 01:16:49,836] Trial 110 finished with value: 0.7974329474915571 and parameters: {'learning_rate': 0.004871916896567056, 'weight_decay': 0.00012218478622409097, 'batch_size': 32, 'oversample_method': 'smote', 'smote_ratio': 0.5874789045928518, 'resampling_k_neighbors': 4, 'cnn_channels': 16, 'cnn_kernel_size': 2, 'lstm_hidden_dim': 96, 'context_hidden_dim': 64, 'fusion_hidden_dim': 256, 'sequence_dropout': 0.23702838082137934, 'context_dropout': 0.12534701605934964, 'fusion_dropout': 0.15811017726794235}. Best is trial 55 with value: 0.8121442327638384.
2026-06-13 01:16:49,952 - preprocessing - INFO - xAPI engineered features created: ['engagement_score', 'absence_risk', 'parent_support_signal']
2026-06-13 01:16:49,955 - preprocessing - INFO - xAPI engineered features created: ['engagement_score', 'absence_risk', 'parent_support_signal']
2026-06-13 01:16:49,973 - preprocessing - INFO - Applying SMOTE on train set with ratio 0.8692092062525429...
2026-06-13 01:16:50,100 - preprocessing - INFO - Feature selection complete. Selected 18 / 19 features.
2026-06-13 01:16:59,064 - train_pipeline - INFO - Early stopping triggered at epoch 46
2026-06-13 01:16:59,083 - preprocessing - INFO - xAPI engineered features created: ['engagement_score', 'absence_risk', 'parent_support_signal']
2026-06-13 01:16:59,085 - preprocessing - INFO - xAPI engineered features created: ['engagement_score', 'absence_risk', 'parent_support_signal']
2026-06-13 01:16:59,102 - preprocessing - INFO - Applying SMOTE on train set with ratio 0.8692092062525429...
2026-06-13 01:16:59,230 - preprocessing - INFO - Feature selection complete. Selected 17 / 19 features.
2026-06-13 01:17:08,339 - train_pipeline - INFO - Early stopping triggered at epoch 47
2026-06-13 01:17:08,358 - preprocessing - INFO - xAPI engineered features created: ['engagement_score', 'absence_risk', 'parent_support_signal']
2026-06-13 01:17:08,361 - preprocessing - INFO - xAPI engineered features created: ['engagement_score', 'absence_risk', 'parent_support_signal']
2026-06-13 01:17:08,378 - preprocessing - INFO - Applying SMOTE on train set with ratio 0.8692092062525429...
2026-06-13 01:17:08,510 - preprocessing - INFO - Feature selection complete. Selected 18 / 19 features.
2026-06-13 01:17:14,634 - train_pipeline - INFO - Early stopping triggered at epoch 32
2026-06-13 01:17:14,651 - preprocessing - INFO - xAPI engineered features created: ['engagement_score', 'absence_risk', 'parent_support_signal']
2026-06-13 01:17:14,655 - preprocessing - INFO - xAPI engineered features created: ['engagement_score', 'absence_risk', 'parent_support_signal']
2026-06-13 01:17:14,672 - preprocessing - INFO - Applying SMOTE on train set with ratio 0.8692092062525429...
2026-06-13 01:17:14,798 - preprocessing - INFO - Feature selection complete. Selected 16 / 19 features.
2026-06-13 01:17:26,346 - train_pipeline - INFO - Early stopping triggered at epoch 61
2026-06-13 01:17:26,363 - preprocessing - INFO - xAPI engineered features created: ['engagement_score', 'absence_risk', 'parent_support_signal']
2026-06-13 01:17:26,366 - preprocessing - INFO - xAPI engineered features created: ['engagement_score', 'absence_risk', 'parent_support_signal']
2026-06-13 01:17:26,383 - preprocessing - INFO - Applying SMOTE on train set with ratio 0.8692092062525429...
2026-06-13 01:17:26,513 - preprocessing - INFO - Feature selection complete. Selected 19 / 19 features.
2026-06-13 01:17:35,534 - train_pipeline - INFO - Early stopping triggered at epoch 46
