[I 2026-06-13 01:10:09,824] Trial 98 pruned. 
2026-06-13 01:10:09,978 - preprocessing - INFO - xAPI engineered features created: ['engagement_score', 'absence_risk', 'parent_support_signal']
2026-06-13 01:10:09,981 - preprocessing - INFO - xAPI engineered features created: ['engagement_score', 'absence_risk', 'parent_support_signal']
2026-06-13 01:10:10,013 - preprocessing - INFO - Applying SMOTE on train set with ratio 0.668942681214152...
2026-06-13 01:10:10,207 - preprocessing - INFO - Feature selection complete. Selected 15 / 19 features.
2026-06-13 01:10:18,390 - train_pipeline - INFO - Early stopping triggered at epoch 41
2026-06-13 01:10:18,408 - preprocessing - INFO - xAPI engineered features created: ['engagement_score', 'absence_risk', 'parent_support_signal']
2026-06-13 01:10:18,410 - preprocessing - INFO - xAPI engineered features created: ['engagement_score', 'absence_risk', 'parent_support_signal']
2026-06-13 01:10:18,431 - preprocessing - INFO - Applying SMOTE on train set with ratio 0.668942681214152...
2026-06-13 01:10:18,581 - preprocessing - INFO - Feature selection complete. Selected 16 / 19 features.
2026-06-13 01:10:25,953 - train_pipeline - INFO - Early stopping triggered at epoch 37
2026-06-13 01:10:25,982 - preprocessing - INFO - xAPI engineered features created: ['engagement_score', 'absence_risk', 'parent_support_signal']
2026-06-13 01:10:25,985 - preprocessing - INFO - xAPI engineered features created: ['engagement_score', 'absence_risk', 'parent_support_signal']
2026-06-13 01:10:26,021 - preprocessing - INFO - Applying SMOTE on train set with ratio 0.668942681214152...
2026-06-13 01:10:26,230 - preprocessing - INFO - Feature selection complete. Selected 18 / 19 features.
2026-06-13 01:10:33,756 - train_pipeline - INFO - Early stopping triggered at epoch 36
2026-06-13 01:10:33,774 - preprocessing - INFO - xAPI engineered features created: ['engagement_score', 'absence_risk', 'parent_support_signal']
2026-06-13 01:10:33,777 - preprocessing - INFO - xAPI engineered features created: ['engagement_score', 'absence_risk', 'parent_support_signal']
2026-06-13 01:10:33,797 - preprocessing - INFO - Applying SMOTE on train set with ratio 0.668942681214152...
2026-06-13 01:10:33,919 - preprocessing - INFO - Feature selection complete. Selected 16 / 19 features.
2026-06-13 01:10:43,794 - train_pipeline - INFO - Early stopping triggered at epoch 48
2026-06-13 01:10:43,813 - preprocessing - INFO - xAPI engineered features created: ['engagement_score', 'absence_risk', 'parent_support_signal']
2026-06-13 01:10:43,817 - preprocessing - INFO - xAPI engineered features created: ['engagement_score', 'absence_risk', 'parent_support_signal']
2026-06-13 01:10:43,840 - preprocessing - INFO - Applying SMOTE on train set with ratio 0.668942681214152...
2026-06-13 01:10:43,973 - preprocessing - INFO - Feature selection complete. Selected 18 / 19 features.
2026-06-13 01:10:53,596 - train_pipeline - INFO - Early stopping triggered at epoch 47
[I 2026-06-13 01:10:53,624] Trial 99 finished with value: 0.8036718198666606 and parameters: {'learning_rate': 0.004513780396945745, 'weight_decay': 0.0004701954635644811, 'batch_size': 16, 'oversample_method': 'smote', 'smote_ratio': 0.668942681214152, 'resampling_k_neighbors': 3, 'cnn_channels': 16, 'cnn_kernel_size': 2, 'lstm_hidden_dim': 128, 'context_hidden_dim': 64, 'fusion_hidden_dim': 256, 'sequence_dropout': 0.25295436756547945, 'context_dropout': 0.2571705132200371, 'fusion_dropout': 0.18834019165731436}. Best is trial 55 with value: 0.8121442327638384.
2026-06-13 01:10:53,738 - preprocessing - INFO - xAPI engineered features created: ['engagement_score', 'absence_risk', 'parent_support_signal']
2026-06-13 01:10:53,741 - preprocessing - INFO - xAPI engineered features created: ['engagement_score', 'absence_risk', 'parent_support_signal']
2026-06-13 01:10:53,759 - preprocessing - INFO - Applying SMOTE on train set with ratio 0.48459862970045775...
2026-06-13 01:10:53,878 - preprocessing - INFO - Feature selection complete. Selected 15 / 19 features.
2026-06-13 01:10:57,291 - train_pipeline - INFO - Early stopping triggered at epoch 49
2026-06-13 01:10:57,320 - preprocessing - INFO - xAPI engineered features created: ['engagement_score', 'absence_risk', 'parent_support_signal']
2026-06-13 01:10:57,323 - preprocessing - INFO - xAPI engineered features created: ['engagement_score', 'absence_risk', 'parent_support_signal']
2026-06-13 01:10:57,358 - preprocessing - INFO - Applying SMOTE on train set with ratio 0.48459862970045775...
2026-06-13 01:10:57,553 - preprocessing - INFO - Feature selection complete. Selected 16 / 19 features.
2026-06-13 01:11:02,331 - train_pipeline - INFO - Early stopping triggered at epoch 65
2026-06-13 01:11:02,351 - preprocessing - INFO - xAPI engineered features created: ['engagement_score', 'absence_risk', 'parent_support_signal']
2026-06-13 01:11:02,353 - preprocessing - INFO - xAPI engineered features created: ['engagement_score', 'absence_risk', 'parent_support_signal']
2026-06-13 01:11:02,378 - preprocessing - INFO - Applying SMOTE on train set with ratio 0.48459862970045775...
2026-06-13 01:11:02,516 - preprocessing - INFO - Feature selection complete. Selected 18 / 19 features.
2026-06-13 01:11:05,636 - train_pipeline - INFO - Early stopping triggered at epoch 48
2026-06-13 01:11:05,654 - preprocessing - INFO - xAPI engineered features created: ['engagement_score', 'absence_risk', 'parent_support_signal']
2026-06-13 01:11:05,658 - preprocessing - INFO - xAPI engineered features created: ['engagement_score', 'absence_risk', 'parent_support_signal']
2026-06-13 01:11:05,685 - preprocessing - INFO - Applying SMOTE on train set with ratio 0.48459862970045775...
2026-06-13 01:11:05,865 - preprocessing - INFO - Feature selection complete. Selected 16 / 19 features.
2026-06-13 01:11:08,408 - train_pipeline - INFO - Early stopping triggered at epoch 32
2026-06-13 01:11:08,428 - preprocessing - INFO - xAPI engineered features created: ['engagement_score', 'absence_risk', 'parent_support_signal']
2026-06-13 01:11:08,431 - preprocessing - INFO - xAPI engineered features created: ['engagement_score', 'absence_risk', 'parent_support_signal']
2026-06-13 01:11:08,454 - preprocessing - INFO - Applying SMOTE on train set with ratio 0.48459862970045775...
2026-06-13 01:11:08,586 - preprocessing - INFO - Feature selection complete. Selected 18 / 19 features.
[I 2026-06-13 01:11:14,267] Trial 100 finished with value: 0.7891147259259393 and parameters: {'learning_rate': 0.0019277120538934978, 'weight_decay': 0.0053531741664283395, 'batch_size': 64, 'oversample_method': 'smote', 'smote_ratio': 0.48459862970045775, 'resampling_k_neighbors': 2, 'cnn_channels': 16, 'cnn_kernel_size': 4, 'lstm_hidden_dim': 128, 'context_hidden_dim': 256, 'fusion_hidden_dim': 256, 'sequence_dropout': 0.304618567481645, 'context_dropout': 0.17992388416498412, 'fusion_dropout': 0.11760435218632495}. Best is trial 55 with value: 0.8121442327638384.
2026-06-13 01:11:14,389 - preprocessing - INFO - xAPI engineered features created: ['engagement_score', 'absence_risk', 'parent_support_signal']
2026-06-13 01:11:14,392 - preprocessing - INFO - xAPI engineered features created: ['engagement_score', 'absence_risk', 'parent_support_signal']
2026-06-13 01:11:14,412 - preprocessing - INFO - Applying SMOTE on train set with ratio 0.7348024400521764...
2026-06-13 01:11:14,557 - preprocessing - INFO - Feature selection complete. Selected 16 / 19 features.
2026-06-13 01:11:21,156 - train_pipeline - INFO - Early stopping triggered at epoch 33
2026-06-13 01:11:21,175 - preprocessing - INFO - xAPI engineered features created: ['engagement_score', 'absence_risk', 'parent_support_signal']
2026-06-13 01:11:21,177 - preprocessing - INFO - xAPI engineered features created: ['engagement_score', 'absence_risk', 'parent_support_signal']
2026-06-13 01:11:21,196 - preprocessing - INFO - Applying SMOTE on train set with ratio 0.7348024400521764...
2026-06-13 01:11:21,346 - preprocessing - INFO - Feature selection complete. Selected 16 / 19 features.
2026-06-13 01:11:30,971 - train_pipeline - INFO - Early stopping triggered at epoch 46
2026-06-13 01:11:30,992 - preprocessing - INFO - xAPI engineered features created: ['engagement_score', 'absence_risk', 'parent_support_signal']
2026-06-13 01:11:30,994 - preprocessing - INFO - xAPI engineered features created: ['engagement_score', 'absence_risk', 'parent_support_signal']
2026-06-13 01:11:31,019 - preprocessing - INFO - Applying SMOTE on train set with ratio 0.7348024400521764...
2026-06-13 01:11:31,169 - preprocessing - INFO - Feature selection complete. Selected 18 / 19 features.
2026-06-13 01:11:40,990 - train_pipeline - INFO - Early stopping triggered at epoch 46
2026-06-13 01:11:41,012 - preprocessing - INFO - xAPI engineered features created: ['engagement_score', 'absence_risk', 'parent_support_signal']
2026-06-13 01:11:41,014 - preprocessing - INFO - xAPI engineered features created: ['engagement_score', 'absence_risk', 'parent_support_signal']
2026-06-13 01:11:41,032 - preprocessing - INFO - Applying SMOTE on train set with ratio 0.7348024400521764...
2026-06-13 01:11:41,186 - preprocessing - INFO - Feature selection complete. Selected 16 / 19 features.
2026-06-13 01:11:57,367 - preprocessing - INFO - xAPI engineered features created: ['engagement_score', 'absence_risk', 'parent_support_signal']
2026-06-13 01:11:57,371 - preprocessing - INFO - xAPI engineered features created: ['engagement_score', 'absence_risk', 'parent_support_signal']
2026-06-13 01:11:57,388 - preprocessing - INFO - Applying SMOTE on train set with ratio 0.7348024400521764...
2026-06-13 01:11:57,516 - preprocessing - INFO - Feature selection complete. Selected 18 / 19 features.
2026-06-13 01:12:05,172 - train_pipeline - INFO - Early stopping triggered at epoch 41
[I 2026-06-13 01:12:05,214] Trial 101 finished with value: 0.8025441391645914 and parameters: {'learning_rate': 0.002473060896840155, 'weight_decay': 0.0004717833981850301, 'batch_size': 16, 'oversample_method': 'smote', 'smote_ratio': 0.7348024400521764, 'resampling_k_neighbors': 4, 'cnn_channels': 16, 'cnn_kernel_size': 2, 'lstm_hidden_dim': 128, 'context_hidden_dim': 64, 'fusion_hidden_dim': 256, 'sequence_dropout': 0.19183471267994257, 'context_dropout': 0.3102651011097941, 'fusion_dropout': 0.2338337706237396}. Best is trial 55 with value: 0.8121442327638384.
2026-06-13 01:12:05,368 - preprocessing - INFO - xAPI engineered features created: ['engagement_score', 'absence_risk', 'parent_support_signal']
2026-06-13 01:12:05,372 - preprocessing - INFO - xAPI engineered features created: ['engagement_score', 'absence_risk', 'parent_support_signal']
2026-06-13 01:12:05,395 - preprocessing - INFO - Applying SMOTE on train set with ratio 0.6151464130243046...
2026-06-13 01:12:05,543 - preprocessing - INFO - Feature selection complete. Selected 15 / 19 features.
2026-06-13 01:12:10,704 - preprocessing - INFO - xAPI engineered features created: ['engagement_score', 'absence_risk', 'parent_support_signal']
2026-06-13 01:12:10,707 - preprocessing - INFO - xAPI engineered features created: ['engagement_score', 'absence_risk', 'parent_support_signal']
2026-06-13 01:12:10,725 - preprocessing - INFO - Applying SMOTE on train set with ratio 0.6151464130243046...
2026-06-13 01:12:10,847 - preprocessing - INFO - Feature selection complete. Selected 16 / 19 features.
2026-06-13 01:12:13,579 - train_pipeline - INFO - Early stopping triggered at epoch 47
2026-06-13 01:12:13,597 - preprocessing - INFO - xAPI engineered features created: ['engagement_score', 'absence_risk', 'parent_support_signal']
2026-06-13 01:12:13,599 - preprocessing - INFO - xAPI engineered features created: ['engagement_score', 'absence_risk', 'parent_support_signal']
2026-06-13 01:12:13,618 - preprocessing - INFO - Applying SMOTE on train set with ratio 0.6151464130243046...
2026-06-13 01:12:13,752 - preprocessing - INFO - Feature selection complete. Selected 18 / 19 features.
2026-06-13 01:12:17,197 - train_pipeline - INFO - Early stopping triggered at epoch 52
2026-06-13 01:12:17,215 - preprocessing - INFO - xAPI engineered features created: ['engagement_score', 'absence_risk', 'parent_support_signal']
2026-06-13 01:12:17,217 - preprocessing - INFO - xAPI engineered features created: ['engagement_score', 'absence_risk', 'parent_support_signal']
2026-06-13 01:12:17,234 - preprocessing - INFO - Applying SMOTE on train set with ratio 0.6151464130243046...
2026-06-13 01:12:17,357 - preprocessing - INFO - Feature selection complete. Selected 16 / 19 features.
2026-06-13 01:12:19,620 - train_pipeline - INFO - Early stopping triggered at epoch 39
2026-06-13 01:12:19,639 - preprocessing - INFO - xAPI engineered features created: ['engagement_score', 'absence_risk', 'parent_support_signal']
2026-06-13 01:12:19,642 - preprocessing - INFO - xAPI engineered features created: ['engagement_score', 'absence_risk', 'parent_support_signal']
2026-06-13 01:12:19,658 - preprocessing - INFO - Applying SMOTE on train set with ratio 0.6151464130243046...
2026-06-13 01:12:19,812 - preprocessing - INFO - Feature selection complete. Selected 18 / 19 features.
2026-06-13 01:12:22,204 - train_pipeline - INFO - Early stopping triggered at epoch 34
[I 2026-06-13 01:12:22,233] Trial 102 finished with value: 0.7928270571365978 and parameters: {'learning_rate': 0.02200115581668342, 'weight_decay': 2.3475512213128115e-05, 'batch_size': 64, 'oversample_method': 'smote', 'smote_ratio': 0.6151464130243046, 'resampling_k_neighbors': 6, 'cnn_channels': 128, 'cnn_kernel_size': 2, 'lstm_hidden_dim': 96, 'context_hidden_dim': 128, 'fusion_hidden_dim': 128, 'sequence_dropout': 0.34764427590672026, 'context_dropout': 0.3162277580754439, 'fusion_dropout': 0.3543063678905758}. Best is trial 55 with value: 0.8121442327638384.
2026-06-13 01:12:22,353 - preprocessing - INFO - xAPI engineered features created: ['engagement_score', 'absence_risk', 'parent_support_signal']
2026-06-13 01:12:22,355 - preprocessing - INFO - xAPI engineered features created: ['engagement_score', 'absence_risk', 'parent_support_signal']
2026-06-13 01:12:22,371 - preprocessing - INFO - Applying SMOTE on train set with ratio 0.798678775035345...
2026-06-13 01:12:22,497 - preprocessing - INFO - Feature selection complete. Selected 18 / 19 features.
2026-06-13 01:12:40,974 - train_pipeline - INFO - Early stopping triggered at epoch 53
2026-06-13 01:12:40,993 - preprocessing - INFO - xAPI engineered features created: ['engagement_score', 'absence_risk', 'parent_support_signal']
2026-06-13 01:12:40,997 - preprocessing - INFO - xAPI engineered features created: ['engagement_score', 'absence_risk', 'parent_support_signal']
2026-06-13 01:12:41,013 - preprocessing - INFO - Applying SMOTE on train set with ratio 0.798678775035345...
2026-06-13 01:12:41,148 - preprocessing - INFO - Feature selection complete. Selected 17 / 19 features.
2026-06-13 01:12:56,188 - train_pipeline - INFO - Early stopping triggered at epoch 43
2026-06-13 01:12:56,205 - preprocessing - INFO - xAPI engineered features created: ['engagement_score', 'absence_risk', 'parent_support_signal']
2026-06-13 01:12:56,207 - preprocessing - INFO - xAPI engineered features created: ['engagement_score', 'absence_risk', 'parent_support_signal']
2026-06-13 01:12:56,224 - preprocessing - INFO - Applying SMOTE on train set with ratio 0.798678775035345...
2026-06-13 01:12:56,349 - preprocessing - INFO - Feature selection complete. Selected 18 / 19 features.
2026-06-13 01:13:08,180 - train_pipeline - INFO - Early stopping triggered at epoch 33
2026-06-13 01:13:08,198 - preprocessing - INFO - xAPI engineered features created: ['engagement_score', 'absence_risk', 'parent_support_signal']
2026-06-13 01:13:08,201 - preprocessing - INFO - xAPI engineered features created: ['engagement_score', 'absence_risk', 'parent_support_signal']
2026-06-13 01:13:08,219 - preprocessing - INFO - Applying SMOTE on train set with ratio 0.798678775035345...
2026-06-13 01:13:08,342 - preprocessing - INFO - Feature selection complete. Selected 16 / 19 features.
2026-06-13 01:13:22,354 - train_pipeline - INFO - Early stopping triggered at epoch 40
2026-06-13 01:13:22,371 - preprocessing - INFO - xAPI engineered features created: ['engagement_score', 'absence_risk', 'parent_support_signal']
2026-06-13 01:13:22,374 - preprocessing - INFO - xAPI engineered features created: ['engagement_score', 'absence_risk', 'parent_support_signal']
2026-06-13 01:13:22,391 - preprocessing - INFO - Applying SMOTE on train set with ratio 0.798678775035345...
2026-06-13 01:13:22,522 - preprocessing - INFO - Feature selection complete. Selected 18 / 19 features.
2026-06-13 01:13:33,915 - train_pipeline - INFO - Early stopping triggered at epoch 31
[I 2026-06-13 01:13:33,944] Trial 103 finished with value: 0.789271762432813 and parameters: {'learning_rate': 0.0037426539232084683, 'weight_decay': 0.0006009878858342032, 'batch_size': 8, 'oversample_method': 'smote', 'smote_ratio': 0.798678775035345, 'resampling_k_neighbors': 2, 'cnn_channels': 16, 'cnn_kernel_size': 3, 'lstm_hidden_dim': 128, 'context_hidden_dim': 256, 'fusion_hidden_dim': 32, 'sequence_dropout': 0.1259643512442751, 'context_dropout': 0.1442065648944209, 'fusion_dropout': 0.13406971605004545}. Best is trial 55 with value: 0.8121442327638384.
2026-06-13 01:13:34,061 - preprocessing - INFO - xAPI engineered features created: ['engagement_score', 'absence_risk', 'parent_support_signal']
2026-06-13 01:13:34,063 - preprocessing - INFO - xAPI engineered features created: ['engagement_score', 'absence_risk', 'parent_support_signal']
2026-06-13 01:13:34,080 - preprocessing - INFO - Applying SMOTE on train set with ratio 0.7928551702730767...
2026-06-13 01:13:34,207 - preprocessing - INFO - Feature selection complete. Selected 18 / 19 features.
2026-06-13 01:13:38,690 - train_pipeline - INFO - Early stopping triggered at epoch 59
2026-06-13 01:13:38,709 - preprocessing - INFO - xAPI engineered features created: ['engagement_score', 'absence_risk', 'parent_support_signal']
2026-06-13 01:13:38,712 - preprocessing - INFO - xAPI engineered features created: ['engagement_score', 'absence_risk', 'parent_support_signal']
2026-06-13 01:13:38,729 - preprocessing - INFO - Applying SMOTE on train set with ratio 0.7928551702730767...
2026-06-13 01:13:38,855 - preprocessing - INFO - Feature selection complete. Selected 17 / 19 features.
2026-06-13 01:13:44,664 - train_pipeline - INFO - Early stopping triggered at epoch 78
2026-06-13 01:13:44,688 - preprocessing - INFO - xAPI engineered features created: ['engagement_score', 'absence_risk', 'parent_support_signal']
2026-06-13 01:13:44,690 - preprocessing - INFO - xAPI engineered features created: ['engagement_score', 'absence_risk', 'parent_support_signal']
2026-06-13 01:13:44,708 - preprocessing - INFO - Applying SMOTE on train set with ratio 0.7928551702730767...
2026-06-13 01:13:44,837 - preprocessing - INFO - Feature selection complete. Selected 18 / 19 features.
2026-06-13 01:13:47,579 - train_pipeline - INFO - Early stopping triggered at epoch 39
2026-06-13 01:13:47,603 - preprocessing - INFO - xAPI engineered features created: ['engagement_score', 'absence_risk', 'parent_support_signal']
2026-06-13 01:13:47,606 - preprocessing - INFO - xAPI engineered features created: ['engagement_score', 'absence_risk', 'parent_support_signal']
2026-06-13 01:13:47,634 - preprocessing - INFO - Applying SMOTE on train set with ratio 0.7928551702730767...
2026-06-13 01:13:47,800 - preprocessing - INFO - Feature selection complete. Selected 16 / 19 features.
2026-06-13 01:13:51,727 - train_pipeline - INFO - Early stopping triggered at epoch 51
2026-06-13 01:13:51,753 - preprocessing - INFO - xAPI engineered features created: ['engagement_score', 'absence_risk', 'parent_support_signal']
2026-06-13 01:13:51,757 - preprocessing - INFO - xAPI engineered features created: ['engagement_score', 'absence_risk', 'parent_support_signal']
2026-06-13 01:13:51,788 - preprocessing - INFO - Applying SMOTE on train set with ratio 0.7928551702730767...
2026-06-13 01:13:51,985 - preprocessing - INFO - Feature selection complete. Selected 18 / 19 features.
2026-06-13 01:13:55,479 - train_pipeline - INFO - Early stopping triggered at epoch 46
