[I 2026-06-13 00:30:32,905] Trial 10 finished with value: 0.7738769302981879 and parameters: {'learning_rate': 0.040382343649777684, 'weight_decay': 0.0002548814943314707, 'batch_size': 8, 'oversample_method': 'adasyn', 'smote_ratio': 0.7729197138900492, 'resampling_k_neighbors': 10, 'cnn_channels': 32, 'cnn_kernel_size': 4, 'lstm_hidden_dim': 32, 'context_hidden_dim': 256, 'fusion_hidden_dim': 256, 'sequence_dropout': 0.29063632026566766, 'context_dropout': 0.1038021699118894, 'fusion_dropout': 0.39216403767137853}. Best is trial 8 with value: 0.7879746996276845.
2026-06-13 00:30:33,025 - preprocessing - INFO - xAPI engineered features created: ['engagement_score', 'absence_risk', 'parent_support_signal']
2026-06-13 00:30:33,028 - preprocessing - INFO - xAPI engineered features created: ['engagement_score', 'absence_risk', 'parent_support_signal']
2026-06-13 00:30:33,046 - preprocessing - INFO - Applying SMOTE on train set with ratio 0.638105164872981...
2026-06-13 00:30:33,178 - preprocessing - INFO - Feature selection complete. Selected 15 / 19 features.
2026-06-13 00:30:35,068 - train_pipeline - INFO - Early stopping triggered at epoch 34
2026-06-13 00:30:35,087 - preprocessing - INFO - xAPI engineered features created: ['engagement_score', 'absence_risk', 'parent_support_signal']
2026-06-13 00:30:35,089 - preprocessing - INFO - xAPI engineered features created: ['engagement_score', 'absence_risk', 'parent_support_signal']
2026-06-13 00:30:35,108 - preprocessing - INFO - Applying SMOTE on train set with ratio 0.638105164872981...
2026-06-13 00:30:35,244 - preprocessing - INFO - Feature selection complete. Selected 16 / 19 features.
2026-06-13 00:30:38,507 - train_pipeline - INFO - Early stopping triggered at epoch 55
2026-06-13 00:30:38,532 - preprocessing - INFO - xAPI engineered features created: ['engagement_score', 'absence_risk', 'parent_support_signal']
2026-06-13 00:30:38,536 - preprocessing - INFO - xAPI engineered features created: ['engagement_score', 'absence_risk', 'parent_support_signal']
2026-06-13 00:30:38,564 - preprocessing - INFO - Applying SMOTE on train set with ratio 0.638105164872981...
2026-06-13 00:30:38,743 - preprocessing - INFO - Feature selection complete. Selected 18 / 19 features.
2026-06-13 00:30:41,707 - train_pipeline - INFO - Early stopping triggered at epoch 48
2026-06-13 00:30:41,728 - preprocessing - INFO - xAPI engineered features created: ['engagement_score', 'absence_risk', 'parent_support_signal']
2026-06-13 00:30:41,730 - preprocessing - INFO - xAPI engineered features created: ['engagement_score', 'absence_risk', 'parent_support_signal']
2026-06-13 00:30:41,773 - preprocessing - INFO - Applying SMOTE on train set with ratio 0.638105164872981...
2026-06-13 00:30:41,995 - preprocessing - INFO - Feature selection complete. Selected 16 / 19 features.
2026-06-13 00:30:44,616 - train_pipeline - INFO - Early stopping triggered at epoch 37
2026-06-13 00:30:44,638 - preprocessing - INFO - xAPI engineered features created: ['engagement_score', 'absence_risk', 'parent_support_signal']
2026-06-13 00:30:44,641 - preprocessing - INFO - xAPI engineered features created: ['engagement_score', 'absence_risk', 'parent_support_signal']
2026-06-13 00:30:44,664 - preprocessing - INFO - Applying SMOTE on train set with ratio 0.638105164872981...
2026-06-13 00:30:44,821 - preprocessing - INFO - Feature selection complete. Selected 18 / 19 features.
2026-06-13 00:30:47,602 - train_pipeline - INFO - Early stopping triggered at epoch 46
[I 2026-06-13 00:30:47,635] Trial 11 finished with value: 0.7993331016353091 and parameters: {'learning_rate': 0.03945244201399777, 'weight_decay': 0.0001019172087103462, 'batch_size': 64, 'oversample_method': 'smote', 'smote_ratio': 0.638105164872981, 'resampling_k_neighbors': 3, 'cnn_channels': 32, 'cnn_kernel_size': 3, 'lstm_hidden_dim': 64, 'context_hidden_dim': 256, 'fusion_hidden_dim': 128, 'sequence_dropout': 0.2942567468657954, 'context_dropout': 0.1723852988088883, 'fusion_dropout': 0.33629997879022416}. Best is trial 11 with value: 0.7993331016353091.
2026-06-13 00:30:47,759 - preprocessing - INFO - xAPI engineered features created: ['engagement_score', 'absence_risk', 'parent_support_signal']
2026-06-13 00:30:47,762 - preprocessing - INFO - xAPI engineered features created: ['engagement_score', 'absence_risk', 'parent_support_signal']
2026-06-13 00:30:47,786 - preprocessing - INFO - Applying ADASYN on train set with ratio 0.8567048280244615...
2026-06-13 00:30:47,807 - preprocessing - WARNING - ADASYN failed (likely too few samples). Error: No samples will be generated with the provided ratio settings.. Falling back to no oversampling.
2026-06-13 00:30:47,936 - preprocessing - INFO - Feature selection complete. Selected 15 / 19 features.
2026-06-13 00:30:50,753 - train_pipeline - INFO - Early stopping triggered at epoch 40
2026-06-13 00:30:50,787 - preprocessing - INFO - xAPI engineered features created: ['engagement_score', 'absence_risk', 'parent_support_signal']
2026-06-13 00:30:50,791 - preprocessing - INFO - xAPI engineered features created: ['engagement_score', 'absence_risk', 'parent_support_signal']
2026-06-13 00:30:50,835 - preprocessing - INFO - Applying ADASYN on train set with ratio 0.8567048280244615...
2026-06-13 00:30:51,112 - preprocessing - INFO - Feature selection complete. Selected 16 / 19 features.
2026-06-13 00:30:54,569 - train_pipeline - INFO - Early stopping triggered at epoch 32
2026-06-13 00:30:54,594 - preprocessing - INFO - xAPI engineered features created: ['engagement_score', 'absence_risk', 'parent_support_signal']
2026-06-13 00:30:54,597 - preprocessing - INFO - xAPI engineered features created: ['engagement_score', 'absence_risk', 'parent_support_signal']
2026-06-13 00:30:54,623 - preprocessing - INFO - Applying ADASYN on train set with ratio 0.8567048280244615...
2026-06-13 00:30:54,644 - preprocessing - WARNING - ADASYN failed (likely too few samples). Error: No samples will be generated with the provided ratio settings.. Falling back to no oversampling.
2026-06-13 00:30:54,845 - preprocessing - INFO - Feature selection complete. Selected 18 / 19 features.
2026-06-13 00:30:58,801 - train_pipeline - INFO - Early stopping triggered at epoch 44
2026-06-13 00:30:58,836 - preprocessing - INFO - xAPI engineered features created: ['engagement_score', 'absence_risk', 'parent_support_signal']
2026-06-13 00:30:58,841 - preprocessing - INFO - xAPI engineered features created: ['engagement_score', 'absence_risk', 'parent_support_signal']
2026-06-13 00:30:58,889 - preprocessing - INFO - Applying ADASYN on train set with ratio 0.8567048280244615...
2026-06-13 00:30:58,931 - preprocessing - WARNING - ADASYN failed (likely too few samples). Error: No samples will be generated with the provided ratio settings.. Falling back to no oversampling.
2026-06-13 00:30:59,171 - preprocessing - INFO - Feature selection complete. Selected 16 / 19 features.
2026-06-13 00:31:02,352 - train_pipeline - INFO - Early stopping triggered at epoch 34
2026-06-13 00:31:02,375 - preprocessing - INFO - xAPI engineered features created: ['engagement_score', 'absence_risk', 'parent_support_signal']
2026-06-13 00:31:02,378 - preprocessing - INFO - xAPI engineered features created: ['engagement_score', 'absence_risk', 'parent_support_signal']
2026-06-13 00:31:02,404 - preprocessing - INFO - Applying ADASYN on train set with ratio 0.8567048280244615...
2026-06-13 00:31:02,603 - preprocessing - INFO - Feature selection complete. Selected 18 / 19 features.
2026-06-13 00:31:10,339 - train_pipeline - INFO - Early stopping triggered at epoch 65
[I 2026-06-13 00:31:10,383] Trial 12 finished with value: 0.8007844714913273 and parameters: {'learning_rate': 0.015803597337062752, 'weight_decay': 5.023812916676588e-05, 'batch_size': 64, 'oversample_method': 'adasyn', 'smote_ratio': 0.8567048280244615, 'resampling_k_neighbors': 6, 'cnn_channels': 32, 'cnn_kernel_size': 4, 'lstm_hidden_dim': 64, 'context_hidden_dim': 256, 'fusion_hidden_dim': 256, 'sequence_dropout': 0.1316091729264987, 'context_dropout': 0.3935763718696601, 'fusion_dropout': 0.2711086028893792}. Best is trial 12 with value: 0.8007844714913273.
2026-06-13 00:31:10,533 - preprocessing - INFO - xAPI engineered features created: ['engagement_score', 'absence_risk', 'parent_support_signal']
2026-06-13 00:31:10,537 - preprocessing - INFO - xAPI engineered features created: ['engagement_score', 'absence_risk', 'parent_support_signal']
2026-06-13 00:31:10,567 - preprocessing - INFO - Applying SMOTE on train set with ratio 0.7824638853109046...
2026-06-13 00:31:10,741 - preprocessing - INFO - Feature selection complete. Selected 16 / 19 features.
2026-06-13 00:31:28,144 - train_pipeline - INFO - Early stopping triggered at epoch 33
2026-06-13 00:31:28,169 - preprocessing - INFO - xAPI engineered features created: ['engagement_score', 'absence_risk', 'parent_support_signal']
2026-06-13 00:31:28,173 - preprocessing - INFO - xAPI engineered features created: ['engagement_score', 'absence_risk', 'parent_support_signal']
2026-06-13 00:31:28,204 - preprocessing - INFO - Applying SMOTE on train set with ratio 0.7824638853109046...
2026-06-13 00:31:28,413 - preprocessing - INFO - Feature selection complete. Selected 16 / 19 features.
2026-06-13 00:31:47,886 - train_pipeline - INFO - Early stopping triggered at epoch 38
2026-06-13 00:31:47,914 - preprocessing - INFO - xAPI engineered features created: ['engagement_score', 'absence_risk', 'parent_support_signal']
2026-06-13 00:31:47,917 - preprocessing - INFO - xAPI engineered features created: ['engagement_score', 'absence_risk', 'parent_support_signal']
2026-06-13 00:31:47,942 - preprocessing - INFO - Applying SMOTE on train set with ratio 0.7824638853109046...
2026-06-13 00:31:48,116 - preprocessing - INFO - Feature selection complete. Selected 18 / 19 features.
2026-06-13 00:32:12,542 - train_pipeline - INFO - Early stopping triggered at epoch 47
2026-06-13 00:32:12,569 - preprocessing - INFO - xAPI engineered features created: ['engagement_score', 'absence_risk', 'parent_support_signal']
2026-06-13 00:32:12,574 - preprocessing - INFO - xAPI engineered features created: ['engagement_score', 'absence_risk', 'parent_support_signal']
2026-06-13 00:32:12,600 - preprocessing - INFO - Applying SMOTE on train set with ratio 0.7824638853109046...
2026-06-13 00:32:12,800 - preprocessing - INFO - Feature selection complete. Selected 16 / 19 features.
2026-06-13 00:32:40,729 - train_pipeline - INFO - Early stopping triggered at epoch 50
2026-06-13 00:32:40,762 - preprocessing - INFO - xAPI engineered features created: ['engagement_score', 'absence_risk', 'parent_support_signal']
2026-06-13 00:32:40,766 - preprocessing - INFO - xAPI engineered features created: ['engagement_score', 'absence_risk', 'parent_support_signal']
2026-06-13 00:32:40,801 - preprocessing - INFO - Applying SMOTE on train set with ratio 0.7824638853109046...
2026-06-13 00:32:41,010 - preprocessing - INFO - Feature selection complete. Selected 19 / 19 features.
2026-06-13 00:33:00,675 - train_pipeline - INFO - Early stopping triggered at epoch 33
[I 2026-06-13 00:33:00,722] Trial 13 finished with value: 0.7970695700043566 and parameters: {'learning_rate': 0.021308996942972128, 'weight_decay': 7.853545290518436e-05, 'batch_size': 8, 'oversample_method': 'smote', 'smote_ratio': 0.7824638853109046, 'resampling_k_neighbors': 4, 'cnn_channels': 32, 'cnn_kernel_size': 3, 'lstm_hidden_dim': 64, 'context_hidden_dim': 256, 'fusion_hidden_dim': 64, 'sequence_dropout': 0.22901006151069928, 'context_dropout': 0.17307991018288327, 'fusion_dropout': 0.48461573545488973}. Best is trial 12 with value: 0.8007844714913273.
2026-06-13 00:33:00,875 - preprocessing - INFO - xAPI engineered features created: ['engagement_score', 'absence_risk', 'parent_support_signal']
2026-06-13 00:33:00,878 - preprocessing - INFO - xAPI engineered features created: ['engagement_score', 'absence_risk', 'parent_support_signal']
2026-06-13 00:33:00,904 - preprocessing - INFO - Applying ADASYN on train set with ratio 0.9115969875790898...
2026-06-13 00:33:01,099 - preprocessing - INFO - Feature selection complete. Selected 16 / 19 features.
2026-06-13 00:33:24,474 - train_pipeline - INFO - Early stopping triggered at epoch 49
2026-06-13 00:33:24,494 - preprocessing - INFO - xAPI engineered features created: ['engagement_score', 'absence_risk', 'parent_support_signal']
2026-06-13 00:33:24,496 - preprocessing - INFO - xAPI engineered features created: ['engagement_score', 'absence_risk', 'parent_support_signal']
2026-06-13 00:33:24,514 - preprocessing - INFO - Applying ADASYN on train set with ratio 0.9115969875790898...
2026-06-13 00:33:24,657 - preprocessing - INFO - Feature selection complete. Selected 17 / 19 features.
2026-06-13 00:33:36,577 - train_pipeline - INFO - Early stopping triggered at epoch 33
2026-06-13 00:33:36,594 - preprocessing - INFO - xAPI engineered features created: ['engagement_score', 'absence_risk', 'parent_support_signal']
2026-06-13 00:33:36,596 - preprocessing - INFO - xAPI engineered features created: ['engagement_score', 'absence_risk', 'parent_support_signal']
2026-06-13 00:33:36,612 - preprocessing - INFO - Applying ADASYN on train set with ratio 0.9115969875790898...
2026-06-13 00:33:36,743 - preprocessing - INFO - Feature selection complete. Selected 17 / 19 features.
2026-06-13 00:33:49,084 - train_pipeline - INFO - Early stopping triggered at epoch 35
2026-06-13 00:33:49,101 - preprocessing - INFO - xAPI engineered features created: ['engagement_score', 'absence_risk', 'parent_support_signal']
2026-06-13 00:33:49,103 - preprocessing - INFO - xAPI engineered features created: ['engagement_score', 'absence_risk', 'parent_support_signal']
2026-06-13 00:33:49,122 - preprocessing - INFO - Applying ADASYN on train set with ratio 0.9115969875790898...
2026-06-13 00:33:49,257 - preprocessing - INFO - Feature selection complete. Selected 17 / 19 features.
2026-06-13 00:34:01,574 - train_pipeline - INFO - Early stopping triggered at epoch 35
2026-06-13 00:34:01,591 - preprocessing - INFO - xAPI engineered features created: ['engagement_score', 'absence_risk', 'parent_support_signal']
2026-06-13 00:34:01,593 - preprocessing - INFO - xAPI engineered features created: ['engagement_score', 'absence_risk', 'parent_support_signal']
2026-06-13 00:34:01,611 - preprocessing - INFO - Applying ADASYN on train set with ratio 0.9115969875790898...
2026-06-13 00:34:01,744 - preprocessing - INFO - Feature selection complete. Selected 18 / 19 features.
2026-06-13 00:34:24,652 - train_pipeline - INFO - Early stopping triggered at epoch 66
[I 2026-06-13 00:34:24,680] Trial 14 finished with value: 0.786990032172556 and parameters: {'learning_rate': 0.010716832229373245, 'weight_decay': 4.46180040252656e-07, 'batch_size': 8, 'oversample_method': 'adasyn', 'smote_ratio': 0.9115969875790898, 'resampling_k_neighbors': 3, 'cnn_channels': 32, 'cnn_kernel_size': 4, 'lstm_hidden_dim': 64, 'context_hidden_dim': 64, 'fusion_hidden_dim': 256, 'sequence_dropout': 0.1492136462210521, 'context_dropout': 0.3294744755399679, 'fusion_dropout': 0.22725108921997234}. Best is trial 12 with value: 0.8007844714913273.
2026-06-13 00:34:24,793 - preprocessing - INFO - xAPI engineered features created: ['engagement_score', 'absence_risk', 'parent_support_signal']
2026-06-13 00:34:24,795 - preprocessing - INFO - xAPI engineered features created: ['engagement_score', 'absence_risk', 'parent_support_signal']
2026-06-13 00:34:24,811 - preprocessing - INFO - Applying ADASYN on train set with ratio 0.7891947035141805...
2026-06-13 00:34:24,826 - preprocessing - WARNING - ADASYN failed (likely too few samples). Error: No samples will be generated with the provided ratio settings.. Falling back to no oversampling.
2026-06-13 00:34:24,942 - preprocessing - INFO - Feature selection complete. Selected 15 / 19 features.
2026-06-13 00:34:27,443 - train_pipeline - INFO - Early stopping triggered at epoch 44
2026-06-13 00:34:27,462 - preprocessing - INFO - xAPI engineered features created: ['engagement_score', 'absence_risk', 'parent_support_signal']
2026-06-13 00:34:27,464 - preprocessing - INFO - xAPI engineered features created: ['engagement_score', 'absence_risk', 'parent_support_signal']
2026-06-13 00:34:27,483 - preprocessing - INFO - Applying ADASYN on train set with ratio 0.7891947035141805...
2026-06-13 00:34:27,499 - preprocessing - WARNING - ADASYN failed (likely too few samples). Error: No samples will be generated with the provided ratio settings.. Falling back to no oversampling.
2026-06-13 00:34:27,613 - preprocessing - INFO - Feature selection complete. Selected 16 / 19 features.
2026-06-13 00:34:29,937 - train_pipeline - INFO - Early stopping triggered at epoch 34
2026-06-13 00:34:29,955 - preprocessing - INFO - xAPI engineered features created: ['engagement_score', 'absence_risk', 'parent_support_signal']
2026-06-13 00:34:29,957 - preprocessing - INFO - xAPI engineered features created: ['engagement_score', 'absence_risk', 'parent_support_signal']
2026-06-13 00:34:29,974 - preprocessing - INFO - Applying ADASYN on train set with ratio 0.7891947035141805...
2026-06-13 00:34:29,989 - preprocessing - WARNING - ADASYN failed (likely too few samples). Error: No samples will be generated with the provided ratio settings.. Falling back to no oversampling.
2026-06-13 00:34:30,102 - preprocessing - INFO - Feature selection complete. Selected 18 / 19 features.
2026-06-13 00:34:32,147 - train_pipeline - INFO - Early stopping triggered at epoch 36
[I 2026-06-13 00:34:32,174] Trial 15 pruned. 
2026-06-13 00:34:32,287 - preprocessing - INFO - xAPI engineered features created: ['engagement_score', 'absence_risk', 'parent_support_signal']
2026-06-13 00:34:32,290 - preprocessing - INFO - xAPI engineered features created: ['engagement_score', 'absence_risk', 'parent_support_signal']
2026-06-13 00:34:32,308 - preprocessing - INFO - Applying SMOTE on train set with ratio 0.7758279934732906...
2026-06-13 00:34:32,435 - preprocessing - INFO - Feature selection complete. Selected 19 / 19 features.
2026-06-13 00:34:38,726 - preprocessing - INFO - xAPI engineered features created: ['engagement_score', 'absence_risk', 'parent_support_signal']
2026-06-13 00:34:38,729 - preprocessing - INFO - xAPI engineered features created: ['engagement_score', 'absence_risk', 'parent_support_signal']
2026-06-13 00:34:38,746 - preprocessing - INFO - Applying SMOTE on train set with ratio 0.7758279934732906...
2026-06-13 00:34:38,870 - preprocessing - INFO - Feature selection complete. Selected 16 / 19 features.
2026-06-13 00:34:40,905 - train_pipeline - INFO - Early stopping triggered at epoch 30
2026-06-13 00:34:40,923 - preprocessing - INFO - xAPI engineered features created: ['engagement_score', 'absence_risk', 'parent_support_signal']
2026-06-13 00:34:40,925 - preprocessing - INFO - xAPI engineered features created: ['engagement_score', 'absence_risk', 'parent_support_signal']
2026-06-13 00:34:40,945 - preprocessing - INFO - Applying SMOTE on train set with ratio 0.7758279934732906...
2026-06-13 00:34:41,068 - preprocessing - INFO - Feature selection complete. Selected 17 / 19 features.
2026-06-13 00:34:44,732 - train_pipeline - INFO - Early stopping triggered at epoch 49
2026-06-13 00:34:44,754 - preprocessing - INFO - xAPI engineered features created: ['engagement_score', 'absence_risk', 'parent_support_signal']
2026-06-13 00:34:44,757 - preprocessing - INFO - xAPI engineered features created: ['engagement_score', 'absence_risk', 'parent_support_signal']
2026-06-13 00:34:44,780 - preprocessing - INFO - Applying SMOTE on train set with ratio 0.7758279934732906...
2026-06-13 00:34:44,943 - preprocessing - INFO - Feature selection complete. Selected 17 / 19 features.
2026-06-13 00:34:50,448 - train_pipeline - INFO - Early stopping triggered at epoch 75
2026-06-13 00:34:50,467 - preprocessing - INFO - xAPI engineered features created: ['engagement_score', 'absence_risk', 'parent_support_signal']
2026-06-13 00:34:50,469 - preprocessing - INFO - xAPI engineered features created: ['engagement_score', 'absence_risk', 'parent_support_signal']
2026-06-13 00:34:50,486 - preprocessing - INFO - Applying SMOTE on train set with ratio 0.7758279934732906...
2026-06-13 00:34:50,616 - preprocessing - INFO - Feature selection complete. Selected 18 / 19 features.
2026-06-13 00:34:55,180 - train_pipeline - INFO - Early stopping triggered at epoch 61
