2026-06-12 22:26:18,020 - run_pipeline - INFO - Starting approved thesis pipeline for xapi.
C:\Users\THPhu\AppData\Local\Programs\Python\Python310\lib\site-packages\optuna\_experimental.py:33: ExperimentalWarning: Argument ``multivariate`` is an experimental feature. The interface can change in the future.
  optuna_warn(
[I 2026-06-12 22:26:19,190] A new study created in RDB with name: xapi_3class_cnn_bilstm_mlp
2026-06-12 22:26:19,205 - run_pipeline - INFO - Optuna target: 150 trials; finished: 0; remaining: 150.
2026-06-12 22:26:19,353 - preprocessing - INFO - xAPI engineered features created: ['engagement_score', 'absence_risk', 'parent_support_signal']
2026-06-12 22:26:19,353 - preprocessing - INFO - xAPI engineered features created: ['engagement_score', 'absence_risk', 'parent_support_signal']
2026-06-12 22:26:19,358 - preprocessing - INFO - Applying ADASYN on train set with ratio 0.7207805082202461...
2026-06-12 22:26:20,718 - preprocessing - WARNING - ADASYN failed (likely too few samples). Error: No samples will be generated with the provided ratio settings.. Falling back to no oversampling.
2026-06-12 22:26:20,837 - preprocessing - INFO - Feature selection complete. Selected 15 / 19 features.
2026-06-12 22:26:50,161 - train_pipeline - INFO - Early stopping triggered at epoch 80
2026-06-12 22:26:50,188 - preprocessing - INFO - xAPI engineered features created: ['engagement_score', 'absence_risk', 'parent_support_signal']
2026-06-12 22:26:50,188 - preprocessing - INFO - xAPI engineered features created: ['engagement_score', 'absence_risk', 'parent_support_signal']
2026-06-12 22:26:50,209 - preprocessing - INFO - Applying ADASYN on train set with ratio 0.7207805082202461...
2026-06-12 22:26:50,216 - preprocessing - WARNING - ADASYN failed (likely too few samples). Error: No samples will be generated with the provided ratio settings.. Falling back to no oversampling.
2026-06-12 22:26:50,348 - preprocessing - INFO - Feature selection complete. Selected 16 / 19 features.
2026-06-12 22:27:15,579 - train_pipeline - INFO - Early stopping triggered at epoch 73
2026-06-12 22:27:15,600 - preprocessing - INFO - xAPI engineered features created: ['engagement_score', 'absence_risk', 'parent_support_signal']
2026-06-12 22:27:15,600 - preprocessing - INFO - xAPI engineered features created: ['engagement_score', 'absence_risk', 'parent_support_signal']
2026-06-12 22:27:15,623 - preprocessing - INFO - Applying ADASYN on train set with ratio 0.7207805082202461...
2026-06-12 22:27:15,631 - preprocessing - WARNING - ADASYN failed (likely too few samples). Error: No samples will be generated with the provided ratio settings.. Falling back to no oversampling.
2026-06-12 22:27:15,766 - preprocessing - INFO - Feature selection complete. Selected 18 / 19 features.
2026-06-12 22:27:25,411 - train_pipeline - INFO - Early stopping triggered at epoch 28
2026-06-12 22:27:25,430 - preprocessing - INFO - xAPI engineered features created: ['engagement_score', 'absence_risk', 'parent_support_signal']
2026-06-12 22:27:25,430 - preprocessing - INFO - xAPI engineered features created: ['engagement_score', 'absence_risk', 'parent_support_signal']
2026-06-12 22:27:25,444 - preprocessing - INFO - Applying ADASYN on train set with ratio 0.7207805082202461...
2026-06-12 22:27:25,458 - preprocessing - WARNING - ADASYN failed (likely too few samples). Error: No samples will be generated with the provided ratio settings.. Falling back to no oversampling.
2026-06-12 22:27:25,597 - preprocessing - INFO - Feature selection complete. Selected 16 / 19 features.
2026-06-12 22:27:37,814 - train_pipeline - INFO - Early stopping triggered at epoch 36
2026-06-12 22:27:37,829 - preprocessing - INFO - xAPI engineered features created: ['engagement_score', 'absence_risk', 'parent_support_signal']
2026-06-12 22:27:37,829 - preprocessing - INFO - xAPI engineered features created: ['engagement_score', 'absence_risk', 'parent_support_signal']
2026-06-12 22:27:37,845 - preprocessing - INFO - Applying ADASYN on train set with ratio 0.7207805082202461...
2026-06-12 22:27:37,861 - preprocessing - WARNING - ADASYN failed (likely too few samples). Error: No samples will be generated with the provided ratio settings.. Falling back to no oversampling.
2026-06-12 22:27:37,990 - preprocessing - INFO - Feature selection complete. Selected 18 / 19 features.
2026-06-12 22:27:53,466 - train_pipeline - INFO - Early stopping triggered at epoch 49
[I 2026-06-12 22:27:53,501] Trial 0 finished with value: 0.7792042287679527 and parameters: {'learning_rate': 0.0006646459471581086, 'weight_decay': 0.005061576888752304, 'batch_size': 8, 'oversample_method': 'adasyn', 'smote_ratio': 0.7207805082202461, 'resampling_k_neighbors': 8, 'cnn_channels': 32, 'cnn_kernel_size': 4, 'lstm_hidden_dim': 128, 'context_hidden_dim': 256, 'fusion_hidden_dim': 32, 'sequence_dropout': 0.12322520635999887, 'context_dropout': 0.34301794076057535, 'fusion_dropout': 0.18526206184364577}. Best is trial 0 with value: 0.7792042287679527.
2026-06-12 22:27:53,607 - preprocessing - INFO - xAPI engineered features created: ['engagement_score', 'absence_risk', 'parent_support_signal']
2026-06-12 22:27:53,613 - preprocessing - INFO - xAPI engineered features created: ['engagement_score', 'absence_risk', 'parent_support_signal']
2026-06-12 22:27:53,628 - preprocessing - INFO - Applying SMOTE on train set with ratio 0.38542676439134516...
2026-06-12 22:27:53,739 - preprocessing - INFO - Feature selection complete. Selected 15 / 19 features.
2026-06-12 22:28:15,679 - preprocessing - INFO - xAPI engineered features created: ['engagement_score', 'absence_risk', 'parent_support_signal']
2026-06-12 22:28:15,679 - preprocessing - INFO - xAPI engineered features created: ['engagement_score', 'absence_risk', 'parent_support_signal']
2026-06-12 22:28:15,695 - preprocessing - INFO - Applying SMOTE on train set with ratio 0.38542676439134516...
2026-06-12 22:28:15,820 - preprocessing - INFO - Feature selection complete. Selected 16 / 19 features.
2026-06-12 22:28:37,760 - preprocessing - INFO - xAPI engineered features created: ['engagement_score', 'absence_risk', 'parent_support_signal']
2026-06-12 22:28:37,770 - preprocessing - INFO - xAPI engineered features created: ['engagement_score', 'absence_risk', 'parent_support_signal']
2026-06-12 22:28:37,788 - preprocessing - INFO - Applying SMOTE on train set with ratio 0.38542676439134516...
2026-06-12 22:28:37,903 - preprocessing - INFO - Feature selection complete. Selected 18 / 19 features.
2026-06-12 22:29:00,621 - preprocessing - INFO - xAPI engineered features created: ['engagement_score', 'absence_risk', 'parent_support_signal']
2026-06-12 22:29:00,621 - preprocessing - INFO - xAPI engineered features created: ['engagement_score', 'absence_risk', 'parent_support_signal']
2026-06-12 22:29:00,648 - preprocessing - INFO - Applying SMOTE on train set with ratio 0.38542676439134516...
2026-06-12 22:29:00,764 - preprocessing - INFO - Feature selection complete. Selected 16 / 19 features.
2026-06-12 22:29:12,061 - train_pipeline - INFO - Early stopping triggered at epoch 38
2026-06-12 22:29:12,087 - preprocessing - INFO - xAPI engineered features created: ['engagement_score', 'absence_risk', 'parent_support_signal']
2026-06-12 22:29:12,089 - preprocessing - INFO - xAPI engineered features created: ['engagement_score', 'absence_risk', 'parent_support_signal']
2026-06-12 22:29:12,105 - preprocessing - INFO - Applying SMOTE on train set with ratio 0.38542676439134516...
2026-06-12 22:29:12,219 - preprocessing - INFO - Feature selection complete. Selected 18 / 19 features.
[I 2026-06-12 22:29:36,140] Trial 1 finished with value: 0.7515420763815582 and parameters: {'learning_rate': 7.83654773361771e-05, 'weight_decay': 0.004935296209402108, 'batch_size': 8, 'oversample_method': 'smote', 'smote_ratio': 0.38542676439134516, 'resampling_k_neighbors': 6, 'cnn_channels': 32, 'cnn_kernel_size': 4, 'lstm_hidden_dim': 64, 'context_hidden_dim': 128, 'fusion_hidden_dim': 256, 'sequence_dropout': 0.23567451588694796, 'context_dropout': 0.43149500366077176, 'fusion_dropout': 0.2783766633467947}. Best is trial 0 with value: 0.7792042287679527.
2026-06-12 22:29:36,261 - preprocessing - INFO - xAPI engineered features created: ['engagement_score', 'absence_risk', 'parent_support_signal']
2026-06-12 22:29:36,263 - preprocessing - INFO - xAPI engineered features created: ['engagement_score', 'absence_risk', 'parent_support_signal']
2026-06-12 22:29:36,282 - preprocessing - INFO - Applying SMOTE on train set with ratio 0.3038654819865217...
2026-06-12 22:29:36,386 - preprocessing - INFO - Feature selection complete. Selected 15 / 19 features.
2026-06-12 22:29:39,951 - train_pipeline - INFO - Early stopping triggered at epoch 62
2026-06-12 22:29:39,967 - preprocessing - INFO - xAPI engineered features created: ['engagement_score', 'absence_risk', 'parent_support_signal']
2026-06-12 22:29:39,971 - preprocessing - INFO - xAPI engineered features created: ['engagement_score', 'absence_risk', 'parent_support_signal']
2026-06-12 22:29:39,986 - preprocessing - INFO - Applying SMOTE on train set with ratio 0.3038654819865217...
2026-06-12 22:29:40,116 - preprocessing - INFO - Feature selection complete. Selected 16 / 19 features.
2026-06-12 22:29:42,835 - train_pipeline - INFO - Early stopping triggered at epoch 47
2026-06-12 22:29:42,853 - preprocessing - INFO - xAPI engineered features created: ['engagement_score', 'absence_risk', 'parent_support_signal']
2026-06-12 22:29:42,855 - preprocessing - INFO - xAPI engineered features created: ['engagement_score', 'absence_risk', 'parent_support_signal']
2026-06-12 22:29:42,876 - preprocessing - INFO - Applying SMOTE on train set with ratio 0.3038654819865217...
2026-06-12 22:29:43,001 - preprocessing - INFO - Feature selection complete. Selected 18 / 19 features.
2026-06-12 22:29:45,489 - train_pipeline - INFO - Early stopping triggered at epoch 45
2026-06-12 22:29:45,516 - preprocessing - INFO - xAPI engineered features created: ['engagement_score', 'absence_risk', 'parent_support_signal']
2026-06-12 22:29:45,518 - preprocessing - INFO - xAPI engineered features created: ['engagement_score', 'absence_risk', 'parent_support_signal']
2026-06-12 22:29:45,540 - preprocessing - INFO - Applying SMOTE on train set with ratio 0.3038654819865217...
2026-06-12 22:29:45,666 - preprocessing - INFO - Feature selection complete. Selected 16 / 19 features.
2026-06-12 22:29:48,764 - train_pipeline - INFO - Early stopping triggered at epoch 56
2026-06-12 22:29:48,790 - preprocessing - INFO - xAPI engineered features created: ['engagement_score', 'absence_risk', 'parent_support_signal']
2026-06-12 22:29:48,793 - preprocessing - INFO - xAPI engineered features created: ['engagement_score', 'absence_risk', 'parent_support_signal']
2026-06-12 22:29:48,810 - preprocessing - INFO - Applying SMOTE on train set with ratio 0.3038654819865217...
2026-06-12 22:29:48,932 - preprocessing - INFO - Feature selection complete. Selected 18 / 19 features.
2026-06-12 22:29:52,059 - train_pipeline - INFO - Early stopping triggered at epoch 54
[I 2026-06-12 22:29:52,091] Trial 2 finished with value: 0.7629488315686541 and parameters: {'learning_rate': 0.0003481557188914644, 'weight_decay': 1.8037506431281856e-05, 'batch_size': 64, 'oversample_method': 'smote', 'smote_ratio': 0.3038654819865217, 'resampling_k_neighbors': 9, 'cnn_channels': 64, 'cnn_kernel_size': 4, 'lstm_hidden_dim': 32, 'context_hidden_dim': 256, 'fusion_hidden_dim': 256, 'sequence_dropout': 0.38063859878474815, 'context_dropout': 0.40838687198182444, 'fusion_dropout': 0.34689779818219535}. Best is trial 0 with value: 0.7792042287679527.
2026-06-12 22:29:52,205 - preprocessing - INFO - xAPI engineered features created: ['engagement_score', 'absence_risk', 'parent_support_signal']
2026-06-12 22:29:52,207 - preprocessing - INFO - xAPI engineered features created: ['engagement_score', 'absence_risk', 'parent_support_signal']
2026-06-12 22:29:52,225 - preprocessing - INFO - Applying ADASYN on train set with ratio 0.9352965317482651...
2026-06-12 22:29:52,356 - preprocessing - INFO - Feature selection complete. Selected 18 / 19 features.
2026-06-12 22:29:57,763 - preprocessing - INFO - xAPI engineered features created: ['engagement_score', 'absence_risk', 'parent_support_signal']
2026-06-12 22:29:57,763 - preprocessing - INFO - xAPI engineered features created: ['engagement_score', 'absence_risk', 'parent_support_signal']
2026-06-12 22:29:57,777 - preprocessing - INFO - Applying ADASYN on train set with ratio 0.9352965317482651...
2026-06-12 22:29:57,923 - preprocessing - INFO - Feature selection complete. Selected 16 / 19 features.
2026-06-12 22:30:01,344 - train_pipeline - INFO - Early stopping triggered at epoch 49
2026-06-12 22:30:01,360 - preprocessing - INFO - xAPI engineered features created: ['engagement_score', 'absence_risk', 'parent_support_signal']
2026-06-12 22:30:01,360 - preprocessing - INFO - xAPI engineered features created: ['engagement_score', 'absence_risk', 'parent_support_signal']
2026-06-12 22:30:01,376 - preprocessing - INFO - Applying ADASYN on train set with ratio 0.9352965317482651...
2026-06-12 22:30:01,535 - preprocessing - INFO - Feature selection complete. Selected 17 / 19 features.
2026-06-12 22:30:06,815 - train_pipeline - INFO - Early stopping triggered at epoch 66
2026-06-12 22:30:06,836 - preprocessing - INFO - xAPI engineered features created: ['engagement_score', 'absence_risk', 'parent_support_signal']
2026-06-12 22:30:06,838 - preprocessing - INFO - xAPI engineered features created: ['engagement_score', 'absence_risk', 'parent_support_signal']
2026-06-12 22:30:06,856 - preprocessing - INFO - Applying ADASYN on train set with ratio 0.9352965317482651...
2026-06-12 22:30:07,018 - preprocessing - INFO - Feature selection complete. Selected 18 / 19 features.
2026-06-12 22:30:09,857 - train_pipeline - INFO - Early stopping triggered at epoch 35
2026-06-12 22:30:09,875 - preprocessing - INFO - xAPI engineered features created: ['engagement_score', 'absence_risk', 'parent_support_signal']
2026-06-12 22:30:09,877 - preprocessing - INFO - xAPI engineered features created: ['engagement_score', 'absence_risk', 'parent_support_signal']
2026-06-12 22:30:09,895 - preprocessing - INFO - Applying ADASYN on train set with ratio 0.9352965317482651...
2026-06-12 22:30:10,039 - preprocessing - INFO - Feature selection complete. Selected 18 / 19 features.
2026-06-12 22:30:13,069 - train_pipeline - INFO - Early stopping triggered at epoch 44
[I 2026-06-12 22:30:13,101] Trial 3 finished with value: 0.7454929565298454 and parameters: {'learning_rate': 0.001849986215731906, 'weight_decay': 3.6749049453053196e-06, 'batch_size': 64, 'oversample_method': 'adasyn', 'smote_ratio': 0.9352965317482651, 'resampling_k_neighbors': 4, 'cnn_channels': 32, 'cnn_kernel_size': 4, 'lstm_hidden_dim': 96, 'context_hidden_dim': 64, 'fusion_hidden_dim': 32, 'sequence_dropout': 0.3135538943131282, 'context_dropout': 0.42720590636899725, 'fusion_dropout': 0.5303652916281717}. Best is trial 0 with value: 0.7792042287679527.
2026-06-12 22:30:13,212 - preprocessing - INFO - xAPI engineered features created: ['engagement_score', 'absence_risk', 'parent_support_signal']
2026-06-12 22:30:13,212 - preprocessing - INFO - xAPI engineered features created: ['engagement_score', 'absence_risk', 'parent_support_signal']
2026-06-12 22:30:13,228 - preprocessing - INFO - Applying SMOTE on train set with ratio 0.6631534352203563...
2026-06-12 22:30:13,357 - preprocessing - INFO - Feature selection complete. Selected 15 / 19 features.
2026-06-12 22:30:32,294 - train_pipeline - INFO - Early stopping triggered at epoch 66
2026-06-12 22:30:32,312 - preprocessing - INFO - xAPI engineered features created: ['engagement_score', 'absence_risk', 'parent_support_signal']
2026-06-12 22:30:32,313 - preprocessing - INFO - xAPI engineered features created: ['engagement_score', 'absence_risk', 'parent_support_signal']
2026-06-12 22:30:32,329 - preprocessing - INFO - Applying SMOTE on train set with ratio 0.6631534352203563...
2026-06-12 22:30:32,457 - preprocessing - INFO - Feature selection complete. Selected 16 / 19 features.
2026-06-12 22:30:55,253 - preprocessing - INFO - xAPI engineered features created: ['engagement_score', 'absence_risk', 'parent_support_signal']
2026-06-12 22:30:55,255 - preprocessing - INFO - xAPI engineered features created: ['engagement_score', 'absence_risk', 'parent_support_signal']
2026-06-12 22:30:55,273 - preprocessing - INFO - Applying SMOTE on train set with ratio 0.6631534352203563...
2026-06-12 22:30:55,402 - preprocessing - INFO - Feature selection complete. Selected 18 / 19 features.
2026-06-12 22:31:05,588 - train_pipeline - INFO - Early stopping triggered at epoch 35
2026-06-12 22:31:05,609 - preprocessing - INFO - xAPI engineered features created: ['engagement_score', 'absence_risk', 'parent_support_signal']
2026-06-12 22:31:05,609 - preprocessing - INFO - xAPI engineered features created: ['engagement_score', 'absence_risk', 'parent_support_signal']
2026-06-12 22:31:05,626 - preprocessing - INFO - Applying SMOTE on train set with ratio 0.6631534352203563...
2026-06-12 22:31:05,770 - preprocessing - INFO - Feature selection complete. Selected 15 / 19 features.
2026-06-12 22:31:27,619 - train_pipeline - INFO - Early stopping triggered at epoch 76
2026-06-12 22:31:27,637 - preprocessing - INFO - xAPI engineered features created: ['engagement_score', 'absence_risk', 'parent_support_signal']
2026-06-12 22:31:27,640 - preprocessing - INFO - xAPI engineered features created: ['engagement_score', 'absence_risk', 'parent_support_signal']
2026-06-12 22:31:27,658 - preprocessing - INFO - Applying SMOTE on train set with ratio 0.6631534352203563...
2026-06-12 22:31:27,802 - preprocessing - INFO - Feature selection complete. Selected 18 / 19 features.
2026-06-12 22:31:37,681 - train_pipeline - INFO - Early stopping triggered at epoch 30
[I 2026-06-12 22:31:37,733] Trial 4 finished with value: 0.7042999737947051 and parameters: {'learning_rate': 5.2459771661339564e-05, 'weight_decay': 1.160068983900714e-05, 'batch_size': 8, 'oversample_method': 'smote', 'smote_ratio': 0.6631534352203563, 'resampling_k_neighbors': 8, 'cnn_channels': 32, 'cnn_kernel_size': 2, 'lstm_hidden_dim': 64, 'context_hidden_dim': 64, 'fusion_hidden_dim': 64, 'sequence_dropout': 0.48080980766435877, 'context_dropout': 0.19505501759695987, 'fusion_dropout': 0.46410817430592977}. Best is trial 0 with value: 0.7792042287679527.
2026-06-12 22:31:37,895 - preprocessing - INFO - xAPI engineered features created: ['engagement_score', 'absence_risk', 'parent_support_signal']
2026-06-12 22:31:37,898 - preprocessing - INFO - xAPI engineered features created: ['engagement_score', 'absence_risk', 'parent_support_signal']
2026-06-12 22:31:37,924 - preprocessing - INFO - Applying SMOTE on train set with ratio 0.3285425990883347...
2026-06-12 22:31:38,075 - preprocessing - INFO - Feature selection complete. Selected 15 / 19 features.
2026-06-12 22:31:41,863 - train_pipeline - INFO - Early stopping triggered at epoch 62
2026-06-12 22:31:41,887 - preprocessing - INFO - xAPI engineered features created: ['engagement_score', 'absence_risk', 'parent_support_signal']
2026-06-12 22:31:41,892 - preprocessing - INFO - xAPI engineered features created: ['engagement_score', 'absence_risk', 'parent_support_signal']
2026-06-12 22:31:41,924 - preprocessing - INFO - Applying SMOTE on train set with ratio 0.3285425990883347...
2026-06-12 22:31:42,063 - preprocessing - INFO - Feature selection complete. Selected 16 / 19 features.
2026-06-13 00:26:20,873 - preprocessing - INFO - xAPI engineered features created: ['engagement_score', 'absence_risk', 'parent_support_signal']
2026-06-13 00:26:20,883 - preprocessing - INFO - xAPI engineered features created: ['engagement_score', 'absence_risk', 'parent_support_signal']
2026-06-13 00:26:21,020 - preprocessing - INFO - Applying SMOTE on train set with ratio 0.3285425990883347...
2026-06-13 00:26:21,487 - preprocessing - INFO - Feature selection complete. Selected 18 / 19 features.
2026-06-13 00:26:30,852 - train_pipeline - INFO - Early stopping triggered at epoch 64
2026-06-13 00:26:30,875 - preprocessing - INFO - xAPI engineered features created: ['engagement_score', 'absence_risk', 'parent_support_signal']
2026-06-13 00:26:30,875 - preprocessing - INFO - xAPI engineered features created: ['engagement_score', 'absence_risk', 'parent_support_signal']
2026-06-13 00:26:30,898 - preprocessing - INFO - Applying SMOTE on train set with ratio 0.3285425990883347...
2026-06-13 00:26:31,057 - preprocessing - INFO - Feature selection complete. Selected 16 / 19 features.
2026-06-13 00:26:34,628 - train_pipeline - INFO - Early stopping triggered at epoch 41
2026-06-13 00:26:34,653 - preprocessing - INFO - xAPI engineered features created: ['engagement_score', 'absence_risk', 'parent_support_signal']
2026-06-13 00:26:34,655 - preprocessing - INFO - xAPI engineered features created: ['engagement_score', 'absence_risk', 'parent_support_signal']
2026-06-13 00:26:34,690 - preprocessing - INFO - Applying SMOTE on train set with ratio 0.3285425990883347...
2026-06-13 00:26:34,855 - preprocessing - INFO - Feature selection complete. Selected 18 / 19 features.
2026-06-13 00:26:41,697 - train_pipeline - INFO - Early stopping triggered at epoch 55
