[I 2026-06-13 01:19:53,558] Trial 118 finished with value: 0.7946576924797573 and parameters: {'learning_rate': 0.0020688046035706735, 'weight_decay': 0.003596343602623969, 'batch_size': 32, 'oversample_method': 'smote', 'smote_ratio': 0.5811219370971876, 'resampling_k_neighbors': 2, 'cnn_channels': 64, 'cnn_kernel_size': 4, 'lstm_hidden_dim': 32, 'context_hidden_dim': 256, 'fusion_hidden_dim': 128, 'sequence_dropout': 0.1953198331726647, 'context_dropout': 0.1961429452793802, 'fusion_dropout': 0.3080148906518123}. Best is trial 55 with value: 0.8121442327638384.
2026-06-13 01:19:53,674 - preprocessing - INFO - xAPI engineered features created: ['engagement_score', 'absence_risk', 'parent_support_signal']
2026-06-13 01:19:53,677 - preprocessing - INFO - xAPI engineered features created: ['engagement_score', 'absence_risk', 'parent_support_signal']
2026-06-13 01:19:53,694 - preprocessing - INFO - Applying SMOTE on train set with ratio 0.5371945746162103...
2026-06-13 01:19:53,842 - preprocessing - INFO - Feature selection complete. Selected 15 / 19 features.
2026-06-13 01:19:56,336 - train_pipeline - INFO - Early stopping triggered at epoch 35
2026-06-13 01:19:56,356 - preprocessing - INFO - xAPI engineered features created: ['engagement_score', 'absence_risk', 'parent_support_signal']
2026-06-13 01:19:56,358 - preprocessing - INFO - xAPI engineered features created: ['engagement_score', 'absence_risk', 'parent_support_signal']
2026-06-13 01:19:56,374 - preprocessing - INFO - Applying SMOTE on train set with ratio 0.5371945746162103...
2026-06-13 01:19:56,492 - preprocessing - INFO - Feature selection complete. Selected 16 / 19 features.
2026-06-13 01:19:58,579 - train_pipeline - INFO - Early stopping triggered at epoch 34
2026-06-13 01:19:58,597 - preprocessing - INFO - xAPI engineered features created: ['engagement_score', 'absence_risk', 'parent_support_signal']
2026-06-13 01:19:58,599 - preprocessing - INFO - xAPI engineered features created: ['engagement_score', 'absence_risk', 'parent_support_signal']
2026-06-13 01:19:58,616 - preprocessing - INFO - Applying SMOTE on train set with ratio 0.5371945746162103...
2026-06-13 01:19:58,735 - preprocessing - INFO - Feature selection complete. Selected 18 / 19 features.
2026-06-13 01:20:00,881 - train_pipeline - INFO - Early stopping triggered at epoch 35
2026-06-13 01:20:00,899 - preprocessing - INFO - xAPI engineered features created: ['engagement_score', 'absence_risk', 'parent_support_signal']
2026-06-13 01:20:00,901 - preprocessing - INFO - xAPI engineered features created: ['engagement_score', 'absence_risk', 'parent_support_signal']
2026-06-13 01:20:00,919 - preprocessing - INFO - Applying SMOTE on train set with ratio 0.5371945746162103...
2026-06-13 01:20:01,044 - preprocessing - INFO - Feature selection complete. Selected 16 / 19 features.
2026-06-13 01:20:06,378 - preprocessing - INFO - xAPI engineered features created: ['engagement_score', 'absence_risk', 'parent_support_signal']
2026-06-13 01:20:06,380 - preprocessing - INFO - xAPI engineered features created: ['engagement_score', 'absence_risk', 'parent_support_signal']
2026-06-13 01:20:06,397 - preprocessing - INFO - Applying SMOTE on train set with ratio 0.5371945746162103...
2026-06-13 01:20:06,518 - preprocessing - INFO - Feature selection complete. Selected 18 / 19 features.
2026-06-13 01:20:11,162 - train_pipeline - INFO - Early stopping triggered at epoch 69
[I 2026-06-13 01:20:11,192] Trial 119 finished with value: 0.8030485035037842 and parameters: {'learning_rate': 0.01317395663228168, 'weight_decay': 0.0005086297271173512, 'batch_size': 64, 'oversample_method': 'smote', 'smote_ratio': 0.5371945746162103, 'resampling_k_neighbors': 3, 'cnn_channels': 64, 'cnn_kernel_size': 3, 'lstm_hidden_dim': 128, 'context_hidden_dim': 256, 'fusion_hidden_dim': 256, 'sequence_dropout': 0.1187573388726675, 'context_dropout': 0.1497222572753782, 'fusion_dropout': 0.15130514416763483}. Best is trial 55 with value: 0.8121442327638384.
2026-06-13 01:20:11,311 - preprocessing - INFO - xAPI engineered features created: ['engagement_score', 'absence_risk', 'parent_support_signal']
2026-06-13 01:20:11,314 - preprocessing - INFO - xAPI engineered features created: ['engagement_score', 'absence_risk', 'parent_support_signal']
2026-06-13 01:20:11,336 - preprocessing - INFO - Applying SMOTE on train set with ratio 0.47532651924572916...
2026-06-13 01:20:11,454 - preprocessing - INFO - Feature selection complete. Selected 15 / 19 features.
2026-06-13 01:20:14,641 - train_pipeline - INFO - Early stopping triggered at epoch 52
2026-06-13 01:20:14,661 - preprocessing - INFO - xAPI engineered features created: ['engagement_score', 'absence_risk', 'parent_support_signal']
2026-06-13 01:20:14,664 - preprocessing - INFO - xAPI engineered features created: ['engagement_score', 'absence_risk', 'parent_support_signal']
2026-06-13 01:20:14,680 - preprocessing - INFO - Applying SMOTE on train set with ratio 0.47532651924572916...
2026-06-13 01:20:14,835 - preprocessing - INFO - Feature selection complete. Selected 16 / 19 features.
2026-06-13 01:20:16,977 - train_pipeline - INFO - Early stopping triggered at epoch 29
2026-06-13 01:20:16,995 - preprocessing - INFO - xAPI engineered features created: ['engagement_score', 'absence_risk', 'parent_support_signal']
2026-06-13 01:20:16,998 - preprocessing - INFO - xAPI engineered features created: ['engagement_score', 'absence_risk', 'parent_support_signal']
2026-06-13 01:20:17,015 - preprocessing - INFO - Applying SMOTE on train set with ratio 0.47532651924572916...
2026-06-13 01:20:17,133 - preprocessing - INFO - Feature selection complete. Selected 18 / 19 features.
2026-06-13 01:20:19,786 - train_pipeline - INFO - Early stopping triggered at epoch 43
2026-06-13 01:20:19,813 - preprocessing - INFO - xAPI engineered features created: ['engagement_score', 'absence_risk', 'parent_support_signal']
2026-06-13 01:20:19,816 - preprocessing - INFO - xAPI engineered features created: ['engagement_score', 'absence_risk', 'parent_support_signal']
2026-06-13 01:20:19,847 - preprocessing - INFO - Applying SMOTE on train set with ratio 0.47532651924572916...
2026-06-13 01:20:20,023 - preprocessing - INFO - Feature selection complete. Selected 16 / 19 features.
2026-06-13 01:20:24,032 - train_pipeline - INFO - Early stopping triggered at epoch 59
2026-06-13 01:20:24,060 - preprocessing - INFO - xAPI engineered features created: ['engagement_score', 'absence_risk', 'parent_support_signal']
2026-06-13 01:20:24,065 - preprocessing - INFO - xAPI engineered features created: ['engagement_score', 'absence_risk', 'parent_support_signal']
2026-06-13 01:20:24,096 - preprocessing - INFO - Applying SMOTE on train set with ratio 0.47532651924572916...
2026-06-13 01:20:24,275 - preprocessing - INFO - Feature selection complete. Selected 18 / 19 features.
2026-06-13 01:20:28,071 - train_pipeline - INFO - Early stopping triggered at epoch 56
[I 2026-06-13 01:20:28,112] Trial 120 finished with value: 0.7990827544434576 and parameters: {'learning_rate': 0.017732449169198073, 'weight_decay': 5.994698066546892e-05, 'batch_size': 64, 'oversample_method': 'smote', 'smote_ratio': 0.47532651924572916, 'resampling_k_neighbors': 4, 'cnn_channels': 64, 'cnn_kernel_size': 3, 'lstm_hidden_dim': 128, 'context_hidden_dim': 256, 'fusion_hidden_dim': 256, 'sequence_dropout': 0.34642201932003347, 'context_dropout': 0.1398835466570581, 'fusion_dropout': 0.15585262432841568}. Best is trial 55 with value: 0.8121442327638384.
2026-06-13 01:20:28,263 - preprocessing - INFO - xAPI engineered features created: ['engagement_score', 'absence_risk', 'parent_support_signal']
2026-06-13 01:20:28,268 - preprocessing - INFO - xAPI engineered features created: ['engagement_score', 'absence_risk', 'parent_support_signal']
2026-06-13 01:20:28,297 - preprocessing - INFO - Applying ADASYN on train set with ratio 0.31447175342322375...
2026-06-13 01:20:28,443 - preprocessing - INFO - Feature selection complete. Selected 15 / 19 features.
2026-06-13 01:20:34,335 - train_pipeline - INFO - Early stopping triggered at epoch 62
2026-06-13 01:20:34,354 - preprocessing - INFO - xAPI engineered features created: ['engagement_score', 'absence_risk', 'parent_support_signal']
2026-06-13 01:20:34,356 - preprocessing - INFO - xAPI engineered features created: ['engagement_score', 'absence_risk', 'parent_support_signal']
2026-06-13 01:20:34,374 - preprocessing - INFO - Applying ADASYN on train set with ratio 0.31447175342322375...
2026-06-13 01:20:34,491 - preprocessing - INFO - Feature selection complete. Selected 16 / 19 features.
2026-06-13 01:20:41,095 - train_pipeline - INFO - Early stopping triggered at epoch 71
2026-06-13 01:20:41,114 - preprocessing - INFO - xAPI engineered features created: ['engagement_score', 'absence_risk', 'parent_support_signal']
2026-06-13 01:20:41,117 - preprocessing - INFO - xAPI engineered features created: ['engagement_score', 'absence_risk', 'parent_support_signal']
2026-06-13 01:20:41,134 - preprocessing - INFO - Applying ADASYN on train set with ratio 0.31447175342322375...
2026-06-13 01:20:41,254 - preprocessing - INFO - Feature selection complete. Selected 18 / 19 features.
2026-06-13 01:20:45,782 - train_pipeline - INFO - Early stopping triggered at epoch 47
2026-06-13 01:20:45,801 - preprocessing - INFO - xAPI engineered features created: ['engagement_score', 'absence_risk', 'parent_support_signal']
2026-06-13 01:20:45,803 - preprocessing - INFO - xAPI engineered features created: ['engagement_score', 'absence_risk', 'parent_support_signal']
2026-06-13 01:20:45,821 - preprocessing - INFO - Applying ADASYN on train set with ratio 0.31447175342322375...
2026-06-13 01:20:45,943 - preprocessing - INFO - Feature selection complete. Selected 16 / 19 features.
2026-06-13 01:20:52,158 - train_pipeline - INFO - Early stopping triggered at epoch 67
2026-06-13 01:20:52,176 - preprocessing - INFO - xAPI engineered features created: ['engagement_score', 'absence_risk', 'parent_support_signal']
2026-06-13 01:20:52,178 - preprocessing - INFO - xAPI engineered features created: ['engagement_score', 'absence_risk', 'parent_support_signal']
2026-06-13 01:20:52,195 - preprocessing - INFO - Applying ADASYN on train set with ratio 0.31447175342322375...
2026-06-13 01:20:52,311 - preprocessing - INFO - Feature selection complete. Selected 18 / 19 features.
2026-06-13 01:20:58,483 - train_pipeline - INFO - Early stopping triggered at epoch 66
[I 2026-06-13 01:20:58,511] Trial 121 finished with value: 0.8082185932388288 and parameters: {'learning_rate': 0.011375632282035926, 'weight_decay': 0.003750924117113874, 'batch_size': 32, 'oversample_method': 'adasyn', 'smote_ratio': 0.31447175342322375, 'resampling_k_neighbors': 2, 'cnn_channels': 32, 'cnn_kernel_size': 3, 'lstm_hidden_dim': 96, 'context_hidden_dim': 256, 'fusion_hidden_dim': 32, 'sequence_dropout': 0.1381195277824292, 'context_dropout': 0.23076624572217955, 'fusion_dropout': 0.17256151252766075}. Best is trial 55 with value: 0.8121442327638384.
2026-06-13 01:20:58,629 - preprocessing - INFO - xAPI engineered features created: ['engagement_score', 'absence_risk', 'parent_support_signal']
2026-06-13 01:20:58,631 - preprocessing - INFO - xAPI engineered features created: ['engagement_score', 'absence_risk', 'parent_support_signal']
2026-06-13 01:20:58,649 - preprocessing - INFO - Applying SMOTE on train set with ratio 0.5857490462109289...
2026-06-13 01:20:58,782 - preprocessing - INFO - Feature selection complete. Selected 15 / 19 features.
2026-06-13 01:21:01,875 - train_pipeline - INFO - Early stopping triggered at epoch 47
2026-06-13 01:21:01,892 - preprocessing - INFO - xAPI engineered features created: ['engagement_score', 'absence_risk', 'parent_support_signal']
2026-06-13 01:21:01,894 - preprocessing - INFO - xAPI engineered features created: ['engagement_score', 'absence_risk', 'parent_support_signal']
2026-06-13 01:21:01,911 - preprocessing - INFO - Applying SMOTE on train set with ratio 0.5857490462109289...
2026-06-13 01:21:02,029 - preprocessing - INFO - Feature selection complete. Selected 16 / 19 features.
2026-06-13 01:21:03,779 - train_pipeline - INFO - Early stopping triggered at epoch 30
2026-06-13 01:21:03,798 - preprocessing - INFO - xAPI engineered features created: ['engagement_score', 'absence_risk', 'parent_support_signal']
2026-06-13 01:21:03,801 - preprocessing - INFO - xAPI engineered features created: ['engagement_score', 'absence_risk', 'parent_support_signal']
2026-06-13 01:21:03,818 - preprocessing - INFO - Applying SMOTE on train set with ratio 0.5857490462109289...
2026-06-13 01:21:03,936 - preprocessing - INFO - Feature selection complete. Selected 18 / 19 features.
2026-06-13 01:21:06,300 - train_pipeline - INFO - Early stopping triggered at epoch 41
[I 2026-06-13 01:21:06,326] Trial 122 pruned. 
2026-06-13 01:21:06,442 - preprocessing - INFO - xAPI engineered features created: ['engagement_score', 'absence_risk', 'parent_support_signal']
2026-06-13 01:21:06,444 - preprocessing - INFO - xAPI engineered features created: ['engagement_score', 'absence_risk', 'parent_support_signal']
2026-06-13 01:21:06,462 - preprocessing - INFO - Applying ADASYN on train set with ratio 0.5120308353275921...
2026-06-13 01:21:06,588 - preprocessing - INFO - Feature selection complete. Selected 15 / 19 features.
2026-06-13 01:21:12,607 - train_pipeline - INFO - Early stopping triggered at epoch 60
2026-06-13 01:21:12,626 - preprocessing - INFO - xAPI engineered features created: ['engagement_score', 'absence_risk', 'parent_support_signal']
2026-06-13 01:21:12,629 - preprocessing - INFO - xAPI engineered features created: ['engagement_score', 'absence_risk', 'parent_support_signal']
2026-06-13 01:21:12,647 - preprocessing - INFO - Applying ADASYN on train set with ratio 0.5120308353275921...
2026-06-13 01:21:12,767 - preprocessing - INFO - Feature selection complete. Selected 16 / 19 features.
2026-06-13 01:21:16,388 - train_pipeline - INFO - Early stopping triggered at epoch 39
2026-06-13 01:21:16,411 - preprocessing - INFO - xAPI engineered features created: ['engagement_score', 'absence_risk', 'parent_support_signal']
2026-06-13 01:21:16,414 - preprocessing - INFO - xAPI engineered features created: ['engagement_score', 'absence_risk', 'parent_support_signal']
2026-06-13 01:21:16,441 - preprocessing - INFO - Applying ADASYN on train set with ratio 0.5120308353275921...
2026-06-13 01:21:16,610 - preprocessing - INFO - Feature selection complete. Selected 18 / 19 features.
2026-06-13 01:21:19,600 - train_pipeline - INFO - Early stopping triggered at epoch 33
2026-06-13 01:21:19,618 - preprocessing - INFO - xAPI engineered features created: ['engagement_score', 'absence_risk', 'parent_support_signal']
2026-06-13 01:21:19,620 - preprocessing - INFO - xAPI engineered features created: ['engagement_score', 'absence_risk', 'parent_support_signal']
2026-06-13 01:21:19,636 - preprocessing - INFO - Applying ADASYN on train set with ratio 0.5120308353275921...
2026-06-13 01:21:19,766 - preprocessing - INFO - Feature selection complete. Selected 16 / 19 features.
2026-06-13 01:21:22,952 - train_pipeline - INFO - Early stopping triggered at epoch 32
2026-06-13 01:21:22,970 - preprocessing - INFO - xAPI engineered features created: ['engagement_score', 'absence_risk', 'parent_support_signal']
2026-06-13 01:21:22,972 - preprocessing - INFO - xAPI engineered features created: ['engagement_score', 'absence_risk', 'parent_support_signal']
2026-06-13 01:21:22,990 - preprocessing - INFO - Applying ADASYN on train set with ratio 0.5120308353275921...
2026-06-13 01:21:23,111 - preprocessing - INFO - Feature selection complete. Selected 18 / 19 features.
2026-06-13 01:21:25,723 - train_pipeline - INFO - Early stopping triggered at epoch 30
[I 2026-06-13 01:21:25,764] Trial 123 finished with value: 0.7957329767218428 and parameters: {'learning_rate': 0.009864970346892548, 'weight_decay': 6.51766786493146e-05, 'batch_size': 32, 'oversample_method': 'adasyn', 'smote_ratio': 0.5120308353275921, 'resampling_k_neighbors': 3, 'cnn_channels': 32, 'cnn_kernel_size': 3, 'lstm_hidden_dim': 96, 'context_hidden_dim': 256, 'fusion_hidden_dim': 32, 'sequence_dropout': 0.10280498235840013, 'context_dropout': 0.1825929628943416, 'fusion_dropout': 0.26821531536816473}. Best is trial 55 with value: 0.8121442327638384.
2026-06-13 01:21:25,919 - preprocessing - INFO - xAPI engineered features created: ['engagement_score', 'absence_risk', 'parent_support_signal']
2026-06-13 01:21:25,923 - preprocessing - INFO - xAPI engineered features created: ['engagement_score', 'absence_risk', 'parent_support_signal']
2026-06-13 01:21:25,948 - preprocessing - INFO - Applying ADASYN on train set with ratio 0.456306244601142...
2026-06-13 01:21:26,099 - preprocessing - INFO - Feature selection complete. Selected 15 / 19 features.
2026-06-13 01:21:31,008 - train_pipeline - INFO - Early stopping triggered at epoch 31
2026-06-13 01:21:31,029 - preprocessing - INFO - xAPI engineered features created: ['engagement_score', 'absence_risk', 'parent_support_signal']
2026-06-13 01:21:31,032 - preprocessing - INFO - xAPI engineered features created: ['engagement_score', 'absence_risk', 'parent_support_signal']
2026-06-13 01:21:31,054 - preprocessing - INFO - Applying ADASYN on train set with ratio 0.456306244601142...
2026-06-13 01:21:31,174 - preprocessing - INFO - Feature selection complete. Selected 16 / 19 features.
2026-06-13 01:21:39,680 - train_pipeline - INFO - Early stopping triggered at epoch 55
2026-06-13 01:21:39,697 - preprocessing - INFO - xAPI engineered features created: ['engagement_score', 'absence_risk', 'parent_support_signal']
2026-06-13 01:21:39,700 - preprocessing - INFO - xAPI engineered features created: ['engagement_score', 'absence_risk', 'parent_support_signal']
2026-06-13 01:21:39,718 - preprocessing - INFO - Applying ADASYN on train set with ratio 0.456306244601142...
2026-06-13 01:21:39,844 - preprocessing - INFO - Feature selection complete. Selected 18 / 19 features.
2026-06-13 01:21:45,867 - train_pipeline - INFO - Early stopping triggered at epoch 40
2026-06-13 01:21:45,884 - preprocessing - INFO - xAPI engineered features created: ['engagement_score', 'absence_risk', 'parent_support_signal']
2026-06-13 01:21:45,886 - preprocessing - INFO - xAPI engineered features created: ['engagement_score', 'absence_risk', 'parent_support_signal']
2026-06-13 01:21:45,906 - preprocessing - INFO - Applying ADASYN on train set with ratio 0.456306244601142...
2026-06-13 01:21:46,025 - preprocessing - INFO - Feature selection complete. Selected 16 / 19 features.
2026-06-13 01:21:50,716 - train_pipeline - INFO - Early stopping triggered at epoch 31
2026-06-13 01:21:50,734 - preprocessing - INFO - xAPI engineered features created: ['engagement_score', 'absence_risk', 'parent_support_signal']
2026-06-13 01:21:50,736 - preprocessing - INFO - xAPI engineered features created: ['engagement_score', 'absence_risk', 'parent_support_signal']
2026-06-13 01:21:50,755 - preprocessing - INFO - Applying ADASYN on train set with ratio 0.456306244601142...
2026-06-13 01:21:50,879 - preprocessing - INFO - Feature selection complete. Selected 18 / 19 features.
2026-06-13 01:21:58,279 - train_pipeline - INFO - Early stopping triggered at epoch 49
