[I 2026-06-13 01:03:40,078] Trial 85 finished with value: 0.7915474356013605 and parameters: {'learning_rate': 0.001822558590043523, 'weight_decay': 0.0030405488491968427, 'batch_size': 64, 'oversample_method': 'smote', 'smote_ratio': 0.4501169436569078, 'resampling_k_neighbors': 4, 'cnn_channels': 16, 'cnn_kernel_size': 4, 'lstm_hidden_dim': 32, 'context_hidden_dim': 256, 'fusion_hidden_dim': 128, 'sequence_dropout': 0.3141007744011614, 'context_dropout': 0.22342068293987113, 'fusion_dropout': 0.11968300035656129}. Best is trial 55 with value: 0.8121442327638384.
2026-06-13 01:03:40,228 - preprocessing - INFO - xAPI engineered features created: ['engagement_score', 'absence_risk', 'parent_support_signal']
2026-06-13 01:03:40,230 - preprocessing - INFO - xAPI engineered features created: ['engagement_score', 'absence_risk', 'parent_support_signal']
2026-06-13 01:03:40,257 - preprocessing - INFO - Applying SMOTE on train set with ratio 0.44655352122447306...
2026-06-13 01:03:40,403 - preprocessing - INFO - Feature selection complete. Selected 15 / 19 features.
2026-06-13 01:03:42,140 - train_pipeline - INFO - Early stopping triggered at epoch 30
2026-06-13 01:03:42,158 - preprocessing - INFO - xAPI engineered features created: ['engagement_score', 'absence_risk', 'parent_support_signal']
2026-06-13 01:03:42,160 - preprocessing - INFO - xAPI engineered features created: ['engagement_score', 'absence_risk', 'parent_support_signal']
2026-06-13 01:03:42,178 - preprocessing - INFO - Applying SMOTE on train set with ratio 0.44655352122447306...
2026-06-13 01:03:42,297 - preprocessing - INFO - Feature selection complete. Selected 16 / 19 features.
2026-06-13 01:03:44,510 - train_pipeline - INFO - Early stopping triggered at epoch 43
2026-06-13 01:03:44,529 - preprocessing - INFO - xAPI engineered features created: ['engagement_score', 'absence_risk', 'parent_support_signal']
2026-06-13 01:03:44,531 - preprocessing - INFO - xAPI engineered features created: ['engagement_score', 'absence_risk', 'parent_support_signal']
2026-06-13 01:03:44,548 - preprocessing - INFO - Applying SMOTE on train set with ratio 0.44655352122447306...
2026-06-13 01:03:44,663 - preprocessing - INFO - Feature selection complete. Selected 18 / 19 features.
2026-06-13 01:03:47,058 - train_pipeline - INFO - Early stopping triggered at epoch 39
2026-06-13 01:03:47,078 - preprocessing - INFO - xAPI engineered features created: ['engagement_score', 'absence_risk', 'parent_support_signal']
2026-06-13 01:03:47,080 - preprocessing - INFO - xAPI engineered features created: ['engagement_score', 'absence_risk', 'parent_support_signal']
2026-06-13 01:03:47,097 - preprocessing - INFO - Applying SMOTE on train set with ratio 0.44655352122447306...
2026-06-13 01:03:47,219 - preprocessing - INFO - Feature selection complete. Selected 16 / 19 features.
2026-06-13 01:03:49,327 - train_pipeline - INFO - Early stopping triggered at epoch 41
2026-06-13 01:03:49,347 - preprocessing - INFO - xAPI engineered features created: ['engagement_score', 'absence_risk', 'parent_support_signal']
2026-06-13 01:03:49,350 - preprocessing - INFO - xAPI engineered features created: ['engagement_score', 'absence_risk', 'parent_support_signal']
2026-06-13 01:03:49,368 - preprocessing - INFO - Applying SMOTE on train set with ratio 0.44655352122447306...
2026-06-13 01:03:49,486 - preprocessing - INFO - Feature selection complete. Selected 18 / 19 features.
2026-06-13 01:03:51,881 - train_pipeline - INFO - Early stopping triggered at epoch 39
[I 2026-06-13 01:03:51,910] Trial 86 finished with value: 0.7971676013394915 and parameters: {'learning_rate': 0.00666811519784469, 'weight_decay': 0.0011996682003437794, 'batch_size': 64, 'oversample_method': 'smote', 'smote_ratio': 0.44655352122447306, 'resampling_k_neighbors': 2, 'cnn_channels': 16, 'cnn_kernel_size': 4, 'lstm_hidden_dim': 96, 'context_hidden_dim': 128, 'fusion_hidden_dim': 128, 'sequence_dropout': 0.13152930375923333, 'context_dropout': 0.16070657674376532, 'fusion_dropout': 0.299552541892558}. Best is trial 55 with value: 0.8121442327638384.
2026-06-13 01:03:52,027 - preprocessing - INFO - xAPI engineered features created: ['engagement_score', 'absence_risk', 'parent_support_signal']
2026-06-13 01:03:52,029 - preprocessing - INFO - xAPI engineered features created: ['engagement_score', 'absence_risk', 'parent_support_signal']
2026-06-13 01:03:52,047 - preprocessing - INFO - Applying SMOTE on train set with ratio 0.6842131046301546...
2026-06-13 01:03:52,172 - preprocessing - INFO - Feature selection complete. Selected 17 / 19 features.
2026-06-13 01:04:02,634 - train_pipeline - INFO - Early stopping triggered at epoch 30
2026-06-13 01:04:02,651 - preprocessing - INFO - xAPI engineered features created: ['engagement_score', 'absence_risk', 'parent_support_signal']
2026-06-13 01:04:02,653 - preprocessing - INFO - xAPI engineered features created: ['engagement_score', 'absence_risk', 'parent_support_signal']
2026-06-13 01:04:02,674 - preprocessing - INFO - Applying SMOTE on train set with ratio 0.6842131046301546...
2026-06-13 01:04:02,799 - preprocessing - INFO - Feature selection complete. Selected 15 / 19 features.
2026-06-13 01:04:15,199 - train_pipeline - INFO - Early stopping triggered at epoch 36
2026-06-13 01:04:15,217 - preprocessing - INFO - xAPI engineered features created: ['engagement_score', 'absence_risk', 'parent_support_signal']
2026-06-13 01:04:15,219 - preprocessing - INFO - xAPI engineered features created: ['engagement_score', 'absence_risk', 'parent_support_signal']
2026-06-13 01:04:15,236 - preprocessing - INFO - Applying SMOTE on train set with ratio 0.6842131046301546...
2026-06-13 01:04:15,362 - preprocessing - INFO - Feature selection complete. Selected 18 / 19 features.
2026-06-13 01:04:24,597 - train_pipeline - INFO - Early stopping triggered at epoch 26
2026-06-13 01:04:24,615 - preprocessing - INFO - xAPI engineered features created: ['engagement_score', 'absence_risk', 'parent_support_signal']
2026-06-13 01:04:24,617 - preprocessing - INFO - xAPI engineered features created: ['engagement_score', 'absence_risk', 'parent_support_signal']
2026-06-13 01:04:24,634 - preprocessing - INFO - Applying SMOTE on train set with ratio 0.6842131046301546...
2026-06-13 01:04:24,754 - preprocessing - INFO - Feature selection complete. Selected 16 / 19 features.
2026-06-13 01:04:38,771 - train_pipeline - INFO - Early stopping triggered at epoch 41
2026-06-13 01:04:38,789 - preprocessing - INFO - xAPI engineered features created: ['engagement_score', 'absence_risk', 'parent_support_signal']
2026-06-13 01:04:38,792 - preprocessing - INFO - xAPI engineered features created: ['engagement_score', 'absence_risk', 'parent_support_signal']
2026-06-13 01:04:38,809 - preprocessing - INFO - Applying SMOTE on train set with ratio 0.6842131046301546...
2026-06-13 01:04:38,936 - preprocessing - INFO - Feature selection complete. Selected 17 / 19 features.
2026-06-13 01:04:53,000 - train_pipeline - INFO - Early stopping triggered at epoch 40
[I 2026-06-13 01:04:53,029] Trial 87 finished with value: 0.8044722533025578 and parameters: {'learning_rate': 0.01375073182457238, 'weight_decay': 0.0005702942884696893, 'batch_size': 8, 'oversample_method': 'smote', 'smote_ratio': 0.6842131046301546, 'resampling_k_neighbors': 2, 'cnn_channels': 16, 'cnn_kernel_size': 3, 'lstm_hidden_dim': 128, 'context_hidden_dim': 256, 'fusion_hidden_dim': 256, 'sequence_dropout': 0.15430020192215013, 'context_dropout': 0.14711537827396073, 'fusion_dropout': 0.19051249168349696}. Best is trial 55 with value: 0.8121442327638384.
2026-06-13 01:04:53,144 - preprocessing - INFO - xAPI engineered features created: ['engagement_score', 'absence_risk', 'parent_support_signal']
2026-06-13 01:04:53,147 - preprocessing - INFO - xAPI engineered features created: ['engagement_score', 'absence_risk', 'parent_support_signal']
2026-06-13 01:04:53,164 - preprocessing - INFO - Applying SMOTE on train set with ratio 0.6600626311462373...
2026-06-13 01:04:53,285 - preprocessing - INFO - Feature selection complete. Selected 17 / 19 features.
2026-06-13 01:05:13,686 - train_pipeline - INFO - Early stopping triggered at epoch 64
2026-06-13 01:05:13,704 - preprocessing - INFO - xAPI engineered features created: ['engagement_score', 'absence_risk', 'parent_support_signal']
2026-06-13 01:05:13,706 - preprocessing - INFO - xAPI engineered features created: ['engagement_score', 'absence_risk', 'parent_support_signal']
2026-06-13 01:05:13,724 - preprocessing - INFO - Applying SMOTE on train set with ratio 0.6600626311462373...
2026-06-13 01:05:13,848 - preprocessing - INFO - Feature selection complete. Selected 15 / 19 features.
2026-06-13 01:05:29,610 - train_pipeline - INFO - Early stopping triggered at epoch 49
2026-06-13 01:05:29,627 - preprocessing - INFO - xAPI engineered features created: ['engagement_score', 'absence_risk', 'parent_support_signal']
2026-06-13 01:05:29,630 - preprocessing - INFO - xAPI engineered features created: ['engagement_score', 'absence_risk', 'parent_support_signal']
2026-06-13 01:05:29,648 - preprocessing - INFO - Applying SMOTE on train set with ratio 0.6600626311462373...
2026-06-13 01:05:29,771 - preprocessing - INFO - Feature selection complete. Selected 18 / 19 features.
2026-06-13 01:05:39,242 - train_pipeline - INFO - Early stopping triggered at epoch 28
2026-06-13 01:05:39,260 - preprocessing - INFO - xAPI engineered features created: ['engagement_score', 'absence_risk', 'parent_support_signal']
2026-06-13 01:05:39,263 - preprocessing - INFO - xAPI engineered features created: ['engagement_score', 'absence_risk', 'parent_support_signal']
2026-06-13 01:05:39,280 - preprocessing - INFO - Applying SMOTE on train set with ratio 0.6600626311462373...
2026-06-13 01:05:39,401 - preprocessing - INFO - Feature selection complete. Selected 16 / 19 features.
2026-06-13 01:05:48,100 - train_pipeline - INFO - Early stopping triggered at epoch 26
2026-06-13 01:05:48,117 - preprocessing - INFO - xAPI engineered features created: ['engagement_score', 'absence_risk', 'parent_support_signal']
2026-06-13 01:05:48,120 - preprocessing - INFO - xAPI engineered features created: ['engagement_score', 'absence_risk', 'parent_support_signal']
2026-06-13 01:05:48,139 - preprocessing - INFO - Applying SMOTE on train set with ratio 0.6600626311462373...
2026-06-13 01:05:48,258 - preprocessing - INFO - Feature selection complete. Selected 17 / 19 features.
2026-06-13 01:05:58,846 - train_pipeline - INFO - Early stopping triggered at epoch 32
[I 2026-06-13 01:05:58,873] Trial 88 finished with value: 0.7897698361663703 and parameters: {'learning_rate': 0.011026241664052154, 'weight_decay': 0.00021125057134553985, 'batch_size': 8, 'oversample_method': 'smote', 'smote_ratio': 0.6600626311462373, 'resampling_k_neighbors': 2, 'cnn_channels': 16, 'cnn_kernel_size': 3, 'lstm_hidden_dim': 128, 'context_hidden_dim': 256, 'fusion_hidden_dim': 64, 'sequence_dropout': 0.3744880771479203, 'context_dropout': 0.11425544015063414, 'fusion_dropout': 0.24792005649493368}. Best is trial 55 with value: 0.8121442327638384.
2026-06-13 01:05:58,986 - preprocessing - INFO - xAPI engineered features created: ['engagement_score', 'absence_risk', 'parent_support_signal']
2026-06-13 01:05:58,989 - preprocessing - INFO - xAPI engineered features created: ['engagement_score', 'absence_risk', 'parent_support_signal']
2026-06-13 01:05:59,006 - preprocessing - INFO - Applying SMOTE on train set with ratio 0.6781430748923016...
2026-06-13 01:05:59,127 - preprocessing - INFO - Feature selection complete. Selected 16 / 19 features.
2026-06-13 01:06:22,792 - train_pipeline - INFO - Early stopping triggered at epoch 71
2026-06-13 01:06:22,811 - preprocessing - INFO - xAPI engineered features created: ['engagement_score', 'absence_risk', 'parent_support_signal']
2026-06-13 01:06:22,813 - preprocessing - INFO - xAPI engineered features created: ['engagement_score', 'absence_risk', 'parent_support_signal']
2026-06-13 01:06:22,831 - preprocessing - INFO - Applying SMOTE on train set with ratio 0.6781430748923016...
2026-06-13 01:06:22,953 - preprocessing - INFO - Feature selection complete. Selected 16 / 19 features.
2026-06-13 01:06:41,234 - train_pipeline - INFO - Early stopping triggered at epoch 54
2026-06-13 01:06:41,252 - preprocessing - INFO - xAPI engineered features created: ['engagement_score', 'absence_risk', 'parent_support_signal']
2026-06-13 01:06:41,254 - preprocessing - INFO - xAPI engineered features created: ['engagement_score', 'absence_risk', 'parent_support_signal']
2026-06-13 01:06:41,272 - preprocessing - INFO - Applying SMOTE on train set with ratio 0.6781430748923016...
2026-06-13 01:06:41,397 - preprocessing - INFO - Feature selection complete. Selected 18 / 19 features.
2026-06-13 01:07:00,659 - train_pipeline - INFO - Early stopping triggered at epoch 57
2026-06-13 01:07:00,678 - preprocessing - INFO - xAPI engineered features created: ['engagement_score', 'absence_risk', 'parent_support_signal']
2026-06-13 01:07:00,681 - preprocessing - INFO - xAPI engineered features created: ['engagement_score', 'absence_risk', 'parent_support_signal']
2026-06-13 01:07:00,699 - preprocessing - INFO - Applying SMOTE on train set with ratio 0.6781430748923016...
2026-06-13 01:07:00,822 - preprocessing - INFO - Feature selection complete. Selected 16 / 19 features.
2026-06-13 01:07:11,562 - train_pipeline - INFO - Early stopping triggered at epoch 31
2026-06-13 01:07:11,579 - preprocessing - INFO - xAPI engineered features created: ['engagement_score', 'absence_risk', 'parent_support_signal']
2026-06-13 01:07:11,581 - preprocessing - INFO - xAPI engineered features created: ['engagement_score', 'absence_risk', 'parent_support_signal']
2026-06-13 01:07:11,598 - preprocessing - INFO - Applying SMOTE on train set with ratio 0.6781430748923016...
2026-06-13 01:07:11,722 - preprocessing - INFO - Feature selection complete. Selected 18 / 19 features.
2026-06-13 01:07:23,499 - train_pipeline - INFO - Early stopping triggered at epoch 33
[I 2026-06-13 01:07:23,526] Trial 89 finished with value: 0.7967141378767696 and parameters: {'learning_rate': 0.010975706832103145, 'weight_decay': 0.000751054051318525, 'batch_size': 8, 'oversample_method': 'smote', 'smote_ratio': 0.6781430748923016, 'resampling_k_neighbors': 4, 'cnn_channels': 16, 'cnn_kernel_size': 3, 'lstm_hidden_dim': 128, 'context_hidden_dim': 256, 'fusion_hidden_dim': 256, 'sequence_dropout': 0.16018843377205322, 'context_dropout': 0.2274979415989371, 'fusion_dropout': 0.2913561541118849}. Best is trial 55 with value: 0.8121442327638384.
2026-06-13 01:07:23,640 - preprocessing - INFO - xAPI engineered features created: ['engagement_score', 'absence_risk', 'parent_support_signal']
2026-06-13 01:07:23,642 - preprocessing - INFO - xAPI engineered features created: ['engagement_score', 'absence_risk', 'parent_support_signal']
2026-06-13 01:07:23,659 - preprocessing - INFO - Applying ADASYN on train set with ratio 0.5545769140736737...
2026-06-13 01:07:23,777 - preprocessing - INFO - Feature selection complete. Selected 15 / 19 features.
2026-06-13 01:07:26,508 - train_pipeline - INFO - Early stopping triggered at epoch 46
2026-06-13 01:07:26,526 - preprocessing - INFO - xAPI engineered features created: ['engagement_score', 'absence_risk', 'parent_support_signal']
2026-06-13 01:07:26,528 - preprocessing - INFO - xAPI engineered features created: ['engagement_score', 'absence_risk', 'parent_support_signal']
2026-06-13 01:07:26,547 - preprocessing - INFO - Applying ADASYN on train set with ratio 0.5545769140736737...
2026-06-13 01:07:26,663 - preprocessing - INFO - Feature selection complete. Selected 16 / 19 features.
2026-06-13 01:07:29,615 - train_pipeline - INFO - Early stopping triggered at epoch 43
2026-06-13 01:07:29,633 - preprocessing - INFO - xAPI engineered features created: ['engagement_score', 'absence_risk', 'parent_support_signal']
2026-06-13 01:07:29,635 - preprocessing - INFO - xAPI engineered features created: ['engagement_score', 'absence_risk', 'parent_support_signal']
2026-06-13 01:07:29,652 - preprocessing - INFO - Applying ADASYN on train set with ratio 0.5545769140736737...
2026-06-13 01:07:29,773 - preprocessing - INFO - Feature selection complete. Selected 18 / 19 features.
2026-06-13 01:07:31,649 - train_pipeline - INFO - Early stopping triggered at epoch 31
2026-06-13 01:07:31,666 - preprocessing - INFO - xAPI engineered features created: ['engagement_score', 'absence_risk', 'parent_support_signal']
2026-06-13 01:07:31,669 - preprocessing - INFO - xAPI engineered features created: ['engagement_score', 'absence_risk', 'parent_support_signal']
2026-06-13 01:07:31,687 - preprocessing - INFO - Applying ADASYN on train set with ratio 0.5545769140736737...
2026-06-13 01:07:31,806 - preprocessing - INFO - Feature selection complete. Selected 16 / 19 features.
2026-06-13 01:07:34,022 - train_pipeline - INFO - Early stopping triggered at epoch 37
2026-06-13 01:07:34,041 - preprocessing - INFO - xAPI engineered features created: ['engagement_score', 'absence_risk', 'parent_support_signal']
2026-06-13 01:07:34,044 - preprocessing - INFO - xAPI engineered features created: ['engagement_score', 'absence_risk', 'parent_support_signal']
2026-06-13 01:07:34,061 - preprocessing - INFO - Applying ADASYN on train set with ratio 0.5545769140736737...
2026-06-13 01:07:34,182 - preprocessing - INFO - Feature selection complete. Selected 18 / 19 features.
2026-06-13 01:07:36,991 - train_pipeline - INFO - Early stopping triggered at epoch 45
[I 2026-06-13 01:07:37,030] Trial 90 finished with value: 0.8083988459736796 and parameters: {'learning_rate': 0.0052510266519266244, 'weight_decay': 0.00025368728874942633, 'batch_size': 64, 'oversample_method': 'adasyn', 'smote_ratio': 0.5545769140736737, 'resampling_k_neighbors': 3, 'cnn_channels': 16, 'cnn_kernel_size': 2, 'lstm_hidden_dim': 128, 'context_hidden_dim': 256, 'fusion_hidden_dim': 256, 'sequence_dropout': 0.31426216832288645, 'context_dropout': 0.1230369612935053, 'fusion_dropout': 0.1687320452512472}. Best is trial 55 with value: 0.8121442327638384.
2026-06-13 01:07:37,181 - preprocessing - INFO - xAPI engineered features created: ['engagement_score', 'absence_risk', 'parent_support_signal']
2026-06-13 01:07:37,185 - preprocessing - INFO - xAPI engineered features created: ['engagement_score', 'absence_risk', 'parent_support_signal']
2026-06-13 01:07:37,211 - preprocessing - INFO - Applying ADASYN on train set with ratio 0.5013684150194664...
2026-06-13 01:07:37,360 - preprocessing - INFO - Feature selection complete. Selected 15 / 19 features.
2026-06-13 01:07:39,823 - train_pipeline - INFO - Early stopping triggered at epoch 38
2026-06-13 01:07:39,841 - preprocessing - INFO - xAPI engineered features created: ['engagement_score', 'absence_risk', 'parent_support_signal']
2026-06-13 01:07:39,843 - preprocessing - INFO - xAPI engineered features created: ['engagement_score', 'absence_risk', 'parent_support_signal']
2026-06-13 01:07:39,861 - preprocessing - INFO - Applying ADASYN on train set with ratio 0.5013684150194664...
2026-06-13 01:07:39,981 - preprocessing - INFO - Feature selection complete. Selected 16 / 19 features.
2026-06-13 01:07:42,487 - train_pipeline - INFO - Early stopping triggered at epoch 42
2026-06-13 01:07:42,507 - preprocessing - INFO - xAPI engineered features created: ['engagement_score', 'absence_risk', 'parent_support_signal']
2026-06-13 01:07:42,509 - preprocessing - INFO - xAPI engineered features created: ['engagement_score', 'absence_risk', 'parent_support_signal']
2026-06-13 01:07:42,525 - preprocessing - INFO - Applying ADASYN on train set with ratio 0.5013684150194664...
2026-06-13 01:07:42,650 - preprocessing - INFO - Feature selection complete. Selected 18 / 19 features.
2026-06-13 01:07:45,952 - train_pipeline - INFO - Early stopping triggered at epoch 48
[I 2026-06-13 01:07:45,978] Trial 91 pruned. 
2026-06-13 01:07:46,093 - preprocessing - INFO - xAPI engineered features created: ['engagement_score', 'absence_risk', 'parent_support_signal']
2026-06-13 01:07:46,096 - preprocessing - INFO - xAPI engineered features created: ['engagement_score', 'absence_risk', 'parent_support_signal']
2026-06-13 01:07:46,113 - preprocessing - INFO - Applying SMOTE on train set with ratio 0.5003229641323371...
2026-06-13 01:07:46,234 - preprocessing - INFO - Feature selection complete. Selected 15 / 19 features.
2026-06-13 01:07:48,744 - train_pipeline - INFO - Early stopping triggered at epoch 41
2026-06-13 01:07:48,773 - preprocessing - INFO - xAPI engineered features created: ['engagement_score', 'absence_risk', 'parent_support_signal']
2026-06-13 01:07:48,776 - preprocessing - INFO - xAPI engineered features created: ['engagement_score', 'absence_risk', 'parent_support_signal']
2026-06-13 01:07:48,807 - preprocessing - INFO - Applying SMOTE on train set with ratio 0.5003229641323371...
2026-06-13 01:07:48,983 - preprocessing - INFO - Feature selection complete. Selected 16 / 19 features.
2026-06-13 01:07:51,680 - train_pipeline - INFO - Early stopping triggered at epoch 39
2026-06-13 01:07:51,697 - preprocessing - INFO - xAPI engineered features created: ['engagement_score', 'absence_risk', 'parent_support_signal']
2026-06-13 01:07:51,700 - preprocessing - INFO - xAPI engineered features created: ['engagement_score', 'absence_risk', 'parent_support_signal']
2026-06-13 01:07:51,717 - preprocessing - INFO - Applying SMOTE on train set with ratio 0.5003229641323371...
2026-06-13 01:07:51,836 - preprocessing - INFO - Feature selection complete. Selected 18 / 19 features.
2026-06-13 01:07:54,720 - train_pipeline - INFO - Early stopping triggered at epoch 47
