[I 2026-06-13 00:36:09,224] Trial 22 pruned. 
2026-06-13 00:36:09,342 - preprocessing - INFO - xAPI engineered features created: ['engagement_score', 'absence_risk', 'parent_support_signal']
2026-06-13 00:36:09,345 - preprocessing - INFO - xAPI engineered features created: ['engagement_score', 'absence_risk', 'parent_support_signal']
2026-06-13 00:36:09,361 - preprocessing - INFO - Applying SMOTE on train set with ratio 0.41929458176758516...
2026-06-13 00:36:09,480 - preprocessing - INFO - Feature selection complete. Selected 15 / 19 features.
2026-06-13 00:36:20,341 - train_pipeline - INFO - Early stopping triggered at epoch 35
2026-06-13 00:36:20,360 - preprocessing - INFO - xAPI engineered features created: ['engagement_score', 'absence_risk', 'parent_support_signal']
2026-06-13 00:36:20,362 - preprocessing - INFO - xAPI engineered features created: ['engagement_score', 'absence_risk', 'parent_support_signal']
2026-06-13 00:36:20,379 - preprocessing - INFO - Applying SMOTE on train set with ratio 0.41929458176758516...
2026-06-13 00:36:20,494 - preprocessing - INFO - Feature selection complete. Selected 16 / 19 features.
2026-06-13 00:36:35,649 - train_pipeline - INFO - Early stopping triggered at epoch 46
2026-06-13 00:36:35,668 - preprocessing - INFO - xAPI engineered features created: ['engagement_score', 'absence_risk', 'parent_support_signal']
2026-06-13 00:36:35,670 - preprocessing - INFO - xAPI engineered features created: ['engagement_score', 'absence_risk', 'parent_support_signal']
2026-06-13 00:36:35,688 - preprocessing - INFO - Applying SMOTE on train set with ratio 0.41929458176758516...
2026-06-13 00:36:35,819 - preprocessing - INFO - Feature selection complete. Selected 18 / 19 features.
2026-06-13 00:36:51,449 - train_pipeline - INFO - Early stopping triggered at epoch 49
2026-06-13 00:36:51,469 - preprocessing - INFO - xAPI engineered features created: ['engagement_score', 'absence_risk', 'parent_support_signal']
2026-06-13 00:36:51,471 - preprocessing - INFO - xAPI engineered features created: ['engagement_score', 'absence_risk', 'parent_support_signal']
2026-06-13 00:36:51,489 - preprocessing - INFO - Applying SMOTE on train set with ratio 0.41929458176758516...
2026-06-13 00:36:51,605 - preprocessing - INFO - Feature selection complete. Selected 16 / 19 features.
2026-06-13 00:37:05,152 - train_pipeline - INFO - Early stopping triggered at epoch 44
2026-06-13 00:37:05,170 - preprocessing - INFO - xAPI engineered features created: ['engagement_score', 'absence_risk', 'parent_support_signal']
2026-06-13 00:37:05,172 - preprocessing - INFO - xAPI engineered features created: ['engagement_score', 'absence_risk', 'parent_support_signal']
2026-06-13 00:37:05,189 - preprocessing - INFO - Applying SMOTE on train set with ratio 0.41929458176758516...
2026-06-13 00:37:05,309 - preprocessing - INFO - Feature selection complete. Selected 18 / 19 features.
2026-06-13 00:37:22,226 - train_pipeline - INFO - Early stopping triggered at epoch 55
[I 2026-06-13 00:37:22,254] Trial 23 finished with value: 0.8008431986811562 and parameters: {'learning_rate': 0.012079881650524154, 'weight_decay': 0.00015733357658324613, 'batch_size': 8, 'oversample_method': 'smote', 'smote_ratio': 0.41929458176758516, 'resampling_k_neighbors': 2, 'cnn_channels': 16, 'cnn_kernel_size': 3, 'lstm_hidden_dim': 128, 'context_hidden_dim': 128, 'fusion_hidden_dim': 128, 'sequence_dropout': 0.1899647243266036, 'context_dropout': 0.329050102456263, 'fusion_dropout': 0.3069528889580329}. Best is trial 17 with value: 0.8075693134180814.
2026-06-13 00:37:22,365 - preprocessing - INFO - xAPI engineered features created: ['engagement_score', 'absence_risk', 'parent_support_signal']
2026-06-13 00:37:22,368 - preprocessing - INFO - xAPI engineered features created: ['engagement_score', 'absence_risk', 'parent_support_signal']
2026-06-13 00:37:22,384 - preprocessing - INFO - Applying SMOTE on train set with ratio 0.42133278825512843...
2026-06-13 00:37:22,502 - preprocessing - INFO - Feature selection complete. Selected 15 / 19 features.
2026-06-13 00:37:25,266 - train_pipeline - INFO - Early stopping triggered at epoch 31
2026-06-13 00:37:25,283 - preprocessing - INFO - xAPI engineered features created: ['engagement_score', 'absence_risk', 'parent_support_signal']
2026-06-13 00:37:25,286 - preprocessing - INFO - xAPI engineered features created: ['engagement_score', 'absence_risk', 'parent_support_signal']
2026-06-13 00:37:25,303 - preprocessing - INFO - Applying SMOTE on train set with ratio 0.42133278825512843...
2026-06-13 00:37:25,419 - preprocessing - INFO - Feature selection complete. Selected 16 / 19 features.
2026-06-13 00:37:28,863 - train_pipeline - INFO - Early stopping triggered at epoch 34
2026-06-13 00:37:28,881 - preprocessing - INFO - xAPI engineered features created: ['engagement_score', 'absence_risk', 'parent_support_signal']
2026-06-13 00:37:28,883 - preprocessing - INFO - xAPI engineered features created: ['engagement_score', 'absence_risk', 'parent_support_signal']
2026-06-13 00:37:28,901 - preprocessing - INFO - Applying SMOTE on train set with ratio 0.42133278825512843...
2026-06-13 00:37:29,017 - preprocessing - INFO - Feature selection complete. Selected 18 / 19 features.
2026-06-13 00:37:31,638 - train_pipeline - INFO - Early stopping triggered at epoch 29
2026-06-13 00:37:31,655 - preprocessing - INFO - xAPI engineered features created: ['engagement_score', 'absence_risk', 'parent_support_signal']
2026-06-13 00:37:31,658 - preprocessing - INFO - xAPI engineered features created: ['engagement_score', 'absence_risk', 'parent_support_signal']
2026-06-13 00:37:31,676 - preprocessing - INFO - Applying SMOTE on train set with ratio 0.42133278825512843...
2026-06-13 00:37:31,821 - preprocessing - INFO - Feature selection complete. Selected 16 / 19 features.
2026-06-13 00:37:35,841 - train_pipeline - INFO - Early stopping triggered at epoch 40
2026-06-13 00:37:35,870 - preprocessing - INFO - xAPI engineered features created: ['engagement_score', 'absence_risk', 'parent_support_signal']
2026-06-13 00:37:35,874 - preprocessing - INFO - xAPI engineered features created: ['engagement_score', 'absence_risk', 'parent_support_signal']
2026-06-13 00:37:35,904 - preprocessing - INFO - Applying SMOTE on train set with ratio 0.42133278825512843...
2026-06-13 00:37:36,084 - preprocessing - INFO - Feature selection complete. Selected 18 / 19 features.
2026-06-13 00:37:41,854 - train_pipeline - INFO - Early stopping triggered at epoch 57
[I 2026-06-13 00:37:41,883] Trial 24 finished with value: 0.8007267446621815 and parameters: {'learning_rate': 0.0074517444139894275, 'weight_decay': 0.000531989310049583, 'batch_size': 32, 'oversample_method': 'smote', 'smote_ratio': 0.42133278825512843, 'resampling_k_neighbors': 3, 'cnn_channels': 16, 'cnn_kernel_size': 3, 'lstm_hidden_dim': 128, 'context_hidden_dim': 128, 'fusion_hidden_dim': 128, 'sequence_dropout': 0.10426962268673683, 'context_dropout': 0.30483098881590526, 'fusion_dropout': 0.3021881225856638}. Best is trial 17 with value: 0.8075693134180814.
2026-06-13 00:37:41,997 - preprocessing - INFO - xAPI engineered features created: ['engagement_score', 'absence_risk', 'parent_support_signal']
2026-06-13 00:37:41,999 - preprocessing - INFO - xAPI engineered features created: ['engagement_score', 'absence_risk', 'parent_support_signal']
2026-06-13 00:37:42,017 - preprocessing - INFO - Applying SMOTE on train set with ratio 0.5459001465189107...
2026-06-13 00:37:42,131 - preprocessing - INFO - Feature selection complete. Selected 15 / 19 features.
2026-06-13 00:37:44,016 - train_pipeline - INFO - Early stopping triggered at epoch 35
2026-06-13 00:37:44,034 - preprocessing - INFO - xAPI engineered features created: ['engagement_score', 'absence_risk', 'parent_support_signal']
2026-06-13 00:37:44,037 - preprocessing - INFO - xAPI engineered features created: ['engagement_score', 'absence_risk', 'parent_support_signal']
2026-06-13 00:37:44,060 - preprocessing - INFO - Applying SMOTE on train set with ratio 0.5459001465189107...
2026-06-13 00:37:44,183 - preprocessing - INFO - Feature selection complete. Selected 16 / 19 features.
2026-06-13 00:37:45,689 - train_pipeline - INFO - Early stopping triggered at epoch 29
2026-06-13 00:37:45,708 - preprocessing - INFO - xAPI engineered features created: ['engagement_score', 'absence_risk', 'parent_support_signal']
2026-06-13 00:37:45,710 - preprocessing - INFO - xAPI engineered features created: ['engagement_score', 'absence_risk', 'parent_support_signal']
2026-06-13 00:37:45,727 - preprocessing - INFO - Applying SMOTE on train set with ratio 0.5459001465189107...
2026-06-13 00:37:45,844 - preprocessing - INFO - Feature selection complete. Selected 18 / 19 features.
2026-06-13 00:37:48,483 - train_pipeline - INFO - Early stopping triggered at epoch 51
2026-06-13 00:37:48,502 - preprocessing - INFO - xAPI engineered features created: ['engagement_score', 'absence_risk', 'parent_support_signal']
2026-06-13 00:37:48,505 - preprocessing - INFO - xAPI engineered features created: ['engagement_score', 'absence_risk', 'parent_support_signal']
2026-06-13 00:37:48,522 - preprocessing - INFO - Applying SMOTE on train set with ratio 0.5459001465189107...
2026-06-13 00:37:48,641 - preprocessing - INFO - Feature selection complete. Selected 16 / 19 features.
2026-06-13 00:37:50,861 - train_pipeline - INFO - Early stopping triggered at epoch 34
2026-06-13 00:37:50,878 - preprocessing - INFO - xAPI engineered features created: ['engagement_score', 'absence_risk', 'parent_support_signal']
2026-06-13 00:37:50,881 - preprocessing - INFO - xAPI engineered features created: ['engagement_score', 'absence_risk', 'parent_support_signal']
2026-06-13 00:37:50,899 - preprocessing - INFO - Applying SMOTE on train set with ratio 0.5459001465189107...
2026-06-13 00:37:51,019 - preprocessing - INFO - Feature selection complete. Selected 18 / 19 features.
2026-06-13 00:37:52,643 - train_pipeline - INFO - Early stopping triggered at epoch 31
[I 2026-06-13 00:37:52,672] Trial 25 finished with value: 0.7849495097201638 and parameters: {'learning_rate': 0.014962230692041535, 'weight_decay': 1.7320494633211736e-05, 'batch_size': 64, 'oversample_method': 'smote', 'smote_ratio': 0.5459001465189107, 'resampling_k_neighbors': 3, 'cnn_channels': 128, 'cnn_kernel_size': 3, 'lstm_hidden_dim': 64, 'context_hidden_dim': 128, 'fusion_hidden_dim': 128, 'sequence_dropout': 0.18604647711697303, 'context_dropout': 0.348310223826425, 'fusion_dropout': 0.21909680261033693}. Best is trial 17 with value: 0.8075693134180814.
2026-06-13 00:37:52,790 - preprocessing - INFO - xAPI engineered features created: ['engagement_score', 'absence_risk', 'parent_support_signal']
2026-06-13 00:37:52,792 - preprocessing - INFO - xAPI engineered features created: ['engagement_score', 'absence_risk', 'parent_support_signal']
2026-06-13 00:37:52,809 - preprocessing - INFO - Applying SMOTE on train set with ratio 0.36972993711431...
2026-06-13 00:37:52,924 - preprocessing - INFO - Feature selection complete. Selected 15 / 19 features.
2026-06-13 00:38:04,408 - train_pipeline - INFO - Early stopping triggered at epoch 34
2026-06-13 00:38:04,426 - preprocessing - INFO - xAPI engineered features created: ['engagement_score', 'absence_risk', 'parent_support_signal']
2026-06-13 00:38:04,429 - preprocessing - INFO - xAPI engineered features created: ['engagement_score', 'absence_risk', 'parent_support_signal']
2026-06-13 00:38:04,446 - preprocessing - INFO - Applying SMOTE on train set with ratio 0.36972993711431...
2026-06-13 00:38:04,562 - preprocessing - INFO - Feature selection complete. Selected 16 / 19 features.
2026-06-13 00:38:14,967 - train_pipeline - INFO - Early stopping triggered at epoch 31
2026-06-13 00:38:14,984 - preprocessing - INFO - xAPI engineered features created: ['engagement_score', 'absence_risk', 'parent_support_signal']
2026-06-13 00:38:14,986 - preprocessing - INFO - xAPI engineered features created: ['engagement_score', 'absence_risk', 'parent_support_signal']
2026-06-13 00:38:15,004 - preprocessing - INFO - Applying SMOTE on train set with ratio 0.36972993711431...
2026-06-13 00:38:15,120 - preprocessing - INFO - Feature selection complete. Selected 18 / 19 features.
2026-06-13 00:38:31,353 - train_pipeline - INFO - Early stopping triggered at epoch 49
[I 2026-06-13 00:38:31,378] Trial 26 pruned. 
2026-06-13 00:38:31,492 - preprocessing - INFO - xAPI engineered features created: ['engagement_score', 'absence_risk', 'parent_support_signal']
2026-06-13 00:38:31,495 - preprocessing - INFO - xAPI engineered features created: ['engagement_score', 'absence_risk', 'parent_support_signal']
2026-06-13 00:38:31,512 - preprocessing - INFO - Applying ADASYN on train set with ratio 0.9496957220951734...
2026-06-13 00:38:31,647 - preprocessing - INFO - Feature selection complete. Selected 18 / 19 features.
2026-06-13 00:38:37,093 - preprocessing - INFO - xAPI engineered features created: ['engagement_score', 'absence_risk', 'parent_support_signal']
2026-06-13 00:38:37,095 - preprocessing - INFO - xAPI engineered features created: ['engagement_score', 'absence_risk', 'parent_support_signal']
2026-06-13 00:38:37,112 - preprocessing - INFO - Applying ADASYN on train set with ratio 0.9496957220951734...
2026-06-13 00:38:37,245 - preprocessing - INFO - Feature selection complete. Selected 17 / 19 features.
2026-06-13 00:38:39,872 - train_pipeline - INFO - Early stopping triggered at epoch 41
2026-06-13 00:38:39,898 - preprocessing - INFO - xAPI engineered features created: ['engagement_score', 'absence_risk', 'parent_support_signal']
2026-06-13 00:38:39,903 - preprocessing - INFO - xAPI engineered features created: ['engagement_score', 'absence_risk', 'parent_support_signal']
2026-06-13 00:38:39,930 - preprocessing - INFO - Applying ADASYN on train set with ratio 0.9496957220951734...
2026-06-13 00:38:40,124 - preprocessing - INFO - Feature selection complete. Selected 18 / 19 features.
2026-06-13 00:38:42,887 - train_pipeline - INFO - Early stopping triggered at epoch 40
[I 2026-06-13 00:38:42,912] Trial 27 pruned. 
2026-06-13 00:38:43,022 - preprocessing - INFO - xAPI engineered features created: ['engagement_score', 'absence_risk', 'parent_support_signal']
2026-06-13 00:38:43,025 - preprocessing - INFO - xAPI engineered features created: ['engagement_score', 'absence_risk', 'parent_support_signal']
2026-06-13 00:38:43,042 - preprocessing - INFO - Applying SMOTE on train set with ratio 0.9197696743555779...
2026-06-13 00:38:43,166 - preprocessing - INFO - Feature selection complete. Selected 19 / 19 features.
2026-06-13 00:38:44,840 - train_pipeline - INFO - Early stopping triggered at epoch 28
2026-06-13 00:38:44,857 - preprocessing - INFO - xAPI engineered features created: ['engagement_score', 'absence_risk', 'parent_support_signal']
2026-06-13 00:38:44,859 - preprocessing - INFO - xAPI engineered features created: ['engagement_score', 'absence_risk', 'parent_support_signal']
2026-06-13 00:38:44,877 - preprocessing - INFO - Applying SMOTE on train set with ratio 0.9197696743555779...
2026-06-13 00:38:45,001 - preprocessing - INFO - Feature selection complete. Selected 16 / 19 features.
2026-06-13 00:38:47,661 - train_pipeline - INFO - Early stopping triggered at epoch 45
2026-06-13 00:38:47,679 - preprocessing - INFO - xAPI engineered features created: ['engagement_score', 'absence_risk', 'parent_support_signal']
2026-06-13 00:38:47,681 - preprocessing - INFO - xAPI engineered features created: ['engagement_score', 'absence_risk', 'parent_support_signal']
2026-06-13 00:38:47,699 - preprocessing - INFO - Applying SMOTE on train set with ratio 0.9197696743555779...
2026-06-13 00:38:47,867 - preprocessing - INFO - Feature selection complete. Selected 18 / 19 features.
2026-06-13 00:38:49,985 - train_pipeline - INFO - Early stopping triggered at epoch 30
[I 2026-06-13 00:38:50,008] Trial 28 pruned. 
2026-06-13 00:38:50,123 - preprocessing - INFO - xAPI engineered features created: ['engagement_score', 'absence_risk', 'parent_support_signal']
2026-06-13 00:38:50,125 - preprocessing - INFO - xAPI engineered features created: ['engagement_score', 'absence_risk', 'parent_support_signal']
2026-06-13 00:38:50,143 - preprocessing - INFO - Applying ADASYN on train set with ratio 0.6251553531988592...
2026-06-13 00:38:50,151 - preprocessing - WARNING - ADASYN failed (likely too few samples). Error: No samples will be generated with the provided ratio settings.. Falling back to no oversampling.
2026-06-13 00:38:50,266 - preprocessing - INFO - Feature selection complete. Selected 15 / 19 features.
2026-06-13 00:38:58,950 - train_pipeline - INFO - Early stopping triggered at epoch 29
2026-06-13 00:38:58,968 - preprocessing - INFO - xAPI engineered features created: ['engagement_score', 'absence_risk', 'parent_support_signal']
2026-06-13 00:38:58,971 - preprocessing - INFO - xAPI engineered features created: ['engagement_score', 'absence_risk', 'parent_support_signal']
2026-06-13 00:38:58,987 - preprocessing - INFO - Applying ADASYN on train set with ratio 0.6251553531988592...
2026-06-13 00:38:58,996 - preprocessing - WARNING - ADASYN failed (likely too few samples). Error: No samples will be generated with the provided ratio settings.. Falling back to no oversampling.
2026-06-13 00:38:59,110 - preprocessing - INFO - Feature selection complete. Selected 16 / 19 features.
2026-06-13 00:39:07,449 - train_pipeline - INFO - Early stopping triggered at epoch 28
2026-06-13 00:39:07,467 - preprocessing - INFO - xAPI engineered features created: ['engagement_score', 'absence_risk', 'parent_support_signal']
2026-06-13 00:39:07,469 - preprocessing - INFO - xAPI engineered features created: ['engagement_score', 'absence_risk', 'parent_support_signal']
2026-06-13 00:39:07,486 - preprocessing - INFO - Applying ADASYN on train set with ratio 0.6251553531988592...
2026-06-13 00:39:07,493 - preprocessing - WARNING - ADASYN failed (likely too few samples). Error: No samples will be generated with the provided ratio settings.. Falling back to no oversampling.
2026-06-13 00:39:07,613 - preprocessing - INFO - Feature selection complete. Selected 18 / 19 features.
2026-06-13 00:39:24,166 - train_pipeline - INFO - Early stopping triggered at epoch 55
2026-06-13 00:39:24,185 - preprocessing - INFO - xAPI engineered features created: ['engagement_score', 'absence_risk', 'parent_support_signal']
2026-06-13 00:39:24,187 - preprocessing - INFO - xAPI engineered features created: ['engagement_score', 'absence_risk', 'parent_support_signal']
2026-06-13 00:39:24,204 - preprocessing - INFO - Applying ADASYN on train set with ratio 0.6251553531988592...
2026-06-13 00:39:24,211 - preprocessing - WARNING - ADASYN failed (likely too few samples). Error: No samples will be generated with the provided ratio settings.. Falling back to no oversampling.
2026-06-13 00:39:24,342 - preprocessing - INFO - Feature selection complete. Selected 16 / 19 features.
2026-06-13 00:39:35,865 - train_pipeline - INFO - Early stopping triggered at epoch 39
2026-06-13 00:39:35,882 - preprocessing - INFO - xAPI engineered features created: ['engagement_score', 'absence_risk', 'parent_support_signal']
2026-06-13 00:39:35,884 - preprocessing - INFO - xAPI engineered features created: ['engagement_score', 'absence_risk', 'parent_support_signal']
2026-06-13 00:39:35,901 - preprocessing - INFO - Applying ADASYN on train set with ratio 0.6251553531988592...
2026-06-13 00:39:35,908 - preprocessing - WARNING - ADASYN failed (likely too few samples). Error: No samples will be generated with the provided ratio settings.. Falling back to no oversampling.
2026-06-13 00:39:36,030 - preprocessing - INFO - Feature selection complete. Selected 18 / 19 features.
2026-06-13 00:39:47,299 - train_pipeline - INFO - Early stopping triggered at epoch 38
