[I 2026-06-13 01:07:54,747] Trial 92 pruned. 
2026-06-13 01:07:54,906 - preprocessing - INFO - xAPI engineered features created: ['engagement_score', 'absence_risk', 'parent_support_signal']
2026-06-13 01:07:54,908 - preprocessing - INFO - xAPI engineered features created: ['engagement_score', 'absence_risk', 'parent_support_signal']
2026-06-13 01:07:54,933 - preprocessing - INFO - Applying ADASYN on train set with ratio 0.7536578138970361...
2026-06-13 01:07:54,957 - preprocessing - WARNING - ADASYN failed (likely too few samples). Error: No samples will be generated with the provided ratio settings.. Falling back to no oversampling.
2026-06-13 01:07:55,113 - preprocessing - INFO - Feature selection complete. Selected 15 / 19 features.
2026-06-13 01:07:57,580 - train_pipeline - INFO - Early stopping triggered at epoch 42
2026-06-13 01:07:57,599 - preprocessing - INFO - xAPI engineered features created: ['engagement_score', 'absence_risk', 'parent_support_signal']
2026-06-13 01:07:57,601 - preprocessing - INFO - xAPI engineered features created: ['engagement_score', 'absence_risk', 'parent_support_signal']
2026-06-13 01:07:57,618 - preprocessing - INFO - Applying ADASYN on train set with ratio 0.7536578138970361...
2026-06-13 01:07:57,632 - preprocessing - WARNING - ADASYN failed (likely too few samples). Error: No samples will be generated with the provided ratio settings.. Falling back to no oversampling.
2026-06-13 01:07:57,753 - preprocessing - INFO - Feature selection complete. Selected 16 / 19 features.
2026-06-13 01:08:00,007 - train_pipeline - INFO - Early stopping triggered at epoch 43
2026-06-13 01:08:00,026 - preprocessing - INFO - xAPI engineered features created: ['engagement_score', 'absence_risk', 'parent_support_signal']
2026-06-13 01:08:00,028 - preprocessing - INFO - xAPI engineered features created: ['engagement_score', 'absence_risk', 'parent_support_signal']
2026-06-13 01:08:00,045 - preprocessing - INFO - Applying ADASYN on train set with ratio 0.7536578138970361...
2026-06-13 01:08:00,061 - preprocessing - WARNING - ADASYN failed (likely too few samples). Error: No samples will be generated with the provided ratio settings.. Falling back to no oversampling.
2026-06-13 01:08:00,187 - preprocessing - INFO - Feature selection complete. Selected 18 / 19 features.
2026-06-13 01:08:01,948 - train_pipeline - INFO - Early stopping triggered at epoch 33
2026-06-13 01:08:01,965 - preprocessing - INFO - xAPI engineered features created: ['engagement_score', 'absence_risk', 'parent_support_signal']
2026-06-13 01:08:01,967 - preprocessing - INFO - xAPI engineered features created: ['engagement_score', 'absence_risk', 'parent_support_signal']
2026-06-13 01:08:01,985 - preprocessing - INFO - Applying ADASYN on train set with ratio 0.7536578138970361...
2026-06-13 01:08:01,998 - preprocessing - WARNING - ADASYN failed (likely too few samples). Error: No samples will be generated with the provided ratio settings.. Falling back to no oversampling.
2026-06-13 01:08:02,115 - preprocessing - INFO - Feature selection complete. Selected 16 / 19 features.
2026-06-13 01:08:04,496 - train_pipeline - INFO - Early stopping triggered at epoch 45
2026-06-13 01:08:04,515 - preprocessing - INFO - xAPI engineered features created: ['engagement_score', 'absence_risk', 'parent_support_signal']
2026-06-13 01:08:04,517 - preprocessing - INFO - xAPI engineered features created: ['engagement_score', 'absence_risk', 'parent_support_signal']
2026-06-13 01:08:04,535 - preprocessing - INFO - Applying ADASYN on train set with ratio 0.7536578138970361...
2026-06-13 01:08:04,549 - preprocessing - WARNING - ADASYN failed (likely too few samples). Error: No samples will be generated with the provided ratio settings.. Falling back to no oversampling.
2026-06-13 01:08:04,674 - preprocessing - INFO - Feature selection complete. Selected 18 / 19 features.
2026-06-13 01:08:08,683 - train_pipeline - INFO - Early stopping triggered at epoch 68
[I 2026-06-13 01:08:08,711] Trial 93 finished with value: 0.798009608319145 and parameters: {'learning_rate': 0.009498006286112354, 'weight_decay': 0.0017237143943861829, 'batch_size': 64, 'oversample_method': 'adasyn', 'smote_ratio': 0.7536578138970361, 'resampling_k_neighbors': 2, 'cnn_channels': 16, 'cnn_kernel_size': 3, 'lstm_hidden_dim': 96, 'context_hidden_dim': 256, 'fusion_hidden_dim': 256, 'sequence_dropout': 0.2894822218648992, 'context_dropout': 0.1449243790876646, 'fusion_dropout': 0.12266360018637668}. Best is trial 55 with value: 0.8121442327638384.
2026-06-13 01:08:08,849 - preprocessing - INFO - xAPI engineered features created: ['engagement_score', 'absence_risk', 'parent_support_signal']
2026-06-13 01:08:08,852 - preprocessing - INFO - xAPI engineered features created: ['engagement_score', 'absence_risk', 'parent_support_signal']
2026-06-13 01:08:08,885 - preprocessing - INFO - Applying ADASYN on train set with ratio 0.6526085281920855...
2026-06-13 01:08:08,896 - preprocessing - WARNING - ADASYN failed (likely too few samples). Error: No samples will be generated with the provided ratio settings.. Falling back to no oversampling.
2026-06-13 01:08:09,049 - preprocessing - INFO - Feature selection complete. Selected 15 / 19 features.
2026-06-13 01:08:12,118 - train_pipeline - INFO - Early stopping triggered at epoch 46
2026-06-13 01:08:12,135 - preprocessing - INFO - xAPI engineered features created: ['engagement_score', 'absence_risk', 'parent_support_signal']
2026-06-13 01:08:12,137 - preprocessing - INFO - xAPI engineered features created: ['engagement_score', 'absence_risk', 'parent_support_signal']
2026-06-13 01:08:12,155 - preprocessing - INFO - Applying ADASYN on train set with ratio 0.6526085281920855...
2026-06-13 01:08:12,162 - preprocessing - WARNING - ADASYN failed (likely too few samples). Error: No samples will be generated with the provided ratio settings.. Falling back to no oversampling.
2026-06-13 01:08:12,275 - preprocessing - INFO - Feature selection complete. Selected 16 / 19 features.
2026-06-13 01:08:16,437 - train_pipeline - INFO - Early stopping triggered at epoch 62
2026-06-13 01:08:16,455 - preprocessing - INFO - xAPI engineered features created: ['engagement_score', 'absence_risk', 'parent_support_signal']
2026-06-13 01:08:16,457 - preprocessing - INFO - xAPI engineered features created: ['engagement_score', 'absence_risk', 'parent_support_signal']
2026-06-13 01:08:16,475 - preprocessing - INFO - Applying ADASYN on train set with ratio 0.6526085281920855...
2026-06-13 01:08:16,482 - preprocessing - WARNING - ADASYN failed (likely too few samples). Error: No samples will be generated with the provided ratio settings.. Falling back to no oversampling.
2026-06-13 01:08:16,598 - preprocessing - INFO - Feature selection complete. Selected 18 / 19 features.
2026-06-13 01:08:18,832 - train_pipeline - INFO - Early stopping triggered at epoch 36
2026-06-13 01:08:18,851 - preprocessing - INFO - xAPI engineered features created: ['engagement_score', 'absence_risk', 'parent_support_signal']
2026-06-13 01:08:18,855 - preprocessing - INFO - xAPI engineered features created: ['engagement_score', 'absence_risk', 'parent_support_signal']
2026-06-13 01:08:18,871 - preprocessing - INFO - Applying ADASYN on train set with ratio 0.6526085281920855...
2026-06-13 01:08:18,878 - preprocessing - WARNING - ADASYN failed (likely too few samples). Error: No samples will be generated with the provided ratio settings.. Falling back to no oversampling.
2026-06-13 01:08:18,995 - preprocessing - INFO - Feature selection complete. Selected 16 / 19 features.
2026-06-13 01:08:24,259 - preprocessing - INFO - xAPI engineered features created: ['engagement_score', 'absence_risk', 'parent_support_signal']
2026-06-13 01:08:24,262 - preprocessing - INFO - xAPI engineered features created: ['engagement_score', 'absence_risk', 'parent_support_signal']
2026-06-13 01:08:24,279 - preprocessing - INFO - Applying ADASYN on train set with ratio 0.6526085281920855...
2026-06-13 01:08:24,285 - preprocessing - WARNING - ADASYN failed (likely too few samples). Error: No samples will be generated with the provided ratio settings.. Falling back to no oversampling.
2026-06-13 01:08:24,398 - preprocessing - INFO - Feature selection complete. Selected 18 / 19 features.
2026-06-13 01:08:27,326 - train_pipeline - INFO - Early stopping triggered at epoch 48
[I 2026-06-13 01:08:27,355] Trial 94 finished with value: 0.7995982464920527 and parameters: {'learning_rate': 0.005980053327481214, 'weight_decay': 0.004358395072258588, 'batch_size': 64, 'oversample_method': 'adasyn', 'smote_ratio': 0.6526085281920855, 'resampling_k_neighbors': 4, 'cnn_channels': 64, 'cnn_kernel_size': 2, 'lstm_hidden_dim': 128, 'context_hidden_dim': 256, 'fusion_hidden_dim': 64, 'sequence_dropout': 0.31527133120442735, 'context_dropout': 0.19969213119833756, 'fusion_dropout': 0.13358528411060705}. Best is trial 55 with value: 0.8121442327638384.
2026-06-13 01:08:27,471 - preprocessing - INFO - xAPI engineered features created: ['engagement_score', 'absence_risk', 'parent_support_signal']
2026-06-13 01:08:27,473 - preprocessing - INFO - xAPI engineered features created: ['engagement_score', 'absence_risk', 'parent_support_signal']
2026-06-13 01:08:27,491 - preprocessing - INFO - Applying SMOTE on train set with ratio 0.48025091857052404...
2026-06-13 01:08:27,607 - preprocessing - INFO - Feature selection complete. Selected 15 / 19 features.
2026-06-13 01:08:30,134 - train_pipeline - INFO - Early stopping triggered at epoch 44
2026-06-13 01:08:30,151 - preprocessing - INFO - xAPI engineered features created: ['engagement_score', 'absence_risk', 'parent_support_signal']
2026-06-13 01:08:30,153 - preprocessing - INFO - xAPI engineered features created: ['engagement_score', 'absence_risk', 'parent_support_signal']
2026-06-13 01:08:30,171 - preprocessing - INFO - Applying SMOTE on train set with ratio 0.48025091857052404...
2026-06-13 01:08:30,289 - preprocessing - INFO - Feature selection complete. Selected 16 / 19 features.
2026-06-13 01:08:31,889 - train_pipeline - INFO - Early stopping triggered at epoch 33
2026-06-13 01:08:31,907 - preprocessing - INFO - xAPI engineered features created: ['engagement_score', 'absence_risk', 'parent_support_signal']
2026-06-13 01:08:31,911 - preprocessing - INFO - xAPI engineered features created: ['engagement_score', 'absence_risk', 'parent_support_signal']
2026-06-13 01:08:31,929 - preprocessing - INFO - Applying SMOTE on train set with ratio 0.48025091857052404...
2026-06-13 01:08:32,047 - preprocessing - INFO - Feature selection complete. Selected 18 / 19 features.
2026-06-13 01:08:35,594 - train_pipeline - INFO - Early stopping triggered at epoch 64
2026-06-13 01:08:35,620 - preprocessing - INFO - xAPI engineered features created: ['engagement_score', 'absence_risk', 'parent_support_signal']
2026-06-13 01:08:35,622 - preprocessing - INFO - xAPI engineered features created: ['engagement_score', 'absence_risk', 'parent_support_signal']
2026-06-13 01:08:35,649 - preprocessing - INFO - Applying SMOTE on train set with ratio 0.48025091857052404...
2026-06-13 01:08:35,827 - preprocessing - INFO - Feature selection complete. Selected 16 / 19 features.
2026-06-13 01:08:37,387 - train_pipeline - INFO - Early stopping triggered at epoch 30
2026-06-13 01:08:37,407 - preprocessing - INFO - xAPI engineered features created: ['engagement_score', 'absence_risk', 'parent_support_signal']
2026-06-13 01:08:37,409 - preprocessing - INFO - xAPI engineered features created: ['engagement_score', 'absence_risk', 'parent_support_signal']
2026-06-13 01:08:37,427 - preprocessing - INFO - Applying SMOTE on train set with ratio 0.48025091857052404...
2026-06-13 01:08:37,546 - preprocessing - INFO - Feature selection complete. Selected 18 / 19 features.
2026-06-13 01:08:40,279 - train_pipeline - INFO - Early stopping triggered at epoch 48
[I 2026-06-13 01:08:40,314] Trial 95 finished with value: 0.8009184307882329 and parameters: {'learning_rate': 0.0024361384489192993, 'weight_decay': 3.4483898747831686e-05, 'batch_size': 64, 'oversample_method': 'smote', 'smote_ratio': 0.48025091857052404, 'resampling_k_neighbors': 3, 'cnn_channels': 16, 'cnn_kernel_size': 2, 'lstm_hidden_dim': 64, 'context_hidden_dim': 64, 'fusion_hidden_dim': 256, 'sequence_dropout': 0.3651995466786195, 'context_dropout': 0.24918840995357103, 'fusion_dropout': 0.13516466404578445}. Best is trial 55 with value: 0.8121442327638384.
2026-06-13 01:08:40,440 - preprocessing - INFO - xAPI engineered features created: ['engagement_score', 'absence_risk', 'parent_support_signal']
2026-06-13 01:08:40,443 - preprocessing - INFO - xAPI engineered features created: ['engagement_score', 'absence_risk', 'parent_support_signal']
2026-06-13 01:08:40,462 - preprocessing - INFO - Applying SMOTE on train set with ratio 0.6587674121999644...
2026-06-13 01:08:40,585 - preprocessing - INFO - Feature selection complete. Selected 16 / 19 features.
2026-06-13 01:08:43,817 - train_pipeline - INFO - Early stopping triggered at epoch 42
2026-06-13 01:08:43,838 - preprocessing - INFO - xAPI engineered features created: ['engagement_score', 'absence_risk', 'parent_support_signal']
2026-06-13 01:08:43,840 - preprocessing - INFO - xAPI engineered features created: ['engagement_score', 'absence_risk', 'parent_support_signal']
2026-06-13 01:08:43,859 - preprocessing - INFO - Applying SMOTE on train set with ratio 0.6587674121999644...
2026-06-13 01:08:43,997 - preprocessing - INFO - Feature selection complete. Selected 15 / 19 features.
2026-06-13 01:08:46,541 - train_pipeline - INFO - Early stopping triggered at epoch 37
2026-06-13 01:08:46,562 - preprocessing - INFO - xAPI engineered features created: ['engagement_score', 'absence_risk', 'parent_support_signal']
2026-06-13 01:08:46,566 - preprocessing - INFO - xAPI engineered features created: ['engagement_score', 'absence_risk', 'parent_support_signal']
2026-06-13 01:08:46,588 - preprocessing - INFO - Applying SMOTE on train set with ratio 0.6587674121999644...
2026-06-13 01:08:46,725 - preprocessing - INFO - Feature selection complete. Selected 18 / 19 features.
2026-06-13 01:08:50,464 - train_pipeline - INFO - Early stopping triggered at epoch 47
2026-06-13 01:08:50,483 - preprocessing - INFO - xAPI engineered features created: ['engagement_score', 'absence_risk', 'parent_support_signal']
2026-06-13 01:08:50,485 - preprocessing - INFO - xAPI engineered features created: ['engagement_score', 'absence_risk', 'parent_support_signal']
2026-06-13 01:08:50,503 - preprocessing - INFO - Applying SMOTE on train set with ratio 0.6587674121999644...
2026-06-13 01:08:50,632 - preprocessing - INFO - Feature selection complete. Selected 16 / 19 features.
2026-06-13 01:08:54,273 - train_pipeline - INFO - Early stopping triggered at epoch 48
2026-06-13 01:08:54,295 - preprocessing - INFO - xAPI engineered features created: ['engagement_score', 'absence_risk', 'parent_support_signal']
2026-06-13 01:08:54,297 - preprocessing - INFO - xAPI engineered features created: ['engagement_score', 'absence_risk', 'parent_support_signal']
2026-06-13 01:08:54,314 - preprocessing - INFO - Applying SMOTE on train set with ratio 0.6587674121999644...
2026-06-13 01:08:54,446 - preprocessing - INFO - Feature selection complete. Selected 17 / 19 features.
2026-06-13 01:08:57,923 - train_pipeline - INFO - Early stopping triggered at epoch 44
[I 2026-06-13 01:08:57,964] Trial 96 finished with value: 0.7909142388985506 and parameters: {'learning_rate': 0.0024833041294476887, 'weight_decay': 0.0010988943101074918, 'batch_size': 64, 'oversample_method': 'smote', 'smote_ratio': 0.6587674121999644, 'resampling_k_neighbors': 2, 'cnn_channels': 64, 'cnn_kernel_size': 2, 'lstm_hidden_dim': 128, 'context_hidden_dim': 128, 'fusion_hidden_dim': 256, 'sequence_dropout': 0.33349434643748305, 'context_dropout': 0.1809146877833236, 'fusion_dropout': 0.17916138056799186}. Best is trial 55 with value: 0.8121442327638384.
2026-06-13 01:08:58,095 - preprocessing - INFO - xAPI engineered features created: ['engagement_score', 'absence_risk', 'parent_support_signal']
2026-06-13 01:08:58,097 - preprocessing - INFO - xAPI engineered features created: ['engagement_score', 'absence_risk', 'parent_support_signal']
2026-06-13 01:08:58,118 - preprocessing - INFO - Applying SMOTE on train set with ratio 0.6285586318261294...
2026-06-13 01:08:58,254 - preprocessing - INFO - Feature selection complete. Selected 15 / 19 features.
2026-06-13 01:09:14,608 - train_pipeline - INFO - Early stopping triggered at epoch 48
2026-06-13 01:09:14,628 - preprocessing - INFO - xAPI engineered features created: ['engagement_score', 'absence_risk', 'parent_support_signal']
2026-06-13 01:09:14,630 - preprocessing - INFO - xAPI engineered features created: ['engagement_score', 'absence_risk', 'parent_support_signal']
2026-06-13 01:09:14,647 - preprocessing - INFO - Applying SMOTE on train set with ratio 0.6285586318261294...
2026-06-13 01:09:14,784 - preprocessing - INFO - Feature selection complete. Selected 16 / 19 features.
2026-06-13 01:09:37,903 - train_pipeline - INFO - Early stopping triggered at epoch 68
2026-06-13 01:09:37,920 - preprocessing - INFO - xAPI engineered features created: ['engagement_score', 'absence_risk', 'parent_support_signal']
2026-06-13 01:09:37,923 - preprocessing - INFO - xAPI engineered features created: ['engagement_score', 'absence_risk', 'parent_support_signal']
2026-06-13 01:09:37,952 - preprocessing - INFO - Applying SMOTE on train set with ratio 0.6285586318261294...
2026-06-13 01:09:38,086 - preprocessing - INFO - Feature selection complete. Selected 18 / 19 features.
2026-06-13 01:09:58,053 - train_pipeline - INFO - Early stopping triggered at epoch 59
[I 2026-06-13 01:09:58,079] Trial 97 pruned. 
2026-06-13 01:09:58,198 - preprocessing - INFO - xAPI engineered features created: ['engagement_score', 'absence_risk', 'parent_support_signal']
2026-06-13 01:09:58,200 - preprocessing - INFO - xAPI engineered features created: ['engagement_score', 'absence_risk', 'parent_support_signal']
2026-06-13 01:09:58,221 - preprocessing - INFO - Applying SMOTE on train set with ratio 0.8418508192151002...
2026-06-13 01:09:58,356 - preprocessing - INFO - Feature selection complete. Selected 18 / 19 features.
2026-06-13 01:10:02,937 - train_pipeline - INFO - Early stopping triggered at epoch 52
2026-06-13 01:10:02,956 - preprocessing - INFO - xAPI engineered features created: ['engagement_score', 'absence_risk', 'parent_support_signal']
2026-06-13 01:10:02,958 - preprocessing - INFO - xAPI engineered features created: ['engagement_score', 'absence_risk', 'parent_support_signal']
2026-06-13 01:10:02,982 - preprocessing - INFO - Applying SMOTE on train set with ratio 0.8418508192151002...
2026-06-13 01:10:03,116 - preprocessing - INFO - Feature selection complete. Selected 17 / 19 features.
2026-06-13 01:10:05,498 - train_pipeline - INFO - Early stopping triggered at epoch 30
2026-06-13 01:10:05,516 - preprocessing - INFO - xAPI engineered features created: ['engagement_score', 'absence_risk', 'parent_support_signal']
2026-06-13 01:10:05,519 - preprocessing - INFO - xAPI engineered features created: ['engagement_score', 'absence_risk', 'parent_support_signal']
2026-06-13 01:10:05,539 - preprocessing - INFO - Applying SMOTE on train set with ratio 0.8418508192151002...
2026-06-13 01:10:05,677 - preprocessing - INFO - Feature selection complete. Selected 18 / 19 features.
2026-06-13 01:10:09,788 - train_pipeline - INFO - Early stopping triggered at epoch 47
