[I 2026-06-13 01:27:35,791] Trial 139 pruned. 
2026-06-13 01:27:35,907 - preprocessing - INFO - xAPI engineered features created: ['engagement_score', 'absence_risk', 'parent_support_signal']
2026-06-13 01:27:35,909 - preprocessing - INFO - xAPI engineered features created: ['engagement_score', 'absence_risk', 'parent_support_signal']
2026-06-13 01:27:35,927 - preprocessing - INFO - Applying SMOTE on train set with ratio 0.6164972183048726...
2026-06-13 01:27:36,048 - preprocessing - INFO - Feature selection complete. Selected 15 / 19 features.
2026-06-13 01:27:41,867 - train_pipeline - INFO - Early stopping triggered at epoch 34
2026-06-13 01:27:41,885 - preprocessing - INFO - xAPI engineered features created: ['engagement_score', 'absence_risk', 'parent_support_signal']
2026-06-13 01:27:41,887 - preprocessing - INFO - xAPI engineered features created: ['engagement_score', 'absence_risk', 'parent_support_signal']
2026-06-13 01:27:41,905 - preprocessing - INFO - Applying SMOTE on train set with ratio 0.6164972183048726...
2026-06-13 01:27:42,029 - preprocessing - INFO - Feature selection complete. Selected 16 / 19 features.
2026-06-13 01:27:47,349 - train_pipeline - INFO - Early stopping triggered at epoch 31
2026-06-13 01:27:47,367 - preprocessing - INFO - xAPI engineered features created: ['engagement_score', 'absence_risk', 'parent_support_signal']
2026-06-13 01:27:47,370 - preprocessing - INFO - xAPI engineered features created: ['engagement_score', 'absence_risk', 'parent_support_signal']
2026-06-13 01:27:47,387 - preprocessing - INFO - Applying SMOTE on train set with ratio 0.6164972183048726...
2026-06-13 01:27:47,507 - preprocessing - INFO - Feature selection complete. Selected 18 / 19 features.
2026-06-13 01:27:58,472 - train_pipeline - INFO - Early stopping triggered at epoch 63
2026-06-13 01:27:58,491 - preprocessing - INFO - xAPI engineered features created: ['engagement_score', 'absence_risk', 'parent_support_signal']
2026-06-13 01:27:58,493 - preprocessing - INFO - xAPI engineered features created: ['engagement_score', 'absence_risk', 'parent_support_signal']
2026-06-13 01:27:58,511 - preprocessing - INFO - Applying SMOTE on train set with ratio 0.6164972183048726...
2026-06-13 01:27:58,639 - preprocessing - INFO - Feature selection complete. Selected 16 / 19 features.
2026-06-13 01:28:08,037 - train_pipeline - INFO - Early stopping triggered at epoch 54
2026-06-13 01:28:08,055 - preprocessing - INFO - xAPI engineered features created: ['engagement_score', 'absence_risk', 'parent_support_signal']
2026-06-13 01:28:08,057 - preprocessing - INFO - xAPI engineered features created: ['engagement_score', 'absence_risk', 'parent_support_signal']
2026-06-13 01:28:08,074 - preprocessing - INFO - Applying SMOTE on train set with ratio 0.6164972183048726...
2026-06-13 01:28:08,199 - preprocessing - INFO - Feature selection complete. Selected 18 / 19 features.
2026-06-13 01:28:20,035 - train_pipeline - INFO - Early stopping triggered at epoch 69
[I 2026-06-13 01:28:20,062] Trial 140 finished with value: 0.805752165434743 and parameters: {'learning_rate': 0.02014674001806314, 'weight_decay': 3.949121978494433e-05, 'batch_size': 16, 'oversample_method': 'smote', 'smote_ratio': 0.6164972183048726, 'resampling_k_neighbors': 3, 'cnn_channels': 16, 'cnn_kernel_size': 4, 'lstm_hidden_dim': 128, 'context_hidden_dim': 64, 'fusion_hidden_dim': 64, 'sequence_dropout': 0.26012989137584064, 'context_dropout': 0.2815332949314752, 'fusion_dropout': 0.20257014753885702}. Best is trial 55 with value: 0.8121442327638384.
2026-06-13 01:28:20,177 - preprocessing - INFO - xAPI engineered features created: ['engagement_score', 'absence_risk', 'parent_support_signal']
2026-06-13 01:28:20,179 - preprocessing - INFO - xAPI engineered features created: ['engagement_score', 'absence_risk', 'parent_support_signal']
2026-06-13 01:28:20,196 - preprocessing - INFO - Applying SMOTE on train set with ratio 0.8916386499922767...
2026-06-13 01:28:20,325 - preprocessing - INFO - Feature selection complete. Selected 18 / 19 features.
2026-06-13 01:28:33,085 - train_pipeline - INFO - Early stopping triggered at epoch 60
2026-06-13 01:28:33,103 - preprocessing - INFO - xAPI engineered features created: ['engagement_score', 'absence_risk', 'parent_support_signal']
2026-06-13 01:28:33,105 - preprocessing - INFO - xAPI engineered features created: ['engagement_score', 'absence_risk', 'parent_support_signal']
2026-06-13 01:28:33,123 - preprocessing - INFO - Applying SMOTE on train set with ratio 0.8916386499922767...
2026-06-13 01:28:33,251 - preprocessing - INFO - Feature selection complete. Selected 17 / 19 features.
2026-06-13 01:28:41,516 - train_pipeline - INFO - Early stopping triggered at epoch 38
2026-06-13 01:28:41,533 - preprocessing - INFO - xAPI engineered features created: ['engagement_score', 'absence_risk', 'parent_support_signal']
2026-06-13 01:28:41,536 - preprocessing - INFO - xAPI engineered features created: ['engagement_score', 'absence_risk', 'parent_support_signal']
2026-06-13 01:28:41,553 - preprocessing - INFO - Applying SMOTE on train set with ratio 0.8916386499922767...
2026-06-13 01:28:41,685 - preprocessing - INFO - Feature selection complete. Selected 18 / 19 features.
2026-06-13 01:28:47,638 - train_pipeline - INFO - Early stopping triggered at epoch 28
[I 2026-06-13 01:28:47,662] Trial 141 pruned. 
2026-06-13 01:28:47,775 - preprocessing - INFO - xAPI engineered features created: ['engagement_score', 'absence_risk', 'parent_support_signal']
2026-06-13 01:28:47,778 - preprocessing - INFO - xAPI engineered features created: ['engagement_score', 'absence_risk', 'parent_support_signal']
2026-06-13 01:28:47,795 - preprocessing - INFO - Applying SMOTE on train set with ratio 0.6899933050553537...
2026-06-13 01:28:47,921 - preprocessing - INFO - Feature selection complete. Selected 16 / 19 features.
2026-06-13 01:29:06,021 - train_pipeline - INFO - Early stopping triggered at epoch 57
2026-06-13 01:29:06,039 - preprocessing - INFO - xAPI engineered features created: ['engagement_score', 'absence_risk', 'parent_support_signal']
2026-06-13 01:29:06,041 - preprocessing - INFO - xAPI engineered features created: ['engagement_score', 'absence_risk', 'parent_support_signal']
2026-06-13 01:29:06,058 - preprocessing - INFO - Applying SMOTE on train set with ratio 0.6899933050553537...
2026-06-13 01:29:06,183 - preprocessing - INFO - Feature selection complete. Selected 16 / 19 features.
2026-06-13 01:29:19,069 - train_pipeline - INFO - Early stopping triggered at epoch 40
2026-06-13 01:29:19,088 - preprocessing - INFO - xAPI engineered features created: ['engagement_score', 'absence_risk', 'parent_support_signal']
2026-06-13 01:29:19,090 - preprocessing - INFO - xAPI engineered features created: ['engagement_score', 'absence_risk', 'parent_support_signal']
2026-06-13 01:29:19,107 - preprocessing - INFO - Applying SMOTE on train set with ratio 0.6899933050553537...
2026-06-13 01:29:19,234 - preprocessing - INFO - Feature selection complete. Selected 18 / 19 features.
2026-06-13 01:29:43,766 - train_pipeline - INFO - Early stopping triggered at epoch 78
[I 2026-06-13 01:29:43,792] Trial 142 pruned. 
2026-06-13 01:29:43,909 - preprocessing - INFO - xAPI engineered features created: ['engagement_score', 'absence_risk', 'parent_support_signal']
2026-06-13 01:29:43,911 - preprocessing - INFO - xAPI engineered features created: ['engagement_score', 'absence_risk', 'parent_support_signal']
2026-06-13 01:29:43,928 - preprocessing - INFO - Applying SMOTE on train set with ratio 0.6867119113460499...
2026-06-13 01:29:44,056 - preprocessing - INFO - Feature selection complete. Selected 17 / 19 features.
2026-06-13 01:29:50,187 - train_pipeline - INFO - Early stopping triggered at epoch 36
2026-06-13 01:29:50,205 - preprocessing - INFO - xAPI engineered features created: ['engagement_score', 'absence_risk', 'parent_support_signal']
2026-06-13 01:29:50,208 - preprocessing - INFO - xAPI engineered features created: ['engagement_score', 'absence_risk', 'parent_support_signal']
2026-06-13 01:29:50,224 - preprocessing - INFO - Applying SMOTE on train set with ratio 0.6867119113460499...
2026-06-13 01:29:50,348 - preprocessing - INFO - Feature selection complete. Selected 15 / 19 features.
2026-06-13 01:29:56,160 - train_pipeline - INFO - Early stopping triggered at epoch 34
2026-06-13 01:29:56,177 - preprocessing - INFO - xAPI engineered features created: ['engagement_score', 'absence_risk', 'parent_support_signal']
2026-06-13 01:29:56,179 - preprocessing - INFO - xAPI engineered features created: ['engagement_score', 'absence_risk', 'parent_support_signal']
2026-06-13 01:29:56,198 - preprocessing - INFO - Applying SMOTE on train set with ratio 0.6867119113460499...
2026-06-13 01:29:56,326 - preprocessing - INFO - Feature selection complete. Selected 18 / 19 features.
2026-06-13 01:30:05,606 - train_pipeline - INFO - Early stopping triggered at epoch 53
2026-06-13 01:30:05,624 - preprocessing - INFO - xAPI engineered features created: ['engagement_score', 'absence_risk', 'parent_support_signal']
2026-06-13 01:30:05,627 - preprocessing - INFO - xAPI engineered features created: ['engagement_score', 'absence_risk', 'parent_support_signal']
2026-06-13 01:30:05,644 - preprocessing - INFO - Applying SMOTE on train set with ratio 0.6867119113460499...
2026-06-13 01:30:05,764 - preprocessing - INFO - Feature selection complete. Selected 16 / 19 features.
2026-06-13 01:30:13,434 - train_pipeline - INFO - Early stopping triggered at epoch 44
2026-06-13 01:30:13,459 - preprocessing - INFO - xAPI engineered features created: ['engagement_score', 'absence_risk', 'parent_support_signal']
2026-06-13 01:30:13,463 - preprocessing - INFO - xAPI engineered features created: ['engagement_score', 'absence_risk', 'parent_support_signal']
2026-06-13 01:30:13,492 - preprocessing - INFO - Applying SMOTE on train set with ratio 0.6867119113460499...
2026-06-13 01:30:13,657 - preprocessing - INFO - Feature selection complete. Selected 17 / 19 features.
2026-06-13 01:30:22,470 - train_pipeline - INFO - Early stopping triggered at epoch 50
[I 2026-06-13 01:30:22,500] Trial 143 finished with value: 0.8002552983975354 and parameters: {'learning_rate': 0.013720949284830105, 'weight_decay': 4.57810857036422e-05, 'batch_size': 16, 'oversample_method': 'smote', 'smote_ratio': 0.6867119113460499, 'resampling_k_neighbors': 2, 'cnn_channels': 16, 'cnn_kernel_size': 4, 'lstm_hidden_dim': 128, 'context_hidden_dim': 64, 'fusion_hidden_dim': 64, 'sequence_dropout': 0.3488630082031583, 'context_dropout': 0.26337518431309853, 'fusion_dropout': 0.15453961199281668}. Best is trial 55 with value: 0.8121442327638384.
2026-06-13 01:30:22,616 - preprocessing - INFO - xAPI engineered features created: ['engagement_score', 'absence_risk', 'parent_support_signal']
2026-06-13 01:30:22,619 - preprocessing - INFO - xAPI engineered features created: ['engagement_score', 'absence_risk', 'parent_support_signal']
2026-06-13 01:30:22,637 - preprocessing - INFO - Applying SMOTE on train set with ratio 0.498101251490294...
2026-06-13 01:30:22,758 - preprocessing - INFO - Feature selection complete. Selected 15 / 19 features.
2026-06-13 01:30:50,708 - preprocessing - INFO - xAPI engineered features created: ['engagement_score', 'absence_risk', 'parent_support_signal']
2026-06-13 01:30:50,710 - preprocessing - INFO - xAPI engineered features created: ['engagement_score', 'absence_risk', 'parent_support_signal']
2026-06-13 01:30:50,727 - preprocessing - INFO - Applying SMOTE on train set with ratio 0.498101251490294...
2026-06-13 01:30:50,843 - preprocessing - INFO - Feature selection complete. Selected 16 / 19 features.
2026-06-13 01:31:10,698 - train_pipeline - INFO - Early stopping triggered at epoch 56
2026-06-13 01:31:10,715 - preprocessing - INFO - xAPI engineered features created: ['engagement_score', 'absence_risk', 'parent_support_signal']
2026-06-13 01:31:10,717 - preprocessing - INFO - xAPI engineered features created: ['engagement_score', 'absence_risk', 'parent_support_signal']
2026-06-13 01:31:10,734 - preprocessing - INFO - Applying SMOTE on train set with ratio 0.498101251490294...
2026-06-13 01:31:10,853 - preprocessing - INFO - Feature selection complete. Selected 18 / 19 features.
2026-06-13 01:31:26,771 - train_pipeline - INFO - Early stopping triggered at epoch 44
2026-06-13 01:31:26,790 - preprocessing - INFO - xAPI engineered features created: ['engagement_score', 'absence_risk', 'parent_support_signal']
2026-06-13 01:31:26,792 - preprocessing - INFO - xAPI engineered features created: ['engagement_score', 'absence_risk', 'parent_support_signal']
2026-06-13 01:31:26,809 - preprocessing - INFO - Applying SMOTE on train set with ratio 0.498101251490294...
2026-06-13 01:31:26,926 - preprocessing - INFO - Feature selection complete. Selected 16 / 19 features.
2026-06-13 01:31:39,743 - train_pipeline - INFO - Early stopping triggered at epoch 35
2026-06-13 01:31:39,762 - preprocessing - INFO - xAPI engineered features created: ['engagement_score', 'absence_risk', 'parent_support_signal']
2026-06-13 01:31:39,764 - preprocessing - INFO - xAPI engineered features created: ['engagement_score', 'absence_risk', 'parent_support_signal']
2026-06-13 01:31:39,781 - preprocessing - INFO - Applying SMOTE on train set with ratio 0.498101251490294...
2026-06-13 01:31:39,904 - preprocessing - INFO - Feature selection complete. Selected 18 / 19 features.
2026-06-13 01:31:55,927 - train_pipeline - INFO - Early stopping triggered at epoch 44
[I 2026-06-13 01:31:55,957] Trial 144 finished with value: 0.796657500133264 and parameters: {'learning_rate': 0.00944384442421268, 'weight_decay': 0.004919842317129301, 'batch_size': 8, 'oversample_method': 'smote', 'smote_ratio': 0.498101251490294, 'resampling_k_neighbors': 2, 'cnn_channels': 128, 'cnn_kernel_size': 3, 'lstm_hidden_dim': 128, 'context_hidden_dim': 256, 'fusion_hidden_dim': 256, 'sequence_dropout': 0.10608958429573151, 'context_dropout': 0.1355095894723297, 'fusion_dropout': 0.20450407373780438}. Best is trial 55 with value: 0.8121442327638384.
2026-06-13 01:31:56,081 - preprocessing - INFO - xAPI engineered features created: ['engagement_score', 'absence_risk', 'parent_support_signal']
2026-06-13 01:31:56,083 - preprocessing - INFO - xAPI engineered features created: ['engagement_score', 'absence_risk', 'parent_support_signal']
2026-06-13 01:31:56,100 - preprocessing - INFO - Applying SMOTE on train set with ratio 0.5963494702340426...
2026-06-13 01:31:56,217 - preprocessing - INFO - Feature selection complete. Selected 15 / 19 features.
2026-06-13 01:31:59,186 - train_pipeline - INFO - Early stopping triggered at epoch 47
2026-06-13 01:31:59,212 - preprocessing - INFO - xAPI engineered features created: ['engagement_score', 'absence_risk', 'parent_support_signal']
2026-06-13 01:31:59,216 - preprocessing - INFO - xAPI engineered features created: ['engagement_score', 'absence_risk', 'parent_support_signal']
2026-06-13 01:31:59,246 - preprocessing - INFO - Applying SMOTE on train set with ratio 0.5963494702340426...
2026-06-13 01:31:59,418 - preprocessing - INFO - Feature selection complete. Selected 16 / 19 features.
2026-06-13 01:32:03,119 - train_pipeline - INFO - Early stopping triggered at epoch 57
2026-06-13 01:32:03,143 - preprocessing - INFO - xAPI engineered features created: ['engagement_score', 'absence_risk', 'parent_support_signal']
2026-06-13 01:32:03,146 - preprocessing - INFO - xAPI engineered features created: ['engagement_score', 'absence_risk', 'parent_support_signal']
2026-06-13 01:32:03,182 - preprocessing - INFO - Applying SMOTE on train set with ratio 0.5963494702340426...
2026-06-13 01:32:03,357 - preprocessing - INFO - Feature selection complete. Selected 18 / 19 features.
2026-06-13 01:32:05,296 - train_pipeline - INFO - Early stopping triggered at epoch 29
2026-06-13 01:32:05,318 - preprocessing - INFO - xAPI engineered features created: ['engagement_score', 'absence_risk', 'parent_support_signal']
2026-06-13 01:32:05,320 - preprocessing - INFO - xAPI engineered features created: ['engagement_score', 'absence_risk', 'parent_support_signal']
2026-06-13 01:32:05,337 - preprocessing - INFO - Applying SMOTE on train set with ratio 0.5963494702340426...
2026-06-13 01:32:05,535 - preprocessing - INFO - Feature selection complete. Selected 16 / 19 features.
2026-06-13 01:32:11,140 - train_pipeline - INFO - Early stopping triggered at epoch 74
2026-06-13 01:32:11,160 - preprocessing - INFO - xAPI engineered features created: ['engagement_score', 'absence_risk', 'parent_support_signal']
2026-06-13 01:32:11,162 - preprocessing - INFO - xAPI engineered features created: ['engagement_score', 'absence_risk', 'parent_support_signal']
2026-06-13 01:32:11,179 - preprocessing - INFO - Applying SMOTE on train set with ratio 0.5963494702340426...
2026-06-13 01:32:11,296 - preprocessing - INFO - Feature selection complete. Selected 18 / 19 features.
2026-06-13 01:32:16,225 - train_pipeline - INFO - Early stopping triggered at epoch 76
[I 2026-06-13 01:32:16,253] Trial 145 finished with value: 0.7895798709027047 and parameters: {'learning_rate': 0.002467882424143145, 'weight_decay': 0.007203655699815715, 'batch_size': 64, 'oversample_method': 'smote', 'smote_ratio': 0.5963494702340426, 'resampling_k_neighbors': 3, 'cnn_channels': 16, 'cnn_kernel_size': 2, 'lstm_hidden_dim': 128, 'context_hidden_dim': 256, 'fusion_hidden_dim': 256, 'sequence_dropout': 0.2830513358430739, 'context_dropout': 0.10324469508536754, 'fusion_dropout': 0.15680757986608262}. Best is trial 55 with value: 0.8121442327638384.
2026-06-13 01:32:16,369 - preprocessing - INFO - xAPI engineered features created: ['engagement_score', 'absence_risk', 'parent_support_signal']
2026-06-13 01:32:16,372 - preprocessing - INFO - xAPI engineered features created: ['engagement_score', 'absence_risk', 'parent_support_signal']
2026-06-13 01:32:16,390 - preprocessing - INFO - Applying SMOTE on train set with ratio 0.6322853234774737...
2026-06-13 01:32:16,511 - preprocessing - INFO - Feature selection complete. Selected 15 / 19 features.
2026-06-13 01:32:18,611 - train_pipeline - INFO - Early stopping triggered at epoch 46
2026-06-13 01:32:18,628 - preprocessing - INFO - xAPI engineered features created: ['engagement_score', 'absence_risk', 'parent_support_signal']
2026-06-13 01:32:18,630 - preprocessing - INFO - xAPI engineered features created: ['engagement_score', 'absence_risk', 'parent_support_signal']
2026-06-13 01:32:18,647 - preprocessing - INFO - Applying SMOTE on train set with ratio 0.6322853234774737...
2026-06-13 01:32:18,771 - preprocessing - INFO - Feature selection complete. Selected 16 / 19 features.
2026-06-13 01:32:20,815 - train_pipeline - INFO - Early stopping triggered at epoch 45
2026-06-13 01:32:20,833 - preprocessing - INFO - xAPI engineered features created: ['engagement_score', 'absence_risk', 'parent_support_signal']
2026-06-13 01:32:20,836 - preprocessing - INFO - xAPI engineered features created: ['engagement_score', 'absence_risk', 'parent_support_signal']
2026-06-13 01:32:20,853 - preprocessing - INFO - Applying SMOTE on train set with ratio 0.6322853234774737...
2026-06-13 01:32:20,977 - preprocessing - INFO - Feature selection complete. Selected 18 / 19 features.
2026-06-13 01:32:22,898 - train_pipeline - INFO - Early stopping triggered at epoch 40
2026-06-13 01:32:22,917 - preprocessing - INFO - xAPI engineered features created: ['engagement_score', 'absence_risk', 'parent_support_signal']
2026-06-13 01:32:22,919 - preprocessing - INFO - xAPI engineered features created: ['engagement_score', 'absence_risk', 'parent_support_signal']
2026-06-13 01:32:22,936 - preprocessing - INFO - Applying SMOTE on train set with ratio 0.6322853234774737...
2026-06-13 01:32:23,057 - preprocessing - INFO - Feature selection complete. Selected 16 / 19 features.
2026-06-13 01:32:24,893 - train_pipeline - INFO - Early stopping triggered at epoch 40
2026-06-13 01:32:24,911 - preprocessing - INFO - xAPI engineered features created: ['engagement_score', 'absence_risk', 'parent_support_signal']
2026-06-13 01:32:24,913 - preprocessing - INFO - xAPI engineered features created: ['engagement_score', 'absence_risk', 'parent_support_signal']
2026-06-13 01:32:24,930 - preprocessing - INFO - Applying SMOTE on train set with ratio 0.6322853234774737...
2026-06-13 01:32:25,050 - preprocessing - INFO - Feature selection complete. Selected 17 / 19 features.
2026-06-13 01:32:27,193 - train_pipeline - INFO - Early stopping triggered at epoch 47
