[I 2026-06-13 00:49:08,616] Trial 46 finished with value: 0.802639193735453 and parameters: {'learning_rate': 0.016336220436152456, 'weight_decay': 0.005128667340813434, 'batch_size': 32, 'oversample_method': 'adasyn', 'smote_ratio': 0.6161313870320494, 'resampling_k_neighbors': 3, 'cnn_channels': 16, 'cnn_kernel_size': 3, 'lstm_hidden_dim': 128, 'context_hidden_dim': 256, 'fusion_hidden_dim': 256, 'sequence_dropout': 0.13685157415384824, 'context_dropout': 0.14260160823874715, 'fusion_dropout': 0.19105407434717006}. Best is trial 17 with value: 0.8075693134180814.
2026-06-13 00:49:08,753 - preprocessing - INFO - xAPI engineered features created: ['engagement_score', 'absence_risk', 'parent_support_signal']
2026-06-13 00:49:08,756 - preprocessing - INFO - xAPI engineered features created: ['engagement_score', 'absence_risk', 'parent_support_signal']
2026-06-13 00:49:08,782 - preprocessing - INFO - Applying ADASYN on train set with ratio 0.8586724120068614...
2026-06-13 00:49:08,800 - preprocessing - WARNING - ADASYN failed (likely too few samples). Error: No samples will be generated with the provided ratio settings.. Falling back to no oversampling.
2026-06-13 00:49:08,929 - preprocessing - INFO - Feature selection complete. Selected 15 / 19 features.
2026-06-13 00:49:13,436 - train_pipeline - INFO - Early stopping triggered at epoch 42
2026-06-13 00:49:13,454 - preprocessing - INFO - xAPI engineered features created: ['engagement_score', 'absence_risk', 'parent_support_signal']
2026-06-13 00:49:13,456 - preprocessing - INFO - xAPI engineered features created: ['engagement_score', 'absence_risk', 'parent_support_signal']
2026-06-13 00:49:13,476 - preprocessing - INFO - Applying ADASYN on train set with ratio 0.8586724120068614...
2026-06-13 00:49:13,613 - preprocessing - INFO - Feature selection complete. Selected 16 / 19 features.
2026-06-13 00:49:18,517 - train_pipeline - INFO - Early stopping triggered at epoch 39
2026-06-13 00:49:18,536 - preprocessing - INFO - xAPI engineered features created: ['engagement_score', 'absence_risk', 'parent_support_signal']
2026-06-13 00:49:18,539 - preprocessing - INFO - xAPI engineered features created: ['engagement_score', 'absence_risk', 'parent_support_signal']
2026-06-13 00:49:18,556 - preprocessing - INFO - Applying ADASYN on train set with ratio 0.8586724120068614...
2026-06-13 00:49:18,570 - preprocessing - WARNING - ADASYN failed (likely too few samples). Error: No samples will be generated with the provided ratio settings.. Falling back to no oversampling.
2026-06-13 00:49:18,687 - preprocessing - INFO - Feature selection complete. Selected 18 / 19 features.
2026-06-13 00:49:22,688 - train_pipeline - INFO - Early stopping triggered at epoch 38
2026-06-13 00:49:22,707 - preprocessing - INFO - xAPI engineered features created: ['engagement_score', 'absence_risk', 'parent_support_signal']
2026-06-13 00:49:22,710 - preprocessing - INFO - xAPI engineered features created: ['engagement_score', 'absence_risk', 'parent_support_signal']
2026-06-13 00:49:22,738 - preprocessing - INFO - Applying ADASYN on train set with ratio 0.8586724120068614...
2026-06-13 00:49:22,760 - preprocessing - WARNING - ADASYN failed (likely too few samples). Error: No samples will be generated with the provided ratio settings.. Falling back to no oversampling.
2026-06-13 00:49:22,907 - preprocessing - INFO - Feature selection complete. Selected 16 / 19 features.
2026-06-13 00:49:29,157 - train_pipeline - INFO - Early stopping triggered at epoch 60
2026-06-13 00:49:29,176 - preprocessing - INFO - xAPI engineered features created: ['engagement_score', 'absence_risk', 'parent_support_signal']
2026-06-13 00:49:29,178 - preprocessing - INFO - xAPI engineered features created: ['engagement_score', 'absence_risk', 'parent_support_signal']
2026-06-13 00:49:29,195 - preprocessing - INFO - Applying ADASYN on train set with ratio 0.8586724120068614...
2026-06-13 00:49:29,326 - preprocessing - INFO - Feature selection complete. Selected 18 / 19 features.
2026-06-13 00:49:33,600 - train_pipeline - INFO - Early stopping triggered at epoch 33
[I 2026-06-13 00:49:33,630] Trial 47 finished with value: 0.7922284262920398 and parameters: {'learning_rate': 0.024238883558831945, 'weight_decay': 0.0005604531772300221, 'batch_size': 32, 'oversample_method': 'adasyn', 'smote_ratio': 0.8586724120068614, 'resampling_k_neighbors': 4, 'cnn_channels': 16, 'cnn_kernel_size': 3, 'lstm_hidden_dim': 128, 'context_hidden_dim': 256, 'fusion_hidden_dim': 256, 'sequence_dropout': 0.11897678265051122, 'context_dropout': 0.13551138075556315, 'fusion_dropout': 0.21239321688600948}. Best is trial 17 with value: 0.8075693134180814.
2026-06-13 00:49:33,743 - preprocessing - INFO - xAPI engineered features created: ['engagement_score', 'absence_risk', 'parent_support_signal']
2026-06-13 00:49:33,746 - preprocessing - INFO - xAPI engineered features created: ['engagement_score', 'absence_risk', 'parent_support_signal']
2026-06-13 00:49:33,763 - preprocessing - INFO - Applying ADASYN on train set with ratio 0.44873729213925145...
2026-06-13 00:49:33,882 - preprocessing - INFO - Feature selection complete. Selected 15 / 19 features.
2026-06-13 00:49:45,982 - train_pipeline - INFO - Early stopping triggered at epoch 68
2026-06-13 00:49:46,000 - preprocessing - INFO - xAPI engineered features created: ['engagement_score', 'absence_risk', 'parent_support_signal']
2026-06-13 00:49:46,002 - preprocessing - INFO - xAPI engineered features created: ['engagement_score', 'absence_risk', 'parent_support_signal']
2026-06-13 00:49:46,020 - preprocessing - INFO - Applying ADASYN on train set with ratio 0.44873729213925145...
2026-06-13 00:49:46,137 - preprocessing - INFO - Feature selection complete. Selected 16 / 19 features.
2026-06-13 00:49:54,548 - train_pipeline - INFO - Early stopping triggered at epoch 46
2026-06-13 00:49:54,567 - preprocessing - INFO - xAPI engineered features created: ['engagement_score', 'absence_risk', 'parent_support_signal']
2026-06-13 00:49:54,570 - preprocessing - INFO - xAPI engineered features created: ['engagement_score', 'absence_risk', 'parent_support_signal']
2026-06-13 00:49:54,589 - preprocessing - INFO - Applying ADASYN on train set with ratio 0.44873729213925145...
2026-06-13 00:49:54,706 - preprocessing - INFO - Feature selection complete. Selected 18 / 19 features.
2026-06-13 00:49:59,798 - train_pipeline - INFO - Early stopping triggered at epoch 28
[I 2026-06-13 00:49:59,824] Trial 48 pruned. 
2026-06-13 00:49:59,945 - preprocessing - INFO - xAPI engineered features created: ['engagement_score', 'absence_risk', 'parent_support_signal']
2026-06-13 00:49:59,947 - preprocessing - INFO - xAPI engineered features created: ['engagement_score', 'absence_risk', 'parent_support_signal']
2026-06-13 00:49:59,964 - preprocessing - INFO - Applying ADASYN on train set with ratio 0.4377828001980558...
2026-06-13 00:50:00,084 - preprocessing - INFO - Feature selection complete. Selected 15 / 19 features.
2026-06-13 00:50:04,767 - train_pipeline - INFO - Early stopping triggered at epoch 54
2026-06-13 00:50:04,784 - preprocessing - INFO - xAPI engineered features created: ['engagement_score', 'absence_risk', 'parent_support_signal']
2026-06-13 00:50:04,786 - preprocessing - INFO - xAPI engineered features created: ['engagement_score', 'absence_risk', 'parent_support_signal']
2026-06-13 00:50:04,804 - preprocessing - INFO - Applying ADASYN on train set with ratio 0.4377828001980558...
2026-06-13 00:50:04,923 - preprocessing - INFO - Feature selection complete. Selected 16 / 19 features.
2026-06-13 00:50:10,132 - train_pipeline - INFO - Early stopping triggered at epoch 61
2026-06-13 00:50:10,152 - preprocessing - INFO - xAPI engineered features created: ['engagement_score', 'absence_risk', 'parent_support_signal']
2026-06-13 00:50:10,154 - preprocessing - INFO - xAPI engineered features created: ['engagement_score', 'absence_risk', 'parent_support_signal']
2026-06-13 00:50:10,171 - preprocessing - INFO - Applying ADASYN on train set with ratio 0.4377828001980558...
2026-06-13 00:50:10,287 - preprocessing - INFO - Feature selection complete. Selected 18 / 19 features.
2026-06-13 00:50:13,786 - train_pipeline - INFO - Early stopping triggered at epoch 40
[I 2026-06-13 00:50:13,813] Trial 49 pruned. 
2026-06-13 00:50:13,942 - preprocessing - INFO - xAPI engineered features created: ['engagement_score', 'absence_risk', 'parent_support_signal']
2026-06-13 00:50:13,945 - preprocessing - INFO - xAPI engineered features created: ['engagement_score', 'absence_risk', 'parent_support_signal']
2026-06-13 00:50:13,968 - preprocessing - INFO - Applying ADASYN on train set with ratio 0.4778085000094978...
2026-06-13 00:50:14,096 - preprocessing - INFO - Feature selection complete. Selected 15 / 19 features.
2026-06-13 00:50:25,718 - train_pipeline - INFO - Early stopping triggered at epoch 37
2026-06-13 00:50:25,736 - preprocessing - INFO - xAPI engineered features created: ['engagement_score', 'absence_risk', 'parent_support_signal']
2026-06-13 00:50:25,738 - preprocessing - INFO - xAPI engineered features created: ['engagement_score', 'absence_risk', 'parent_support_signal']
2026-06-13 00:50:25,756 - preprocessing - INFO - Applying ADASYN on train set with ratio 0.4778085000094978...
2026-06-13 00:50:25,872 - preprocessing - INFO - Feature selection complete. Selected 16 / 19 features.
2026-06-13 00:50:39,065 - train_pipeline - INFO - Early stopping triggered at epoch 41
2026-06-13 00:50:39,082 - preprocessing - INFO - xAPI engineered features created: ['engagement_score', 'absence_risk', 'parent_support_signal']
2026-06-13 00:50:39,084 - preprocessing - INFO - xAPI engineered features created: ['engagement_score', 'absence_risk', 'parent_support_signal']
2026-06-13 00:50:39,101 - preprocessing - INFO - Applying ADASYN on train set with ratio 0.4778085000094978...
2026-06-13 00:50:39,217 - preprocessing - INFO - Feature selection complete. Selected 18 / 19 features.
2026-06-13 00:50:52,542 - train_pipeline - INFO - Early stopping triggered at epoch 41
2026-06-13 00:50:52,560 - preprocessing - INFO - xAPI engineered features created: ['engagement_score', 'absence_risk', 'parent_support_signal']
2026-06-13 00:50:52,562 - preprocessing - INFO - xAPI engineered features created: ['engagement_score', 'absence_risk', 'parent_support_signal']
2026-06-13 00:50:52,580 - preprocessing - INFO - Applying ADASYN on train set with ratio 0.4778085000094978...
2026-06-13 00:50:52,696 - preprocessing - INFO - Feature selection complete. Selected 16 / 19 features.
2026-06-13 00:51:07,741 - train_pipeline - INFO - Early stopping triggered at epoch 47
2026-06-13 00:51:07,758 - preprocessing - INFO - xAPI engineered features created: ['engagement_score', 'absence_risk', 'parent_support_signal']
2026-06-13 00:51:07,761 - preprocessing - INFO - xAPI engineered features created: ['engagement_score', 'absence_risk', 'parent_support_signal']
2026-06-13 00:51:07,779 - preprocessing - INFO - Applying ADASYN on train set with ratio 0.4778085000094978...
2026-06-13 00:51:07,893 - preprocessing - INFO - Feature selection complete. Selected 18 / 19 features.
2026-06-13 00:51:27,706 - train_pipeline - INFO - Early stopping triggered at epoch 62
[I 2026-06-13 00:51:27,733] Trial 50 finished with value: 0.7948021213677224 and parameters: {'learning_rate': 0.01642574840430581, 'weight_decay': 0.0007034464957769345, 'batch_size': 8, 'oversample_method': 'adasyn', 'smote_ratio': 0.4778085000094978, 'resampling_k_neighbors': 4, 'cnn_channels': 16, 'cnn_kernel_size': 3, 'lstm_hidden_dim': 128, 'context_hidden_dim': 256, 'fusion_hidden_dim': 128, 'sequence_dropout': 0.12967846588513238, 'context_dropout': 0.22901930451050842, 'fusion_dropout': 0.20805748557951143}. Best is trial 17 with value: 0.8075693134180814.
2026-06-13 00:51:27,849 - preprocessing - INFO - xAPI engineered features created: ['engagement_score', 'absence_risk', 'parent_support_signal']
2026-06-13 00:51:27,852 - preprocessing - INFO - xAPI engineered features created: ['engagement_score', 'absence_risk', 'parent_support_signal']
2026-06-13 00:51:27,870 - preprocessing - INFO - Applying ADASYN on train set with ratio 0.47951759035699015...
2026-06-13 00:51:27,990 - preprocessing - INFO - Feature selection complete. Selected 15 / 19 features.
2026-06-13 00:51:31,592 - train_pipeline - INFO - Early stopping triggered at epoch 35
2026-06-13 00:51:31,615 - preprocessing - INFO - xAPI engineered features created: ['engagement_score', 'absence_risk', 'parent_support_signal']
2026-06-13 00:51:31,618 - preprocessing - INFO - xAPI engineered features created: ['engagement_score', 'absence_risk', 'parent_support_signal']
2026-06-13 00:51:31,643 - preprocessing - INFO - Applying ADASYN on train set with ratio 0.47951759035699015...
2026-06-13 00:51:31,789 - preprocessing - INFO - Feature selection complete. Selected 16 / 19 features.
2026-06-13 00:51:37,047 - train_pipeline - INFO - Early stopping triggered at epoch 51
2026-06-13 00:51:37,066 - preprocessing - INFO - xAPI engineered features created: ['engagement_score', 'absence_risk', 'parent_support_signal']
2026-06-13 00:51:37,068 - preprocessing - INFO - xAPI engineered features created: ['engagement_score', 'absence_risk', 'parent_support_signal']
2026-06-13 00:51:37,085 - preprocessing - INFO - Applying ADASYN on train set with ratio 0.47951759035699015...
2026-06-13 00:51:37,202 - preprocessing - INFO - Feature selection complete. Selected 18 / 19 features.
2026-06-13 00:51:40,010 - train_pipeline - INFO - Early stopping triggered at epoch 28
2026-06-13 00:51:40,050 - preprocessing - INFO - xAPI engineered features created: ['engagement_score', 'absence_risk', 'parent_support_signal']
2026-06-13 00:51:40,055 - preprocessing - INFO - xAPI engineered features created: ['engagement_score', 'absence_risk', 'parent_support_signal']
2026-06-13 00:51:40,090 - preprocessing - INFO - Applying ADASYN on train set with ratio 0.47951759035699015...
2026-06-13 00:51:40,277 - preprocessing - INFO - Feature selection complete. Selected 16 / 19 features.
2026-06-13 00:51:45,616 - train_pipeline - INFO - Early stopping triggered at epoch 50
2026-06-13 00:51:45,634 - preprocessing - INFO - xAPI engineered features created: ['engagement_score', 'absence_risk', 'parent_support_signal']
2026-06-13 00:51:45,637 - preprocessing - INFO - xAPI engineered features created: ['engagement_score', 'absence_risk', 'parent_support_signal']
2026-06-13 00:51:45,654 - preprocessing - INFO - Applying ADASYN on train set with ratio 0.47951759035699015...
2026-06-13 00:51:45,779 - preprocessing - INFO - Feature selection complete. Selected 18 / 19 features.
2026-06-13 00:51:49,286 - train_pipeline - INFO - Early stopping triggered at epoch 35
[I 2026-06-13 00:51:49,327] Trial 51 finished with value: 0.788025897062007 and parameters: {'learning_rate': 0.030509531906089384, 'weight_decay': 0.003756005921304866, 'batch_size': 32, 'oversample_method': 'adasyn', 'smote_ratio': 0.47951759035699015, 'resampling_k_neighbors': 3, 'cnn_channels': 16, 'cnn_kernel_size': 4, 'lstm_hidden_dim': 128, 'context_hidden_dim': 256, 'fusion_hidden_dim': 32, 'sequence_dropout': 0.13679042647893724, 'context_dropout': 0.14586819080340357, 'fusion_dropout': 0.22496633609179537}. Best is trial 17 with value: 0.8075693134180814.
2026-06-13 00:51:49,473 - preprocessing - INFO - xAPI engineered features created: ['engagement_score', 'absence_risk', 'parent_support_signal']
2026-06-13 00:51:49,476 - preprocessing - INFO - xAPI engineered features created: ['engagement_score', 'absence_risk', 'parent_support_signal']
2026-06-13 00:51:49,499 - preprocessing - INFO - Applying SMOTE on train set with ratio 0.7005172816635437...
2026-06-13 00:51:49,653 - preprocessing - INFO - Feature selection complete. Selected 16 / 19 features.
2026-06-13 00:51:52,482 - train_pipeline - INFO - Early stopping triggered at epoch 44
2026-06-13 00:51:52,500 - preprocessing - INFO - xAPI engineered features created: ['engagement_score', 'absence_risk', 'parent_support_signal']
2026-06-13 00:51:52,502 - preprocessing - INFO - xAPI engineered features created: ['engagement_score', 'absence_risk', 'parent_support_signal']
2026-06-13 00:51:52,519 - preprocessing - INFO - Applying SMOTE on train set with ratio 0.7005172816635437...
2026-06-13 00:51:52,646 - preprocessing - INFO - Feature selection complete. Selected 16 / 19 features.
2026-06-13 00:51:55,342 - train_pipeline - INFO - Early stopping triggered at epoch 37
2026-06-13 00:51:55,360 - preprocessing - INFO - xAPI engineered features created: ['engagement_score', 'absence_risk', 'parent_support_signal']
2026-06-13 00:51:55,362 - preprocessing - INFO - xAPI engineered features created: ['engagement_score', 'absence_risk', 'parent_support_signal']
2026-06-13 00:51:55,380 - preprocessing - INFO - Applying SMOTE on train set with ratio 0.7005172816635437...
2026-06-13 00:51:55,507 - preprocessing - INFO - Feature selection complete. Selected 18 / 19 features.
2026-06-13 00:51:57,643 - train_pipeline - INFO - Early stopping triggered at epoch 34
[I 2026-06-13 00:51:57,669] Trial 52 pruned. 
2026-06-13 00:51:57,784 - preprocessing - INFO - xAPI engineered features created: ['engagement_score', 'absence_risk', 'parent_support_signal']
2026-06-13 00:51:57,787 - preprocessing - INFO - xAPI engineered features created: ['engagement_score', 'absence_risk', 'parent_support_signal']
2026-06-13 00:51:57,805 - preprocessing - INFO - Applying ADASYN on train set with ratio 0.7650579380592368...
2026-06-13 00:51:57,819 - preprocessing - WARNING - ADASYN failed (likely too few samples). Error: No samples will be generated with the provided ratio settings.. Falling back to no oversampling.
2026-06-13 00:51:57,932 - preprocessing - INFO - Feature selection complete. Selected 15 / 19 features.
2026-06-13 00:52:02,411 - train_pipeline - INFO - Early stopping triggered at epoch 50
2026-06-13 00:52:02,430 - preprocessing - INFO - xAPI engineered features created: ['engagement_score', 'absence_risk', 'parent_support_signal']
2026-06-13 00:52:02,432 - preprocessing - INFO - xAPI engineered features created: ['engagement_score', 'absence_risk', 'parent_support_signal']
2026-06-13 00:52:02,449 - preprocessing - INFO - Applying ADASYN on train set with ratio 0.7650579380592368...
2026-06-13 00:52:02,464 - preprocessing - WARNING - ADASYN failed (likely too few samples). Error: No samples will be generated with the provided ratio settings.. Falling back to no oversampling.
2026-06-13 00:52:02,584 - preprocessing - INFO - Feature selection complete. Selected 16 / 19 features.
2026-06-13 00:52:07,399 - train_pipeline - INFO - Early stopping triggered at epoch 54
2026-06-13 00:52:07,417 - preprocessing - INFO - xAPI engineered features created: ['engagement_score', 'absence_risk', 'parent_support_signal']
2026-06-13 00:52:07,420 - preprocessing - INFO - xAPI engineered features created: ['engagement_score', 'absence_risk', 'parent_support_signal']
2026-06-13 00:52:07,440 - preprocessing - INFO - Applying ADASYN on train set with ratio 0.7650579380592368...
2026-06-13 00:52:07,454 - preprocessing - WARNING - ADASYN failed (likely too few samples). Error: No samples will be generated with the provided ratio settings.. Falling back to no oversampling.
2026-06-13 00:52:07,568 - preprocessing - INFO - Feature selection complete. Selected 18 / 19 features.
2026-06-13 00:52:13,905 - train_pipeline - INFO - Early stopping triggered at epoch 72
2026-06-13 00:52:13,924 - preprocessing - INFO - xAPI engineered features created: ['engagement_score', 'absence_risk', 'parent_support_signal']
2026-06-13 00:52:13,926 - preprocessing - INFO - xAPI engineered features created: ['engagement_score', 'absence_risk', 'parent_support_signal']
2026-06-13 00:52:13,944 - preprocessing - INFO - Applying ADASYN on train set with ratio 0.7650579380592368...
2026-06-13 00:52:13,957 - preprocessing - WARNING - ADASYN failed (likely too few samples). Error: No samples will be generated with the provided ratio settings.. Falling back to no oversampling.
2026-06-13 00:52:14,071 - preprocessing - INFO - Feature selection complete. Selected 16 / 19 features.
2026-06-13 00:52:18,398 - train_pipeline - INFO - Early stopping triggered at epoch 48
2026-06-13 00:52:18,416 - preprocessing - INFO - xAPI engineered features created: ['engagement_score', 'absence_risk', 'parent_support_signal']
2026-06-13 00:52:18,419 - preprocessing - INFO - xAPI engineered features created: ['engagement_score', 'absence_risk', 'parent_support_signal']
2026-06-13 00:52:18,436 - preprocessing - INFO - Applying ADASYN on train set with ratio 0.7650579380592368...
2026-06-13 00:52:18,451 - preprocessing - WARNING - ADASYN failed (likely too few samples). Error: No samples will be generated with the provided ratio settings.. Falling back to no oversampling.
2026-06-13 00:52:18,569 - preprocessing - INFO - Feature selection complete. Selected 18 / 19 features.
2026-06-13 00:52:23,365 - train_pipeline - INFO - Early stopping triggered at epoch 53
