[I 2026-06-13 00:54:48,260] Trial 59 pruned. 
2026-06-13 00:54:48,376 - preprocessing - INFO - xAPI engineered features created: ['engagement_score', 'absence_risk', 'parent_support_signal']
2026-06-13 00:54:48,378 - preprocessing - INFO - xAPI engineered features created: ['engagement_score', 'absence_risk', 'parent_support_signal']
2026-06-13 00:54:48,395 - preprocessing - INFO - Applying SMOTE on train set with ratio 0.5515597702846344...
2026-06-13 00:54:48,517 - preprocessing - INFO - Feature selection complete. Selected 15 / 19 features.
2026-06-13 00:54:50,060 - train_pipeline - INFO - Early stopping triggered at epoch 34
2026-06-13 00:54:50,078 - preprocessing - INFO - xAPI engineered features created: ['engagement_score', 'absence_risk', 'parent_support_signal']
2026-06-13 00:54:50,080 - preprocessing - INFO - xAPI engineered features created: ['engagement_score', 'absence_risk', 'parent_support_signal']
2026-06-13 00:54:50,096 - preprocessing - INFO - Applying SMOTE on train set with ratio 0.5515597702846344...
2026-06-13 00:54:50,218 - preprocessing - INFO - Feature selection complete. Selected 16 / 19 features.
2026-06-13 00:54:51,490 - train_pipeline - INFO - Early stopping triggered at epoch 28
2026-06-13 00:54:51,508 - preprocessing - INFO - xAPI engineered features created: ['engagement_score', 'absence_risk', 'parent_support_signal']
2026-06-13 00:54:51,510 - preprocessing - INFO - xAPI engineered features created: ['engagement_score', 'absence_risk', 'parent_support_signal']
2026-06-13 00:54:51,527 - preprocessing - INFO - Applying SMOTE on train set with ratio 0.5515597702846344...
2026-06-13 00:54:51,646 - preprocessing - INFO - Feature selection complete. Selected 18 / 19 features.
2026-06-13 00:54:53,386 - train_pipeline - INFO - Early stopping triggered at epoch 38
2026-06-13 00:54:53,406 - preprocessing - INFO - xAPI engineered features created: ['engagement_score', 'absence_risk', 'parent_support_signal']
2026-06-13 00:54:53,409 - preprocessing - INFO - xAPI engineered features created: ['engagement_score', 'absence_risk', 'parent_support_signal']
2026-06-13 00:54:53,426 - preprocessing - INFO - Applying SMOTE on train set with ratio 0.5515597702846344...
2026-06-13 00:54:53,546 - preprocessing - INFO - Feature selection complete. Selected 16 / 19 features.
2026-06-13 00:54:56,181 - train_pipeline - INFO - Early stopping triggered at epoch 58
2026-06-13 00:54:56,198 - preprocessing - INFO - xAPI engineered features created: ['engagement_score', 'absence_risk', 'parent_support_signal']
2026-06-13 00:54:56,200 - preprocessing - INFO - xAPI engineered features created: ['engagement_score', 'absence_risk', 'parent_support_signal']
2026-06-13 00:54:56,218 - preprocessing - INFO - Applying SMOTE on train set with ratio 0.5515597702846344...
2026-06-13 00:54:56,335 - preprocessing - INFO - Feature selection complete. Selected 18 / 19 features.
2026-06-13 00:54:57,852 - train_pipeline - INFO - Early stopping triggered at epoch 33
[I 2026-06-13 00:54:57,881] Trial 60 finished with value: 0.7933987558833658 and parameters: {'learning_rate': 0.004930486754586455, 'weight_decay': 0.0001229359734536362, 'batch_size': 64, 'oversample_method': 'smote', 'smote_ratio': 0.5515597702846344, 'resampling_k_neighbors': 2, 'cnn_channels': 64, 'cnn_kernel_size': 3, 'lstm_hidden_dim': 32, 'context_hidden_dim': 64, 'fusion_hidden_dim': 256, 'sequence_dropout': 0.13142595972374121, 'context_dropout': 0.1374265558997949, 'fusion_dropout': 0.17997149300393223}. Best is trial 55 with value: 0.8121442327638384.
2026-06-13 00:54:57,997 - preprocessing - INFO - xAPI engineered features created: ['engagement_score', 'absence_risk', 'parent_support_signal']
2026-06-13 00:54:57,999 - preprocessing - INFO - xAPI engineered features created: ['engagement_score', 'absence_risk', 'parent_support_signal']
2026-06-13 00:54:58,016 - preprocessing - INFO - Applying SMOTE on train set with ratio 0.4574350823003253...
2026-06-13 00:54:58,133 - preprocessing - INFO - Feature selection complete. Selected 15 / 19 features.
2026-06-13 00:55:04,290 - train_pipeline - INFO - Early stopping triggered at epoch 68
2026-06-13 00:55:04,307 - preprocessing - INFO - xAPI engineered features created: ['engagement_score', 'absence_risk', 'parent_support_signal']
2026-06-13 00:55:04,309 - preprocessing - INFO - xAPI engineered features created: ['engagement_score', 'absence_risk', 'parent_support_signal']
2026-06-13 00:55:04,327 - preprocessing - INFO - Applying SMOTE on train set with ratio 0.4574350823003253...
2026-06-13 00:55:04,448 - preprocessing - INFO - Feature selection complete. Selected 16 / 19 features.
2026-06-13 00:55:10,567 - train_pipeline - INFO - Early stopping triggered at epoch 62
2026-06-13 00:55:10,585 - preprocessing - INFO - xAPI engineered features created: ['engagement_score', 'absence_risk', 'parent_support_signal']
2026-06-13 00:55:10,587 - preprocessing - INFO - xAPI engineered features created: ['engagement_score', 'absence_risk', 'parent_support_signal']
2026-06-13 00:55:10,605 - preprocessing - INFO - Applying SMOTE on train set with ratio 0.4574350823003253...
2026-06-13 00:55:10,727 - preprocessing - INFO - Feature selection complete. Selected 18 / 19 features.
2026-06-13 00:55:16,490 - train_pipeline - INFO - Early stopping triggered at epoch 62
2026-06-13 00:55:16,508 - preprocessing - INFO - xAPI engineered features created: ['engagement_score', 'absence_risk', 'parent_support_signal']
2026-06-13 00:55:16,511 - preprocessing - INFO - xAPI engineered features created: ['engagement_score', 'absence_risk', 'parent_support_signal']
2026-06-13 00:55:16,528 - preprocessing - INFO - Applying SMOTE on train set with ratio 0.4574350823003253...
2026-06-13 00:55:16,646 - preprocessing - INFO - Feature selection complete. Selected 16 / 19 features.
2026-06-13 00:55:21,781 - train_pipeline - INFO - Early stopping triggered at epoch 55
2026-06-13 00:55:21,799 - preprocessing - INFO - xAPI engineered features created: ['engagement_score', 'absence_risk', 'parent_support_signal']
2026-06-13 00:55:21,802 - preprocessing - INFO - xAPI engineered features created: ['engagement_score', 'absence_risk', 'parent_support_signal']
2026-06-13 00:55:21,819 - preprocessing - INFO - Applying SMOTE on train set with ratio 0.4574350823003253...
2026-06-13 00:55:21,941 - preprocessing - INFO - Feature selection complete. Selected 18 / 19 features.
[I 2026-06-13 00:55:29,517] Trial 61 finished with value: 0.8021842479346992 and parameters: {'learning_rate': 0.004959276380856669, 'weight_decay': 0.007281222911572592, 'batch_size': 32, 'oversample_method': 'smote', 'smote_ratio': 0.4574350823003253, 'resampling_k_neighbors': 3, 'cnn_channels': 32, 'cnn_kernel_size': 3, 'lstm_hidden_dim': 96, 'context_hidden_dim': 128, 'fusion_hidden_dim': 128, 'sequence_dropout': 0.3528182918043105, 'context_dropout': 0.2441607884698083, 'fusion_dropout': 0.2164322407557377}. Best is trial 55 with value: 0.8121442327638384.
2026-06-13 00:55:29,669 - preprocessing - INFO - xAPI engineered features created: ['engagement_score', 'absence_risk', 'parent_support_signal']
2026-06-13 00:55:29,672 - preprocessing - INFO - xAPI engineered features created: ['engagement_score', 'absence_risk', 'parent_support_signal']
2026-06-13 00:55:29,695 - preprocessing - INFO - Applying SMOTE on train set with ratio 0.4459711493394785...
2026-06-13 00:55:29,825 - preprocessing - INFO - Feature selection complete. Selected 15 / 19 features.
2026-06-13 00:55:34,414 - train_pipeline - INFO - Early stopping triggered at epoch 49
2026-06-13 00:55:34,433 - preprocessing - INFO - xAPI engineered features created: ['engagement_score', 'absence_risk', 'parent_support_signal']
2026-06-13 00:55:34,436 - preprocessing - INFO - xAPI engineered features created: ['engagement_score', 'absence_risk', 'parent_support_signal']
2026-06-13 00:55:34,453 - preprocessing - INFO - Applying SMOTE on train set with ratio 0.4459711493394785...
2026-06-13 00:55:34,580 - preprocessing - INFO - Feature selection complete. Selected 16 / 19 features.
2026-06-13 00:55:40,883 - train_pipeline - INFO - Early stopping triggered at epoch 70
2026-06-13 00:55:40,900 - preprocessing - INFO - xAPI engineered features created: ['engagement_score', 'absence_risk', 'parent_support_signal']
2026-06-13 00:55:40,903 - preprocessing - INFO - xAPI engineered features created: ['engagement_score', 'absence_risk', 'parent_support_signal']
2026-06-13 00:55:40,920 - preprocessing - INFO - Applying SMOTE on train set with ratio 0.4459711493394785...
2026-06-13 00:55:41,048 - preprocessing - INFO - Feature selection complete. Selected 18 / 19 features.
2026-06-13 00:55:45,548 - train_pipeline - INFO - Early stopping triggered at epoch 48
[I 2026-06-13 00:55:45,573] Trial 62 pruned. 
2026-06-13 00:55:45,688 - preprocessing - INFO - xAPI engineered features created: ['engagement_score', 'absence_risk', 'parent_support_signal']
2026-06-13 00:55:45,690 - preprocessing - INFO - xAPI engineered features created: ['engagement_score', 'absence_risk', 'parent_support_signal']
2026-06-13 00:55:45,707 - preprocessing - INFO - Applying SMOTE on train set with ratio 0.5394706931140857...
2026-06-13 00:55:45,828 - preprocessing - INFO - Feature selection complete. Selected 15 / 19 features.
2026-06-13 00:55:48,582 - train_pipeline - INFO - Early stopping triggered at epoch 31
2026-06-13 00:55:48,599 - preprocessing - INFO - xAPI engineered features created: ['engagement_score', 'absence_risk', 'parent_support_signal']
2026-06-13 00:55:48,601 - preprocessing - INFO - xAPI engineered features created: ['engagement_score', 'absence_risk', 'parent_support_signal']
2026-06-13 00:55:48,619 - preprocessing - INFO - Applying SMOTE on train set with ratio 0.5394706931140857...
2026-06-13 00:55:48,737 - preprocessing - INFO - Feature selection complete. Selected 16 / 19 features.
2026-06-13 00:55:55,193 - train_pipeline - INFO - Early stopping triggered at epoch 64
2026-06-13 00:55:55,213 - preprocessing - INFO - xAPI engineered features created: ['engagement_score', 'absence_risk', 'parent_support_signal']
2026-06-13 00:55:55,216 - preprocessing - INFO - xAPI engineered features created: ['engagement_score', 'absence_risk', 'parent_support_signal']
2026-06-13 00:55:55,232 - preprocessing - INFO - Applying SMOTE on train set with ratio 0.5394706931140857...
2026-06-13 00:55:55,348 - preprocessing - INFO - Feature selection complete. Selected 18 / 19 features.
2026-06-13 00:55:59,587 - train_pipeline - INFO - Early stopping triggered at epoch 43
[I 2026-06-13 00:55:59,613] Trial 63 pruned. 
2026-06-13 00:55:59,727 - preprocessing - INFO - xAPI engineered features created: ['engagement_score', 'absence_risk', 'parent_support_signal']
2026-06-13 00:55:59,730 - preprocessing - INFO - xAPI engineered features created: ['engagement_score', 'absence_risk', 'parent_support_signal']
2026-06-13 00:55:59,748 - preprocessing - INFO - Applying SMOTE on train set with ratio 0.6838465819033884...
2026-06-13 00:55:59,878 - preprocessing - INFO - Feature selection complete. Selected 17 / 19 features.
2026-06-13 00:56:02,706 - train_pipeline - INFO - Early stopping triggered at epoch 47
2026-06-13 00:56:02,723 - preprocessing - INFO - xAPI engineered features created: ['engagement_score', 'absence_risk', 'parent_support_signal']
2026-06-13 00:56:02,726 - preprocessing - INFO - xAPI engineered features created: ['engagement_score', 'absence_risk', 'parent_support_signal']
2026-06-13 00:56:02,757 - preprocessing - INFO - Applying SMOTE on train set with ratio 0.6838465819033884...
2026-06-13 00:56:02,942 - preprocessing - INFO - Feature selection complete. Selected 15 / 19 features.
2026-06-13 00:56:05,817 - train_pipeline - INFO - Early stopping triggered at epoch 43
2026-06-13 00:56:05,836 - preprocessing - INFO - xAPI engineered features created: ['engagement_score', 'absence_risk', 'parent_support_signal']
2026-06-13 00:56:05,838 - preprocessing - INFO - xAPI engineered features created: ['engagement_score', 'absence_risk', 'parent_support_signal']
2026-06-13 00:56:05,856 - preprocessing - INFO - Applying SMOTE on train set with ratio 0.6838465819033884...
2026-06-13 00:56:05,982 - preprocessing - INFO - Feature selection complete. Selected 18 / 19 features.
2026-06-13 00:56:09,202 - train_pipeline - INFO - Early stopping triggered at epoch 51
2026-06-13 00:56:09,230 - preprocessing - INFO - xAPI engineered features created: ['engagement_score', 'absence_risk', 'parent_support_signal']
2026-06-13 00:56:09,232 - preprocessing - INFO - xAPI engineered features created: ['engagement_score', 'absence_risk', 'parent_support_signal']
2026-06-13 00:56:09,258 - preprocessing - INFO - Applying SMOTE on train set with ratio 0.6838465819033884...
2026-06-13 00:56:09,442 - preprocessing - INFO - Feature selection complete. Selected 16 / 19 features.
2026-06-13 00:56:12,568 - train_pipeline - INFO - Early stopping triggered at epoch 50
2026-06-13 00:56:12,587 - preprocessing - INFO - xAPI engineered features created: ['engagement_score', 'absence_risk', 'parent_support_signal']
2026-06-13 00:56:12,590 - preprocessing - INFO - xAPI engineered features created: ['engagement_score', 'absence_risk', 'parent_support_signal']
2026-06-13 00:56:12,608 - preprocessing - INFO - Applying SMOTE on train set with ratio 0.6838465819033884...
2026-06-13 00:56:12,735 - preprocessing - INFO - Feature selection complete. Selected 17 / 19 features.
2026-06-13 00:56:16,074 - train_pipeline - INFO - Early stopping triggered at epoch 41
[I 2026-06-13 00:56:16,105] Trial 64 finished with value: 0.8041576323176715 and parameters: {'learning_rate': 0.0033295260480936313, 'weight_decay': 0.0036696640933380157, 'batch_size': 64, 'oversample_method': 'smote', 'smote_ratio': 0.6838465819033884, 'resampling_k_neighbors': 2, 'cnn_channels': 16, 'cnn_kernel_size': 2, 'lstm_hidden_dim': 128, 'context_hidden_dim': 256, 'fusion_hidden_dim': 256, 'sequence_dropout': 0.32146703376805874, 'context_dropout': 0.16339226578164304, 'fusion_dropout': 0.11043622302985051}. Best is trial 55 with value: 0.8121442327638384.
2026-06-13 00:56:16,220 - preprocessing - INFO - xAPI engineered features created: ['engagement_score', 'absence_risk', 'parent_support_signal']
2026-06-13 00:56:16,222 - preprocessing - INFO - xAPI engineered features created: ['engagement_score', 'absence_risk', 'parent_support_signal']
2026-06-13 00:56:16,238 - preprocessing - INFO - Applying SMOTE on train set with ratio 0.6712103022353693...
2026-06-13 00:56:16,361 - preprocessing - INFO - Feature selection complete. Selected 15 / 19 features.
2026-06-13 00:56:18,722 - train_pipeline - INFO - Early stopping triggered at epoch 35
2026-06-13 00:56:18,740 - preprocessing - INFO - xAPI engineered features created: ['engagement_score', 'absence_risk', 'parent_support_signal']
2026-06-13 00:56:18,742 - preprocessing - INFO - xAPI engineered features created: ['engagement_score', 'absence_risk', 'parent_support_signal']
2026-06-13 00:56:18,760 - preprocessing - INFO - Applying SMOTE on train set with ratio 0.6712103022353693...
2026-06-13 00:56:18,882 - preprocessing - INFO - Feature selection complete. Selected 16 / 19 features.
2026-06-13 00:56:21,905 - train_pipeline - INFO - Early stopping triggered at epoch 52
2026-06-13 00:56:21,933 - preprocessing - INFO - xAPI engineered features created: ['engagement_score', 'absence_risk', 'parent_support_signal']
2026-06-13 00:56:21,935 - preprocessing - INFO - xAPI engineered features created: ['engagement_score', 'absence_risk', 'parent_support_signal']
2026-06-13 00:56:21,962 - preprocessing - INFO - Applying SMOTE on train set with ratio 0.6712103022353693...
2026-06-13 00:56:22,150 - preprocessing - INFO - Feature selection complete. Selected 18 / 19 features.
2026-06-13 00:56:24,917 - train_pipeline - INFO - Early stopping triggered at epoch 44
2026-06-13 00:56:24,935 - preprocessing - INFO - xAPI engineered features created: ['engagement_score', 'absence_risk', 'parent_support_signal']
2026-06-13 00:56:24,937 - preprocessing - INFO - xAPI engineered features created: ['engagement_score', 'absence_risk', 'parent_support_signal']
2026-06-13 00:56:24,954 - preprocessing - INFO - Applying SMOTE on train set with ratio 0.6712103022353693...
2026-06-13 00:56:25,079 - preprocessing - INFO - Feature selection complete. Selected 16 / 19 features.
2026-06-13 00:56:27,744 - train_pipeline - INFO - Early stopping triggered at epoch 47
2026-06-13 00:56:27,774 - preprocessing - INFO - xAPI engineered features created: ['engagement_score', 'absence_risk', 'parent_support_signal']
2026-06-13 00:56:27,777 - preprocessing - INFO - xAPI engineered features created: ['engagement_score', 'absence_risk', 'parent_support_signal']
2026-06-13 00:56:27,808 - preprocessing - INFO - Applying SMOTE on train set with ratio 0.6712103022353693...
2026-06-13 00:56:27,995 - preprocessing - INFO - Feature selection complete. Selected 18 / 19 features.
2026-06-13 00:56:31,488 - train_pipeline - INFO - Early stopping triggered at epoch 56
[I 2026-06-13 00:56:31,517] Trial 65 finished with value: 0.8048327086777378 and parameters: {'learning_rate': 0.011769289886185835, 'weight_decay': 0.00018510456026330223, 'batch_size': 64, 'oversample_method': 'smote', 'smote_ratio': 0.6712103022353693, 'resampling_k_neighbors': 3, 'cnn_channels': 16, 'cnn_kernel_size': 2, 'lstm_hidden_dim': 128, 'context_hidden_dim': 64, 'fusion_hidden_dim': 256, 'sequence_dropout': 0.30177846704146244, 'context_dropout': 0.1516517104618116, 'fusion_dropout': 0.1398499906400135}. Best is trial 55 with value: 0.8121442327638384.
2026-06-13 00:56:31,631 - preprocessing - INFO - xAPI engineered features created: ['engagement_score', 'absence_risk', 'parent_support_signal']
2026-06-13 00:56:31,634 - preprocessing - INFO - xAPI engineered features created: ['engagement_score', 'absence_risk', 'parent_support_signal']
2026-06-13 00:56:31,652 - preprocessing - INFO - Applying SMOTE on train set with ratio 0.7132233848464314...
2026-06-13 00:56:31,802 - preprocessing - INFO - Feature selection complete. Selected 16 / 19 features.
2026-06-13 00:56:37,870 - train_pipeline - INFO - Early stopping triggered at epoch 65
2026-06-13 00:56:37,887 - preprocessing - INFO - xAPI engineered features created: ['engagement_score', 'absence_risk', 'parent_support_signal']
2026-06-13 00:56:37,889 - preprocessing - INFO - xAPI engineered features created: ['engagement_score', 'absence_risk', 'parent_support_signal']
2026-06-13 00:56:37,908 - preprocessing - INFO - Applying SMOTE on train set with ratio 0.7132233848464314...
2026-06-13 00:56:38,037 - preprocessing - INFO - Feature selection complete. Selected 16 / 19 features.
2026-06-13 00:56:43,754 - train_pipeline - INFO - Early stopping triggered at epoch 63
2026-06-13 00:56:43,772 - preprocessing - INFO - xAPI engineered features created: ['engagement_score', 'absence_risk', 'parent_support_signal']
2026-06-13 00:56:43,774 - preprocessing - INFO - xAPI engineered features created: ['engagement_score', 'absence_risk', 'parent_support_signal']
2026-06-13 00:56:43,794 - preprocessing - INFO - Applying SMOTE on train set with ratio 0.7132233848464314...
2026-06-13 00:56:43,918 - preprocessing - INFO - Feature selection complete. Selected 18 / 19 features.
2026-06-13 00:56:46,977 - train_pipeline - INFO - Early stopping triggered at epoch 36
2026-06-13 00:56:47,004 - preprocessing - INFO - xAPI engineered features created: ['engagement_score', 'absence_risk', 'parent_support_signal']
2026-06-13 00:56:47,007 - preprocessing - INFO - xAPI engineered features created: ['engagement_score', 'absence_risk', 'parent_support_signal']
2026-06-13 00:56:47,038 - preprocessing - INFO - Applying SMOTE on train set with ratio 0.7132233848464314...
2026-06-13 00:56:47,234 - preprocessing - INFO - Feature selection complete. Selected 16 / 19 features.
2026-06-13 00:56:54,388 - preprocessing - INFO - xAPI engineered features created: ['engagement_score', 'absence_risk', 'parent_support_signal']
2026-06-13 00:56:54,391 - preprocessing - INFO - xAPI engineered features created: ['engagement_score', 'absence_risk', 'parent_support_signal']
2026-06-13 00:56:54,409 - preprocessing - INFO - Applying SMOTE on train set with ratio 0.7132233848464314...
2026-06-13 00:56:54,535 - preprocessing - INFO - Feature selection complete. Selected 18 / 19 features.
2026-06-13 00:56:58,798 - train_pipeline - INFO - Early stopping triggered at epoch 48
