[I 2026-06-13 01:25:00,374] Trial 131 pruned. 
2026-06-13 01:25:00,488 - preprocessing - INFO - xAPI engineered features created: ['engagement_score', 'absence_risk', 'parent_support_signal']
2026-06-13 01:25:00,491 - preprocessing - INFO - xAPI engineered features created: ['engagement_score', 'absence_risk', 'parent_support_signal']
2026-06-13 01:25:00,509 - preprocessing - INFO - Applying ADASYN on train set with ratio 0.704646731894272...
2026-06-13 01:25:00,525 - preprocessing - WARNING - ADASYN failed (likely too few samples). Error: No samples will be generated with the provided ratio settings.. Falling back to no oversampling.
2026-06-13 01:25:00,637 - preprocessing - INFO - Feature selection complete. Selected 15 / 19 features.
2026-06-13 01:25:03,214 - train_pipeline - INFO - Early stopping triggered at epoch 42
2026-06-13 01:25:03,231 - preprocessing - INFO - xAPI engineered features created: ['engagement_score', 'absence_risk', 'parent_support_signal']
2026-06-13 01:25:03,234 - preprocessing - INFO - xAPI engineered features created: ['engagement_score', 'absence_risk', 'parent_support_signal']
2026-06-13 01:25:03,251 - preprocessing - INFO - Applying ADASYN on train set with ratio 0.704646731894272...
2026-06-13 01:25:03,266 - preprocessing - WARNING - ADASYN failed (likely too few samples). Error: No samples will be generated with the provided ratio settings.. Falling back to no oversampling.
2026-06-13 01:25:03,387 - preprocessing - INFO - Feature selection complete. Selected 16 / 19 features.
2026-06-13 01:25:05,426 - train_pipeline - INFO - Early stopping triggered at epoch 27
2026-06-13 01:25:05,445 - preprocessing - INFO - xAPI engineered features created: ['engagement_score', 'absence_risk', 'parent_support_signal']
2026-06-13 01:25:05,447 - preprocessing - INFO - xAPI engineered features created: ['engagement_score', 'absence_risk', 'parent_support_signal']
2026-06-13 01:25:05,464 - preprocessing - INFO - Applying ADASYN on train set with ratio 0.704646731894272...
2026-06-13 01:25:05,478 - preprocessing - WARNING - ADASYN failed (likely too few samples). Error: No samples will be generated with the provided ratio settings.. Falling back to no oversampling.
2026-06-13 01:25:05,595 - preprocessing - INFO - Feature selection complete. Selected 18 / 19 features.
2026-06-13 01:25:07,789 - train_pipeline - INFO - Early stopping triggered at epoch 36
[I 2026-06-13 01:25:07,813] Trial 132 pruned. 
2026-06-13 01:25:07,928 - preprocessing - INFO - xAPI engineered features created: ['engagement_score', 'absence_risk', 'parent_support_signal']
2026-06-13 01:25:07,931 - preprocessing - INFO - xAPI engineered features created: ['engagement_score', 'absence_risk', 'parent_support_signal']
2026-06-13 01:25:07,949 - preprocessing - INFO - Applying SMOTE on train set with ratio 0.6715807446408482...
2026-06-13 01:25:08,075 - preprocessing - INFO - Feature selection complete. Selected 16 / 19 features.
2026-06-13 01:25:09,841 - train_pipeline - INFO - Early stopping triggered at epoch 31
2026-06-13 01:25:09,858 - preprocessing - INFO - xAPI engineered features created: ['engagement_score', 'absence_risk', 'parent_support_signal']
2026-06-13 01:25:09,860 - preprocessing - INFO - xAPI engineered features created: ['engagement_score', 'absence_risk', 'parent_support_signal']
2026-06-13 01:25:09,878 - preprocessing - INFO - Applying SMOTE on train set with ratio 0.6715807446408482...
2026-06-13 01:25:10,002 - preprocessing - INFO - Feature selection complete. Selected 15 / 19 features.
2026-06-13 01:25:11,825 - train_pipeline - INFO - Early stopping triggered at epoch 32
2026-06-13 01:25:11,844 - preprocessing - INFO - xAPI engineered features created: ['engagement_score', 'absence_risk', 'parent_support_signal']
2026-06-13 01:25:11,846 - preprocessing - INFO - xAPI engineered features created: ['engagement_score', 'absence_risk', 'parent_support_signal']
2026-06-13 01:25:11,863 - preprocessing - INFO - Applying SMOTE on train set with ratio 0.6715807446408482...
2026-06-13 01:25:11,987 - preprocessing - INFO - Feature selection complete. Selected 18 / 19 features.
2026-06-13 01:25:13,710 - train_pipeline - INFO - Early stopping triggered at epoch 30
[I 2026-06-13 01:25:13,735] Trial 133 pruned. 
2026-06-13 01:25:13,850 - preprocessing - INFO - xAPI engineered features created: ['engagement_score', 'absence_risk', 'parent_support_signal']
2026-06-13 01:25:13,852 - preprocessing - INFO - xAPI engineered features created: ['engagement_score', 'absence_risk', 'parent_support_signal']
2026-06-13 01:25:13,869 - preprocessing - INFO - Applying ADASYN on train set with ratio 0.33962247867175727...
2026-06-13 01:25:13,988 - preprocessing - INFO - Feature selection complete. Selected 15 / 19 features.
2026-06-13 01:25:18,285 - train_pipeline - INFO - Early stopping triggered at epoch 46
2026-06-13 01:25:18,302 - preprocessing - INFO - xAPI engineered features created: ['engagement_score', 'absence_risk', 'parent_support_signal']
2026-06-13 01:25:18,305 - preprocessing - INFO - xAPI engineered features created: ['engagement_score', 'absence_risk', 'parent_support_signal']
2026-06-13 01:25:18,322 - preprocessing - INFO - Applying ADASYN on train set with ratio 0.33962247867175727...
2026-06-13 01:25:18,445 - preprocessing - INFO - Feature selection complete. Selected 16 / 19 features.
2026-06-13 01:25:22,512 - train_pipeline - INFO - Early stopping triggered at epoch 45
2026-06-13 01:25:22,538 - preprocessing - INFO - xAPI engineered features created: ['engagement_score', 'absence_risk', 'parent_support_signal']
2026-06-13 01:25:22,542 - preprocessing - INFO - xAPI engineered features created: ['engagement_score', 'absence_risk', 'parent_support_signal']
2026-06-13 01:25:22,568 - preprocessing - INFO - Applying ADASYN on train set with ratio 0.33962247867175727...
2026-06-13 01:25:22,726 - preprocessing - INFO - Feature selection complete. Selected 18 / 19 features.
2026-06-13 01:25:27,254 - train_pipeline - INFO - Early stopping triggered at epoch 47
[I 2026-06-13 01:25:27,277] Trial 134 pruned. 
2026-06-13 01:25:27,394 - preprocessing - INFO - xAPI engineered features created: ['engagement_score', 'absence_risk', 'parent_support_signal']
2026-06-13 01:25:27,396 - preprocessing - INFO - xAPI engineered features created: ['engagement_score', 'absence_risk', 'parent_support_signal']
2026-06-13 01:25:27,414 - preprocessing - INFO - Applying ADASYN on train set with ratio 0.620524425553933...
2026-06-13 01:25:27,422 - preprocessing - WARNING - ADASYN failed (likely too few samples). Error: No samples will be generated with the provided ratio settings.. Falling back to no oversampling.
2026-06-13 01:25:27,538 - preprocessing - INFO - Feature selection complete. Selected 15 / 19 features.
2026-06-13 01:25:29,205 - train_pipeline - INFO - Early stopping triggered at epoch 31
2026-06-13 01:25:29,222 - preprocessing - INFO - xAPI engineered features created: ['engagement_score', 'absence_risk', 'parent_support_signal']
2026-06-13 01:25:29,224 - preprocessing - INFO - xAPI engineered features created: ['engagement_score', 'absence_risk', 'parent_support_signal']
2026-06-13 01:25:29,242 - preprocessing - INFO - Applying ADASYN on train set with ratio 0.620524425553933...
2026-06-13 01:25:29,249 - preprocessing - WARNING - ADASYN failed (likely too few samples). Error: No samples will be generated with the provided ratio settings.. Falling back to no oversampling.
2026-06-13 01:25:29,377 - preprocessing - INFO - Feature selection complete. Selected 16 / 19 features.
2026-06-13 01:25:31,042 - train_pipeline - INFO - Early stopping triggered at epoch 31
2026-06-13 01:25:31,060 - preprocessing - INFO - xAPI engineered features created: ['engagement_score', 'absence_risk', 'parent_support_signal']
2026-06-13 01:25:31,063 - preprocessing - INFO - xAPI engineered features created: ['engagement_score', 'absence_risk', 'parent_support_signal']
2026-06-13 01:25:31,080 - preprocessing - INFO - Applying ADASYN on train set with ratio 0.620524425553933...
2026-06-13 01:25:31,088 - preprocessing - WARNING - ADASYN failed (likely too few samples). Error: No samples will be generated with the provided ratio settings.. Falling back to no oversampling.
2026-06-13 01:25:31,202 - preprocessing - INFO - Feature selection complete. Selected 18 / 19 features.
2026-06-13 01:25:33,264 - train_pipeline - INFO - Early stopping triggered at epoch 38
[I 2026-06-13 01:25:33,286] Trial 135 pruned. 
2026-06-13 01:25:33,411 - preprocessing - INFO - xAPI engineered features created: ['engagement_score', 'absence_risk', 'parent_support_signal']
2026-06-13 01:25:33,413 - preprocessing - INFO - xAPI engineered features created: ['engagement_score', 'absence_risk', 'parent_support_signal']
2026-06-13 01:25:33,429 - preprocessing - INFO - Applying SMOTE on train set with ratio 0.6551451244465347...
2026-06-13 01:25:33,555 - preprocessing - INFO - Feature selection complete. Selected 16 / 19 features.
2026-06-13 01:25:53,656 - train_pipeline - INFO - Early stopping triggered at epoch 64
2026-06-13 01:25:53,674 - preprocessing - INFO - xAPI engineered features created: ['engagement_score', 'absence_risk', 'parent_support_signal']
2026-06-13 01:25:53,676 - preprocessing - INFO - xAPI engineered features created: ['engagement_score', 'absence_risk', 'parent_support_signal']
2026-06-13 01:25:53,693 - preprocessing - INFO - Applying SMOTE on train set with ratio 0.6551451244465347...
2026-06-13 01:25:53,817 - preprocessing - INFO - Feature selection complete. Selected 15 / 19 features.
2026-06-13 01:26:04,329 - train_pipeline - INFO - Early stopping triggered at epoch 32
2026-06-13 01:26:04,346 - preprocessing - INFO - xAPI engineered features created: ['engagement_score', 'absence_risk', 'parent_support_signal']
2026-06-13 01:26:04,348 - preprocessing - INFO - xAPI engineered features created: ['engagement_score', 'absence_risk', 'parent_support_signal']
2026-06-13 01:26:04,365 - preprocessing - INFO - Applying SMOTE on train set with ratio 0.6551451244465347...
2026-06-13 01:26:04,489 - preprocessing - INFO - Feature selection complete. Selected 18 / 19 features.
2026-06-13 01:26:15,915 - train_pipeline - INFO - Early stopping triggered at epoch 35
2026-06-13 01:26:15,934 - preprocessing - INFO - xAPI engineered features created: ['engagement_score', 'absence_risk', 'parent_support_signal']
2026-06-13 01:26:15,937 - preprocessing - INFO - xAPI engineered features created: ['engagement_score', 'absence_risk', 'parent_support_signal']
2026-06-13 01:26:15,954 - preprocessing - INFO - Applying SMOTE on train set with ratio 0.6551451244465347...
2026-06-13 01:26:16,079 - preprocessing - INFO - Feature selection complete. Selected 16 / 19 features.
2026-06-13 01:26:29,671 - train_pipeline - INFO - Early stopping triggered at epoch 34
2026-06-13 01:26:29,689 - preprocessing - INFO - xAPI engineered features created: ['engagement_score', 'absence_risk', 'parent_support_signal']
2026-06-13 01:26:29,691 - preprocessing - INFO - xAPI engineered features created: ['engagement_score', 'absence_risk', 'parent_support_signal']
2026-06-13 01:26:29,708 - preprocessing - INFO - Applying SMOTE on train set with ratio 0.6551451244465347...
2026-06-13 01:26:29,882 - preprocessing - INFO - Feature selection complete. Selected 17 / 19 features.
2026-06-13 01:26:45,182 - train_pipeline - INFO - Early stopping triggered at epoch 47
[I 2026-06-13 01:26:45,210] Trial 136 finished with value: 0.7876416026567232 and parameters: {'learning_rate': 0.0027908950310245153, 'weight_decay': 3.4804759866555787e-05, 'batch_size': 8, 'oversample_method': 'smote', 'smote_ratio': 0.6551451244465347, 'resampling_k_neighbors': 2, 'cnn_channels': 16, 'cnn_kernel_size': 3, 'lstm_hidden_dim': 96, 'context_hidden_dim': 256, 'fusion_hidden_dim': 256, 'sequence_dropout': 0.24029325008111505, 'context_dropout': 0.1541200973028974, 'fusion_dropout': 0.13368686971520574}. Best is trial 55 with value: 0.8121442327638384.
2026-06-13 01:26:45,327 - preprocessing - INFO - xAPI engineered features created: ['engagement_score', 'absence_risk', 'parent_support_signal']
2026-06-13 01:26:45,329 - preprocessing - INFO - xAPI engineered features created: ['engagement_score', 'absence_risk', 'parent_support_signal']
2026-06-13 01:26:45,347 - preprocessing - INFO - Applying SMOTE on train set with ratio 0.5451647819126506...
2026-06-13 01:26:45,464 - preprocessing - INFO - Feature selection complete. Selected 15 / 19 features.
2026-06-13 01:26:47,814 - train_pipeline - INFO - Early stopping triggered at epoch 41
2026-06-13 01:26:47,831 - preprocessing - INFO - xAPI engineered features created: ['engagement_score', 'absence_risk', 'parent_support_signal']
2026-06-13 01:26:47,833 - preprocessing - INFO - xAPI engineered features created: ['engagement_score', 'absence_risk', 'parent_support_signal']
2026-06-13 01:26:47,852 - preprocessing - INFO - Applying SMOTE on train set with ratio 0.5451647819126506...
2026-06-13 01:26:47,975 - preprocessing - INFO - Feature selection complete. Selected 16 / 19 features.
2026-06-13 01:26:51,321 - train_pipeline - INFO - Early stopping triggered at epoch 53
2026-06-13 01:26:51,343 - preprocessing - INFO - xAPI engineered features created: ['engagement_score', 'absence_risk', 'parent_support_signal']
2026-06-13 01:26:51,346 - preprocessing - INFO - xAPI engineered features created: ['engagement_score', 'absence_risk', 'parent_support_signal']
2026-06-13 01:26:51,380 - preprocessing - INFO - Applying SMOTE on train set with ratio 0.5451647819126506...
2026-06-13 01:26:51,544 - preprocessing - INFO - Feature selection complete. Selected 18 / 19 features.
2026-06-13 01:26:54,380 - train_pipeline - INFO - Early stopping triggered at epoch 47
2026-06-13 01:26:54,399 - preprocessing - INFO - xAPI engineered features created: ['engagement_score', 'absence_risk', 'parent_support_signal']
2026-06-13 01:26:54,401 - preprocessing - INFO - xAPI engineered features created: ['engagement_score', 'absence_risk', 'parent_support_signal']
2026-06-13 01:26:54,417 - preprocessing - INFO - Applying SMOTE on train set with ratio 0.5451647819126506...
2026-06-13 01:26:54,537 - preprocessing - INFO - Feature selection complete. Selected 16 / 19 features.
2026-06-13 01:26:57,451 - train_pipeline - INFO - Early stopping triggered at epoch 44
2026-06-13 01:26:57,469 - preprocessing - INFO - xAPI engineered features created: ['engagement_score', 'absence_risk', 'parent_support_signal']
2026-06-13 01:26:57,471 - preprocessing - INFO - xAPI engineered features created: ['engagement_score', 'absence_risk', 'parent_support_signal']
2026-06-13 01:26:57,488 - preprocessing - INFO - Applying SMOTE on train set with ratio 0.5451647819126506...
2026-06-13 01:26:57,605 - preprocessing - INFO - Feature selection complete. Selected 18 / 19 features.
[I 2026-06-13 01:27:02,674] Trial 137 finished with value: 0.7900573553635082 and parameters: {'learning_rate': 0.008197818513721747, 'weight_decay': 0.0008818165863334906, 'batch_size': 64, 'oversample_method': 'smote', 'smote_ratio': 0.5451647819126506, 'resampling_k_neighbors': 3, 'cnn_channels': 16, 'cnn_kernel_size': 3, 'lstm_hidden_dim': 128, 'context_hidden_dim': 256, 'fusion_hidden_dim': 256, 'sequence_dropout': 0.11345705026624159, 'context_dropout': 0.2031164544320465, 'fusion_dropout': 0.3121543824234453}. Best is trial 55 with value: 0.8121442327638384.
2026-06-13 01:27:02,789 - preprocessing - INFO - xAPI engineered features created: ['engagement_score', 'absence_risk', 'parent_support_signal']
2026-06-13 01:27:02,791 - preprocessing - INFO - xAPI engineered features created: ['engagement_score', 'absence_risk', 'parent_support_signal']
2026-06-13 01:27:02,809 - preprocessing - INFO - Applying ADASYN on train set with ratio 0.3236162627890231...
2026-06-13 01:27:02,928 - preprocessing - INFO - Feature selection complete. Selected 15 / 19 features.
2026-06-13 01:27:06,365 - train_pipeline - INFO - Early stopping triggered at epoch 36
2026-06-13 01:27:06,390 - preprocessing - INFO - xAPI engineered features created: ['engagement_score', 'absence_risk', 'parent_support_signal']
2026-06-13 01:27:06,393 - preprocessing - INFO - xAPI engineered features created: ['engagement_score', 'absence_risk', 'parent_support_signal']
2026-06-13 01:27:06,422 - preprocessing - INFO - Applying ADASYN on train set with ratio 0.3236162627890231...
2026-06-13 01:27:06,592 - preprocessing - INFO - Feature selection complete. Selected 16 / 19 features.
2026-06-13 01:27:11,926 - train_pipeline - INFO - Early stopping triggered at epoch 54
2026-06-13 01:27:11,946 - preprocessing - INFO - xAPI engineered features created: ['engagement_score', 'absence_risk', 'parent_support_signal']
2026-06-13 01:27:11,948 - preprocessing - INFO - xAPI engineered features created: ['engagement_score', 'absence_risk', 'parent_support_signal']
2026-06-13 01:27:11,965 - preprocessing - INFO - Applying ADASYN on train set with ratio 0.3236162627890231...
2026-06-13 01:27:12,082 - preprocessing - INFO - Feature selection complete. Selected 18 / 19 features.
2026-06-13 01:27:16,687 - train_pipeline - INFO - Early stopping triggered at epoch 47
2026-06-13 01:27:16,706 - preprocessing - INFO - xAPI engineered features created: ['engagement_score', 'absence_risk', 'parent_support_signal']
2026-06-13 01:27:16,709 - preprocessing - INFO - xAPI engineered features created: ['engagement_score', 'absence_risk', 'parent_support_signal']
2026-06-13 01:27:16,726 - preprocessing - INFO - Applying ADASYN on train set with ratio 0.3236162627890231...
2026-06-13 01:27:16,855 - preprocessing - INFO - Feature selection complete. Selected 16 / 19 features.
2026-06-13 01:27:24,864 - preprocessing - INFO - xAPI engineered features created: ['engagement_score', 'absence_risk', 'parent_support_signal']
2026-06-13 01:27:24,866 - preprocessing - INFO - xAPI engineered features created: ['engagement_score', 'absence_risk', 'parent_support_signal']
2026-06-13 01:27:24,890 - preprocessing - INFO - Applying ADASYN on train set with ratio 0.3236162627890231...
2026-06-13 01:27:25,037 - preprocessing - INFO - Feature selection complete. Selected 18 / 19 features.
2026-06-13 01:27:28,699 - train_pipeline - INFO - Early stopping triggered at epoch 37
[I 2026-06-13 01:27:28,731] Trial 138 finished with value: 0.78311608734105 and parameters: {'learning_rate': 0.0029827749081532033, 'weight_decay': 0.006665384166120456, 'batch_size': 32, 'oversample_method': 'adasyn', 'smote_ratio': 0.3236162627890231, 'resampling_k_neighbors': 2, 'cnn_channels': 32, 'cnn_kernel_size': 4, 'lstm_hidden_dim': 96, 'context_hidden_dim': 256, 'fusion_hidden_dim': 32, 'sequence_dropout': 0.28968595466664204, 'context_dropout': 0.25544917869579925, 'fusion_dropout': 0.28662181701283884}. Best is trial 55 with value: 0.8121442327638384.
2026-06-13 01:27:28,862 - preprocessing - INFO - xAPI engineered features created: ['engagement_score', 'absence_risk', 'parent_support_signal']
2026-06-13 01:27:28,865 - preprocessing - INFO - xAPI engineered features created: ['engagement_score', 'absence_risk', 'parent_support_signal']
2026-06-13 01:27:28,889 - preprocessing - INFO - Applying SMOTE on train set with ratio 0.6030845299664392...
2026-06-13 01:27:29,021 - preprocessing - INFO - Feature selection complete. Selected 15 / 19 features.
2026-06-13 01:27:31,185 - train_pipeline - INFO - Early stopping triggered at epoch 38
2026-06-13 01:27:31,202 - preprocessing - INFO - xAPI engineered features created: ['engagement_score', 'absence_risk', 'parent_support_signal']
2026-06-13 01:27:31,204 - preprocessing - INFO - xAPI engineered features created: ['engagement_score', 'absence_risk', 'parent_support_signal']
2026-06-13 01:27:31,221 - preprocessing - INFO - Applying SMOTE on train set with ratio 0.6030845299664392...
2026-06-13 01:27:31,338 - preprocessing - INFO - Feature selection complete. Selected 16 / 19 features.
2026-06-13 01:27:33,442 - train_pipeline - INFO - Early stopping triggered at epoch 36
2026-06-13 01:27:33,461 - preprocessing - INFO - xAPI engineered features created: ['engagement_score', 'absence_risk', 'parent_support_signal']
2026-06-13 01:27:33,463 - preprocessing - INFO - xAPI engineered features created: ['engagement_score', 'absence_risk', 'parent_support_signal']
2026-06-13 01:27:33,482 - preprocessing - INFO - Applying SMOTE on train set with ratio 0.6030845299664392...
2026-06-13 01:27:33,609 - preprocessing - INFO - Feature selection complete. Selected 18 / 19 features.
2026-06-13 01:27:35,767 - train_pipeline - INFO - Early stopping triggered at epoch 31
