[I 2026-06-13 00:34:55,209] Trial 16 finished with value: 0.7783942079071221 and parameters: {'learning_rate': 0.005225401990170408, 'weight_decay': 0.00483890346855717, 'batch_size': 64, 'oversample_method': 'smote', 'smote_ratio': 0.7758279934732906, 'resampling_k_neighbors': 6, 'cnn_channels': 32, 'cnn_kernel_size': 3, 'lstm_hidden_dim': 128, 'context_hidden_dim': 256, 'fusion_hidden_dim': 128, 'sequence_dropout': 0.18447973321928174, 'context_dropout': 0.1320374398290799, 'fusion_dropout': 0.3174820497833458}. Best is trial 12 with value: 0.8007844714913273.
2026-06-13 00:34:55,320 - preprocessing - INFO - xAPI engineered features created: ['engagement_score', 'absence_risk', 'parent_support_signal']
2026-06-13 00:34:55,322 - preprocessing - INFO - xAPI engineered features created: ['engagement_score', 'absence_risk', 'parent_support_signal']
2026-06-13 00:34:55,339 - preprocessing - INFO - Applying SMOTE on train set with ratio 0.5942599479951521...
2026-06-13 00:34:55,455 - preprocessing - INFO - Feature selection complete. Selected 15 / 19 features.
2026-06-13 00:34:57,115 - train_pipeline - INFO - Early stopping triggered at epoch 32
2026-06-13 00:34:57,132 - preprocessing - INFO - xAPI engineered features created: ['engagement_score', 'absence_risk', 'parent_support_signal']
2026-06-13 00:34:57,134 - preprocessing - INFO - xAPI engineered features created: ['engagement_score', 'absence_risk', 'parent_support_signal']
2026-06-13 00:34:57,152 - preprocessing - INFO - Applying SMOTE on train set with ratio 0.5942599479951521...
2026-06-13 00:34:57,271 - preprocessing - INFO - Feature selection complete. Selected 16 / 19 features.
2026-06-13 00:34:58,890 - train_pipeline - INFO - Early stopping triggered at epoch 31
2026-06-13 00:34:58,907 - preprocessing - INFO - xAPI engineered features created: ['engagement_score', 'absence_risk', 'parent_support_signal']
2026-06-13 00:34:58,909 - preprocessing - INFO - xAPI engineered features created: ['engagement_score', 'absence_risk', 'parent_support_signal']
2026-06-13 00:34:58,927 - preprocessing - INFO - Applying SMOTE on train set with ratio 0.5942599479951521...
2026-06-13 00:34:59,046 - preprocessing - INFO - Feature selection complete. Selected 18 / 19 features.
2026-06-13 00:35:00,665 - train_pipeline - INFO - Early stopping triggered at epoch 31
2026-06-13 00:35:00,683 - preprocessing - INFO - xAPI engineered features created: ['engagement_score', 'absence_risk', 'parent_support_signal']
2026-06-13 00:35:00,686 - preprocessing - INFO - xAPI engineered features created: ['engagement_score', 'absence_risk', 'parent_support_signal']
2026-06-13 00:35:00,703 - preprocessing - INFO - Applying SMOTE on train set with ratio 0.5942599479951521...
2026-06-13 00:35:00,821 - preprocessing - INFO - Feature selection complete. Selected 16 / 19 features.
2026-06-13 00:35:02,460 - train_pipeline - INFO - Early stopping triggered at epoch 31
2026-06-13 00:35:02,477 - preprocessing - INFO - xAPI engineered features created: ['engagement_score', 'absence_risk', 'parent_support_signal']
2026-06-13 00:35:02,480 - preprocessing - INFO - xAPI engineered features created: ['engagement_score', 'absence_risk', 'parent_support_signal']
2026-06-13 00:35:02,497 - preprocessing - INFO - Applying SMOTE on train set with ratio 0.5942599479951521...
2026-06-13 00:35:02,616 - preprocessing - INFO - Feature selection complete. Selected 18 / 19 features.
2026-06-13 00:35:05,179 - train_pipeline - INFO - Early stopping triggered at epoch 49
[I 2026-06-13 00:35:05,212] Trial 17 finished with value: 0.8075693134180814 and parameters: {'learning_rate': 0.014245630762092915, 'weight_decay': 4.192465202734098e-05, 'batch_size': 64, 'oversample_method': 'smote', 'smote_ratio': 0.5942599479951521, 'resampling_k_neighbors': 4, 'cnn_channels': 128, 'cnn_kernel_size': 3, 'lstm_hidden_dim': 64, 'context_hidden_dim': 128, 'fusion_hidden_dim': 128, 'sequence_dropout': 0.30222101103269516, 'context_dropout': 0.314170669793139, 'fusion_dropout': 0.3753519681452694}. Best is trial 17 with value: 0.8075693134180814.
2026-06-13 00:35:05,323 - preprocessing - INFO - xAPI engineered features created: ['engagement_score', 'absence_risk', 'parent_support_signal']
2026-06-13 00:35:05,325 - preprocessing - INFO - xAPI engineered features created: ['engagement_score', 'absence_risk', 'parent_support_signal']
2026-06-13 00:35:05,343 - preprocessing - INFO - Applying SMOTE on train set with ratio 0.5769969377050974...
2026-06-13 00:35:05,459 - preprocessing - INFO - Feature selection complete. Selected 15 / 19 features.
2026-06-13 00:35:08,865 - train_pipeline - INFO - Early stopping triggered at epoch 33
2026-06-13 00:35:08,883 - preprocessing - INFO - xAPI engineered features created: ['engagement_score', 'absence_risk', 'parent_support_signal']
2026-06-13 00:35:08,885 - preprocessing - INFO - xAPI engineered features created: ['engagement_score', 'absence_risk', 'parent_support_signal']
2026-06-13 00:35:08,903 - preprocessing - INFO - Applying SMOTE on train set with ratio 0.5769969377050974...
2026-06-13 00:35:09,019 - preprocessing - INFO - Feature selection complete. Selected 16 / 19 features.
2026-06-13 00:35:12,953 - train_pipeline - INFO - Early stopping triggered at epoch 39
2026-06-13 00:35:12,974 - preprocessing - INFO - xAPI engineered features created: ['engagement_score', 'absence_risk', 'parent_support_signal']
2026-06-13 00:35:12,976 - preprocessing - INFO - xAPI engineered features created: ['engagement_score', 'absence_risk', 'parent_support_signal']
2026-06-13 00:35:13,001 - preprocessing - INFO - Applying SMOTE on train set with ratio 0.5769969377050974...
2026-06-13 00:35:13,130 - preprocessing - INFO - Feature selection complete. Selected 18 / 19 features.
2026-06-13 00:35:16,165 - train_pipeline - INFO - Early stopping triggered at epoch 33
2026-06-13 00:35:16,184 - preprocessing - INFO - xAPI engineered features created: ['engagement_score', 'absence_risk', 'parent_support_signal']
2026-06-13 00:35:16,186 - preprocessing - INFO - xAPI engineered features created: ['engagement_score', 'absence_risk', 'parent_support_signal']
2026-06-13 00:35:16,206 - preprocessing - INFO - Applying SMOTE on train set with ratio 0.5769969377050974...
2026-06-13 00:35:16,325 - preprocessing - INFO - Feature selection complete. Selected 16 / 19 features.
2026-06-13 00:35:19,746 - train_pipeline - INFO - Early stopping triggered at epoch 34
2026-06-13 00:35:19,766 - preprocessing - INFO - xAPI engineered features created: ['engagement_score', 'absence_risk', 'parent_support_signal']
2026-06-13 00:35:19,769 - preprocessing - INFO - xAPI engineered features created: ['engagement_score', 'absence_risk', 'parent_support_signal']
2026-06-13 00:35:19,793 - preprocessing - INFO - Applying SMOTE on train set with ratio 0.5769969377050974...
2026-06-13 00:35:19,948 - preprocessing - INFO - Feature selection complete. Selected 18 / 19 features.
2026-06-13 00:35:26,482 - train_pipeline - INFO - Early stopping triggered at epoch 66
[I 2026-06-13 00:35:26,510] Trial 18 finished with value: 0.7863060558166143 and parameters: {'learning_rate': 0.01927416631596061, 'weight_decay': 3.552951618531968e-06, 'batch_size': 32, 'oversample_method': 'smote', 'smote_ratio': 0.5769969377050974, 'resampling_k_neighbors': 4, 'cnn_channels': 128, 'cnn_kernel_size': 4, 'lstm_hidden_dim': 64, 'context_hidden_dim': 128, 'fusion_hidden_dim': 128, 'sequence_dropout': 0.31358211551842663, 'context_dropout': 0.3321251975520253, 'fusion_dropout': 0.4381085009844046}. Best is trial 17 with value: 0.8075693134180814.
2026-06-13 00:35:26,623 - preprocessing - INFO - xAPI engineered features created: ['engagement_score', 'absence_risk', 'parent_support_signal']
2026-06-13 00:35:26,625 - preprocessing - INFO - xAPI engineered features created: ['engagement_score', 'absence_risk', 'parent_support_signal']
2026-06-13 00:35:26,643 - preprocessing - INFO - Applying ADASYN on train set with ratio 0.8066829185353149...
2026-06-13 00:35:26,656 - preprocessing - WARNING - ADASYN failed (likely too few samples). Error: No samples will be generated with the provided ratio settings.. Falling back to no oversampling.
2026-06-13 00:35:26,771 - preprocessing - INFO - Feature selection complete. Selected 15 / 19 features.
2026-06-13 00:35:28,633 - train_pipeline - INFO - Early stopping triggered at epoch 36
2026-06-13 00:35:28,653 - preprocessing - INFO - xAPI engineered features created: ['engagement_score', 'absence_risk', 'parent_support_signal']
2026-06-13 00:35:28,655 - preprocessing - INFO - xAPI engineered features created: ['engagement_score', 'absence_risk', 'parent_support_signal']
2026-06-13 00:35:28,672 - preprocessing - INFO - Applying ADASYN on train set with ratio 0.8066829185353149...
2026-06-13 00:35:28,686 - preprocessing - WARNING - ADASYN failed (likely too few samples). Error: No samples will be generated with the provided ratio settings.. Falling back to no oversampling.
2026-06-13 00:35:28,805 - preprocessing - INFO - Feature selection complete. Selected 16 / 19 features.
2026-06-13 00:35:32,378 - train_pipeline - INFO - Early stopping triggered at epoch 65
2026-06-13 00:35:32,400 - preprocessing - INFO - xAPI engineered features created: ['engagement_score', 'absence_risk', 'parent_support_signal']
2026-06-13 00:35:32,404 - preprocessing - INFO - xAPI engineered features created: ['engagement_score', 'absence_risk', 'parent_support_signal']
2026-06-13 00:35:32,434 - preprocessing - INFO - Applying ADASYN on train set with ratio 0.8066829185353149...
2026-06-13 00:35:32,459 - preprocessing - WARNING - ADASYN failed (likely too few samples). Error: No samples will be generated with the provided ratio settings.. Falling back to no oversampling.
2026-06-13 00:35:32,626 - preprocessing - INFO - Feature selection complete. Selected 18 / 19 features.
2026-06-13 00:35:34,441 - train_pipeline - INFO - Early stopping triggered at epoch 33
2026-06-13 00:35:34,459 - preprocessing - INFO - xAPI engineered features created: ['engagement_score', 'absence_risk', 'parent_support_signal']
2026-06-13 00:35:34,461 - preprocessing - INFO - xAPI engineered features created: ['engagement_score', 'absence_risk', 'parent_support_signal']
2026-06-13 00:35:34,478 - preprocessing - INFO - Applying ADASYN on train set with ratio 0.8066829185353149...
2026-06-13 00:35:34,493 - preprocessing - WARNING - ADASYN failed (likely too few samples). Error: No samples will be generated with the provided ratio settings.. Falling back to no oversampling.
2026-06-13 00:35:34,612 - preprocessing - INFO - Feature selection complete. Selected 16 / 19 features.
2026-06-13 00:35:36,991 - train_pipeline - INFO - Early stopping triggered at epoch 46
2026-06-13 00:35:37,010 - preprocessing - INFO - xAPI engineered features created: ['engagement_score', 'absence_risk', 'parent_support_signal']
2026-06-13 00:35:37,013 - preprocessing - INFO - xAPI engineered features created: ['engagement_score', 'absence_risk', 'parent_support_signal']
2026-06-13 00:35:37,031 - preprocessing - INFO - Applying ADASYN on train set with ratio 0.8066829185353149...
2026-06-13 00:35:37,045 - preprocessing - WARNING - ADASYN failed (likely too few samples). Error: No samples will be generated with the provided ratio settings.. Falling back to no oversampling.
2026-06-13 00:35:37,156 - preprocessing - INFO - Feature selection complete. Selected 18 / 19 features.
[I 2026-06-13 00:35:41,743] Trial 19 finished with value: 0.7949206184080249 and parameters: {'learning_rate': 0.012358185676041696, 'weight_decay': 0.0007834848601227567, 'batch_size': 64, 'oversample_method': 'adasyn', 'smote_ratio': 0.8066829185353149, 'resampling_k_neighbors': 3, 'cnn_channels': 32, 'cnn_kernel_size': 2, 'lstm_hidden_dim': 64, 'context_hidden_dim': 256, 'fusion_hidden_dim': 256, 'sequence_dropout': 0.1567599970588921, 'context_dropout': 0.3965366738708605, 'fusion_dropout': 0.1778045973875656}. Best is trial 17 with value: 0.8075693134180814.
2026-06-13 00:35:41,856 - preprocessing - INFO - xAPI engineered features created: ['engagement_score', 'absence_risk', 'parent_support_signal']
2026-06-13 00:35:41,858 - preprocessing - INFO - xAPI engineered features created: ['engagement_score', 'absence_risk', 'parent_support_signal']
2026-06-13 00:35:41,875 - preprocessing - INFO - Applying ADASYN on train set with ratio 0.7719206716681952...
2026-06-13 00:35:41,889 - preprocessing - WARNING - ADASYN failed (likely too few samples). Error: No samples will be generated with the provided ratio settings.. Falling back to no oversampling.
2026-06-13 00:35:42,003 - preprocessing - INFO - Feature selection complete. Selected 15 / 19 features.
2026-06-13 00:35:43,936 - train_pipeline - INFO - Early stopping triggered at epoch 42
2026-06-13 00:35:43,953 - preprocessing - INFO - xAPI engineered features created: ['engagement_score', 'absence_risk', 'parent_support_signal']
2026-06-13 00:35:43,955 - preprocessing - INFO - xAPI engineered features created: ['engagement_score', 'absence_risk', 'parent_support_signal']
2026-06-13 00:35:43,973 - preprocessing - INFO - Applying ADASYN on train set with ratio 0.7719206716681952...
2026-06-13 00:35:43,987 - preprocessing - WARNING - ADASYN failed (likely too few samples). Error: No samples will be generated with the provided ratio settings.. Falling back to no oversampling.
2026-06-13 00:35:44,105 - preprocessing - INFO - Feature selection complete. Selected 16 / 19 features.
2026-06-13 00:35:45,505 - train_pipeline - INFO - Early stopping triggered at epoch 31
2026-06-13 00:35:45,526 - preprocessing - INFO - xAPI engineered features created: ['engagement_score', 'absence_risk', 'parent_support_signal']
2026-06-13 00:35:45,528 - preprocessing - INFO - xAPI engineered features created: ['engagement_score', 'absence_risk', 'parent_support_signal']
2026-06-13 00:35:45,545 - preprocessing - INFO - Applying ADASYN on train set with ratio 0.7719206716681952...
2026-06-13 00:35:45,559 - preprocessing - WARNING - ADASYN failed (likely too few samples). Error: No samples will be generated with the provided ratio settings.. Falling back to no oversampling.
2026-06-13 00:35:45,675 - preprocessing - INFO - Feature selection complete. Selected 18 / 19 features.
2026-06-13 00:35:47,723 - train_pipeline - INFO - Early stopping triggered at epoch 45
2026-06-13 00:35:47,741 - preprocessing - INFO - xAPI engineered features created: ['engagement_score', 'absence_risk', 'parent_support_signal']
2026-06-13 00:35:47,743 - preprocessing - INFO - xAPI engineered features created: ['engagement_score', 'absence_risk', 'parent_support_signal']
2026-06-13 00:35:47,760 - preprocessing - INFO - Applying ADASYN on train set with ratio 0.7719206716681952...
2026-06-13 00:35:47,774 - preprocessing - WARNING - ADASYN failed (likely too few samples). Error: No samples will be generated with the provided ratio settings.. Falling back to no oversampling.
2026-06-13 00:35:47,891 - preprocessing - INFO - Feature selection complete. Selected 16 / 19 features.
2026-06-13 00:35:49,926 - train_pipeline - INFO - Early stopping triggered at epoch 45
2026-06-13 00:35:49,943 - preprocessing - INFO - xAPI engineered features created: ['engagement_score', 'absence_risk', 'parent_support_signal']
2026-06-13 00:35:49,946 - preprocessing - INFO - xAPI engineered features created: ['engagement_score', 'absence_risk', 'parent_support_signal']
2026-06-13 00:35:49,963 - preprocessing - INFO - Applying ADASYN on train set with ratio 0.7719206716681952...
2026-06-13 00:35:49,977 - preprocessing - WARNING - ADASYN failed (likely too few samples). Error: No samples will be generated with the provided ratio settings.. Falling back to no oversampling.
2026-06-13 00:35:50,095 - preprocessing - INFO - Feature selection complete. Selected 18 / 19 features.
2026-06-13 00:35:51,893 - train_pipeline - INFO - Early stopping triggered at epoch 40
[I 2026-06-13 00:35:51,921] Trial 20 finished with value: 0.7862407130000357 and parameters: {'learning_rate': 0.006552177007760086, 'weight_decay': 2.0186077201525357e-05, 'batch_size': 64, 'oversample_method': 'adasyn', 'smote_ratio': 0.7719206716681952, 'resampling_k_neighbors': 7, 'cnn_channels': 32, 'cnn_kernel_size': 3, 'lstm_hidden_dim': 64, 'context_hidden_dim': 64, 'fusion_hidden_dim': 64, 'sequence_dropout': 0.2040246611700554, 'context_dropout': 0.4098625624196826, 'fusion_dropout': 0.2773829182229943}. Best is trial 17 with value: 0.8075693134180814.
2026-06-13 00:35:52,033 - preprocessing - INFO - xAPI engineered features created: ['engagement_score', 'absence_risk', 'parent_support_signal']
2026-06-13 00:35:52,035 - preprocessing - INFO - xAPI engineered features created: ['engagement_score', 'absence_risk', 'parent_support_signal']
2026-06-13 00:35:52,051 - preprocessing - INFO - Applying SMOTE on train set with ratio 0.3929200194956009...
2026-06-13 00:35:52,167 - preprocessing - INFO - Feature selection complete. Selected 15 / 19 features.
2026-06-13 00:35:54,704 - train_pipeline - INFO - Early stopping triggered at epoch 53
2026-06-13 00:35:54,722 - preprocessing - INFO - xAPI engineered features created: ['engagement_score', 'absence_risk', 'parent_support_signal']
2026-06-13 00:35:54,725 - preprocessing - INFO - xAPI engineered features created: ['engagement_score', 'absence_risk', 'parent_support_signal']
2026-06-13 00:35:54,749 - preprocessing - INFO - Applying SMOTE on train set with ratio 0.3929200194956009...
2026-06-13 00:35:54,925 - preprocessing - INFO - Feature selection complete. Selected 16 / 19 features.
2026-06-13 00:35:56,676 - train_pipeline - INFO - Early stopping triggered at epoch 30
2026-06-13 00:35:56,693 - preprocessing - INFO - xAPI engineered features created: ['engagement_score', 'absence_risk', 'parent_support_signal']
2026-06-13 00:35:56,695 - preprocessing - INFO - xAPI engineered features created: ['engagement_score', 'absence_risk', 'parent_support_signal']
2026-06-13 00:35:56,712 - preprocessing - INFO - Applying SMOTE on train set with ratio 0.3929200194956009...
2026-06-13 00:35:56,832 - preprocessing - INFO - Feature selection complete. Selected 18 / 19 features.
2026-06-13 00:35:58,836 - train_pipeline - INFO - Early stopping triggered at epoch 41
2026-06-13 00:35:58,853 - preprocessing - INFO - xAPI engineered features created: ['engagement_score', 'absence_risk', 'parent_support_signal']
2026-06-13 00:35:58,855 - preprocessing - INFO - xAPI engineered features created: ['engagement_score', 'absence_risk', 'parent_support_signal']
2026-06-13 00:35:58,872 - preprocessing - INFO - Applying SMOTE on train set with ratio 0.3929200194956009...
2026-06-13 00:35:58,987 - preprocessing - INFO - Feature selection complete. Selected 16 / 19 features.
2026-06-13 00:36:00,893 - train_pipeline - INFO - Early stopping triggered at epoch 39
2026-06-13 00:36:00,912 - preprocessing - INFO - xAPI engineered features created: ['engagement_score', 'absence_risk', 'parent_support_signal']
2026-06-13 00:36:00,914 - preprocessing - INFO - xAPI engineered features created: ['engagement_score', 'absence_risk', 'parent_support_signal']
2026-06-13 00:36:00,931 - preprocessing - INFO - Applying SMOTE on train set with ratio 0.3929200194956009...
2026-06-13 00:36:01,055 - preprocessing - INFO - Feature selection complete. Selected 18 / 19 features.
2026-06-13 00:36:03,332 - train_pipeline - INFO - Early stopping triggered at epoch 47
[I 2026-06-13 00:36:03,359] Trial 21 finished with value: 0.8005971246587616 and parameters: {'learning_rate': 0.013254286499223032, 'weight_decay': 9.443587659724766e-05, 'batch_size': 64, 'oversample_method': 'smote', 'smote_ratio': 0.3929200194956009, 'resampling_k_neighbors': 3, 'cnn_channels': 32, 'cnn_kernel_size': 3, 'lstm_hidden_dim': 64, 'context_hidden_dim': 256, 'fusion_hidden_dim': 128, 'sequence_dropout': 0.28025133803262353, 'context_dropout': 0.2894054669900289, 'fusion_dropout': 0.39365131472937037}. Best is trial 17 with value: 0.8075693134180814.
2026-06-13 00:36:03,474 - preprocessing - INFO - xAPI engineered features created: ['engagement_score', 'absence_risk', 'parent_support_signal']
2026-06-13 00:36:03,477 - preprocessing - INFO - xAPI engineered features created: ['engagement_score', 'absence_risk', 'parent_support_signal']
2026-06-13 00:36:03,494 - preprocessing - INFO - Applying SMOTE on train set with ratio 0.5236182636443265...
2026-06-13 00:36:03,612 - preprocessing - INFO - Feature selection complete. Selected 15 / 19 features.
2026-06-13 00:36:05,615 - train_pipeline - INFO - Early stopping triggered at epoch 32
2026-06-13 00:36:05,632 - preprocessing - INFO - xAPI engineered features created: ['engagement_score', 'absence_risk', 'parent_support_signal']
2026-06-13 00:36:05,634 - preprocessing - INFO - xAPI engineered features created: ['engagement_score', 'absence_risk', 'parent_support_signal']
2026-06-13 00:36:05,651 - preprocessing - INFO - Applying SMOTE on train set with ratio 0.5236182636443265...
2026-06-13 00:36:05,768 - preprocessing - INFO - Feature selection complete. Selected 16 / 19 features.
2026-06-13 00:36:07,453 - train_pipeline - INFO - Early stopping triggered at epoch 33
2026-06-13 00:36:07,470 - preprocessing - INFO - xAPI engineered features created: ['engagement_score', 'absence_risk', 'parent_support_signal']
2026-06-13 00:36:07,472 - preprocessing - INFO - xAPI engineered features created: ['engagement_score', 'absence_risk', 'parent_support_signal']
2026-06-13 00:36:07,489 - preprocessing - INFO - Applying SMOTE on train set with ratio 0.5236182636443265...
2026-06-13 00:36:07,607 - preprocessing - INFO - Feature selection complete. Selected 18 / 19 features.
2026-06-13 00:36:09,200 - train_pipeline - INFO - Early stopping triggered at epoch 31
