[I 2026-06-13 01:21:58,316] Trial 124 finished with value: 0.7969076120109582 and parameters: {'learning_rate': 0.0027218662677682983, 'weight_decay': 0.0014466331935117014, 'batch_size': 16, 'oversample_method': 'adasyn', 'smote_ratio': 0.456306244601142, 'resampling_k_neighbors': 3, 'cnn_channels': 32, 'cnn_kernel_size': 3, 'lstm_hidden_dim': 32, 'context_hidden_dim': 256, 'fusion_hidden_dim': 32, 'sequence_dropout': 0.22288801918849588, 'context_dropout': 0.34223643328991826, 'fusion_dropout': 0.2735805774778848}. Best is trial 55 with value: 0.8121442327638384.
2026-06-13 01:21:58,463 - preprocessing - INFO - xAPI engineered features created: ['engagement_score', 'absence_risk', 'parent_support_signal']
2026-06-13 01:21:58,467 - preprocessing - INFO - xAPI engineered features created: ['engagement_score', 'absence_risk', 'parent_support_signal']
2026-06-13 01:21:58,492 - preprocessing - INFO - Applying SMOTE on train set with ratio 0.4308273795697092...
2026-06-13 01:21:58,642 - preprocessing - INFO - Feature selection complete. Selected 15 / 19 features.
2026-06-13 01:22:03,607 - train_pipeline - INFO - Early stopping triggered at epoch 44
2026-06-13 01:22:03,625 - preprocessing - INFO - xAPI engineered features created: ['engagement_score', 'absence_risk', 'parent_support_signal']
2026-06-13 01:22:03,627 - preprocessing - INFO - xAPI engineered features created: ['engagement_score', 'absence_risk', 'parent_support_signal']
2026-06-13 01:22:03,644 - preprocessing - INFO - Applying SMOTE on train set with ratio 0.4308273795697092...
2026-06-13 01:22:03,761 - preprocessing - INFO - Feature selection complete. Selected 16 / 19 features.
2026-06-13 01:22:06,858 - train_pipeline - INFO - Early stopping triggered at epoch 30
2026-06-13 01:22:06,887 - preprocessing - INFO - xAPI engineered features created: ['engagement_score', 'absence_risk', 'parent_support_signal']
2026-06-13 01:22:06,892 - preprocessing - INFO - xAPI engineered features created: ['engagement_score', 'absence_risk', 'parent_support_signal']
2026-06-13 01:22:06,920 - preprocessing - INFO - Applying SMOTE on train set with ratio 0.4308273795697092...
2026-06-13 01:22:07,105 - preprocessing - INFO - Feature selection complete. Selected 18 / 19 features.
2026-06-13 01:22:10,366 - train_pipeline - INFO - Early stopping triggered at epoch 29
2026-06-13 01:22:10,385 - preprocessing - INFO - xAPI engineered features created: ['engagement_score', 'absence_risk', 'parent_support_signal']
2026-06-13 01:22:10,387 - preprocessing - INFO - xAPI engineered features created: ['engagement_score', 'absence_risk', 'parent_support_signal']
2026-06-13 01:22:10,405 - preprocessing - INFO - Applying SMOTE on train set with ratio 0.4308273795697092...
2026-06-13 01:22:10,521 - preprocessing - INFO - Feature selection complete. Selected 16 / 19 features.
2026-06-13 01:22:15,999 - train_pipeline - INFO - Early stopping triggered at epoch 46
2026-06-13 01:22:16,022 - preprocessing - INFO - xAPI engineered features created: ['engagement_score', 'absence_risk', 'parent_support_signal']
2026-06-13 01:22:16,025 - preprocessing - INFO - xAPI engineered features created: ['engagement_score', 'absence_risk', 'parent_support_signal']
2026-06-13 01:22:16,049 - preprocessing - INFO - Applying SMOTE on train set with ratio 0.4308273795697092...
2026-06-13 01:22:16,174 - preprocessing - INFO - Feature selection complete. Selected 18 / 19 features.
2026-06-13 01:22:22,905 - train_pipeline - INFO - Early stopping triggered at epoch 61
[I 2026-06-13 01:22:22,947] Trial 125 finished with value: 0.8027356029387718 and parameters: {'learning_rate': 0.006217979138626295, 'weight_decay': 0.0013444316774755296, 'batch_size': 32, 'oversample_method': 'smote', 'smote_ratio': 0.4308273795697092, 'resampling_k_neighbors': 3, 'cnn_channels': 64, 'cnn_kernel_size': 3, 'lstm_hidden_dim': 128, 'context_hidden_dim': 256, 'fusion_hidden_dim': 256, 'sequence_dropout': 0.11746792708585416, 'context_dropout': 0.16474160165528132, 'fusion_dropout': 0.22067152918910216}. Best is trial 55 with value: 0.8121442327638384.
2026-06-13 01:22:23,102 - preprocessing - INFO - xAPI engineered features created: ['engagement_score', 'absence_risk', 'parent_support_signal']
2026-06-13 01:22:23,106 - preprocessing - INFO - xAPI engineered features created: ['engagement_score', 'absence_risk', 'parent_support_signal']
2026-06-13 01:22:23,131 - preprocessing - INFO - Applying SMOTE on train set with ratio 0.7486804437491547...
2026-06-13 01:22:23,297 - preprocessing - INFO - Feature selection complete. Selected 18 / 19 features.
2026-06-13 01:22:26,114 - train_pipeline - INFO - Early stopping triggered at epoch 47
2026-06-13 01:22:26,131 - preprocessing - INFO - xAPI engineered features created: ['engagement_score', 'absence_risk', 'parent_support_signal']
2026-06-13 01:22:26,134 - preprocessing - INFO - xAPI engineered features created: ['engagement_score', 'absence_risk', 'parent_support_signal']
2026-06-13 01:22:26,151 - preprocessing - INFO - Applying SMOTE on train set with ratio 0.7486804437491547...
2026-06-13 01:22:26,280 - preprocessing - INFO - Feature selection complete. Selected 16 / 19 features.
2026-06-13 01:22:28,172 - train_pipeline - INFO - Early stopping triggered at epoch 34
2026-06-13 01:22:28,190 - preprocessing - INFO - xAPI engineered features created: ['engagement_score', 'absence_risk', 'parent_support_signal']
2026-06-13 01:22:28,192 - preprocessing - INFO - xAPI engineered features created: ['engagement_score', 'absence_risk', 'parent_support_signal']
2026-06-13 01:22:28,211 - preprocessing - INFO - Applying SMOTE on train set with ratio 0.7486804437491547...
2026-06-13 01:22:28,335 - preprocessing - INFO - Feature selection complete. Selected 18 / 19 features.
2026-06-13 01:22:31,065 - train_pipeline - INFO - Early stopping triggered at epoch 47
[I 2026-06-13 01:22:31,100] Trial 126 pruned. 
2026-06-13 01:22:31,251 - preprocessing - INFO - xAPI engineered features created: ['engagement_score', 'absence_risk', 'parent_support_signal']
2026-06-13 01:22:31,255 - preprocessing - INFO - xAPI engineered features created: ['engagement_score', 'absence_risk', 'parent_support_signal']
2026-06-13 01:22:31,286 - preprocessing - INFO - Applying SMOTE on train set with ratio 0.5450408819251912...
2026-06-13 01:22:31,429 - preprocessing - INFO - Feature selection complete. Selected 15 / 19 features.
2026-06-13 01:22:33,776 - train_pipeline - INFO - Early stopping triggered at epoch 38
2026-06-13 01:22:33,794 - preprocessing - INFO - xAPI engineered features created: ['engagement_score', 'absence_risk', 'parent_support_signal']
2026-06-13 01:22:33,797 - preprocessing - INFO - xAPI engineered features created: ['engagement_score', 'absence_risk', 'parent_support_signal']
2026-06-13 01:22:33,814 - preprocessing - INFO - Applying SMOTE on train set with ratio 0.5450408819251912...
2026-06-13 01:22:33,932 - preprocessing - INFO - Feature selection complete. Selected 16 / 19 features.
2026-06-13 01:22:38,445 - train_pipeline - INFO - Early stopping triggered at epoch 72
2026-06-13 01:22:38,464 - preprocessing - INFO - xAPI engineered features created: ['engagement_score', 'absence_risk', 'parent_support_signal']
2026-06-13 01:22:38,467 - preprocessing - INFO - xAPI engineered features created: ['engagement_score', 'absence_risk', 'parent_support_signal']
2026-06-13 01:22:38,484 - preprocessing - INFO - Applying SMOTE on train set with ratio 0.5450408819251912...
2026-06-13 01:22:38,605 - preprocessing - INFO - Feature selection complete. Selected 18 / 19 features.
2026-06-13 01:22:41,380 - train_pipeline - INFO - Early stopping triggered at epoch 48
2026-06-13 01:22:41,399 - preprocessing - INFO - xAPI engineered features created: ['engagement_score', 'absence_risk', 'parent_support_signal']
2026-06-13 01:22:41,402 - preprocessing - INFO - xAPI engineered features created: ['engagement_score', 'absence_risk', 'parent_support_signal']
2026-06-13 01:22:41,419 - preprocessing - INFO - Applying SMOTE on train set with ratio 0.5450408819251912...
2026-06-13 01:22:41,535 - preprocessing - INFO - Feature selection complete. Selected 16 / 19 features.
2026-06-13 01:22:45,420 - train_pipeline - INFO - Early stopping triggered at epoch 61
2026-06-13 01:22:45,437 - preprocessing - INFO - xAPI engineered features created: ['engagement_score', 'absence_risk', 'parent_support_signal']
2026-06-13 01:22:45,440 - preprocessing - INFO - xAPI engineered features created: ['engagement_score', 'absence_risk', 'parent_support_signal']
2026-06-13 01:22:45,457 - preprocessing - INFO - Applying SMOTE on train set with ratio 0.5450408819251912...
2026-06-13 01:22:45,576 - preprocessing - INFO - Feature selection complete. Selected 18 / 19 features.
[I 2026-06-13 01:22:50,927] Trial 127 finished with value: 0.8030311841681697 and parameters: {'learning_rate': 0.015850551812370536, 'weight_decay': 0.0071589524685684875, 'batch_size': 64, 'oversample_method': 'smote', 'smote_ratio': 0.5450408819251912, 'resampling_k_neighbors': 2, 'cnn_channels': 16, 'cnn_kernel_size': 3, 'lstm_hidden_dim': 128, 'context_hidden_dim': 256, 'fusion_hidden_dim': 256, 'sequence_dropout': 0.20219057373804333, 'context_dropout': 0.17169126128193113, 'fusion_dropout': 0.3230422476655867}. Best is trial 55 with value: 0.8121442327638384.
2026-06-13 01:22:51,061 - preprocessing - INFO - xAPI engineered features created: ['engagement_score', 'absence_risk', 'parent_support_signal']
2026-06-13 01:22:51,065 - preprocessing - INFO - xAPI engineered features created: ['engagement_score', 'absence_risk', 'parent_support_signal']
2026-06-13 01:22:51,082 - preprocessing - INFO - Applying ADASYN on train set with ratio 0.3705751994861962...
2026-06-13 01:22:51,200 - preprocessing - INFO - Feature selection complete. Selected 15 / 19 features.
2026-06-13 01:22:55,551 - train_pipeline - INFO - Early stopping triggered at epoch 44
2026-06-13 01:22:55,569 - preprocessing - INFO - xAPI engineered features created: ['engagement_score', 'absence_risk', 'parent_support_signal']
2026-06-13 01:22:55,572 - preprocessing - INFO - xAPI engineered features created: ['engagement_score', 'absence_risk', 'parent_support_signal']
2026-06-13 01:22:55,589 - preprocessing - INFO - Applying ADASYN on train set with ratio 0.3705751994861962...
2026-06-13 01:22:55,711 - preprocessing - INFO - Feature selection complete. Selected 16 / 19 features.
2026-06-13 01:23:02,289 - train_pipeline - INFO - Early stopping triggered at epoch 69
2026-06-13 01:23:02,307 - preprocessing - INFO - xAPI engineered features created: ['engagement_score', 'absence_risk', 'parent_support_signal']
2026-06-13 01:23:02,310 - preprocessing - INFO - xAPI engineered features created: ['engagement_score', 'absence_risk', 'parent_support_signal']
2026-06-13 01:23:02,328 - preprocessing - INFO - Applying ADASYN on train set with ratio 0.3705751994861962...
2026-06-13 01:23:02,445 - preprocessing - INFO - Feature selection complete. Selected 18 / 19 features.
2026-06-13 01:23:06,569 - train_pipeline - INFO - Early stopping triggered at epoch 41
[I 2026-06-13 01:23:06,595] Trial 128 pruned. 
2026-06-13 01:23:06,713 - preprocessing - INFO - xAPI engineered features created: ['engagement_score', 'absence_risk', 'parent_support_signal']
2026-06-13 01:23:06,716 - preprocessing - INFO - xAPI engineered features created: ['engagement_score', 'absence_risk', 'parent_support_signal']
2026-06-13 01:23:06,735 - preprocessing - INFO - Applying ADASYN on train set with ratio 0.450115458838772...
2026-06-13 01:23:07,052 - preprocessing - INFO - Feature selection complete. Selected 15 / 19 features.
2026-06-13 01:23:08,945 - train_pipeline - INFO - Early stopping triggered at epoch 35
2026-06-13 01:23:08,962 - preprocessing - INFO - xAPI engineered features created: ['engagement_score', 'absence_risk', 'parent_support_signal']
2026-06-13 01:23:08,965 - preprocessing - INFO - xAPI engineered features created: ['engagement_score', 'absence_risk', 'parent_support_signal']
2026-06-13 01:23:08,982 - preprocessing - INFO - Applying ADASYN on train set with ratio 0.450115458838772...
2026-06-13 01:23:09,101 - preprocessing - INFO - Feature selection complete. Selected 16 / 19 features.
2026-06-13 01:23:11,489 - train_pipeline - INFO - Early stopping triggered at epoch 50
2026-06-13 01:23:11,506 - preprocessing - INFO - xAPI engineered features created: ['engagement_score', 'absence_risk', 'parent_support_signal']
2026-06-13 01:23:11,509 - preprocessing - INFO - xAPI engineered features created: ['engagement_score', 'absence_risk', 'parent_support_signal']
2026-06-13 01:23:11,526 - preprocessing - INFO - Applying ADASYN on train set with ratio 0.450115458838772...
2026-06-13 01:23:11,646 - preprocessing - INFO - Feature selection complete. Selected 18 / 19 features.
2026-06-13 01:23:14,395 - train_pipeline - INFO - Early stopping triggered at epoch 50
2026-06-13 01:23:14,414 - preprocessing - INFO - xAPI engineered features created: ['engagement_score', 'absence_risk', 'parent_support_signal']
2026-06-13 01:23:14,416 - preprocessing - INFO - xAPI engineered features created: ['engagement_score', 'absence_risk', 'parent_support_signal']
2026-06-13 01:23:14,434 - preprocessing - INFO - Applying ADASYN on train set with ratio 0.450115458838772...
2026-06-13 01:23:14,558 - preprocessing - INFO - Feature selection complete. Selected 16 / 19 features.
2026-06-13 01:23:17,094 - train_pipeline - INFO - Early stopping triggered at epoch 53
2026-06-13 01:23:17,112 - preprocessing - INFO - xAPI engineered features created: ['engagement_score', 'absence_risk', 'parent_support_signal']
2026-06-13 01:23:17,115 - preprocessing - INFO - xAPI engineered features created: ['engagement_score', 'absence_risk', 'parent_support_signal']
2026-06-13 01:23:17,132 - preprocessing - INFO - Applying ADASYN on train set with ratio 0.450115458838772...
2026-06-13 01:23:17,252 - preprocessing - INFO - Feature selection complete. Selected 18 / 19 features.
2026-06-13 01:23:19,491 - train_pipeline - INFO - Early stopping triggered at epoch 47
[I 2026-06-13 01:23:19,521] Trial 129 finished with value: 0.7998687855443294 and parameters: {'learning_rate': 0.0018128807094850111, 'weight_decay': 0.002408339217892138, 'batch_size': 64, 'oversample_method': 'adasyn', 'smote_ratio': 0.450115458838772, 'resampling_k_neighbors': 2, 'cnn_channels': 16, 'cnn_kernel_size': 2, 'lstm_hidden_dim': 32, 'context_hidden_dim': 256, 'fusion_hidden_dim': 256, 'sequence_dropout': 0.26917444961169307, 'context_dropout': 0.14447089334815724, 'fusion_dropout': 0.24289745860027612}. Best is trial 55 with value: 0.8121442327638384.
2026-06-13 01:23:19,636 - preprocessing - INFO - xAPI engineered features created: ['engagement_score', 'absence_risk', 'parent_support_signal']
2026-06-13 01:23:19,638 - preprocessing - INFO - xAPI engineered features created: ['engagement_score', 'absence_risk', 'parent_support_signal']
2026-06-13 01:23:19,655 - preprocessing - INFO - Applying SMOTE on train set with ratio 0.3586961696503077...
2026-06-13 01:23:19,785 - preprocessing - INFO - Feature selection complete. Selected 15 / 19 features.
2026-06-13 01:23:28,667 - train_pipeline - INFO - Early stopping triggered at epoch 57
2026-06-13 01:23:28,686 - preprocessing - INFO - xAPI engineered features created: ['engagement_score', 'absence_risk', 'parent_support_signal']
2026-06-13 01:23:28,688 - preprocessing - INFO - xAPI engineered features created: ['engagement_score', 'absence_risk', 'parent_support_signal']
2026-06-13 01:23:28,705 - preprocessing - INFO - Applying SMOTE on train set with ratio 0.3586961696503077...
2026-06-13 01:23:28,830 - preprocessing - INFO - Feature selection complete. Selected 16 / 19 features.
2026-06-13 01:23:41,006 - preprocessing - INFO - xAPI engineered features created: ['engagement_score', 'absence_risk', 'parent_support_signal']
2026-06-13 01:23:41,009 - preprocessing - INFO - xAPI engineered features created: ['engagement_score', 'absence_risk', 'parent_support_signal']
2026-06-13 01:23:41,027 - preprocessing - INFO - Applying SMOTE on train set with ratio 0.3586961696503077...
2026-06-13 01:23:41,148 - preprocessing - INFO - Feature selection complete. Selected 18 / 19 features.
2026-06-13 01:23:46,857 - train_pipeline - INFO - Early stopping triggered at epoch 37
2026-06-13 01:23:46,877 - preprocessing - INFO - xAPI engineered features created: ['engagement_score', 'absence_risk', 'parent_support_signal']
2026-06-13 01:23:46,880 - preprocessing - INFO - xAPI engineered features created: ['engagement_score', 'absence_risk', 'parent_support_signal']
2026-06-13 01:23:46,898 - preprocessing - INFO - Applying SMOTE on train set with ratio 0.3586961696503077...
2026-06-13 01:23:47,017 - preprocessing - INFO - Feature selection complete. Selected 16 / 19 features.
2026-06-13 01:23:54,501 - train_pipeline - INFO - Early stopping triggered at epoch 48
2026-06-13 01:23:54,527 - preprocessing - INFO - xAPI engineered features created: ['engagement_score', 'absence_risk', 'parent_support_signal']
2026-06-13 01:23:54,531 - preprocessing - INFO - xAPI engineered features created: ['engagement_score', 'absence_risk', 'parent_support_signal']
2026-06-13 01:23:54,557 - preprocessing - INFO - Applying SMOTE on train set with ratio 0.3586961696503077...
2026-06-13 01:23:54,714 - preprocessing - INFO - Feature selection complete. Selected 18 / 19 features.
2026-06-13 01:23:59,165 - train_pipeline - INFO - Early stopping triggered at epoch 28
[I 2026-06-13 01:23:59,196] Trial 130 finished with value: 0.7974784385351216 and parameters: {'learning_rate': 0.0016934424636243363, 'weight_decay': 0.002481520752121899, 'batch_size': 16, 'oversample_method': 'smote', 'smote_ratio': 0.3586961696503077, 'resampling_k_neighbors': 2, 'cnn_channels': 16, 'cnn_kernel_size': 4, 'lstm_hidden_dim': 32, 'context_hidden_dim': 256, 'fusion_hidden_dim': 128, 'sequence_dropout': 0.10322156685904905, 'context_dropout': 0.2023088871531069, 'fusion_dropout': 0.18478729327048427}. Best is trial 55 with value: 0.8121442327638384.
2026-06-13 01:23:59,313 - preprocessing - INFO - xAPI engineered features created: ['engagement_score', 'absence_risk', 'parent_support_signal']
2026-06-13 01:23:59,316 - preprocessing - INFO - xAPI engineered features created: ['engagement_score', 'absence_risk', 'parent_support_signal']
2026-06-13 01:23:59,333 - preprocessing - INFO - Applying SMOTE on train set with ratio 0.7453624424297259...
2026-06-13 01:23:59,462 - preprocessing - INFO - Feature selection complete. Selected 16 / 19 features.
2026-06-13 01:24:17,865 - train_pipeline - INFO - Early stopping triggered at epoch 54
2026-06-13 01:24:17,882 - preprocessing - INFO - xAPI engineered features created: ['engagement_score', 'absence_risk', 'parent_support_signal']
2026-06-13 01:24:17,884 - preprocessing - INFO - xAPI engineered features created: ['engagement_score', 'absence_risk', 'parent_support_signal']
2026-06-13 01:24:17,902 - preprocessing - INFO - Applying SMOTE on train set with ratio 0.7453624424297259...
2026-06-13 01:24:18,032 - preprocessing - INFO - Feature selection complete. Selected 16 / 19 features.
2026-06-13 01:24:41,884 - train_pipeline - INFO - Early stopping triggered at epoch 70
2026-06-13 01:24:41,902 - preprocessing - INFO - xAPI engineered features created: ['engagement_score', 'absence_risk', 'parent_support_signal']
2026-06-13 01:24:41,904 - preprocessing - INFO - xAPI engineered features created: ['engagement_score', 'absence_risk', 'parent_support_signal']
2026-06-13 01:24:41,922 - preprocessing - INFO - Applying SMOTE on train set with ratio 0.7453624424297259...
2026-06-13 01:24:42,057 - preprocessing - INFO - Feature selection complete. Selected 18 / 19 features.
2026-06-13 01:25:00,349 - train_pipeline - INFO - Early stopping triggered at epoch 53
