[I 2026-06-13 01:17:35,565] Trial 111 finished with value: 0.791547207805963 and parameters: {'learning_rate': 0.0059856508743864395, 'weight_decay': 0.0007150125861566888, 'batch_size': 16, 'oversample_method': 'smote', 'smote_ratio': 0.8692092062525429, 'resampling_k_neighbors': 3, 'cnn_channels': 16, 'cnn_kernel_size': 2, 'lstm_hidden_dim': 96, 'context_hidden_dim': 64, 'fusion_hidden_dim': 64, 'sequence_dropout': 0.4072814705654855, 'context_dropout': 0.17757414949071448, 'fusion_dropout': 0.1708869980973946}. Best is trial 55 with value: 0.8121442327638384.
2026-06-13 01:17:35,682 - preprocessing - INFO - xAPI engineered features created: ['engagement_score', 'absence_risk', 'parent_support_signal']
2026-06-13 01:17:35,685 - preprocessing - INFO - xAPI engineered features created: ['engagement_score', 'absence_risk', 'parent_support_signal']
2026-06-13 01:17:35,704 - preprocessing - INFO - Applying ADASYN on train set with ratio 0.6695075188523246...
2026-06-13 01:17:35,711 - preprocessing - WARNING - ADASYN failed (likely too few samples). Error: No samples will be generated with the provided ratio settings.. Falling back to no oversampling.
2026-06-13 01:17:35,827 - preprocessing - INFO - Feature selection complete. Selected 15 / 19 features.
2026-06-13 01:17:37,257 - train_pipeline - INFO - Early stopping triggered at epoch 33
2026-06-13 01:17:37,275 - preprocessing - INFO - xAPI engineered features created: ['engagement_score', 'absence_risk', 'parent_support_signal']
2026-06-13 01:17:37,278 - preprocessing - INFO - xAPI engineered features created: ['engagement_score', 'absence_risk', 'parent_support_signal']
2026-06-13 01:17:37,295 - preprocessing - INFO - Applying ADASYN on train set with ratio 0.6695075188523246...
2026-06-13 01:17:37,302 - preprocessing - WARNING - ADASYN failed (likely too few samples). Error: No samples will be generated with the provided ratio settings.. Falling back to no oversampling.
2026-06-13 01:17:37,435 - preprocessing - INFO - Feature selection complete. Selected 16 / 19 features.
2026-06-13 01:17:39,513 - train_pipeline - INFO - Early stopping triggered at epoch 47
2026-06-13 01:17:39,531 - preprocessing - INFO - xAPI engineered features created: ['engagement_score', 'absence_risk', 'parent_support_signal']
2026-06-13 01:17:39,533 - preprocessing - INFO - xAPI engineered features created: ['engagement_score', 'absence_risk', 'parent_support_signal']
2026-06-13 01:17:39,550 - preprocessing - INFO - Applying ADASYN on train set with ratio 0.6695075188523246...
2026-06-13 01:17:39,557 - preprocessing - WARNING - ADASYN failed (likely too few samples). Error: No samples will be generated with the provided ratio settings.. Falling back to no oversampling.
2026-06-13 01:17:39,674 - preprocessing - INFO - Feature selection complete. Selected 18 / 19 features.
2026-06-13 01:17:41,267 - train_pipeline - INFO - Early stopping triggered at epoch 36
[I 2026-06-13 01:17:41,291] Trial 112 pruned. 
2026-06-13 01:17:41,410 - preprocessing - INFO - xAPI engineered features created: ['engagement_score', 'absence_risk', 'parent_support_signal']
2026-06-13 01:17:41,413 - preprocessing - INFO - xAPI engineered features created: ['engagement_score', 'absence_risk', 'parent_support_signal']
2026-06-13 01:17:41,429 - preprocessing - INFO - Applying SMOTE on train set with ratio 0.6309817393774689...
2026-06-13 01:17:41,555 - preprocessing - INFO - Feature selection complete. Selected 15 / 19 features.
2026-06-13 01:17:46,926 - train_pipeline - INFO - Early stopping triggered at epoch 33
2026-06-13 01:17:46,945 - preprocessing - INFO - xAPI engineered features created: ['engagement_score', 'absence_risk', 'parent_support_signal']
2026-06-13 01:17:46,948 - preprocessing - INFO - xAPI engineered features created: ['engagement_score', 'absence_risk', 'parent_support_signal']
2026-06-13 01:17:46,965 - preprocessing - INFO - Applying SMOTE on train set with ratio 0.6309817393774689...
2026-06-13 01:17:47,085 - preprocessing - INFO - Feature selection complete. Selected 16 / 19 features.
2026-06-13 01:17:52,216 - train_pipeline - INFO - Early stopping triggered at epoch 31
2026-06-13 01:17:52,234 - preprocessing - INFO - xAPI engineered features created: ['engagement_score', 'absence_risk', 'parent_support_signal']
2026-06-13 01:17:52,237 - preprocessing - INFO - xAPI engineered features created: ['engagement_score', 'absence_risk', 'parent_support_signal']
2026-06-13 01:17:52,255 - preprocessing - INFO - Applying SMOTE on train set with ratio 0.6309817393774689...
2026-06-13 01:17:52,374 - preprocessing - INFO - Feature selection complete. Selected 18 / 19 features.
2026-06-13 01:18:02,791 - train_pipeline - INFO - Early stopping triggered at epoch 63
[I 2026-06-13 01:18:02,815] Trial 113 pruned. 
2026-06-13 01:18:02,930 - preprocessing - INFO - xAPI engineered features created: ['engagement_score', 'absence_risk', 'parent_support_signal']
2026-06-13 01:18:02,932 - preprocessing - INFO - xAPI engineered features created: ['engagement_score', 'absence_risk', 'parent_support_signal']
2026-06-13 01:18:02,949 - preprocessing - INFO - Applying SMOTE on train set with ratio 0.7487714072612132...
2026-06-13 01:18:03,076 - preprocessing - INFO - Feature selection complete. Selected 18 / 19 features.
2026-06-13 01:18:09,726 - train_pipeline - INFO - Early stopping triggered at epoch 43
2026-06-13 01:18:09,747 - preprocessing - INFO - xAPI engineered features created: ['engagement_score', 'absence_risk', 'parent_support_signal']
2026-06-13 01:18:09,750 - preprocessing - INFO - xAPI engineered features created: ['engagement_score', 'absence_risk', 'parent_support_signal']
2026-06-13 01:18:09,786 - preprocessing - INFO - Applying SMOTE on train set with ratio 0.7487714072612132...
2026-06-13 01:18:09,979 - preprocessing - INFO - Feature selection complete. Selected 16 / 19 features.
2026-06-13 01:18:19,060 - train_pipeline - INFO - Early stopping triggered at epoch 58
2026-06-13 01:18:19,077 - preprocessing - INFO - xAPI engineered features created: ['engagement_score', 'absence_risk', 'parent_support_signal']
2026-06-13 01:18:19,080 - preprocessing - INFO - xAPI engineered features created: ['engagement_score', 'absence_risk', 'parent_support_signal']
2026-06-13 01:18:19,098 - preprocessing - INFO - Applying SMOTE on train set with ratio 0.7487714072612132...
2026-06-13 01:18:19,228 - preprocessing - INFO - Feature selection complete. Selected 18 / 19 features.
2026-06-13 01:18:24,427 - train_pipeline - INFO - Early stopping triggered at epoch 33
2026-06-13 01:18:24,445 - preprocessing - INFO - xAPI engineered features created: ['engagement_score', 'absence_risk', 'parent_support_signal']
2026-06-13 01:18:24,447 - preprocessing - INFO - xAPI engineered features created: ['engagement_score', 'absence_risk', 'parent_support_signal']
2026-06-13 01:18:24,465 - preprocessing - INFO - Applying SMOTE on train set with ratio 0.7487714072612132...
2026-06-13 01:18:24,591 - preprocessing - INFO - Feature selection complete. Selected 16 / 19 features.
2026-06-13 01:18:33,066 - train_pipeline - INFO - Early stopping triggered at epoch 53
2026-06-13 01:18:33,086 - preprocessing - INFO - xAPI engineered features created: ['engagement_score', 'absence_risk', 'parent_support_signal']
2026-06-13 01:18:33,089 - preprocessing - INFO - xAPI engineered features created: ['engagement_score', 'absence_risk', 'parent_support_signal']
2026-06-13 01:18:33,107 - preprocessing - INFO - Applying SMOTE on train set with ratio 0.7487714072612132...
2026-06-13 01:18:33,231 - preprocessing - INFO - Feature selection complete. Selected 18 / 19 features.
2026-06-13 01:18:44,054 - train_pipeline - INFO - Early stopping triggered at epoch 69
[I 2026-06-13 01:18:44,082] Trial 114 finished with value: 0.800192966622389 and parameters: {'learning_rate': 0.018491744734315183, 'weight_decay': 0.0013508476338842477, 'batch_size': 16, 'oversample_method': 'smote', 'smote_ratio': 0.7487714072612132, 'resampling_k_neighbors': 2, 'cnn_channels': 16, 'cnn_kernel_size': 2, 'lstm_hidden_dim': 32, 'context_hidden_dim': 64, 'fusion_hidden_dim': 128, 'sequence_dropout': 0.3714257632940521, 'context_dropout': 0.186575219033688, 'fusion_dropout': 0.19881551563999866}. Best is trial 55 with value: 0.8121442327638384.
2026-06-13 01:18:44,198 - preprocessing - INFO - xAPI engineered features created: ['engagement_score', 'absence_risk', 'parent_support_signal']
2026-06-13 01:18:44,201 - preprocessing - INFO - xAPI engineered features created: ['engagement_score', 'absence_risk', 'parent_support_signal']
2026-06-13 01:18:44,219 - preprocessing - INFO - Applying ADASYN on train set with ratio 0.6331005994440468...
2026-06-13 01:18:44,226 - preprocessing - WARNING - ADASYN failed (likely too few samples). Error: No samples will be generated with the provided ratio settings.. Falling back to no oversampling.
2026-06-13 01:18:44,339 - preprocessing - INFO - Feature selection complete. Selected 15 / 19 features.
2026-06-13 01:18:47,485 - train_pipeline - INFO - Early stopping triggered at epoch 49
2026-06-13 01:18:47,508 - preprocessing - INFO - xAPI engineered features created: ['engagement_score', 'absence_risk', 'parent_support_signal']
2026-06-13 01:18:47,511 - preprocessing - INFO - xAPI engineered features created: ['engagement_score', 'absence_risk', 'parent_support_signal']
2026-06-13 01:18:47,543 - preprocessing - INFO - Applying ADASYN on train set with ratio 0.6331005994440468...
2026-06-13 01:18:47,554 - preprocessing - WARNING - ADASYN failed (likely too few samples). Error: No samples will be generated with the provided ratio settings.. Falling back to no oversampling.
2026-06-13 01:18:47,722 - preprocessing - INFO - Feature selection complete. Selected 16 / 19 features.
2026-06-13 01:18:51,154 - train_pipeline - INFO - Early stopping triggered at epoch 54
2026-06-13 01:18:51,182 - preprocessing - INFO - xAPI engineered features created: ['engagement_score', 'absence_risk', 'parent_support_signal']
2026-06-13 01:18:51,185 - preprocessing - INFO - xAPI engineered features created: ['engagement_score', 'absence_risk', 'parent_support_signal']
2026-06-13 01:18:51,214 - preprocessing - INFO - Applying ADASYN on train set with ratio 0.6331005994440468...
2026-06-13 01:18:51,223 - preprocessing - WARNING - ADASYN failed (likely too few samples). Error: No samples will be generated with the provided ratio settings.. Falling back to no oversampling.
2026-06-13 01:18:51,387 - preprocessing - INFO - Feature selection complete. Selected 18 / 19 features.
2026-06-13 01:18:53,532 - train_pipeline - INFO - Early stopping triggered at epoch 33
[I 2026-06-13 01:18:53,556] Trial 115 pruned. 
2026-06-13 01:18:53,671 - preprocessing - INFO - xAPI engineered features created: ['engagement_score', 'absence_risk', 'parent_support_signal']
2026-06-13 01:18:53,674 - preprocessing - INFO - xAPI engineered features created: ['engagement_score', 'absence_risk', 'parent_support_signal']
2026-06-13 01:18:53,693 - preprocessing - INFO - Applying SMOTE on train set with ratio 0.6196968916373916...
2026-06-13 01:18:53,816 - preprocessing - INFO - Feature selection complete. Selected 15 / 19 features.
2026-06-13 01:18:55,933 - train_pipeline - INFO - Early stopping triggered at epoch 37
2026-06-13 01:18:55,953 - preprocessing - INFO - xAPI engineered features created: ['engagement_score', 'absence_risk', 'parent_support_signal']
2026-06-13 01:18:55,955 - preprocessing - INFO - xAPI engineered features created: ['engagement_score', 'absence_risk', 'parent_support_signal']
2026-06-13 01:18:55,973 - preprocessing - INFO - Applying SMOTE on train set with ratio 0.6196968916373916...
2026-06-13 01:18:56,097 - preprocessing - INFO - Feature selection complete. Selected 16 / 19 features.
2026-06-13 01:18:58,379 - train_pipeline - INFO - Early stopping triggered at epoch 40
2026-06-13 01:18:58,397 - preprocessing - INFO - xAPI engineered features created: ['engagement_score', 'absence_risk', 'parent_support_signal']
2026-06-13 01:18:58,399 - preprocessing - INFO - xAPI engineered features created: ['engagement_score', 'absence_risk', 'parent_support_signal']
2026-06-13 01:18:58,416 - preprocessing - INFO - Applying SMOTE on train set with ratio 0.6196968916373916...
2026-06-13 01:18:58,543 - preprocessing - INFO - Feature selection complete. Selected 18 / 19 features.
2026-06-13 01:19:01,014 - train_pipeline - INFO - Early stopping triggered at epoch 36
2026-06-13 01:19:01,032 - preprocessing - INFO - xAPI engineered features created: ['engagement_score', 'absence_risk', 'parent_support_signal']
2026-06-13 01:19:01,035 - preprocessing - INFO - xAPI engineered features created: ['engagement_score', 'absence_risk', 'parent_support_signal']
2026-06-13 01:19:01,052 - preprocessing - INFO - Applying SMOTE on train set with ratio 0.6196968916373916...
2026-06-13 01:19:01,174 - preprocessing - INFO - Feature selection complete. Selected 16 / 19 features.
2026-06-13 01:19:03,459 - train_pipeline - INFO - Early stopping triggered at epoch 40
2026-06-13 01:19:03,478 - preprocessing - INFO - xAPI engineered features created: ['engagement_score', 'absence_risk', 'parent_support_signal']
2026-06-13 01:19:03,480 - preprocessing - INFO - xAPI engineered features created: ['engagement_score', 'absence_risk', 'parent_support_signal']
2026-06-13 01:19:03,499 - preprocessing - INFO - Applying SMOTE on train set with ratio 0.6196968916373916...
2026-06-13 01:19:03,619 - preprocessing - INFO - Feature selection complete. Selected 17 / 19 features.
2026-06-13 01:19:06,283 - train_pipeline - INFO - Early stopping triggered at epoch 39
[I 2026-06-13 01:19:06,313] Trial 116 finished with value: 0.8045502863740948 and parameters: {'learning_rate': 0.015539354464245881, 'weight_decay': 0.001186546006040387, 'batch_size': 64, 'oversample_method': 'smote', 'smote_ratio': 0.6196968916373916, 'resampling_k_neighbors': 2, 'cnn_channels': 16, 'cnn_kernel_size': 3, 'lstm_hidden_dim': 128, 'context_hidden_dim': 256, 'fusion_hidden_dim': 256, 'sequence_dropout': 0.2433422485934858, 'context_dropout': 0.10837194325406307, 'fusion_dropout': 0.20195955925532394}. Best is trial 55 with value: 0.8121442327638384.
2026-06-13 01:19:06,428 - preprocessing - INFO - xAPI engineered features created: ['engagement_score', 'absence_risk', 'parent_support_signal']
2026-06-13 01:19:06,430 - preprocessing - INFO - xAPI engineered features created: ['engagement_score', 'absence_risk', 'parent_support_signal']
2026-06-13 01:19:06,447 - preprocessing - INFO - Applying SMOTE on train set with ratio 0.5679717175044875...
2026-06-13 01:19:06,566 - preprocessing - INFO - Feature selection complete. Selected 15 / 19 features.
2026-06-13 01:19:13,810 - train_pipeline - INFO - Early stopping triggered at epoch 45
2026-06-13 01:19:13,834 - preprocessing - INFO - xAPI engineered features created: ['engagement_score', 'absence_risk', 'parent_support_signal']
2026-06-13 01:19:13,838 - preprocessing - INFO - xAPI engineered features created: ['engagement_score', 'absence_risk', 'parent_support_signal']
2026-06-13 01:19:13,867 - preprocessing - INFO - Applying SMOTE on train set with ratio 0.5679717175044875...
2026-06-13 01:19:14,042 - preprocessing - INFO - Feature selection complete. Selected 16 / 19 features.
2026-06-13 01:19:23,735 - train_pipeline - INFO - Early stopping triggered at epoch 59
2026-06-13 01:19:23,753 - preprocessing - INFO - xAPI engineered features created: ['engagement_score', 'absence_risk', 'parent_support_signal']
2026-06-13 01:19:23,756 - preprocessing - INFO - xAPI engineered features created: ['engagement_score', 'absence_risk', 'parent_support_signal']
2026-06-13 01:19:23,776 - preprocessing - INFO - Applying SMOTE on train set with ratio 0.5679717175044875...
2026-06-13 01:19:23,895 - preprocessing - INFO - Feature selection complete. Selected 18 / 19 features.
2026-06-13 01:19:30,816 - train_pipeline - INFO - Early stopping triggered at epoch 42
[I 2026-06-13 01:19:30,850] Trial 117 pruned. 
2026-06-13 01:19:31,005 - preprocessing - INFO - xAPI engineered features created: ['engagement_score', 'absence_risk', 'parent_support_signal']
2026-06-13 01:19:31,009 - preprocessing - INFO - xAPI engineered features created: ['engagement_score', 'absence_risk', 'parent_support_signal']
2026-06-13 01:19:31,035 - preprocessing - INFO - Applying SMOTE on train set with ratio 0.5811219370971876...
2026-06-13 01:19:31,190 - preprocessing - INFO - Feature selection complete. Selected 15 / 19 features.
2026-06-13 01:19:37,869 - train_pipeline - INFO - Early stopping triggered at epoch 73
2026-06-13 01:19:37,886 - preprocessing - INFO - xAPI engineered features created: ['engagement_score', 'absence_risk', 'parent_support_signal']
2026-06-13 01:19:37,889 - preprocessing - INFO - xAPI engineered features created: ['engagement_score', 'absence_risk', 'parent_support_signal']
2026-06-13 01:19:37,906 - preprocessing - INFO - Applying SMOTE on train set with ratio 0.5811219370971876...
2026-06-13 01:19:38,028 - preprocessing - INFO - Feature selection complete. Selected 16 / 19 features.
2026-06-13 01:19:41,748 - train_pipeline - INFO - Early stopping triggered at epoch 41
2026-06-13 01:19:41,769 - preprocessing - INFO - xAPI engineered features created: ['engagement_score', 'absence_risk', 'parent_support_signal']
2026-06-13 01:19:41,772 - preprocessing - INFO - xAPI engineered features created: ['engagement_score', 'absence_risk', 'parent_support_signal']
2026-06-13 01:19:41,793 - preprocessing - INFO - Applying SMOTE on train set with ratio 0.5811219370971876...
2026-06-13 01:19:41,943 - preprocessing - INFO - Feature selection complete. Selected 18 / 19 features.
2026-06-13 01:19:45,892 - train_pipeline - INFO - Early stopping triggered at epoch 43
2026-06-13 01:19:45,916 - preprocessing - INFO - xAPI engineered features created: ['engagement_score', 'absence_risk', 'parent_support_signal']
2026-06-13 01:19:45,918 - preprocessing - INFO - xAPI engineered features created: ['engagement_score', 'absence_risk', 'parent_support_signal']
2026-06-13 01:19:45,943 - preprocessing - INFO - Applying SMOTE on train set with ratio 0.5811219370971876...
2026-06-13 01:19:46,085 - preprocessing - INFO - Feature selection complete. Selected 16 / 19 features.
2026-06-13 01:19:49,901 - train_pipeline - INFO - Early stopping triggered at epoch 42
2026-06-13 01:19:49,920 - preprocessing - INFO - xAPI engineered features created: ['engagement_score', 'absence_risk', 'parent_support_signal']
2026-06-13 01:19:49,923 - preprocessing - INFO - xAPI engineered features created: ['engagement_score', 'absence_risk', 'parent_support_signal']
2026-06-13 01:19:49,945 - preprocessing - INFO - Applying SMOTE on train set with ratio 0.5811219370971876...
2026-06-13 01:19:50,084 - preprocessing - INFO - Feature selection complete. Selected 18 / 19 features.
2026-06-13 01:19:53,530 - train_pipeline - INFO - Early stopping triggered at epoch 41
