[I 2026-06-13 01:01:49,289] Trial 79 pruned. 
2026-06-13 01:01:49,433 - preprocessing - INFO - xAPI engineered features created: ['engagement_score', 'absence_risk', 'parent_support_signal']
2026-06-13 01:01:49,435 - preprocessing - INFO - xAPI engineered features created: ['engagement_score', 'absence_risk', 'parent_support_signal']
2026-06-13 01:01:49,460 - preprocessing - INFO - Applying SMOTE on train set with ratio 0.6236312727741375...
2026-06-13 01:01:49,618 - preprocessing - INFO - Feature selection complete. Selected 15 / 19 features.
2026-06-13 01:01:51,552 - train_pipeline - INFO - Early stopping triggered at epoch 35
2026-06-13 01:01:51,569 - preprocessing - INFO - xAPI engineered features created: ['engagement_score', 'absence_risk', 'parent_support_signal']
2026-06-13 01:01:51,571 - preprocessing - INFO - xAPI engineered features created: ['engagement_score', 'absence_risk', 'parent_support_signal']
2026-06-13 01:01:51,589 - preprocessing - INFO - Applying SMOTE on train set with ratio 0.6236312727741375...
2026-06-13 01:01:51,711 - preprocessing - INFO - Feature selection complete. Selected 16 / 19 features.
2026-06-13 01:01:53,218 - train_pipeline - INFO - Early stopping triggered at epoch 29
2026-06-13 01:01:53,236 - preprocessing - INFO - xAPI engineered features created: ['engagement_score', 'absence_risk', 'parent_support_signal']
2026-06-13 01:01:53,238 - preprocessing - INFO - xAPI engineered features created: ['engagement_score', 'absence_risk', 'parent_support_signal']
2026-06-13 01:01:53,256 - preprocessing - INFO - Applying SMOTE on train set with ratio 0.6236312727741375...
2026-06-13 01:01:53,377 - preprocessing - INFO - Feature selection complete. Selected 18 / 19 features.
2026-06-13 01:01:55,049 - train_pipeline - INFO - Early stopping triggered at epoch 32
2026-06-13 01:01:55,067 - preprocessing - INFO - xAPI engineered features created: ['engagement_score', 'absence_risk', 'parent_support_signal']
2026-06-13 01:01:55,070 - preprocessing - INFO - xAPI engineered features created: ['engagement_score', 'absence_risk', 'parent_support_signal']
2026-06-13 01:01:55,088 - preprocessing - INFO - Applying SMOTE on train set with ratio 0.6236312727741375...
2026-06-13 01:01:55,329 - preprocessing - INFO - Feature selection complete. Selected 16 / 19 features.
2026-06-13 01:01:57,713 - train_pipeline - INFO - Early stopping triggered at epoch 46
2026-06-13 01:01:57,730 - preprocessing - INFO - xAPI engineered features created: ['engagement_score', 'absence_risk', 'parent_support_signal']
2026-06-13 01:01:57,732 - preprocessing - INFO - xAPI engineered features created: ['engagement_score', 'absence_risk', 'parent_support_signal']
2026-06-13 01:01:57,758 - preprocessing - INFO - Applying SMOTE on train set with ratio 0.6236312727741375...
2026-06-13 01:01:57,938 - preprocessing - INFO - Feature selection complete. Selected 18 / 19 features.
2026-06-13 01:02:01,246 - train_pipeline - INFO - Early stopping triggered at epoch 57
[I 2026-06-13 01:02:01,275] Trial 80 finished with value: 0.7939889882767014 and parameters: {'learning_rate': 0.00499282361250908, 'weight_decay': 0.0001338104435523877, 'batch_size': 64, 'oversample_method': 'smote', 'smote_ratio': 0.6236312727741375, 'resampling_k_neighbors': 5, 'cnn_channels': 128, 'cnn_kernel_size': 3, 'lstm_hidden_dim': 64, 'context_hidden_dim': 128, 'fusion_hidden_dim': 128, 'sequence_dropout': 0.2876073789514479, 'context_dropout': 0.2994271421819172, 'fusion_dropout': 0.5128939849193125}. Best is trial 55 with value: 0.8121442327638384.
2026-06-13 01:02:01,388 - preprocessing - INFO - xAPI engineered features created: ['engagement_score', 'absence_risk', 'parent_support_signal']
2026-06-13 01:02:01,391 - preprocessing - INFO - xAPI engineered features created: ['engagement_score', 'absence_risk', 'parent_support_signal']
2026-06-13 01:02:01,408 - preprocessing - INFO - Applying ADASYN on train set with ratio 0.4913108808712919...
2026-06-13 01:02:01,526 - preprocessing - INFO - Feature selection complete. Selected 15 / 19 features.
2026-06-13 01:02:07,422 - train_pipeline - INFO - Early stopping triggered at epoch 54
2026-06-13 01:02:07,440 - preprocessing - INFO - xAPI engineered features created: ['engagement_score', 'absence_risk', 'parent_support_signal']
2026-06-13 01:02:07,443 - preprocessing - INFO - xAPI engineered features created: ['engagement_score', 'absence_risk', 'parent_support_signal']
2026-06-13 01:02:07,462 - preprocessing - INFO - Applying ADASYN on train set with ratio 0.4913108808712919...
2026-06-13 01:02:07,579 - preprocessing - INFO - Feature selection complete. Selected 16 / 19 features.
2026-06-13 01:02:12,493 - train_pipeline - INFO - Early stopping triggered at epoch 47
2026-06-13 01:02:12,512 - preprocessing - INFO - xAPI engineered features created: ['engagement_score', 'absence_risk', 'parent_support_signal']
2026-06-13 01:02:12,515 - preprocessing - INFO - xAPI engineered features created: ['engagement_score', 'absence_risk', 'parent_support_signal']
2026-06-13 01:02:12,533 - preprocessing - INFO - Applying ADASYN on train set with ratio 0.4913108808712919...
2026-06-13 01:02:12,653 - preprocessing - INFO - Feature selection complete. Selected 18 / 19 features.
2026-06-13 01:02:18,631 - train_pipeline - INFO - Early stopping triggered at epoch 58
2026-06-13 01:02:18,649 - preprocessing - INFO - xAPI engineered features created: ['engagement_score', 'absence_risk', 'parent_support_signal']
2026-06-13 01:02:18,651 - preprocessing - INFO - xAPI engineered features created: ['engagement_score', 'absence_risk', 'parent_support_signal']
2026-06-13 01:02:18,668 - preprocessing - INFO - Applying ADASYN on train set with ratio 0.4913108808712919...
2026-06-13 01:02:18,786 - preprocessing - INFO - Feature selection complete. Selected 16 / 19 features.
2026-06-13 01:02:27,222 - preprocessing - INFO - xAPI engineered features created: ['engagement_score', 'absence_risk', 'parent_support_signal']
2026-06-13 01:02:27,224 - preprocessing - INFO - xAPI engineered features created: ['engagement_score', 'absence_risk', 'parent_support_signal']
2026-06-13 01:02:27,241 - preprocessing - INFO - Applying ADASYN on train set with ratio 0.4913108808712919...
2026-06-13 01:02:27,362 - preprocessing - INFO - Feature selection complete. Selected 18 / 19 features.
2026-06-13 01:02:32,259 - train_pipeline - INFO - Early stopping triggered at epoch 47
[I 2026-06-13 01:02:32,289] Trial 81 finished with value: 0.8084125326799219 and parameters: {'learning_rate': 0.0061108845595269305, 'weight_decay': 0.005721800504902731, 'batch_size': 32, 'oversample_method': 'adasyn', 'smote_ratio': 0.4913108808712919, 'resampling_k_neighbors': 3, 'cnn_channels': 32, 'cnn_kernel_size': 3, 'lstm_hidden_dim': 128, 'context_hidden_dim': 128, 'fusion_hidden_dim': 256, 'sequence_dropout': 0.33476345724532336, 'context_dropout': 0.2054474819323954, 'fusion_dropout': 0.1325615929303238}. Best is trial 55 with value: 0.8121442327638384.
2026-06-13 01:02:32,406 - preprocessing - INFO - xAPI engineered features created: ['engagement_score', 'absence_risk', 'parent_support_signal']
2026-06-13 01:02:32,408 - preprocessing - INFO - xAPI engineered features created: ['engagement_score', 'absence_risk', 'parent_support_signal']
2026-06-13 01:02:32,425 - preprocessing - INFO - Applying ADASYN on train set with ratio 0.3884707415921916...
2026-06-13 01:02:32,542 - preprocessing - INFO - Feature selection complete. Selected 15 / 19 features.
2026-06-13 01:02:35,015 - train_pipeline - INFO - Early stopping triggered at epoch 29
2026-06-13 01:02:35,033 - preprocessing - INFO - xAPI engineered features created: ['engagement_score', 'absence_risk', 'parent_support_signal']
2026-06-13 01:02:35,035 - preprocessing - INFO - xAPI engineered features created: ['engagement_score', 'absence_risk', 'parent_support_signal']
2026-06-13 01:02:35,053 - preprocessing - INFO - Applying ADASYN on train set with ratio 0.3884707415921916...
2026-06-13 01:02:35,176 - preprocessing - INFO - Feature selection complete. Selected 16 / 19 features.
2026-06-13 01:02:42,589 - preprocessing - INFO - xAPI engineered features created: ['engagement_score', 'absence_risk', 'parent_support_signal']
2026-06-13 01:02:42,592 - preprocessing - INFO - xAPI engineered features created: ['engagement_score', 'absence_risk', 'parent_support_signal']
2026-06-13 01:02:42,622 - preprocessing - INFO - Applying ADASYN on train set with ratio 0.3884707415921916...
2026-06-13 01:02:42,784 - preprocessing - INFO - Feature selection complete. Selected 18 / 19 features.
2026-06-13 01:02:45,864 - train_pipeline - INFO - Early stopping triggered at epoch 35
2026-06-13 01:02:45,891 - preprocessing - INFO - xAPI engineered features created: ['engagement_score', 'absence_risk', 'parent_support_signal']
2026-06-13 01:02:45,894 - preprocessing - INFO - xAPI engineered features created: ['engagement_score', 'absence_risk', 'parent_support_signal']
2026-06-13 01:02:45,927 - preprocessing - INFO - Applying ADASYN on train set with ratio 0.3884707415921916...
2026-06-13 01:02:46,108 - preprocessing - INFO - Feature selection complete. Selected 16 / 19 features.
2026-06-13 01:02:50,812 - train_pipeline - INFO - Early stopping triggered at epoch 49
2026-06-13 01:02:50,833 - preprocessing - INFO - xAPI engineered features created: ['engagement_score', 'absence_risk', 'parent_support_signal']
2026-06-13 01:02:50,836 - preprocessing - INFO - xAPI engineered features created: ['engagement_score', 'absence_risk', 'parent_support_signal']
2026-06-13 01:02:50,860 - preprocessing - INFO - Applying ADASYN on train set with ratio 0.3884707415921916...
2026-06-13 01:02:51,016 - preprocessing - INFO - Feature selection complete. Selected 18 / 19 features.
2026-06-13 01:02:56,415 - train_pipeline - INFO - Early stopping triggered at epoch 59
[I 2026-06-13 01:02:56,443] Trial 82 finished with value: 0.8011711209343723 and parameters: {'learning_rate': 0.002807901745232112, 'weight_decay': 0.002250367325871826, 'batch_size': 32, 'oversample_method': 'adasyn', 'smote_ratio': 0.3884707415921916, 'resampling_k_neighbors': 4, 'cnn_channels': 32, 'cnn_kernel_size': 2, 'lstm_hidden_dim': 64, 'context_hidden_dim': 128, 'fusion_hidden_dim': 256, 'sequence_dropout': 0.1920701821999059, 'context_dropout': 0.2556857083300881, 'fusion_dropout': 0.15191317499394452}. Best is trial 55 with value: 0.8121442327638384.
2026-06-13 01:02:56,565 - preprocessing - INFO - xAPI engineered features created: ['engagement_score', 'absence_risk', 'parent_support_signal']
2026-06-13 01:02:56,567 - preprocessing - INFO - xAPI engineered features created: ['engagement_score', 'absence_risk', 'parent_support_signal']
2026-06-13 01:02:56,585 - preprocessing - INFO - Applying SMOTE on train set with ratio 0.6929324445344536...
2026-06-13 01:02:56,707 - preprocessing - INFO - Feature selection complete. Selected 17 / 19 features.
2026-06-13 01:02:59,022 - train_pipeline - INFO - Early stopping triggered at epoch 36
2026-06-13 01:02:59,039 - preprocessing - INFO - xAPI engineered features created: ['engagement_score', 'absence_risk', 'parent_support_signal']
2026-06-13 01:02:59,042 - preprocessing - INFO - xAPI engineered features created: ['engagement_score', 'absence_risk', 'parent_support_signal']
2026-06-13 01:02:59,060 - preprocessing - INFO - Applying SMOTE on train set with ratio 0.6929324445344536...
2026-06-13 01:02:59,187 - preprocessing - INFO - Feature selection complete. Selected 15 / 19 features.
2026-06-13 01:03:03,259 - train_pipeline - INFO - Early stopping triggered at epoch 57
2026-06-13 01:03:03,277 - preprocessing - INFO - xAPI engineered features created: ['engagement_score', 'absence_risk', 'parent_support_signal']
2026-06-13 01:03:03,280 - preprocessing - INFO - xAPI engineered features created: ['engagement_score', 'absence_risk', 'parent_support_signal']
2026-06-13 01:03:03,297 - preprocessing - INFO - Applying SMOTE on train set with ratio 0.6929324445344536...
2026-06-13 01:03:03,425 - preprocessing - INFO - Feature selection complete. Selected 18 / 19 features.
2026-06-13 01:03:06,226 - train_pipeline - INFO - Early stopping triggered at epoch 43
2026-06-13 01:03:06,244 - preprocessing - INFO - xAPI engineered features created: ['engagement_score', 'absence_risk', 'parent_support_signal']
2026-06-13 01:03:06,247 - preprocessing - INFO - xAPI engineered features created: ['engagement_score', 'absence_risk', 'parent_support_signal']
2026-06-13 01:03:06,266 - preprocessing - INFO - Applying SMOTE on train set with ratio 0.6929324445344536...
2026-06-13 01:03:06,391 - preprocessing - INFO - Feature selection complete. Selected 16 / 19 features.
2026-06-13 01:03:10,686 - train_pipeline - INFO - Early stopping triggered at epoch 61
2026-06-13 01:03:10,706 - preprocessing - INFO - xAPI engineered features created: ['engagement_score', 'absence_risk', 'parent_support_signal']
2026-06-13 01:03:10,708 - preprocessing - INFO - xAPI engineered features created: ['engagement_score', 'absence_risk', 'parent_support_signal']
2026-06-13 01:03:10,727 - preprocessing - INFO - Applying SMOTE on train set with ratio 0.6929324445344536...
2026-06-13 01:03:10,919 - preprocessing - INFO - Feature selection complete. Selected 18 / 19 features.
2026-06-13 01:03:15,028 - train_pipeline - INFO - Early stopping triggered at epoch 57
[I 2026-06-13 01:03:15,072] Trial 83 finished with value: 0.798460556234964 and parameters: {'learning_rate': 0.005062183045456794, 'weight_decay': 0.0014927157186892042, 'batch_size': 64, 'oversample_method': 'smote', 'smote_ratio': 0.6929324445344536, 'resampling_k_neighbors': 2, 'cnn_channels': 32, 'cnn_kernel_size': 3, 'lstm_hidden_dim': 128, 'context_hidden_dim': 128, 'fusion_hidden_dim': 32, 'sequence_dropout': 0.17318903522337342, 'context_dropout': 0.12813691327077717, 'fusion_dropout': 0.17686566181380114}. Best is trial 55 with value: 0.8121442327638384.
2026-06-13 01:03:15,219 - preprocessing - INFO - xAPI engineered features created: ['engagement_score', 'absence_risk', 'parent_support_signal']
2026-06-13 01:03:15,222 - preprocessing - INFO - xAPI engineered features created: ['engagement_score', 'absence_risk', 'parent_support_signal']
2026-06-13 01:03:15,253 - preprocessing - INFO - Applying ADASYN on train set with ratio 0.5856909613189732...
2026-06-13 01:03:15,393 - preprocessing - INFO - Feature selection complete. Selected 15 / 19 features.
2026-06-13 01:03:18,413 - train_pipeline - INFO - Early stopping triggered at epoch 30
2026-06-13 01:03:18,430 - preprocessing - INFO - xAPI engineered features created: ['engagement_score', 'absence_risk', 'parent_support_signal']
2026-06-13 01:03:18,432 - preprocessing - INFO - xAPI engineered features created: ['engagement_score', 'absence_risk', 'parent_support_signal']
2026-06-13 01:03:18,451 - preprocessing - INFO - Applying ADASYN on train set with ratio 0.5856909613189732...
2026-06-13 01:03:18,571 - preprocessing - INFO - Feature selection complete. Selected 16 / 19 features.
2026-06-13 01:03:22,301 - train_pipeline - INFO - Early stopping triggered at epoch 35
2026-06-13 01:03:22,320 - preprocessing - INFO - xAPI engineered features created: ['engagement_score', 'absence_risk', 'parent_support_signal']
2026-06-13 01:03:22,322 - preprocessing - INFO - xAPI engineered features created: ['engagement_score', 'absence_risk', 'parent_support_signal']
2026-06-13 01:03:22,341 - preprocessing - INFO - Applying ADASYN on train set with ratio 0.5856909613189732...
2026-06-13 01:03:22,457 - preprocessing - INFO - Feature selection complete. Selected 18 / 19 features.
2026-06-13 01:03:26,181 - train_pipeline - INFO - Early stopping triggered at epoch 35
[I 2026-06-13 01:03:26,206] Trial 84 pruned. 
2026-06-13 01:03:26,321 - preprocessing - INFO - xAPI engineered features created: ['engagement_score', 'absence_risk', 'parent_support_signal']
2026-06-13 01:03:26,322 - preprocessing - INFO - xAPI engineered features created: ['engagement_score', 'absence_risk', 'parent_support_signal']
2026-06-13 01:03:26,342 - preprocessing - INFO - Applying SMOTE on train set with ratio 0.4501169436569078...
2026-06-13 01:03:26,461 - preprocessing - INFO - Feature selection complete. Selected 15 / 19 features.
2026-06-13 01:03:29,019 - train_pipeline - INFO - Early stopping triggered at epoch 48
2026-06-13 01:03:29,036 - preprocessing - INFO - xAPI engineered features created: ['engagement_score', 'absence_risk', 'parent_support_signal']
2026-06-13 01:03:29,039 - preprocessing - INFO - xAPI engineered features created: ['engagement_score', 'absence_risk', 'parent_support_signal']
2026-06-13 01:03:29,057 - preprocessing - INFO - Applying SMOTE on train set with ratio 0.4501169436569078...
2026-06-13 01:03:29,181 - preprocessing - INFO - Feature selection complete. Selected 16 / 19 features.
2026-06-13 01:03:33,007 - train_pipeline - INFO - Early stopping triggered at epoch 76
2026-06-13 01:03:33,029 - preprocessing - INFO - xAPI engineered features created: ['engagement_score', 'absence_risk', 'parent_support_signal']
2026-06-13 01:03:33,032 - preprocessing - INFO - xAPI engineered features created: ['engagement_score', 'absence_risk', 'parent_support_signal']
2026-06-13 01:03:33,056 - preprocessing - INFO - Applying SMOTE on train set with ratio 0.4501169436569078...
2026-06-13 01:03:33,192 - preprocessing - INFO - Feature selection complete. Selected 18 / 19 features.
2026-06-13 01:03:34,630 - train_pipeline - INFO - Early stopping triggered at epoch 31
2026-06-13 01:03:34,649 - preprocessing - INFO - xAPI engineered features created: ['engagement_score', 'absence_risk', 'parent_support_signal']
2026-06-13 01:03:34,652 - preprocessing - INFO - xAPI engineered features created: ['engagement_score', 'absence_risk', 'parent_support_signal']
2026-06-13 01:03:34,670 - preprocessing - INFO - Applying SMOTE on train set with ratio 0.4501169436569078...
2026-06-13 01:03:34,789 - preprocessing - INFO - Feature selection complete. Selected 16 / 19 features.
2026-06-13 01:03:37,156 - train_pipeline - INFO - Early stopping triggered at epoch 52
2026-06-13 01:03:37,173 - preprocessing - INFO - xAPI engineered features created: ['engagement_score', 'absence_risk', 'parent_support_signal']
2026-06-13 01:03:37,175 - preprocessing - INFO - xAPI engineered features created: ['engagement_score', 'absence_risk', 'parent_support_signal']
2026-06-13 01:03:37,195 - preprocessing - INFO - Applying SMOTE on train set with ratio 0.4501169436569078...
2026-06-13 01:03:37,310 - preprocessing - INFO - Feature selection complete. Selected 18 / 19 features.
2026-06-13 01:03:40,034 - train_pipeline - INFO - Early stopping triggered at epoch 57
