[I 2026-06-13 00:56:58,831] Trial 66 finished with value: 0.7970830105181196 and parameters: {'learning_rate': 0.009321052010697703, 'weight_decay': 0.006815036851309169, 'batch_size': 64, 'oversample_method': 'smote', 'smote_ratio': 0.7132233848464314, 'resampling_k_neighbors': 3, 'cnn_channels': 128, 'cnn_kernel_size': 2, 'lstm_hidden_dim': 128, 'context_hidden_dim': 256, 'fusion_hidden_dim': 256, 'sequence_dropout': 0.22506251954864728, 'context_dropout': 0.17143627834572164, 'fusion_dropout': 0.15277286705405274}. Best is trial 55 with value: 0.8121442327638384.
2026-06-13 00:56:58,961 - preprocessing - INFO - xAPI engineered features created: ['engagement_score', 'absence_risk', 'parent_support_signal']
2026-06-13 00:56:58,964 - preprocessing - INFO - xAPI engineered features created: ['engagement_score', 'absence_risk', 'parent_support_signal']
2026-06-13 00:56:58,992 - preprocessing - INFO - Applying SMOTE on train set with ratio 0.6173354291768569...
2026-06-13 00:56:59,124 - preprocessing - INFO - Feature selection complete. Selected 15 / 19 features.
2026-06-13 00:57:01,296 - train_pipeline - INFO - Early stopping triggered at epoch 38
2026-06-13 00:57:01,313 - preprocessing - INFO - xAPI engineered features created: ['engagement_score', 'absence_risk', 'parent_support_signal']
2026-06-13 00:57:01,315 - preprocessing - INFO - xAPI engineered features created: ['engagement_score', 'absence_risk', 'parent_support_signal']
2026-06-13 00:57:01,332 - preprocessing - INFO - Applying SMOTE on train set with ratio 0.6173354291768569...
2026-06-13 00:57:01,453 - preprocessing - INFO - Feature selection complete. Selected 16 / 19 features.
2026-06-13 00:57:03,124 - train_pipeline - INFO - Early stopping triggered at epoch 30
2026-06-13 00:57:03,143 - preprocessing - INFO - xAPI engineered features created: ['engagement_score', 'absence_risk', 'parent_support_signal']
2026-06-13 00:57:03,145 - preprocessing - INFO - xAPI engineered features created: ['engagement_score', 'absence_risk', 'parent_support_signal']
2026-06-13 00:57:03,163 - preprocessing - INFO - Applying SMOTE on train set with ratio 0.6173354291768569...
2026-06-13 00:57:03,285 - preprocessing - INFO - Feature selection complete. Selected 18 / 19 features.
2026-06-13 00:57:05,162 - train_pipeline - INFO - Early stopping triggered at epoch 34
2026-06-13 00:57:05,181 - preprocessing - INFO - xAPI engineered features created: ['engagement_score', 'absence_risk', 'parent_support_signal']
2026-06-13 00:57:05,184 - preprocessing - INFO - xAPI engineered features created: ['engagement_score', 'absence_risk', 'parent_support_signal']
2026-06-13 00:57:05,201 - preprocessing - INFO - Applying SMOTE on train set with ratio 0.6173354291768569...
2026-06-13 00:57:05,328 - preprocessing - INFO - Feature selection complete. Selected 16 / 19 features.
2026-06-13 00:57:07,829 - train_pipeline - INFO - Early stopping triggered at epoch 45
[I 2026-06-13 00:57:07,866] Trial 67 pruned. 
2026-06-13 00:57:08,017 - preprocessing - INFO - xAPI engineered features created: ['engagement_score', 'absence_risk', 'parent_support_signal']
2026-06-13 00:57:08,021 - preprocessing - INFO - xAPI engineered features created: ['engagement_score', 'absence_risk', 'parent_support_signal']
2026-06-13 00:57:08,046 - preprocessing - INFO - Applying SMOTE on train set with ratio 0.779415539552502...
2026-06-13 00:57:08,213 - preprocessing - INFO - Feature selection complete. Selected 18 / 19 features.
2026-06-13 00:57:10,969 - train_pipeline - INFO - Early stopping triggered at epoch 37
2026-06-13 00:57:10,988 - preprocessing - INFO - xAPI engineered features created: ['engagement_score', 'absence_risk', 'parent_support_signal']
2026-06-13 00:57:10,991 - preprocessing - INFO - xAPI engineered features created: ['engagement_score', 'absence_risk', 'parent_support_signal']
2026-06-13 00:57:11,009 - preprocessing - INFO - Applying SMOTE on train set with ratio 0.779415539552502...
2026-06-13 00:57:11,135 - preprocessing - INFO - Feature selection complete. Selected 16 / 19 features.
2026-06-13 00:57:14,750 - train_pipeline - INFO - Early stopping triggered at epoch 49
2026-06-13 00:57:14,773 - preprocessing - INFO - xAPI engineered features created: ['engagement_score', 'absence_risk', 'parent_support_signal']
2026-06-13 00:57:14,777 - preprocessing - INFO - xAPI engineered features created: ['engagement_score', 'absence_risk', 'parent_support_signal']
2026-06-13 00:57:14,803 - preprocessing - INFO - Applying SMOTE on train set with ratio 0.779415539552502...
2026-06-13 00:57:14,967 - preprocessing - INFO - Feature selection complete. Selected 18 / 19 features.
2026-06-13 00:57:18,242 - train_pipeline - INFO - Early stopping triggered at epoch 45
2026-06-13 00:57:18,271 - preprocessing - INFO - xAPI engineered features created: ['engagement_score', 'absence_risk', 'parent_support_signal']
2026-06-13 00:57:18,274 - preprocessing - INFO - xAPI engineered features created: ['engagement_score', 'absence_risk', 'parent_support_signal']
2026-06-13 00:57:18,309 - preprocessing - INFO - Applying SMOTE on train set with ratio 0.779415539552502...
2026-06-13 00:57:18,487 - preprocessing - INFO - Feature selection complete. Selected 16 / 19 features.
2026-06-13 00:57:21,916 - train_pipeline - INFO - Early stopping triggered at epoch 46
2026-06-13 00:57:21,944 - preprocessing - INFO - xAPI engineered features created: ['engagement_score', 'absence_risk', 'parent_support_signal']
2026-06-13 00:57:21,946 - preprocessing - INFO - xAPI engineered features created: ['engagement_score', 'absence_risk', 'parent_support_signal']
2026-06-13 00:57:21,978 - preprocessing - INFO - Applying SMOTE on train set with ratio 0.779415539552502...
2026-06-13 00:57:22,164 - preprocessing - INFO - Feature selection complete. Selected 19 / 19 features.
2026-06-13 00:57:25,777 - train_pipeline - INFO - Early stopping triggered at epoch 49
[I 2026-06-13 00:57:25,818] Trial 68 finished with value: 0.793855753670625 and parameters: {'learning_rate': 0.010123959612239258, 'weight_decay': 0.0026044777322468257, 'batch_size': 64, 'oversample_method': 'smote', 'smote_ratio': 0.779415539552502, 'resampling_k_neighbors': 3, 'cnn_channels': 16, 'cnn_kernel_size': 2, 'lstm_hidden_dim': 128, 'context_hidden_dim': 64, 'fusion_hidden_dim': 256, 'sequence_dropout': 0.44507896156105214, 'context_dropout': 0.13750677716036822, 'fusion_dropout': 0.17434607774787297}. Best is trial 55 with value: 0.8121442327638384.
2026-06-13 00:57:25,975 - preprocessing - INFO - xAPI engineered features created: ['engagement_score', 'absence_risk', 'parent_support_signal']
2026-06-13 00:57:25,978 - preprocessing - INFO - xAPI engineered features created: ['engagement_score', 'absence_risk', 'parent_support_signal']
2026-06-13 00:57:26,004 - preprocessing - INFO - Applying ADASYN on train set with ratio 0.41976638232784785...
2026-06-13 00:57:26,171 - preprocessing - INFO - Feature selection complete. Selected 15 / 19 features.
2026-06-13 00:57:30,629 - train_pipeline - INFO - Early stopping triggered at epoch 40
2026-06-13 00:57:30,653 - preprocessing - INFO - xAPI engineered features created: ['engagement_score', 'absence_risk', 'parent_support_signal']
2026-06-13 00:57:30,656 - preprocessing - INFO - xAPI engineered features created: ['engagement_score', 'absence_risk', 'parent_support_signal']
2026-06-13 00:57:30,681 - preprocessing - INFO - Applying ADASYN on train set with ratio 0.41976638232784785...
2026-06-13 00:57:30,837 - preprocessing - INFO - Feature selection complete. Selected 16 / 19 features.
2026-06-13 00:57:38,239 - train_pipeline - INFO - Early stopping triggered at epoch 70
2026-06-13 00:57:38,256 - preprocessing - INFO - xAPI engineered features created: ['engagement_score', 'absence_risk', 'parent_support_signal']
2026-06-13 00:57:38,259 - preprocessing - INFO - xAPI engineered features created: ['engagement_score', 'absence_risk', 'parent_support_signal']
2026-06-13 00:57:38,276 - preprocessing - INFO - Applying ADASYN on train set with ratio 0.41976638232784785...
2026-06-13 00:57:38,398 - preprocessing - INFO - Feature selection complete. Selected 18 / 19 features.
2026-06-13 00:57:44,012 - train_pipeline - INFO - Early stopping triggered at epoch 52
2026-06-13 00:57:44,031 - preprocessing - INFO - xAPI engineered features created: ['engagement_score', 'absence_risk', 'parent_support_signal']
2026-06-13 00:57:44,033 - preprocessing - INFO - xAPI engineered features created: ['engagement_score', 'absence_risk', 'parent_support_signal']
2026-06-13 00:57:44,051 - preprocessing - INFO - Applying ADASYN on train set with ratio 0.41976638232784785...
2026-06-13 00:57:44,170 - preprocessing - INFO - Feature selection complete. Selected 16 / 19 features.
2026-06-13 00:57:48,844 - train_pipeline - INFO - Early stopping triggered at epoch 43
2026-06-13 00:57:48,868 - preprocessing - INFO - xAPI engineered features created: ['engagement_score', 'absence_risk', 'parent_support_signal']
2026-06-13 00:57:48,870 - preprocessing - INFO - xAPI engineered features created: ['engagement_score', 'absence_risk', 'parent_support_signal']
2026-06-13 00:57:48,890 - preprocessing - INFO - Applying ADASYN on train set with ratio 0.41976638232784785...
2026-06-13 00:57:49,009 - preprocessing - INFO - Feature selection complete. Selected 18 / 19 features.
2026-06-13 00:57:54,488 - train_pipeline - INFO - Early stopping triggered at epoch 51
[I 2026-06-13 00:57:54,516] Trial 69 finished with value: 0.8026927349424451 and parameters: {'learning_rate': 0.003482244262942984, 'weight_decay': 0.009274765460799073, 'batch_size': 32, 'oversample_method': 'adasyn', 'smote_ratio': 0.41976638232784785, 'resampling_k_neighbors': 2, 'cnn_channels': 32, 'cnn_kernel_size': 3, 'lstm_hidden_dim': 128, 'context_hidden_dim': 256, 'fusion_hidden_dim': 256, 'sequence_dropout': 0.2079394500997871, 'context_dropout': 0.22629534312292876, 'fusion_dropout': 0.1617517767192587}. Best is trial 55 with value: 0.8121442327638384.
2026-06-13 00:57:54,632 - preprocessing - INFO - xAPI engineered features created: ['engagement_score', 'absence_risk', 'parent_support_signal']
2026-06-13 00:57:54,634 - preprocessing - INFO - xAPI engineered features created: ['engagement_score', 'absence_risk', 'parent_support_signal']
2026-06-13 00:57:54,651 - preprocessing - INFO - Applying ADASYN on train set with ratio 0.528548271645298...
2026-06-13 00:57:54,767 - preprocessing - INFO - Feature selection complete. Selected 15 / 19 features.
2026-06-13 00:57:59,696 - train_pipeline - INFO - Early stopping triggered at epoch 46
2026-06-13 00:57:59,714 - preprocessing - INFO - xAPI engineered features created: ['engagement_score', 'absence_risk', 'parent_support_signal']
2026-06-13 00:57:59,716 - preprocessing - INFO - xAPI engineered features created: ['engagement_score', 'absence_risk', 'parent_support_signal']
2026-06-13 00:57:59,733 - preprocessing - INFO - Applying ADASYN on train set with ratio 0.528548271645298...
2026-06-13 00:57:59,854 - preprocessing - INFO - Feature selection complete. Selected 16 / 19 features.
2026-06-13 00:58:04,409 - train_pipeline - INFO - Early stopping triggered at epoch 42
2026-06-13 00:58:04,426 - preprocessing - INFO - xAPI engineered features created: ['engagement_score', 'absence_risk', 'parent_support_signal']
2026-06-13 00:58:04,428 - preprocessing - INFO - xAPI engineered features created: ['engagement_score', 'absence_risk', 'parent_support_signal']
2026-06-13 00:58:04,445 - preprocessing - INFO - Applying ADASYN on train set with ratio 0.528548271645298...
2026-06-13 00:58:04,567 - preprocessing - INFO - Feature selection complete. Selected 18 / 19 features.
2026-06-13 00:58:07,456 - train_pipeline - INFO - Early stopping triggered at epoch 29
2026-06-13 00:58:07,476 - preprocessing - INFO - xAPI engineered features created: ['engagement_score', 'absence_risk', 'parent_support_signal']
2026-06-13 00:58:07,478 - preprocessing - INFO - xAPI engineered features created: ['engagement_score', 'absence_risk', 'parent_support_signal']
2026-06-13 00:58:07,495 - preprocessing - INFO - Applying ADASYN on train set with ratio 0.528548271645298...
2026-06-13 00:58:07,612 - preprocessing - INFO - Feature selection complete. Selected 16 / 19 features.
2026-06-13 00:58:13,185 - train_pipeline - INFO - Early stopping triggered at epoch 48
2026-06-13 00:58:13,203 - preprocessing - INFO - xAPI engineered features created: ['engagement_score', 'absence_risk', 'parent_support_signal']
2026-06-13 00:58:13,205 - preprocessing - INFO - xAPI engineered features created: ['engagement_score', 'absence_risk', 'parent_support_signal']
2026-06-13 00:58:13,222 - preprocessing - INFO - Applying ADASYN on train set with ratio 0.528548271645298...
2026-06-13 00:58:13,341 - preprocessing - INFO - Feature selection complete. Selected 18 / 19 features.
2026-06-13 00:58:16,878 - train_pipeline - INFO - Early stopping triggered at epoch 32
[I 2026-06-13 00:58:16,911] Trial 70 finished with value: 0.802266668404652 and parameters: {'learning_rate': 0.003565819101202356, 'weight_decay': 0.0037645757709916933, 'batch_size': 32, 'oversample_method': 'adasyn', 'smote_ratio': 0.528548271645298, 'resampling_k_neighbors': 3, 'cnn_channels': 32, 'cnn_kernel_size': 3, 'lstm_hidden_dim': 128, 'context_hidden_dim': 256, 'fusion_hidden_dim': 256, 'sequence_dropout': 0.2385981063539164, 'context_dropout': 0.2488470650502232, 'fusion_dropout': 0.1706974312016559}. Best is trial 55 with value: 0.8121442327638384.
2026-06-13 00:58:17,040 - preprocessing - INFO - xAPI engineered features created: ['engagement_score', 'absence_risk', 'parent_support_signal']
2026-06-13 00:58:17,043 - preprocessing - INFO - xAPI engineered features created: ['engagement_score', 'absence_risk', 'parent_support_signal']
2026-06-13 00:58:17,065 - preprocessing - INFO - Applying ADASYN on train set with ratio 0.5059748024027008...
2026-06-13 00:58:17,190 - preprocessing - INFO - Feature selection complete. Selected 15 / 19 features.
2026-06-13 00:58:20,547 - train_pipeline - INFO - Early stopping triggered at epoch 34
2026-06-13 00:58:20,564 - preprocessing - INFO - xAPI engineered features created: ['engagement_score', 'absence_risk', 'parent_support_signal']
2026-06-13 00:58:20,566 - preprocessing - INFO - xAPI engineered features created: ['engagement_score', 'absence_risk', 'parent_support_signal']
2026-06-13 00:58:20,583 - preprocessing - INFO - Applying ADASYN on train set with ratio 0.5059748024027008...
2026-06-13 00:58:20,703 - preprocessing - INFO - Feature selection complete. Selected 16 / 19 features.
2026-06-13 00:58:29,469 - preprocessing - INFO - xAPI engineered features created: ['engagement_score', 'absence_risk', 'parent_support_signal']
2026-06-13 00:58:29,471 - preprocessing - INFO - xAPI engineered features created: ['engagement_score', 'absence_risk', 'parent_support_signal']
2026-06-13 00:58:29,488 - preprocessing - INFO - Applying ADASYN on train set with ratio 0.5059748024027008...
2026-06-13 00:58:29,609 - preprocessing - INFO - Feature selection complete. Selected 18 / 19 features.
2026-06-13 00:58:33,283 - train_pipeline - INFO - Early stopping triggered at epoch 35
2026-06-13 00:58:33,312 - preprocessing - INFO - xAPI engineered features created: ['engagement_score', 'absence_risk', 'parent_support_signal']
2026-06-13 00:58:33,315 - preprocessing - INFO - xAPI engineered features created: ['engagement_score', 'absence_risk', 'parent_support_signal']
2026-06-13 00:58:33,346 - preprocessing - INFO - Applying ADASYN on train set with ratio 0.5059748024027008...
2026-06-13 00:58:33,527 - preprocessing - INFO - Feature selection complete. Selected 16 / 19 features.
2026-06-13 00:58:41,070 - train_pipeline - INFO - Early stopping triggered at epoch 71
2026-06-13 00:58:41,088 - preprocessing - INFO - xAPI engineered features created: ['engagement_score', 'absence_risk', 'parent_support_signal']
2026-06-13 00:58:41,091 - preprocessing - INFO - xAPI engineered features created: ['engagement_score', 'absence_risk', 'parent_support_signal']
2026-06-13 00:58:41,108 - preprocessing - INFO - Applying ADASYN on train set with ratio 0.5059748024027008...
2026-06-13 00:58:41,228 - preprocessing - INFO - Feature selection complete. Selected 18 / 19 features.
2026-06-13 00:58:46,119 - train_pipeline - INFO - Early stopping triggered at epoch 45
[I 2026-06-13 00:58:46,147] Trial 71 finished with value: 0.7998482580932318 and parameters: {'learning_rate': 0.001704344662934617, 'weight_decay': 0.0032992757600233923, 'batch_size': 32, 'oversample_method': 'adasyn', 'smote_ratio': 0.5059748024027008, 'resampling_k_neighbors': 3, 'cnn_channels': 32, 'cnn_kernel_size': 3, 'lstm_hidden_dim': 128, 'context_hidden_dim': 256, 'fusion_hidden_dim': 256, 'sequence_dropout': 0.12692973996180879, 'context_dropout': 0.28693650543716953, 'fusion_dropout': 0.24471188781045952}. Best is trial 55 with value: 0.8121442327638384.
2026-06-13 00:58:46,263 - preprocessing - INFO - xAPI engineered features created: ['engagement_score', 'absence_risk', 'parent_support_signal']
2026-06-13 00:58:46,265 - preprocessing - INFO - xAPI engineered features created: ['engagement_score', 'absence_risk', 'parent_support_signal']
2026-06-13 00:58:46,282 - preprocessing - INFO - Applying ADASYN on train set with ratio 0.30800103641136906...
2026-06-13 00:58:46,399 - preprocessing - INFO - Feature selection complete. Selected 15 / 19 features.
2026-06-13 00:59:01,145 - preprocessing - INFO - xAPI engineered features created: ['engagement_score', 'absence_risk', 'parent_support_signal']
2026-06-13 00:59:01,147 - preprocessing - INFO - xAPI engineered features created: ['engagement_score', 'absence_risk', 'parent_support_signal']
2026-06-13 00:59:01,165 - preprocessing - INFO - Applying ADASYN on train set with ratio 0.30800103641136906...
2026-06-13 00:59:01,286 - preprocessing - INFO - Feature selection complete. Selected 16 / 19 features.
2026-06-13 00:59:07,649 - train_pipeline - INFO - Early stopping triggered at epoch 34
2026-06-13 00:59:07,669 - preprocessing - INFO - xAPI engineered features created: ['engagement_score', 'absence_risk', 'parent_support_signal']
2026-06-13 00:59:07,671 - preprocessing - INFO - xAPI engineered features created: ['engagement_score', 'absence_risk', 'parent_support_signal']
2026-06-13 00:59:07,687 - preprocessing - INFO - Applying ADASYN on train set with ratio 0.30800103641136906...
2026-06-13 00:59:07,856 - preprocessing - INFO - Feature selection complete. Selected 18 / 19 features.
2026-06-13 00:59:15,463 - train_pipeline - INFO - Early stopping triggered at epoch 39
2026-06-13 00:59:15,482 - preprocessing - INFO - xAPI engineered features created: ['engagement_score', 'absence_risk', 'parent_support_signal']
2026-06-13 00:59:15,485 - preprocessing - INFO - xAPI engineered features created: ['engagement_score', 'absence_risk', 'parent_support_signal']
2026-06-13 00:59:15,503 - preprocessing - INFO - Applying ADASYN on train set with ratio 0.30800103641136906...
2026-06-13 00:59:15,624 - preprocessing - INFO - Feature selection complete. Selected 16 / 19 features.
2026-06-13 00:59:23,704 - train_pipeline - INFO - Early stopping triggered at epoch 42
2026-06-13 00:59:23,729 - preprocessing - INFO - xAPI engineered features created: ['engagement_score', 'absence_risk', 'parent_support_signal']
2026-06-13 00:59:23,732 - preprocessing - INFO - xAPI engineered features created: ['engagement_score', 'absence_risk', 'parent_support_signal']
2026-06-13 00:59:23,757 - preprocessing - INFO - Applying ADASYN on train set with ratio 0.30800103641136906...
2026-06-13 00:59:23,907 - preprocessing - INFO - Feature selection complete. Selected 18 / 19 features.
2026-06-13 00:59:30,872 - train_pipeline - INFO - Early stopping triggered at epoch 37
