[I 2026-06-12 17:48:04,343] Trial 11 finished with value: 0.787415067523692 and parameters: {'learning_rate': 0.0033919147341055387, 'weight_decay': 0.00034875309357332334, 'dropout': 0.38387597797143386, 'batch_size': 16, 'lambda_ordinal': 0.32325392864750074, 'oversample_method': 'adasyn', 'smote_ratio': 0.4142367852838497, 'context_architecture': 'deepfm', 'sequence_architecture': 'dsc_bilstm_attention', 'fm_embedding_dim': 8, 'dcn_cross_layers': 2, 'context_hidden_dim': 128, 'sequence_hidden_dim': 64, 'fusion_hidden_dim': 64}. Best is trial 0 with value: 0.8012617082366521.
2026-06-12 17:48:04,359 - preprocessing - INFO - xAPI engineered features created: ['engagement_score', 'absence_risk', 'parent_support_signal']
2026-06-12 17:48:04,359 - preprocessing - INFO - xAPI engineered features created: ['engagement_score', 'absence_risk', 'parent_support_signal']
2026-06-12 17:48:04,391 - preprocessing - INFO - Applying ADASYN on train set with ratio 0.41828626105401034...
2026-06-12 17:48:04,506 - preprocessing - INFO - Feature selection complete. Selected 15 / 19 features.
[I 2026-06-12 17:48:15,869] Early stopping triggered at epoch 49
2026-06-12 17:48:15,885 - preprocessing - INFO - xAPI engineered features created: ['engagement_score', 'absence_risk', 'parent_support_signal']
2026-06-12 17:48:15,885 - preprocessing - INFO - xAPI engineered features created: ['engagement_score', 'absence_risk', 'parent_support_signal']
2026-06-12 17:48:15,906 - preprocessing - INFO - Applying ADASYN on train set with ratio 0.41828626105401034...
2026-06-12 17:48:16,029 - preprocessing - INFO - Feature selection complete. Selected 16 / 19 features.
[I 2026-06-12 17:48:23,050] Early stopping triggered at epoch 30
2026-06-12 17:48:23,054 - preprocessing - INFO - xAPI engineered features created: ['engagement_score', 'absence_risk', 'parent_support_signal']
2026-06-12 17:48:23,058 - preprocessing - INFO - xAPI engineered features created: ['engagement_score', 'absence_risk', 'parent_support_signal']
2026-06-12 17:48:23,078 - preprocessing - INFO - Applying ADASYN on train set with ratio 0.41828626105401034...
2026-06-12 17:48:23,204 - preprocessing - INFO - Feature selection complete. Selected 18 / 19 features.
[I 2026-06-12 17:48:29,443] Early stopping triggered at epoch 26
2026-06-12 17:48:29,443 - preprocessing - INFO - xAPI engineered features created: ['engagement_score', 'absence_risk', 'parent_support_signal']
2026-06-12 17:48:29,459 - preprocessing - INFO - xAPI engineered features created: ['engagement_score', 'absence_risk', 'parent_support_signal']
2026-06-12 17:48:29,466 - preprocessing - INFO - Applying ADASYN on train set with ratio 0.41828626105401034...
2026-06-12 17:48:29,611 - preprocessing - INFO - Feature selection complete. Selected 16 / 19 features.
[I 2026-06-12 17:48:36,217] Early stopping triggered at epoch 28
2026-06-12 17:48:36,217 - preprocessing - INFO - xAPI engineered features created: ['engagement_score', 'absence_risk', 'parent_support_signal']
2026-06-12 17:48:36,217 - preprocessing - INFO - xAPI engineered features created: ['engagement_score', 'absence_risk', 'parent_support_signal']
2026-06-12 17:48:36,244 - preprocessing - INFO - Applying ADASYN on train set with ratio 0.41828626105401034...
2026-06-12 17:48:36,376 - preprocessing - INFO - Feature selection complete. Selected 18 / 19 features.
[I 2026-06-12 17:48:41,477] Early stopping triggered at epoch 21
[I 2026-06-12 17:48:41,477] Trial 12 finished with value: 0.7639758743164276 and parameters: {'learning_rate': 0.0005364877997969045, 'weight_decay': 6.526189152073637e-05, 'dropout': 0.3998944720110367, 'batch_size': 16, 'lambda_ordinal': 0.2302965776236024, 'oversample_method': 'adasyn', 'smote_ratio': 0.41828626105401034, 'context_architecture': 'dcnv2', 'sequence_architecture': 'dsc_bilstm_attention', 'fm_embedding_dim': 8, 'dcn_cross_layers': 2, 'context_hidden_dim': 128, 'sequence_hidden_dim': 64, 'fusion_hidden_dim': 64}. Best is trial 0 with value: 0.8012617082366521.
2026-06-12 17:48:41,493 - preprocessing - INFO - xAPI engineered features created: ['engagement_score', 'absence_risk', 'parent_support_signal']
2026-06-12 17:48:41,496 - preprocessing - INFO - xAPI engineered features created: ['engagement_score', 'absence_risk', 'parent_support_signal']
2026-06-12 17:48:41,517 - preprocessing - INFO - Applying ADASYN on train set with ratio 0.4986017306305973...
2026-06-12 17:48:41,646 - preprocessing - INFO - Feature selection complete. Selected 15 / 19 features.
2026-06-12 17:48:53,914 - preprocessing - INFO - xAPI engineered features created: ['engagement_score', 'absence_risk', 'parent_support_signal']
2026-06-12 17:48:53,914 - preprocessing - INFO - xAPI engineered features created: ['engagement_score', 'absence_risk', 'parent_support_signal']
2026-06-12 17:48:53,944 - preprocessing - INFO - Applying ADASYN on train set with ratio 0.4986017306305973...
2026-06-12 17:48:54,076 - preprocessing - INFO - Feature selection complete. Selected 16 / 19 features.
[I 2026-06-12 17:49:01,318] Early stopping triggered at epoch 28
2026-06-12 17:49:01,318 - preprocessing - INFO - xAPI engineered features created: ['engagement_score', 'absence_risk', 'parent_support_signal']
2026-06-12 17:49:01,318 - preprocessing - INFO - xAPI engineered features created: ['engagement_score', 'absence_risk', 'parent_support_signal']
2026-06-12 17:49:01,337 - preprocessing - INFO - Applying ADASYN on train set with ratio 0.4986017306305973...
2026-06-12 17:49:01,469 - preprocessing - INFO - Feature selection complete. Selected 18 / 19 features.
[I 2026-06-12 17:49:08,436] Early stopping triggered at epoch 26
2026-06-12 17:49:08,440 - preprocessing - INFO - xAPI engineered features created: ['engagement_score', 'absence_risk', 'parent_support_signal']
2026-06-12 17:49:08,442 - preprocessing - INFO - xAPI engineered features created: ['engagement_score', 'absence_risk', 'parent_support_signal']
2026-06-12 17:49:08,463 - preprocessing - INFO - Applying ADASYN on train set with ratio 0.4986017306305973...
2026-06-12 17:49:08,622 - preprocessing - INFO - Feature selection complete. Selected 16 / 19 features.
[I 2026-06-12 17:49:15,104] Early stopping triggered at epoch 25
2026-06-12 17:49:15,108 - preprocessing - INFO - xAPI engineered features created: ['engagement_score', 'absence_risk', 'parent_support_signal']
2026-06-12 17:49:15,110 - preprocessing - INFO - xAPI engineered features created: ['engagement_score', 'absence_risk', 'parent_support_signal']
2026-06-12 17:49:15,122 - preprocessing - INFO - Applying ADASYN on train set with ratio 0.4986017306305973...
2026-06-12 17:49:15,242 - preprocessing - INFO - Feature selection complete. Selected 18 / 19 features.
[I 2026-06-12 17:49:21,791] Early stopping triggered at epoch 25
[I 2026-06-12 17:49:21,807] Trial 13 finished with value: 0.7947660643314987 and parameters: {'learning_rate': 0.002554363194527121, 'weight_decay': 0.0003913728039321853, 'dropout': 0.10201766864120554, 'batch_size': 16, 'lambda_ordinal': 0.3977294619526861, 'oversample_method': 'adasyn', 'smote_ratio': 0.4986017306305973, 'context_architecture': 'deepfm', 'sequence_architecture': 'dsc_bilstm_attention', 'fm_embedding_dim': 8, 'dcn_cross_layers': 2, 'context_hidden_dim': 128, 'sequence_hidden_dim': 64, 'fusion_hidden_dim': 64}. Best is trial 0 with value: 0.8012617082366521.
2026-06-12 17:49:21,817 - preprocessing - INFO - xAPI engineered features created: ['engagement_score', 'absence_risk', 'parent_support_signal']
2026-06-12 17:49:21,817 - preprocessing - INFO - xAPI engineered features created: ['engagement_score', 'absence_risk', 'parent_support_signal']
2026-06-12 17:49:21,839 - preprocessing - INFO - Applying ADASYN on train set with ratio 0.46995923771899384...
2026-06-12 17:49:21,955 - preprocessing - INFO - Feature selection complete. Selected 15 / 19 features.
2026-06-12 17:49:34,532 - preprocessing - INFO - xAPI engineered features created: ['engagement_score', 'absence_risk', 'parent_support_signal']
2026-06-12 17:49:34,534 - preprocessing - INFO - xAPI engineered features created: ['engagement_score', 'absence_risk', 'parent_support_signal']
2026-06-12 17:49:34,552 - preprocessing - INFO - Applying ADASYN on train set with ratio 0.46995923771899384...
2026-06-12 17:49:34,679 - preprocessing - INFO - Feature selection complete. Selected 16 / 19 features.
[I 2026-06-12 17:49:41,755] Early stopping triggered at epoch 28
2026-06-12 17:49:41,755 - preprocessing - INFO - xAPI engineered features created: ['engagement_score', 'absence_risk', 'parent_support_signal']
2026-06-12 17:49:41,764 - preprocessing - INFO - xAPI engineered features created: ['engagement_score', 'absence_risk', 'parent_support_signal']
2026-06-12 17:49:41,783 - preprocessing - INFO - Applying ADASYN on train set with ratio 0.46995923771899384...
2026-06-12 17:49:41,915 - preprocessing - INFO - Feature selection complete. Selected 18 / 19 features.
[I 2026-06-12 17:49:47,709] Early stopping triggered at epoch 22
2026-06-12 17:49:47,710 - preprocessing - INFO - xAPI engineered features created: ['engagement_score', 'absence_risk', 'parent_support_signal']
2026-06-12 17:49:47,710 - preprocessing - INFO - xAPI engineered features created: ['engagement_score', 'absence_risk', 'parent_support_signal']
2026-06-12 17:49:47,725 - preprocessing - INFO - Applying ADASYN on train set with ratio 0.46995923771899384...
2026-06-12 17:49:47,862 - preprocessing - INFO - Feature selection complete. Selected 16 / 19 features.
[I 2026-06-12 17:49:54,446] Early stopping triggered at epoch 26
2026-06-12 17:49:54,446 - preprocessing - INFO - xAPI engineered features created: ['engagement_score', 'absence_risk', 'parent_support_signal']
2026-06-12 17:49:54,446 - preprocessing - INFO - xAPI engineered features created: ['engagement_score', 'absence_risk', 'parent_support_signal']
2026-06-12 17:49:54,474 - preprocessing - INFO - Applying ADASYN on train set with ratio 0.46995923771899384...
2026-06-12 17:49:54,599 - preprocessing - INFO - Feature selection complete. Selected 18 / 19 features.
[I 2026-06-12 17:50:02,492] Early stopping triggered at epoch 30
[I 2026-06-12 17:50:02,492] Trial 14 finished with value: 0.7943555484525413 and parameters: {'learning_rate': 0.0029850008793120796, 'weight_decay': 0.00035256242539360695, 'dropout': 0.28539469257062305, 'batch_size': 16, 'lambda_ordinal': 0.25101300058182247, 'oversample_method': 'adasyn', 'smote_ratio': 0.46995923771899384, 'context_architecture': 'deepfm', 'sequence_architecture': 'dsc_bilstm_attention', 'fm_embedding_dim': 8, 'dcn_cross_layers': 1, 'context_hidden_dim': 128, 'sequence_hidden_dim': 64, 'fusion_hidden_dim': 64}. Best is trial 0 with value: 0.8012617082366521.
2026-06-12 17:50:02,508 - preprocessing - INFO - xAPI engineered features created: ['engagement_score', 'absence_risk', 'parent_support_signal']
2026-06-12 17:50:02,508 - preprocessing - INFO - xAPI engineered features created: ['engagement_score', 'absence_risk', 'parent_support_signal']
2026-06-12 17:50:02,658 - preprocessing - INFO - Feature selection complete. Selected 15 / 19 features.
[I 2026-06-12 17:50:06,807] Early stopping triggered at epoch 31
2026-06-12 17:50:06,813 - preprocessing - INFO - xAPI engineered features created: ['engagement_score', 'absence_risk', 'parent_support_signal']
2026-06-12 17:50:06,814 - preprocessing - INFO - xAPI engineered features created: ['engagement_score', 'absence_risk', 'parent_support_signal']
2026-06-12 17:50:06,959 - preprocessing - INFO - Feature selection complete. Selected 16 / 19 features.
[I 2026-06-12 17:50:10,506] Early stopping triggered at epoch 26
2026-06-12 17:50:10,510 - preprocessing - INFO - xAPI engineered features created: ['engagement_score', 'absence_risk', 'parent_support_signal']
2026-06-12 17:50:10,512 - preprocessing - INFO - xAPI engineered features created: ['engagement_score', 'absence_risk', 'parent_support_signal']
2026-06-12 17:50:10,658 - preprocessing - INFO - Feature selection complete. Selected 18 / 19 features.
[I 2026-06-12 17:50:16,350] Early stopping triggered at epoch 38
2026-06-12 17:50:16,355 - preprocessing - INFO - xAPI engineered features created: ['engagement_score', 'absence_risk', 'parent_support_signal']
2026-06-12 17:50:16,358 - preprocessing - INFO - xAPI engineered features created: ['engagement_score', 'absence_risk', 'parent_support_signal']
2026-06-12 17:50:16,545 - preprocessing - INFO - Feature selection complete. Selected 16 / 19 features.
[I 2026-06-12 17:50:20,656] Early stopping triggered at epoch 29
2026-06-12 17:50:20,672 - preprocessing - INFO - xAPI engineered features created: ['engagement_score', 'absence_risk', 'parent_support_signal']
2026-06-12 17:50:20,672 - preprocessing - INFO - xAPI engineered features created: ['engagement_score', 'absence_risk', 'parent_support_signal']
2026-06-12 17:50:20,813 - preprocessing - INFO - Feature selection complete. Selected 18 / 19 features.
[I 2026-06-12 17:50:28,063] Trial 15 finished with value: 0.7921606344274282 and parameters: {'learning_rate': 0.007641694497495967, 'weight_decay': 0.000467681833758634, 'dropout': 0.11566393318551298, 'batch_size': 32, 'lambda_ordinal': 0.3347267043716541, 'oversample_method': 'none', 'focal_gamma': 2.3249565138127783, 'context_architecture': 'deepfm', 'sequence_architecture': 'dsc_bilstm_attention', 'fm_embedding_dim': 16, 'dcn_cross_layers': 2, 'context_hidden_dim': 128, 'sequence_hidden_dim': 64, 'fusion_hidden_dim': 64}. Best is trial 0 with value: 0.8012617082366521.
2026-06-12 17:50:28,078 - preprocessing - INFO - xAPI engineered features created: ['engagement_score', 'absence_risk', 'parent_support_signal']
2026-06-12 17:50:28,078 - preprocessing - INFO - xAPI engineered features created: ['engagement_score', 'absence_risk', 'parent_support_signal']
2026-06-12 17:50:28,091 - preprocessing - INFO - Applying ADASYN on train set with ratio 0.4777652773693163...
2026-06-12 17:50:28,224 - preprocessing - INFO - Feature selection complete. Selected 15 / 19 features.
[I 2026-06-12 17:50:38,559] Early stopping triggered at epoch 42
2026-06-12 17:50:38,559 - preprocessing - INFO - xAPI engineered features created: ['engagement_score', 'absence_risk', 'parent_support_signal']
2026-06-12 17:50:38,559 - preprocessing - INFO - xAPI engineered features created: ['engagement_score', 'absence_risk', 'parent_support_signal']
2026-06-12 17:50:38,580 - preprocessing - INFO - Applying ADASYN on train set with ratio 0.4777652773693163...
2026-06-12 17:50:38,719 - preprocessing - INFO - Feature selection complete. Selected 16 / 19 features.
[I 2026-06-12 17:50:45,260] Early stopping triggered at epoch 26
2026-06-12 17:50:45,263 - preprocessing - INFO - xAPI engineered features created: ['engagement_score', 'absence_risk', 'parent_support_signal']
2026-06-12 17:50:45,265 - preprocessing - INFO - xAPI engineered features created: ['engagement_score', 'absence_risk', 'parent_support_signal']
2026-06-12 17:50:45,279 - preprocessing - INFO - Applying ADASYN on train set with ratio 0.4777652773693163...
2026-06-12 17:50:45,413 - preprocessing - INFO - Feature selection complete. Selected 18 / 19 features.
[I 2026-06-12 17:50:55,609] Early stopping triggered at epoch 39
2026-06-12 17:50:55,613 - preprocessing - INFO - xAPI engineered features created: ['engagement_score', 'absence_risk', 'parent_support_signal']
2026-06-12 17:50:55,615 - preprocessing - INFO - xAPI engineered features created: ['engagement_score', 'absence_risk', 'parent_support_signal']
2026-06-12 17:50:55,632 - preprocessing - INFO - Applying ADASYN on train set with ratio 0.4777652773693163...
2026-06-12 17:50:55,743 - preprocessing - INFO - Feature selection complete. Selected 16 / 19 features.
2026-06-12 17:51:08,490 - preprocessing - INFO - xAPI engineered features created: ['engagement_score', 'absence_risk', 'parent_support_signal']
2026-06-12 17:51:08,490 - preprocessing - INFO - xAPI engineered features created: ['engagement_score', 'absence_risk', 'parent_support_signal']
2026-06-12 17:51:08,515 - preprocessing - INFO - Applying ADASYN on train set with ratio 0.4777652773693163...
2026-06-12 17:51:08,647 - preprocessing - INFO - Feature selection complete. Selected 18 / 19 features.
[I 2026-06-12 17:51:16,268] Early stopping triggered at epoch 29
[I 2026-06-12 17:51:16,270] Trial 16 finished with value: 0.7831154940991814 and parameters: {'learning_rate': 0.0021305357971451518, 'weight_decay': 0.000997455073676173, 'dropout': 0.10318256922049457, 'batch_size': 16, 'lambda_ordinal': 0.3922654483148002, 'oversample_method': 'adasyn', 'smote_ratio': 0.4777652773693163, 'context_architecture': 'deepfm', 'sequence_architecture': 'dsc_bilstm_attention', 'fm_embedding_dim': 8, 'dcn_cross_layers': 3, 'context_hidden_dim': 128, 'sequence_hidden_dim': 64, 'fusion_hidden_dim': 64}. Best is trial 0 with value: 0.8012617082366521.
2026-06-12 17:51:16,284 - preprocessing - INFO - xAPI engineered features created: ['engagement_score', 'absence_risk', 'parent_support_signal']
2026-06-12 17:51:16,286 - preprocessing - INFO - xAPI engineered features created: ['engagement_score', 'absence_risk', 'parent_support_signal']
2026-06-12 17:51:16,304 - preprocessing - INFO - Applying SMOTE on train set with ratio 0.40188853005209846...
2026-06-12 17:51:16,438 - preprocessing - INFO - Feature selection complete. Selected 15 / 19 features.
[I 2026-06-12 17:51:26,861] Early stopping triggered at epoch 41
2026-06-12 17:51:26,867 - preprocessing - INFO - xAPI engineered features created: ['engagement_score', 'absence_risk', 'parent_support_signal']
2026-06-12 17:51:26,867 - preprocessing - INFO - xAPI engineered features created: ['engagement_score', 'absence_risk', 'parent_support_signal']
2026-06-12 17:51:26,886 - preprocessing - INFO - Applying SMOTE on train set with ratio 0.40188853005209846...
2026-06-12 17:51:27,017 - preprocessing - INFO - Feature selection complete. Selected 16 / 19 features.
[I 2026-06-12 17:51:32,322] Early stopping triggered at epoch 21
2026-06-12 17:51:32,327 - preprocessing - INFO - xAPI engineered features created: ['engagement_score', 'absence_risk', 'parent_support_signal']
2026-06-12 17:51:32,329 - preprocessing - INFO - xAPI engineered features created: ['engagement_score', 'absence_risk', 'parent_support_signal']
2026-06-12 17:51:32,345 - preprocessing - INFO - Applying SMOTE on train set with ratio 0.40188853005209846...
2026-06-12 17:51:32,486 - preprocessing - INFO - Feature selection complete. Selected 18 / 19 features.
[I 2026-06-12 17:51:42,014] Early stopping triggered at epoch 36
2026-06-12 17:51:42,014 - preprocessing - INFO - xAPI engineered features created: ['engagement_score', 'absence_risk', 'parent_support_signal']
2026-06-12 17:51:42,014 - preprocessing - INFO - xAPI engineered features created: ['engagement_score', 'absence_risk', 'parent_support_signal']
2026-06-12 17:51:42,039 - preprocessing - INFO - Applying SMOTE on train set with ratio 0.40188853005209846...
2026-06-12 17:51:42,162 - preprocessing - INFO - Feature selection complete. Selected 16 / 19 features.
[I 2026-06-12 17:51:48,697] Early stopping triggered at epoch 26
2026-06-12 17:51:48,697 - preprocessing - INFO - xAPI engineered features created: ['engagement_score', 'absence_risk', 'parent_support_signal']
2026-06-12 17:51:48,697 - preprocessing - INFO - xAPI engineered features created: ['engagement_score', 'absence_risk', 'parent_support_signal']
2026-06-12 17:51:48,718 - preprocessing - INFO - Applying SMOTE on train set with ratio 0.40188853005209846...
2026-06-12 17:51:48,843 - preprocessing - INFO - Feature selection complete. Selected 18 / 19 features.
[I 2026-06-12 17:52:01,292] Early stopping triggered at epoch 46
