[I 2026-06-12 17:44:44,979] Trial 5 finished with value: 0.7421604890440682 and parameters: {'learning_rate': 0.0002665363777973328, 'weight_decay': 0.0008779918831947248, 'dropout': 0.1966102018802498, 'batch_size': 16, 'lambda_ordinal': 0.47443582388170547, 'oversample_method': 'adasyn', 'smote_ratio': 0.6191364637342265, 'context_architecture': 'deepfm', 'sequence_architecture': 'dsc_bilstm_attention', 'fm_embedding_dim': 32, 'dcn_cross_layers': 3, 'context_hidden_dim': 64, 'sequence_hidden_dim': 64, 'fusion_hidden_dim': 128}. Best is trial 0 with value: 0.8012617082366521.
2026-06-12 17:44:44,979 - preprocessing - INFO - xAPI engineered features created: ['engagement_score', 'absence_risk', 'parent_support_signal']
2026-06-12 17:44:44,995 - preprocessing - INFO - xAPI engineered features created: ['engagement_score', 'absence_risk', 'parent_support_signal']
2026-06-12 17:44:45,013 - preprocessing - INFO - Applying ADASYN on train set with ratio 0.5061527599880276...
2026-06-12 17:44:45,138 - preprocessing - INFO - Feature selection complete. Selected 15 / 19 features.
2026-06-12 17:44:56,694 - preprocessing - INFO - xAPI engineered features created: ['engagement_score', 'absence_risk', 'parent_support_signal']
2026-06-12 17:44:56,694 - preprocessing - INFO - xAPI engineered features created: ['engagement_score', 'absence_risk', 'parent_support_signal']
2026-06-12 17:44:56,710 - preprocessing - INFO - Applying ADASYN on train set with ratio 0.5061527599880276...
2026-06-12 17:44:56,849 - preprocessing - INFO - Feature selection complete. Selected 16 / 19 features.
[I 2026-06-12 17:45:02,215] Early stopping triggered at epoch 23
2026-06-12 17:45:02,218 - preprocessing - INFO - xAPI engineered features created: ['engagement_score', 'absence_risk', 'parent_support_signal']
2026-06-12 17:45:02,220 - preprocessing - INFO - xAPI engineered features created: ['engagement_score', 'absence_risk', 'parent_support_signal']
2026-06-12 17:45:02,236 - preprocessing - INFO - Applying ADASYN on train set with ratio 0.5061527599880276...
2026-06-12 17:45:02,371 - preprocessing - INFO - Feature selection complete. Selected 18 / 19 features.
[I 2026-06-12 17:45:09,572] Early stopping triggered at epoch 30
2026-06-12 17:45:09,588 - preprocessing - INFO - xAPI engineered features created: ['engagement_score', 'absence_risk', 'parent_support_signal']
2026-06-12 17:45:09,588 - preprocessing - INFO - xAPI engineered features created: ['engagement_score', 'absence_risk', 'parent_support_signal']
2026-06-12 17:45:09,604 - preprocessing - INFO - Applying ADASYN on train set with ratio 0.5061527599880276...
2026-06-12 17:45:09,739 - preprocessing - INFO - Feature selection complete. Selected 16 / 19 features.
[I 2026-06-12 17:45:15,159] Early stopping triggered at epoch 23
2026-06-12 17:45:15,159 - preprocessing - INFO - xAPI engineered features created: ['engagement_score', 'absence_risk', 'parent_support_signal']
2026-06-12 17:45:15,159 - preprocessing - INFO - xAPI engineered features created: ['engagement_score', 'absence_risk', 'parent_support_signal']
2026-06-12 17:45:15,175 - preprocessing - INFO - Applying ADASYN on train set with ratio 0.5061527599880276...
2026-06-12 17:45:15,309 - preprocessing - INFO - Feature selection complete. Selected 18 / 19 features.
[I 2026-06-12 17:45:24,333] Early stopping triggered at epoch 37
[I 2026-06-12 17:45:24,349] Trial 6 finished with value: 0.7902830595909712 and parameters: {'learning_rate': 0.0007715566558734588, 'weight_decay': 0.00025549741848098016, 'dropout': 0.39153739778616836, 'batch_size': 16, 'lambda_ordinal': 0.4132282079440738, 'oversample_method': 'adasyn', 'smote_ratio': 0.5061527599880276, 'context_architecture': 'dcnv2', 'sequence_architecture': 'dsc_bilstm_attention', 'fm_embedding_dim': 8, 'dcn_cross_layers': 2, 'context_hidden_dim': 128, 'sequence_hidden_dim': 64, 'fusion_hidden_dim': 64}. Best is trial 0 with value: 0.8012617082366521.
2026-06-12 17:45:24,354 - preprocessing - INFO - xAPI engineered features created: ['engagement_score', 'absence_risk', 'parent_support_signal']
2026-06-12 17:45:24,354 - preprocessing - INFO - xAPI engineered features created: ['engagement_score', 'absence_risk', 'parent_support_signal']
2026-06-12 17:45:24,370 - preprocessing - INFO - Applying SMOTE on train set with ratio 0.624429988415739...
2026-06-12 17:45:24,508 - preprocessing - INFO - Feature selection complete. Selected 15 / 19 features.
[I 2026-06-12 17:45:31,038] Early stopping triggered at epoch 26
2026-06-12 17:45:31,042 - preprocessing - INFO - xAPI engineered features created: ['engagement_score', 'absence_risk', 'parent_support_signal']
2026-06-12 17:45:31,042 - preprocessing - INFO - xAPI engineered features created: ['engagement_score', 'absence_risk', 'parent_support_signal']
2026-06-12 17:45:31,063 - preprocessing - INFO - Applying SMOTE on train set with ratio 0.624429988415739...
2026-06-12 17:45:31,187 - preprocessing - INFO - Feature selection complete. Selected 16 / 19 features.
[I 2026-06-12 17:45:37,847] Early stopping triggered at epoch 25
2026-06-12 17:45:37,854 - preprocessing - INFO - xAPI engineered features created: ['engagement_score', 'absence_risk', 'parent_support_signal']
2026-06-12 17:45:37,854 - preprocessing - INFO - xAPI engineered features created: ['engagement_score', 'absence_risk', 'parent_support_signal']
2026-06-12 17:45:37,876 - preprocessing - INFO - Applying SMOTE on train set with ratio 0.624429988415739...
2026-06-12 17:45:38,002 - preprocessing - INFO - Feature selection complete. Selected 18 / 19 features.
[I 2026-06-12 17:45:46,298] Early stopping triggered at epoch 28
2026-06-12 17:45:46,308 - preprocessing - INFO - xAPI engineered features created: ['engagement_score', 'absence_risk', 'parent_support_signal']
2026-06-12 17:45:46,311 - preprocessing - INFO - xAPI engineered features created: ['engagement_score', 'absence_risk', 'parent_support_signal']
2026-06-12 17:45:46,334 - preprocessing - INFO - Applying SMOTE on train set with ratio 0.624429988415739...
2026-06-12 17:45:46,472 - preprocessing - INFO - Feature selection complete. Selected 16 / 19 features.
[I 2026-06-12 17:45:55,290] Early stopping triggered at epoch 33
2026-06-12 17:45:55,290 - preprocessing - INFO - xAPI engineered features created: ['engagement_score', 'absence_risk', 'parent_support_signal']
2026-06-12 17:45:55,290 - preprocessing - INFO - xAPI engineered features created: ['engagement_score', 'absence_risk', 'parent_support_signal']
2026-06-12 17:45:55,306 - preprocessing - INFO - Applying SMOTE on train set with ratio 0.624429988415739...
2026-06-12 17:45:55,457 - preprocessing - INFO - Feature selection complete. Selected 18 / 19 features.
[I 2026-06-12 17:46:03,606] Early stopping triggered at epoch 29
[I 2026-06-12 17:46:03,606] Trial 7 finished with value: 0.7633372802115224 and parameters: {'learning_rate': 0.003938472488664359, 'weight_decay': 1.3143746419467585e-05, 'dropout': 0.19834466078153057, 'batch_size': 16, 'lambda_ordinal': 0.09453798252358908, 'oversample_method': 'smote', 'smote_ratio': 0.624429988415739, 'context_architecture': 'dcnv2', 'sequence_architecture': 'dsc_bilstm_attention', 'fm_embedding_dim': 32, 'dcn_cross_layers': 3, 'context_hidden_dim': 32, 'sequence_hidden_dim': 32, 'fusion_hidden_dim': 64}. Best is trial 0 with value: 0.8012617082366521.
2026-06-12 17:46:03,606 - preprocessing - INFO - xAPI engineered features created: ['engagement_score', 'absence_risk', 'parent_support_signal']
2026-06-12 17:46:03,606 - preprocessing - INFO - xAPI engineered features created: ['engagement_score', 'absence_risk', 'parent_support_signal']
2026-06-12 17:46:03,634 - preprocessing - INFO - Applying SMOTE on train set with ratio 0.6985482592385581...
2026-06-12 17:46:03,761 - preprocessing - INFO - Feature selection complete. Selected 15 / 19 features.
[I 2026-06-12 17:46:07,488] Early stopping triggered at epoch 48
2026-06-12 17:46:07,506 - preprocessing - INFO - xAPI engineered features created: ['engagement_score', 'absence_risk', 'parent_support_signal']
2026-06-12 17:46:07,506 - preprocessing - INFO - xAPI engineered features created: ['engagement_score', 'absence_risk', 'parent_support_signal']
2026-06-12 17:46:07,526 - preprocessing - INFO - Applying SMOTE on train set with ratio 0.6985482592385581...
2026-06-12 17:46:07,665 - preprocessing - INFO - Feature selection complete. Selected 16 / 19 features.
[I 2026-06-12 17:46:10,409] Early stopping triggered at epoch 35
2026-06-12 17:46:10,412 - preprocessing - INFO - xAPI engineered features created: ['engagement_score', 'absence_risk', 'parent_support_signal']
2026-06-12 17:46:10,412 - preprocessing - INFO - xAPI engineered features created: ['engagement_score', 'absence_risk', 'parent_support_signal']
2026-06-12 17:46:10,433 - preprocessing - INFO - Applying SMOTE on train set with ratio 0.6985482592385581...
2026-06-12 17:46:10,558 - preprocessing - INFO - Feature selection complete. Selected 18 / 19 features.
[I 2026-06-12 17:46:12,983] Early stopping triggered at epoch 30
2026-06-12 17:46:12,983 - preprocessing - INFO - xAPI engineered features created: ['engagement_score', 'absence_risk', 'parent_support_signal']
2026-06-12 17:46:12,983 - preprocessing - INFO - xAPI engineered features created: ['engagement_score', 'absence_risk', 'parent_support_signal']
2026-06-12 17:46:13,007 - preprocessing - INFO - Applying SMOTE on train set with ratio 0.6985482592385581...
2026-06-12 17:46:13,159 - preprocessing - INFO - Feature selection complete. Selected 17 / 19 features.
[I 2026-06-12 17:46:16,616] Early stopping triggered at epoch 43
2026-06-12 17:46:16,635 - preprocessing - INFO - xAPI engineered features created: ['engagement_score', 'absence_risk', 'parent_support_signal']
2026-06-12 17:46:16,635 - preprocessing - INFO - xAPI engineered features created: ['engagement_score', 'absence_risk', 'parent_support_signal']
2026-06-12 17:46:16,655 - preprocessing - INFO - Applying SMOTE on train set with ratio 0.6985482592385581...
2026-06-12 17:46:16,787 - preprocessing - INFO - Feature selection complete. Selected 18 / 19 features.
[I 2026-06-12 17:46:19,692] Early stopping triggered at epoch 35
[I 2026-06-12 17:46:19,696] Trial 8 finished with value: 0.7681876205558509 and parameters: {'learning_rate': 0.001124103482498904, 'weight_decay': 0.0007097835411245311, 'dropout': 0.49378853388008015, 'batch_size': 64, 'lambda_ordinal': 0.03615623071681928, 'oversample_method': 'smote', 'smote_ratio': 0.6985482592385581, 'context_architecture': 'dcnv2', 'sequence_architecture': 'dsc_bilstm_attention', 'fm_embedding_dim': 16, 'dcn_cross_layers': 1, 'context_hidden_dim': 64, 'sequence_hidden_dim': 32, 'fusion_hidden_dim': 128}. Best is trial 0 with value: 0.8012617082366521.
2026-06-12 17:46:19,700 - preprocessing - INFO - xAPI engineered features created: ['engagement_score', 'absence_risk', 'parent_support_signal']
2026-06-12 17:46:19,702 - preprocessing - INFO - xAPI engineered features created: ['engagement_score', 'absence_risk', 'parent_support_signal']
2026-06-12 17:46:19,722 - preprocessing - INFO - Applying SMOTE on train set with ratio 0.5950303747328025...
2026-06-12 17:46:19,861 - preprocessing - INFO - Feature selection complete. Selected 15 / 19 features.
[I 2026-06-12 17:46:24,611] Early stopping triggered at epoch 45
2026-06-12 17:46:24,615 - preprocessing - INFO - xAPI engineered features created: ['engagement_score', 'absence_risk', 'parent_support_signal']
2026-06-12 17:46:24,617 - preprocessing - INFO - xAPI engineered features created: ['engagement_score', 'absence_risk', 'parent_support_signal']
2026-06-12 17:46:24,637 - preprocessing - INFO - Applying SMOTE on train set with ratio 0.5950303747328025...
2026-06-12 17:46:24,766 - preprocessing - INFO - Feature selection complete. Selected 16 / 19 features.
[I 2026-06-12 17:46:28,430] Early stopping triggered at epoch 34
2026-06-12 17:46:28,430 - preprocessing - INFO - xAPI engineered features created: ['engagement_score', 'absence_risk', 'parent_support_signal']
2026-06-12 17:46:28,435 - preprocessing - INFO - xAPI engineered features created: ['engagement_score', 'absence_risk', 'parent_support_signal']
2026-06-12 17:46:28,451 - preprocessing - INFO - Applying SMOTE on train set with ratio 0.5950303747328025...
2026-06-12 17:46:28,573 - preprocessing - INFO - Feature selection complete. Selected 18 / 19 features.
[I 2026-06-12 17:46:32,846] Early stopping triggered at epoch 39
2026-06-12 17:46:32,846 - preprocessing - INFO - xAPI engineered features created: ['engagement_score', 'absence_risk', 'parent_support_signal']
2026-06-12 17:46:32,846 - preprocessing - INFO - xAPI engineered features created: ['engagement_score', 'absence_risk', 'parent_support_signal']
2026-06-12 17:46:32,858 - preprocessing - INFO - Applying SMOTE on train set with ratio 0.5950303747328025...
2026-06-12 17:46:32,993 - preprocessing - INFO - Feature selection complete. Selected 16 / 19 features.
[I 2026-06-12 17:46:38,231] Early stopping triggered at epoch 47
2026-06-12 17:46:38,232 - preprocessing - INFO - xAPI engineered features created: ['engagement_score', 'absence_risk', 'parent_support_signal']
2026-06-12 17:46:38,232 - preprocessing - INFO - xAPI engineered features created: ['engagement_score', 'absence_risk', 'parent_support_signal']
2026-06-12 17:46:38,253 - preprocessing - INFO - Applying SMOTE on train set with ratio 0.5950303747328025...
2026-06-12 17:46:38,391 - preprocessing - INFO - Feature selection complete. Selected 18 / 19 features.
[I 2026-06-12 17:46:41,236] Early stopping triggered at epoch 25
[I 2026-06-12 17:46:41,242] Trial 9 finished with value: 0.755478189480887 and parameters: {'learning_rate': 0.00011667929122767103, 'weight_decay': 1.6983289996517993e-05, 'dropout': 0.24493411383822555, 'batch_size': 32, 'lambda_ordinal': 0.44697386175966436, 'oversample_method': 'smote', 'smote_ratio': 0.5950303747328025, 'context_architecture': 'mlp_baseline', 'sequence_architecture': 'dsc_bilstm_attention', 'fm_embedding_dim': 32, 'dcn_cross_layers': 3, 'context_hidden_dim': 64, 'sequence_hidden_dim': 32, 'fusion_hidden_dim': 128}. Best is trial 0 with value: 0.8012617082366521.
2026-06-12 17:46:41,256 - preprocessing - INFO - xAPI engineered features created: ['engagement_score', 'absence_risk', 'parent_support_signal']
2026-06-12 17:46:41,256 - preprocessing - INFO - xAPI engineered features created: ['engagement_score', 'absence_risk', 'parent_support_signal']
2026-06-12 17:46:41,408 - preprocessing - INFO - Feature selection complete. Selected 15 / 19 features.
[I 2026-06-12 17:46:53,689] Early stopping triggered at epoch 47
2026-06-12 17:46:53,692 - preprocessing - INFO - xAPI engineered features created: ['engagement_score', 'absence_risk', 'parent_support_signal']
2026-06-12 17:46:53,695 - preprocessing - INFO - xAPI engineered features created: ['engagement_score', 'absence_risk', 'parent_support_signal']
2026-06-12 17:46:53,855 - preprocessing - INFO - Feature selection complete. Selected 16 / 19 features.
[I 2026-06-12 17:47:01,770] Early stopping triggered at epoch 30
2026-06-12 17:47:01,777 - preprocessing - INFO - xAPI engineered features created: ['engagement_score', 'absence_risk', 'parent_support_signal']
2026-06-12 17:47:01,777 - preprocessing - INFO - xAPI engineered features created: ['engagement_score', 'absence_risk', 'parent_support_signal']
2026-06-12 17:47:01,916 - preprocessing - INFO - Feature selection complete. Selected 18 / 19 features.
[I 2026-06-12 17:47:09,318] Early stopping triggered at epoch 27
2026-06-12 17:47:09,318 - preprocessing - INFO - xAPI engineered features created: ['engagement_score', 'absence_risk', 'parent_support_signal']
2026-06-12 17:47:09,318 - preprocessing - INFO - xAPI engineered features created: ['engagement_score', 'absence_risk', 'parent_support_signal']
2026-06-12 17:47:09,471 - preprocessing - INFO - Feature selection complete. Selected 16 / 19 features.
[I 2026-06-12 17:47:16,650] Early stopping triggered at epoch 27
2026-06-12 17:47:16,651 - preprocessing - INFO - xAPI engineered features created: ['engagement_score', 'absence_risk', 'parent_support_signal']
2026-06-12 17:47:16,651 - preprocessing - INFO - xAPI engineered features created: ['engagement_score', 'absence_risk', 'parent_support_signal']
2026-06-12 17:47:16,811 - preprocessing - INFO - Feature selection complete. Selected 18 / 19 features.
[I 2026-06-12 17:47:23,998] Early stopping triggered at epoch 26
[I 2026-06-12 17:47:24,005] Trial 10 finished with value: 0.7392273846860682 and parameters: {'learning_rate': 0.008544786958357363, 'weight_decay': 4.666705949770616e-05, 'dropout': 0.4796491524325379, 'batch_size': 16, 'lambda_ordinal': 0.25145155210937403, 'oversample_method': 'none', 'focal_gamma': 2.9027916177319693, 'context_architecture': 'deepfm', 'sequence_architecture': 'dsc_bilstm_attention', 'fm_embedding_dim': 16, 'dcn_cross_layers': 1, 'context_hidden_dim': 128, 'sequence_hidden_dim': 64, 'fusion_hidden_dim': 64}. Best is trial 0 with value: 0.8012617082366521.
2026-06-12 17:47:24,019 - preprocessing - INFO - xAPI engineered features created: ['engagement_score', 'absence_risk', 'parent_support_signal']
2026-06-12 17:47:24,019 - preprocessing - INFO - xAPI engineered features created: ['engagement_score', 'absence_risk', 'parent_support_signal']
2026-06-12 17:47:24,041 - preprocessing - INFO - Applying ADASYN on train set with ratio 0.4142367852838497...
2026-06-12 17:47:24,185 - preprocessing - INFO - Feature selection complete. Selected 15 / 19 features.
[I 2026-06-12 17:47:33,412] Early stopping triggered at epoch 36
2026-06-12 17:47:33,419 - preprocessing - INFO - xAPI engineered features created: ['engagement_score', 'absence_risk', 'parent_support_signal']
2026-06-12 17:47:33,419 - preprocessing - INFO - xAPI engineered features created: ['engagement_score', 'absence_risk', 'parent_support_signal']
2026-06-12 17:47:33,440 - preprocessing - INFO - Applying ADASYN on train set with ratio 0.4142367852838497...
2026-06-12 17:47:33,572 - preprocessing - INFO - Feature selection complete. Selected 16 / 19 features.
[I 2026-06-12 17:47:39,517] Early stopping triggered at epoch 23
2026-06-12 17:47:39,524 - preprocessing - INFO - xAPI engineered features created: ['engagement_score', 'absence_risk', 'parent_support_signal']
2026-06-12 17:47:39,524 - preprocessing - INFO - xAPI engineered features created: ['engagement_score', 'absence_risk', 'parent_support_signal']
2026-06-12 17:47:39,545 - preprocessing - INFO - Applying ADASYN on train set with ratio 0.4142367852838497...
2026-06-12 17:47:39,684 - preprocessing - INFO - Feature selection complete. Selected 18 / 19 features.
[I 2026-06-12 17:47:48,147] Early stopping triggered at epoch 31
2026-06-12 17:47:48,154 - preprocessing - INFO - xAPI engineered features created: ['engagement_score', 'absence_risk', 'parent_support_signal']
2026-06-12 17:47:48,154 - preprocessing - INFO - xAPI engineered features created: ['engagement_score', 'absence_risk', 'parent_support_signal']
2026-06-12 17:47:48,175 - preprocessing - INFO - Applying ADASYN on train set with ratio 0.4142367852838497...
2026-06-12 17:47:48,314 - preprocessing - INFO - Feature selection complete. Selected 16 / 19 features.
[I 2026-06-12 17:47:54,898] Early stopping triggered at epoch 25
2026-06-12 17:47:54,904 - preprocessing - INFO - xAPI engineered features created: ['engagement_score', 'absence_risk', 'parent_support_signal']
2026-06-12 17:47:54,904 - preprocessing - INFO - xAPI engineered features created: ['engagement_score', 'absence_risk', 'parent_support_signal']
2026-06-12 17:47:54,925 - preprocessing - INFO - Applying ADASYN on train set with ratio 0.4142367852838497...
2026-06-12 17:47:55,060 - preprocessing - INFO - Feature selection complete. Selected 18 / 19 features.
[I 2026-06-12 17:48:04,343] Early stopping triggered at epoch 33
