[I 2026-06-13 01:32:27,221] Trial 146 finished with value: 0.8030944052346385 and parameters: {'learning_rate': 0.005202568397023384, 'weight_decay': 0.002962064957965778, 'batch_size': 64, 'oversample_method': 'smote', 'smote_ratio': 0.6322853234774737, 'resampling_k_neighbors': 2, 'cnn_channels': 32, 'cnn_kernel_size': 4, 'lstm_hidden_dim': 32, 'context_hidden_dim': 256, 'fusion_hidden_dim': 32, 'sequence_dropout': 0.17025035576907677, 'context_dropout': 0.1729831874433411, 'fusion_dropout': 0.2042965861624053}. Best is trial 55 with value: 0.8121442327638384.
2026-06-13 01:32:27,338 - preprocessing - INFO - xAPI engineered features created: ['engagement_score', 'absence_risk', 'parent_support_signal']
2026-06-13 01:32:27,340 - preprocessing - INFO - xAPI engineered features created: ['engagement_score', 'absence_risk', 'parent_support_signal']
2026-06-13 01:32:27,358 - preprocessing - INFO - Applying SMOTE on train set with ratio 0.6838013351124411...
2026-06-13 01:32:27,482 - preprocessing - INFO - Feature selection complete. Selected 15 / 19 features.
2026-06-13 01:32:37,773 - train_pipeline - INFO - Early stopping triggered at epoch 36
2026-06-13 01:32:37,789 - preprocessing - INFO - xAPI engineered features created: ['engagement_score', 'absence_risk', 'parent_support_signal']
2026-06-13 01:32:37,792 - preprocessing - INFO - xAPI engineered features created: ['engagement_score', 'absence_risk', 'parent_support_signal']
2026-06-13 01:32:37,810 - preprocessing - INFO - Applying SMOTE on train set with ratio 0.6838013351124411...
2026-06-13 01:32:37,935 - preprocessing - INFO - Feature selection complete. Selected 16 / 19 features.
2026-06-13 01:32:58,923 - train_pipeline - INFO - Early stopping triggered at epoch 77
2026-06-13 01:32:58,941 - preprocessing - INFO - xAPI engineered features created: ['engagement_score', 'absence_risk', 'parent_support_signal']
2026-06-13 01:32:58,945 - preprocessing - INFO - xAPI engineered features created: ['engagement_score', 'absence_risk', 'parent_support_signal']
2026-06-13 01:32:58,962 - preprocessing - INFO - Applying SMOTE on train set with ratio 0.6838013351124411...
2026-06-13 01:32:59,085 - preprocessing - INFO - Feature selection complete. Selected 18 / 19 features.
2026-06-13 01:33:18,885 - train_pipeline - INFO - Early stopping triggered at epoch 71
[I 2026-06-13 01:33:18,910] Trial 147 pruned. 
2026-06-13 01:33:19,023 - preprocessing - INFO - xAPI engineered features created: ['engagement_score', 'absence_risk', 'parent_support_signal']
2026-06-13 01:33:19,026 - preprocessing - INFO - xAPI engineered features created: ['engagement_score', 'absence_risk', 'parent_support_signal']
2026-06-13 01:33:19,043 - preprocessing - INFO - Applying SMOTE on train set with ratio 0.5298701526469141...
2026-06-13 01:33:19,161 - preprocessing - INFO - Feature selection complete. Selected 15 / 19 features.
2026-06-13 01:33:20,993 - train_pipeline - INFO - Early stopping triggered at epoch 33
2026-06-13 01:33:21,011 - preprocessing - INFO - xAPI engineered features created: ['engagement_score', 'absence_risk', 'parent_support_signal']
2026-06-13 01:33:21,013 - preprocessing - INFO - xAPI engineered features created: ['engagement_score', 'absence_risk', 'parent_support_signal']
2026-06-13 01:33:21,029 - preprocessing - INFO - Applying SMOTE on train set with ratio 0.5298701526469141...
2026-06-13 01:33:21,146 - preprocessing - INFO - Feature selection complete. Selected 16 / 19 features.
2026-06-13 01:33:23,192 - train_pipeline - INFO - Early stopping triggered at epoch 37
2026-06-13 01:33:23,209 - preprocessing - INFO - xAPI engineered features created: ['engagement_score', 'absence_risk', 'parent_support_signal']
2026-06-13 01:33:23,211 - preprocessing - INFO - xAPI engineered features created: ['engagement_score', 'absence_risk', 'parent_support_signal']
2026-06-13 01:33:23,228 - preprocessing - INFO - Applying SMOTE on train set with ratio 0.5298701526469141...
2026-06-13 01:33:23,349 - preprocessing - INFO - Feature selection complete. Selected 18 / 19 features.
2026-06-13 01:33:24,896 - train_pipeline - INFO - Early stopping triggered at epoch 28
2026-06-13 01:33:24,913 - preprocessing - INFO - xAPI engineered features created: ['engagement_score', 'absence_risk', 'parent_support_signal']
2026-06-13 01:33:24,915 - preprocessing - INFO - xAPI engineered features created: ['engagement_score', 'absence_risk', 'parent_support_signal']
2026-06-13 01:33:24,932 - preprocessing - INFO - Applying SMOTE on train set with ratio 0.5298701526469141...
2026-06-13 01:33:25,049 - preprocessing - INFO - Feature selection complete. Selected 16 / 19 features.
2026-06-13 01:33:28,043 - train_pipeline - INFO - Early stopping triggered at epoch 53
2026-06-13 01:33:28,071 - preprocessing - INFO - xAPI engineered features created: ['engagement_score', 'absence_risk', 'parent_support_signal']
2026-06-13 01:33:28,075 - preprocessing - INFO - xAPI engineered features created: ['engagement_score', 'absence_risk', 'parent_support_signal']
2026-06-13 01:33:28,103 - preprocessing - INFO - Applying SMOTE on train set with ratio 0.5298701526469141...
2026-06-13 01:33:28,269 - preprocessing - INFO - Feature selection complete. Selected 18 / 19 features.
[I 2026-06-13 01:33:33,327] Trial 148 finished with value: 0.7967895366247475 and parameters: {'learning_rate': 0.0013556032170783335, 'weight_decay': 0.0004834566847864498, 'batch_size': 64, 'oversample_method': 'smote', 'smote_ratio': 0.5298701526469141, 'resampling_k_neighbors': 2, 'cnn_channels': 32, 'cnn_kernel_size': 4, 'lstm_hidden_dim': 96, 'context_hidden_dim': 256, 'fusion_hidden_dim': 128, 'sequence_dropout': 0.21116469645146016, 'context_dropout': 0.1065112643948983, 'fusion_dropout': 0.1515311385506266}. Best is trial 55 with value: 0.8121442327638384.
2026-06-13 01:33:33,443 - preprocessing - INFO - xAPI engineered features created: ['engagement_score', 'absence_risk', 'parent_support_signal']
2026-06-13 01:33:33,446 - preprocessing - INFO - xAPI engineered features created: ['engagement_score', 'absence_risk', 'parent_support_signal']
2026-06-13 01:33:33,463 - preprocessing - INFO - Applying SMOTE on train set with ratio 0.667475331004893...
2026-06-13 01:33:33,587 - preprocessing - INFO - Feature selection complete. Selected 16 / 19 features.
2026-06-13 01:33:35,771 - train_pipeline - INFO - Early stopping triggered at epoch 48
2026-06-13 01:33:35,788 - preprocessing - INFO - xAPI engineered features created: ['engagement_score', 'absence_risk', 'parent_support_signal']
2026-06-13 01:33:35,790 - preprocessing - INFO - xAPI engineered features created: ['engagement_score', 'absence_risk', 'parent_support_signal']
2026-06-13 01:33:35,808 - preprocessing - INFO - Applying SMOTE on train set with ratio 0.667475331004893...
2026-06-13 01:33:35,928 - preprocessing - INFO - Feature selection complete. Selected 15 / 19 features.
2026-06-13 01:33:38,240 - train_pipeline - INFO - Early stopping triggered at epoch 51
2026-06-13 01:33:38,257 - preprocessing - INFO - xAPI engineered features created: ['engagement_score', 'absence_risk', 'parent_support_signal']
2026-06-13 01:33:38,259 - preprocessing - INFO - xAPI engineered features created: ['engagement_score', 'absence_risk', 'parent_support_signal']
2026-06-13 01:33:38,276 - preprocessing - INFO - Applying SMOTE on train set with ratio 0.667475331004893...
2026-06-13 01:33:38,403 - preprocessing - INFO - Feature selection complete. Selected 18 / 19 features.
2026-06-13 01:33:42,238 - train_pipeline - INFO - Early stopping triggered at epoch 76
2026-06-13 01:33:42,258 - preprocessing - INFO - xAPI engineered features created: ['engagement_score', 'absence_risk', 'parent_support_signal']
2026-06-13 01:33:42,261 - preprocessing - INFO - xAPI engineered features created: ['engagement_score', 'absence_risk', 'parent_support_signal']
2026-06-13 01:33:42,277 - preprocessing - INFO - Applying SMOTE on train set with ratio 0.667475331004893...
2026-06-13 01:33:42,399 - preprocessing - INFO - Feature selection complete. Selected 16 / 19 features.
2026-06-13 01:33:44,684 - train_pipeline - INFO - Early stopping triggered at epoch 42
2026-06-13 01:33:44,704 - preprocessing - INFO - xAPI engineered features created: ['engagement_score', 'absence_risk', 'parent_support_signal']
2026-06-13 01:33:44,706 - preprocessing - INFO - xAPI engineered features created: ['engagement_score', 'absence_risk', 'parent_support_signal']
2026-06-13 01:33:44,723 - preprocessing - INFO - Applying SMOTE on train set with ratio 0.667475331004893...
2026-06-13 01:33:44,845 - preprocessing - INFO - Feature selection complete. Selected 17 / 19 features.
2026-06-13 01:33:47,067 - train_pipeline - INFO - Early stopping triggered at epoch 48
[I 2026-06-13 01:33:47,095] Trial 149 finished with value: 0.8057834014384536 and parameters: {'learning_rate': 0.014470945131697742, 'weight_decay': 0.006578840487119311, 'batch_size': 64, 'oversample_method': 'smote', 'smote_ratio': 0.667475331004893, 'resampling_k_neighbors': 2, 'cnn_channels': 64, 'cnn_kernel_size': 2, 'lstm_hidden_dim': 32, 'context_hidden_dim': 32, 'fusion_hidden_dim': 128, 'sequence_dropout': 0.19459619533732836, 'context_dropout': 0.24951814734157057, 'fusion_dropout': 0.12276058678109206}. Best is trial 55 with value: 0.8121442327638384.
2026-06-13 01:33:47,097 - run_pipeline - INFO - Best CV F1-Macro: 0.8121
2026-06-13 01:33:47,099 - run_pipeline - INFO - Best parameters: {'learning_rate': 0.005895084262565673, 'weight_decay': 0.0008186193200934173, 'batch_size': 64, 'oversample_method': 'smote', 'smote_ratio': 0.613914852032189, 'resampling_k_neighbors': 2, 'cnn_channels': 16, 'cnn_kernel_size': 3, 'lstm_hidden_dim': 128, 'context_hidden_dim': 256, 'fusion_hidden_dim': 256, 'sequence_dropout': 0.14613966394794353, 'context_dropout': 0.12477030958565044, 'fusion_dropout': 0.23148947180170343}
2026-06-13 01:33:47,103 - preprocessing - INFO - xAPI engineered features created: ['engagement_score', 'absence_risk', 'parent_support_signal']
2026-06-13 01:33:47,105 - preprocessing - INFO - xAPI engineered features created: ['engagement_score', 'absence_risk', 'parent_support_signal']
2026-06-13 01:33:47,126 - preprocessing - INFO - Applying SMOTE on train set with ratio 0.613914852032189...
2026-06-13 01:33:47,261 - preprocessing - INFO - Feature selection complete. Selected 17 / 19 features.
2026-06-13 01:33:47,273 - run_pipeline - INFO - Training ensemble seed 42.
2026-06-13 01:33:49,443 - train_pipeline - INFO - Early stopping triggered at epoch 32
2026-06-13 01:33:49,466 - run_pipeline - INFO - Training ensemble seed 123.
2026-06-13 01:33:54,380 - train_pipeline - INFO - Early stopping triggered at epoch 64
2026-06-13 01:33:54,406 - run_pipeline - INFO - Training ensemble seed 155.
2026-06-13 01:33:56,649 - train_pipeline - INFO - Early stopping triggered at epoch 31
2026-06-13 01:33:56,667 - run_pipeline - INFO - Training ensemble seed 156.
2026-06-13 01:33:58,755 - train_pipeline - INFO - Early stopping triggered at epoch 31
2026-06-13 01:33:58,774 - run_pipeline - INFO - Training ensemble seed 2025.
2026-06-13 01:34:02,328 - train_pipeline - INFO - Early stopping triggered at epoch 50
2026-06-13 01:34:02,352 - run_pipeline - INFO - Locked-test F1-Macro: 0.7663
2026-06-13 01:34:02,391 - run_pipeline - INFO - Saved metrics, predictions, learning paths and report for xapi.
2026-06-13 01:34:02,392 - explainability - INFO - Calculating permutation importance...
2026-06-13 01:34:02,730 - evaluation - INFO - Persisted PostgreSQL evaluation run 11 for xapi.
2026-06-13 01:34:02,731 - run_pipeline - INFO - PostgreSQL run id: 11
